first_input.log
{"i": ["cuda", "schedule_direct_3d_cuda", [[1, 1, 80, 160, 160], [32, 1, 3, 3, 3], [1, 2, 2], [1, 1, 1], 1], {}, ["schedule_direct_3d_cuda", [1, 1, 80, 160, 160], [32, 1, 3, 3, 3], [1, 2, 2], [1, 1, 1], 1], {"i": 6000100967, "t": "", "c": null, "e": [["tile_f", "sp", [-1, 2, 2, 1]], ["tile_d", "sp", [-1, 1, 1, 1]], ["tile_y", "sp", [-1, 10, 1, 4]], ["tile_x", "sp", [-1, 16, 1, 1]], ["tile_rc", "sp", [-1, 1]], ["tile_rd", "sp", [-1, 3]], ["tile_ry", "sp", [-1, 3]], ["tile_rx", "sp", [-1, 3]], ["auto_unroll_max_step", "ot", 512], ["unroll_explicit", "ot", 1]]}], "r": [[0.177930445], 0, 5.443858861923218, 1576390457.5052903], "v": 0.1}
{"i": ["cuda", "schedule_direct_3d_cuda", [[1, 1, 80, 160, 160], [32, 1, 3, 3, 3], [1, 2, 2], [1, 1, 1], 1], {}, ["schedule_direct_3d_cuda", [1, 1, 80, 160, 160], [32, 1, 3, 3, 3], [1, 2, 2], [1, 1, 1], 1], {"i": 52833782, "t": "", "c": null, "e": [["tile_f", "sp", [-1, 2, 1, 2]], ["tile_d", "sp", [-1, 1, 1, 1]], ["tile_y", "sp", [-1, 2, 4, 1]], ["tile_x", "sp", [-1, 5, 1, 2]], ["tile_rc", "sp", [-1, 1]], ["tile_rd", "sp", [-1, 1]], ["tile_ry", "sp", [-1, 1]], ["tile_rx", "sp", [-1, 1]], ["auto_unroll_max_step", "ot", 0], ["unroll_explicit", "ot", 0]]}], "r": [[0.04644832125], 0, 1.7316868305206299, 1576390501.6012836], "v": 0.1}
{"i": ["cuda", "schedule_direct_3d_cuda", [[1, 1, 80, 160, 160], [32, 1, 3, 3, 3], [1, 2, 2], [1, 1, 1], 1], {}, ["schedule_direct_3d_cuda", [1, 1, 80, 160, 160], [32, 1, 3, 3, 3], [1, 2, 2], [1, 1, 1], 1], {"i": 82485127, "t": "", "c": null, "e": [["tile_f", "sp", [-1, 8, 1, 4]], ["tile_d", "sp", [-1, 40, 1, 1]], ["tile_y", "sp", [-1, 5, 4, 1]], ["tile_x", "sp", [-1, 1, 1, 4]], ["tile_rc", "sp", [-1, 1]], ["tile_rd", "sp", [-1, 1]], ["tile_ry", "sp", [-1, 1]], ["tile_rx", "sp", [-1, 1]], ["auto_unroll_max_step", "ot", 0], ["unroll_explicit", "ot", 0]]}], "r": [[0.22892933125], 0, 7.841280698776245, 1576390505.3687446], "v": 0.1}
{"i": ["cuda", "schedule_direct_3d_cuda", [[1, 1, 80, 160, 160], [32, 1, 3, 3, 3], [1, 2, 2], [1, 1, 1], 1], {}, ["schedule_direct_3d_cuda", [1, 1, 80, 160, 160], [32, 1, 3, 3, 3], [1, 2, 2], [1, 1, 1], 1], {"i": 389813127, "t": "", "c": null, "e": [["tile_f", "sp", [-1, 8, 1, 4]], ["tile_d", "sp", [-1, 40, 1, 1]], ["tile_y", "sp", [-1, 5, 4, 1]], ["tile_x", "sp", [-1, 1, 1, 4]], ["tile_rc", "sp", [-1, 1]], ["tile_rd", "sp", [-1, 1]], ["tile_ry", "sp", [-1, 3]], ["tile_rx", "sp", [-1, 1]], ["auto_unroll_max_step", "ot", 0], ["unroll_explicit", "ot", 0]]}], "r": [[0.18948020025], 0, 7.408533334732056, 1576390508.7977147], "v": 0.1}
{"i": ["cuda", "schedule_direct_3d_cuda", [[1, 1, 80, 160, 160], [32, 1, 3, 3, 3], [1, 2, 2], [1, 1, 1], 1], {}, ["schedule_direct_3d_cuda", [1, 1, 80, 160, 160], [32, 1, 3, 3, 3], [1, 2, 2], [1, 1, 1], 1], {"i": 1849683587, "t": "", "c": null, "e": [["tile_f", "sp", [-1, 8, 1, 1]], ["tile_d", "sp", [-1, 8, 1, 1]], ["tile_y", "sp", [-1, 1, 8, 1]], ["tile_x", "sp", [-1, 10, 1, 1]], ["tile_rc", "sp", [-1, 1]], ["tile_rd", "sp", [-1, 1]], ["tile_ry", "sp", [-1, 1]], ["tile_rx", "sp", [-1, 3]], ["auto_unroll_max_step", "ot", 512], ["unroll_explicit", "ot", 0]]}], "r": [[0.05283051725], 0, 6.994790554046631, 1576390515.9474528], "v": 0.1}
{"i": ["cuda", "schedule_direct_3d_cuda", [[1, 1, 80, 160, 160], [32, 1, 3, 3, 3], [1, 2, 2], [1, 1, 1], 1], {}, ["schedule_direct_3d_cuda", [1, 1, 80, 160, 160], [32, 1, 3, 3, 3], [1, 2, 2], [1, 1, 1], 1], {"i": 3078995586, "t": "", "c": null, "e": [["tile_f", "sp", [-1, 4, 1, 1]], ["tile_d", "sp", [-1, 8, 1, 1]], ["tile_y", "sp", [-1, 1, 8, 1]], ["tile_x", "sp", [-1, 10, 1, 1]], ["tile_rc", "sp", [-1, 1]], ["tile_rd", "sp", [-1, 1]], ["tile_ry", "sp", [-1, 1]], ["tile_rx", "sp", [-1, 3]], ["auto_unroll_max_step", "ot", 1500], ["unroll_explicit", "ot", 0]]}], "r": [[0.0326042765], 0, 4.7249743938446045, 1576390553.2291205], "v": 0.1}
{"i": ["cuda", "schedule_direct_3d_cuda", [[1, 1, 80, 160, 160], [32, 1, 3, 3, 3], [1, 2, 2], [1, 1, 1], 1], {}, ["schedule_direct_3d_cuda", [1, 1, 80, 160, 160], [32, 1, 3, 3, 3], [1, 2, 2], [1, 1, 1], 1], {"i": 4053601927, "t": "", "c": null, "e": [["tile_f", "sp", [-1, 8, 1, 4]], ["tile_d", "sp", [-1, 40, 1, 1]], ["tile_y", "sp", [-1, 5, 4, 1]], ["tile_x", "sp", [-1, 1, 2, 2]], ["tile_rc", "sp", [-1, 1]], ["tile_rd", "sp", [-1, 1]], ["tile_ry", "sp", [-1, 3]], ["tile_rx", "sp", [-1, 1]], ["auto_unroll_max_step", "ot", 0], ["unroll_explicit", "ot", 1]]}], "r": [[0.1015955625], 0, 6.169531583786011, 1576390560.9038928], "v": 0.1}
{"i": ["cuda", "schedule_direct_3d_cuda", [[1, 1, 80, 160, 160], [32, 1, 3, 3, 3], [1, 2, 2], [1, 1, 1], 1], {}, ["schedule_direct_3d_cuda", [1, 1, 80, 160, 160], [32, 1, 3, 3, 3], [1, 2, 2], [1, 1, 1], 1], {"i": 5542911389, "t": "", "c": null, "e": [["tile_f", "sp", [-1, 8, 2, 2]], ["tile_d", "sp", [-1, 1, 1, 1]], ["tile_y", "sp", [-1, 8, 1, 1]], ["tile_x", "sp", [-1, 1, 2, 1]], ["tile_rc", "sp", [-1, 1]], ["tile_rd", "sp", [-1, 1]], ["tile_ry", "sp", [-1, 1]], ["tile_rx", "sp", [-1, 3]], ["auto_unroll_max_step", "ot", 512], ["unroll_explicit", "ot", 1]]}], "r": [[0.00317158175], 0, 1.8995490074157715, 1576390567.0144758], "v": 0.1}
{"i": ["cuda", "schedule_direct_3d_cuda", [[1, 1, 80, 160, 160], [32, 1, 3, 3, 3], [1, 2, 2], [1, 1, 1], 1], {}, ["schedule_direct_3d_cuda", [1, 1, 80, 160, 160], [32, 1, 3, 3, 3], [1, 2, 2], [1, 1, 1], 1], {"i": 3078995587, "t": "", "c": null, "e": [["tile_f", "sp", [-1, 8, 1, 1]], ["tile_d", "sp", [-1, 8, 1, 1]], ["tile_y", "sp", [-1, 1, 8, 1]], ["tile_x", "sp", [-1, 10, 1, 1]], ["tile_rc", "sp", [-1, 1]], ["tile_rd", "sp", [-1, 1]], ["tile_ry", "sp", [-1, 1]], ["tile_rx", "sp", [-1, 3]], ["auto_unroll_max_step", "ot", 1500], ["unroll_explicit", "ot", 0]]}], "r": [[0.051317687], 0, 5.655441522598267, 1576390568.5990305], "v": 0.1}
{"i": ["cuda", "schedule_direct_3d_cuda", [[1, 1, 80, 160, 160], [32, 1, 3, 3, 3], [1, 2, 2], [1, 1, 1], 1], {}, ["schedule_direct_3d_cuda", [1, 1, 80, 160, 160], [32, 1, 3, 3, 3], [1, 2, 2], [1, 1, 1], 1], {"i": 5696575401, "t": "", "c": null, "e": [["tile_f", "sp", [-1, 2, 2, 4]], ["tile_d", "sp", [-1, 1, 1, 1]], ["tile_y", "sp", [-1, 8, 1, 1]], ["tile_x", "sp", [-1, 1, 2, 1]], ["tile_rc", "sp", [-1, 1]], ["tile_rd", "sp", [-1, 3]], ["tile_ry", "sp", [-1, 1]], ["tile_rx", "sp", [-1, 3]], ["auto_unroll_max_step", "ot", 512], ["unroll_explicit", "ot", 1]]}], "r": [[0.0107465476], 0, 2.1888301372528076, 1576390569.9192135], "v": 0.1}
{"i": ["cuda", "schedule_direct_3d_cuda", [[1, 1, 80, 160, 160], [32, 1, 3, 3, 3], [1, 2, 2], [1, 1, 1], 1], {}, ["schedule_direct_3d_cuda", [1, 1, 80, 160, 160], [32, 1, 3, 3, 3], [1, 2, 2], [1, 1, 1], 1], {"i": 5696575391, "t": "", "c": null, "e": [["tile_f", "sp", [-1, 2, 4, 2]], ["tile_d", "sp", [-1, 1, 1, 1]], ["tile_y", "sp", [-1, 8, 1, 1]], ["tile_x", "sp", [-1, 1, 2, 1]], ["tile_rc", "sp", [-1, 1]], ["tile_rd", "sp", [-1, 3]], ["tile_ry", "sp", [-1, 1]], ["tile_rx", "sp", [-1, 3]], ["auto_unroll_max_step", "ot", 512], ["unroll_explicit", "ot", 1]]}], "r": [[0.0034253885333333334], 0, 1.655158281326294, 1576390570.9716272], "v": 0.1}
{"i": ["cuda", "schedule_direct_3d_cuda", [[1, 1, 80, 160, 160], [32, 1, 3, 3, 3], [1, 2, 2], [1, 1, 1], 1], {}, ["schedule_direct_3d_cuda", [1, 1, 80, 160, 160], [32, 1, 3, 3, 3], [1, 2, 2], [1, 1, 1], 1], {"i": 5542911391, "t": "", "c": null, "e": [["tile_f", "sp", [-1, 2, 4, 2]], ["tile_d", "sp", [-1, 1, 1, 1]], ["tile_y", "sp", [-1, 8, 1, 1]], ["tile_x", "sp", [-1, 1, 2, 1]], ["tile_rc", "sp", [-1, 1]], ["tile_rd", "sp", [-1, 1]], ["tile_ry", "sp", [-1, 1]], ["tile_rx", "sp", [-1, 3]], ["auto_unroll_max_step", "ot", 512], ["unroll_explicit", "ot", 1]]}], "r": [[0.0015875919047619047], 0, 1.411731481552124, 1576390571.8380575], "v": 0.1}
{"i": ["cuda", "schedule_direct_3d_cuda", [[1, 1, 80, 160, 160], [32, 1, 3, 3, 3], [1, 2, 2], [1, 1, 1], 1], {}, ["schedule_direct_3d_cuda", [1, 1, 80, 160, 160], [32, 1, 3, 3, 3], [1, 2, 2], [1, 1, 1], 1], {"i": 4077749127, "t": "", "c": null, "e": [["tile_f", "sp", [-1, 8, 1, 4]], ["tile_d", "sp", [-1, 40, 1, 1]], ["tile_y", "sp", [-1, 5, 4, 1]], ["tile_x", "sp", [-1, 1, 1, 4]], ["tile_rc", "sp", [-1, 1]], ["tile_rd", "sp", [-1, 1]], ["tile_ry", "sp", [-1, 3]], ["tile_rx", "sp", [-1, 1]], ["auto_unroll_max_step", "ot", 0], ["unroll_explicit", "ot", 1]]}], "r": [[0.1917393305], 0, 6.727570533752441, 1576390586.3325531], "v": 0.1}
{"i": ["cuda", "schedule_direct_3d_cuda", [[1, 1, 80, 160, 160], [32, 1, 3, 3, 3], [1, 2, 2], [1, 1, 1], 1], {}, ["schedule_direct_3d_cuda", [1, 1, 80, 160, 160], [32, 1, 3, 3, 3], [1, 2, 2], [1, 1, 1], 1], {"i": 4302741019, "t": "", "c": null, "e": [["tile_f", "sp", [-1, 8, 1, 1]], ["tile_d", "sp", [-1, 2, 1, 1]], ["tile_y", "sp", [-1, 2, 4, 1]], ["tile_x", "sp", [-1, 1, 1, 1]], ["tile_rc", "sp", [-1, 1]], ["tile_rd", "sp", [-1, 1]], ["tile_ry", "sp", [-1, 1]], ["tile_rx", "sp", [-1, 3]], ["auto_unroll_max_step", "ot", 0], ["unroll_explicit", "ot", 1]]}], "r": [[0.014630664857142857], 0, 1.5863487720489502, 1576390823.2145584], "v": 0.1}
{"i": ["cuda", "schedule_direct_3d_cuda", [[1, 1, 80, 160, 160], [32, 1, 3, 3, 3], [1, 2, 2], [1, 1, 1], 1], {}, ["schedule_direct_3d_cuda", [1, 1, 80, 160, 160], [32, 1, 3, 3, 3], [1, 2, 2], [1, 1, 1], 1], {"i": 4302741024, "t": "", "c": null, "e": [["tile_f", "sp", [-1, 4, 2, 1]], ["tile_d", "sp", [-1, 2, 1, 1]], ["tile_y", "sp", [-1, 2, 4, 1]], ["tile_x", "sp", [-1, 1, 1, 1]], ["tile_rc", "sp", [-1, 1]], ["tile_rd", "sp", [-1, 1]], ["tile_ry", "sp", [-1, 1]], ["tile_rx", "sp", [-1, 3]], ["auto_unroll_max_step", "ot", 0], ["unroll_explicit", "ot", 1]]}], "r": [[0.0050506951000000005], 0, 1.5149593353271484, 1576390824.147654], "v": 0.1}
{"i": ["cuda", "schedule_direct_3d_cuda", [[1, 1, 80, 160, 160], [32, 1, 3, 3, 3], [1, 2, 2], [1, 1, 1], 1], {}, ["schedule_direct_3d_cuda", [1, 1, 80, 160, 160], [32, 1, 3, 3, 3], [1, 2, 2], [1, 1, 1], 1], {"i": 4302592255, "t": "", "c": null, "e": [["tile_f", "sp", [-1, 2, 4, 2]], ["tile_d", "sp", [-1, 8, 1, 1]], ["tile_y", "sp", [-1, 1, 1, 1]], ["tile_x", "sp", [-1, 1, 1, 1]], ["tile_rc", "sp", [-1, 1]], ["tile_rd", "sp", [-1, 1]], ["tile_ry", "sp", [-1, 1]], ["tile_rx", "sp", [-1, 3]], ["auto_unroll_max_step", "ot", 0], ["unroll_explicit", "ot", 1]]}], "r": [[0.0022436158], 0, 1.3782763481140137, 1576390825.524499], "v": 0.1}
{"i": ["cuda", "schedule_direct_3d_cuda", [[1, 1, 80, 160, 160], [32, 1, 3, 3, 3], [1, 2, 2], [1, 1, 1], 1], {}, ["schedule_direct_3d_cuda", [1, 1, 80, 160, 160], [32, 1, 3, 3, 3], [1, 2, 2], [1, 1, 1], 1], {"i": 4302693988, "t": "", "c": null, "e": [["tile_f", "sp", [-1, 2, 4, 1]], ["tile_d", "sp", [-1, 2, 1, 1]], ["tile_y", "sp", [-1, 5, 2, 1]], ["tile_x", "sp", [-1, 1, 1, 1]], ["tile_rc", "sp", [-1, 1]], ["tile_rd", "sp", [-1, 1]], ["tile_ry", "sp", [-1, 1]], ["tile_rx", "sp", [-1, 3]], ["auto_unroll_max_step", "ot", 0], ["unroll_explicit", "ot", 1]]}], "r": [[0.008826036333333334], 0, 1.4266092777252197, 1576390826.4855866], "v": 0.1}
{"i": ["cuda", "schedule_direct_3d_cuda", [[1, 1, 80, 160, 160], [32, 1, 3, 3, 3], [1, 2, 2], [1, 1, 1], 1], {}, ["schedule_direct_3d_cuda", [1, 1, 80, 160, 160], [32, 1, 3, 3, 3], [1, 2, 2], [1, 1, 1], 1], {"i": 4302670555, "t": "", "c": null, "e": [["tile_f", "sp", [-1, 1, 4, 4]], ["tile_d", "sp", [-1, 4, 1, 1]], ["tile_y", "sp", [-1, 1, 2, 1]], ["tile_x", "sp", [-1, 1, 1, 1]], ["tile_rc", "sp", [-1, 1]], ["tile_rd", "sp", [-1, 1]], ["tile_ry", "sp", [-1, 1]], ["tile_rx", "sp", [-1, 3]], ["auto_unroll_max_step", "ot", 0], ["unroll_explicit", "ot", 1]]}], "r": [[0.002981700117647059], 0, 1.1766231060028076, 1576390827.5545087], "v": 0.1}
{"i": ["cuda", "schedule_direct_3d_cuda", [[1, 1, 80, 160, 160], [32, 1, 3, 3, 3], [1, 2, 2], [1, 1, 1], 1], {}, ["schedule_direct_3d_cuda", [1, 1, 80, 160, 160], [32, 1, 3, 3, 3], [1, 2, 2], [1, 1, 1], 1], {"i": 4303705379, "t": "", "c": null, "e": [["tile_f", "sp", [-1, 1, 4, 4]], ["tile_d", "sp", [-1, 2, 1, 1]], ["tile_y", "sp", [-1, 4, 1, 1]], ["tile_x", "sp", [-1, 2, 1, 1]], ["tile_rc", "sp", [-1, 1]], ["tile_rd", "sp", [-1, 1]], ["tile_ry", "sp", [-1, 1]], ["tile_rx", "sp", [-1, 3]], ["auto_unroll_max_step", "ot", 0], ["unroll_explicit", "ot", 1]]}], "r": [[0.006498416], 0, 1.7267746925354004, 1576390830.3000991], "v": 0.1}
{"i": ["cuda", "schedule_direct_3d_cuda", [[1, 1, 80, 160, 160], [32, 1, 3, 3, 3], [1, 2, 2], [1, 1, 1], 1], {}, ["schedule_direct_3d_cuda", [1, 1, 80, 160, 160], [32, 1, 3, 3, 3], [1, 2, 2], [1, 1, 1], 1], {"i": 4609943554, "t": "", "c": null, "e": [["tile_f", "sp", [-1, 2, 8, 2]], ["tile_d", "sp", [-1, 1, 1, 1]], ["tile_y", "sp", [-1, 5, 1, 1]], ["tile_x", "sp", [-1, 1, 1, 1]], ["tile_rc", "sp", [-1, 1]], ["tile_rd", "sp", [-1, 1]], ["tile_ry", "sp", [-1, 3]], ["tile_rx", "sp", [-1, 3]], ["auto_unroll_max_step", "ot", 0], ["unroll_explicit", "ot", 1]]}], "r": [[0.0016679592], 0, 1.5970649719238281, 1576390831.1877952], "v": 0.1}
{"i": ["cuda", "schedule_direct_3d_cuda", [[1, 1, 80, 160, 160], [32, 1, 3, 3, 3], [1, 2, 2], [1, 1, 1], 1], {}, ["schedule_direct_3d_cuda", [1, 1, 80, 160, 160], [32, 1, 3, 3, 3], [1, 2, 2], [1, 1, 1], 1], {"i": 4302670651, "t": "", "c": null, "e": [["tile_f", "sp", [-1, 2, 2, 2]], ["tile_d", "sp", [-1, 8, 1, 1]], ["tile_y", "sp", [-1, 1, 2, 1]], ["tile_x", "sp", [-1, 1, 1, 1]], ["tile_rc", "sp", [-1, 1]], ["tile_rd", "sp", [-1, 1]], ["tile_ry", "sp", [-1, 1]], ["tile_rx", "sp", [-1, 3]], ["auto_unroll_max_step", "ot", 0], ["unroll_explicit", "ot", 1]]}], "r": [[0.0056572229444444445], 0, 1.6365602016448975, 1576390832.0910168], "v": 0.1}
{"i": ["cuda", "schedule_direct_3d_cuda", [[1, 1, 80, 160, 160], [32, 1, 3, 3, 3], [1, 2, 2], [1, 1, 1], 1], {}, ["schedule_direct_3d_cuda", [1, 1, 80, 160, 160], [32, 1, 3, 3, 3], [1, 2, 2], [1, 1, 1], 1], {"i": 4302670540, "t": "", "c": null, "e": [["tile_f", "sp", [-1, 4, 2, 2]], ["tile_d", "sp", [-1, 4, 1, 1]], ["tile_y", "sp", [-1, 1, 2, 1]], ["tile_x", "sp", [-1, 1, 1, 1]], ["tile_rc", "sp", [-1, 1]], ["tile_rd", "sp", [-1, 1]], ["tile_ry", "sp", [-1, 1]], ["tile_rx", "sp", [-1, 3]], ["auto_unroll_max_step", "ot", 0], ["unroll_explicit", "ot", 1]]}], "r": [[0.0031191172727272724], 0, 1.6399505138397217, 1576390832.9419022], "v": 0.1}
{"i": ["cuda", "schedule_direct_3d_cuda", [[1, 1, 80, 160, 160], [32, 1, 3, 3, 3], [1, 2, 2], [1, 1, 1], 1], {}, ["schedule_direct_3d_cuda", [1, 1, 80, 160, 160], [32, 1, 3, 3, 3], [1, 2, 2], [1, 1, 1], 1], {"i": 4609998466, "t": "", "c": null, "e": [["tile_f", "sp", [-1, 16, 2, 1]], ["tile_d", "sp", [-1, 2, 1, 1]], ["tile_y", "sp", [-1, 1, 2, 1]], ["tile_x", "sp", [-1, 1, 1, 1]], ["tile_rc", "sp", [-1, 1]], ["tile_rd", "sp", [-1, 1]], ["tile_ry", "sp", [-1, 3]], ["tile_rx", "sp", [-1, 3]], ["auto_unroll_max_step", "ot", 0], ["unroll_explicit", "ot", 1]]}], "r": [[0.0034681157241379314], 0, 1.705824375152588, 1576390833.9832225], "v": 0.1}
{"i": ["cuda", "schedule_direct_3d_cuda", [[1, 1, 80, 160, 160], [32, 1, 3, 3, 3], [1, 2, 2], [1, 1, 1], 1], {}, ["schedule_direct_3d_cuda", [1, 1, 80, 160, 160], [32, 1, 3, 3, 3], [1, 2, 2], [1, 1, 1], 1], {"i": 4609943555, "t": "", "c": null, "e": [["tile_f", "sp", [-1, 1, 16, 2]], ["tile_d", "sp", [-1, 1, 1, 1]], ["tile_y", "sp", [-1, 5, 1, 1]], ["tile_x", "sp", [-1, 1, 1, 1]], ["tile_rc", "sp", [-1, 1]], ["tile_rd", "sp", [-1, 1]], ["tile_ry", "sp", [-1, 3]], ["tile_rx", "sp", [-1, 3]], ["auto_unroll_max_step", "ot", 0], ["unroll_explicit", "ot", 1]]}], "r": [[0.0012789742704918032], 0, 1.8135643005371094, 1576390835.0724385], "v": 0.1}
{"i": ["cuda", "schedule_direct_3d_cuda", [[1, 1, 80, 160, 160], [32, 1, 3, 3, 3], [1, 2, 2], [1, 1, 1], 1], {}, ["schedule_direct_3d_cuda", [1, 1, 80, 160, 160], [32, 1, 3, 3, 3], [1, 2, 2], [1, 1, 1], 1], {"i": 4610061130, "t": "", "c": null, "e": [["tile_f", "sp", [-1, 16, 2, 1]], ["tile_d", "sp", [-1, 1, 1, 1]], ["tile_y", "sp", [-1, 1, 4, 1]], ["tile_x", "sp", [-1, 1, 1, 1]], ["tile_rc", "sp", [-1, 1]], ["tile_rd", "sp", [-1, 1]], ["tile_ry", "sp", [-1, 3]], ["tile_rx", "sp", [-1, 3]], ["auto_unroll_max_step", "ot", 0], ["unroll_explicit", "ot", 1]]}], "r": [[0.002194786956521739], 0, 1.6080751419067383, 1576390836.0598612], "v": 0.1}
{"i": ["cuda", "schedule_direct_3d_cuda", [[1, 1, 80, 160, 160], [32, 1, 3, 3, 3], [1, 2, 2], [1, 1, 1], 1], {}, ["schedule_direct_3d_cuda", [1, 1, 80, 160, 160], [32, 1, 3, 3, 3], [1, 2, 2], [1, 1, 1], 1], {"i": 4610061134, "t": "", "c": null, "e": [["tile_f", "sp", [-1, 8, 4, 1]], ["tile_d", "sp", [-1, 1, 1, 1]], ["tile_y", "sp", [-1, 1, 4, 1]], ["tile_x", "sp", [-1, 1, 1, 1]], ["tile_rc", "sp", [-1, 1]], ["tile_rd", "sp", [-1, 1]], ["tile_ry", "sp", [-1, 3]], ["tile_rx", "sp", [-1, 3]], ["auto_unroll_max_step", "ot", 0], ["unroll_explicit", "ot", 1]]}], "r": [[0.0018743531111111112], 0, 1.5446414947509766, 1576390836.9094927], "v": 0.1}
{"i": ["cuda", "schedule_direct_3d_cuda", [[1, 1, 80, 160, 160], [32, 1, 3, 3, 3], [1, 2, 2], [1, 1, 1], 1], {}, ["schedule_direct_3d_cuda", [1, 1, 80, 160, 160], [32, 1, 3, 3, 3], [1, 2, 2], [1, 1, 1], 1], {"i": 4302631268, "t": "", "c": null, "e": [["tile_f", "sp", [-1, 2, 4, 1]], ["tile_d", "sp", [-1, 2, 1, 1]], ["tile_y", "sp", [-1, 10, 1, 1]], ["tile_x", "sp", [-1, 1, 1, 1]], ["tile_rc", "sp", [-1, 1]], ["tile_rd", "sp", [-1, 1]], ["tile_ry", "sp", [-1, 1]], ["tile_rx", "sp", [-1, 3]], ["auto_unroll_max_step", "ot", 0], ["unroll_explicit", "ot", 1]]}], "r": [[0.014656600142857143], 0, 1.460782766342163, 1576390839.6640315], "v": 0.1}
{"i": ["cuda", "schedule_direct_3d_cuda", [[1, 1, 80, 160, 160], [32, 1, 3, 3, 3], [1, 2, 2], [1, 1, 1], 1], {}, ["schedule_direct_3d_cuda", [1, 1, 80, 160, 160], [32, 1, 3, 3, 3], [1, 2, 2], [1, 1, 1], 1], {"i": 4302615554, "t": "", "c": null, "e": [["tile_f", "sp", [-1, 2, 8, 2]], ["tile_d", "sp", [-1, 1, 1, 1]], ["tile_y", "sp", [-1, 5, 1, 1]], ["tile_x", "sp", [-1, 1, 1, 1]], ["tile_rc", "sp", [-1, 1]], ["tile_rd", "sp", [-1, 1]], ["tile_ry", "sp", [-1, 1]], ["tile_rx", "sp", [-1, 3]], ["auto_unroll_max_step", "ot", 0], ["unroll_explicit", "ot", 1]]}], "r": [[0.0020639836122448977], 0, 1.3701729774475098, 1576390840.505818], "v": 0.1}
{"i": ["cuda", "schedule_direct_3d_cuda", [[1, 1, 80, 160, 160], [32, 1, 3, 3, 3], [1, 2, 2], [1, 1, 1], 1], {}, ["schedule_direct_3d_cuda", [1, 1, 80, 160, 160], [32, 1, 3, 3, 3], [1, 2, 2], [1, 1, 1], 1], {"i": 4609998488, "t": "", "c": null, "e": [["tile_f", "sp", [-1, 4, 4, 2]], ["tile_d", "sp", [-1, 2, 1, 1]], ["tile_y", "sp", [-1, 1, 2, 1]], ["tile_x", "sp", [-1, 1, 1, 1]], ["tile_rc", "sp", [-1, 1]], ["tile_rd", "sp", [-1, 1]], ["tile_ry", "sp", [-1, 3]], ["tile_rx", "sp", [-1, 3]], ["auto_unroll_max_step", "ot", 0], ["unroll_explicit", "ot", 1]]}], "r": [[0.0017545937192982456], 0, 1.550687313079834, 1576390841.5465462], "v": 0.1}
{"i": ["cuda", "schedule_direct_3d_cuda", [[1, 1, 80, 160, 160], [32, 1, 3, 3, 3], [1, 2, 2], [1, 1, 1], 1], {}, ["schedule_direct_3d_cuda", [1, 1, 80, 160, 160], [32, 1, 3, 3, 3], [1, 2, 2], [1, 1, 1], 1], {"i": 4302670466, "t": "", "c": null, "e": [["tile_f", "sp", [-1, 16, 2, 1]], ["tile_d", "sp", [-1, 2, 1, 1]], ["tile_y", "sp", [-1, 1, 2, 1]], ["tile_x", "sp", [-1, 1, 1, 1]], ["tile_rc", "sp", [-1, 1]], ["tile_rd", "sp", [-1, 1]], ["tile_ry", "sp", [-1, 1]], ["tile_rx", "sp", [-1, 3]], ["auto_unroll_max_step", "ot", 0], ["unroll_explicit", "ot", 1]]}], "r": [[0.0045088708695652175], 0, 1.3832857608795166, 1576390842.4449034], "v": 0.1}
{"i": ["cuda", "schedule_direct_3d_cuda", [[1, 1, 80, 160, 160], [32, 1, 3, 3, 3], [1, 2, 2], [1, 1, 1], 1], {}, ["schedule_direct_3d_cuda", [1, 1, 80, 160, 160], [32, 1, 3, 3, 3], [1, 2, 2], [1, 1, 1], 1], {"i": 4456279554, "t": "", "c": null, "e": [["tile_f", "sp", [-1, 2, 8, 2]], ["tile_d", "sp", [-1, 1, 1, 1]], ["tile_y", "sp", [-1, 5, 1, 1]], ["tile_x", "sp", [-1, 1, 1, 1]], ["tile_rc", "sp", [-1, 1]], ["tile_rd", "sp", [-1, 3]], ["tile_ry", "sp", [-1, 1]], ["tile_rx", "sp", [-1, 3]], ["auto_unroll_max_step", "ot", 0], ["unroll_explicit", "ot", 1]]}], "r": [[0.0028876433142857143], 0, 1.5106942653656006, 1576390843.4092553], "v": 0.1}
{"i": ["cuda", "schedule_direct_3d_cuda", [[1, 1, 80, 160, 160], [32, 1, 3, 3, 3], [1, 2, 2], [1, 1, 1], 1], {}, ["schedule_direct_3d_cuda", [1, 1, 80, 160, 160], [32, 1, 3, 3, 3], [1, 2, 2], [1, 1, 1], 1], {"i": 4303697651, "t": "", "c": null, "e": [["tile_f", "sp", [-1, 1, 4, 4]], ["tile_d", "sp", [-1, 5, 1, 1]], ["tile_y", "sp", [-1, 2, 1, 1]], ["tile_x", "sp", [-1, 2, 1, 1]], ["tile_rc", "sp", [-1, 1]], ["tile_rd", "sp", [-1, 1]], ["tile_ry", "sp", [-1, 1]], ["tile_rx", "sp", [-1, 3]], ["auto_unroll_max_step", "ot", 0], ["unroll_explicit", "ot", 1]]}], "r": [[0.006899412533333333], 0, 1.400212049484253, 1576390844.3086076], "v": 0.1}
{"i": ["cuda", "schedule_direct_3d_cuda", [[1, 1, 80, 160, 160], [32, 1, 3, 3, 3], [1, 2, 2], [1, 1, 1], 1], {}, ["schedule_direct_3d_cuda", [1, 1, 80, 160, 160], [32, 1, 3, 3, 3], [1, 2, 2], [1, 1, 1], 1], {"i": 4610068964, "t": "", "c": null, "e": [["tile_f", "sp", [-1, 16, 1, 1]], ["tile_d", "sp", [-1, 1, 1, 1]], ["tile_y", "sp", [-1, 2, 4, 1]], ["tile_x", "sp", [-1, 1, 1, 1]], ["tile_rc", "sp", [-1, 1]], ["tile_rd", "sp", [-1, 1]], ["tile_ry", "sp", [-1, 3]], ["tile_rx", "sp", [-1, 3]], ["auto_unroll_max_step", "ot", 0], ["unroll_explicit", "ot", 1]]}], "r": [[0.0057223868399999996], 0, 1.9366774559020996, 1576390847.9168754], "v": 0.1}
{"i": ["cuda", "schedule_direct_3d_cuda", [[1, 1, 80, 160, 160], [32, 1, 3, 3, 3], [1, 2, 2], [1, 1, 1], 1], {}, ["schedule_direct_3d_cuda", [1, 1, 80, 160, 160], [32, 1, 3, 3, 3], [1, 2, 2], [1, 1, 1], 1], {"i": 4456405019, "t": "", "c": null, "e": [["tile_f", "sp", [-1, 8, 1, 1]], ["tile_d", "sp", [-1, 2, 1, 1]], ["tile_y", "sp", [-1, 2, 4, 1]], ["tile_x", "sp", [-1, 1, 1, 1]], ["tile_rc", "sp", [-1, 1]], ["tile_rd", "sp", [-1, 3]], ["tile_ry", "sp", [-1, 1]], ["tile_rx", "sp", [-1, 3]], ["auto_unroll_max_step", "ot", 0], ["unroll_explicit", "ot", 1]]}], "r": [[0.008196564307692307], 0, 1.7022063732147217, 1576390848.9028566], "v": 0.1}
{"i": ["cuda", "schedule_direct_3d_cuda", [[1, 1, 80, 160, 160], [32, 1, 3, 3, 3], [1, 2, 2], [1, 1, 1], 1], {}, ["schedule_direct_3d_cuda", [1, 1, 80, 160, 160], [32, 1, 3, 3, 3], [1, 2, 2], [1, 1, 1], 1], {"i": 4610076863, "t": "", "c": null, "e": [["tile_f", "sp", [-1, 2, 2, 1]], ["tile_d", "sp", [-1, 2, 1, 1]], ["tile_y", "sp", [-1, 4, 4, 1]], ["tile_x", "sp", [-1, 1, 1, 1]], ["tile_rc", "sp", [-1, 1]], ["tile_rd", "sp", [-1, 1]], ["tile_ry", "sp", [-1, 3]], ["tile_rx", "sp", [-1, 3]], ["auto_unroll_max_step", "ot", 0], ["unroll_explicit", "ot", 1]]}], "r": [[0.0046689427727272725], 0, 1.6535871028900146, 1576390849.7899802], "v": 0.1}
{"i": ["cuda", "schedule_direct_3d_cuda", [[1, 1, 80, 160, 160], [32, 1, 3, 3, 3], [1, 2, 2], [1, 1, 1], 1], {}, ["schedule_direct_3d_cuda", [1, 1, 80, 160, 160], [32, 1, 3, 3, 3], [1, 2, 2], [1, 1, 1], 1], {"i": 4302741001, "t": "", "c": null, "e": [["tile_f", "sp", [-1, 2, 2, 4]], ["tile_d", "sp", [-1, 1, 1, 1]], ["tile_y", "sp", [-1, 2, 4, 1]], ["tile_x", "sp", [-1, 1, 1, 1]], ["tile_rc", "sp", [-1, 1]], ["tile_rd", "sp", [-1, 1]], ["tile_ry", "sp", [-1, 1]], ["tile_rx", "sp", [-1, 3]], ["auto_unroll_max_step", "ot", 0], ["unroll_explicit", "ot", 1]]}], "r": [[0.0032283746451612903], 0, 1.7310762405395508, 1576390850.7339997], "v": 0.1}
{"i": ["cuda", "schedule_direct_3d_cuda", [[1, 1, 80, 160, 160], [32, 1, 3, 3, 3], [1, 2, 2], [1, 1, 1], 1], {}, ["schedule_direct_3d_cuda", [1, 1, 80, 160, 160], [32, 1, 3, 3, 3], [1, 2, 2], [1, 1, 1], 1], {"i": 614805024, "t": "", "c": null, "e": [["tile_f", "sp", [-1, 4, 2, 1]], ["tile_d", "sp", [-1, 2, 1, 1]], ["tile_y", "sp", [-1, 2, 4, 1]], ["tile_x", "sp", [-1, 1, 1, 1]], ["tile_rc", "sp", [-1, 1]], ["tile_rd", "sp", [-1, 1]], ["tile_ry", "sp", [-1, 1]], ["tile_rx", "sp", [-1, 3]], ["auto_unroll_max_step", "ot", 0], ["unroll_explicit", "ot", 0]]}], "r": [[0.00508155595], 0, 1.6738412380218506, 1576390851.6281521], "v": 0.1}
{"i": ["cuda", "schedule_direct_3d_cuda", [[1, 1, 80, 160, 160], [32, 1, 3, 3, 3], [1, 2, 2], [1, 1, 1], 1], {}, ["schedule_direct_3d_cuda", [1, 1, 80, 160, 160], [32, 1, 3, 3, 3], [1, 2, 2], [1, 1, 1], 1], {"i": 614805019, "t": "", "c": null, "e": [["tile_f", "sp", [-1, 8, 1, 1]], ["tile_d", "sp", [-1, 2, 1, 1]], ["tile_y", "sp", [-1, 2, 4, 1]], ["tile_x", "sp", [-1, 1, 1, 1]], ["tile_rc", "sp", [-1, 1]], ["tile_rd", "sp", [-1, 1]], ["tile_ry", "sp", [-1, 1]], ["tile_rx", "sp", [-1, 3]], ["auto_unroll_max_step", "ot", 0], ["unroll_explicit", "ot", 0]]}], "r": [[0.012917993], 0, 1.7388620376586914, 1576390852.4779165], "v": 0.1}
{"i": ["cuda", "schedule_direct_3d_cuda", [[1, 1, 80, 160, 160], [32, 1, 3, 3, 3], [1, 2, 2], [1, 1, 1], 1], {}, ["schedule_direct_3d_cuda", [1, 1, 80, 160, 160], [32, 1, 3, 3, 3], [1, 2, 2], [1, 1, 1], 1], {"i": 4309177893, "t": "", "c": null, "e": [["tile_f", "sp", [-1, 4, 4, 1]], ["tile_d", "sp", [-1, 10, 1, 1]], ["tile_y", "sp", [-1, 1, 1, 1]], ["tile_x", "sp", [-1, 16, 1, 1]], ["tile_rc", "sp", [-1, 1]], ["tile_rd", "sp", [-1, 1]], ["tile_ry", "sp", [-1, 1]], ["tile_rx", "sp", [-1, 3]], ["auto_unroll_max_step", "ot", 0], ["unroll_explicit", "ot", 1]]}], "r": [[0.13691591325], 0, 3.293057680130005, 1576390854.81844], "v": 0.1}
{"i": ["cuda", "schedule_direct_3d_cuda", [[1, 1, 80, 160, 160], [32, 1, 3, 3, 3], [1, 2, 2], [1, 1, 1], 1], {}, ["schedule_direct_3d_cuda", [1, 1, 80, 160, 160], [32, 1, 3, 3, 3], [1, 2, 2], [1, 1, 1], 1], {"i": 3995412964, "t": "", "c": null, "e": [["tile_f", "sp", [-1, 16, 1, 1]], ["tile_d", "sp", [-1, 1, 1, 1]], ["tile_y", "sp", [-1, 2, 4, 1]], ["tile_x", "sp", [-1, 1, 1, 1]], ["tile_rc", "sp", [-1, 1]], ["tile_rd", "sp", [-1, 1]], ["tile_ry", "sp", [-1, 3]], ["tile_rx", "sp", [-1, 1]], ["auto_unroll_max_step", "ot", 0], ["unroll_explicit", "ot", 1]]}], "r": [[0.0029352969714285713], 0, 1.6961448192596436, 1576390855.723735], "v": 0.1}
{"i": ["cuda", "schedule_direct_3d_cuda", [[1, 1, 80, 160, 160], [32, 1, 3, 3, 3], [1, 2, 2], [1, 1, 1], 1], {}, ["schedule_direct_3d_cuda", [1, 1, 80, 160, 160], [32, 1, 3, 3, 3], [1, 2, 2], [1, 1, 1], 1], {"i": 4467255589, "t": "", "c": null, "e": [["tile_f", "sp", [-1, 4, 4, 1]], ["tile_d", "sp", [-1, 2, 1, 1]], ["tile_y", "sp", [-1, 5, 1, 1]], ["tile_x", "sp", [-1, 1, 2, 1]], ["tile_rc", "sp", [-1, 1]], ["tile_rd", "sp", [-1, 3]], ["tile_ry", "sp", [-1, 1]], ["tile_rx", "sp", [-1, 3]], ["auto_unroll_max_step", "ot", 0], ["unroll_explicit", "ot", 1]]}], "r": [[0.0023905653571428573], 0, 1.6190185546875, 1576390856.675577], "v": 0.1}
{"i": ["cuda", "schedule_direct_3d_cuda", [[1, 1, 80, 160, 160], [32, 1, 3, 3, 3], [1, 2, 2], [1, 1, 1], 1], {}, ["schedule_direct_3d_cuda", [1, 1, 80, 160, 160], [32, 1, 3, 3, 3], [1, 2, 2], [1, 1, 1], 1], {"i": 4467255604, "t": "", "c": null, "e": [["tile_f", "sp", [-1, 4, 2, 2]], ["tile_d", "sp", [-1, 2, 1, 1]], ["tile_y", "sp", [-1, 5, 1, 1]], ["tile_x", "sp", [-1, 1, 2, 1]], ["tile_rc", "sp", [-1, 1]], ["tile_rd", "sp", [-1, 3]], ["tile_ry", "sp", [-1, 1]], ["tile_rx", "sp", [-1, 3]], ["auto_unroll_max_step", "ot", 0], ["unroll_explicit", "ot", 1]]}], "r": [[0.00507687305], 0, 1.6805832386016846, 1576390857.5995777], "v": 0.1}
{"i": ["cuda", "schedule_direct_3d_cuda", [[1, 1, 80, 160, 160], [32, 1, 3, 3, 3], [1, 2, 2], [1, 1, 1], 1], {}, ["schedule_direct_3d_cuda", [1, 1, 80, 160, 160], [32, 1, 3, 3, 3], [1, 2, 2], [1, 1, 1], 1], {"i": 4467255592, "t": "", "c": null, "e": [["tile_f", "sp", [-1, 2, 8, 1]], ["tile_d", "sp", [-1, 2, 1, 1]], ["tile_y", "sp", [-1, 5, 1, 1]], ["tile_x", "sp", [-1, 1, 2, 1]], ["tile_rc", "sp", [-1, 1]], ["tile_rd", "sp", [-1, 3]], ["tile_ry", "sp", [-1, 1]], ["tile_rx", "sp", [-1, 3]], ["auto_unroll_max_step", "ot", 0], ["unroll_explicit", "ot", 1]]}], "r": [[0.001254982325], 0, 1.6264567375183105, 1576390860.2618039], "v": 0.1}
{"i": ["cuda", "schedule_direct_3d_cuda", [[1, 1, 80, 160, 160], [32, 1, 3, 3, 3], [1, 2, 2], [1, 1, 1], 1], {}, ["schedule_direct_3d_cuda", [1, 1, 80, 160, 160], [32, 1, 3, 3, 3], [1, 2, 2], [1, 1, 1], 1], {"i": 4609920255, "t": "", "c": null, "e": [["tile_f", "sp", [-1, 2, 4, 2]], ["tile_d", "sp", [-1, 8, 1, 1]], ["tile_y", "sp", [-1, 1, 1, 1]], ["tile_x", "sp", [-1, 1, 1, 1]], ["tile_rc", "sp", [-1, 1]], ["tile_rd", "sp", [-1, 1]], ["tile_ry", "sp", [-1, 3]], ["tile_rx", "sp", [-1, 3]], ["auto_unroll_max_step", "ot", 0], ["unroll_explicit", "ot", 1]]}], "r": [[0.003360069266666667], 0, 1.692030429840088, 1576390861.1947267], "v": 0.1}
{"i": ["cuda", "schedule_direct_3d_cuda", [[1, 1, 80, 160, 160], [32, 1, 3, 3, 3], [1, 2, 2], [1, 1, 1], 1], {}, ["schedule_direct_3d_cuda", [1, 1, 80, 160, 160], [32, 1, 3, 3, 3], [1, 2, 2], [1, 1, 1], 1], {"i": 4467310572, "t": "", "c": null, "e": [["tile_f", "sp", [-1, 16, 1, 1]], ["tile_d", "sp", [-1, 5, 1, 1]], ["tile_y", "sp", [-1, 1, 2, 1]], ["tile_x", "sp", [-1, 1, 2, 1]], ["tile_rc", "sp", [-1, 1]], ["tile_rd", "sp", [-1, 3]], ["tile_ry", "sp", [-1, 1]], ["tile_rx", "sp", [-1, 3]], ["auto_unroll_max_step", "ot", 0], ["unroll_explicit", "ot", 1]]}], "r": [[0.005390495947368421], 0, 1.72300124168396, 1576390862.1215425], "v": 0.1}
{"i": ["cuda", "schedule_direct_3d_cuda", [[1, 1, 80, 160, 160], [32, 1, 3, 3, 3], [1, 2, 2], [1, 1, 1], 1], {}, ["schedule_direct_3d_cuda", [1, 1, 80, 160, 160], [32, 1, 3, 3, 3], [1, 2, 2], [1, 1, 1], 1], {"i": 4467326108, "t": "", "c": null, "e": [["tile_f", "sp", [-1, 4, 2, 2]], ["tile_d", "sp", [-1, 1, 1, 1]], ["tile_y", "sp", [-1, 4, 2, 1]], ["tile_x", "sp", [-1, 1, 2, 1]], ["tile_rc", "sp", [-1, 1]], ["tile_rd", "sp", [-1, 3]], ["tile_ry", "sp", [-1, 1]], ["tile_rx", "sp", [-1, 3]], ["auto_unroll_max_step", "ot", 0], ["unroll_explicit", "ot", 1]]}], "r": [[0.0029348825428571427], 0, 1.7209937572479248, 1576390863.0838826], "v": 0.1}
{"i": ["cuda", "schedule_direct_3d_cuda", [[1, 1, 80, 160, 160], [32, 1, 3, 3, 3], [1, 2, 2], [1, 1, 1], 1], {}, ["schedule_direct_3d_cuda", [1, 1, 80, 160, 160], [32, 1, 3, 3, 3], [1, 2, 2], [1, 1, 1], 1], {"i": 4611017746, "t": "", "c": null, "e": [["tile_f", "sp", [-1, 2, 8, 2]], ["tile_d", "sp", [-1, 4, 1, 1]], ["tile_y", "sp", [-1, 1, 1, 1]], ["tile_x", "sp", [-1, 2, 1, 1]], ["tile_rc", "sp", [-1, 1]], ["tile_rd", "sp", [-1, 1]], ["tile_ry", "sp", [-1, 3]], ["tile_rx", "sp", [-1, 3]], ["auto_unroll_max_step", "ot", 0], ["unroll_explicit", "ot", 1]]}], "r": [[0.0019127649056603774], 0, 1.7788290977478027, 1576390863.9992962], "v": 0.1}
{"i": ["cuda", "schedule_direct_3d_cuda", [[1, 1, 80, 160, 160], [32, 1, 3, 3, 3], [1, 2, 2], [1, 1, 1], 1], {}, ["schedule_direct_3d_cuda", [1, 1, 80, 160, 160], [32, 1, 3, 3, 3], [1, 2, 2], [1, 1, 1], 1], {"i": 4609959268, "t": "", "c": null, "e": [["tile_f", "sp", [-1, 2, 4, 1]], ["tile_d", "sp", [-1, 2, 1, 1]], ["tile_y", "sp", [-1, 10, 1, 1]], ["tile_x", "sp", [-1, 1, 1, 1]], ["tile_rc", "sp", [-1, 1]], ["tile_rd", "sp", [-1, 1]], ["tile_ry", "sp", [-1, 3]], ["tile_rx", "sp", [-1, 3]], ["auto_unroll_max_step", "ot", 0], ["unroll_explicit", "ot", 1]]}], "r": [[0.007286805714285714], 0, 1.7045879364013672, 1576390864.879385], "v": 0.1}
{"i": ["cuda", "schedule_direct_3d_cuda", [[1, 1, 80, 160, 160], [32, 1, 3, 3, 3], [1, 2, 2], [1, 1, 1], 1], {}, ["schedule_direct_3d_cuda", [1, 1, 80, 160, 160], [32, 1, 3, 3, 3], [1, 2, 2], [1, 1, 1], 1], {"i": 4611041262, "t": "", "c": null, "e": [["tile_f", "sp", [-1, 1, 4, 2]], ["tile_d", "sp", [-1, 4, 1, 1]], ["tile_y", "sp", [-1, 5, 1, 1]], ["tile_x", "sp", [-1, 2, 1, 1]], ["tile_rc", "sp", [-1, 1]], ["tile_rd", "sp", [-1, 1]], ["tile_ry", "sp", [-1, 3]], ["tile_rx", "sp", [-1, 3]], ["auto_unroll_max_step", "ot", 0], ["unroll_explicit", "ot", 1]]}], "r": [[0.005772164166666666], 0, 1.7678906917572021, 1576390865.8081295], "v": 0.1}
{"i": ["cuda", "schedule_direct_3d_cuda", [[1, 1, 80, 160, 160], [32, 1, 3, 3, 3], [1, 2, 2], [1, 1, 1], 1], {}, ["schedule_direct_3d_cuda", [1, 1, 80, 160, 160], [32, 1, 3, 3, 3], [1, 2, 2], [1, 1, 1], 1], {"i": 4611103909, "t": "", "c": null, "e": [["tile_f", "sp", [-1, 4, 4, 1]], ["tile_d", "sp", [-1, 2, 1, 1]], ["tile_y", "sp", [-1, 2, 2, 1]], ["tile_x", "sp", [-1, 2, 1, 1]], ["tile_rc", "sp", [-1, 1]], ["tile_rd", "sp", [-1, 1]], ["tile_ry", "sp", [-1, 3]], ["tile_rx", "sp", [-1, 3]], ["auto_unroll_max_step", "ot", 0], ["unroll_explicit", "ot", 1]]}], "r": [[0.0017627423684210526], 0, 1.725386381149292, 1576390866.675699], "v": 0.1}
{"i": ["cuda", "schedule_direct_3d_cuda", [[1, 1, 80, 160, 160], [32, 1, 3, 3, 3], [1, 2, 2], [1, 1, 1], 1], {}, ["schedule_direct_3d_cuda", [1, 1, 80, 160, 160], [32, 1, 3, 3, 3], [1, 2, 2], [1, 1, 1], 1], {"i": 4610061351, "t": "", "c": null, "e": [["tile_f", "sp", [-1, 2, 2, 1]], ["tile_d", "sp", [-1, 8, 1, 1]], ["tile_y", "sp", [-1, 1, 4, 1]], ["tile_x", "sp", [-1, 1, 1, 1]], ["tile_rc", "sp", [-1, 1]], ["tile_rd", "sp", [-1, 1]], ["tile_ry", "sp", [-1, 3]], ["tile_rx", "sp", [-1, 3]], ["auto_unroll_max_step", "ot", 0], ["unroll_explicit", "ot", 1]]}], "r": [[0.0028698222], 0, 1.7041547298431396, 1576390867.6713526], "v": 0.1}
{"i": ["cuda", "schedule_direct_3d_cuda", [[1, 1, 80, 160, 160], [32, 1, 3, 3, 3], [1, 2, 2], [1, 1, 1], 1], {}, ["schedule_direct_3d_cuda", [1, 1, 80, 160, 160], [32, 1, 3, 3, 3], [1, 2, 2], [1, 1, 1], 1], {"i": 4611096091, "t": "", "c": null, "e": [["tile_f", "sp", [-1, 1, 16, 2]], ["tile_d", "sp", [-1, 2, 1, 1]], ["tile_y", "sp", [-1, 1, 2, 1]], ["tile_x", "sp", [-1, 2, 1, 1]], ["tile_rc", "sp", [-1, 1]], ["tile_rd", "sp", [-1, 1]], ["tile_ry", "sp", [-1, 3]], ["tile_rx", "sp", [-1, 3]], ["auto_unroll_max_step", "ot", 0], ["unroll_explicit", "ot", 1]]}], "r": [[0.0010175322626262626], 0, 1.5892033576965332, 1576390868.5094907], "v": 0.1}
{"i": ["cuda", "schedule_direct_3d_cuda", [[1, 1, 80, 160, 160], [32, 1, 3, 3, 3], [1, 2, 2], [1, 1, 1], 1], {}, ["schedule_direct_3d_cuda", [1, 1, 80, 160, 160], [32, 1, 3, 3, 3], [1, 2, 2], [1, 1, 1], 1], {"i": 922078114, "t": "", "c": null, "e": [["tile_f", "sp", [-1, 2, 8, 2]], ["tile_d", "sp", [-1, 1, 1, 1]], ["tile_y", "sp", [-1, 4, 2, 1]], ["tile_x", "sp", [-1, 1, 1, 1]], ["tile_rc", "sp", [-1, 1]], ["tile_rd", "sp", [-1, 1]], ["tile_ry", "sp", [-1, 3]], ["tile_rx", "sp", [-1, 3]], ["auto_unroll_max_step", "ot", 0], ["unroll_explicit", "ot", 0]]}], "r": [[0.0014126344788732395], 0, 1.8584740161895752, 1576391088.1464317], "v": 0.1}
{"i": ["cuda", "schedule_direct_3d_cuda", [[1, 1, 80, 160, 160], [32, 1, 3, 3, 3], [1, 2, 2], [1, 1, 1], 1], {}, ["schedule_direct_3d_cuda", [1, 1, 80, 160, 160], [32, 1, 3, 3, 3], [1, 2, 2], [1, 1, 1], 1], {"i": 4610014114, "t": "", "c": null, "e": [["tile_f", "sp", [-1, 2, 8, 2]], ["tile_d", "sp", [-1, 1, 1, 1]], ["tile_y", "sp", [-1, 4, 2, 1]], ["tile_x", "sp", [-1, 1, 1, 1]], ["tile_rc", "sp", [-1, 1]], ["tile_rd", "sp", [-1, 1]], ["tile_ry", "sp", [-1, 3]], ["tile_rx", "sp", [-1, 3]], ["auto_unroll_max_step", "ot", 0], ["unroll_explicit", "ot", 1]]}], "r": [[0.0011007450827586207], 0, 1.870574712753296, 1576391089.187243], "v": 0.1}
{"i": ["cuda", "schedule_direct_3d_cuda", [[1, 1, 80, 160, 160], [32, 1, 3, 3, 3], [1, 2, 2], [1, 1, 1], 1], {}, ["schedule_direct_3d_cuda", [1, 1, 80, 160, 160], [32, 1, 3, 3, 3], [1, 2, 2], [1, 1, 1], 1], {"i": 4610014096, "t": "", "c": null, "e": [["tile_f", "sp", [-1, 2, 8, 1]], ["tile_d", "sp", [-1, 1, 1, 1]], ["tile_y", "sp", [-1, 4, 2, 1]], ["tile_x", "sp", [-1, 1, 1, 1]], ["tile_rc", "sp", [-1, 1]], ["tile_rd", "sp", [-1, 1]], ["tile_ry", "sp", [-1, 3]], ["tile_rx", "sp", [-1, 3]], ["auto_unroll_max_step", "ot", 0], ["unroll_explicit", "ot", 1]]}], "r": [[0.0013793121780821917], 0, 1.6733388900756836, 1576391090.0947616], "v": 0.1}
{"i": ["cuda", "schedule_direct_3d_cuda", [[1, 1, 80, 160, 160], [32, 1, 3, 3, 3], [1, 2, 2], [1, 1, 1], 1], {}, ["schedule_direct_3d_cuda", [1, 1, 80, 160, 160], [32, 1, 3, 3, 3], [1, 2, 2], [1, 1, 1], 1], {"i": 922078096, "t": "", "c": null, "e": [["tile_f", "sp", [-1, 2, 8, 1]], ["tile_d", "sp", [-1, 1, 1, 1]], ["tile_y", "sp", [-1, 4, 2, 1]], ["tile_x", "sp", [-1, 1, 1, 1]], ["tile_rc", "sp", [-1, 1]], ["tile_rd", "sp", [-1, 1]], ["tile_ry", "sp", [-1, 3]], ["tile_rx", "sp", [-1, 3]], ["auto_unroll_max_step", "ot", 0], ["unroll_explicit", "ot", 0]]}], "r": [[0.0013793124383561645], 0, 1.6751034259796143, 1576391090.9024434], "v": 0.1}
{"i": ["cuda", "schedule_direct_3d_cuda", [[1, 1, 80, 160, 160], [32, 1, 3, 3, 3], [1, 2, 2], [1, 1, 1], 1], {}, ["schedule_direct_3d_cuda", [1, 1, 80, 160, 160], [32, 1, 3, 3, 3], [1, 2, 2], [1, 1, 1], 1], {"i": 3380702114, "t": "", "c": null, "e": [["tile_f", "sp", [-1, 2, 8, 2]], ["tile_d", "sp", [-1, 1, 1, 1]], ["tile_y", "sp", [-1, 4, 2, 1]], ["tile_x", "sp", [-1, 1, 1, 1]], ["tile_rc", "sp", [-1, 1]], ["tile_rd", "sp", [-1, 1]], ["tile_ry", "sp", [-1, 3]], ["tile_rx", "sp", [-1, 3]], ["auto_unroll_max_step", "ot", 1500], ["unroll_explicit", "ot", 0]]}], "r": [[0.001120794788888889], 0, 2.04691219329834, 1576391091.853871], "v": 0.1}
{"i": ["cuda", "schedule_direct_3d_cuda", [[1, 1, 80, 160, 160], [32, 1, 3, 3, 3], [1, 2, 2], [1, 1, 1], 1], {}, ["schedule_direct_3d_cuda", [1, 1, 80, 160, 160], [32, 1, 3, 3, 3], [1, 2, 2], [1, 1, 1], 1], {"i": 7068638114, "t": "", "c": null, "e": [["tile_f", "sp", [-1, 2, 8, 2]], ["tile_d", "sp", [-1, 1, 1, 1]], ["tile_y", "sp", [-1, 4, 2, 1]], ["tile_x", "sp", [-1, 1, 1, 1]], ["tile_rc", "sp", [-1, 1]], ["tile_rd", "sp", [-1, 1]], ["tile_ry", "sp", [-1, 3]], ["tile_rx", "sp", [-1, 3]], ["auto_unroll_max_step", "ot", 1500], ["unroll_explicit", "ot", 1]]}], "r": [[0.0011232508749999999], 0, 2.589900255203247, 1576391093.0700612], "v": 0.1}
{"i": ["cuda", "schedule_direct_3d_cuda", [[1, 1, 80, 160, 160], [32, 1, 3, 3, 3], [1, 2, 2], [1, 1, 1], 1], {}, ["schedule_direct_3d_cuda", [1, 1, 80, 160, 160], [32, 1, 3, 3, 3], [1, 2, 2], [1, 1, 1], 1], {"i": 5839326114, "t": "", "c": null, "e": [["tile_f", "sp", [-1, 2, 8, 2]], ["tile_d", "sp", [-1, 1, 1, 1]], ["tile_y", "sp", [-1, 4, 2, 1]], ["tile_x", "sp", [-1, 1, 1, 1]], ["tile_rc", "sp", [-1, 1]], ["tile_rd", "sp", [-1, 1]], ["tile_ry", "sp", [-1, 3]], ["tile_rx", "sp", [-1, 3]], ["auto_unroll_max_step", "ot", 512], ["unroll_explicit", "ot", 1]]}], "r": [[0.0011288761460674158], 0, 2.309328317642212, 1576391093.9393234], "v": 0.1}
{"i": ["cuda", "schedule_direct_3d_cuda", [[1, 1, 80, 160, 160], [32, 1, 3, 3, 3], [1, 2, 2], [1, 1, 1], 1], {}, ["schedule_direct_3d_cuda", [1, 1, 80, 160, 160], [32, 1, 3, 3, 3], [1, 2, 2], [1, 1, 1], 1], {"i": 2151390114, "t": "", "c": null, "e": [["tile_f", "sp", [-1, 2, 8, 2]], ["tile_d", "sp", [-1, 1, 1, 1]], ["tile_y", "sp", [-1, 4, 2, 1]], ["tile_x", "sp", [-1, 1, 1, 1]], ["tile_rc", "sp", [-1, 1]], ["tile_rd", "sp", [-1, 1]], ["tile_ry", "sp", [-1, 3]], ["tile_rx", "sp", [-1, 3]], ["auto_unroll_max_step", "ot", 512], ["unroll_explicit", "ot", 0]]}], "r": [[0.0011264051348314607], 0, 1.952714443206787, 1576391094.7974482], "v": 0.1}
{"i": ["cuda", "schedule_direct_3d_cuda", [[1, 1, 80, 160, 160], [32, 1, 3, 3, 3], [1, 2, 2], [1, 1, 1], 1], {}, ["schedule_direct_3d_cuda", [1, 1, 80, 160, 160], [32, 1, 3, 3, 3], [1, 2, 2], [1, 1, 1], 1], {"i": 3380702096, "t": "", "c": null, "e": [["tile_f", "sp", [-1, 2, 8, 1]], ["tile_d", "sp", [-1, 1, 1, 1]], ["tile_y", "sp", [-1, 4, 2, 1]], ["tile_x", "sp", [-1, 1, 1, 1]], ["tile_rc", "sp", [-1, 1]], ["tile_rd", "sp", [-1, 1]], ["tile_ry", "sp", [-1, 3]], ["tile_rx", "sp", [-1, 3]], ["auto_unroll_max_step", "ot", 1500], ["unroll_explicit", "ot", 0]]}], "r": [[0.001370629205479452], 0, 1.936786413192749, 1576391095.6969452], "v": 0.1}
{"i": ["cuda", "schedule_direct_3d_cuda", [[1, 1, 80, 160, 160], [32, 1, 3, 3, 3], [1, 2, 2], [1, 1, 1], 1], {}, ["schedule_direct_3d_cuda", [1, 1, 80, 160, 160], [32, 1, 3, 3, 3], [1, 2, 2], [1, 1, 1], 1], {"i": 7068638096, "t": "", "c": null, "e": [["tile_f", "sp", [-1, 2, 8, 1]], ["tile_d", "sp", [-1, 1, 1, 1]], ["tile_y", "sp", [-1, 4, 2, 1]], ["tile_x", "sp", [-1, 1, 1, 1]], ["tile_rc", "sp", [-1, 1]], ["tile_rd", "sp", [-1, 1]], ["tile_ry", "sp", [-1, 3]], ["tile_rx", "sp", [-1, 3]], ["auto_unroll_max_step", "ot", 1500], ["unroll_explicit", "ot", 1]]}], "r": [[0.001397883236111111], 0, 2.1104018688201904, 1576391096.635357], "v": 0.1}
{"i": ["cuda", "schedule_direct_3d_cuda", [[1, 1, 80, 160, 160], [32, 1, 3, 3, 3], [1, 2, 2], [1, 1, 1], 1], {}, ["schedule_direct_3d_cuda", [1, 1, 80, 160, 160], [32, 1, 3, 3, 3], [1, 2, 2], [1, 1, 1], 1], {"i": 4610006256, "t": "", "c": null, "e": [["tile_f", "sp", [-1, 2, 8, 1]], ["tile_d", "sp", [-1, 1, 1, 1]], ["tile_y", "sp", [-1, 2, 2, 1]], ["tile_x", "sp", [-1, 1, 1, 1]], ["tile_rc", "sp", [-1, 1]], ["tile_rd", "sp", [-1, 1]], ["tile_ry", "sp", [-1, 3]], ["tile_rx", "sp", [-1, 3]], ["auto_unroll_max_step", "ot", 0], ["unroll_explicit", "ot", 1]]}], "r": [[0.0016042425079365078], 0, 1.7673530578613281, 1576391097.46203], "v": 0.1}
{"i": ["cuda", "schedule_direct_3d_cuda", [[1, 1, 80, 160, 160], [32, 1, 3, 3, 3], [1, 2, 2], [1, 1, 1], 1], {}, ["schedule_direct_3d_cuda", [1, 1, 80, 160, 160], [32, 1, 3, 3, 3], [1, 2, 2], [1, 1, 1], 1], {"i": 461086096, "t": "", "c": null, "e": [["tile_f", "sp", [-1, 2, 8, 1]], ["tile_d", "sp", [-1, 1, 1, 1]], ["tile_y", "sp", [-1, 4, 2, 1]], ["tile_x", "sp", [-1, 1, 1, 1]], ["tile_rc", "sp", [-1, 1]], ["tile_rd", "sp", [-1, 3]], ["tile_ry", "sp", [-1, 3]], ["tile_rx", "sp", [-1, 1]], ["auto_unroll_max_step", "ot", 0], ["unroll_explicit", "ot", 0]]}], "r": [[0.00167338575], 0, 1.8280813694000244, 1576391098.3470676], "v": 0.1}
{"i": ["cuda", "schedule_direct_3d_cuda", [[1, 1, 80, 160, 160], [32, 1, 3, 3, 3], [1, 2, 2], [1, 1, 1], 1], {}, ["schedule_direct_3d_cuda", [1, 1, 80, 160, 160], [32, 1, 3, 3, 3], [1, 2, 2], [1, 1, 1], 1], {"i": 4149022096, "t": "", "c": null, "e": [["tile_f", "sp", [-1, 2, 8, 1]], ["tile_d", "sp", [-1, 1, 1, 1]], ["tile_y", "sp", [-1, 4, 2, 1]], ["tile_x", "sp", [-1, 1, 1, 1]], ["tile_rc", "sp", [-1, 1]], ["tile_rd", "sp", [-1, 3]], ["tile_ry", "sp", [-1, 3]], ["tile_rx", "sp", [-1, 1]], ["auto_unroll_max_step", "ot", 0], ["unroll_explicit", "ot", 1]]}], "r": [[0.0018119579305555557], 0, 1.822575569152832, 1576391101.846146], "v": 0.1}
{"i": ["cuda", "schedule_direct_3d_cuda", [[1, 1, 80, 160, 160], [32, 1, 3, 3, 3], [1, 2, 2], [1, 1, 1], 1], {}, ["schedule_direct_3d_cuda", [1, 1, 80, 160, 160], [32, 1, 3, 3, 3], [1, 2, 2], [1, 1, 1], 1], {"i": 3380694256, "t": "", "c": null, "e": [["tile_f", "sp", [-1, 2, 8, 1]], ["tile_d", "sp", [-1, 1, 1, 1]], ["tile_y", "sp", [-1, 2, 2, 1]], ["tile_x", "sp", [-1, 1, 1, 1]], ["tile_rc", "sp", [-1, 1]], ["tile_rd", "sp", [-1, 1]], ["tile_ry", "sp", [-1, 3]], ["tile_rx", "sp", [-1, 3]], ["auto_unroll_max_step", "ot", 1500], ["unroll_explicit", "ot", 0]]}], "r": [[0.001596455634920635], 0, 1.7073190212249756, 1576391102.718884], "v": 0.1}
{"i": ["cuda", "schedule_direct_3d_cuda", [[1, 1, 80, 160, 160], [32, 1, 3, 3, 3], [1, 2, 2], [1, 1, 1], 1], {}, ["schedule_direct_3d_cuda", [1, 1, 80, 160, 160], [32, 1, 3, 3, 3], [1, 2, 2], [1, 1, 1], 1], {"i": 2151382256, "t": "", "c": null, "e": [["tile_f", "sp", [-1, 2, 8, 1]], ["tile_d", "sp", [-1, 1, 1, 1]], ["tile_y", "sp", [-1, 2, 2, 1]], ["tile_x", "sp", [-1, 1, 1, 1]], ["tile_rc", "sp", [-1, 1]], ["tile_rd", "sp", [-1, 1]], ["tile_ry", "sp", [-1, 3]], ["tile_rx", "sp", [-1, 3]], ["auto_unroll_max_step", "ot", 512], ["unroll_explicit", "ot", 0]]}], "r": [[0.0015965880634920635], 0, 1.8300447463989258, 1576391103.5277174], "v": 0.1}
{"i": ["cuda", "schedule_direct_3d_cuda", [[1, 1, 80, 160, 160], [32, 1, 3, 3, 3], [1, 2, 2], [1, 1, 1], 1], {}, ["schedule_direct_3d_cuda", [1, 1, 80, 160, 160], [32, 1, 3, 3, 3], [1, 2, 2], [1, 1, 1], 1], {"i": 5839318256, "t": "", "c": null, "e": [["tile_f", "sp", [-1, 2, 8, 1]], ["tile_d", "sp", [-1, 1, 1, 1]], ["tile_y", "sp", [-1, 2, 2, 1]], ["tile_x", "sp", [-1, 1, 1, 1]], ["tile_rc", "sp", [-1, 1]], ["tile_rd", "sp", [-1, 1]], ["tile_ry", "sp", [-1, 3]], ["tile_rx", "sp", [-1, 3]], ["auto_unroll_max_step", "ot", 512], ["unroll_explicit", "ot", 1]]}], "r": [[0.001571146], 0, 2.021066427230835, 1576391104.3965008], "v": 0.1}
{"i": ["cuda", "schedule_direct_3d_cuda", [[1, 1, 80, 160, 160], [32, 1, 3, 3, 3], [1, 2, 2], [1, 1, 1], 1], {}, ["schedule_direct_3d_cuda", [1, 1, 80, 160, 160], [32, 1, 3, 3, 3], [1, 2, 2], [1, 1, 1], 1], {"i": 1690398096, "t": "", "c": null, "e": [["tile_f", "sp", [-1, 2, 8, 1]], ["tile_d", "sp", [-1, 1, 1, 1]], ["tile_y", "sp", [-1, 4, 2, 1]], ["tile_x", "sp", [-1, 1, 1, 1]], ["tile_rc", "sp", [-1, 1]], ["tile_rd", "sp", [-1, 3]], ["tile_ry", "sp", [-1, 3]], ["tile_rx", "sp", [-1, 1]], ["auto_unroll_max_step", "ot", 512], ["unroll_explicit", "ot", 0]]}], "r": [[0.001634641064516129], 0, 1.898902416229248, 1576391105.2855015], "v": 0.1}
{"i": ["cuda", "schedule_direct_3d_cuda", [[1, 1, 80, 160, 160], [32, 1, 3, 3, 3], [1, 2, 2], [1, 1, 1], 1], {}, ["schedule_direct_3d_cuda", [1, 1, 80, 160, 160], [32, 1, 3, 3, 3], [1, 2, 2], [1, 1, 1], 1], {"i": 6607646096, "t": "", "c": null, "e": [["tile_f", "sp", [-1, 2, 8, 1]], ["tile_d", "sp", [-1, 1, 1, 1]], ["tile_y", "sp", [-1, 4, 2, 1]], ["tile_x", "sp", [-1, 1, 1, 1]], ["tile_rc", "sp", [-1, 1]], ["tile_rd", "sp", [-1, 3]], ["tile_ry", "sp", [-1, 3]], ["tile_rx", "sp", [-1, 1]], ["auto_unroll_max_step", "ot", 1500], ["unroll_explicit", "ot", 1]]}], "r": [[0.0016393620491803279], 0, 2.5746638774871826, 1576391106.442583], "v": 0.1}
{"i": ["cuda", "schedule_direct_3d_cuda", [[1, 1, 80, 160, 160], [32, 1, 3, 3, 3], [1, 2, 2], [1, 1, 1], 1], {}, ["schedule_direct_3d_cuda", [1, 1, 80, 160, 160], [32, 1, 3, 3, 3], [1, 2, 2], [1, 1, 1], 1], {"i": 5378334096, "t": "", "c": null, "e": [["tile_f", "sp", [-1, 2, 8, 1]], ["tile_d", "sp", [-1, 1, 1, 1]], ["tile_y", "sp", [-1, 4, 2, 1]], ["tile_x", "sp", [-1, 1, 1, 1]], ["tile_rc", "sp", [-1, 1]], ["tile_rd", "sp", [-1, 3]], ["tile_ry", "sp", [-1, 3]], ["tile_rx", "sp", [-1, 1]], ["auto_unroll_max_step", "ot", 512], ["unroll_explicit", "ot", 1]]}], "r": [[0.0016403126393442623], 0, 2.2221477031707764, 1576391107.295571], "v": 0.1}
{"i": ["cuda", "schedule_direct_3d_cuda", [[1, 1, 80, 160, 160], [32, 1, 3, 3, 3], [1, 2, 2], [1, 1, 1], 1], {}, ["schedule_direct_3d_cuda", [1, 1, 80, 160, 160], [32, 1, 3, 3, 3], [1, 2, 2], [1, 1, 1], 1], {"i": 2919710096, "t": "", "c": null, "e": [["tile_f", "sp", [-1, 2, 8, 1]], ["tile_d", "sp", [-1, 1, 1, 1]], ["tile_y", "sp", [-1, 4, 2, 1]], ["tile_x", "sp", [-1, 1, 1, 1]], ["tile_rc", "sp", [-1, 1]], ["tile_rd", "sp", [-1, 3]], ["tile_ry", "sp", [-1, 3]], ["tile_rx", "sp", [-1, 1]], ["auto_unroll_max_step", "ot", 1500], ["unroll_explicit", "ot", 0]]}], "r": [[0.0016347025161290321], 0, 1.9706714153289795, 1576391108.1413064], "v": 0.1}
{"i": ["cuda", "schedule_direct_3d_cuda", [[1, 1, 80, 160, 160], [32, 1, 3, 3, 3], [1, 2, 2], [1, 1, 1], 1], {}, ["schedule_direct_3d_cuda", [1, 1, 80, 160, 160], [32, 1, 3, 3, 3], [1, 2, 2], [1, 1, 1], 1], {"i": 922062470, "t": "", "c": null, "e": [["tile_f", "sp", [-1, 8, 4, 1]], ["tile_d", "sp", [-1, 2, 1, 1]], ["tile_y", "sp", [-1, 1, 2, 1]], ["tile_x", "sp", [-1, 1, 1, 1]], ["tile_rc", "sp", [-1, 1]], ["tile_rd", "sp", [-1, 1]], ["tile_ry", "sp", [-1, 3]], ["tile_rx", "sp", [-1, 3]], ["auto_unroll_max_step", "ot", 0], ["unroll_explicit", "ot", 0]]}], "r": [[0.00179510125], 0, 2.059985876083374, 1576391109.0760794], "v": 0.1}
{"i": ["cuda", "schedule_direct_3d_cuda", [[1, 1, 80, 160, 160], [32, 1, 3, 3, 3], [1, 2, 2], [1, 1, 1], 1], {}, ["schedule_direct_3d_cuda", [1, 1, 80, 160, 160], [32, 1, 3, 3, 3], [1, 2, 2], [1, 1, 1], 1], {"i": 932983536, "t": "", "c": null, "e": [["tile_f", "sp", [-1, 2, 8, 1]], ["tile_d", "sp", [-1, 1, 1, 1]], ["tile_y", "sp", [-1, 5, 1, 1]], ["tile_x", "sp", [-1, 1, 2, 1]], ["tile_rc", "sp", [-1, 1]], ["tile_rd", "sp", [-1, 1]], ["tile_ry", "sp", [-1, 3]], ["tile_rx", "sp", [-1, 3]], ["auto_unroll_max_step", "ot", 0], ["unroll_explicit", "ot", 0]]}], "r": [[0.0009044988648648648], 0, 1.9801912307739258, 1576391109.9419754], "v": 0.1}
{"i": ["cuda", "schedule_direct_3d_cuda", [[1, 1, 80, 160, 160], [32, 1, 3, 3, 3], [1, 2, 2], [1, 1, 1], 1], {}, ["schedule_direct_3d_cuda", [1, 1, 80, 160, 160], [32, 1, 3, 3, 3], [1, 2, 2], [1, 1, 1], 1], {"i": 4620919536, "t": "", "c": null, "e": [["tile_f", "sp", [-1, 2, 8, 1]], ["tile_d", "sp", [-1, 1, 1, 1]], ["tile_y", "sp", [-1, 5, 1, 1]], ["tile_x", "sp", [-1, 1, 2, 1]], ["tile_rc", "sp", [-1, 1]], ["tile_rd", "sp", [-1, 1]], ["tile_ry", "sp", [-1, 3]], ["tile_rx", "sp", [-1, 3]], ["auto_unroll_max_step", "ot", 0], ["unroll_explicit", "ot", 1]]}], "r": [[0.0009044528288288288], 0, 1.9218978881835938, 1576391110.7488785], "v": 0.1}
{"i": ["cuda", "schedule_direct_3d_cuda", [[1, 1, 80, 160, 160], [32, 1, 3, 3, 3], [1, 2, 2], [1, 1, 1], 1], {}, ["schedule_direct_3d_cuda", [1, 1, 80, 160, 160], [32, 1, 3, 3, 3], [1, 2, 2], [1, 1, 1], 1], {"i": 4149022114, "t": "", "c": null, "e": [["tile_f", "sp", [-1, 2, 8, 2]], ["tile_d", "sp", [-1, 1, 1, 1]], ["tile_y", "sp", [-1, 4, 2, 1]], ["tile_x", "sp", [-1, 1, 1, 1]], ["tile_rc", "sp", [-1, 1]], ["tile_rd", "sp", [-1, 3]], ["tile_ry", "sp", [-1, 3]], ["tile_rx", "sp", [-1, 1]], ["auto_unroll_max_step", "ot", 0], ["unroll_explicit", "ot", 1]]}], "r": [[0.0013202707236842106], 0, 1.8613905906677246, 1576391111.6131635], "v": 0.1}
{"i": ["cuda", "schedule_direct_3d_cuda", [[1, 1, 80, 160, 160], [32, 1, 3, 3, 3], [1, 2, 2], [1, 1, 1], 1], {}, ["schedule_direct_3d_cuda", [1, 1, 80, 160, 160], [32, 1, 3, 3, 3], [1, 2, 2], [1, 1, 1], 1], {"i": 461086114, "t": "", "c": null, "e": [["tile_f", "sp", [-1, 2, 8, 2]], ["tile_d", "sp", [-1, 1, 1, 1]], ["tile_y", "sp", [-1, 4, 2, 1]], ["tile_x", "sp", [-1, 1, 1, 1]], ["tile_rc", "sp", [-1, 1]], ["tile_rd", "sp", [-1, 3]], ["tile_ry", "sp", [-1, 3]], ["tile_rx", "sp", [-1, 1]], ["auto_unroll_max_step", "ot", 0], ["unroll_explicit", "ot", 0]]}], "r": [[0.00131947], 0, 1.4712178707122803, 1576391114.7147007], "v": 0.1}
{"i": ["cuda", "schedule_direct_3d_cuda", [[1, 1, 80, 160, 160], [32, 1, 3, 3, 3], [1, 2, 2], [1, 1, 1], 1], {}, ["schedule_direct_3d_cuda", [1, 1, 80, 160, 160], [32, 1, 3, 3, 3], [1, 2, 2], [1, 1, 1], 1], {"i": 4620903856, "t": "", "c": null, "e": [["tile_f", "sp", [-1, 2, 8, 1]], ["tile_d", "sp", [-1, 1, 1, 1]], ["tile_y", "sp", [-1, 2, 1, 1]], ["tile_x", "sp", [-1, 1, 2, 1]], ["tile_rc", "sp", [-1, 1]], ["tile_rd", "sp", [-1, 1]], ["tile_ry", "sp", [-1, 3]], ["tile_rx", "sp", [-1, 3]], ["auto_unroll_max_step", "ot", 0], ["unroll_explicit", "ot", 1]]}], "r": [[0.0012928454487179488], 0, 1.5739295482635498, 1576391115.5528514], "v": 0.1}
{"i": ["cuda", "schedule_direct_3d_cuda", [[1, 1, 80, 160, 160], [32, 1, 3, 3, 3], [1, 2, 2], [1, 1, 1], 1], {}, ["schedule_direct_3d_cuda", [1, 1, 80, 160, 160], [32, 1, 3, 3, 3], [1, 2, 2], [1, 1, 1], 1], {"i": 932967856, "t": "", "c": null, "e": [["tile_f", "sp", [-1, 2, 8, 1]], ["tile_d", "sp", [-1, 1, 1, 1]], ["tile_y", "sp", [-1, 2, 1, 1]], ["tile_x", "sp", [-1, 1, 2, 1]], ["tile_rc", "sp", [-1, 1]], ["tile_rd", "sp", [-1, 1]], ["tile_ry", "sp", [-1, 3]], ["tile_rx", "sp", [-1, 3]], ["auto_unroll_max_step", "ot", 0], ["unroll_explicit", "ot", 0]]}], "r": [[0.0012928447051282052], 0, 1.5068585872650146, 1576391116.3647664], "v": 0.1}
{"i": ["cuda", "schedule_direct_3d_cuda", [[1, 1, 80, 160, 160], [32, 1, 3, 3, 3], [1, 2, 2], [1, 1, 1], 1], {}, ["schedule_direct_3d_cuda", [1, 1, 80, 160, 160], [32, 1, 3, 3, 3], [1, 2, 2], [1, 1, 1], 1], {"i": 461078253, "t": "", "c": null, "e": [["tile_f", "sp", [-1, 4, 4, 1]], ["tile_d", "sp", [-1, 1, 1, 1]], ["tile_y", "sp", [-1, 2, 2, 1]], ["tile_x", "sp", [-1, 1, 1, 1]], ["tile_rc", "sp", [-1, 1]], ["tile_rd", "sp", [-1, 3]], ["tile_ry", "sp", [-1, 3]], ["tile_rx", "sp", [-1, 1]], ["auto_unroll_max_step", "ot", 0], ["unroll_explicit", "ot", 0]]}], "r": [[0.00319857246875], 0, 1.7951281070709229, 1576391117.253714], "v": 0.1}
{"i": ["cuda", "schedule_direct_3d_cuda", [[1, 1, 80, 160, 160], [32, 1, 3, 3, 3], [1, 2, 2], [1, 1, 1], 1], {}, ["schedule_direct_3d_cuda", [1, 1, 80, 160, 160], [32, 1, 3, 3, 3], [1, 2, 2], [1, 1, 1], 1], {"i": 4149014253, "t": "", "c": null, "e": [["tile_f", "sp", [-1, 4, 4, 1]], ["tile_d", "sp", [-1, 1, 1, 1]], ["tile_y", "sp", [-1, 2, 2, 1]], ["tile_x", "sp", [-1, 1, 1, 1]], ["tile_rc", "sp", [-1, 1]], ["tile_rd", "sp", [-1, 3]], ["tile_ry", "sp", [-1, 3]], ["tile_rx", "sp", [-1, 1]], ["auto_unroll_max_step", "ot", 0], ["unroll_explicit", "ot", 1]]}], "r": [[0.00319854615625], 0, 1.6820476055145264, 1576391118.0883868], "v": 0.1}
{"i": ["cuda", "schedule_direct_3d_cuda", [[1, 1, 80, 160, 160], [32, 1, 3, 3, 3], [1, 2, 2], [1, 1, 1], 1], {}, ["schedule_direct_3d_cuda", [1, 1, 80, 160, 160], [32, 1, 3, 3, 3], [1, 2, 2], [1, 1, 1], 1], {"i": 461078256, "t": "", "c": null, "e": [["tile_f", "sp", [-1, 2, 8, 1]], ["tile_d", "sp", [-1, 1, 1, 1]], ["tile_y", "sp", [-1, 2, 2, 1]], ["tile_x", "sp", [-1, 1, 1, 1]], ["tile_rc", "sp", [-1, 1]], ["tile_rd", "sp", [-1, 3]], ["tile_ry", "sp", [-1, 3]], ["tile_rx", "sp", [-1, 1]], ["auto_unroll_max_step", "ot", 0], ["unroll_explicit", "ot", 0]]}], "r": [[0.0021258630625], 0, 1.7200398445129395, 1576391118.9692826], "v": 0.1}
{"i": ["cuda", "schedule_direct_3d_cuda", [[1, 1, 80, 160, 160], [32, 1, 3, 3, 3], [1, 2, 2], [1, 1, 1], 1], {}, ["schedule_direct_3d_cuda", [1, 1, 80, 160, 160], [32, 1, 3, 3, 3], [1, 2, 2], [1, 1, 1], 1], {"i": 4149014256, "t": "", "c": null, "e": [["tile_f", "sp", [-1, 2, 8, 1]], ["tile_d", "sp", [-1, 1, 1, 1]], ["tile_y", "sp", [-1, 2, 2, 1]], ["tile_x", "sp", [-1, 1, 1, 1]], ["tile_rc", "sp", [-1, 1]], ["tile_rd", "sp", [-1, 3]], ["tile_ry", "sp", [-1, 3]], ["tile_rx", "sp", [-1, 1]], ["auto_unroll_max_step", "ot", 0], ["unroll_explicit", "ot", 1]]}], "r": [[0.002126093513157895], 0, 2.091679334640503, 1576391120.070865], "v": 0.1}
{"i": ["cuda", "schedule_direct_3d_cuda", [[1, 1, 80, 160, 160], [32, 1, 3, 3, 3], [1, 2, 2], [1, 1, 1], 1], {}, ["schedule_direct_3d_cuda", [1, 1, 80, 160, 160], [32, 1, 3, 3, 3], [1, 2, 2], [1, 1, 1], 1], {"i": 922078093, "t": "", "c": null, "e": [["tile_f", "sp", [-1, 4, 4, 1]], ["tile_d", "sp", [-1, 1, 1, 1]], ["tile_y", "sp", [-1, 4, 2, 1]], ["tile_x", "sp", [-1, 1, 1, 1]], ["tile_rc", "sp", [-1, 1]], ["tile_rd", "sp", [-1, 1]], ["tile_ry", "sp", [-1, 3]], ["tile_rx", "sp", [-1, 3]], ["auto_unroll_max_step", "ot", 0], ["unroll_explicit", "ot", 0]]}], "r": [[0.0018755505925925925], 0, 1.907456636428833, 1576391120.9646912], "v": 0.1}
{"i": ["cuda", "schedule_direct_3d_cuda", [[1, 1, 80, 160, 160], [32, 1, 3, 3, 3], [1, 2, 2], [1, 1, 1], 1], {}, ["schedule_direct_3d_cuda", [1, 1, 80, 160, 160], [32, 1, 3, 3, 3], [1, 2, 2], [1, 1, 1], 1], {"i": 922062434, "t": "", "c": null, "e": [["tile_f", "sp", [-1, 2, 8, 2]], ["tile_d", "sp", [-1, 1, 1, 1]], ["tile_y", "sp", [-1, 1, 2, 1]], ["tile_x", "sp", [-1, 1, 1, 1]], ["tile_rc", "sp", [-1, 1]], ["tile_rd", "sp", [-1, 1]], ["tile_ry", "sp", [-1, 3]], ["tile_rx", "sp", [-1, 3]], ["auto_unroll_max_step", "ot", 0], ["unroll_explicit", "ot", 0]]}], "r": [[0.0018612801111111113], 0, 1.887239933013916, 1576391121.7993338], "v": 0.1}
{"i": ["cuda", "schedule_direct_3d_cuda", [[1, 1, 80, 160, 160], [32, 1, 3, 3, 3], [1, 2, 2], [1, 1, 1], 1], {}, ["schedule_direct_3d_cuda", [1, 1, 80, 160, 160], [32, 1, 3, 3, 3], [1, 2, 2], [1, 1, 1], 1], {"i": 779311696, "t": "", "c": null, "e": [["tile_f", "sp", [-1, 2, 8, 1]], ["tile_d", "sp", [-1, 1, 1, 1]], ["tile_y", "sp", [-1, 4, 1, 1]], ["tile_x", "sp", [-1, 1, 2, 1]], ["tile_rc", "sp", [-1, 1]], ["tile_rd", "sp", [-1, 3]], ["tile_ry", "sp", [-1, 1]], ["tile_rx", "sp", [-1, 3]], ["auto_unroll_max_step", "ot", 0], ["unroll_explicit", "ot", 0]]}], "r": [[0.0014496107391304346], 0, 1.8892993927001953, 1576391122.684584], "v": 0.1}
{"i": ["cuda", "schedule_direct_3d_cuda", [[1, 1, 80, 160, 160], [32, 1, 3, 3, 3], [1, 2, 2], [1, 1, 1], 1], {}, ["schedule_direct_3d_cuda", [1, 1, 80, 160, 160], [32, 1, 3, 3, 3], [1, 2, 2], [1, 1, 1], 1], {"i": 4467247696, "t": "", "c": null, "e": [["tile_f", "sp", [-1, 2, 8, 1]], ["tile_d", "sp", [-1, 1, 1, 1]], ["tile_y", "sp", [-1, 4, 1, 1]], ["tile_x", "sp", [-1, 1, 2, 1]], ["tile_rc", "sp", [-1, 1]], ["tile_rd", "sp", [-1, 3]], ["tile_ry", "sp", [-1, 1]], ["tile_rx", "sp", [-1, 3]], ["auto_unroll_max_step", "ot", 0], ["unroll_explicit", "ot", 1]]}], "r": [[0.0014519849565217391], 0, 1.7379717826843262, 1576391123.5049975], "v": 0.1}
{"i": ["cuda", "schedule_direct_3d_cuda", [[1, 1, 80, 160, 160], [32, 1, 3, 3, 3], [1, 2, 2], [1, 1, 1], 1], {}, ["schedule_direct_3d_cuda", [1, 1, 80, 160, 160], [32, 1, 3, 3, 3], [1, 2, 2], [1, 1, 1], 1], {"i": 461078274, "t": "", "c": null, "e": [["tile_f", "sp", [-1, 2, 8, 2]], ["tile_d", "sp", [-1, 1, 1, 1]], ["tile_y", "sp", [-1, 2, 2, 1]], ["tile_x", "sp", [-1, 1, 1, 1]], ["tile_rc", "sp", [-1, 1]], ["tile_rd", "sp", [-1, 3]], ["tile_ry", "sp", [-1, 3]], ["tile_rx", "sp", [-1, 1]], ["auto_unroll_max_step", "ot", 0], ["unroll_explicit", "ot", 0]]}], "r": [[0.0014928182537313434], 0, 1.645308256149292, 1576391124.353499], "v": 0.1}
{"i": ["cuda", "schedule_direct_3d_cuda", [[1, 1, 80, 160, 160], [32, 1, 3, 3, 3], [1, 2, 2], [1, 1, 1], 1], {}, ["schedule_direct_3d_cuda", [1, 1, 80, 160, 160], [32, 1, 3, 3, 3], [1, 2, 2], [1, 1, 1], 1], {"i": 4149014274, "t": "", "c": null, "e": [["tile_f", "sp", [-1, 2, 8, 2]], ["tile_d", "sp", [-1, 1, 1, 1]], ["tile_y", "sp", [-1, 2, 2, 1]], ["tile_x", "sp", [-1, 1, 1, 1]], ["tile_rc", "sp", [-1, 1]], ["tile_rd", "sp", [-1, 3]], ["tile_ry", "sp", [-1, 3]], ["tile_rx", "sp", [-1, 1]], ["auto_unroll_max_step", "ot", 0], ["unroll_explicit", "ot", 1]]}], "r": [[0.001493168208955224], 0, 1.5052061080932617, 1576391127.5981133], "v": 0.1}
{"i": ["cuda", "schedule_direct_3d_cuda", [[1, 1, 80, 160, 160], [32, 1, 3, 3, 3], [1, 2, 2], [1, 1, 1], 1], {}, ["schedule_direct_3d_cuda", [1, 1, 80, 160, 160], [32, 1, 3, 3, 3], [1, 2, 2], [1, 1, 1], 1], {"i": 4609998546, "t": "", "c": null, "e": [["tile_f", "sp", [-1, 2, 8, 2]], ["tile_d", "sp", [-1, 4, 1, 1]], ["tile_y", "sp", [-1, 1, 2, 1]], ["tile_x", "sp", [-1, 1, 1, 1]], ["tile_rc", "sp", [-1, 1]], ["tile_rd", "sp", [-1, 1]], ["tile_ry", "sp", [-1, 3]], ["tile_rx", "sp", [-1, 3]], ["auto_unroll_max_step", "ot", 0], ["unroll_explicit", "ot", 1]]}], "r": [[0.0011391161022727273], 0, 1.7067720890045166, 1576391128.4701421], "v": 0.1}
{"i": ["cuda", "schedule_direct_3d_cuda", [[1, 1, 80, 160, 160], [32, 1, 3, 3, 3], [1, 2, 2], [1, 1, 1], 1], {}, ["schedule_direct_3d_cuda", [1, 1, 80, 160, 160], [32, 1, 3, 3, 3], [1, 2, 2], [1, 1, 1], 1], {"i": 922062546, "t": "", "c": null, "e": [["tile_f", "sp", [-1, 2, 8, 2]], ["tile_d", "sp", [-1, 4, 1, 1]], ["tile_y", "sp", [-1, 1, 2, 1]], ["tile_x", "sp", [-1, 1, 1, 1]], ["tile_rc", "sp", [-1, 1]], ["tile_rd", "sp", [-1, 1]], ["tile_ry", "sp", [-1, 3]], ["tile_rx", "sp", [-1, 3]], ["auto_unroll_max_step", "ot", 0], ["unroll_explicit", "ot", 0]]}], "r": [[0.001138968965909091], 0, 1.7328734397888184, 1576391129.2688773], "v": 0.1}
{"i": ["cuda", "schedule_direct_3d_cuda", [[1, 1, 80, 160, 160], [32, 1, 3, 3, 3], [1, 2, 2], [1, 1, 1], 1], {}, ["schedule_direct_3d_cuda", [1, 1, 80, 160, 160], [32, 1, 3, 3, 3], [1, 2, 2], [1, 1, 1], 1], {"i": 3380686470, "t": "", "c": null, "e": [["tile_f", "sp", [-1, 8, 4, 1]], ["tile_d", "sp", [-1, 2, 1, 1]], ["tile_y", "sp", [-1, 1, 2, 1]], ["tile_x", "sp", [-1, 1, 1, 1]], ["tile_rc", "sp", [-1, 1]], ["tile_rd", "sp", [-1, 1]], ["tile_ry", "sp", [-1, 3]], ["tile_rx", "sp", [-1, 3]], ["auto_unroll_max_step", "ot", 1500], ["unroll_explicit", "ot", 0]]}], "r": [[0.001836485090909091], 0, 2.111948013305664, 1576391130.2222037], "v": 0.1}
{"i": ["cuda", "schedule_direct_3d_cuda", [[1, 1, 80, 160, 160], [32, 1, 3, 3, 3], [1, 2, 2], [1, 1, 1], 1], {}, ["schedule_direct_3d_cuda", [1, 1, 80, 160, 160], [32, 1, 3, 3, 3], [1, 2, 2], [1, 1, 1], 1], {"i": 2151374470, "t": "", "c": null, "e": [["tile_f", "sp", [-1, 8, 4, 1]], ["tile_d", "sp", [-1, 2, 1, 1]], ["tile_y", "sp", [-1, 1, 2, 1]], ["tile_x", "sp", [-1, 1, 1, 1]], ["tile_rc", "sp", [-1, 1]], ["tile_rd", "sp", [-1, 1]], ["tile_ry", "sp", [-1, 3]], ["tile_rx", "sp", [-1, 3]], ["auto_unroll_max_step", "ot", 512], ["unroll_explicit", "ot", 0]]}], "r": [[0.0023927661904761905], 0, 1.935523271560669, 1576391131.0962503], "v": 0.1}
{"i": ["cuda", "schedule_direct_3d_cuda", [[1, 1, 80, 160, 160], [32, 1, 3, 3, 3], [1, 2, 2], [1, 1, 1], 1], {}, ["schedule_direct_3d_cuda", [1, 1, 80, 160, 160], [32, 1, 3, 3, 3], [1, 2, 2], [1, 1, 1], 1], {"i": 7068622470, "t": "", "c": null, "e": [["tile_f", "sp", [-1, 8, 4, 1]], ["tile_d", "sp", [-1, 2, 1, 1]], ["tile_y", "sp", [-1, 1, 2, 1]], ["tile_x", "sp", [-1, 1, 1, 1]], ["tile_rc", "sp", [-1, 1]], ["tile_rd", "sp", [-1, 1]], ["tile_ry", "sp", [-1, 3]], ["tile_rx", "sp", [-1, 3]], ["auto_unroll_max_step", "ot", 1500], ["unroll_explicit", "ot", 1]]}], "r": [[0.001802702], 0, 2.5381486415863037, 1576391132.0377166], "v": 0.1}
{"i": ["cuda", "schedule_direct_3d_cuda", [[1, 1, 80, 160, 160], [32, 1, 3, 3, 3], [1, 2, 2], [1, 1, 1], 1], {}, ["schedule_direct_3d_cuda", [1, 1, 80, 160, 160], [32, 1, 3, 3, 3], [1, 2, 2], [1, 1, 1], 1], {"i": 5839310470, "t": "", "c": null, "e": [["tile_f", "sp", [-1, 8, 4, 1]], ["tile_d", "sp", [-1, 2, 1, 1]], ["tile_y", "sp", [-1, 1, 2, 1]], ["tile_x", "sp", [-1, 1, 1, 1]], ["tile_rc", "sp", [-1, 1]], ["tile_rd", "sp", [-1, 1]], ["tile_ry", "sp", [-1, 3]], ["tile_rx", "sp", [-1, 3]], ["auto_unroll_max_step", "ot", 512], ["unroll_explicit", "ot", 1]]}], "r": [[0.0018148846785714285], 0, 2.0393128395080566, 1576391132.923052], "v": 0.1}
{"i": ["cuda", "schedule_direct_3d_cuda", [[1, 1, 80, 160, 160], [32, 1, 3, 3, 3], [1, 2, 2], [1, 1, 1], 1], {}, ["schedule_direct_3d_cuda", [1, 1, 80, 160, 160], [32, 1, 3, 3, 3], [1, 2, 2], [1, 1, 1], 1], {"i": 4149014254, "t": "", "c": null, "e": [["tile_f", "sp", [-1, 8, 4, 1]], ["tile_d", "sp", [-1, 1, 1, 1]], ["tile_y", "sp", [-1, 2, 2, 1]], ["tile_x", "sp", [-1, 1, 1, 1]], ["tile_rc", "sp", [-1, 1]], ["tile_rd", "sp", [-1, 3]], ["tile_ry", "sp", [-1, 3]], ["tile_rx", "sp", [-1, 1]], ["auto_unroll_max_step", "ot", 0], ["unroll_explicit", "ot", 1]]}], "r": [[0.00203326698], 0, 2.0048370361328125, 1576391133.8122334], "v": 0.1}
{"i": ["cuda", "schedule_direct_3d_cuda", [[1, 1, 80, 160, 160], [32, 1, 3, 3, 3], [1, 2, 2], [1, 1, 1], 1], {}, ["schedule_direct_3d_cuda", [1, 1, 80, 160, 160], [32, 1, 3, 3, 3], [1, 2, 2], [1, 1, 1], 1], {"i": 461078254, "t": "", "c": null, "e": [["tile_f", "sp", [-1, 8, 4, 1]], ["tile_d", "sp", [-1, 1, 1, 1]], ["tile_y", "sp", [-1, 2, 2, 1]], ["tile_x", "sp", [-1, 1, 1, 1]], ["tile_rc", "sp", [-1, 1]], ["tile_rd", "sp", [-1, 3]], ["tile_ry", "sp", [-1, 3]], ["tile_rx", "sp", [-1, 1]], ["auto_unroll_max_step", "ot", 0], ["unroll_explicit", "ot", 0]]}], "r": [[0.00203284928], 0, 1.9183950424194336, 1576391134.638815], "v": 0.1}
{"i": ["cuda", "schedule_direct_3d_cuda", [[1, 1, 80, 160, 160], [32, 1, 3, 3, 3], [1, 2, 2], [1, 1, 1], 1], {}, ["schedule_direct_3d_cuda", [1, 1, 80, 160, 160], [32, 1, 3, 3, 3], [1, 2, 2], [1, 1, 1], 1], {"i": 3391607536, "t": "", "c": null, "e": [["tile_f", "sp", [-1, 2, 8, 1]], ["tile_d", "sp", [-1, 1, 1, 1]], ["tile_y", "sp", [-1, 5, 1, 1]], ["tile_x", "sp", [-1, 1, 2, 1]], ["tile_rc", "sp", [-1, 1]], ["tile_rd", "sp", [-1, 1]], ["tile_ry", "sp", [-1, 3]], ["tile_rx", "sp", [-1, 3]], ["auto_unroll_max_step", "ot", 1500], ["unroll_explicit", "ot", 0]]}], "r": [[0.0009124874727272727], 0, 2.007689952850342, 1576391135.564022], "v": 0.1}
{"i": ["cuda", "schedule_direct_3d_cuda", [[1, 1, 80, 160, 160], [32, 1, 3, 3, 3], [1, 2, 2], [1, 1, 1], 1], {}, ["schedule_direct_3d_cuda", [1, 1, 80, 160, 160], [32, 1, 3, 3, 3], [1, 2, 2], [1, 1, 1], 1], {"i": 5850231536, "t": "", "c": null, "e": [["tile_f", "sp", [-1, 2, 8, 1]], ["tile_d", "sp", [-1, 1, 1, 1]], ["tile_y", "sp", [-1, 5, 1, 1]], ["tile_x", "sp", [-1, 1, 2, 1]], ["tile_rc", "sp", [-1, 1]], ["tile_rd", "sp", [-1, 1]], ["tile_ry", "sp", [-1, 3]], ["tile_rx", "sp", [-1, 3]], ["auto_unroll_max_step", "ot", 512], ["unroll_explicit", "ot", 1]]}], "r": [[0.0009006724245810056], 0, 2.3119983673095703, 1576391136.7410038], "v": 0.1}
