first_layer_input_grad.log
{"i": ["cuda", "schedule_conv3d_transpose_nchw_cuda", [[1, 32, 80, 80, 80], [32, 1, 3, 3, 3], [1, 2, 2], [1, 1, 1], [0, 1, 1], "float32"], {}, ["schedule_conv3d_transpose_nchw_cuda", [1, 32, 80, 80, 80], [32, 1, 3, 3, 3], [1, 2, 2], [1, 1, 1], [0, 1, 1], "float32"], {"i": 1306980296, "t": "", "c": null, "e": [["tile_f", "sp", [-1, 1, 1, 1]], ["tile_d", "sp", [-1, 2, 1, 4]], ["tile_y", "sp", [-1, 1, 4, 5]], ["tile_x", "sp", [-1, 1, 2, 1]], ["tile_rc", "sp", [-1, 1]], ["tile_rd", "sp", [-1, 3]], ["tile_ry", "sp", [-1, 3]], ["tile_rx", "sp", [-1, 3]], ["auto_unroll_max_step", "ot", 0], ["unroll_explicit", "ot", 1]]}], "r": [[0.015507198714285714], 0, 1.4067046642303467, 1576295302.180769], "v": 0.1}
{"i": ["cuda", "schedule_conv3d_transpose_nchw_cuda", [[1, 32, 80, 80, 80], [32, 1, 3, 3, 3], [1, 2, 2], [1, 1, 1], [0, 1, 1], "float32"], {}, ["schedule_conv3d_transpose_nchw_cuda", [1, 32, 80, 80, 80], [32, 1, 3, 3, 3], [1, 2, 2], [1, 1, 1], [0, 1, 1], "float32"], {"i": 295439946, "t": "", "c": null, "e": [["tile_f", "sp", [-1, 1, 1, 1]], ["tile_d", "sp", [-1, 2, 1, 2]], ["tile_y", "sp", [-1, 1, 2, 20]], ["tile_x", "sp", [-1, 1, 2, 1]], ["tile_rc", "sp", [-1, 1]], ["tile_rd", "sp", [-1, 3]], ["tile_ry", "sp", [-1, 3]], ["tile_rx", "sp", [-1, 3]], ["auto_unroll_max_step", "ot", 0], ["unroll_explicit", "ot", 0]]}], "r": [[0.0368813515], 0, 1.9718923568725586, 1576295475.283832], "v": 0.1}
{"i": ["cuda", "schedule_conv3d_transpose_nchw_cuda", [[1, 32, 80, 80, 80], [32, 1, 3, 3, 3], [1, 2, 2], [1, 1, 1], [0, 1, 1], "float32"], {}, ["schedule_conv3d_transpose_nchw_cuda", [1, 32, 80, 80, 80], [32, 1, 3, 3, 3], [1, 2, 2], [1, 1, 1], [0, 1, 1], "float32"], {"i": 632622666, "t": "", "c": null, "e": [["tile_f", "sp", [-1, 1, 1, 1]], ["tile_d", "sp", [-1, 2, 1, 2]], ["tile_y", "sp", [-1, 1, 2, 20]], ["tile_x", "sp", [-1, 1, 2, 1]], ["tile_rc", "sp", [-1, 1]], ["tile_rd", "sp", [-1, 3]], ["tile_ry", "sp", [-1, 3]], ["tile_rx", "sp", [-1, 3]], ["auto_unroll_max_step", "ot", 512], ["unroll_explicit", "ot", 0]]}], "r": [[0.02545418025], 0, 2.9834256172180176, 1576295477.116279], "v": 0.1}
{"i": ["cuda", "schedule_conv3d_transpose_nchw_cuda", [[1, 32, 80, 80, 80], [32, 1, 3, 3, 3], [1, 2, 2], [1, 1, 1], [0, 1, 1], "float32"], {}, ["schedule_conv3d_transpose_nchw_cuda", [1, 32, 80, 80, 80], [32, 1, 3, 3, 3], [1, 2, 2], [1, 1, 1], [0, 1, 1], "float32"], {"i": 632613489, "t": "", "c": null, "e": [["tile_f", "sp", [-1, 1, 1, 1]], ["tile_d", "sp", [-1, 2, 1, 8]], ["tile_y", "sp", [-1, 2, 1, 5]], ["tile_x", "sp", [-1, 1, 2, 1]], ["tile_rc", "sp", [-1, 1]], ["tile_rd", "sp", [-1, 3]], ["tile_ry", "sp", [-1, 3]], ["tile_rx", "sp", [-1, 3]], ["auto_unroll_max_step", "ot", 512], ["unroll_explicit", "ot", 0]]}], "r": [[0.15930249525], 0, 6.46845555305481, 1576295819.4035738], "v": 0.1}
{"i": ["cuda", "schedule_conv3d_transpose_nchw_cuda", [[1, 32, 80, 80, 80], [32, 1, 3, 3, 3], [1, 2, 2], [1, 1, 1], [0, 1, 1], "float32"], {}, ["schedule_conv3d_transpose_nchw_cuda", [1, 32, 80, 80, 80], [32, 1, 3, 3, 3], [1, 2, 2], [1, 1, 1], [0, 1, 1], "float32"], {"i": 1644161649, "t": "", "c": null, "e": [["tile_f", "sp", [-1, 1, 1, 1]], ["tile_d", "sp", [-1, 2, 1, 8]], ["tile_y", "sp", [-1, 2, 1, 5]], ["tile_x", "sp", [-1, 1, 2, 1]], ["tile_rc", "sp", [-1, 1]], ["tile_rd", "sp", [-1, 3]], ["tile_ry", "sp", [-1, 3]], ["tile_rx", "sp", [-1, 3]], ["auto_unroll_max_step", "ot", 512], ["unroll_explicit", "ot", 1]]}], "r": [[0.0742742205], 0, 5.811295986175537, 1576295821.797589], "v": 0.1}
{"i": ["cuda", "schedule_conv3d_transpose_nchw_cuda", [[1, 32, 80, 80, 80], [32, 1, 3, 3, 3], [1, 2, 2], [1, 1, 1], [0, 1, 1], "float32"], {}, ["schedule_conv3d_transpose_nchw_cuda", [1, 32, 80, 80, 80], [32, 1, 3, 3, 3], [1, 2, 2], [1, 1, 1], [0, 1, 1], "float32"], {"i": 969796209, "t": "", "c": null, "e": [["tile_f", "sp", [-1, 1, 1, 1]], ["tile_d", "sp", [-1, 2, 1, 8]], ["tile_y", "sp", [-1, 2, 1, 5]], ["tile_x", "sp", [-1, 1, 2, 1]], ["tile_rc", "sp", [-1, 1]], ["tile_rd", "sp", [-1, 3]], ["tile_ry", "sp", [-1, 3]], ["tile_rx", "sp", [-1, 3]], ["auto_unroll_max_step", "ot", 1500], ["unroll_explicit", "ot", 0]]}], "r": [[0.08076543725], 0, 7.183313846588135, 1576295824.779408], "v": 0.1}
{"i": ["cuda", "schedule_conv3d_transpose_nchw_cuda", [[1, 32, 80, 80, 80], [32, 1, 3, 3, 3], [1, 2, 2], [1, 1, 1], [0, 1, 1], "float32"], {}, ["schedule_conv3d_transpose_nchw_cuda", [1, 32, 80, 80, 80], [32, 1, 3, 3, 3], [1, 2, 2], [1, 1, 1], [0, 1, 1], "float32"], {"i": 1306975678, "t": "", "c": null, "e": [["tile_f", "sp", [-1, 1, 1, 1]], ["tile_d", "sp", [-1, 5, 1, 4]], ["tile_y", "sp", [-1, 1, 2, 4]], ["tile_x", "sp", [-1, 1, 2, 1]], ["tile_rc", "sp", [-1, 1]], ["tile_rd", "sp", [-1, 3]], ["tile_ry", "sp", [-1, 3]], ["tile_rx", "sp", [-1, 3]], ["auto_unroll_max_step", "ot", 0], ["unroll_explicit", "ot", 1]]}], "r": [[0.05905978275], 0, 2.6399941444396973, 1576295837.2870047], "v": 0.1}
{"i": ["cuda", "schedule_conv3d_transpose_nchw_cuda", [[1, 32, 80, 80, 80], [32, 1, 3, 3, 3], [1, 2, 2], [1, 1, 1], [0, 1, 1], "float32"], {}, ["schedule_conv3d_transpose_nchw_cuda", [1, 32, 80, 80, 80], [32, 1, 3, 3, 3], [1, 2, 2], [1, 1, 1], [0, 1, 1], "float32"], {"i": 1644158398, "t": "", "c": null, "e": [["tile_f", "sp", [-1, 1, 1, 1]], ["tile_d", "sp", [-1, 5, 1, 4]], ["tile_y", "sp", [-1, 1, 2, 4]], ["tile_x", "sp", [-1, 1, 2, 1]], ["tile_rc", "sp", [-1, 1]], ["tile_rd", "sp", [-1, 3]], ["tile_ry", "sp", [-1, 3]], ["tile_rx", "sp", [-1, 3]], ["auto_unroll_max_step", "ot", 512], ["unroll_explicit", "ot", 1]]}], "r": [[0.008917434833333333], 0, 3.328174591064453, 1576295838.5939941], "v": 0.1}
{"i": ["cuda", "schedule_conv3d_transpose_nchw_cuda", [[1, 32, 80, 80, 80], [32, 1, 3, 3, 3], [1, 2, 2], [1, 1, 1], [0, 1, 1], "float32"], {}, ["schedule_conv3d_transpose_nchw_cuda", [1, 32, 80, 80, 80], [32, 1, 3, 3, 3], [1, 2, 2], [1, 1, 1], [0, 1, 1], "float32"], {"i": 295427518, "t": "", "c": null, "e": [["tile_f", "sp", [-1, 1, 1, 1]], ["tile_d", "sp", [-1, 5, 1, 4]], ["tile_y", "sp", [-1, 1, 2, 4]], ["tile_x", "sp", [-1, 1, 2, 1]], ["tile_rc", "sp", [-1, 1]], ["tile_rd", "sp", [-1, 3]], ["tile_ry", "sp", [-1, 3]], ["tile_rx", "sp", [-1, 3]], ["auto_unroll_max_step", "ot", 0], ["unroll_explicit", "ot", 0]]}], "r": [[0.05907792175], 0, 1.9889252185821533, 1576295839.9055076], "v": 0.1}
{"i": ["cuda", "schedule_conv3d_transpose_nchw_cuda", [[1, 32, 80, 80, 80], [32, 1, 3, 3, 3], [1, 2, 2], [1, 1, 1], [0, 1, 1], "float32"], {}, ["schedule_conv3d_transpose_nchw_cuda", [1, 32, 80, 80, 80], [32, 1, 3, 3, 3], [1, 2, 2], [1, 1, 1], [0, 1, 1], "float32"], {"i": 632610210, "t": "", "c": null, "e": [["tile_f", "sp", [-1, 1, 1, 1]], ["tile_d", "sp", [-1, 10, 1, 2]], ["tile_y", "sp", [-1, 1, 2, 4]], ["tile_x", "sp", [-1, 1, 2, 1]], ["tile_rc", "sp", [-1, 1]], ["tile_rd", "sp", [-1, 3]], ["tile_ry", "sp", [-1, 3]], ["tile_rx", "sp", [-1, 3]], ["auto_unroll_max_step", "ot", 512], ["unroll_explicit", "ot", 0]]}], "r": [[0.0260659135], 0, 3.27982759475708, 1576295841.4787161], "v": 0.1}
{"i": ["cuda", "schedule_conv3d_transpose_nchw_cuda", [[1, 32, 80, 80, 80], [32, 1, 3, 3, 3], [1, 2, 2], [1, 1, 1], [0, 1, 1], "float32"], {}, ["schedule_conv3d_transpose_nchw_cuda", [1, 32, 80, 80, 80], [32, 1, 3, 3, 3], [1, 2, 2], [1, 1, 1], [0, 1, 1], "float32"], {"i": 1981341118, "t": "", "c": null, "e": [["tile_f", "sp", [-1, 1, 1, 1]], ["tile_d", "sp", [-1, 5, 1, 4]], ["tile_y", "sp", [-1, 1, 2, 4]], ["tile_x", "sp", [-1, 1, 2, 1]], ["tile_rc", "sp", [-1, 1]], ["tile_rd", "sp", [-1, 3]], ["tile_ry", "sp", [-1, 3]], ["tile_rx", "sp", [-1, 3]], ["auto_unroll_max_step", "ot", 1500], ["unroll_explicit", "ot", 1]]}], "r": [[0.0074554439999999994], 0, 3.2159504890441895, 1576295842.6287956], "v": 0.1}
{"i": ["cuda", "schedule_conv3d_transpose_nchw_cuda", [[1, 32, 80, 80, 80], [32, 1, 3, 3, 3], [1, 2, 2], [1, 1, 1], [0, 1, 1], "float32"], {}, ["schedule_conv3d_transpose_nchw_cuda", [1, 32, 80, 80, 80], [32, 1, 3, 3, 3], [1, 2, 2], [1, 1, 1], [0, 1, 1], "float32"], {"i": 969792958, "t": "", "c": null, "e": [["tile_f", "sp", [-1, 1, 1, 1]], ["tile_d", "sp", [-1, 5, 1, 4]], ["tile_y", "sp", [-1, 1, 2, 4]], ["tile_x", "sp", [-1, 1, 2, 1]], ["tile_rc", "sp", [-1, 1]], ["tile_rd", "sp", [-1, 3]], ["tile_ry", "sp", [-1, 3]], ["tile_rx", "sp", [-1, 3]], ["auto_unroll_max_step", "ot", 1500], ["unroll_explicit", "ot", 0]]}], "r": [[0.04652714125], 0, 4.51586127281189, 1576296154.742416], "v": 0.1}
{"i": ["cuda", "schedule_conv3d_transpose_nchw_cuda", [[1, 32, 80, 80, 80], [32, 1, 3, 3, 3], [1, 2, 2], [1, 1, 1], [0, 1, 1], "float32"], {}, ["schedule_conv3d_transpose_nchw_cuda", [1, 32, 80, 80, 80], [32, 1, 3, 3, 3], [1, 2, 2], [1, 1, 1], [0, 1, 1], "float32"], {"i": 632610238, "t": "", "c": null, "e": [["tile_f", "sp", [-1, 1, 1, 1]], ["tile_d", "sp", [-1, 5, 1, 4]], ["tile_y", "sp", [-1, 1, 2, 4]], ["tile_x", "sp", [-1, 1, 2, 1]], ["tile_rc", "sp", [-1, 1]], ["tile_rd", "sp", [-1, 3]], ["tile_ry", "sp", [-1, 3]], ["tile_rx", "sp", [-1, 3]], ["auto_unroll_max_step", "ot", 512], ["unroll_explicit", "ot", 0]]}], "r": [[0.025846341], 0, 3.326707363128662, 1576296156.3252385], "v": 0.1}
{"i": ["cuda", "schedule_conv3d_transpose_nchw_cuda", [[1, 32, 80, 80, 80], [32, 1, 3, 3, 3], [1, 2, 2], [1, 1, 1], [0, 1, 1], "float32"], {}, ["schedule_conv3d_transpose_nchw_cuda", [1, 32, 80, 80, 80], [32, 1, 3, 3, 3], [1, 2, 2], [1, 1, 1], [0, 1, 1], "float32"], {"i": 969792998, "t": "", "c": null, "e": [["tile_f", "sp", [-1, 1, 1, 1]], ["tile_d", "sp", [-1, 2, 1, 10]], ["tile_y", "sp", [-1, 1, 2, 4]], ["tile_x", "sp", [-1, 1, 2, 1]], ["tile_rc", "sp", [-1, 1]], ["tile_rd", "sp", [-1, 3]], ["tile_ry", "sp", [-1, 3]], ["tile_rx", "sp", [-1, 3]], ["auto_unroll_max_step", "ot", 1500], ["unroll_explicit", "ot", 0]]}], "r": [[0.017559530666666667], 0, 3.6559743881225586, 1576296157.8595634], "v": 0.1}
{"i": ["cuda", "schedule_conv3d_transpose_nchw_cuda", [[1, 32, 80, 80, 80], [32, 1, 3, 3, 3], [1, 2, 2], [1, 1, 1], [0, 1, 1], "float32"], {}, ["schedule_conv3d_transpose_nchw_cuda", [1, 32, 80, 80, 80], [32, 1, 3, 3, 3], [1, 2, 2], [1, 1, 1], [0, 1, 1], "float32"], {"i": 632610278, "t": "", "c": null, "e": [["tile_f", "sp", [-1, 1, 1, 1]], ["tile_d", "sp", [-1, 2, 1, 10]], ["tile_y", "sp", [-1, 1, 2, 4]], ["tile_x", "sp", [-1, 1, 2, 1]], ["tile_rc", "sp", [-1, 1]], ["tile_rd", "sp", [-1, 3]], ["tile_ry", "sp", [-1, 3]], ["tile_rx", "sp", [-1, 3]], ["auto_unroll_max_step", "ot", 512], ["unroll_explicit", "ot", 0]]}], "r": [[0.02868069975], 0, 3.4161417484283447, 1576296159.510945], "v": 0.1}
{"i": ["cuda", "schedule_conv3d_transpose_nchw_cuda", [[1, 32, 80, 80, 80], [32, 1, 3, 3, 3], [1, 2, 2], [1, 1, 1], [0, 1, 1], "float32"], {}, ["schedule_conv3d_transpose_nchw_cuda", [1, 32, 80, 80, 80], [32, 1, 3, 3, 3], [1, 2, 2], [1, 1, 1], [0, 1, 1], "float32"], {"i": 1981341158, "t": "", "c": null, "e": [["tile_f", "sp", [-1, 1, 1, 1]], ["tile_d", "sp", [-1, 2, 1, 10]], ["tile_y", "sp", [-1, 1, 2, 4]], ["tile_x", "sp", [-1, 1, 2, 1]], ["tile_rc", "sp", [-1, 1]], ["tile_rd", "sp", [-1, 3]], ["tile_ry", "sp", [-1, 3]], ["tile_rx", "sp", [-1, 3]], ["auto_unroll_max_step", "ot", 1500], ["unroll_explicit", "ot", 1]]}], "r": [[0.007512379], 0, 3.209421157836914, 1576296160.6546109], "v": 0.1}
{"i": ["cuda", "schedule_conv3d_transpose_nchw_cuda", [[1, 32, 80, 80, 80], [32, 1, 3, 3, 3], [1, 2, 2], [1, 1, 1], [0, 1, 1], "float32"], {}, ["schedule_conv3d_transpose_nchw_cuda", [1, 32, 80, 80, 80], [32, 1, 3, 3, 3], [1, 2, 2], [1, 1, 1], [0, 1, 1], "float32"], {"i": 1644158438, "t": "", "c": null, "e": [["tile_f", "sp", [-1, 1, 1, 1]], ["tile_d", "sp", [-1, 2, 1, 10]], ["tile_y", "sp", [-1, 1, 2, 4]], ["tile_x", "sp", [-1, 1, 2, 1]], ["tile_rc", "sp", [-1, 1]], ["tile_rd", "sp", [-1, 3]], ["tile_ry", "sp", [-1, 3]], ["tile_rx", "sp", [-1, 3]], ["auto_unroll_max_step", "ot", 512], ["unroll_explicit", "ot", 1]]}], "r": [[0.0088656305], 0, 3.2292492389678955, 1576296161.9636784], "v": 0.1}
{"i": ["cuda", "schedule_conv3d_transpose_nchw_cuda", [[1, 32, 80, 80, 80], [32, 1, 3, 3, 3], [1, 2, 2], [1, 1, 1], [0, 1, 1], "float32"], {}, ["schedule_conv3d_transpose_nchw_cuda", [1, 32, 80, 80, 80], [32, 1, 3, 3, 3], [1, 2, 2], [1, 1, 1], [0, 1, 1], "float32"], {"i": 1306975718, "t": "", "c": null, "e": [["tile_f", "sp", [-1, 1, 1, 1]], ["tile_d", "sp", [-1, 2, 1, 10]], ["tile_y", "sp", [-1, 1, 2, 4]], ["tile_x", "sp", [-1, 1, 2, 1]], ["tile_rc", "sp", [-1, 1]], ["tile_rd", "sp", [-1, 3]], ["tile_ry", "sp", [-1, 3]], ["tile_rx", "sp", [-1, 3]], ["auto_unroll_max_step", "ot", 0], ["unroll_explicit", "ot", 1]]}], "r": [[0.059229375], 0, 2.700387716293335, 1576296163.7957618], "v": 0.1}
{"i": ["cuda", "schedule_conv3d_transpose_nchw_cuda", [[1, 32, 80, 80, 80], [32, 1, 3, 3, 3], [1, 2, 2], [1, 1, 1], [0, 1, 1], "float32"], {}, ["schedule_conv3d_transpose_nchw_cuda", [1, 32, 80, 80, 80], [32, 1, 3, 3, 3], [1, 2, 2], [1, 1, 1], [0, 1, 1], "float32"], {"i": 295427558, "t": "", "c": null, "e": [["tile_f", "sp", [-1, 1, 1, 1]], ["tile_d", "sp", [-1, 2, 1, 10]], ["tile_y", "sp", [-1, 1, 2, 4]], ["tile_x", "sp", [-1, 1, 2, 1]], ["tile_rc", "sp", [-1, 1]], ["tile_rd", "sp", [-1, 3]], ["tile_ry", "sp", [-1, 3]], ["tile_rx", "sp", [-1, 3]], ["auto_unroll_max_step", "ot", 0], ["unroll_explicit", "ot", 0]]}], "r": [[0.060028767], 0, 2.085330009460449, 1576296165.5994985], "v": 0.1}
{"i": ["cuda", "schedule_conv3d_transpose_nchw_cuda", [[1, 32, 80, 80, 80], [32, 1, 3, 3, 3], [1, 2, 2], [1, 1, 1], [0, 1, 1], "float32"], {}, ["schedule_conv3d_transpose_nchw_cuda", [1, 32, 80, 80, 80], [32, 1, 3, 3, 3], [1, 2, 2], [1, 1, 1], [0, 1, 1], "float32"], {"i": 969792975, "t": "", "c": null, "e": [["tile_f", "sp", [-1, 1, 1, 1]], ["tile_d", "sp", [-1, 4, 1, 5]], ["tile_y", "sp", [-1, 1, 2, 4]], ["tile_x", "sp", [-1, 1, 2, 1]], ["tile_rc", "sp", [-1, 1]], ["tile_rd", "sp", [-1, 3]], ["tile_ry", "sp", [-1, 3]], ["tile_rx", "sp", [-1, 3]], ["auto_unroll_max_step", "ot", 1500], ["unroll_explicit", "ot", 0]]}], "r": [[0.020275557833333333], 0, 4.442106008529663, 1576296480.4860892], "v": 0.1}
{"i": ["cuda", "schedule_conv3d_transpose_nchw_cuda", [[1, 32, 80, 80, 80], [32, 1, 3, 3, 3], [1, 2, 2], [1, 1, 1], [0, 1, 1], "float32"], {}, ["schedule_conv3d_transpose_nchw_cuda", [1, 32, 80, 80, 80], [32, 1, 3, 3, 3], [1, 2, 2], [1, 1, 1], [0, 1, 1], "float32"], {"i": 1981341135, "t": "", "c": null, "e": [["tile_f", "sp", [-1, 1, 1, 1]], ["tile_d", "sp", [-1, 4, 1, 5]], ["tile_y", "sp", [-1, 1, 2, 4]], ["tile_x", "sp", [-1, 1, 2, 1]], ["tile_rc", "sp", [-1, 1]], ["tile_rd", "sp", [-1, 3]], ["tile_ry", "sp", [-1, 3]], ["tile_rx", "sp", [-1, 3]], ["auto_unroll_max_step", "ot", 1500], ["unroll_explicit", "ot", 1]]}], "r": [[0.007399349642857143], 0, 4.240175247192383, 1576296481.772571], "v": 0.1}
{"i": ["cuda", "schedule_conv3d_transpose_nchw_cuda", [[1, 32, 80, 80, 80], [32, 1, 3, 3, 3], [1, 2, 2], [1, 1, 1], [0, 1, 1], "float32"], {}, ["schedule_conv3d_transpose_nchw_cuda", [1, 32, 80, 80, 80], [32, 1, 3, 3, 3], [1, 2, 2], [1, 1, 1], [0, 1, 1], "float32"], {"i": 1981345037, "t": "", "c": null, "e": [["tile_f", "sp", [-1, 1, 1, 1]], ["tile_d", "sp", [-1, 4, 1, 4]], ["tile_y", "sp", [-1, 1, 2, 5]], ["tile_x", "sp", [-1, 1, 2, 1]], ["tile_rc", "sp", [-1, 1]], ["tile_rd", "sp", [-1, 3]], ["tile_ry", "sp", [-1, 3]], ["tile_rx", "sp", [-1, 3]], ["auto_unroll_max_step", "ot", 1500], ["unroll_explicit", "ot", 1]]}], "r": [[0.0225393755], 0, 8.70381212234497, 1576296488.469455], "v": 0.1}
{"i": ["cuda", "schedule_conv3d_transpose_nchw_cuda", [[1, 32, 80, 80, 80], [32, 1, 3, 3, 3], [1, 2, 2], [1, 1, 1], [0, 1, 1], "float32"], {}, ["schedule_conv3d_transpose_nchw_cuda", [1, 32, 80, 80, 80], [32, 1, 3, 3, 3], [1, 2, 2], [1, 1, 1], [0, 1, 1], "float32"], {"i": 1644162317, "t": "", "c": null, "e": [["tile_f", "sp", [-1, 1, 1, 1]], ["tile_d", "sp", [-1, 4, 1, 4]], ["tile_y", "sp", [-1, 1, 2, 5]], ["tile_x", "sp", [-1, 1, 2, 1]], ["tile_rc", "sp", [-1, 1]], ["tile_rd", "sp", [-1, 3]], ["tile_ry", "sp", [-1, 3]], ["tile_rx", "sp", [-1, 3]], ["auto_unroll_max_step", "ot", 512], ["unroll_explicit", "ot", 1]]}], "r": [[0.0774824515], 0, 6.3572235107421875, 1576296491.1482582], "v": 0.1}
{"i": ["cuda", "schedule_conv3d_transpose_nchw_cuda", [[1, 32, 80, 80, 80], [32, 1, 3, 3, 3], [1, 2, 2], [1, 1, 1], [0, 1, 1], "float32"], {}, ["schedule_conv3d_transpose_nchw_cuda", [1, 32, 80, 80, 80], [32, 1, 3, 3, 3], [1, 2, 2], [1, 1, 1], [0, 1, 1], "float32"], {"i": 1644158415, "t": "", "c": null, "e": [["tile_f", "sp", [-1, 1, 1, 1]], ["tile_d", "sp", [-1, 4, 1, 5]], ["tile_y", "sp", [-1, 1, 2, 4]], ["tile_x", "sp", [-1, 1, 2, 1]], ["tile_rc", "sp", [-1, 1]], ["tile_rd", "sp", [-1, 3]], ["tile_ry", "sp", [-1, 3]], ["tile_rx", "sp", [-1, 3]], ["auto_unroll_max_step", "ot", 512], ["unroll_explicit", "ot", 1]]}], "r": [[0.008897512750000001], 0, 4.312207937240601, 1576296492.4802642], "v": 0.1}
{"i": ["cuda", "schedule_conv3d_transpose_nchw_cuda", [[1, 32, 80, 80, 80], [32, 1, 3, 3, 3], [1, 2, 2], [1, 1, 1], [0, 1, 1], "float32"], {}, ["schedule_conv3d_transpose_nchw_cuda", [1, 32, 80, 80, 80], [32, 1, 3, 3, 3], [1, 2, 2], [1, 1, 1], [0, 1, 1], "float32"], {"i": 1981345038, "t": "", "c": null, "e": [["tile_f", "sp", [-1, 1, 1, 1]], ["tile_d", "sp", [-1, 5, 1, 4]], ["tile_y", "sp", [-1, 1, 2, 5]], ["tile_x", "sp", [-1, 1, 2, 1]], ["tile_rc", "sp", [-1, 1]], ["tile_rd", "sp", [-1, 3]], ["tile_ry", "sp", [-1, 3]], ["tile_rx", "sp", [-1, 3]], ["auto_unroll_max_step", "ot", 1500], ["unroll_explicit", "ot", 1]]}], "r": [[0.0278357085], 0, 8.387070178985596, 1576296494.4023814], "v": 0.1}
{"i": ["cuda", "schedule_conv3d_transpose_nchw_cuda", [[1, 32, 80, 80, 80], [32, 1, 3, 3, 3], [1, 2, 2], [1, 1, 1], [0, 1, 1], "float32"], {}, ["schedule_conv3d_transpose_nchw_cuda", [1, 32, 80, 80, 80], [32, 1, 3, 3, 3], [1, 2, 2], [1, 1, 1], [0, 1, 1], "float32"], {"i": 1644162318, "t": "", "c": null, "e": [["tile_f", "sp", [-1, 1, 1, 1]], ["tile_d", "sp", [-1, 5, 1, 4]], ["tile_y", "sp", [-1, 1, 2, 5]], ["tile_x", "sp", [-1, 1, 2, 1]], ["tile_rc", "sp", [-1, 1]], ["tile_rd", "sp", [-1, 3]], ["tile_ry", "sp", [-1, 3]], ["tile_rx", "sp", [-1, 3]], ["auto_unroll_max_step", "ot", 512], ["unroll_explicit", "ot", 1]]}], "r": [[0.0905921985], 0, 7.1272873878479, 1576296497.6117165], "v": 0.1}
{"i": ["cuda", "schedule_conv3d_transpose_nchw_cuda", [[1, 32, 80, 80, 80], [32, 1, 3, 3, 3], [1, 2, 2], [1, 1, 1], [0, 1, 1], "float32"], {}, ["schedule_conv3d_transpose_nchw_cuda", [1, 32, 80, 80, 80], [32, 1, 3, 3, 3], [1, 2, 2], [1, 1, 1], [0, 1, 1], "float32"], {"i": 634527086, "t": "", "c": null, "e": [["tile_f", "sp", [-1, 1, 1, 1]], ["tile_d", "sp", [-1, 2, 1, 2]], ["tile_y", "sp", [-1, 1, 2, 5]], ["tile_x", "sp", [-1, 1, 2, 2]], ["tile_rc", "sp", [-1, 1]], ["tile_rd", "sp", [-1, 3]], ["tile_ry", "sp", [-1, 3]], ["tile_rx", "sp", [-1, 3]], ["auto_unroll_max_step", "ot", 512], ["unroll_explicit", "ot", 0]]}], "r": [[0.009720056636363637], 0, 2.8151681423187256, 1576296498.8030357], "v": 0.1}
{"i": ["cuda", "schedule_conv3d_transpose_nchw_cuda", [[1, 32, 80, 80, 80], [32, 1, 3, 3, 3], [1, 2, 2], [1, 1, 1], [0, 1, 1], "float32"], {}, ["schedule_conv3d_transpose_nchw_cuda", [1, 32, 80, 80, 80], [32, 1, 3, 3, 3], [1, 2, 2], [1, 1, 1], [0, 1, 1], "float32"], {"i": 971709806, "t": "", "c": null, "e": [["tile_f", "sp", [-1, 1, 1, 1]], ["tile_d", "sp", [-1, 2, 1, 2]], ["tile_y", "sp", [-1, 1, 2, 5]], ["tile_x", "sp", [-1, 1, 2, 2]], ["tile_rc", "sp", [-1, 1]], ["tile_rd", "sp", [-1, 3]], ["tile_ry", "sp", [-1, 3]], ["tile_rx", "sp", [-1, 3]], ["auto_unroll_max_step", "ot", 1500], ["unroll_explicit", "ot", 0]]}], "r": [[0.019461363333333332], 0, 4.796235084533691, 1576296500.3297575], "v": 0.1}
{"i": ["cuda", "schedule_conv3d_transpose_nchw_cuda", [[1, 32, 80, 80, 80], [32, 1, 3, 3, 3], [1, 2, 2], [1, 1, 1], [0, 1, 1], "float32"], {}, ["schedule_conv3d_transpose_nchw_cuda", [1, 32, 80, 80, 80], [32, 1, 3, 3, 3], [1, 2, 2], [1, 1, 1], [0, 1, 1], "float32"], {"i": 1651223605, "t": "", "c": null, "e": [["tile_f", "sp", [-1, 1, 1, 1]], ["tile_d", "sp", [-1, 1, 1, 2]], ["tile_y", "sp", [-1, 1, 2, 10]], ["tile_x", "sp", [-1, 2, 2, 1]], ["tile_rc", "sp", [-1, 2]], ["tile_rd", "sp", [-1, 3]], ["tile_ry", "sp", [-1, 3]], ["tile_rx", "sp", [-1, 3]], ["auto_unroll_max_step", "ot", 512], ["unroll_explicit", "ot", 1]]}], "r": [[0.007496299894736842], 0, 3.3660426139831543, 1576296783.1041615], "v": 0.1}
{"i": ["cuda", "schedule_conv3d_transpose_nchw_cuda", [[1, 32, 80, 80, 80], [32, 1, 3, 3, 3], [1, 2, 2], [1, 1, 1], [0, 1, 1], "float32"], {}, ["schedule_conv3d_transpose_nchw_cuda", [1, 32, 80, 80, 80], [32, 1, 3, 3, 3], [1, 2, 2], [1, 1, 1], [0, 1, 1], "float32"], {"i": 1988406325, "t": "", "c": null, "e": [["tile_f", "sp", [-1, 1, 1, 1]], ["tile_d", "sp", [-1, 1, 1, 2]], ["tile_y", "sp", [-1, 1, 2, 10]], ["tile_x", "sp", [-1, 2, 2, 1]], ["tile_rc", "sp", [-1, 2]], ["tile_rd", "sp", [-1, 3]], ["tile_ry", "sp", [-1, 3]], ["tile_rx", "sp", [-1, 3]], ["auto_unroll_max_step", "ot", 1500], ["unroll_explicit", "ot", 1]]}], "r": [[0.007182552071428571], 0, 4.450185060501099, 1576296784.2636304], "v": 0.1}
{"i": ["cuda", "schedule_conv3d_transpose_nchw_cuda", [[1, 32, 80, 80, 80], [32, 1, 3, 3, 3], [1, 2, 2], [1, 1, 1], [0, 1, 1], "float32"], {}, ["schedule_conv3d_transpose_nchw_cuda", [1, 32, 80, 80, 80], [32, 1, 3, 3, 3], [1, 2, 2], [1, 1, 1], [0, 1, 1], "float32"], {"i": 1653105205, "t": "", "c": null, "e": [["tile_f", "sp", [-1, 1, 1, 1]], ["tile_d", "sp", [-1, 1, 1, 2]], ["tile_y", "sp", [-1, 1, 2, 10]], ["tile_x", "sp", [-1, 1, 2, 2]], ["tile_rc", "sp", [-1, 2]], ["tile_rd", "sp", [-1, 3]], ["tile_ry", "sp", [-1, 3]], ["tile_rx", "sp", [-1, 3]], ["auto_unroll_max_step", "ot", 512], ["unroll_explicit", "ot", 1]]}], "r": [[0.002152478765957447], 0, 2.007904291152954, 1576296785.188968], "v": 0.1}
{"i": ["cuda", "schedule_conv3d_transpose_nchw_cuda", [[1, 32, 80, 80, 80], [32, 1, 3, 3, 3], [1, 2, 2], [1, 1, 1], [0, 1, 1], "float32"], {}, ["schedule_conv3d_transpose_nchw_cuda", [1, 32, 80, 80, 80], [32, 1, 3, 3, 3], [1, 2, 2], [1, 1, 1], [0, 1, 1], "float32"], {"i": 1990287925, "t": "", "c": null, "e": [["tile_f", "sp", [-1, 1, 1, 1]], ["tile_d", "sp", [-1, 1, 1, 2]], ["tile_y", "sp", [-1, 1, 2, 10]], ["tile_x", "sp", [-1, 1, 2, 2]], ["tile_rc", "sp", [-1, 2]], ["tile_rd", "sp", [-1, 3]], ["tile_ry", "sp", [-1, 3]], ["tile_rx", "sp", [-1, 3]], ["auto_unroll_max_step", "ot", 1500], ["unroll_explicit", "ot", 1]]}], "r": [[0.0021759278695652174], 0, 2.499417781829834, 1576296786.0995457], "v": 0.1}
{"i": ["cuda", "schedule_conv3d_transpose_nchw_cuda", [[1, 32, 80, 80, 80], [32, 1, 3, 3, 3], [1, 2, 2], [1, 1, 1], [0, 1, 1], "float32"], {}, ["schedule_conv3d_transpose_nchw_cuda", [1, 32, 80, 80, 80], [32, 1, 3, 3, 3], [1, 2, 2], [1, 1, 1], [0, 1, 1], "float32"], {"i": 1988679326, "t": "", "c": null, "e": [["tile_f", "sp", [-1, 1, 1, 1]], ["tile_d", "sp", [-1, 2, 1, 2]], ["tile_y", "sp", [-1, 1, 2, 4]], ["tile_x", "sp", [-1, 1, 4, 1]], ["tile_rc", "sp", [-1, 2]], ["tile_rd", "sp", [-1, 3]], ["tile_ry", "sp", [-1, 3]], ["tile_rx", "sp", [-1, 3]], ["auto_unroll_max_step", "ot", 1500], ["unroll_explicit", "ot", 1]]}], "r": [[0.00270669772972973], 0, 4.14262318611145, 1576296787.1875148], "v": 0.1}
{"i": ["cuda", "schedule_conv3d_transpose_nchw_cuda", [[1, 32, 80, 80, 80], [32, 1, 3, 3, 3], [1, 2, 2], [1, 1, 1], [0, 1, 1], "float32"], {}, ["schedule_conv3d_transpose_nchw_cuda", [1, 32, 80, 80, 80], [32, 1, 3, 3, 3], [1, 2, 2], [1, 1, 1], [0, 1, 1], "float32"], {"i": 1651496606, "t": "", "c": null, "e": [["tile_f", "sp", [-1, 1, 1, 1]], ["tile_d", "sp", [-1, 2, 1, 2]], ["tile_y", "sp", [-1, 1, 2, 4]], ["tile_x", "sp", [-1, 1, 4, 1]], ["tile_rc", "sp", [-1, 2]], ["tile_rd", "sp", [-1, 3]], ["tile_ry", "sp", [-1, 3]], ["tile_rx", "sp", [-1, 3]], ["auto_unroll_max_step", "ot", 512], ["unroll_explicit", "ot", 1]]}], "r": [[0.002830655055555556], 0, 3.1167192459106445, 1576296788.1551652], "v": 0.1}
{"i": ["cuda", "schedule_conv3d_transpose_nchw_cuda", [[1, 32, 80, 80, 80], [32, 1, 3, 3, 3], [1, 2, 2], [1, 1, 1], [0, 1, 1], "float32"], {}, ["schedule_conv3d_transpose_nchw_cuda", [1, 32, 80, 80, 80], [32, 1, 3, 3, 3], [1, 2, 2], [1, 1, 1], [0, 1, 1], "float32"], {"i": 1653096013, "t": "", "c": null, "e": [["tile_f", "sp", [-1, 1, 1, 1]], ["tile_d", "sp", [-1, 1, 1, 5]], ["tile_y", "sp", [-1, 1, 2, 4]], ["tile_x", "sp", [-1, 1, 2, 2]], ["tile_rc", "sp", [-1, 2]], ["tile_rd", "sp", [-1, 3]], ["tile_ry", "sp", [-1, 3]], ["tile_rx", "sp", [-1, 3]], ["auto_unroll_max_step", "ot", 512], ["unroll_explicit", "ot", 1]]}], "r": [[0.0020319561], 0, 2.675071954727173, 1576296789.0970304], "v": 0.1}
{"i": ["cuda", "schedule_conv3d_transpose_nchw_cuda", [[1, 32, 80, 80, 80], [32, 1, 3, 3, 3], [1, 2, 2], [1, 1, 1], [0, 1, 1], "float32"], {}, ["schedule_conv3d_transpose_nchw_cuda", [1, 32, 80, 80, 80], [32, 1, 3, 3, 3], [1, 2, 2], [1, 1, 1], [0, 1, 1], "float32"], {"i": 1990278733, "t": "", "c": null, "e": [["tile_f", "sp", [-1, 1, 1, 1]], ["tile_d", "sp", [-1, 1, 1, 5]], ["tile_y", "sp", [-1, 1, 2, 4]], ["tile_x", "sp", [-1, 1, 2, 2]], ["tile_rc", "sp", [-1, 2]], ["tile_rd", "sp", [-1, 3]], ["tile_ry", "sp", [-1, 3]], ["tile_rx", "sp", [-1, 3]], ["auto_unroll_max_step", "ot", 1500], ["unroll_explicit", "ot", 1]]}], "r": [[0.0020616235102040815], 0, 2.873997926712036, 1576296790.0859933], "v": 0.1}
{"i": ["cuda", "schedule_conv3d_transpose_nchw_cuda", [[1, 32, 80, 80, 80], [32, 1, 3, 3, 3], [1, 2, 2], [1, 1, 1], [0, 1, 1], "float32"], {}, ["schedule_conv3d_transpose_nchw_cuda", [1, 32, 80, 80, 80], [32, 1, 3, 3, 3], [1, 2, 2], [1, 1, 1], [0, 1, 1], "float32"], {"i": 1992499226, "t": "", "c": null, "e": [["tile_f", "sp", [-1, 1, 1, 1]], ["tile_d", "sp", [-1, 2, 1, 2]], ["tile_y", "sp", [-1, 1, 2, 2]], ["tile_x", "sp", [-1, 1, 2, 5]], ["tile_rc", "sp", [-1, 2]], ["tile_rd", "sp", [-1, 3]], ["tile_ry", "sp", [-1, 3]], ["tile_rx", "sp", [-1, 3]], ["auto_unroll_max_step", "ot", 1500], ["unroll_explicit", "ot", 1]]}], "r": [[0.005974164], 0, 4.562077045440674, 1576296791.239255], "v": 0.1}
{"i": ["cuda", "schedule_conv3d_transpose_nchw_cuda", [[1, 32, 80, 80, 80], [32, 1, 3, 3, 3], [1, 2, 2], [1, 1, 1], [0, 1, 1], "float32"], {}, ["schedule_conv3d_transpose_nchw_cuda", [1, 32, 80, 80, 80], [32, 1, 3, 3, 3], [1, 2, 2], [1, 1, 1], [0, 1, 1], "float32"], {"i": 1655316506, "t": "", "c": null, "e": [["tile_f", "sp", [-1, 1, 1, 1]], ["tile_d", "sp", [-1, 2, 1, 2]], ["tile_y", "sp", [-1, 1, 2, 2]], ["tile_x", "sp", [-1, 1, 2, 5]], ["tile_rc", "sp", [-1, 2]], ["tile_rd", "sp", [-1, 3]], ["tile_ry", "sp", [-1, 3]], ["tile_rx", "sp", [-1, 3]], ["auto_unroll_max_step", "ot", 512], ["unroll_explicit", "ot", 1]]}], "r": [[0.005670862722222222], 0, 3.047450065612793, 1576296792.3062236], "v": 0.1}
{"i": ["cuda", "schedule_conv3d_transpose_nchw_cuda", [[1, 32, 80, 80, 80], [32, 1, 3, 3, 3], [1, 2, 2], [1, 1, 1], [0, 1, 1], "float32"], {}, ["schedule_conv3d_transpose_nchw_cuda", [1, 32, 80, 80, 80], [32, 1, 3, 3, 3], [1, 2, 2], [1, 1, 1], [0, 1, 1], "float32"], {"i": 1991627165, "t": "", "c": null, "e": [["tile_f", "sp", [-1, 1, 1, 1]], ["tile_d", "sp", [-1, 1, 1, 2]], ["tile_y", "sp", [-1, 1, 2, 4]], ["tile_x", "sp", [-1, 1, 2, 4]], ["tile_rc", "sp", [-1, 2]], ["tile_rd", "sp", [-1, 3]], ["tile_ry", "sp", [-1, 3]], ["tile_rx", "sp", [-1, 3]], ["auto_unroll_max_step", "ot", 1500], ["unroll_explicit", "ot", 1]]}], "r": [[0.0015616498446601942], 0, 2.7452356815338135, 1576296793.4881523], "v": 0.1}
{"i": ["cuda", "schedule_conv3d_transpose_nchw_cuda", [[1, 32, 80, 80, 80], [32, 1, 3, 3, 3], [1, 2, 2], [1, 1, 1], [0, 1, 1], "float32"], {}, ["schedule_conv3d_transpose_nchw_cuda", [1, 32, 80, 80, 80], [32, 1, 3, 3, 3], [1, 2, 2], [1, 1, 1], [0, 1, 1], "float32"], {"i": 1654444445, "t": "", "c": null, "e": [["tile_f", "sp", [-1, 1, 1, 1]], ["tile_d", "sp", [-1, 1, 1, 2]], ["tile_y", "sp", [-1, 1, 2, 4]], ["tile_x", "sp", [-1, 1, 2, 4]], ["tile_rc", "sp", [-1, 2]], ["tile_rd", "sp", [-1, 3]], ["tile_ry", "sp", [-1, 3]], ["tile_rx", "sp", [-1, 3]], ["auto_unroll_max_step", "ot", 512], ["unroll_explicit", "ot", 1]]}], "r": [[0.0014858145294117647], 0, 2.2003300189971924, 1576296794.389084], "v": 0.1}
{"i": ["cuda", "schedule_conv3d_transpose_nchw_cuda", [[1, 32, 80, 80, 80], [32, 1, 3, 3, 3], [1, 2, 2], [1, 1, 1], [0, 1, 1], "float32"], {}, ["schedule_conv3d_transpose_nchw_cuda", [1, 32, 80, 80, 80], [32, 1, 3, 3, 3], [1, 2, 2], [1, 1, 1], [0, 1, 1], "float32"], {"i": 1648291866, "t": "", "c": null, "e": [["tile_f", "sp", [-1, 1, 1, 1]], ["tile_d", "sp", [-1, 2, 1, 2]], ["tile_y", "sp", [-1, 1, 2, 2]], ["tile_x", "sp", [-1, 1, 2, 5]], ["tile_rc", "sp", [-1, 1]], ["tile_rd", "sp", [-1, 3]], ["tile_ry", "sp", [-1, 3]], ["tile_rx", "sp", [-1, 3]], ["auto_unroll_max_step", "ot", 512], ["unroll_explicit", "ot", 1]]}], "r": [[0.006171671833333333], 0, 2.9693095684051514, 1576296800.524184], "v": 0.1}
{"i": ["cuda", "schedule_conv3d_transpose_nchw_cuda", [[1, 32, 80, 80, 80], [32, 1, 3, 3, 3], [1, 2, 2], [1, 1, 1], [0, 1, 1], "float32"], {}, ["schedule_conv3d_transpose_nchw_cuda", [1, 32, 80, 80, 80], [32, 1, 3, 3, 3], [1, 2, 2], [1, 1, 1], [0, 1, 1], "float32"], {"i": 1985474586, "t": "", "c": null, "e": [["tile_f", "sp", [-1, 1, 1, 1]], ["tile_d", "sp", [-1, 2, 1, 2]], ["tile_y", "sp", [-1, 1, 2, 2]], ["tile_x", "sp", [-1, 1, 2, 5]], ["tile_rc", "sp", [-1, 1]], ["tile_rd", "sp", [-1, 3]], ["tile_ry", "sp", [-1, 3]], ["tile_rx", "sp", [-1, 3]], ["auto_unroll_max_step", "ot", 1500], ["unroll_explicit", "ot", 1]]}], "r": [[0.0066195316875], 0, 4.508450269699097, 1576296801.713002], "v": 0.1}
{"i": ["cuda", "schedule_conv3d_transpose_nchw_cuda", [[1, 32, 80, 80, 80], [32, 1, 3, 3, 3], [1, 2, 2], [1, 1, 1], [0, 1, 1], "float32"], {}, ["schedule_conv3d_transpose_nchw_cuda", [1, 32, 80, 80, 80], [32, 1, 3, 3, 3], [1, 2, 2], [1, 1, 1], [0, 1, 1], "float32"], {"i": 1653121306, "t": "", "c": null, "e": [["tile_f", "sp", [-1, 1, 1, 1]], ["tile_d", "sp", [-1, 2, 1, 2]], ["tile_y", "sp", [-1, 1, 2, 2]], ["tile_x", "sp", [-1, 2, 2, 2]], ["tile_rc", "sp", [-1, 2]], ["tile_rd", "sp", [-1, 3]], ["tile_ry", "sp", [-1, 3]], ["tile_rx", "sp", [-1, 3]], ["auto_unroll_max_step", "ot", 512], ["unroll_explicit", "ot", 1]]}], "r": [[0.0015983281746031746], 0, 1.8887245655059814, 1576296802.6158], "v": 0.1}
{"i": ["cuda", "schedule_conv3d_transpose_nchw_cuda", [[1, 32, 80, 80, 80], [32, 1, 3, 3, 3], [1, 2, 2], [1, 1, 1], [0, 1, 1], "float32"], {}, ["schedule_conv3d_transpose_nchw_cuda", [1, 32, 80, 80, 80], [32, 1, 3, 3, 3], [1, 2, 2], [1, 1, 1], [0, 1, 1], "float32"], {"i": 1990304026, "t": "", "c": null, "e": [["tile_f", "sp", [-1, 1, 1, 1]], ["tile_d", "sp", [-1, 2, 1, 2]], ["tile_y", "sp", [-1, 1, 2, 2]], ["tile_x", "sp", [-1, 2, 2, 2]], ["tile_rc", "sp", [-1, 2]], ["tile_rd", "sp", [-1, 3]], ["tile_ry", "sp", [-1, 3]], ["tile_rx", "sp", [-1, 3]], ["auto_unroll_max_step", "ot", 1500], ["unroll_explicit", "ot", 1]]}], "r": [[0.0016590022950819672], 0, 2.149726629257202, 1576296803.522012], "v": 0.1}
{"i": ["cuda", "schedule_conv3d_transpose_nchw_cuda", [[1, 32, 80, 80, 80], [32, 1, 3, 3, 3], [1, 2, 2], [1, 1, 1], [0, 1, 1], "float32"], {}, ["schedule_conv3d_transpose_nchw_cuda", [1, 32, 80, 80, 80], [32, 1, 3, 3, 3], [1, 2, 2], [1, 1, 1], [0, 1, 1], "float32"], {"i": 1653127325, "t": "", "c": null, "e": [["tile_f", "sp", [-1, 1, 1, 1]], ["tile_d", "sp", [-1, 1, 1, 2]], ["tile_y", "sp", [-1, 1, 2, 4]], ["tile_x", "sp", [-1, 2, 2, 2]], ["tile_rc", "sp", [-1, 2]], ["tile_rd", "sp", [-1, 3]], ["tile_ry", "sp", [-1, 3]], ["tile_rx", "sp", [-1, 3]], ["auto_unroll_max_step", "ot", 512], ["unroll_explicit", "ot", 1]]}], "r": [[0.0015269877727272728], 0, 2.016374111175537, 1576296804.4446168], "v": 0.1}
{"i": ["cuda", "schedule_conv3d_transpose_nchw_cuda", [[1, 32, 80, 80, 80], [32, 1, 3, 3, 3], [1, 2, 2], [1, 1, 1], [0, 1, 1], "float32"], {}, ["schedule_conv3d_transpose_nchw_cuda", [1, 32, 80, 80, 80], [32, 1, 3, 3, 3], [1, 2, 2], [1, 1, 1], [0, 1, 1], "float32"], {"i": 1990310045, "t": "", "c": null, "e": [["tile_f", "sp", [-1, 1, 1, 1]], ["tile_d", "sp", [-1, 1, 1, 2]], ["tile_y", "sp", [-1, 1, 2, 4]], ["tile_x", "sp", [-1, 2, 2, 2]], ["tile_rc", "sp", [-1, 2]], ["tile_rd", "sp", [-1, 3]], ["tile_ry", "sp", [-1, 3]], ["tile_rx", "sp", [-1, 3]], ["auto_unroll_max_step", "ot", 1500], ["unroll_explicit", "ot", 1]]}], "r": [[0.0016272927741935483], 0, 2.3013947010040283, 1576296805.3598495], "v": 0.1}
{"i": ["cuda", "schedule_conv3d_transpose_nchw_cuda", [[1, 32, 80, 80, 80], [32, 1, 3, 3, 3], [1, 2, 2], [1, 1, 1], [0, 1, 1], "float32"], {}, ["schedule_conv3d_transpose_nchw_cuda", [1, 32, 80, 80, 80], [32, 1, 3, 3, 3], [1, 2, 2], [1, 1, 1], [0, 1, 1], "float32"], {"i": 1981341090, "t": "", "c": null, "e": [["tile_f", "sp", [-1, 1, 1, 1]], ["tile_d", "sp", [-1, 10, 1, 2]], ["tile_y", "sp", [-1, 1, 2, 4]], ["tile_x", "sp", [-1, 1, 2, 1]], ["tile_rc", "sp", [-1, 1]], ["tile_rd", "sp", [-1, 3]], ["tile_ry", "sp", [-1, 3]], ["tile_rx", "sp", [-1, 3]], ["auto_unroll_max_step", "ot", 1500], ["unroll_explicit", "ot", 1]]}], "r": [[0.0075276935], 0, 3.7986133098602295, 1576296806.523922], "v": 0.1}
{"i": ["cuda", "schedule_conv3d_transpose_nchw_cuda", [[1, 32, 80, 80, 80], [32, 1, 3, 3, 3], [1, 2, 2], [1, 1, 1], [0, 1, 1], "float32"], {}, ["schedule_conv3d_transpose_nchw_cuda", [1, 32, 80, 80, 80], [32, 1, 3, 3, 3], [1, 2, 2], [1, 1, 1], [0, 1, 1], "float32"], {"i": 1651496653, "t": "", "c": null, "e": [["tile_f", "sp", [-1, 1, 1, 1]], ["tile_d", "sp", [-1, 1, 1, 5]], ["tile_y", "sp", [-1, 1, 2, 4]], ["tile_x", "sp", [-1, 1, 4, 1]], ["tile_rc", "sp", [-1, 2]], ["tile_rd", "sp", [-1, 3]], ["tile_ry", "sp", [-1, 3]], ["tile_rx", "sp", [-1, 3]], ["auto_unroll_max_step", "ot", 512], ["unroll_explicit", "ot", 1]]}], "r": [[0.003233662612903226], 0, 2.711805582046509, 1576296807.55051], "v": 0.1}
{"i": ["cuda", "schedule_conv3d_transpose_nchw_cuda", [[1, 32, 80, 80, 80], [32, 1, 3, 3, 3], [1, 2, 2], [1, 1, 1], [0, 1, 1], "float32"], {}, ["schedule_conv3d_transpose_nchw_cuda", [1, 32, 80, 80, 80], [32, 1, 3, 3, 3], [1, 2, 2], [1, 1, 1], [0, 1, 1], "float32"], {"i": 1988679373, "t": "", "c": null, "e": [["tile_f", "sp", [-1, 1, 1, 1]], ["tile_d", "sp", [-1, 1, 1, 5]], ["tile_y", "sp", [-1, 1, 2, 4]], ["tile_x", "sp", [-1, 1, 4, 1]], ["tile_rc", "sp", [-1, 2]], ["tile_rd", "sp", [-1, 3]], ["tile_ry", "sp", [-1, 3]], ["tile_rx", "sp", [-1, 3]], ["auto_unroll_max_step", "ot", 1500], ["unroll_explicit", "ot", 1]]}], "r": [[0.0033740837666666667], 0, 5.328728914260864, 1576296808.8195212], "v": 0.1}
{"i": ["cuda", "schedule_conv3d_transpose_nchw_cuda", [[1, 32, 80, 80, 80], [32, 1, 3, 3, 3], [1, 2, 2], [1, 1, 1], [0, 1, 1], "float32"], {}, ["schedule_conv3d_transpose_nchw_cuda", [1, 32, 80, 80, 80], [32, 1, 3, 3, 3], [1, 2, 2], [1, 1, 1], [0, 1, 1], "float32"], {"i": 1990313965, "t": "", "c": null, "e": [["tile_f", "sp", [-1, 1, 1, 1]], ["tile_d", "sp", [-1, 1, 1, 2]], ["tile_y", "sp", [-1, 1, 2, 5]], ["tile_x", "sp", [-1, 2, 2, 2]], ["tile_rc", "sp", [-1, 2]], ["tile_rd", "sp", [-1, 3]], ["tile_ry", "sp", [-1, 3]], ["tile_rx", "sp", [-1, 3]], ["auto_unroll_max_step", "ot", 1500], ["unroll_explicit", "ot", 1]]}], "r": [[0.0059386944705882355], 0, 4.2865917682647705, 1576296809.9894245], "v": 0.1}
{"i": ["cuda", "schedule_conv3d_transpose_nchw_cuda", [[1, 32, 80, 80, 80], [32, 1, 3, 3, 3], [1, 2, 2], [1, 1, 1], [0, 1, 1], "float32"], {}, ["schedule_conv3d_transpose_nchw_cuda", [1, 32, 80, 80, 80], [32, 1, 3, 3, 3], [1, 2, 2], [1, 1, 1], [0, 1, 1], "float32"], {"i": 1653131245, "t": "", "c": null, "e": [["tile_f", "sp", [-1, 1, 1, 1]], ["tile_d", "sp", [-1, 1, 1, 2]], ["tile_y", "sp", [-1, 1, 2, 5]], ["tile_x", "sp", [-1, 2, 2, 2]], ["tile_rc", "sp", [-1, 2]], ["tile_rd", "sp", [-1, 3]], ["tile_ry", "sp", [-1, 3]], ["tile_rx", "sp", [-1, 3]], ["auto_unroll_max_step", "ot", 512], ["unroll_explicit", "ot", 1]]}], "r": [[0.005734923722222222], 0, 3.0089941024780273, 1576296811.0563877], "v": 0.1}
{"i": ["cuda", "schedule_conv3d_transpose_nchw_cuda", [[1, 32, 80, 80, 80], [32, 1, 3, 3, 3], [1, 2, 2], [1, 1, 1], [0, 1, 1], "float32"], {}, ["schedule_conv3d_transpose_nchw_cuda", [1, 32, 80, 80, 80], [32, 1, 3, 3, 3], [1, 2, 2], [1, 1, 1], [0, 1, 1], "float32"], {"i": 1651505845, "t": "", "c": null, "e": [["tile_f", "sp", [-1, 1, 1, 1]], ["tile_d", "sp", [-1, 1, 1, 2]], ["tile_y", "sp", [-1, 1, 2, 10]], ["tile_x", "sp", [-1, 1, 4, 1]], ["tile_rc", "sp", [-1, 2]], ["tile_rd", "sp", [-1, 3]], ["tile_ry", "sp", [-1, 3]], ["tile_rx", "sp", [-1, 3]], ["auto_unroll_max_step", "ot", 512], ["unroll_explicit", "ot", 1]]}], "r": [[0.0032887216774193546], 0, 2.275749444961548, 1576296811.9839082], "v": 0.1}
{"i": ["cuda", "schedule_conv3d_transpose_nchw_cuda", [[1, 32, 80, 80, 80], [32, 1, 3, 3, 3], [1, 2, 2], [1, 1, 1], [0, 1, 1], "float32"], {}, ["schedule_conv3d_transpose_nchw_cuda", [1, 32, 80, 80, 80], [32, 1, 3, 3, 3], [1, 2, 2], [1, 1, 1], [0, 1, 1], "float32"], {"i": 1653346845, "t": "", "c": null, "e": [["tile_f", "sp", [-1, 1, 1, 1]], ["tile_d", "sp", [-1, 1, 1, 2]], ["tile_y", "sp", [-1, 1, 2, 4]], ["tile_x", "sp", [-1, 1, 4, 2]], ["tile_rc", "sp", [-1, 2]], ["tile_rd", "sp", [-1, 3]], ["tile_ry", "sp", [-1, 3]], ["tile_rx", "sp", [-1, 3]], ["auto_unroll_max_step", "ot", 512], ["unroll_explicit", "ot", 1]]}], "r": [[0.001378766], 0, 1.7552688121795654, 1576296822.566924], "v": 0.1}
{"i": ["cuda", "schedule_conv3d_transpose_nchw_cuda", [[1, 32, 80, 80, 80], [32, 1, 3, 3, 3], [1, 2, 2], [1, 1, 1], [0, 1, 1], "float32"], {}, ["schedule_conv3d_transpose_nchw_cuda", [1, 32, 80, 80, 80], [32, 1, 3, 3, 3], [1, 2, 2], [1, 1, 1], [0, 1, 1], "float32"], {"i": 1990529565, "t": "", "c": null, "e": [["tile_f", "sp", [-1, 1, 1, 1]], ["tile_d", "sp", [-1, 1, 1, 2]], ["tile_y", "sp", [-1, 1, 2, 4]], ["tile_x", "sp", [-1, 1, 4, 2]], ["tile_rc", "sp", [-1, 2]], ["tile_rd", "sp", [-1, 3]], ["tile_ry", "sp", [-1, 3]], ["tile_rx", "sp", [-1, 3]], ["auto_unroll_max_step", "ot", 1500], ["unroll_explicit", "ot", 1]]}], "r": [[0.001300179435483871], 0, 2.1706297397613525, 1576296823.7702796], "v": 0.1}
{"i": ["cuda", "schedule_conv3d_transpose_nchw_cuda", [[1, 32, 80, 80, 80], [32, 1, 3, 3, 3], [1, 2, 2], [1, 1, 1], [0, 1, 1], "float32"], {}, ["schedule_conv3d_transpose_nchw_cuda", [1, 32, 80, 80, 80], [32, 1, 3, 3, 3], [1, 2, 2], [1, 1, 1], [0, 1, 1], "float32"], {"i": 1988683246, "t": "", "c": null, "e": [["tile_f", "sp", [-1, 1, 1, 1]], ["tile_d", "sp", [-1, 2, 1, 2]], ["tile_y", "sp", [-1, 1, 2, 5]], ["tile_x", "sp", [-1, 1, 4, 1]], ["tile_rc", "sp", [-1, 2]], ["tile_rd", "sp", [-1, 3]], ["tile_ry", "sp", [-1, 3]], ["tile_rx", "sp", [-1, 3]], ["auto_unroll_max_step", "ot", 1500], ["unroll_explicit", "ot", 1]]}], "r": [[0.011809222222222223], 0, 10.582756280899048, 1576296825.4436595], "v": 0.1}
{"i": ["cuda", "schedule_conv3d_transpose_nchw_cuda", [[1, 32, 80, 80, 80], [32, 1, 3, 3, 3], [1, 2, 2], [1, 1, 1], [0, 1, 1], "float32"], {}, ["schedule_conv3d_transpose_nchw_cuda", [1, 32, 80, 80, 80], [32, 1, 3, 3, 3], [1, 2, 2], [1, 1, 1], [0, 1, 1], "float32"], {"i": 1651500526, "t": "", "c": null, "e": [["tile_f", "sp", [-1, 1, 1, 1]], ["tile_d", "sp", [-1, 2, 1, 2]], ["tile_y", "sp", [-1, 1, 2, 5]], ["tile_x", "sp", [-1, 1, 4, 1]], ["tile_rc", "sp", [-1, 2]], ["tile_rd", "sp", [-1, 3]], ["tile_ry", "sp", [-1, 3]], ["tile_rx", "sp", [-1, 3]], ["auto_unroll_max_step", "ot", 512], ["unroll_explicit", "ot", 1]]}], "r": [[0.007335429357142857], 0, 3.7636921405792236, 1576296826.6187227], "v": 0.1}
{"i": ["cuda", "schedule_conv3d_transpose_nchw_cuda", [[1, 32, 80, 80, 80], [32, 1, 3, 3, 3], [1, 2, 2], [1, 1, 1], [0, 1, 1], "float32"], {}, ["schedule_conv3d_transpose_nchw_cuda", [1, 32, 80, 80, 80], [32, 1, 3, 3, 3], [1, 2, 2], [1, 1, 1], [0, 1, 1], "float32"], {"i": 1990282606, "t": "", "c": null, "e": [["tile_f", "sp", [-1, 1, 1, 1]], ["tile_d", "sp", [-1, 2, 1, 2]], ["tile_y", "sp", [-1, 1, 2, 5]], ["tile_x", "sp", [-1, 1, 2, 2]], ["tile_rc", "sp", [-1, 2]], ["tile_rd", "sp", [-1, 3]], ["tile_ry", "sp", [-1, 3]], ["tile_rx", "sp", [-1, 3]], ["auto_unroll_max_step", "ot", 1500], ["unroll_explicit", "ot", 1]]}], "r": [[0.005759429666666666], 0, 4.598876714706421, 1576296827.817471], "v": 0.1}
{"i": ["cuda", "schedule_conv3d_transpose_nchw_cuda", [[1, 32, 80, 80, 80], [32, 1, 3, 3, 3], [1, 2, 2], [1, 1, 1], [0, 1, 1], "float32"], {}, ["schedule_conv3d_transpose_nchw_cuda", [1, 32, 80, 80, 80], [32, 1, 3, 3, 3], [1, 2, 2], [1, 1, 1], [0, 1, 1], "float32"], {"i": 1653099886, "t": "", "c": null, "e": [["tile_f", "sp", [-1, 1, 1, 1]], ["tile_d", "sp", [-1, 2, 1, 2]], ["tile_y", "sp", [-1, 1, 2, 5]], ["tile_x", "sp", [-1, 1, 2, 2]], ["tile_rc", "sp", [-1, 2]], ["tile_rd", "sp", [-1, 3]], ["tile_ry", "sp", [-1, 3]], ["tile_rx", "sp", [-1, 3]], ["auto_unroll_max_step", "ot", 512], ["unroll_explicit", "ot", 1]]}], "r": [[0.0057354415555555555], 0, 3.1294212341308594, 1576296828.8705683], "v": 0.1}
{"i": ["cuda", "schedule_conv3d_transpose_nchw_cuda", [[1, 32, 80, 80, 80], [32, 1, 3, 3, 3], [1, 2, 2], [1, 1, 1], [0, 1, 1], "float32"], {}, ["schedule_conv3d_transpose_nchw_cuda", [1, 32, 80, 80, 80], [32, 1, 3, 3, 3], [1, 2, 2], [1, 1, 1], [0, 1, 1], "float32"], {"i": 1988428445, "t": "", "c": null, "e": [["tile_f", "sp", [-1, 1, 1, 1]], ["tile_d", "sp", [-1, 1, 1, 2]], ["tile_y", "sp", [-1, 1, 2, 4]], ["tile_x", "sp", [-1, 4, 2, 1]], ["tile_rc", "sp", [-1, 2]], ["tile_rd", "sp", [-1, 3]], ["tile_ry", "sp", [-1, 3]], ["tile_rx", "sp", [-1, 3]], ["auto_unroll_max_step", "ot", 1500], ["unroll_explicit", "ot", 1]]}], "r": [[0.006559653], 0, 3.8858799934387207, 1576296829.9787111], "v": 0.1}
{"i": ["cuda", "schedule_conv3d_transpose_nchw_cuda", [[1, 32, 80, 80, 80], [32, 1, 3, 3, 3], [1, 2, 2], [1, 1, 1], [0, 1, 1], "float32"], {}, ["schedule_conv3d_transpose_nchw_cuda", [1, 32, 80, 80, 80], [32, 1, 3, 3, 3], [1, 2, 2], [1, 1, 1], [0, 1, 1], "float32"], {"i": 1651245725, "t": "", "c": null, "e": [["tile_f", "sp", [-1, 1, 1, 1]], ["tile_d", "sp", [-1, 1, 1, 2]], ["tile_y", "sp", [-1, 1, 2, 4]], ["tile_x", "sp", [-1, 4, 2, 1]], ["tile_rc", "sp", [-1, 2]], ["tile_rd", "sp", [-1, 3]], ["tile_ry", "sp", [-1, 3]], ["tile_rx", "sp", [-1, 3]], ["auto_unroll_max_step", "ot", 512], ["unroll_explicit", "ot", 1]]}], "r": [[0.0056757560555555555], 0, 2.885751724243164, 1576296831.0127995], "v": 0.1}
{"i": ["cuda", "schedule_conv3d_transpose_nchw_cuda", [[1, 32, 80, 80, 80], [32, 1, 3, 3, 3], [1, 2, 2], [1, 1, 1], [0, 1, 1], "float32"], {}, ["schedule_conv3d_transpose_nchw_cuda", [1, 32, 80, 80, 80], [32, 1, 3, 3, 3], [1, 2, 2], [1, 1, 1], [0, 1, 1], "float32"], {"i": 1644165256, "t": "", "c": null, "e": [["tile_f", "sp", [-1, 1, 1, 1]], ["tile_d", "sp", [-1, 2, 1, 4]], ["tile_y", "sp", [-1, 1, 2, 8]], ["tile_x", "sp", [-1, 1, 2, 1]], ["tile_rc", "sp", [-1, 1]], ["tile_rd", "sp", [-1, 3]], ["tile_ry", "sp", [-1, 3]], ["tile_rx", "sp", [-1, 3]], ["auto_unroll_max_step", "ot", 512], ["unroll_explicit", "ot", 1]]}], "r": [[0.00988164009090909], 0, 3.5589959621429443, 1576296832.2725961], "v": 0.1}
{"i": ["cuda", "schedule_conv3d_transpose_nchw_cuda", [[1, 32, 80, 80, 80], [32, 1, 3, 3, 3], [1, 2, 2], [1, 1, 1], [0, 1, 1], "float32"], {}, ["schedule_conv3d_transpose_nchw_cuda", [1, 32, 80, 80, 80], [32, 1, 3, 3, 3], [1, 2, 2], [1, 1, 1], [0, 1, 1], "float32"], {"i": 1981347976, "t": "", "c": null, "e": [["tile_f", "sp", [-1, 1, 1, 1]], ["tile_d", "sp", [-1, 2, 1, 4]], ["tile_y", "sp", [-1, 1, 2, 8]], ["tile_x", "sp", [-1, 1, 2, 1]], ["tile_rc", "sp", [-1, 1]], ["tile_rd", "sp", [-1, 3]], ["tile_ry", "sp", [-1, 3]], ["tile_rx", "sp", [-1, 3]], ["auto_unroll_max_step", "ot", 1500], ["unroll_explicit", "ot", 1]]}], "r": [[0.007123083733333333], 0, 3.5648367404937744, 1576296833.4203184], "v": 0.1}
{"i": ["cuda", "schedule_conv3d_transpose_nchw_cuda", [[1, 32, 80, 80, 80], [32, 1, 3, 3, 3], [1, 2, 2], [1, 1, 1], [0, 1, 1], "float32"], {}, ["schedule_conv3d_transpose_nchw_cuda", [1, 32, 80, 80, 80], [32, 1, 3, 3, 3], [1, 2, 2], [1, 1, 1], [0, 1, 1], "float32"], {"i": 1983254093, "t": "", "c": null, "e": [["tile_f", "sp", [-1, 1, 1, 1]], ["tile_d", "sp", [-1, 1, 1, 5]], ["tile_y", "sp", [-1, 1, 2, 4]], ["tile_x", "sp", [-1, 1, 2, 2]], ["tile_rc", "sp", [-1, 1]], ["tile_rd", "sp", [-1, 3]], ["tile_ry", "sp", [-1, 3]], ["tile_rx", "sp", [-1, 3]], ["auto_unroll_max_step", "ot", 1500], ["unroll_explicit", "ot", 1]]}], "r": [[0.0036066285357142856], 0, 2.4763524532318115, 1576296834.42832], "v": 0.1}
{"i": ["cuda", "schedule_conv3d_transpose_nchw_cuda", [[1, 32, 80, 80, 80], [32, 1, 3, 3, 3], [1, 2, 2], [1, 1, 1], [0, 1, 1], "float32"], {}, ["schedule_conv3d_transpose_nchw_cuda", [1, 32, 80, 80, 80], [32, 1, 3, 3, 3], [1, 2, 2], [1, 1, 1], [0, 1, 1], "float32"], {"i": 1646071373, "t": "", "c": null, "e": [["tile_f", "sp", [-1, 1, 1, 1]], ["tile_d", "sp", [-1, 1, 1, 5]], ["tile_y", "sp", [-1, 1, 2, 4]], ["tile_x", "sp", [-1, 1, 2, 2]], ["tile_rc", "sp", [-1, 1]], ["tile_rd", "sp", [-1, 3]], ["tile_ry", "sp", [-1, 3]], ["tile_rx", "sp", [-1, 3]], ["auto_unroll_max_step", "ot", 512], ["unroll_explicit", "ot", 1]]}], "r": [[0.003575156607142857], 0, 2.662351131439209, 1576296835.4198935], "v": 0.1}
{"i": ["cuda", "schedule_conv3d_transpose_nchw_cuda", [[1, 32, 80, 80, 80], [32, 1, 3, 3, 3], [1, 2, 2], [1, 1, 1], [0, 1, 1], "float32"], {}, ["schedule_conv3d_transpose_nchw_cuda", [1, 32, 80, 80, 80], [32, 1, 3, 3, 3], [1, 2, 2], [1, 1, 1], [0, 1, 1], "float32"], {"i": 1645789086, "t": "", "c": null, "e": [["tile_f", "sp", [-1, 1, 1, 1]], ["tile_d", "sp", [-1, 2, 1, 2]], ["tile_y", "sp", [-1, 1, 2, 4]], ["tile_x", "sp", [-1, 2, 1, 2]], ["tile_rc", "sp", [-1, 1]], ["tile_rd", "sp", [-1, 3]], ["tile_ry", "sp", [-1, 3]], ["tile_rx", "sp", [-1, 3]], ["auto_unroll_max_step", "ot", 512], ["unroll_explicit", "ot", 1]]}], "r": [[0.003917063846153846], 0, 2.3301093578338623, 1576296840.1473958], "v": 0.1}
{"i": ["cuda", "schedule_conv3d_transpose_nchw_cuda", [[1, 32, 80, 80, 80], [32, 1, 3, 3, 3], [1, 2, 2], [1, 1, 1], [0, 1, 1], "float32"], {}, ["schedule_conv3d_transpose_nchw_cuda", [1, 32, 80, 80, 80], [32, 1, 3, 3, 3], [1, 2, 2], [1, 1, 1], [0, 1, 1], "float32"], {"i": 1982971806, "t": "", "c": null, "e": [["tile_f", "sp", [-1, 1, 1, 1]], ["tile_d", "sp", [-1, 2, 1, 2]], ["tile_y", "sp", [-1, 1, 2, 4]], ["tile_x", "sp", [-1, 2, 1, 2]], ["tile_rc", "sp", [-1, 1]], ["tile_rd", "sp", [-1, 3]], ["tile_ry", "sp", [-1, 3]], ["tile_rx", "sp", [-1, 3]], ["auto_unroll_max_step", "ot", 1500], ["unroll_explicit", "ot", 1]]}], "r": [[0.002672523052631579], 0, 2.1360528469085693, 1576296841.067866], "v": 0.1}
{"i": ["cuda", "schedule_conv3d_transpose_nchw_cuda", [[1, 32, 80, 80, 80], [32, 1, 3, 3, 3], [1, 2, 2], [1, 1, 1], [0, 1, 1], "float32"], {}, ["schedule_conv3d_transpose_nchw_cuda", [1, 32, 80, 80, 80], [32, 1, 3, 3, 3], [1, 2, 2], [1, 1, 1], [0, 1, 1], "float32"], {"i": 1652813726, "t": "", "c": null, "e": [["tile_f", "sp", [-1, 1, 1, 1]], ["tile_d", "sp", [-1, 2, 1, 2]], ["tile_y", "sp", [-1, 1, 2, 4]], ["tile_x", "sp", [-1, 2, 1, 2]], ["tile_rc", "sp", [-1, 2]], ["tile_rd", "sp", [-1, 3]], ["tile_ry", "sp", [-1, 3]], ["tile_rx", "sp", [-1, 3]], ["auto_unroll_max_step", "ot", 512], ["unroll_explicit", "ot", 1]]}], "r": [[0.004658680636363636], 0, 2.8240880966186523, 1576296842.1327226], "v": 0.1}
{"i": ["cuda", "schedule_conv3d_transpose_nchw_cuda", [[1, 32, 80, 80, 80], [32, 1, 3, 3, 3], [1, 2, 2], [1, 1, 1], [0, 1, 1], "float32"], {}, ["schedule_conv3d_transpose_nchw_cuda", [1, 32, 80, 80, 80], [32, 1, 3, 3, 3], [1, 2, 2], [1, 1, 1], [0, 1, 1], "float32"], {"i": 1989996446, "t": "", "c": null, "e": [["tile_f", "sp", [-1, 1, 1, 1]], ["tile_d", "sp", [-1, 2, 1, 2]], ["tile_y", "sp", [-1, 1, 2, 4]], ["tile_x", "sp", [-1, 2, 1, 2]], ["tile_rc", "sp", [-1, 2]], ["tile_rd", "sp", [-1, 3]], ["tile_ry", "sp", [-1, 3]], ["tile_rx", "sp", [-1, 3]], ["auto_unroll_max_step", "ot", 1500], ["unroll_explicit", "ot", 1]]}], "r": [[0.0030525536969696968], 0, 2.5536065101623535, 1576296843.1218557], "v": 0.1}
{"i": ["cuda", "schedule_conv3d_transpose_nchw_cuda", [[1, 32, 80, 80, 80], [32, 1, 3, 3, 3], [1, 2, 2], [1, 1, 1], [0, 1, 1], "float32"], {}, ["schedule_conv3d_transpose_nchw_cuda", [1, 32, 80, 80, 80], [32, 1, 3, 3, 3], [1, 2, 2], [1, 1, 1], [0, 1, 1], "float32"], {"i": 1644165227, "t": "", "c": null, "e": [["tile_f", "sp", [-1, 1, 1, 1]], ["tile_d", "sp", [-1, 4, 1, 2]], ["tile_y", "sp", [-1, 1, 2, 8]], ["tile_x", "sp", [-1, 1, 2, 1]], ["tile_rc", "sp", [-1, 1]], ["tile_rd", "sp", [-1, 3]], ["tile_ry", "sp", [-1, 3]], ["tile_rx", "sp", [-1, 3]], ["auto_unroll_max_step", "ot", 512], ["unroll_explicit", "ot", 1]]}], "r": [[0.0100874256], 0, 3.7825610637664795, 1576296844.31275], "v": 0.1}
{"i": ["cuda", "schedule_conv3d_transpose_nchw_cuda", [[1, 32, 80, 80, 80], [32, 1, 3, 3, 3], [1, 2, 2], [1, 1, 1], [0, 1, 1], "float32"], {}, ["schedule_conv3d_transpose_nchw_cuda", [1, 32, 80, 80, 80], [32, 1, 3, 3, 3], [1, 2, 2], [1, 1, 1], [0, 1, 1], "float32"], {"i": 1981347947, "t": "", "c": null, "e": [["tile_f", "sp", [-1, 1, 1, 1]], ["tile_d", "sp", [-1, 4, 1, 2]], ["tile_y", "sp", [-1, 1, 2, 8]], ["tile_x", "sp", [-1, 1, 2, 1]], ["tile_rc", "sp", [-1, 1]], ["tile_rd", "sp", [-1, 3]], ["tile_ry", "sp", [-1, 3]], ["tile_rx", "sp", [-1, 3]], ["auto_unroll_max_step", "ot", 1500], ["unroll_explicit", "ot", 1]]}], "r": [[0.007220486071428571], 0, 3.7891600131988525, 1576296845.4046185], "v": 0.1}
{"i": ["cuda", "schedule_conv3d_transpose_nchw_cuda", [[1, 32, 80, 80, 80], [32, 1, 3, 3, 3], [1, 2, 2], [1, 1, 1], [0, 1, 1], "float32"], {}, ["schedule_conv3d_transpose_nchw_cuda", [1, 32, 80, 80, 80], [32, 1, 3, 3, 3], [1, 2, 2], [1, 1, 1], [0, 1, 1], "float32"], {"i": 1992348445, "t": "", "c": null, "e": [["tile_f", "sp", [-1, 1, 1, 1]], ["tile_d", "sp", [-1, 1, 1, 2]], ["tile_y", "sp", [-1, 1, 2, 4]], ["tile_x", "sp", [-1, 2, 1, 5]], ["tile_rc", "sp", [-1, 2]], ["tile_rd", "sp", [-1, 3]], ["tile_ry", "sp", [-1, 3]], ["tile_rx", "sp", [-1, 3]], ["auto_unroll_max_step", "ot", 1500], ["unroll_explicit", "ot", 1]]}], "r": [[0.003371373333333333], 0, 2.8668932914733887, 1576296846.4078977], "v": 0.1}
{"i": ["cuda", "schedule_conv3d_transpose_nchw_cuda", [[1, 32, 80, 80, 80], [32, 1, 3, 3, 3], [1, 2, 2], [1, 1, 1], [0, 1, 1], "float32"], {}, ["schedule_conv3d_transpose_nchw_cuda", [1, 32, 80, 80, 80], [32, 1, 3, 3, 3], [1, 2, 2], [1, 1, 1], [0, 1, 1], "float32"], {"i": 1989996493, "t": "", "c": null, "e": [["tile_f", "sp", [-1, 1, 1, 1]], ["tile_d", "sp", [-1, 1, 1, 5]], ["tile_y", "sp", [-1, 1, 2, 4]], ["tile_x", "sp", [-1, 2, 1, 2]], ["tile_rc", "sp", [-1, 2]], ["tile_rd", "sp", [-1, 3]], ["tile_ry", "sp", [-1, 3]], ["tile_rx", "sp", [-1, 3]], ["auto_unroll_max_step", "ot", 1500], ["unroll_explicit", "ot", 1]]}], "r": [[0.003190734375], 0, 2.8642821311950684, 1576296847.4187906], "v": 0.1}
{"i": ["cuda", "schedule_conv3d_transpose_nchw_cuda", [[1, 32, 80, 80, 80], [32, 1, 3, 3, 3], [1, 2, 2], [1, 1, 1], [0, 1, 1], "float32"], {}, ["schedule_conv3d_transpose_nchw_cuda", [1, 32, 80, 80, 80], [32, 1, 3, 3, 3], [1, 2, 2], [1, 1, 1], [0, 1, 1], "float32"], {"i": 1655165725, "t": "", "c": null, "e": [["tile_f", "sp", [-1, 1, 1, 1]], ["tile_d", "sp", [-1, 1, 1, 2]], ["tile_y", "sp", [-1, 1, 2, 4]], ["tile_x", "sp", [-1, 2, 1, 5]], ["tile_rc", "sp", [-1, 2]], ["tile_rd", "sp", [-1, 3]], ["tile_ry", "sp", [-1, 3]], ["tile_rx", "sp", [-1, 3]], ["auto_unroll_max_step", "ot", 512], ["unroll_explicit", "ot", 1]]}], "r": [[0.0061833726470588235], 0, 3.064828872680664, 1576296848.5204718], "v": 0.1}
{"i": ["cuda", "schedule_conv3d_transpose_nchw_cuda", [[1, 32, 80, 80, 80], [32, 1, 3, 3, 3], [1, 2, 2], [1, 1, 1], [0, 1, 1], "float32"], {}, ["schedule_conv3d_transpose_nchw_cuda", [1, 32, 80, 80, 80], [32, 1, 3, 3, 3], [1, 2, 2], [1, 1, 1], [0, 1, 1], "float32"], {"i": 1652813773, "t": "", "c": null, "e": [["tile_f", "sp", [-1, 1, 1, 1]], ["tile_d", "sp", [-1, 1, 1, 5]], ["tile_y", "sp", [-1, 1, 2, 4]], ["tile_x", "sp", [-1, 2, 1, 2]], ["tile_rc", "sp", [-1, 2]], ["tile_rd", "sp", [-1, 3]], ["tile_ry", "sp", [-1, 3]], ["tile_rx", "sp", [-1, 3]], ["auto_unroll_max_step", "ot", 512], ["unroll_explicit", "ot", 1]]}], "r": [[0.006005181235294118], 0, 3.0984628200531006, 1576296849.65071], "v": 0.1}
{"i": ["cuda", "schedule_conv3d_transpose_nchw_cuda", [[1, 32, 80, 80, 80], [32, 1, 3, 3, 3], [1, 2, 2], [1, 1, 1], [0, 1, 1], "float32"], {}, ["schedule_conv3d_transpose_nchw_cuda", [1, 32, 80, 80, 80], [32, 1, 3, 3, 3], [1, 2, 2], [1, 1, 1], [0, 1, 1], "float32"], {"i": 1645762376, "t": "", "c": null, "e": [["tile_f", "sp", [-1, 1, 1, 1]], ["tile_d", "sp", [-1, 2, 1, 4]], ["tile_y", "sp", [-1, 1, 4, 5]], ["tile_x", "sp", [-1, 1, 1, 2]], ["tile_rc", "sp", [-1, 1]], ["tile_rd", "sp", [-1, 3]], ["tile_ry", "sp", [-1, 3]], ["tile_rx", "sp", [-1, 3]], ["auto_unroll_max_step", "ot", 512], ["unroll_explicit", "ot", 1]]}], "r": [[0.022947016833333334], 0, 3.7511091232299805, 1576296851.1757786], "v": 0.1}
{"i": ["cuda", "schedule_conv3d_transpose_nchw_cuda", [[1, 32, 80, 80, 80], [32, 1, 3, 3, 3], [1, 2, 2], [1, 1, 1], [0, 1, 1], "float32"], {}, ["schedule_conv3d_transpose_nchw_cuda", [1, 32, 80, 80, 80], [32, 1, 3, 3, 3], [1, 2, 2], [1, 1, 1], [0, 1, 1], "float32"], {"i": 1982945096, "t": "", "c": null, "e": [["tile_f", "sp", [-1, 1, 1, 1]], ["tile_d", "sp", [-1, 2, 1, 4]], ["tile_y", "sp", [-1, 1, 4, 5]], ["tile_x", "sp", [-1, 1, 1, 2]], ["tile_rc", "sp", [-1, 1]], ["tile_rd", "sp", [-1, 3]], ["tile_ry", "sp", [-1, 3]], ["tile_rx", "sp", [-1, 3]], ["auto_unroll_max_step", "ot", 1500], ["unroll_explicit", "ot", 1]]}], "r": [[0.007761841923076922], 0, 3.9722893238067627, 1576296852.4171138], "v": 0.1}
{"i": ["cuda", "schedule_conv3d_transpose_nchw_cuda", [[1, 32, 80, 80, 80], [32, 1, 3, 3, 3], [1, 2, 2], [1, 1, 1], [0, 1, 1], "float32"], {}, ["schedule_conv3d_transpose_nchw_cuda", [1, 32, 80, 80, 80], [32, 1, 3, 3, 3], [1, 2, 2], [1, 1, 1], [0, 1, 1], "float32"], {"i": 1653095966, "t": "", "c": null, "e": [["tile_f", "sp", [-1, 1, 1, 1]], ["tile_d", "sp", [-1, 2, 1, 2]], ["tile_y", "sp", [-1, 1, 2, 4]], ["tile_x", "sp", [-1, 1, 2, 2]], ["tile_rc", "sp", [-1, 2]], ["tile_rd", "sp", [-1, 3]], ["tile_ry", "sp", [-1, 3]], ["tile_rx", "sp", [-1, 3]], ["auto_unroll_max_step", "ot", 512], ["unroll_explicit", "ot", 1]]}], "r": [[0.001934168116883117], 0, 2.1091434955596924, 1576297084.7630646], "v": 0.1}
{"i": ["cuda", "schedule_conv3d_transpose_nchw_cuda", [[1, 32, 80, 80, 80], [32, 1, 3, 3, 3], [1, 2, 2], [1, 1, 1], [0, 1, 1], "float32"], {}, ["schedule_conv3d_transpose_nchw_cuda", [1, 32, 80, 80, 80], [32, 1, 3, 3, 3], [1, 2, 2], [1, 1, 1], [0, 1, 1], "float32"], {"i": 1990278686, "t": "", "c": null, "e": [["tile_f", "sp", [-1, 1, 1, 1]], ["tile_d", "sp", [-1, 2, 1, 2]], ["tile_y", "sp", [-1, 1, 2, 4]], ["tile_x", "sp", [-1, 1, 2, 2]], ["tile_rc", "sp", [-1, 2]], ["tile_rd", "sp", [-1, 3]], ["tile_ry", "sp", [-1, 3]], ["tile_rx", "sp", [-1, 3]], ["auto_unroll_max_step", "ot", 1500], ["unroll_explicit", "ot", 1]]}], "r": [[0.0015264829090909091], 0, 2.1581881046295166, 1576297085.668267], "v": 0.1}
{"i": ["cuda", "schedule_conv3d_transpose_nchw_cuda", [[1, 32, 80, 80, 80], [32, 1, 3, 3, 3], [1, 2, 2], [1, 1, 1], [0, 1, 1], "float32"], {}, ["schedule_conv3d_transpose_nchw_cuda", [1, 32, 80, 80, 80], [32, 1, 3, 3, 3], [1, 2, 2], [1, 1, 1], [0, 1, 1], "float32"], {"i": 1653095995, "t": "", "c": null, "e": [["tile_f", "sp", [-1, 1, 1, 1]], ["tile_d", "sp", [-1, 1, 1, 4]], ["tile_y", "sp", [-1, 1, 2, 4]], ["tile_x", "sp", [-1, 1, 2, 2]], ["tile_rc", "sp", [-1, 2]], ["tile_rd", "sp", [-1, 3]], ["tile_ry", "sp", [-1, 3]], ["tile_rx", "sp", [-1, 3]], ["auto_unroll_max_step", "ot", 512], ["unroll_explicit", "ot", 1]]}], "r": [[0.0016346272474226805], 0, 2.296459197998047, 1576297086.831992], "v": 0.1}
{"i": ["cuda", "schedule_conv3d_transpose_nchw_cuda", [[1, 32, 80, 80, 80], [32, 1, 3, 3, 3], [1, 2, 2], [1, 1, 1], [0, 1, 1], "float32"], {}, ["schedule_conv3d_transpose_nchw_cuda", [1, 32, 80, 80, 80], [32, 1, 3, 3, 3], [1, 2, 2], [1, 1, 1], [0, 1, 1], "float32"], {"i": 1315913246, "t": "", "c": null, "e": [["tile_f", "sp", [-1, 1, 1, 1]], ["tile_d", "sp", [-1, 2, 1, 2]], ["tile_y", "sp", [-1, 1, 2, 4]], ["tile_x", "sp", [-1, 1, 2, 2]], ["tile_rc", "sp", [-1, 2]], ["tile_rd", "sp", [-1, 3]], ["tile_ry", "sp", [-1, 3]], ["tile_rx", "sp", [-1, 3]], ["auto_unroll_max_step", "ot", 0], ["unroll_explicit", "ot", 1]]}], "r": [[0.020210769833333333], 0, 1.7684991359710693, 1576297087.8421388], "v": 0.1}
{"i": ["cuda", "schedule_conv3d_transpose_nchw_cuda", [[1, 32, 80, 80, 80], [32, 1, 3, 3, 3], [1, 2, 2], [1, 1, 1], [0, 1, 1], "float32"], {}, ["schedule_conv3d_transpose_nchw_cuda", [1, 32, 80, 80, 80], [32, 1, 3, 3, 3], [1, 2, 2], [1, 1, 1], [0, 1, 1], "float32"], {"i": 1651189865, "t": "", "c": null, "e": [["tile_f", "sp", [-1, 1, 1, 1]], ["tile_d", "sp", [-1, 1, 1, 2]], ["tile_y", "sp", [-1, 1, 2, 8]], ["tile_x", "sp", [-1, 1, 2, 1]], ["tile_rc", "sp", [-1, 2]], ["tile_rd", "sp", [-1, 3]], ["tile_ry", "sp", [-1, 3]], ["tile_rx", "sp", [-1, 3]], ["auto_unroll_max_step", "ot", 512], ["unroll_explicit", "ot", 1]]}], "r": [[0.006193891117647059], 0, 2.6143651008605957, 1576297088.8302944], "v": 0.1}
{"i": ["cuda", "schedule_conv3d_transpose_nchw_cuda", [[1, 32, 80, 80, 80], [32, 1, 3, 3, 3], [1, 2, 2], [1, 1, 1], [0, 1, 1], "float32"], {}, ["schedule_conv3d_transpose_nchw_cuda", [1, 32, 80, 80, 80], [32, 1, 3, 3, 3], [1, 2, 2], [1, 1, 1], [0, 1, 1], "float32"], {"i": 1315944605, "t": "", "c": null, "e": [["tile_f", "sp", [-1, 1, 1, 1]], ["tile_d", "sp", [-1, 1, 1, 2]], ["tile_y", "sp", [-1, 1, 2, 4]], ["tile_x", "sp", [-1, 2, 2, 2]], ["tile_rc", "sp", [-1, 2]], ["tile_rd", "sp", [-1, 3]], ["tile_ry", "sp", [-1, 3]], ["tile_rx", "sp", [-1, 3]], ["auto_unroll_max_step", "ot", 0], ["unroll_explicit", "ot", 1]]}], "r": [[0.0223268385], 0, 1.895240306854248, 1576297089.9043791], "v": 0.1}
{"i": ["cuda", "schedule_conv3d_transpose_nchw_cuda", [[1, 32, 80, 80, 80], [32, 1, 3, 3, 3], [1, 2, 2], [1, 1, 1], [0, 1, 1], "float32"], {}, ["schedule_conv3d_transpose_nchw_cuda", [1, 32, 80, 80, 80], [32, 1, 3, 3, 3], [1, 2, 2], [1, 1, 1], [0, 1, 1], "float32"], {"i": 1653095965, "t": "", "c": null, "e": [["tile_f", "sp", [-1, 1, 1, 1]], ["tile_d", "sp", [-1, 1, 1, 2]], ["tile_y", "sp", [-1, 1, 2, 4]], ["tile_x", "sp", [-1, 1, 2, 2]], ["tile_rc", "sp", [-1, 2]], ["tile_rd", "sp", [-1, 3]], ["tile_ry", "sp", [-1, 3]], ["tile_rx", "sp", [-1, 3]], ["auto_unroll_max_step", "ot", 512], ["unroll_explicit", "ot", 1]]}], "r": [[0.002179323760869565], 0, 2.0802712440490723, 1576297090.7738547], "v": 0.1}
{"i": ["cuda", "schedule_conv3d_transpose_nchw_cuda", [[1, 32, 80, 80, 80], [32, 1, 3, 3, 3], [1, 2, 2], [1, 1, 1], [0, 1, 1], "float32"], {}, ["schedule_conv3d_transpose_nchw_cuda", [1, 32, 80, 80, 80], [32, 1, 3, 3, 3], [1, 2, 2], [1, 1, 1], [0, 1, 1], "float32"], {"i": 1990278715, "t": "", "c": null, "e": [["tile_f", "sp", [-1, 1, 1, 1]], ["tile_d", "sp", [-1, 1, 1, 4]], ["tile_y", "sp", [-1, 1, 2, 4]], ["tile_x", "sp", [-1, 1, 2, 2]], ["tile_rc", "sp", [-1, 2]], ["tile_rd", "sp", [-1, 3]], ["tile_ry", "sp", [-1, 3]], ["tile_rx", "sp", [-1, 3]], ["auto_unroll_max_step", "ot", 1500], ["unroll_explicit", "ot", 1]]}], "r": [[0.0015248263636363636], 0, 2.2053112983703613, 1576297091.672223], "v": 0.1}
{"i": ["cuda", "schedule_conv3d_transpose_nchw_cuda", [[1, 32, 80, 80, 80], [32, 1, 3, 3, 3], [1, 2, 2], [1, 1, 1], [0, 1, 1], "float32"], {}, ["schedule_conv3d_transpose_nchw_cuda", [1, 32, 80, 80, 80], [32, 1, 3, 3, 3], [1, 2, 2], [1, 1, 1], [0, 1, 1], "float32"], {"i": 1315913275, "t": "", "c": null, "e": [["tile_f", "sp", [-1, 1, 1, 1]], ["tile_d", "sp", [-1, 1, 1, 4]], ["tile_y", "sp", [-1, 1, 2, 4]], ["tile_x", "sp", [-1, 1, 2, 2]], ["tile_rc", "sp", [-1, 2]], ["tile_rd", "sp", [-1, 3]], ["tile_ry", "sp", [-1, 3]], ["tile_rx", "sp", [-1, 3]], ["auto_unroll_max_step", "ot", 0], ["unroll_explicit", "ot", 1]]}], "r": [[0.021037951333333332], 0, 1.9789350032806396, 1576297092.744405], "v": 0.1}
{"i": ["cuda", "schedule_conv3d_transpose_nchw_cuda", [[1, 32, 80, 80, 80], [32, 1, 3, 3, 3], [1, 2, 2], [1, 1, 1], [0, 1, 1], "float32"], {}, ["schedule_conv3d_transpose_nchw_cuda", [1, 32, 80, 80, 80], [32, 1, 3, 3, 3], [1, 2, 2], [1, 1, 1], [0, 1, 1], "float32"], {"i": 1988372585, "t": "", "c": null, "e": [["tile_f", "sp", [-1, 1, 1, 1]], ["tile_d", "sp", [-1, 1, 1, 2]], ["tile_y", "sp", [-1, 1, 2, 8]], ["tile_x", "sp", [-1, 1, 2, 1]], ["tile_rc", "sp", [-1, 2]], ["tile_rd", "sp", [-1, 3]], ["tile_ry", "sp", [-1, 3]], ["tile_rx", "sp", [-1, 3]], ["auto_unroll_max_step", "ot", 1500], ["unroll_explicit", "ot", 1]]}], "r": [[0.005723255222222222], 0, 2.8693296909332275, 1576297093.8392892], "v": 0.1}
{"i": ["cuda", "schedule_conv3d_transpose_nchw_cuda", [[1, 32, 80, 80, 80], [32, 1, 3, 3, 3], [1, 2, 2], [1, 1, 1], [0, 1, 1], "float32"], {}, ["schedule_conv3d_transpose_nchw_cuda", [1, 32, 80, 80, 80], [32, 1, 3, 3, 3], [1, 2, 2], [1, 1, 1], [0, 1, 1], "float32"], {"i": 1651214395, "t": "", "c": null, "e": [["tile_f", "sp", [-1, 1, 1, 1]], ["tile_d", "sp", [-1, 1, 1, 4]], ["tile_y", "sp", [-1, 1, 2, 4]], ["tile_x", "sp", [-1, 2, 2, 1]], ["tile_rc", "sp", [-1, 2]], ["tile_rd", "sp", [-1, 3]], ["tile_ry", "sp", [-1, 3]], ["tile_rx", "sp", [-1, 3]], ["auto_unroll_max_step", "ot", 512], ["unroll_explicit", "ot", 1]]}], "r": [[0.005600797833333334], 0, 2.372915506362915, 1576297094.8532085], "v": 0.1}
{"i": ["cuda", "schedule_conv3d_transpose_nchw_cuda", [[1, 32, 80, 80, 80], [32, 1, 3, 3, 3], [1, 2, 2], [1, 1, 1], [0, 1, 1], "float32"], {}, ["schedule_conv3d_transpose_nchw_cuda", [1, 32, 80, 80, 80], [32, 1, 3, 3, 3], [1, 2, 2], [1, 1, 1], [0, 1, 1], "float32"], {"i": 1990278685, "t": "", "c": null, "e": [["tile_f", "sp", [-1, 1, 1, 1]], ["tile_d", "sp", [-1, 1, 1, 2]], ["tile_y", "sp", [-1, 1, 2, 4]], ["tile_x", "sp", [-1, 1, 2, 2]], ["tile_rc", "sp", [-1, 2]], ["tile_rd", "sp", [-1, 3]], ["tile_ry", "sp", [-1, 3]], ["tile_rx", "sp", [-1, 3]], ["auto_unroll_max_step", "ot", 1500], ["unroll_explicit", "ot", 1]]}], "r": [[0.002283539652173913], 0, 2.010315179824829, 1576297095.7561653], "v": 0.1}
{"i": ["cuda", "schedule_conv3d_transpose_nchw_cuda", [[1, 32, 80, 80, 80], [32, 1, 3, 3, 3], [1, 2, 2], [1, 1, 1], [0, 1, 1], "float32"], {}, ["schedule_conv3d_transpose_nchw_cuda", [1, 32, 80, 80, 80], [32, 1, 3, 3, 3], [1, 2, 2], [1, 1, 1], [0, 1, 1], "float32"], {"i": 1651496635, "t": "", "c": null, "e": [["tile_f", "sp", [-1, 1, 1, 1]], ["tile_d", "sp", [-1, 1, 1, 4]], ["tile_y", "sp", [-1, 1, 2, 4]], ["tile_x", "sp", [-1, 1, 4, 1]], ["tile_rc", "sp", [-1, 2]], ["tile_rd", "sp", [-1, 3]], ["tile_ry", "sp", [-1, 3]], ["tile_rx", "sp", [-1, 3]], ["auto_unroll_max_step", "ot", 512], ["unroll_explicit", "ot", 1]]}], "r": [[0.003301686577777778], 0, 3.057910203933716, 1576297100.3367975], "v": 0.1}
{"i": ["cuda", "schedule_conv3d_transpose_nchw_cuda", [[1, 32, 80, 80, 80], [32, 1, 3, 3, 3], [1, 2, 2], [1, 1, 1], [0, 1, 1], "float32"], {}, ["schedule_conv3d_transpose_nchw_cuda", [1, 32, 80, 80, 80], [32, 1, 3, 3, 3], [1, 2, 2], [1, 1, 1], [0, 1, 1], "float32"], {"i": 1314007145, "t": "", "c": null, "e": [["tile_f", "sp", [-1, 1, 1, 1]], ["tile_d", "sp", [-1, 1, 1, 2]], ["tile_y", "sp", [-1, 1, 2, 8]], ["tile_x", "sp", [-1, 1, 2, 1]], ["tile_rc", "sp", [-1, 2]], ["tile_rd", "sp", [-1, 3]], ["tile_ry", "sp", [-1, 3]], ["tile_rx", "sp", [-1, 3]], ["auto_unroll_max_step", "ot", 0], ["unroll_explicit", "ot", 1]]}], "r": [[0.018328052], 0, 1.8696229457855225, 1576297101.4317017], "v": 0.1}
