fourth_layer_weight_grad_custom.log
{"i": ["cuda", "schedule_conv3d_nchw_cuda", [[192, 1, 10, 10, 10], [192, 1, 10, 10, 10], [1, 1, 1], [1, 1, 1], [1, 1, 1], 1], {}, ["schedule_conv3d_nchw_cuda", [192, 1, 10, 10, 10], [192, 1, 10, 10, 10], [1, 1, 1], [1, 1, 1], [1, 1, 1], 1], {"i": 5043217594, "t": "", "c": null, "e": [["tile_n", "sp", [-1, 2, 12, 1]], ["tile_f", "sp", [-1, 1, 6, 2]], ["tile_d", "sp", [-1, 1, 1, 3]], ["tile_y", "sp", [-1, 1, 1, 3]], ["tile_x", "sp", [-1, 1, 1, 3]], ["tile_rc", "sp", [-1, 1]], ["tile_rd", "sp", [-1, 2]], ["tile_ry", "sp", [-1, 5]], ["tile_rx", "sp", [-1, 10]], ["auto_unroll_max_step", "ot", 512], ["unroll_explicit", "ot", 1], ["fuse_yx", "ot", 1]]}], "r": [[0.00192334775], 0, 2.7035675048828125, 1577714941.061115], "v": 0.1}
{"i": ["cuda", "schedule_conv3d_nchw_cuda", [[192, 1, 10, 10, 10], [192, 1, 10, 10, 10], [1, 1, 1], [1, 1, 1], [1, 1, 1], 1], {}, ["schedule_conv3d_nchw_cuda", [192, 1, 10, 10, 10], [192, 1, 10, 10, 10], [1, 1, 1], [1, 1, 1], [1, 1, 1], 1], {"i": 1541520466, "t": "", "c": null, "e": [["tile_n", "sp", [-1, 4, 1, 4]], ["tile_f", "sp", [-1, 3, 4, 2]], ["tile_d", "sp", [-1, 1, 3, 1]], ["tile_y", "sp", [-1, 3, 1, 1]], ["tile_x", "sp", [-1, 3, 1, 1]], ["tile_rc", "sp", [-1, 1]], ["tile_rd", "sp", [-1, 2]], ["tile_ry", "sp", [-1, 2]], ["tile_rx", "sp", [-1, 2]], ["auto_unroll_max_step", "ot", 0], ["unroll_explicit", "ot", 1], ["fuse_yx", "ot", 0]]}], "r": [[0.063899539], 0, 2.710136651992798, 1577714942.4951158], "v": 0.1}
{"i": ["cuda", "schedule_conv3d_nchw_cuda", [[192, 1, 10, 10, 10], [192, 1, 10, 10, 10], [1, 1, 1], [1, 1, 1], [1, 1, 1], 1], {}, ["schedule_conv3d_nchw_cuda", [192, 1, 10, 10, 10], [192, 1, 10, 10, 10], [1, 1, 1], [1, 1, 1], [1, 1, 1], 1], {"i": 3212472195, "t": "", "c": null, "e": [["tile_n", "sp", [-1, 3, 8, 1]], ["tile_f", "sp", [-1, 1, 8, 1]], ["tile_d", "sp", [-1, 1, 1, 3]], ["tile_y", "sp", [-1, 3, 1, 1]], ["tile_x", "sp", [-1, 1, 3, 1]], ["tile_rc", "sp", [-1, 1]], ["tile_rd", "sp", [-1, 1]], ["tile_ry", "sp", [-1, 10]], ["tile_rx", "sp", [-1, 10]], ["auto_unroll_max_step", "ot", 0], ["unroll_explicit", "ot", 0], ["fuse_yx", "ot", 1]]}], "r": [[0.001272207], 0, 0.8776440620422363, 1577714942.9989288], "v": 0.1}
{"i": ["cuda", "schedule_conv3d_nchw_cuda", [[192, 1, 10, 10, 10], [192, 1, 10, 10, 10], [1, 1, 1], [1, 1, 1], [1, 1, 1], 1], {}, ["schedule_conv3d_nchw_cuda", [192, 1, 10, 10, 10], [192, 1, 10, 10, 10], [1, 1, 1], [1, 1, 1], [1, 1, 1], 1], {"i": 872021269, "t": "", "c": null, "e": [["tile_n", "sp", [-1, 4, 12, 2]], ["tile_f", "sp", [-1, 6, 4, 1]], ["tile_d", "sp", [-1, 1, 1, 1]], ["tile_y", "sp", [-1, 1, 1, 3]], ["tile_x", "sp", [-1, 1, 3, 1]], ["tile_rc", "sp", [-1, 1]], ["tile_rd", "sp", [-1, 1]], ["tile_ry", "sp", [-1, 5]], ["tile_rx", "sp", [-1, 10]], ["auto_unroll_max_step", "ot", 512], ["unroll_explicit", "ot", 0], ["fuse_yx", "ot", 0]]}], "r": [[0.0015658975], 0, 1.6370713710784912, 1577714944.0215993], "v": 0.1}
{"i": ["cuda", "schedule_conv3d_nchw_cuda", [[192, 1, 10, 10, 10], [192, 1, 10, 10, 10], [1, 1, 1], [1, 1, 1], [1, 1, 1], 1], {}, ["schedule_conv3d_nchw_cuda", [192, 1, 10, 10, 10], [192, 1, 10, 10, 10], [1, 1, 1], [1, 1, 1], [1, 1, 1], 1], {"i": 1517717217, "t": "", "c": null, "e": [["tile_n", "sp", [-1, 3, 1, 4]], ["tile_f", "sp", [-1, 4, 8, 3]], ["tile_d", "sp", [-1, 1, 1, 3]], ["tile_y", "sp", [-1, 1, 1, 1]], ["tile_x", "sp", [-1, 1, 1, 1]], ["tile_rc", "sp", [-1, 1]], ["tile_rd", "sp", [-1, 5]], ["tile_ry", "sp", [-1, 1]], ["tile_rx", "sp", [-1, 2]], ["auto_unroll_max_step", "ot", 0], ["unroll_explicit", "ot", 1], ["fuse_yx", "ot", 0]]}], "r": [[0.1203102285], 0, 2.800992012023926, 1577714951.5037577], "v": 0.1}
{"i": ["cuda", "schedule_conv3d_nchw_cuda", [[192, 1, 10, 10, 10], [192, 1, 10, 10, 10], [1, 1, 1], [1, 1, 1], [1, 1, 1], 1], {}, ["schedule_conv3d_nchw_cuda", [192, 1, 10, 10, 10], [192, 1, 10, 10, 10], [1, 1, 1], [1, 1, 1], [1, 1, 1], 1], {"i": 706522255, "t": "", "c": null, "e": [["tile_n", "sp", [-1, 1, 1, 12]], ["tile_f", "sp", [-1, 24, 8, 1]], ["tile_d", "sp", [-1, 1, 3, 1]], ["tile_y", "sp", [-1, 1, 1, 1]], ["tile_x", "sp", [-1, 1, 1, 3]], ["tile_rc", "sp", [-1, 1]], ["tile_rd", "sp", [-1, 2]], ["tile_ry", "sp", [-1, 1]], ["tile_rx", "sp", [-1, 5]], ["auto_unroll_max_step", "ot", 512], ["unroll_explicit", "ot", 0], ["fuse_yx", "ot", 0]]}], "r": [[0.0424431325], 0, 2.758084535598755, 1577714953.3418655], "v": 0.1}
{"i": ["cuda", "schedule_conv3d_nchw_cuda", [[192, 1, 10, 10, 10], [192, 1, 10, 10, 10], [1, 1, 1], [1, 1, 1], [1, 1, 1], 1], {}, ["schedule_conv3d_nchw_cuda", [192, 1, 10, 10, 10], [192, 1, 10, 10, 10], [1, 1, 1], [1, 1, 1], [1, 1, 1], 1], {"i": 163891571, "t": "", "c": null, "e": [["tile_n", "sp", [-1, 6, 1, 4]], ["tile_f", "sp", [-1, 2, 8, 6]], ["tile_d", "sp", [-1, 1, 1, 3]], ["tile_y", "sp", [-1, 1, 3, 1]], ["tile_x", "sp", [-1, 1, 3, 1]], ["tile_rc", "sp", [-1, 1]], ["tile_rd", "sp", [-1, 5]], ["tile_ry", "sp", [-1, 2]], ["tile_rx", "sp", [-1, 2]], ["auto_unroll_max_step", "ot", 0], ["unroll_explicit", "ot", 0], ["fuse_yx", "ot", 0]]}], "r": [[0.035612793], 0, 1.9964368343353271, 1577714967.2101648], "v": 0.1}
{"i": ["cuda", "schedule_conv3d_nchw_cuda", [[192, 1, 10, 10, 10], [192, 1, 10, 10, 10], [1, 1, 1], [1, 1, 1], [1, 1, 1], 1], {}, ["schedule_conv3d_nchw_cuda", [192, 1, 10, 10, 10], [192, 1, 10, 10, 10], [1, 1, 1], [1, 1, 1], [1, 1, 1], 1], {"i": 3823216186, "t": "", "c": null, "e": [["tile_n", "sp", [-1, 6, 4, 4]], ["tile_f", "sp", [-1, 2, 1, 32]], ["tile_d", "sp", [-1, 1, 1, 1]], ["tile_y", "sp", [-1, 1, 3, 1]], ["tile_x", "sp", [-1, 1, 1, 1]], ["tile_rc", "sp", [-1, 1]], ["tile_rd", "sp", [-1, 2]], ["tile_ry", "sp", [-1, 1]], ["tile_rx", "sp", [-1, 2]], ["auto_unroll_max_step", "ot", 1500], ["unroll_explicit", "ot", 0], ["fuse_yx", "ot", 1]]}], "r": [[0.031151957], 0, 3.4848809242248535, 1577714968.452531], "v": 0.1}
{"i": ["cuda", "schedule_conv3d_nchw_cuda", [[192, 1, 10, 10, 10], [192, 1, 10, 10, 10], [1, 1, 1], [1, 1, 1], [1, 1, 1], 1], {}, ["schedule_conv3d_nchw_cuda", [192, 1, 10, 10, 10], [192, 1, 10, 10, 10], [1, 1, 1], [1, 1, 1], [1, 1, 1], 1], {"i": 4740846981, "t": "", "c": null, "e": [["tile_n", "sp", [-1, 2, 12, 4]], ["tile_f", "sp", [-1, 2, 2, 1]], ["tile_d", "sp", [-1, 3, 1, 1]], ["tile_y", "sp", [-1, 1, 3, 1]], ["tile_x", "sp", [-1, 1, 1, 1]], ["tile_rc", "sp", [-1, 1]], ["tile_rd", "sp", [-1, 1]], ["tile_ry", "sp", [-1, 1]], ["tile_rx", "sp", [-1, 2]], ["auto_unroll_max_step", "ot", 512], ["unroll_explicit", "ot", 1], ["fuse_yx", "ot", 1]]}], "r": [[0.0056261755], 0, 1.094625473022461, 1577714986.227419], "v": 0.1}
{"i": ["cuda", "schedule_conv3d_nchw_cuda", [[192, 1, 10, 10, 10], [192, 1, 10, 10, 10], [1, 1, 1], [1, 1, 1], [1, 1, 1], 1], {}, ["schedule_conv3d_nchw_cuda", [192, 1, 10, 10, 10], [192, 1, 10, 10, 10], [1, 1, 1], [1, 1, 1], [1, 1, 1], 1], {"i": 3854663761, "t": "", "c": null, "e": [["tile_n", "sp", [-1, 1, 3, 4]], ["tile_f", "sp", [-1, 1, 8, 3]], ["tile_d", "sp", [-1, 1, 1, 3]], ["tile_y", "sp", [-1, 1, 1, 3]], ["tile_x", "sp", [-1, 3, 1, 1]], ["tile_rc", "sp", [-1, 1]], ["tile_rd", "sp", [-1, 2]], ["tile_ry", "sp", [-1, 2]], ["tile_rx", "sp", [-1, 2]], ["auto_unroll_max_step", "ot", 1500], ["unroll_explicit", "ot", 0], ["fuse_yx", "ot", 1]]}], "r": [[0.00282476675], 0, 1.786332368850708, 1577714994.0506785], "v": 0.1}
{"i": ["cuda", "schedule_conv3d_nchw_cuda", [[192, 1, 10, 10, 10], [192, 1, 10, 10, 10], [1, 1, 1], [1, 1, 1], [1, 1, 1], 1], {}, ["schedule_conv3d_nchw_cuda", [192, 1, 10, 10, 10], [192, 1, 10, 10, 10], [1, 1, 1], [1, 1, 1], [1, 1, 1], 1], {"i": 1428226066, "t": "", "c": null, "e": [["tile_n", "sp", [-1, 8, 1, 12]], ["tile_f", "sp", [-1, 2, 1, 12]], ["tile_d", "sp", [-1, 1, 3, 1]], ["tile_y", "sp", [-1, 1, 3, 1]], ["tile_x", "sp", [-1, 1, 3, 1]], ["tile_rc", "sp", [-1, 1]], ["tile_rd", "sp", [-1, 2]], ["tile_ry", "sp", [-1, 2]], ["tile_rx", "sp", [-1, 1]], ["auto_unroll_max_step", "ot", 0], ["unroll_explicit", "ot", 1], ["fuse_yx", "ot", 0]]}], "r": [[0.077801229], 0, 2.2283754348754883, 1577714995.7166395], "v": 0.1}
{"i": ["cuda", "schedule_conv3d_nchw_cuda", [[192, 1, 10, 10, 10], [192, 1, 10, 10, 10], [1, 1, 1], [1, 1, 1], [1, 1, 1], 1], {}, ["schedule_conv3d_nchw_cuda", [192, 1, 10, 10, 10], [192, 1, 10, 10, 10], [1, 1, 1], [1, 1, 1], [1, 1, 1], 1], {"i": 4460580813, "t": "", "c": null, "e": [["tile_n", "sp", [-1, 4, 6, 1]], ["tile_f", "sp", [-1, 4, 1, 4]], ["tile_d", "sp", [-1, 1, 3, 1]], ["tile_y", "sp", [-1, 3, 1, 1]], ["tile_x", "sp", [-1, 3, 1, 1]], ["tile_rc", "sp", [-1, 1]], ["tile_rd", "sp", [-1, 2]], ["tile_ry", "sp", [-1, 5]], ["tile_rx", "sp", [-1, 5]], ["auto_unroll_max_step", "ot", 0], ["unroll_explicit", "ot", 1], ["fuse_yx", "ot", 1]]}], "r": [[0.0583396795], 0, 2.3103156089782715, 1577714997.0867603], "v": 0.1}
{"i": ["cuda", "schedule_conv3d_nchw_cuda", [[192, 1, 10, 10, 10], [192, 1, 10, 10, 10], [1, 1, 1], [1, 1, 1], [1, 1, 1], 1], {}, ["schedule_conv3d_nchw_cuda", [192, 1, 10, 10, 10], [192, 1, 10, 10, 10], [1, 1, 1], [1, 1, 1], [1, 1, 1], 1], {"i": 3358233473, "t": "", "c": null, "e": [["tile_n", "sp", [-1, 2, 4, 3]], ["tile_f", "sp", [-1, 3, 1, 2]], ["tile_d", "sp", [-1, 1, 3, 1]], ["tile_y", "sp", [-1, 1, 1, 1]], ["tile_x", "sp", [-1, 1, 1, 3]], ["tile_rc", "sp", [-1, 1]], ["tile_rd", "sp", [-1, 1]], ["tile_ry", "sp", [-1, 1]], ["tile_rx", "sp", [-1, 2]], ["auto_unroll_max_step", "ot", 512], ["unroll_explicit", "ot", 0], ["fuse_yx", "ot", 1]]}], "r": [[0.00478575025], 0, 1.3406078815460205, 1577715008.2346637], "v": 0.1}
{"i": ["cuda", "schedule_conv3d_nchw_cuda", [[192, 1, 10, 10, 10], [192, 1, 10, 10, 10], [1, 1, 1], [1, 1, 1], [1, 1, 1], 1], {}, ["schedule_conv3d_nchw_cuda", [192, 1, 10, 10, 10], [192, 1, 10, 10, 10], [1, 1, 1], [1, 1, 1], [1, 1, 1], 1], {"i": 135606147, "t": "", "c": null, "e": [["tile_n", "sp", [-1, 3, 1, 8]], ["tile_f", "sp", [-1, 6, 8, 1]], ["tile_d", "sp", [-1, 3, 1, 1]], ["tile_y", "sp", [-1, 1, 1, 1]], ["tile_x", "sp", [-1, 1, 1, 3]], ["tile_rc", "sp", [-1, 1]], ["tile_rd", "sp", [-1, 5]], ["tile_ry", "sp", [-1, 1]], ["tile_rx", "sp", [-1, 2]], ["auto_unroll_max_step", "ot", 0], ["unroll_explicit", "ot", 0], ["fuse_yx", "ot", 0]]}], "r": [[0.1435329125], 0, 3.3480842113494873, 1577715016.789082], "v": 0.1}
{"i": ["cuda", "schedule_conv3d_nchw_cuda", [[192, 1, 10, 10, 10], [192, 1, 10, 10, 10], [1, 1, 1], [1, 1, 1], [1, 1, 1], 1], {}, ["schedule_conv3d_nchw_cuda", [192, 1, 10, 10, 10], [192, 1, 10, 10, 10], [1, 1, 1], [1, 1, 1], [1, 1, 1], 1], {"i": 5134983351, "t": "", "c": null, "e": [["tile_n", "sp", [-1, 24, 1, 4]], ["tile_f", "sp", [-1, 3, 16, 1]], ["tile_d", "sp", [-1, 1, 1, 1]], ["tile_y", "sp", [-1, 1, 1, 3]], ["tile_x", "sp", [-1, 1, 3, 1]], ["tile_rc", "sp", [-1, 1]], ["tile_rd", "sp", [-1, 5]], ["tile_ry", "sp", [-1, 2]], ["tile_rx", "sp", [-1, 1]], ["auto_unroll_max_step", "ot", 1500], ["unroll_explicit", "ot", 1], ["fuse_yx", "ot", 1]]}], "r": [[0.03996158725], 0, 10.367103815078735, 1577715019.8508766], "v": 0.1}
{"i": ["cuda", "schedule_conv3d_nchw_cuda", [[192, 1, 10, 10, 10], [192, 1, 10, 10, 10], [1, 1, 1], [1, 1, 1], [1, 1, 1], 1], {}, ["schedule_conv3d_nchw_cuda", [192, 1, 10, 10, 10], [192, 1, 10, 10, 10], [1, 1, 1], [1, 1, 1], [1, 1, 1], 1], {"i": 377149296, "t": "", "c": null, "e": [["tile_n", "sp", [-1, 32, 6, 1]], ["tile_f", "sp", [-1, 4, 2, 6]], ["tile_d", "sp", [-1, 1, 1, 1]], ["tile_y", "sp", [-1, 1, 1, 3]], ["tile_x", "sp", [-1, 1, 1, 1]], ["tile_rc", "sp", [-1, 1]], ["tile_rd", "sp", [-1, 1]], ["tile_ry", "sp", [-1, 2]], ["tile_rx", "sp", [-1, 10]], ["auto_unroll_max_step", "ot", 0], ["unroll_explicit", "ot", 0], ["fuse_yx", "ot", 0]]}], "r": [[0.14398283475], 0, 3.295053243637085, 1577715022.2890675], "v": 0.1}
{"i": ["cuda", "schedule_conv3d_nchw_cuda", [[192, 1, 10, 10, 10], [192, 1, 10, 10, 10], [1, 1, 1], [1, 1, 1], [1, 1, 1], 1], {}, ["schedule_conv3d_nchw_cuda", [192, 1, 10, 10, 10], [192, 1, 10, 10, 10], [1, 1, 1], [1, 1, 1], [1, 1, 1], 1], {"i": 2897016698, "t": "", "c": null, "e": [["tile_n", "sp", [-1, 2, 16, 3]], ["tile_f", "sp", [-1, 1, 8, 24]], ["tile_d", "sp", [-1, 1, 1, 1]], ["tile_y", "sp", [-1, 1, 1, 3]], ["tile_x", "sp", [-1, 1, 1, 3]], ["tile_rc", "sp", [-1, 1]], ["tile_rd", "sp", [-1, 1]], ["tile_ry", "sp", [-1, 1]], ["tile_rx", "sp", [-1, 2]], ["auto_unroll_max_step", "ot", 0], ["unroll_explicit", "ot", 0], ["fuse_yx", "ot", 1]]}], "r": [[0.06337070175], 0, 2.242743968963623, 1577715039.8953118], "v": 0.1}
{"i": ["cuda", "schedule_conv3d_nchw_cuda", [[192, 1, 10, 10, 10], [192, 1, 10, 10, 10], [1, 1, 1], [1, 1, 1], [1, 1, 1], 1], {}, ["schedule_conv3d_nchw_cuda", [192, 1, 10, 10, 10], [192, 1, 10, 10, 10], [1, 1, 1], [1, 1, 1], [1, 1, 1], 1], {"i": 4811178075, "t": "", "c": null, "e": [["tile_n", "sp", [-1, 8, 6, 2]], ["tile_f", "sp", [-1, 12, 1, 1]], ["tile_d", "sp", [-1, 1, 1, 1]], ["tile_y", "sp", [-1, 1, 3, 1]], ["tile_x", "sp", [-1, 1, 1, 3]], ["tile_rc", "sp", [-1, 1]], ["tile_rd", "sp", [-1, 2]], ["tile_ry", "sp", [-1, 5]], ["tile_rx", "sp", [-1, 2]], ["auto_unroll_max_step", "ot", 512], ["unroll_explicit", "ot", 1], ["fuse_yx", "ot", 1]]}], "r": [[0.0492774315], 0, 8.133098840713501, 1577715042.7883768], "v": 0.1}
{"i": ["cuda", "schedule_conv3d_nchw_cuda", [[192, 1, 10, 10, 10], [192, 1, 10, 10, 10], [1, 1, 1], [1, 1, 1], [1, 1, 1], 1], {}, ["schedule_conv3d_nchw_cuda", [192, 1, 10, 10, 10], [192, 1, 10, 10, 10], [1, 1, 1], [1, 1, 1], [1, 1, 1], 1], {"i": 3763354341, "t": "", "c": null, "e": [["tile_n", "sp", [-1, 8, 4, 2]], ["tile_f", "sp", [-1, 1, 8, 6]], ["tile_d", "sp", [-1, 1, 3, 1]], ["tile_y", "sp", [-1, 3, 1, 1]], ["tile_x", "sp", [-1, 1, 1, 3]], ["tile_rc", "sp", [-1, 1]], ["tile_rd", "sp", [-1, 1]], ["tile_ry", "sp", [-1, 5]], ["tile_rx", "sp", [-1, 1]], ["auto_unroll_max_step", "ot", 1500], ["unroll_explicit", "ot", 0], ["fuse_yx", "ot", 1]]}], "r": [[0.0251090675], 0, 4.232872724533081, 1577715049.404358], "v": 0.1}
{"i": ["cuda", "schedule_conv3d_nchw_cuda", [[192, 1, 10, 10, 10], [192, 1, 10, 10, 10], [1, 1, 1], [1, 1, 1], [1, 1, 1], 1], {}, ["schedule_conv3d_nchw_cuda", [192, 1, 10, 10, 10], [192, 1, 10, 10, 10], [1, 1, 1], [1, 1, 1], [1, 1, 1], 1], {"i": 3823807284, "t": "", "c": null, "e": [["tile_n", "sp", [-1, 1, 2, 12]], ["tile_f", "sp", [-1, 2, 12, 1]], ["tile_d", "sp", [-1, 1, 3, 1]], ["tile_y", "sp", [-1, 1, 1, 3]], ["tile_x", "sp", [-1, 1, 1, 1]], ["tile_rc", "sp", [-1, 1]], ["tile_rd", "sp", [-1, 2]], ["tile_ry", "sp", [-1, 1]], ["tile_rx", "sp", [-1, 2]], ["auto_unroll_max_step", "ot", 1500], ["unroll_explicit", "ot", 0], ["fuse_yx", "ot", 1]]}], "r": [[0.003209897], 0, 1.2755050659179688, 1577715289.130403], "v": 0.1}
{"i": ["cuda", "schedule_conv3d_nchw_cuda", [[192, 1, 10, 10, 10], [192, 1, 10, 10, 10], [1, 1, 1], [1, 1, 1], [1, 1, 1], 1], {}, ["schedule_conv3d_nchw_cuda", [192, 1, 10, 10, 10], [192, 1, 10, 10, 10], [1, 1, 1], [1, 1, 1], [1, 1, 1], 1], {"i": 5211073332, "t": "", "c": null, "e": [["tile_n", "sp", [-1, 1, 2, 12]], ["tile_f", "sp", [-1, 2, 12, 1]], ["tile_d", "sp", [-1, 1, 3, 1]], ["tile_y", "sp", [-1, 1, 1, 3]], ["tile_x", "sp", [-1, 1, 1, 1]], ["tile_rc", "sp", [-1, 1]], ["tile_rd", "sp", [-1, 2]], ["tile_ry", "sp", [-1, 1]], ["tile_rx", "sp", [-1, 2]], ["auto_unroll_max_step", "ot", 1500], ["unroll_explicit", "ot", 1], ["fuse_yx", "ot", 1]]}], "r": [[0.00312897325], 0, 1.5579421520233154, 1577715289.8826573], "v": 0.1}
{"i": ["cuda", "schedule_conv3d_nchw_cuda", [[192, 1, 10, 10, 10], [192, 1, 10, 10, 10], [1, 1, 1], [1, 1, 1], [1, 1, 1], 1], {}, ["schedule_conv3d_nchw_cuda", [192, 1, 10, 10, 10], [192, 1, 10, 10, 10], [1, 1, 1], [1, 1, 1], [1, 1, 1], 1], {"i": 4748651316, "t": "", "c": null, "e": [["tile_n", "sp", [-1, 1, 2, 12]], ["tile_f", "sp", [-1, 2, 12, 1]], ["tile_d", "sp", [-1, 1, 3, 1]], ["tile_y", "sp", [-1, 1, 1, 3]], ["tile_x", "sp", [-1, 1, 1, 1]], ["tile_rc", "sp", [-1, 1]], ["tile_rd", "sp", [-1, 2]], ["tile_ry", "sp", [-1, 1]], ["tile_rx", "sp", [-1, 2]], ["auto_unroll_max_step", "ot", 512], ["unroll_explicit", "ot", 1], ["fuse_yx", "ot", 1]]}], "r": [[0.00317884875], 0, 1.299304723739624, 1577715290.4013326], "v": 0.1}
{"i": ["cuda", "schedule_conv3d_nchw_cuda", [[192, 1, 10, 10, 10], [192, 1, 10, 10, 10], [1, 1, 1], [1, 1, 1], [1, 1, 1], 1], {}, ["schedule_conv3d_nchw_cuda", [192, 1, 10, 10, 10], [192, 1, 10, 10, 10], [1, 1, 1], [1, 1, 1], [1, 1, 1], 1], {"i": 3241939257, "t": "", "c": null, "e": [["tile_n", "sp", [-1, 1, 2, 8]], ["tile_f", "sp", [-1, 4, 8, 1]], ["tile_d", "sp", [-1, 1, 1, 1]], ["tile_y", "sp", [-1, 1, 1, 3]], ["tile_x", "sp", [-1, 1, 3, 1]], ["tile_rc", "sp", [-1, 1]], ["tile_rd", "sp", [-1, 1]], ["tile_ry", "sp", [-1, 1]], ["tile_rx", "sp", [-1, 1]], ["auto_unroll_max_step", "ot", 512], ["unroll_explicit", "ot", 0], ["fuse_yx", "ot", 1]]}], "r": [[0.0017039765], 0, 1.1321842670440674, 1577715291.0185444], "v": 0.1}
{"i": ["cuda", "schedule_conv3d_nchw_cuda", [[192, 1, 10, 10, 10], [192, 1, 10, 10, 10], [1, 1, 1], [1, 1, 1], [1, 1, 1], 1], {}, ["schedule_conv3d_nchw_cuda", [192, 1, 10, 10, 10], [192, 1, 10, 10, 10], [1, 1, 1], [1, 1, 1], [1, 1, 1], 1], {"i": 4629205305, "t": "", "c": null, "e": [["tile_n", "sp", [-1, 1, 2, 8]], ["tile_f", "sp", [-1, 4, 8, 1]], ["tile_d", "sp", [-1, 1, 1, 1]], ["tile_y", "sp", [-1, 1, 1, 3]], ["tile_x", "sp", [-1, 1, 3, 1]], ["tile_rc", "sp", [-1, 1]], ["tile_rd", "sp", [-1, 1]], ["tile_ry", "sp", [-1, 1]], ["tile_rx", "sp", [-1, 1]], ["auto_unroll_max_step", "ot", 512], ["unroll_explicit", "ot", 1], ["fuse_yx", "ot", 1]]}], "r": [[0.00186520325], 0, 1.2323098182678223, 1577715291.6424856], "v": 0.1}
{"i": ["cuda", "schedule_conv3d_nchw_cuda", [[192, 1, 10, 10, 10], [192, 1, 10, 10, 10], [1, 1, 1], [1, 1, 1], [1, 1, 1], 1], {}, ["schedule_conv3d_nchw_cuda", [192, 1, 10, 10, 10], [192, 1, 10, 10, 10], [1, 1, 1], [1, 1, 1], [1, 1, 1], 1], {"i": 3823915404, "t": "", "c": null, "e": [["tile_n", "sp", [-1, 1, 6, 4]], ["tile_f", "sp", [-1, 2, 6, 1]], ["tile_d", "sp", [-1, 1, 1, 3]], ["tile_y", "sp", [-1, 1, 1, 3]], ["tile_x", "sp", [-1, 1, 1, 1]], ["tile_rc", "sp", [-1, 1]], ["tile_rd", "sp", [-1, 2]], ["tile_ry", "sp", [-1, 1]], ["tile_rx", "sp", [-1, 2]], ["auto_unroll_max_step", "ot", 1500], ["unroll_explicit", "ot", 0], ["fuse_yx", "ot", 1]]}], "r": [[0.0025793745], 0, 1.1574411392211914, 1577715292.2291336], "v": 0.1}
{"i": ["cuda", "schedule_conv3d_nchw_cuda", [[192, 1, 10, 10, 10], [192, 1, 10, 10, 10], [1, 1, 1], [1, 1, 1], [1, 1, 1], 1], {}, ["schedule_conv3d_nchw_cuda", [192, 1, 10, 10, 10], [192, 1, 10, 10, 10], [1, 1, 1], [1, 1, 1], [1, 1, 1], 1], {"i": 4663745369, "t": "", "c": null, "e": [["tile_n", "sp", [-1, 1, 2, 4]], ["tile_f", "sp", [-1, 2, 4, 1]], ["tile_d", "sp", [-1, 1, 3, 1]], ["tile_y", "sp", [-1, 1, 1, 3]], ["tile_x", "sp", [-1, 3, 1, 1]], ["tile_rc", "sp", [-1, 1]], ["tile_rd", "sp", [-1, 2]], ["tile_ry", "sp", [-1, 2]], ["tile_rx", "sp", [-1, 1]], ["auto_unroll_max_step", "ot", 512], ["unroll_explicit", "ot", 1], ["fuse_yx", "ot", 1]]}], "r": [[0.00224271925], 0, 1.5432584285736084, 1577715292.942202], "v": 0.1}
{"i": ["cuda", "schedule_conv3d_nchw_cuda", [[192, 1, 10, 10, 10], [192, 1, 10, 10, 10], [1, 1, 1], [1, 1, 1], [1, 1, 1], 1], {}, ["schedule_conv3d_nchw_cuda", [192, 1, 10, 10, 10], [192, 1, 10, 10, 10], [1, 1, 1], [1, 1, 1], [1, 1, 1], 1], {"i": 4286229300, "t": "", "c": null, "e": [["tile_n", "sp", [-1, 1, 2, 12]], ["tile_f", "sp", [-1, 2, 12, 1]], ["tile_d", "sp", [-1, 1, 3, 1]], ["tile_y", "sp", [-1, 1, 1, 3]], ["tile_x", "sp", [-1, 1, 1, 1]], ["tile_rc", "sp", [-1, 1]], ["tile_rd", "sp", [-1, 2]], ["tile_ry", "sp", [-1, 1]], ["tile_rx", "sp", [-1, 2]], ["auto_unroll_max_step", "ot", 0], ["unroll_explicit", "ot", 1], ["fuse_yx", "ot", 1]]}], "r": [[0.0013356195], 0, 1.1410088539123535, 1577715293.488023], "v": 0.1}
{"i": ["cuda", "schedule_conv3d_nchw_cuda", [[192, 1, 10, 10, 10], [192, 1, 10, 10, 10], [1, 1, 1], [1, 1, 1], [1, 1, 1], 1], {}, ["schedule_conv3d_nchw_cuda", [192, 1, 10, 10, 10], [192, 1, 10, 10, 10], [1, 1, 1], [1, 1, 1], [1, 1, 1], 1], {"i": 5156652674, "t": "", "c": null, "e": [["tile_n", "sp", [-1, 2, 3, 4]], ["tile_f", "sp", [-1, 2, 6, 1]], ["tile_d", "sp", [-1, 1, 1, 1]], ["tile_y", "sp", [-1, 1, 1, 3]], ["tile_x", "sp", [-1, 1, 3, 1]], ["tile_rc", "sp", [-1, 1]], ["tile_rd", "sp", [-1, 2]], ["tile_ry", "sp", [-1, 5]], ["tile_rx", "sp", [-1, 1]], ["auto_unroll_max_step", "ot", 1500], ["unroll_explicit", "ot", 1], ["fuse_yx", "ot", 1]]}], "r": [[0.00176342125], 0, 2.453247547149658, 1577715294.3112159], "v": 0.1}
{"i": ["cuda", "schedule_conv3d_nchw_cuda", [[192, 1, 10, 10, 10], [192, 1, 10, 10, 10], [1, 1, 1], [1, 1, 1], [1, 1, 1], 1], {}, ["schedule_conv3d_nchw_cuda", [192, 1, 10, 10, 10], [192, 1, 10, 10, 10], [1, 1, 1], [1, 1, 1], [1, 1, 1], 1], {"i": 3769386626, "t": "", "c": null, "e": [["tile_n", "sp", [-1, 2, 3, 4]], ["tile_f", "sp", [-1, 2, 6, 1]], ["tile_d", "sp", [-1, 1, 1, 1]], ["tile_y", "sp", [-1, 1, 1, 3]], ["tile_x", "sp", [-1, 1, 3, 1]], ["tile_rc", "sp", [-1, 1]], ["tile_rd", "sp", [-1, 2]], ["tile_ry", "sp", [-1, 5]], ["tile_rx", "sp", [-1, 1]], ["auto_unroll_max_step", "ot", 1500], ["unroll_explicit", "ot", 0], ["fuse_yx", "ot", 1]]}], "r": [[0.00436078775], 0, 1.8515503406524658, 1577715295.2603257], "v": 0.1}
{"i": ["cuda", "schedule_conv3d_nchw_cuda", [[192, 1, 10, 10, 10], [192, 1, 10, 10, 10], [1, 1, 1], [1, 1, 1], [1, 1, 1], 1], {}, ["schedule_conv3d_nchw_cuda", [192, 1, 10, 10, 10], [192, 1, 10, 10, 10], [1, 1, 1], [1, 1, 1], [1, 1, 1], 1], {"i": 4694230658, "t": "", "c": null, "e": [["tile_n", "sp", [-1, 2, 3, 4]], ["tile_f", "sp", [-1, 2, 6, 1]], ["tile_d", "sp", [-1, 1, 1, 1]], ["tile_y", "sp", [-1, 1, 1, 3]], ["tile_x", "sp", [-1, 1, 3, 1]], ["tile_rc", "sp", [-1, 1]], ["tile_rd", "sp", [-1, 2]], ["tile_ry", "sp", [-1, 5]], ["tile_rx", "sp", [-1, 1]], ["auto_unroll_max_step", "ot", 512], ["unroll_explicit", "ot", 1], ["fuse_yx", "ot", 1]]}], "r": [[0.00247975975], 0, 1.8136365413665771, 1577715296.0084848], "v": 0.1}
{"i": ["cuda", "schedule_conv3d_nchw_cuda", [[192, 1, 10, 10, 10], [192, 1, 10, 10, 10], [1, 1, 1], [1, 1, 1], [1, 1, 1], 1], {}, ["schedule_conv3d_nchw_cuda", [192, 1, 10, 10, 10], [192, 1, 10, 10, 10], [1, 1, 1], [1, 1, 1], [1, 1, 1], 1], {"i": 3991556155, "t": "", "c": null, "e": [["tile_n", "sp", [-1, 1, 24, 2]], ["tile_f", "sp", [-1, 2, 2, 1]], ["tile_d", "sp", [-1, 1, 1, 1]], ["tile_y", "sp", [-1, 1, 1, 3]], ["tile_x", "sp", [-1, 3, 1, 1]], ["tile_rc", "sp", [-1, 1]], ["tile_rd", "sp", [-1, 1]], ["tile_ry", "sp", [-1, 5]], ["tile_rx", "sp", [-1, 5]], ["auto_unroll_max_step", "ot", 1500], ["unroll_explicit", "ot", 0], ["fuse_yx", "ot", 1]]}], "r": [[0.00258405775], 0, 1.8291358947753906, 1577715297.157046], "v": 0.1}
{"i": ["cuda", "schedule_conv3d_nchw_cuda", [[192, 1, 10, 10, 10], [192, 1, 10, 10, 10], [1, 1, 1], [1, 1, 1], [1, 1, 1], 1], {}, ["schedule_conv3d_nchw_cuda", [192, 1, 10, 10, 10], [192, 1, 10, 10, 10], [1, 1, 1], [1, 1, 1], [1, 1, 1], 1], {"i": 5378822203, "t": "", "c": null, "e": [["tile_n", "sp", [-1, 1, 24, 2]], ["tile_f", "sp", [-1, 2, 2, 1]], ["tile_d", "sp", [-1, 1, 1, 1]], ["tile_y", "sp", [-1, 1, 1, 3]], ["tile_x", "sp", [-1, 3, 1, 1]], ["tile_rc", "sp", [-1, 1]], ["tile_rd", "sp", [-1, 1]], ["tile_ry", "sp", [-1, 5]], ["tile_rx", "sp", [-1, 5]], ["auto_unroll_max_step", "ot", 1500], ["unroll_explicit", "ot", 1], ["fuse_yx", "ot", 1]]}], "r": [[0.00396818625], 0, 2.764164686203003, 1577715301.253465], "v": 0.1}
{"i": ["cuda", "schedule_conv3d_nchw_cuda", [[192, 1, 10, 10, 10], [192, 1, 10, 10, 10], [1, 1, 1], [1, 1, 1], [1, 1, 1], 1], {}, ["schedule_conv3d_nchw_cuda", [192, 1, 10, 10, 10], [192, 1, 10, 10, 10], [1, 1, 1], [1, 1, 1], [1, 1, 1], 1], {"i": 5181937892, "t": "", "c": null, "e": [["tile_n", "sp", [-1, 1, 24, 1]], ["tile_f", "sp", [-1, 2, 4, 1]], ["tile_d", "sp", [-1, 1, 1, 1]], ["tile_y", "sp", [-1, 1, 1, 3]], ["tile_x", "sp", [-1, 1, 1, 1]], ["tile_rc", "sp", [-1, 1]], ["tile_rd", "sp", [-1, 2]], ["tile_ry", "sp", [-1, 10]], ["tile_rx", "sp", [-1, 1]], ["auto_unroll_max_step", "ot", 1500], ["unroll_explicit", "ot", 1], ["fuse_yx", "ot", 1]]}], "r": [[0.00100222525], 0, 3.3177332878112793, 1577715302.086144], "v": 0.1}
{"i": ["cuda", "schedule_conv3d_nchw_cuda", [[192, 1, 10, 10, 10], [192, 1, 10, 10, 10], [1, 1, 1], [1, 1, 1], [1, 1, 1], 1], {}, ["schedule_conv3d_nchw_cuda", [192, 1, 10, 10, 10], [192, 1, 10, 10, 10], [1, 1, 1], [1, 1, 1], [1, 1, 1], 1], {"i": 3794671844, "t": "", "c": null, "e": [["tile_n", "sp", [-1, 1, 24, 1]], ["tile_f", "sp", [-1, 2, 4, 1]], ["tile_d", "sp", [-1, 1, 1, 1]], ["tile_y", "sp", [-1, 1, 1, 3]], ["tile_x", "sp", [-1, 1, 1, 1]], ["tile_rc", "sp", [-1, 1]], ["tile_rd", "sp", [-1, 2]], ["tile_ry", "sp", [-1, 10]], ["tile_rx", "sp", [-1, 1]], ["auto_unroll_max_step", "ot", 1500], ["unroll_explicit", "ot", 0], ["fuse_yx", "ot", 1]]}], "r": [[0.005279929], 0, 2.1900672912597656, 1577715303.2136617], "v": 0.1}
{"i": ["cuda", "schedule_conv3d_nchw_cuda", [[192, 1, 10, 10, 10], [192, 1, 10, 10, 10], [1, 1, 1], [1, 1, 1], [1, 1, 1], 1], {}, ["schedule_conv3d_nchw_cuda", [192, 1, 10, 10, 10], [192, 1, 10, 10, 10], [1, 1, 1], [1, 1, 1], [1, 1, 1], 1], {"i": 4719515876, "t": "", "c": null, "e": [["tile_n", "sp", [-1, 1, 24, 1]], ["tile_f", "sp", [-1, 2, 4, 1]], ["tile_d", "sp", [-1, 1, 1, 1]], ["tile_y", "sp", [-1, 1, 1, 3]], ["tile_x", "sp", [-1, 1, 1, 1]], ["tile_rc", "sp", [-1, 1]], ["tile_rd", "sp", [-1, 2]], ["tile_ry", "sp", [-1, 10]], ["tile_rx", "sp", [-1, 1]], ["auto_unroll_max_step", "ot", 512], ["unroll_explicit", "ot", 1], ["fuse_yx", "ot", 1]]}], "r": [[0.0022209325], 0, 1.3841774463653564, 1577715303.9246335], "v": 0.1}
{"i": ["cuda", "schedule_conv3d_nchw_cuda", [[192, 1, 10, 10, 10], [192, 1, 10, 10, 10], [1, 1, 1], [1, 1, 1], [1, 1, 1], 1], {}, ["schedule_conv3d_nchw_cuda", [192, 1, 10, 10, 10], [192, 1, 10, 10, 10], [1, 1, 1], [1, 1, 1], [1, 1, 1], 1], {"i": 3332249828, "t": "", "c": null, "e": [["tile_n", "sp", [-1, 1, 24, 1]], ["tile_f", "sp", [-1, 2, 4, 1]], ["tile_d", "sp", [-1, 1, 1, 1]], ["tile_y", "sp", [-1, 1, 1, 3]], ["tile_x", "sp", [-1, 1, 1, 1]], ["tile_rc", "sp", [-1, 1]], ["tile_rd", "sp", [-1, 2]], ["tile_ry", "sp", [-1, 10]], ["tile_rx", "sp", [-1, 1]], ["auto_unroll_max_step", "ot", 512], ["unroll_explicit", "ot", 0], ["fuse_yx", "ot", 1]]}], "r": [[0.00310309925], 0, 1.2559499740600586, 1577715304.6614707], "v": 0.1}
{"i": ["cuda", "schedule_conv3d_nchw_cuda", [[192, 1, 10, 10, 10], [192, 1, 10, 10, 10], [1, 1, 1], [1, 1, 1], [1, 1, 1], 1], {}, ["schedule_conv3d_nchw_cuda", [192, 1, 10, 10, 10], [192, 1, 10, 10, 10], [1, 1, 1], [1, 1, 1], [1, 1, 1], 1], {"i": 5268865523, "t": "", "c": null, "e": [["tile_n", "sp", [-1, 1, 12, 2]], ["tile_f", "sp", [-1, 2, 3, 1]], ["tile_d", "sp", [-1, 1, 3, 1]], ["tile_y", "sp", [-1, 1, 1, 3]], ["tile_x", "sp", [-1, 1, 1, 1]], ["tile_rc", "sp", [-1, 1]], ["tile_rd", "sp", [-1, 2]], ["tile_ry", "sp", [-1, 5]], ["tile_rx", "sp", [-1, 2]], ["auto_unroll_max_step", "ot", 1500], ["unroll_explicit", "ot", 1], ["fuse_yx", "ot", 1]]}], "r": [[0.00349851175], 0, 2.0462887287139893, 1577715305.5515516], "v": 0.1}
{"i": ["cuda", "schedule_conv3d_nchw_cuda", [[192, 1, 10, 10, 10], [192, 1, 10, 10, 10], [1, 1, 1], [1, 1, 1], [1, 1, 1], 1], {}, ["schedule_conv3d_nchw_cuda", [192, 1, 10, 10, 10], [192, 1, 10, 10, 10], [1, 1, 1], [1, 1, 1], [1, 1, 1], 1], {"i": 4658110315, "t": "", "c": null, "e": [["tile_n", "sp", [-1, 3, 2, 4]], ["tile_f", "sp", [-1, 2, 16, 1]], ["tile_d", "sp", [-1, 1, 1, 1]], ["tile_y", "sp", [-1, 1, 1, 3]], ["tile_x", "sp", [-1, 1, 3, 1]], ["tile_rc", "sp", [-1, 1]], ["tile_rd", "sp", [-1, 1]], ["tile_ry", "sp", [-1, 2]], ["tile_rx", "sp", [-1, 1]], ["auto_unroll_max_step", "ot", 512], ["unroll_explicit", "ot", 1], ["fuse_yx", "ot", 1]]}], "r": [[0.0012675235], 0, 1.216188669204712, 1577715306.1431565], "v": 0.1}
{"i": ["cuda", "schedule_conv3d_nchw_cuda", [[192, 1, 10, 10, 10], [192, 1, 10, 10, 10], [1, 1, 1], [1, 1, 1], [1, 1, 1], 1], {}, ["schedule_conv3d_nchw_cuda", [192, 1, 10, 10, 10], [192, 1, 10, 10, 10], [1, 1, 1], [1, 1, 1], [1, 1, 1], 1], {"i": 3733266283, "t": "", "c": null, "e": [["tile_n", "sp", [-1, 3, 2, 4]], ["tile_f", "sp", [-1, 2, 16, 1]], ["tile_d", "sp", [-1, 1, 1, 1]], ["tile_y", "sp", [-1, 1, 1, 3]], ["tile_x", "sp", [-1, 1, 3, 1]], ["tile_rc", "sp", [-1, 1]], ["tile_rd", "sp", [-1, 1]], ["tile_ry", "sp", [-1, 2]], ["tile_rx", "sp", [-1, 1]], ["auto_unroll_max_step", "ot", 1500], ["unroll_explicit", "ot", 0], ["fuse_yx", "ot", 1]]}], "r": [[0.000784992], 0, 1.2586069107055664, 1577715306.7630517], "v": 0.1}
{"i": ["cuda", "schedule_conv3d_nchw_cuda", [[192, 1, 10, 10, 10], [192, 1, 10, 10, 10], [1, 1, 1], [1, 1, 1], [1, 1, 1], 1], {}, ["schedule_conv3d_nchw_cuda", [192, 1, 10, 10, 10], [192, 1, 10, 10, 10], [1, 1, 1], [1, 1, 1], [1, 1, 1], 1], {"i": 3270844267, "t": "", "c": null, "e": [["tile_n", "sp", [-1, 3, 2, 4]], ["tile_f", "sp", [-1, 2, 16, 1]], ["tile_d", "sp", [-1, 1, 1, 1]], ["tile_y", "sp", [-1, 1, 1, 3]], ["tile_x", "sp", [-1, 1, 3, 1]], ["tile_rc", "sp", [-1, 1]], ["tile_rd", "sp", [-1, 1]], ["tile_ry", "sp", [-1, 2]], ["tile_rx", "sp", [-1, 1]], ["auto_unroll_max_step", "ot", 512], ["unroll_explicit", "ot", 0], ["fuse_yx", "ot", 1]]}], "r": [[0.00124873575], 0, 1.1130142211914062, 1577715307.3523374], "v": 0.1}
{"i": ["cuda", "schedule_conv3d_nchw_cuda", [[192, 1, 10, 10, 10], [192, 1, 10, 10, 10], [1, 1, 1], [1, 1, 1], [1, 1, 1], 1], {}, ["schedule_conv3d_nchw_cuda", [192, 1, 10, 10, 10], [192, 1, 10, 10, 10], [1, 1, 1], [1, 1, 1], [1, 1, 1], 1], {"i": 3361404039, "t": "", "c": null, "e": [["tile_n", "sp", [-1, 1, 4, 6]], ["tile_f", "sp", [-1, 3, 4, 2]], ["tile_d", "sp", [-1, 1, 3, 1]], ["tile_y", "sp", [-1, 1, 1, 3]], ["tile_x", "sp", [-1, 1, 1, 1]], ["tile_rc", "sp", [-1, 1]], ["tile_rd", "sp", [-1, 2]], ["tile_ry", "sp", [-1, 1]], ["tile_rx", "sp", [-1, 2]], ["auto_unroll_max_step", "ot", 512], ["unroll_explicit", "ot", 0], ["fuse_yx", "ot", 1]]}], "r": [[0.000934945], 0, 1.1667101383209229, 1577715307.944679], "v": 0.1}
{"i": ["cuda", "schedule_conv3d_nchw_cuda", [[192, 1, 10, 10, 10], [192, 1, 10, 10, 10], [1, 1, 1], [1, 1, 1], [1, 1, 1], 1], {}, ["schedule_conv3d_nchw_cuda", [192, 1, 10, 10, 10], [192, 1, 10, 10, 10], [1, 1, 1], [1, 1, 1], [1, 1, 1], 1], {"i": 4744810164, "t": "", "c": null, "e": [["tile_n", "sp", [-1, 1, 2, 12]], ["tile_f", "sp", [-1, 2, 8, 1]], ["tile_d", "sp", [-1, 1, 1, 1]], ["tile_y", "sp", [-1, 1, 1, 3]], ["tile_x", "sp", [-1, 1, 3, 1]], ["tile_rc", "sp", [-1, 1]], ["tile_rd", "sp", [-1, 1]], ["tile_ry", "sp", [-1, 1]], ["tile_rx", "sp", [-1, 2]], ["auto_unroll_max_step", "ot", 512], ["unroll_explicit", "ot", 1], ["fuse_yx", "ot", 1]]}], "r": [[0.00074827], 0, 1.3101990222930908, 1577715308.632742], "v": 0.1}
{"i": ["cuda", "schedule_conv3d_nchw_cuda", [[192, 1, 10, 10, 10], [192, 1, 10, 10, 10], [1, 1, 1], [1, 1, 1], [1, 1, 1], 1], {}, ["schedule_conv3d_nchw_cuda", [192, 1, 10, 10, 10], [192, 1, 10, 10, 10], [1, 1, 1], [1, 1, 1], [1, 1, 1], 1], {"i": 3357544116, "t": "", "c": null, "e": [["tile_n", "sp", [-1, 1, 2, 12]], ["tile_f", "sp", [-1, 2, 8, 1]], ["tile_d", "sp", [-1, 1, 1, 1]], ["tile_y", "sp", [-1, 1, 1, 3]], ["tile_x", "sp", [-1, 1, 3, 1]], ["tile_rc", "sp", [-1, 1]], ["tile_rd", "sp", [-1, 1]], ["tile_ry", "sp", [-1, 1]], ["tile_rx", "sp", [-1, 2]], ["auto_unroll_max_step", "ot", 512], ["unroll_explicit", "ot", 0], ["fuse_yx", "ot", 1]]}], "r": [[0.000738401], 0, 1.18178391456604, 1577715309.3198798], "v": 0.1}
{"i": ["cuda", "schedule_conv3d_nchw_cuda", [[192, 1, 10, 10, 10], [192, 1, 10, 10, 10], [1, 1, 1], [1, 1, 1], [1, 1, 1], 1], {}, ["schedule_conv3d_nchw_cuda", [192, 1, 10, 10, 10], [192, 1, 10, 10, 10], [1, 1, 1], [1, 1, 1], [1, 1, 1], 1], {"i": 5207232180, "t": "", "c": null, "e": [["tile_n", "sp", [-1, 1, 2, 12]], ["tile_f", "sp", [-1, 2, 8, 1]], ["tile_d", "sp", [-1, 1, 1, 1]], ["tile_y", "sp", [-1, 1, 1, 3]], ["tile_x", "sp", [-1, 1, 3, 1]], ["tile_rc", "sp", [-1, 1]], ["tile_rd", "sp", [-1, 1]], ["tile_ry", "sp", [-1, 1]], ["tile_rx", "sp", [-1, 2]], ["auto_unroll_max_step", "ot", 1500], ["unroll_explicit", "ot", 1], ["fuse_yx", "ot", 1]]}], "r": [[0.000754353], 0, 1.0856845378875732, 1577715313.0548499], "v": 0.1}
{"i": ["cuda", "schedule_conv3d_nchw_cuda", [[192, 1, 10, 10, 10], [192, 1, 10, 10, 10], [1, 1, 1], [1, 1, 1], [1, 1, 1], 1], {}, ["schedule_conv3d_nchw_cuda", [192, 1, 10, 10, 10], [192, 1, 10, 10, 10], [1, 1, 1], [1, 1, 1], [1, 1, 1], 1], {"i": 3819966132, "t": "", "c": null, "e": [["tile_n", "sp", [-1, 1, 2, 12]], ["tile_f", "sp", [-1, 2, 8, 1]], ["tile_d", "sp", [-1, 1, 1, 1]], ["tile_y", "sp", [-1, 1, 1, 3]], ["tile_x", "sp", [-1, 1, 3, 1]], ["tile_rc", "sp", [-1, 1]], ["tile_rd", "sp", [-1, 1]], ["tile_ry", "sp", [-1, 1]], ["tile_rx", "sp", [-1, 2]], ["auto_unroll_max_step", "ot", 1500], ["unroll_explicit", "ot", 0], ["fuse_yx", "ot", 1]]}], "r": [[0.000736966], 0, 0.9294867515563965, 1577715313.5373113], "v": 0.1}
{"i": ["cuda", "schedule_conv3d_nchw_cuda", [[192, 1, 10, 10, 10], [192, 1, 10, 10, 10], [1, 1, 1], [1, 1, 1], [1, 1, 1], 1], {}, ["schedule_conv3d_nchw_cuda", [192, 1, 10, 10, 10], [192, 1, 10, 10, 10], [1, 1, 1], [1, 1, 1], [1, 1, 1], 1], {"i": 5211094164, "t": "", "c": null, "e": [["tile_n", "sp", [-1, 1, 2, 12]], ["tile_f", "sp", [-1, 1, 6, 2]], ["tile_d", "sp", [-1, 1, 3, 1]], ["tile_y", "sp", [-1, 1, 1, 3]], ["tile_x", "sp", [-1, 1, 1, 1]], ["tile_rc", "sp", [-1, 1]], ["tile_rd", "sp", [-1, 2]], ["tile_ry", "sp", [-1, 1]], ["tile_rx", "sp", [-1, 2]], ["auto_unroll_max_step", "ot", 1500], ["unroll_explicit", "ot", 1], ["fuse_yx", "ot", 1]]}], "r": [[0.00387772775], 0, 1.676926851272583, 1577715314.326413], "v": 0.1}
{"i": ["cuda", "schedule_conv3d_nchw_cuda", [[192, 1, 10, 10, 10], [192, 1, 10, 10, 10], [1, 1, 1], [1, 1, 1], [1, 1, 1], 1], {}, ["schedule_conv3d_nchw_cuda", [192, 1, 10, 10, 10], [192, 1, 10, 10, 10], [1, 1, 1], [1, 1, 1], [1, 1, 1], 1], {"i": 5203847988, "t": "", "c": null, "e": [["tile_n", "sp", [-1, 1, 2, 12]], ["tile_f", "sp", [-1, 2, 12, 1]], ["tile_d", "sp", [-1, 1, 3, 1]], ["tile_y", "sp", [-1, 1, 1, 3]], ["tile_x", "sp", [-1, 1, 1, 1]], ["tile_rc", "sp", [-1, 1]], ["tile_rd", "sp", [-1, 1]], ["tile_ry", "sp", [-1, 1]], ["tile_rx", "sp", [-1, 2]], ["auto_unroll_max_step", "ot", 1500], ["unroll_explicit", "ot", 1], ["fuse_yx", "ot", 1]]}], "r": [[0.00157382775], 0, 3.311936140060425, 1577715315.0945246], "v": 0.1}
{"i": ["cuda", "schedule_conv3d_nchw_cuda", [[192, 1, 10, 10, 10], [192, 1, 10, 10, 10], [1, 1, 1], [1, 1, 1], [1, 1, 1], 1], {}, ["schedule_conv3d_nchw_cuda", [192, 1, 10, 10, 10], [192, 1, 10, 10, 10], [1, 1, 1], [1, 1, 1], [1, 1, 1], 1], {"i": 4741425972, "t": "", "c": null, "e": [["tile_n", "sp", [-1, 1, 2, 12]], ["tile_f", "sp", [-1, 2, 12, 1]], ["tile_d", "sp", [-1, 1, 3, 1]], ["tile_y", "sp", [-1, 1, 1, 3]], ["tile_x", "sp", [-1, 1, 1, 1]], ["tile_rc", "sp", [-1, 1]], ["tile_rd", "sp", [-1, 1]], ["tile_ry", "sp", [-1, 1]], ["tile_rx", "sp", [-1, 2]], ["auto_unroll_max_step", "ot", 512], ["unroll_explicit", "ot", 1], ["fuse_yx", "ot", 1]]}], "r": [[0.0014012405], 0, 1.2663195133209229, 1577715315.7196622], "v": 0.1}
{"i": ["cuda", "schedule_conv3d_nchw_cuda", [[192, 1, 10, 10, 10], [192, 1, 10, 10, 10], [1, 1, 1], [1, 1, 1], [1, 1, 1], 1], {}, ["schedule_conv3d_nchw_cuda", [192, 1, 10, 10, 10], [192, 1, 10, 10, 10], [1, 1, 1], [1, 1, 1], [1, 1, 1], 1], {"i": 2899071372, "t": "", "c": null, "e": [["tile_n", "sp", [-1, 1, 6, 4]], ["tile_f", "sp", [-1, 2, 6, 1]], ["tile_d", "sp", [-1, 1, 1, 3]], ["tile_y", "sp", [-1, 1, 1, 3]], ["tile_x", "sp", [-1, 1, 1, 1]], ["tile_rc", "sp", [-1, 1]], ["tile_rd", "sp", [-1, 2]], ["tile_ry", "sp", [-1, 1]], ["tile_rx", "sp", [-1, 2]], ["auto_unroll_max_step", "ot", 0], ["unroll_explicit", "ot", 0], ["fuse_yx", "ot", 1]]}], "r": [[0.0037635365], 0, 1.3432838916778564, 1577715316.581621], "v": 0.1}
{"i": ["cuda", "schedule_conv3d_nchw_cuda", [[192, 1, 10, 10, 10], [192, 1, 10, 10, 10], [1, 1, 1], [1, 1, 1], [1, 1, 1], 1], {}, ["schedule_conv3d_nchw_cuda", [192, 1, 10, 10, 10], [192, 1, 10, 10, 10], [1, 1, 1], [1, 1, 1], [1, 1, 1], 1], {"i": 4453978171, "t": "", "c": null, "e": [["tile_n", "sp", [-1, 1, 24, 2]], ["tile_f", "sp", [-1, 2, 2, 1]], ["tile_d", "sp", [-1, 1, 1, 1]], ["tile_y", "sp", [-1, 1, 1, 3]], ["tile_x", "sp", [-1, 3, 1, 1]], ["tile_rc", "sp", [-1, 1]], ["tile_rd", "sp", [-1, 1]], ["tile_ry", "sp", [-1, 5]], ["tile_rx", "sp", [-1, 5]], ["auto_unroll_max_step", "ot", 0], ["unroll_explicit", "ot", 1], ["fuse_yx", "ot", 1]]}], "r": [[0.00245235675], 0, 1.0067298412322998, 1577715317.1302137], "v": 0.1}
{"i": ["cuda", "schedule_conv3d_nchw_cuda", [[192, 1, 10, 10, 10], [192, 1, 10, 10, 10], [1, 1, 1], [1, 1, 1], [1, 1, 1], 1], {}, ["schedule_conv3d_nchw_cuda", [192, 1, 10, 10, 10], [192, 1, 10, 10, 10], [1, 1, 1], [1, 1, 1], [1, 1, 1], 1], {"i": 3272898082, "t": "", "c": null, "e": [["tile_n", "sp", [-1, 2, 4, 1]], ["tile_f", "sp", [-1, 4, 8, 2]], ["tile_d", "sp", [-1, 1, 3, 1]], ["tile_y", "sp", [-1, 1, 1, 3]], ["tile_x", "sp", [-1, 1, 1, 3]], ["tile_rc", "sp", [-1, 1]], ["tile_rd", "sp", [-1, 1]], ["tile_ry", "sp", [-1, 2]], ["tile_rx", "sp", [-1, 1]], ["auto_unroll_max_step", "ot", 512], ["unroll_explicit", "ot", 0], ["fuse_yx", "ot", 1]]}], "r": [[0.000977551], 0, 1.3191561698913574, 1577715317.8399897], "v": 0.1}
{"i": ["cuda", "schedule_conv3d_nchw_cuda", [[192, 1, 10, 10, 10], [192, 1, 10, 10, 10], [1, 1, 1], [1, 1, 1], [1, 1, 1], 1], {}, ["schedule_conv3d_nchw_cuda", [192, 1, 10, 10, 10], [192, 1, 10, 10, 10], [1, 1, 1], [1, 1, 1], [1, 1, 1], 1], {"i": 4660164130, "t": "", "c": null, "e": [["tile_n", "sp", [-1, 2, 4, 1]], ["tile_f", "sp", [-1, 4, 8, 2]], ["tile_d", "sp", [-1, 1, 3, 1]], ["tile_y", "sp", [-1, 1, 1, 3]], ["tile_x", "sp", [-1, 1, 1, 3]], ["tile_rc", "sp", [-1, 1]], ["tile_rd", "sp", [-1, 1]], ["tile_ry", "sp", [-1, 2]], ["tile_rx", "sp", [-1, 1]], ["auto_unroll_max_step", "ot", 512], ["unroll_explicit", "ot", 1], ["fuse_yx", "ot", 1]]}], "r": [[0.00139023375], 0, 1.5101807117462158, 1577715318.522962], "v": 0.1}
{"i": ["cuda", "schedule_conv3d_nchw_cuda", [[192, 1, 10, 10, 10], [192, 1, 10, 10, 10], [1, 1, 1], [1, 1, 1], [1, 1, 1], 1], {}, ["schedule_conv3d_nchw_cuda", [192, 1, 10, 10, 10], [192, 1, 10, 10, 10], [1, 1, 1], [1, 1, 1], [1, 1, 1], 1], {"i": 3735320098, "t": "", "c": null, "e": [["tile_n", "sp", [-1, 2, 4, 1]], ["tile_f", "sp", [-1, 4, 8, 2]], ["tile_d", "sp", [-1, 1, 3, 1]], ["tile_y", "sp", [-1, 1, 1, 3]], ["tile_x", "sp", [-1, 1, 1, 3]], ["tile_rc", "sp", [-1, 1]], ["tile_rd", "sp", [-1, 1]], ["tile_ry", "sp", [-1, 2]], ["tile_rx", "sp", [-1, 1]], ["auto_unroll_max_step", "ot", 1500], ["unroll_explicit", "ot", 0], ["fuse_yx", "ot", 1]]}], "r": [[0.0008551125], 0, 1.5170609951019287, 1577715319.314097], "v": 0.1}
{"i": ["cuda", "schedule_conv3d_nchw_cuda", [[192, 1, 10, 10, 10], [192, 1, 10, 10, 10], [1, 1, 1], [1, 1, 1], [1, 1, 1], 1], {}, ["schedule_conv3d_nchw_cuda", [192, 1, 10, 10, 10], [192, 1, 10, 10, 10], [1, 1, 1], [1, 1, 1], [1, 1, 1], 1], {"i": 5122586146, "t": "", "c": null, "e": [["tile_n", "sp", [-1, 2, 4, 1]], ["tile_f", "sp", [-1, 4, 8, 2]], ["tile_d", "sp", [-1, 1, 3, 1]], ["tile_y", "sp", [-1, 1, 1, 3]], ["tile_x", "sp", [-1, 1, 1, 3]], ["tile_rc", "sp", [-1, 1]], ["tile_rd", "sp", [-1, 1]], ["tile_ry", "sp", [-1, 2]], ["tile_rx", "sp", [-1, 1]], ["auto_unroll_max_step", "ot", 1500], ["unroll_explicit", "ot", 1], ["fuse_yx", "ot", 1]]}], "r": [[0.001308737], 0, 3.262887477874756, 1577715320.0678928], "v": 0.1}
{"i": ["cuda", "schedule_conv3d_nchw_cuda", [[192, 1, 10, 10, 10], [192, 1, 10, 10, 10], [1, 1, 1], [1, 1, 1], [1, 1, 1], 1], {}, ["schedule_conv3d_nchw_cuda", [192, 1, 10, 10, 10], [192, 1, 10, 10, 10], [1, 1, 1], [1, 1, 1], [1, 1, 1], 1], {"i": 5155749506, "t": "", "c": null, "e": [["tile_n", "sp", [-1, 2, 3, 4]], ["tile_f", "sp", [-1, 2, 6, 1]], ["tile_d", "sp", [-1, 1, 1, 1]], ["tile_y", "sp", [-1, 3, 1, 1]], ["tile_x", "sp", [-1, 1, 3, 1]], ["tile_rc", "sp", [-1, 1]], ["tile_rd", "sp", [-1, 2]], ["tile_ry", "sp", [-1, 5]], ["tile_rx", "sp", [-1, 1]], ["auto_unroll_max_step", "ot", 1500], ["unroll_explicit", "ot", 1], ["fuse_yx", "ot", 1]]}], "r": [[0.001790334], 0, 2.518890142440796, 1577715320.861883], "v": 0.1}
{"i": ["cuda", "schedule_conv3d_nchw_cuda", [[192, 1, 10, 10, 10], [192, 1, 10, 10, 10], [1, 1, 1], [1, 1, 1], [1, 1, 1], 1], {}, ["schedule_conv3d_nchw_cuda", [192, 1, 10, 10, 10], [192, 1, 10, 10, 10], [1, 1, 1], [1, 1, 1], [1, 1, 1], 1], {"i": 5090608569, "t": "", "c": null, "e": [["tile_n", "sp", [-1, 1, 2, 8]], ["tile_f", "sp", [-1, 2, 6, 1]], ["tile_d", "sp", [-1, 1, 1, 3]], ["tile_y", "sp", [-1, 1, 1, 1]], ["tile_x", "sp", [-1, 1, 3, 1]], ["tile_rc", "sp", [-1, 1]], ["tile_rd", "sp", [-1, 1]], ["tile_ry", "sp", [-1, 1]], ["tile_rx", "sp", [-1, 1]], ["auto_unroll_max_step", "ot", 1500], ["unroll_explicit", "ot", 1], ["fuse_yx", "ot", 1]]}], "r": [[0.00251203725], 0, 1.8092200756072998, 1577715324.5181427], "v": 0.1}
{"i": ["cuda", "schedule_conv3d_nchw_cuda", [[192, 1, 10, 10, 10], [192, 1, 10, 10, 10], [1, 1, 1], [1, 1, 1], [1, 1, 1], 1], {}, ["schedule_conv3d_nchw_cuda", [192, 1, 10, 10, 10], [192, 1, 10, 10, 10], [1, 1, 1], [1, 1, 1], [1, 1, 1], 1], {"i": 3530940475, "t": "", "c": null, "e": [["tile_n", "sp", [-1, 1, 24, 2]], ["tile_f", "sp", [-1, 2, 2, 1]], ["tile_d", "sp", [-1, 1, 1, 1]], ["tile_y", "sp", [-1, 1, 1, 3]], ["tile_x", "sp", [-1, 1, 3, 1]], ["tile_rc", "sp", [-1, 1]], ["tile_rd", "sp", [-1, 1]], ["tile_ry", "sp", [-1, 5]], ["tile_rx", "sp", [-1, 5]], ["auto_unroll_max_step", "ot", 512], ["unroll_explicit", "ot", 0], ["fuse_yx", "ot", 1]]}], "r": [[0.00276733225], 0, 1.25266695022583, 1577715325.2372344], "v": 0.1}
{"i": ["cuda", "schedule_conv3d_nchw_cuda", [[192, 1, 10, 10, 10], [192, 1, 10, 10, 10], [1, 1, 1], [1, 1, 1], [1, 1, 1], 1], {}, ["schedule_conv3d_nchw_cuda", [192, 1, 10, 10, 10], [192, 1, 10, 10, 10], [1, 1, 1], [1, 1, 1], [1, 1, 1], 1], {"i": 4918206523, "t": "", "c": null, "e": [["tile_n", "sp", [-1, 1, 24, 2]], ["tile_f", "sp", [-1, 2, 2, 1]], ["tile_d", "sp", [-1, 1, 1, 1]], ["tile_y", "sp", [-1, 1, 1, 3]], ["tile_x", "sp", [-1, 1, 3, 1]], ["tile_rc", "sp", [-1, 1]], ["tile_rd", "sp", [-1, 1]], ["tile_ry", "sp", [-1, 5]], ["tile_rx", "sp", [-1, 5]], ["auto_unroll_max_step", "ot", 512], ["unroll_explicit", "ot", 1], ["fuse_yx", "ot", 1]]}], "r": [[0.0015173355], 0, 1.487694501876831, 1577715325.9264607], "v": 0.1}
{"i": ["cuda", "schedule_conv3d_nchw_cuda", [[192, 1, 10, 10, 10], [192, 1, 10, 10, 10], [1, 1, 1], [1, 1, 1], [1, 1, 1], 1], {}, ["schedule_conv3d_nchw_cuda", [192, 1, 10, 10, 10], [192, 1, 10, 10, 10], [1, 1, 1], [1, 1, 1], [1, 1, 1], 1], {"i": 5380628539, "t": "", "c": null, "e": [["tile_n", "sp", [-1, 1, 24, 2]], ["tile_f", "sp", [-1, 2, 2, 1]], ["tile_d", "sp", [-1, 1, 1, 1]], ["tile_y", "sp", [-1, 1, 1, 3]], ["tile_x", "sp", [-1, 1, 3, 1]], ["tile_rc", "sp", [-1, 1]], ["tile_rd", "sp", [-1, 1]], ["tile_ry", "sp", [-1, 5]], ["tile_rx", "sp", [-1, 5]], ["auto_unroll_max_step", "ot", 1500], ["unroll_explicit", "ot", 1], ["fuse_yx", "ot", 1]]}], "r": [[0.00126085025], 0, 2.834503650665283, 1577715326.7232468], "v": 0.1}
{"i": ["cuda", "schedule_conv3d_nchw_cuda", [[192, 1, 10, 10, 10], [192, 1, 10, 10, 10], [1, 1, 1], [1, 1, 1], [1, 1, 1], 1], {}, ["schedule_conv3d_nchw_cuda", [192, 1, 10, 10, 10], [192, 1, 10, 10, 10], [1, 1, 1], [1, 1, 1], [1, 1, 1], 1], {"i": 3993362491, "t": "", "c": null, "e": [["tile_n", "sp", [-1, 1, 24, 2]], ["tile_f", "sp", [-1, 2, 2, 1]], ["tile_d", "sp", [-1, 1, 1, 1]], ["tile_y", "sp", [-1, 1, 1, 3]], ["tile_x", "sp", [-1, 1, 3, 1]], ["tile_rc", "sp", [-1, 1]], ["tile_rd", "sp", [-1, 1]], ["tile_ry", "sp", [-1, 5]], ["tile_rx", "sp", [-1, 5]], ["auto_unroll_max_step", "ot", 1500], ["unroll_explicit", "ot", 0], ["fuse_yx", "ot", 1]]}], "r": [[0.00460604675], 0, 1.9497954845428467, 1577715327.6933756], "v": 0.1}
{"i": ["cuda", "schedule_conv3d_nchw_cuda", [[192, 1, 10, 10, 10], [192, 1, 10, 10, 10], [1, 1, 1], [1, 1, 1], [1, 1, 1], 1], {}, ["schedule_conv3d_nchw_cuda", [192, 1, 10, 10, 10], [192, 1, 10, 10, 10], [1, 1, 1], [1, 1, 1], [1, 1, 1], 1], {"i": 3269036258, "t": "", "c": null, "e": [["tile_n", "sp", [-1, 2, 3, 4]], ["tile_f", "sp", [-1, 2, 12, 1]], ["tile_d", "sp", [-1, 1, 1, 1]], ["tile_y", "sp", [-1, 1, 1, 3]], ["tile_x", "sp", [-1, 3, 1, 1]], ["tile_rc", "sp", [-1, 1]], ["tile_rd", "sp", [-1, 1]], ["tile_ry", "sp", [-1, 2]], ["tile_rx", "sp", [-1, 1]], ["auto_unroll_max_step", "ot", 512], ["unroll_explicit", "ot", 0], ["fuse_yx", "ot", 1]]}], "r": [[0.00104521725], 0, 1.3406336307525635, 1577715328.402565], "v": 0.1}
{"i": ["cuda", "schedule_conv3d_nchw_cuda", [[192, 1, 10, 10, 10], [192, 1, 10, 10, 10], [1, 1, 1], [1, 1, 1], [1, 1, 1], 1], {}, ["schedule_conv3d_nchw_cuda", [192, 1, 10, 10, 10], [192, 1, 10, 10, 10], [1, 1, 1], [1, 1, 1], [1, 1, 1], 1], {"i": 5118724322, "t": "", "c": null, "e": [["tile_n", "sp", [-1, 2, 3, 4]], ["tile_f", "sp", [-1, 2, 12, 1]], ["tile_d", "sp", [-1, 1, 1, 1]], ["tile_y", "sp", [-1, 1, 1, 3]], ["tile_x", "sp", [-1, 3, 1, 1]], ["tile_rc", "sp", [-1, 1]], ["tile_rd", "sp", [-1, 1]], ["tile_ry", "sp", [-1, 2]], ["tile_rx", "sp", [-1, 1]], ["auto_unroll_max_step", "ot", 1500], ["unroll_explicit", "ot", 1], ["fuse_yx", "ot", 1]]}], "r": [[0.00098303125], 0, 3.3170459270477295, 1577715329.243223], "v": 0.1}
{"i": ["cuda", "schedule_conv3d_nchw_cuda", [[192, 1, 10, 10, 10], [192, 1, 10, 10, 10], [1, 1, 1], [1, 1, 1], [1, 1, 1], 1], {}, ["schedule_conv3d_nchw_cuda", [192, 1, 10, 10, 10], [192, 1, 10, 10, 10], [1, 1, 1], [1, 1, 1], [1, 1, 1], 1], {"i": 4656302306, "t": "", "c": null, "e": [["tile_n", "sp", [-1, 2, 3, 4]], ["tile_f", "sp", [-1, 2, 12, 1]], ["tile_d", "sp", [-1, 1, 1, 1]], ["tile_y", "sp", [-1, 1, 1, 3]], ["tile_x", "sp", [-1, 3, 1, 1]], ["tile_rc", "sp", [-1, 1]], ["tile_rd", "sp", [-1, 1]], ["tile_ry", "sp", [-1, 2]], ["tile_rx", "sp", [-1, 1]], ["auto_unroll_max_step", "ot", 512], ["unroll_explicit", "ot", 1], ["fuse_yx", "ot", 1]]}], "r": [[0.00105048175], 0, 1.5917751789093018, 1577715329.946035], "v": 0.1}
{"i": ["cuda", "schedule_conv3d_nchw_cuda", [[192, 1, 10, 10, 10], [192, 1, 10, 10, 10], [1, 1, 1], [1, 1, 1], [1, 1, 1], 1], {}, ["schedule_conv3d_nchw_cuda", [192, 1, 10, 10, 10], [192, 1, 10, 10, 10], [1, 1, 1], [1, 1, 1], [1, 1, 1], 1], {"i": 5128116112, "t": "", "c": null, "e": [["tile_n", "sp", [-1, 1, 4, 2]], ["tile_f", "sp", [-1, 4, 6, 2]], ["tile_d", "sp", [-1, 1, 1, 3]], ["tile_y", "sp", [-1, 1, 1, 3]], ["tile_x", "sp", [-1, 1, 3, 1]], ["tile_rc", "sp", [-1, 1]], ["tile_rd", "sp", [-1, 2]], ["tile_ry", "sp", [-1, 2]], ["tile_rx", "sp", [-1, 1]], ["auto_unroll_max_step", "ot", 1500], ["unroll_explicit", "ot", 1], ["fuse_yx", "ot", 1]]}], "r": [[0.0013386885], 0, 1.8148484230041504, 1577715330.572577], "v": 0.1}
{"i": ["cuda", "schedule_conv3d_nchw_cuda", [[192, 1, 10, 10, 10], [192, 1, 10, 10, 10], [1, 1, 1], [1, 1, 1], [1, 1, 1], 1], {}, ["schedule_conv3d_nchw_cuda", [192, 1, 10, 10, 10], [192, 1, 10, 10, 10], [1, 1, 1], [1, 1, 1], [1, 1, 1], 1], {"i": 3733264306, "t": "", "c": null, "e": [["tile_n", "sp", [-1, 1, 2, 6]], ["tile_f", "sp", [-1, 1, 12, 1]], ["tile_d", "sp", [-1, 1, 1, 1]], ["tile_y", "sp", [-1, 1, 1, 3]], ["tile_x", "sp", [-1, 1, 3, 1]], ["tile_rc", "sp", [-1, 1]], ["tile_rd", "sp", [-1, 1]], ["tile_ry", "sp", [-1, 2]], ["tile_rx", "sp", [-1, 1]], ["auto_unroll_max_step", "ot", 1500], ["unroll_explicit", "ot", 0], ["fuse_yx", "ot", 1]]}], "r": [[0.00159627025], 0, 1.280073881149292, 1577715331.3600152], "v": 0.1}
{"i": ["cuda", "schedule_conv3d_nchw_cuda", [[192, 1, 10, 10, 10], [192, 1, 10, 10, 10], [1, 1, 1], [1, 1, 1], [1, 1, 1], 1], {}, ["schedule_conv3d_nchw_cuda", [192, 1, 10, 10, 10], [192, 1, 10, 10, 10], [1, 1, 1], [1, 1, 1], [1, 1, 1], 1], {"i": 5120530354, "t": "", "c": null, "e": [["tile_n", "sp", [-1, 1, 2, 6]], ["tile_f", "sp", [-1, 1, 12, 1]], ["tile_d", "sp", [-1, 1, 1, 1]], ["tile_y", "sp", [-1, 1, 1, 3]], ["tile_x", "sp", [-1, 1, 3, 1]], ["tile_rc", "sp", [-1, 1]], ["tile_rd", "sp", [-1, 1]], ["tile_ry", "sp", [-1, 2]], ["tile_rx", "sp", [-1, 1]], ["auto_unroll_max_step", "ot", 1500], ["unroll_explicit", "ot", 1], ["fuse_yx", "ot", 1]]}], "r": [[0.00163324025], 0, 1.4528980255126953, 1577715332.121908], "v": 0.1}
{"i": ["cuda", "schedule_conv3d_nchw_cuda", [[192, 1, 10, 10, 10], [192, 1, 10, 10, 10], [1, 1, 1], [1, 1, 1], [1, 1, 1], 1], {}, ["schedule_conv3d_nchw_cuda", [192, 1, 10, 10, 10], [192, 1, 10, 10, 10], [1, 1, 1], [1, 1, 1], [1, 1, 1], 1], {"i": 4658108338, "t": "", "c": null, "e": [["tile_n", "sp", [-1, 1, 2, 6]], ["tile_f", "sp", [-1, 1, 12, 1]], ["tile_d", "sp", [-1, 1, 1, 1]], ["tile_y", "sp", [-1, 1, 1, 3]], ["tile_x", "sp", [-1, 1, 3, 1]], ["tile_rc", "sp", [-1, 1]], ["tile_rd", "sp", [-1, 1]], ["tile_ry", "sp", [-1, 2]], ["tile_rx", "sp", [-1, 1]], ["auto_unroll_max_step", "ot", 512], ["unroll_explicit", "ot", 1], ["fuse_yx", "ot", 1]]}], "r": [[0.001631973], 0, 1.0931146144866943, 1577715332.6109965], "v": 0.1}
{"i": ["cuda", "schedule_conv3d_nchw_cuda", [[192, 1, 10, 10, 10], [192, 1, 10, 10, 10], [1, 1, 1], [1, 1, 1], [1, 1, 1], 1], {}, ["schedule_conv3d_nchw_cuda", [192, 1, 10, 10, 10], [192, 1, 10, 10, 10], [1, 1, 1], [1, 1, 1], [1, 1, 1], 1], {"i": 3270842290, "t": "", "c": null, "e": [["tile_n", "sp", [-1, 1, 2, 6]], ["tile_f", "sp", [-1, 1, 12, 1]], ["tile_d", "sp", [-1, 1, 1, 1]], ["tile_y", "sp", [-1, 1, 1, 3]], ["tile_x", "sp", [-1, 1, 3, 1]], ["tile_rc", "sp", [-1, 1]], ["tile_rd", "sp", [-1, 1]], ["tile_ry", "sp", [-1, 2]], ["tile_rx", "sp", [-1, 1]], ["auto_unroll_max_step", "ot", 512], ["unroll_explicit", "ot", 0], ["fuse_yx", "ot", 1]]}], "r": [[0.00160888825], 0, 0.9276843070983887, 1577715336.1658897], "v": 0.1}
{"i": ["cuda", "schedule_conv3d_nchw_cuda", [[192, 1, 10, 10, 10], [192, 1, 10, 10, 10], [1, 1, 1], [1, 1, 1], [1, 1, 1], 1], {}, ["schedule_conv3d_nchw_cuda", [192, 1, 10, 10, 10], [192, 1, 10, 10, 10], [1, 1, 1], [1, 1, 1], [1, 1, 1], 1], {"i": 4659914978, "t": "", "c": null, "e": [["tile_n", "sp", [-1, 2, 3, 4]], ["tile_f", "sp", [-1, 2, 12, 1]], ["tile_d", "sp", [-1, 1, 1, 1]], ["tile_y", "sp", [-1, 1, 1, 3]], ["tile_x", "sp", [-1, 1, 1, 3]], ["tile_rc", "sp", [-1, 1]], ["tile_rd", "sp", [-1, 1]], ["tile_ry", "sp", [-1, 2]], ["tile_rx", "sp", [-1, 1]], ["auto_unroll_max_step", "ot", 512], ["unroll_explicit", "ot", 1], ["fuse_yx", "ot", 1]]}], "r": [[0.00104565625], 0, 1.5473649501800537, 1577715336.8913915], "v": 0.1}
{"i": ["cuda", "schedule_conv3d_nchw_cuda", [[192, 1, 10, 10, 10], [192, 1, 10, 10, 10], [1, 1, 1], [1, 1, 1], [1, 1, 1], 1], {}, ["schedule_conv3d_nchw_cuda", [192, 1, 10, 10, 10], [192, 1, 10, 10, 10], [1, 1, 1], [1, 1, 1], [1, 1, 1], 1], {"i": 3272648930, "t": "", "c": null, "e": [["tile_n", "sp", [-1, 2, 3, 4]], ["tile_f", "sp", [-1, 2, 12, 1]], ["tile_d", "sp", [-1, 1, 1, 1]], ["tile_y", "sp", [-1, 1, 1, 3]], ["tile_x", "sp", [-1, 1, 1, 3]], ["tile_rc", "sp", [-1, 1]], ["tile_rd", "sp", [-1, 1]], ["tile_ry", "sp", [-1, 2]], ["tile_rx", "sp", [-1, 1]], ["auto_unroll_max_step", "ot", 512], ["unroll_explicit", "ot", 0], ["fuse_yx", "ot", 1]]}], "r": [[0.0010300835], 0, 1.2892694473266602, 1577715337.6202278], "v": 0.1}
{"i": ["cuda", "schedule_conv3d_nchw_cuda", [[192, 1, 10, 10, 10], [192, 1, 10, 10, 10], [1, 1, 1], [1, 1, 1], [1, 1, 1], 1], {}, ["schedule_conv3d_nchw_cuda", [192, 1, 10, 10, 10], [192, 1, 10, 10, 10], [1, 1, 1], [1, 1, 1], [1, 1, 1], 1], {"i": 5122336994, "t": "", "c": null, "e": [["tile_n", "sp", [-1, 2, 3, 4]], ["tile_f", "sp", [-1, 2, 12, 1]], ["tile_d", "sp", [-1, 1, 1, 1]], ["tile_y", "sp", [-1, 1, 1, 3]], ["tile_x", "sp", [-1, 1, 1, 3]], ["tile_rc", "sp", [-1, 1]], ["tile_rd", "sp", [-1, 1]], ["tile_ry", "sp", [-1, 2]], ["tile_rx", "sp", [-1, 1]], ["auto_unroll_max_step", "ot", 1500], ["unroll_explicit", "ot", 1], ["fuse_yx", "ot", 1]]}], "r": [[0.00096949], 0, 3.303640842437744, 1577715338.4529405], "v": 0.1}
{"i": ["cuda", "schedule_conv3d_nchw_cuda", [[192, 1, 10, 10, 10], [192, 1, 10, 10, 10], [1, 1, 1], [1, 1, 1], [1, 1, 1], 1], {}, ["schedule_conv3d_nchw_cuda", [192, 1, 10, 10, 10], [192, 1, 10, 10, 10], [1, 1, 1], [1, 1, 1], [1, 1, 1], 1], {"i": 3816574521, "t": "", "c": null, "e": [["tile_n", "sp", [-1, 1, 2, 8]], ["tile_f", "sp", [-1, 4, 4, 1]], ["tile_d", "sp", [-1, 1, 3, 1]], ["tile_y", "sp", [-1, 1, 1, 3]], ["tile_x", "sp", [-1, 1, 1, 1]], ["tile_rc", "sp", [-1, 1]], ["tile_rd", "sp", [-1, 1]], ["tile_ry", "sp", [-1, 1]], ["tile_rx", "sp", [-1, 2]], ["auto_unroll_max_step", "ot", 1500], ["unroll_explicit", "ot", 0], ["fuse_yx", "ot", 1]]}], "r": [[0.00168729225], 0, 1.1856584548950195, 1577715339.1005356], "v": 0.1}
{"i": ["cuda", "schedule_conv3d_nchw_cuda", [[192, 1, 10, 10, 10], [192, 1, 10, 10, 10], [1, 1, 1], [1, 1, 1], [1, 1, 1], 1], {}, ["schedule_conv3d_nchw_cuda", [192, 1, 10, 10, 10], [192, 1, 10, 10, 10], [1, 1, 1], [1, 1, 1], [1, 1, 1], 1], {"i": 5203840569, "t": "", "c": null, "e": [["tile_n", "sp", [-1, 1, 2, 8]], ["tile_f", "sp", [-1, 4, 4, 1]], ["tile_d", "sp", [-1, 1, 3, 1]], ["tile_y", "sp", [-1, 1, 1, 3]], ["tile_x", "sp", [-1, 1, 1, 1]], ["tile_rc", "sp", [-1, 1]], ["tile_rd", "sp", [-1, 1]], ["tile_ry", "sp", [-1, 1]], ["tile_rx", "sp", [-1, 2]], ["auto_unroll_max_step", "ot", 1500], ["unroll_explicit", "ot", 1], ["fuse_yx", "ot", 1]]}], "r": [[0.0019830035], 0, 1.3926284313201904, 1577715339.8051085], "v": 0.1}
{"i": ["cuda", "schedule_conv3d_nchw_cuda", [[192, 1, 10, 10, 10], [192, 1, 10, 10, 10], [1, 1, 1], [1, 1, 1], [1, 1, 1], 1], {}, ["schedule_conv3d_nchw_cuda", [192, 1, 10, 10, 10], [192, 1, 10, 10, 10], [1, 1, 1], [1, 1, 1], [1, 1, 1], 1], {"i": 3354152505, "t": "", "c": null, "e": [["tile_n", "sp", [-1, 1, 2, 8]], ["tile_f", "sp", [-1, 4, 4, 1]], ["tile_d", "sp", [-1, 1, 3, 1]], ["tile_y", "sp", [-1, 1, 1, 3]], ["tile_x", "sp", [-1, 1, 1, 1]], ["tile_rc", "sp", [-1, 1]], ["tile_rd", "sp", [-1, 1]], ["tile_ry", "sp", [-1, 1]], ["tile_rx", "sp", [-1, 2]], ["auto_unroll_max_step", "ot", 512], ["unroll_explicit", "ot", 0], ["fuse_yx", "ot", 1]]}], "r": [[0.0016896235], 0, 0.9832799434661865, 1577715340.2873693], "v": 0.1}
{"i": ["cuda", "schedule_conv3d_nchw_cuda", [[192, 1, 10, 10, 10], [192, 1, 10, 10, 10], [1, 1, 1], [1, 1, 1], [1, 1, 1], 1], {}, ["schedule_conv3d_nchw_cuda", [192, 1, 10, 10, 10], [192, 1, 10, 10, 10], [1, 1, 1], [1, 1, 1], [1, 1, 1], 1], {"i": 4741418553, "t": "", "c": null, "e": [["tile_n", "sp", [-1, 1, 2, 8]], ["tile_f", "sp", [-1, 4, 4, 1]], ["tile_d", "sp", [-1, 1, 3, 1]], ["tile_y", "sp", [-1, 1, 1, 3]], ["tile_x", "sp", [-1, 1, 1, 1]], ["tile_rc", "sp", [-1, 1]], ["tile_rd", "sp", [-1, 1]], ["tile_ry", "sp", [-1, 1]], ["tile_rx", "sp", [-1, 2]], ["auto_unroll_max_step", "ot", 512], ["unroll_explicit", "ot", 1], ["fuse_yx", "ot", 1]]}], "r": [[0.00197564325], 0, 1.2359399795532227, 1577715340.7749074], "v": 0.1}
{"i": ["cuda", "schedule_conv3d_nchw_cuda", [[192, 1, 10, 10, 10], [192, 1, 10, 10, 10], [1, 1, 1], [1, 1, 1], [1, 1, 1], 1], {}, ["schedule_conv3d_nchw_cuda", [192, 1, 10, 10, 10], [192, 1, 10, 10, 10], [1, 1, 1], [1, 1, 1], [1, 1, 1], 1], {"i": 4665708880, "t": "", "c": null, "e": [["tile_n", "sp", [-1, 1, 4, 2]], ["tile_f", "sp", [-1, 2, 8, 3]], ["tile_d", "sp", [-1, 1, 1, 3]], ["tile_y", "sp", [-1, 1, 1, 3]], ["tile_x", "sp", [-1, 1, 3, 1]], ["tile_rc", "sp", [-1, 1]], ["tile_rd", "sp", [-1, 2]], ["tile_ry", "sp", [-1, 2]], ["tile_rx", "sp", [-1, 1]], ["auto_unroll_max_step", "ot", 512], ["unroll_explicit", "ot", 1], ["fuse_yx", "ot", 1]]}], "r": [[0.0010219045], 0, 1.6357359886169434, 1577715341.4719431], "v": 0.1}
{"i": ["cuda", "schedule_conv3d_nchw_cuda", [[192, 1, 10, 10, 10], [192, 1, 10, 10, 10], [1, 1, 1], [1, 1, 1], [1, 1, 1], 1], {}, ["schedule_conv3d_nchw_cuda", [192, 1, 10, 10, 10], [192, 1, 10, 10, 10], [1, 1, 1], [1, 1, 1], [1, 1, 1], 1], {"i": 3272220226, "t": "", "c": null, "e": [["tile_n", "sp", [-1, 1, 2, 6]], ["tile_f", "sp", [-1, 2, 8, 2]], ["tile_d", "sp", [-1, 1, 1, 1]], ["tile_y", "sp", [-1, 1, 3, 1]], ["tile_x", "sp", [-1, 1, 1, 3]], ["tile_rc", "sp", [-1, 1]], ["tile_rd", "sp", [-1, 1]], ["tile_ry", "sp", [-1, 2]], ["tile_rx", "sp", [-1, 1]], ["auto_unroll_max_step", "ot", 512], ["unroll_explicit", "ot", 0], ["fuse_yx", "ot", 1]]}], "r": [[0.00088732475], 0, 1.087944507598877, 1577715342.0346632], "v": 0.1}
{"i": ["cuda", "schedule_conv3d_nchw_cuda", [[192, 1, 10, 10, 10], [192, 1, 10, 10, 10], [1, 1, 1], [1, 1, 1], [1, 1, 1], 1], {}, ["schedule_conv3d_nchw_cuda", [192, 1, 10, 10, 10], [192, 1, 10, 10, 10], [1, 1, 1], [1, 1, 1], [1, 1, 1], 1], {"i": 3734642242, "t": "", "c": null, "e": [["tile_n", "sp", [-1, 1, 2, 6]], ["tile_f", "sp", [-1, 2, 8, 2]], ["tile_d", "sp", [-1, 1, 1, 1]], ["tile_y", "sp", [-1, 1, 3, 1]], ["tile_x", "sp", [-1, 1, 1, 3]], ["tile_rc", "sp", [-1, 1]], ["tile_rd", "sp", [-1, 1]], ["tile_ry", "sp", [-1, 2]], ["tile_rx", "sp", [-1, 1]], ["auto_unroll_max_step", "ot", 1500], ["unroll_explicit", "ot", 0], ["fuse_yx", "ot", 1]]}], "r": [[0.0007742345], 0, 1.1945550441741943, 1577715342.6495705], "v": 0.1}
{"i": ["cuda", "schedule_conv3d_nchw_cuda", [[192, 1, 10, 10, 10], [192, 1, 10, 10, 10], [1, 1, 1], [1, 1, 1], [1, 1, 1], 1], {}, ["schedule_conv3d_nchw_cuda", [192, 1, 10, 10, 10], [192, 1, 10, 10, 10], [1, 1, 1], [1, 1, 1], [1, 1, 1], 1], {"i": 5121908290, "t": "", "c": null, "e": [["tile_n", "sp", [-1, 1, 2, 6]], ["tile_f", "sp", [-1, 2, 8, 2]], ["tile_d", "sp", [-1, 1, 1, 1]], ["tile_y", "sp", [-1, 1, 3, 1]], ["tile_x", "sp", [-1, 1, 1, 3]], ["tile_rc", "sp", [-1, 1]], ["tile_rd", "sp", [-1, 1]], ["tile_ry", "sp", [-1, 2]], ["tile_rx", "sp", [-1, 1]], ["auto_unroll_max_step", "ot", 1500], ["unroll_explicit", "ot", 1], ["fuse_yx", "ot", 1]]}], "r": [[0.0007524605], 0, 1.8115215301513672, 1577715343.2665854], "v": 0.1}
{"i": ["cuda", "schedule_conv3d_nchw_cuda", [[192, 1, 10, 10, 10], [192, 1, 10, 10, 10], [1, 1, 1], [1, 1, 1], [1, 1, 1], 1], {}, ["schedule_conv3d_nchw_cuda", [192, 1, 10, 10, 10], [192, 1, 10, 10, 10], [1, 1, 1], [1, 1, 1], [1, 1, 1], 1], {"i": 4659486274, "t": "", "c": null, "e": [["tile_n", "sp", [-1, 1, 2, 6]], ["tile_f", "sp", [-1, 2, 8, 2]], ["tile_d", "sp", [-1, 1, 1, 1]], ["tile_y", "sp", [-1, 1, 3, 1]], ["tile_x", "sp", [-1, 1, 1, 3]], ["tile_rc", "sp", [-1, 1]], ["tile_rd", "sp", [-1, 1]], ["tile_ry", "sp", [-1, 2]], ["tile_rx", "sp", [-1, 1]], ["auto_unroll_max_step", "ot", 512], ["unroll_explicit", "ot", 1], ["fuse_yx", "ot", 1]]}], "r": [[0.00098848775], 0, 1.1560211181640625, 1577715552.1106796], "v": 0.1}
{"i": ["cuda", "schedule_conv3d_nchw_cuda", [[192, 1, 10, 10, 10], [192, 1, 10, 10, 10], [1, 1, 1], [1, 1, 1], [1, 1, 1], 1], {}, ["schedule_conv3d_nchw_cuda", [192, 1, 10, 10, 10], [192, 1, 10, 10, 10], [1, 1, 1], [1, 1, 1], [1, 1, 1], 1], {"i": 5237940151, "t": "", "c": null, "e": [["tile_n", "sp", [-1, 2, 4, 4]], ["tile_f", "sp", [-1, 3, 8, 1]], ["tile_d", "sp", [-1, 1, 1, 1]], ["tile_y", "sp", [-1, 1, 1, 3]], ["tile_x", "sp", [-1, 1, 1, 3]], ["tile_rc", "sp", [-1, 1]], ["tile_rd", "sp", [-1, 1]], ["tile_ry", "sp", [-1, 2]], ["tile_rx", "sp", [-1, 2]], ["auto_unroll_max_step", "ot", 1500], ["unroll_explicit", "ot", 1], ["fuse_yx", "ot", 1]]}], "r": [[0.00151017425], 0, 2.5116631984710693, 1577715552.8795776], "v": 0.1}
{"i": ["cuda", "schedule_conv3d_nchw_cuda", [[192, 1, 10, 10, 10], [192, 1, 10, 10, 10], [1, 1, 1], [1, 1, 1], [1, 1, 1], 1], {}, ["schedule_conv3d_nchw_cuda", [192, 1, 10, 10, 10], [192, 1, 10, 10, 10], [1, 1, 1], [1, 1, 1], [1, 1, 1], 1], {"i": 5207269431, "t": "", "c": null, "e": [["tile_n", "sp", [-1, 1, 4, 6]], ["tile_f", "sp", [-1, 2, 4, 3]], ["tile_d", "sp", [-1, 1, 1, 1]], ["tile_y", "sp", [-1, 1, 1, 3]], ["tile_x", "sp", [-1, 1, 3, 1]], ["tile_rc", "sp", [-1, 1]], ["tile_rd", "sp", [-1, 1]], ["tile_ry", "sp", [-1, 1]], ["tile_rx", "sp", [-1, 2]], ["auto_unroll_max_step", "ot", 1500], ["unroll_explicit", "ot", 1], ["fuse_yx", "ot", 1]]}], "r": [[0.00077383875], 0, 1.4854347705841064, 1577715553.6542933], "v": 0.1}
{"i": ["cuda", "schedule_conv3d_nchw_cuda", [[192, 1, 10, 10, 10], [192, 1, 10, 10, 10], [1, 1, 1], [1, 1, 1], [1, 1, 1], 1], {}, ["schedule_conv3d_nchw_cuda", [192, 1, 10, 10, 10], [192, 1, 10, 10, 10], [1, 1, 1], [1, 1, 1], [1, 1, 1], 1], {"i": 5122359768, "t": "", "c": null, "e": [["tile_n", "sp", [-1, 1, 6, 2]], ["tile_f", "sp", [-1, 2, 8, 2]], ["tile_d", "sp", [-1, 1, 1, 1]], ["tile_y", "sp", [-1, 1, 1, 3]], ["tile_x", "sp", [-1, 1, 1, 3]], ["tile_rc", "sp", [-1, 1]], ["tile_rd", "sp", [-1, 1]], ["tile_ry", "sp", [-1, 2]], ["tile_rx", "sp", [-1, 1]], ["auto_unroll_max_step", "ot", 1500], ["unroll_explicit", "ot", 1], ["fuse_yx", "ot", 1]]}], "r": [[0.000753264], 0, 1.7251865863800049, 1577715554.2691345], "v": 0.1}
{"i": ["cuda", "schedule_conv3d_nchw_cuda", [[192, 1, 10, 10, 10], [192, 1, 10, 10, 10], [1, 1, 1], [1, 1, 1], [1, 1, 1], 1], {}, ["schedule_conv3d_nchw_cuda", [192, 1, 10, 10, 10], [192, 1, 10, 10, 10], [1, 1, 1], [1, 1, 1], [1, 1, 1], 1], {"i": 3820003383, "t": "", "c": null, "e": [["tile_n", "sp", [-1, 1, 4, 6]], ["tile_f", "sp", [-1, 2, 4, 3]], ["tile_d", "sp", [-1, 1, 1, 1]], ["tile_y", "sp", [-1, 1, 1, 3]], ["tile_x", "sp", [-1, 1, 3, 1]], ["tile_rc", "sp", [-1, 1]], ["tile_rd", "sp", [-1, 1]], ["tile_ry", "sp", [-1, 1]], ["tile_rx", "sp", [-1, 2]], ["auto_unroll_max_step", "ot", 1500], ["unroll_explicit", "ot", 0], ["fuse_yx", "ot", 1]]}], "r": [[0.0007904175], 0, 1.3130548000335693, 1577715555.0240436], "v": 0.1}
{"i": ["cuda", "schedule_conv3d_nchw_cuda", [[192, 1, 10, 10, 10], [192, 1, 10, 10, 10], [1, 1, 1], [1, 1, 1], [1, 1, 1], 1], {}, ["schedule_conv3d_nchw_cuda", [192, 1, 10, 10, 10], [192, 1, 10, 10, 10], [1, 1, 1], [1, 1, 1], [1, 1, 1], 1], {"i": 3270865524, "t": "", "c": null, "e": [["tile_n", "sp", [-1, 1, 2, 12]], ["tile_f", "sp", [-1, 2, 8, 2]], ["tile_d", "sp", [-1, 1, 1, 1]], ["tile_y", "sp", [-1, 1, 1, 3]], ["tile_x", "sp", [-1, 1, 3, 1]], ["tile_rc", "sp", [-1, 1]], ["tile_rd", "sp", [-1, 1]], ["tile_ry", "sp", [-1, 2]], ["tile_rx", "sp", [-1, 1]], ["auto_unroll_max_step", "ot", 512], ["unroll_explicit", "ot", 0], ["fuse_yx", "ot", 1]]}], "r": [[0.00126836], 0, 1.2217810153961182, 1577715555.7493236], "v": 0.1}
{"i": ["cuda", "schedule_conv3d_nchw_cuda", [[192, 1, 10, 10, 10], [192, 1, 10, 10, 10], [1, 1, 1], [1, 1, 1], [1, 1, 1], 1], {}, ["schedule_conv3d_nchw_cuda", [192, 1, 10, 10, 10], [192, 1, 10, 10, 10], [1, 1, 1], [1, 1, 1], [1, 1, 1], 1], {"i": 5203527735, "t": "", "c": null, "e": [["tile_n", "sp", [-1, 1, 4, 6]], ["tile_f", "sp", [-1, 2, 4, 2]], ["tile_d", "sp", [-1, 1, 1, 3]], ["tile_y", "sp", [-1, 1, 3, 1]], ["tile_x", "sp", [-1, 1, 1, 1]], ["tile_rc", "sp", [-1, 1]], ["tile_rd", "sp", [-1, 1]], ["tile_ry", "sp", [-1, 1]], ["tile_rx", "sp", [-1, 2]], ["auto_unroll_max_step", "ot", 1500], ["unroll_explicit", "ot", 1], ["fuse_yx", "ot", 1]]}], "r": [[0.00161323475], 0, 1.3257486820220947, 1577715556.4141555], "v": 0.1}
{"i": ["cuda", "schedule_conv3d_nchw_cuda", [[192, 1, 10, 10, 10], [192, 1, 10, 10, 10], [1, 1, 1], [1, 1, 1], [1, 1, 1], 1], {}, ["schedule_conv3d_nchw_cuda", [192, 1, 10, 10, 10], [192, 1, 10, 10, 10], [1, 1, 1], [1, 1, 1], [1, 1, 1], 1], {"i": 3272220249, "t": "", "c": null, "e": [["tile_n", "sp", [-1, 1, 2, 8]], ["tile_f", "sp", [-1, 2, 8, 2]], ["tile_d", "sp", [-1, 1, 1, 1]], ["tile_y", "sp", [-1, 1, 3, 1]], ["tile_x", "sp", [-1, 1, 1, 3]], ["tile_rc", "sp", [-1, 1]], ["tile_rd", "sp", [-1, 1]], ["tile_ry", "sp", [-1, 2]], ["tile_rx", "sp", [-1, 1]], ["auto_unroll_max_step", "ot", 512], ["unroll_explicit", "ot", 0], ["fuse_yx", "ot", 1]]}], "r": [[0.00095943975], 0, 1.161041498184204, 1577715557.01895], "v": 0.1}
