fourth_input.log
{"i": ["cuda", "schedule_direct_3d_cuda", [[1, 192, 10, 10, 10], [192, 192, 3, 3, 3], [1, 1, 1], [1, 1, 1], 1], {}, ["schedule_direct_3d_cuda", [1, 192, 10, 10, 10], [192, 192, 3, 3, 3], [1, 1, 1], [1, 1, 1], 1], {"i": 388473403, "t": "", "c": null, "e": [["tile_f", "sp", [-1, 1, 8, 12]], ["tile_d", "sp", [-1, 5, 1, 2]], ["tile_y", "sp", [-1, 1, 2, 1]], ["tile_x", "sp", [-1, 1, 2, 1]], ["tile_rc", "sp", [-1, 3]], ["tile_rd", "sp", [-1, 1]], ["tile_ry", "sp", [-1, 1]], ["tile_rx", "sp", [-1, 3]], ["auto_unroll_max_step", "ot", 1500], ["unroll_explicit", "ot", 0]]}], "r": [[0.0063641169375], 0, 2.034858465194702, 1575003873.1128392], "v": 0.1}
{"i": ["cuda", "schedule_direct_3d_cuda", [[1, 192, 10, 10, 10], [192, 192, 3, 3, 3], [1, 1, 1], [1, 1, 1], 1], {}, ["schedule_direct_3d_cuda", [1, 192, 10, 10, 10], [192, 192, 3, 3, 3], [1, 1, 1], [1, 1, 1], 1], {"i": 24233189, "t": "", "c": null, "e": [["tile_f", "sp", [-1, 16, 3, 4]], ["tile_d", "sp", [-1, 5, 1, 2]], ["tile_y", "sp", [-1, 1, 5, 2]], ["tile_x", "sp", [-1, 1, 1, 2]], ["tile_rc", "sp", [-1, 4]], ["tile_rd", "sp", [-1, 3]], ["tile_ry", "sp", [-1, 1]], ["tile_rx", "sp", [-1, 1]], ["auto_unroll_max_step", "ot", 0], ["unroll_explicit", "ot", 0]]}], "r": [[0.1565997405], 0, 3.6607954502105713, 1575003881.455393], "v": 0.1}
{"i": ["cuda", "schedule_direct_3d_cuda", [[1, 192, 10, 10, 10], [192, 192, 3, 3, 3], [1, 1, 1], [1, 1, 1], 1], {}, ["schedule_direct_3d_cuda", [1, 192, 10, 10, 10], [192, 192, 3, 3, 3], [1, 1, 1], [1, 1, 1], 1], {"i": 240011229, "t": "", "c": null, "e": [["tile_f", "sp", [-1, 4, 6, 1]], ["tile_d", "sp", [-1, 1, 1, 10]], ["tile_y", "sp", [-1, 1, 2, 1]], ["tile_x", "sp", [-1, 1, 5, 1]], ["tile_rc", "sp", [-1, 12]], ["tile_rd", "sp", [-1, 1]], ["tile_ry", "sp", [-1, 1]], ["tile_rx", "sp", [-1, 3]], ["auto_unroll_max_step", "ot", 512], ["unroll_explicit", "ot", 0]]}], "r": [[0.0008632433017241379], 0, 1.3312764167785645, 1575003882.43428], "v": 0.1}
{"i": ["cuda", "schedule_direct_3d_cuda", [[1, 192, 10, 10, 10], [192, 192, 3, 3, 3], [1, 1, 1], [1, 1, 1], 1], {}, ["schedule_direct_3d_cuda", [1, 192, 10, 10, 10], [192, 192, 3, 3, 3], [1, 1, 1], [1, 1, 1], 1], {"i": 578057694, "t": "", "c": null, "e": [["tile_f", "sp", [-1, 1, 24, 8]], ["tile_d", "sp", [-1, 1, 1, 2]], ["tile_y", "sp", [-1, 5, 2, 1]], ["tile_x", "sp", [-1, 1, 1, 1]], ["tile_rc", "sp", [-1, 1]], ["tile_rd", "sp", [-1, 1]], ["tile_ry", "sp", [-1, 3]], ["tile_rx", "sp", [-1, 3]], ["auto_unroll_max_step", "ot", 0], ["unroll_explicit", "ot", 1]]}], "r": [[0.0018882479056603772], 0, 1.453129529953003, 1575003982.6368554], "v": 0.1}
{"i": ["cuda", "schedule_direct_3d_cuda", [[1, 192, 10, 10, 10], [192, 192, 3, 3, 3], [1, 1, 1], [1, 1, 1], 1], {}, ["schedule_direct_3d_cuda", [1, 192, 10, 10, 10], [192, 192, 3, 3, 3], [1, 1, 1], [1, 1, 1], 1], {"i": 735344213, "t": "", "c": null, "e": [["tile_f", "sp", [-1, 4, 1, 3]], ["tile_d", "sp", [-1, 1, 1, 5]], ["tile_y", "sp", [-1, 1, 2, 5]], ["tile_x", "sp", [-1, 1, 2, 1]], ["tile_rc", "sp", [-1, 3]], ["tile_rd", "sp", [-1, 1]], ["tile_ry", "sp", [-1, 3]], ["tile_rx", "sp", [-1, 3]], ["auto_unroll_max_step", "ot", 512], ["unroll_explicit", "ot", 1]]}], "r": [[0.076972723], 0, 5.916613340377808, 1575003985.217106], "v": 0.1}
{"i": ["cuda", "schedule_direct_3d_cuda", [[1, 192, 10, 10, 10], [192, 192, 3, 3, 3], [1, 1, 1], [1, 1, 1], 1], {}, ["schedule_direct_3d_cuda", [1, 192, 10, 10, 10], [192, 192, 3, 3, 3], [1, 1, 1], [1, 1, 1], 1], {"i": 683053370, "t": "", "c": null, "e": [["tile_f", "sp", [-1, 1, 1, 32]], ["tile_d", "sp", [-1, 1, 1, 1]], ["tile_y", "sp", [-1, 1, 1, 1]], ["tile_x", "sp", [-1, 5, 2, 1]], ["tile_rc", "sp", [-1, 12]], ["tile_rd", "sp", [-1, 3]], ["tile_ry", "sp", [-1, 3]], ["tile_rx", "sp", [-1, 1]], ["auto_unroll_max_step", "ot", 512], ["unroll_explicit", "ot", 1]]}], "r": [[0.05212475475], 0, 2.4546380043029785, 1575003986.739615], "v": 0.1}
{"i": ["cuda", "schedule_direct_3d_cuda", [[1, 192, 10, 10, 10], [192, 192, 3, 3, 3], [1, 1, 1], [1, 1, 1], 1], {}, ["schedule_direct_3d_cuda", [1, 192, 10, 10, 10], [192, 192, 3, 3, 3], [1, 1, 1], [1, 1, 1], 1], {"i": 486348724, "t": "", "c": null, "e": [["tile_f", "sp", [-1, 2, 1, 3]], ["tile_d", "sp", [-1, 5, 1, 2]], ["tile_y", "sp", [-1, 5, 1, 1]], ["tile_x", "sp", [-1, 1, 5, 1]], ["tile_rc", "sp", [-1, 4]], ["tile_rd", "sp", [-1, 3]], ["tile_ry", "sp", [-1, 1]], ["tile_rx", "sp", [-1, 1]], ["auto_unroll_max_step", "ot", 0], ["unroll_explicit", "ot", 1]]}], "r": [[0.06152872275], 0, 2.4939258098602295, 1575003988.508196], "v": 0.1}
{"i": ["cuda", "schedule_direct_3d_cuda", [[1, 192, 10, 10, 10], [192, 192, 3, 3, 3], [1, 1, 1], [1, 1, 1], 1], {}, ["schedule_direct_3d_cuda", [1, 192, 10, 10, 10], [192, 192, 3, 3, 3], [1, 1, 1], [1, 1, 1], 1], {"i": 79477992, "t": "", "c": null, "e": [["tile_f", "sp", [-1, 3, 16, 4]], ["tile_d", "sp", [-1, 2, 1, 5]], ["tile_y", "sp", [-1, 1, 1, 10]], ["tile_x", "sp", [-1, 1, 5, 2]], ["tile_rc", "sp", [-1, 2]], ["tile_rd", "sp", [-1, 1]], ["tile_ry", "sp", [-1, 1]], ["tile_rx", "sp", [-1, 3]], ["auto_unroll_max_step", "ot", 0], ["unroll_explicit", "ot", 0]]}], "r": [[0.129317392], 0, 3.341442346572876, 1575003992.2891755], "v": 0.1}
{"i": ["cuda", "schedule_direct_3d_cuda", [[1, 192, 10, 10, 10], [192, 192, 3, 3, 3], [1, 1, 1], [1, 1, 1], 1], {}, ["schedule_direct_3d_cuda", [1, 192, 10, 10, 10], [192, 192, 3, 3, 3], [1, 1, 1], [1, 1, 1], 1], {"i": 587003209, "t": "", "c": null, "e": [["tile_f", "sp", [-1, 2, 6, 2]], ["tile_d", "sp", [-1, 1, 1, 2]], ["tile_y", "sp", [-1, 5, 2, 1]], ["tile_x", "sp", [-1, 1, 10, 1]], ["tile_rc", "sp", [-1, 12]], ["tile_rd", "sp", [-1, 1]], ["tile_ry", "sp", [-1, 3]], ["tile_rx", "sp", [-1, 3]], ["auto_unroll_max_step", "ot", 0], ["unroll_explicit", "ot", 1]]}], "r": [[0.0012516799390243903], 0, 1.5974769592285156, 1575005521.7259161], "v": 0.1}
{"i": ["cuda", "schedule_direct_3d_cuda", [[1, 192, 10, 10, 10], [192, 192, 3, 3, 3], [1, 1, 1], [1, 1, 1], 1], {}, ["schedule_direct_3d_cuda", [1, 192, 10, 10, 10], [192, 192, 3, 3, 3], [1, 1, 1], [1, 1, 1], 1], {"i": 528525130, "t": "", "c": null, "e": [["tile_f", "sp", [-1, 1, 2, 3]], ["tile_d", "sp", [-1, 1, 1, 10]], ["tile_y", "sp", [-1, 2, 5, 1]], ["tile_x", "sp", [-1, 1, 1, 1]], ["tile_rc", "sp", [-1, 12]], ["tile_rd", "sp", [-1, 3]], ["tile_ry", "sp", [-1, 3]], ["tile_rx", "sp", [-1, 1]], ["auto_unroll_max_step", "ot", 0], ["unroll_explicit", "ot", 1]]}], "r": [[0.007768095307692308], 0, 1.4255361557006836, 1575005545.0653946], "v": 0.1}
{"i": ["cuda", "schedule_direct_3d_cuda", [[1, 192, 10, 10, 10], [192, 192, 3, 3, 3], [1, 1, 1], [1, 1, 1], 1], {}, ["schedule_direct_3d_cuda", [1, 192, 10, 10, 10], [192, 192, 3, 3, 3], [1, 1, 1], [1, 1, 1], 1], {"i": 675783995, "t": "", "c": null, "e": [["tile_f", "sp", [-1, 1, 4, 16]], ["tile_d", "sp", [-1, 2, 1, 5]], ["tile_y", "sp", [-1, 2, 5, 1]], ["tile_x", "sp", [-1, 1, 1, 1]], ["tile_rc", "sp", [-1, 2]], ["tile_rd", "sp", [-1, 3]], ["tile_ry", "sp", [-1, 3]], ["tile_rx", "sp", [-1, 1]], ["auto_unroll_max_step", "ot", 512], ["unroll_explicit", "ot", 1]]}], "r": [[0.02025165233333333], 0, 3.511622667312622, 1575005554.653352], "v": 0.1}
{"i": ["cuda", "schedule_direct_3d_cuda", [[1, 192, 10, 10, 10], [192, 192, 3, 3, 3], [1, 1, 1], [1, 1, 1], 1], {}, ["schedule_direct_3d_cuda", [1, 192, 10, 10, 10], [192, 192, 3, 3, 3], [1, 1, 1], [1, 1, 1], 1], {"i": 547322921, "t": "", "c": null, "e": [["tile_f", "sp", [-1, 8, 1, 2]], ["tile_d", "sp", [-1, 1, 1, 2]], ["tile_y", "sp", [-1, 1, 1, 1]], ["tile_x", "sp", [-1, 1, 5, 2]], ["tile_rc", "sp", [-1, 8]], ["tile_rd", "sp", [-1, 1]], ["tile_ry", "sp", [-1, 1]], ["tile_rx", "sp", [-1, 3]], ["auto_unroll_max_step", "ot", 0], ["unroll_explicit", "ot", 1]]}], "r": [[0.01353279075], 0, 1.6948466300964355, 1575005555.871882], "v": 0.1}
{"i": ["cuda", "schedule_direct_3d_cuda", [[1, 192, 10, 10, 10], [192, 192, 3, 3, 3], [1, 1, 1], [1, 1, 1], 1], {}, ["schedule_direct_3d_cuda", [1, 192, 10, 10, 10], [192, 192, 3, 3, 3], [1, 1, 1], [1, 1, 1], 1], {"i": 900246483, "t": "", "c": null, "e": [["tile_f", "sp", [-1, 4, 1, 1]], ["tile_d", "sp", [-1, 1, 1, 2]], ["tile_y", "sp", [-1, 1, 1, 1]], ["tile_x", "sp", [-1, 5, 1, 1]], ["tile_rc", "sp", [-1, 48]], ["tile_rd", "sp", [-1, 1]], ["tile_ry", "sp", [-1, 3]], ["tile_rx", "sp", [-1, 3]], ["auto_unroll_max_step", "ot", 1500], ["unroll_explicit", "ot", 1]]}], "r": [[0.1962652895], 0, 4.0703136920928955, 1575005568.9809933], "v": 0.1}
{"i": ["cuda", "schedule_direct_3d_cuda", [[1, 192, 10, 10, 10], [192, 192, 3, 3, 3], [1, 1, 1], [1, 1, 1], 1], {}, ["schedule_direct_3d_cuda", [1, 192, 10, 10, 10], [192, 192, 3, 3, 3], [1, 1, 1], [1, 1, 1], 1], {"i": 86181701, "t": "", "c": null, "e": [["tile_f", "sp", [-1, 6, 8, 1]], ["tile_d", "sp", [-1, 2, 1, 5]], ["tile_y", "sp", [-1, 1, 2, 5]], ["tile_x", "sp", [-1, 1, 1, 2]], ["tile_rc", "sp", [-1, 12]], ["tile_rd", "sp", [-1, 1]], ["tile_ry", "sp", [-1, 1]], ["tile_rx", "sp", [-1, 3]], ["auto_unroll_max_step", "ot", 0], ["unroll_explicit", "ot", 0]]}], "r": [[0.066542605], 0, 2.406749725341797, 1575005573.6281633], "v": 0.1}
{"i": ["cuda", "schedule_direct_3d_cuda", [[1, 192, 10, 10, 10], [192, 192, 3, 3, 3], [1, 1, 1], [1, 1, 1], 1], {}, ["schedule_direct_3d_cuda", [1, 192, 10, 10, 10], [192, 192, 3, 3, 3], [1, 1, 1], [1, 1, 1], 1], {"i": 586234932, "t": "", "c": null, "e": [["tile_f", "sp", [-1, 1, 2, 12]], ["tile_d", "sp", [-1, 5, 1, 2]], ["tile_y", "sp", [-1, 1, 5, 1]], ["tile_x", "sp", [-1, 1, 1, 10]], ["tile_rc", "sp", [-1, 8]], ["tile_rd", "sp", [-1, 1]], ["tile_ry", "sp", [-1, 3]], ["tile_rx", "sp", [-1, 3]], ["auto_unroll_max_step", "ot", 0], ["unroll_explicit", "ot", 1]]}], "r": [[0.0714129835], 0, 2.7144358158111572, 1575005580.9932976], "v": 0.1}
{"i": ["cuda", "schedule_direct_3d_cuda", [[1, 192, 10, 10, 10], [192, 192, 3, 3, 3], [1, 1, 1], [1, 1, 1], 1], {}, ["schedule_direct_3d_cuda", [1, 192, 10, 10, 10], [192, 192, 3, 3, 3], [1, 1, 1], [1, 1, 1], 1], {"i": 393892851, "t": "", "c": null, "e": [["tile_f", "sp", [-1, 3, 8, 1]], ["tile_d", "sp", [-1, 1, 1, 5]], ["tile_y", "sp", [-1, 1, 2, 1]], ["tile_x", "sp", [-1, 10, 1, 1]], ["tile_rc", "sp", [-1, 12]], ["tile_rd", "sp", [-1, 1]], ["tile_ry", "sp", [-1, 1]], ["tile_rx", "sp", [-1, 3]], ["auto_unroll_max_step", "ot", 1500], ["unroll_explicit", "ot", 0]]}], "r": [[0.0076256475], 0, 5.46227765083313, 1575005585.1985035], "v": 0.1}
{"i": ["cuda", "schedule_direct_3d_cuda", [[1, 192, 10, 10, 10], [192, 192, 3, 3, 3], [1, 1, 1], [1, 1, 1], 1], {}, ["schedule_direct_3d_cuda", [1, 192, 10, 10, 10], [192, 192, 3, 3, 3], [1, 1, 1], [1, 1, 1], 1], {"i": 721159383, "t": "", "c": null, "e": [["tile_f", "sp", [-1, 1, 4, 6]], ["tile_d", "sp", [-1, 10, 1, 1]], ["tile_y", "sp", [-1, 1, 1, 1]], ["tile_x", "sp", [-1, 1, 1, 1]], ["tile_rc", "sp", [-1, 12]], ["tile_rd", "sp", [-1, 3]], ["tile_ry", "sp", [-1, 1]], ["tile_rx", "sp", [-1, 3]], ["auto_unroll_max_step", "ot", 512], ["unroll_explicit", "ot", 1]]}], "r": [[0.007368621785714286], 0, 1.8233866691589355, 1575005596.7614799], "v": 0.1}
{"i": ["cuda", "schedule_direct_3d_cuda", [[1, 192, 10, 10, 10], [192, 192, 3, 3, 3], [1, 1, 1], [1, 1, 1], 1], {}, ["schedule_direct_3d_cuda", [1, 192, 10, 10, 10], [192, 192, 3, 3, 3], [1, 1, 1], [1, 1, 1], 1], {"i": 617212508, "t": "", "c": null, "e": [["tile_f", "sp", [-1, 1, 1, 96]], ["tile_d", "sp", [-1, 2, 1, 5]], ["tile_y", "sp", [-1, 1, 10, 1]], ["tile_x", "sp", [-1, 2, 5, 1]], ["tile_rc", "sp", [-1, 1]], ["tile_rd", "sp", [-1, 1]], ["tile_ry", "sp", [-1, 1]], ["tile_rx", "sp", [-1, 1]], ["auto_unroll_max_step", "ot", 512], ["unroll_explicit", "ot", 1]]}], "r": [[0.2802164575], 0, 4.790576696395874, 1575005601.1570826], "v": 0.1}
{"i": ["cuda", "schedule_direct_3d_cuda", [[1, 192, 10, 10, 10], [192, 192, 3, 3, 3], [1, 1, 1], [1, 1, 1], 1], {}, ["schedule_direct_3d_cuda", [1, 192, 10, 10, 10], [192, 192, 3, 3, 3], [1, 1, 1], [1, 1, 1], 1], {"i": 390145742, "t": "", "c": null, "e": [["tile_f", "sp", [-1, 1, 2, 1]], ["tile_d", "sp", [-1, 1, 1, 5]], ["tile_y", "sp", [-1, 1, 5, 2]], ["tile_x", "sp", [-1, 2, 5, 1]], ["tile_rc", "sp", [-1, 4]], ["tile_rd", "sp", [-1, 1]], ["tile_ry", "sp", [-1, 1]], ["tile_rx", "sp", [-1, 3]], ["auto_unroll_max_step", "ot", 1500], ["unroll_explicit", "ot", 0]]}], "r": [[0.003837155296296296], 0, 2.8480224609375, 1575005603.2437932], "v": 0.1}
{"i": ["cuda", "schedule_direct_3d_cuda", [[1, 192, 10, 10, 10], [192, 192, 3, 3, 3], [1, 1, 1], [1, 1, 1], 1], {}, ["schedule_direct_3d_cuda", [1, 192, 10, 10, 10], [192, 192, 3, 3, 3], [1, 1, 1], [1, 1, 1], 1], {"i": 370361519, "t": "", "c": null, "e": [["tile_f", "sp", [-1, 3, 32, 2]], ["tile_d", "sp", [-1, 5, 1, 2]], ["tile_y", "sp", [-1, 1, 5, 2]], ["tile_x", "sp", [-1, 2, 1, 1]], ["tile_rc", "sp", [-1, 4]], ["tile_rd", "sp", [-1, 3]], ["tile_ry", "sp", [-1, 3]], ["tile_rx", "sp", [-1, 1]], ["auto_unroll_max_step", "ot", 1500], ["unroll_explicit", "ot", 0]]}], "r": [[0.0059091130000000006], 0, 2.5703659057617188, 1575005604.806846], "v": 0.1}
{"i": ["cuda", "schedule_direct_3d_cuda", [[1, 192, 10, 10, 10], [192, 192, 3, 3, 3], [1, 1, 1], [1, 1, 1], 1], {}, ["schedule_direct_3d_cuda", [1, 192, 10, 10, 10], [192, 192, 3, 3, 3], [1, 1, 1], [1, 1, 1], 1], {"i": 333436393, "t": "", "c": null, "e": [["tile_f", "sp", [-1, 2, 32, 1]], ["tile_d", "sp", [-1, 5, 1, 1]], ["tile_y", "sp", [-1, 2, 5, 1]], ["tile_x", "sp", [-1, 1, 2, 1]], ["tile_rc", "sp", [-1, 6]], ["tile_rd", "sp", [-1, 3]], ["tile_ry", "sp", [-1, 1]], ["tile_rx", "sp", [-1, 1]], ["auto_unroll_max_step", "ot", 1500], ["unroll_explicit", "ot", 0]]}], "r": [[0.0010486580625], 0, 2.057297945022583, 1575005615.901631], "v": 0.1}
{"i": ["cuda", "schedule_direct_3d_cuda", [[1, 192, 10, 10, 10], [192, 192, 3, 3, 3], [1, 1, 1], [1, 1, 1], 1], {}, ["schedule_direct_3d_cuda", [1, 192, 10, 10, 10], [192, 192, 3, 3, 3], [1, 1, 1], [1, 1, 1], 1], {"i": 786702710, "t": "", "c": null, "e": [["tile_f", "sp", [-1, 8, 4, 1]], ["tile_d", "sp", [-1, 2, 1, 1]], ["tile_y", "sp", [-1, 1, 1, 1]], ["tile_x", "sp", [-1, 5, 1, 2]], ["tile_rc", "sp", [-1, 64]], ["tile_rd", "sp", [-1, 1]], ["tile_ry", "sp", [-1, 1]], ["tile_rx", "sp", [-1, 1]], ["auto_unroll_max_step", "ot", 1500], ["unroll_explicit", "ot", 1]]}], "r": [[0.006575246125], 0, 5.235111713409424, 1575005623.0747685], "v": 0.1}
{"i": ["cuda", "schedule_direct_3d_cuda", [[1, 192, 10, 10, 10], [192, 192, 3, 3, 3], [1, 1, 1], [1, 1, 1], 1], {}, ["schedule_direct_3d_cuda", [1, 192, 10, 10, 10], [192, 192, 3, 3, 3], [1, 1, 1], [1, 1, 1], 1], {"i": 387905476, "t": "", "c": null, "e": [["tile_f", "sp", [-1, 8, 3, 4]], ["tile_d", "sp", [-1, 1, 1, 1]], ["tile_y", "sp", [-1, 1, 5, 2]], ["tile_x", "sp", [-1, 2, 1, 5]], ["tile_rc", "sp", [-1, 2]], ["tile_rd", "sp", [-1, 1]], ["tile_ry", "sp", [-1, 1]], ["tile_rx", "sp", [-1, 3]], ["auto_unroll_max_step", "ot", 1500], ["unroll_explicit", "ot", 0]]}], "r": [[0.06303192925], 0, 4.044673919677734, 1575005628.9923906], "v": 0.1}
{"i": ["cuda", "schedule_direct_3d_cuda", [[1, 192, 10, 10, 10], [192, 192, 3, 3, 3], [1, 1, 1], [1, 1, 1], 1], {}, ["schedule_direct_3d_cuda", [1, 192, 10, 10, 10], [192, 192, 3, 3, 3], [1, 1, 1], [1, 1, 1], 1], {"i": 82535433, "t": "", "c": null, "e": [["tile_f", "sp", [-1, 1, 12, 1]], ["tile_d", "sp", [-1, 1, 1, 2]], ["tile_y", "sp", [-1, 1, 10, 1]], ["tile_x", "sp", [-1, 1, 1, 10]], ["tile_rc", "sp", [-1, 4]], ["tile_rd", "sp", [-1, 1]], ["tile_ry", "sp", [-1, 1]], ["tile_rx", "sp", [-1, 3]], ["auto_unroll_max_step", "ot", 0], ["unroll_explicit", "ot", 0]]}], "r": [[0.0010770485376344085], 0, 1.9474191665649414, 1575005945.2570722], "v": 0.1}
{"i": ["cuda", "schedule_direct_3d_cuda", [[1, 192, 10, 10, 10], [192, 192, 3, 3, 3], [1, 1, 1], [1, 1, 1], 1], {}, ["schedule_direct_3d_cuda", [1, 192, 10, 10, 10], [192, 192, 3, 3, 3], [1, 1, 1], [1, 1, 1], 1], {"i": 390816777, "t": "", "c": null, "e": [["tile_f", "sp", [-1, 1, 12, 1]], ["tile_d", "sp", [-1, 1, 1, 2]], ["tile_y", "sp", [-1, 1, 10, 1]], ["tile_x", "sp", [-1, 1, 1, 10]], ["tile_rc", "sp", [-1, 4]], ["tile_rd", "sp", [-1, 1]], ["tile_ry", "sp", [-1, 1]], ["tile_rx", "sp", [-1, 3]], ["auto_unroll_max_step", "ot", 1500], ["unroll_explicit", "ot", 0]]}], "r": [[0.0018436052363636365], 0, 2.5126216411590576, 1575005946.5109906], "v": 0.1}
{"i": ["cuda", "schedule_direct_3d_cuda", [[1, 192, 10, 10, 10], [192, 192, 3, 3, 3], [1, 1, 1], [1, 1, 1], 1], {}, ["schedule_direct_3d_cuda", [1, 192, 10, 10, 10], [192, 192, 3, 3, 3], [1, 1, 1], [1, 1, 1], 1], {"i": 289996257, "t": "", "c": null, "e": [["tile_f", "sp", [-1, 1, 4, 1]], ["tile_d", "sp", [-1, 1, 1, 5]], ["tile_y", "sp", [-1, 1, 5, 1]], ["tile_x", "sp", [-1, 1, 5, 2]], ["tile_rc", "sp", [-1, 1]], ["tile_rd", "sp", [-1, 3]], ["tile_ry", "sp", [-1, 3]], ["tile_rx", "sp", [-1, 3]], ["auto_unroll_max_step", "ot", 512], ["unroll_explicit", "ot", 0]]}], "r": [[0.0010873650337837838], 0, 2.212388515472412, 1575005947.6570718], "v": 0.1}
{"i": ["cuda", "schedule_direct_3d_cuda", [[1, 192, 10, 10, 10], [192, 192, 3, 3, 3], [1, 1, 1], [1, 1, 1], 1], {}, ["schedule_direct_3d_cuda", [1, 192, 10, 10, 10], [192, 192, 3, 3, 3], [1, 1, 1], [1, 1, 1], 1], {"i": 135855585, "t": "", "c": null, "e": [["tile_f", "sp", [-1, 1, 4, 1]], ["tile_d", "sp", [-1, 1, 1, 5]], ["tile_y", "sp", [-1, 1, 5, 1]], ["tile_x", "sp", [-1, 1, 5, 2]], ["tile_rc", "sp", [-1, 1]], ["tile_rd", "sp", [-1, 3]], ["tile_ry", "sp", [-1, 3]], ["tile_rx", "sp", [-1, 3]], ["auto_unroll_max_step", "ot", 0], ["unroll_explicit", "ot", 0]]}], "r": [[0.0010900055108695652], 0, 2.006885528564453, 1575005948.6692312], "v": 0.1}
{"i": ["cuda", "schedule_direct_3d_cuda", [[1, 192, 10, 10, 10], [192, 192, 3, 3, 3], [1, 1, 1], [1, 1, 1], 1], {}, ["schedule_direct_3d_cuda", [1, 192, 10, 10, 10], [192, 192, 3, 3, 3], [1, 1, 1], [1, 1, 1], 1], {"i": 270728673, "t": "", "c": null, "e": [["tile_f", "sp", [-1, 1, 4, 1]], ["tile_d", "sp", [-1, 1, 1, 5]], ["tile_y", "sp", [-1, 1, 5, 1]], ["tile_x", "sp", [-1, 1, 5, 2]], ["tile_rc", "sp", [-1, 1]], ["tile_rd", "sp", [-1, 1]], ["tile_ry", "sp", [-1, 3]], ["tile_rx", "sp", [-1, 3]], ["auto_unroll_max_step", "ot", 512], ["unroll_explicit", "ot", 0]]}], "r": [[0.00201372992], 0, 2.3335318565368652, 1575005949.649091], "v": 0.1}
{"i": ["cuda", "schedule_direct_3d_cuda", [[1, 192, 10, 10, 10], [192, 192, 3, 3, 3], [1, 1, 1], [1, 1, 1], 1], {}, ["schedule_direct_3d_cuda", [1, 192, 10, 10, 10], [192, 192, 3, 3, 3], [1, 1, 1], [1, 1, 1], 1], {"i": 251728881, "t": "", "c": null, "e": [["tile_f", "sp", [-1, 1, 4, 1]], ["tile_d", "sp", [-1, 1, 1, 2]], ["tile_y", "sp", [-1, 1, 10, 1]], ["tile_x", "sp", [-1, 1, 2, 5]], ["tile_rc", "sp", [-1, 1]], ["tile_rd", "sp", [-1, 3]], ["tile_ry", "sp", [-1, 1]], ["tile_rx", "sp", [-1, 3]], ["auto_unroll_max_step", "ot", 512], ["unroll_explicit", "ot", 0]]}], "r": [[0.0006544209607843137], 0, 2.4130656719207764, 1575005950.7264764], "v": 0.1}
{"i": ["cuda", "schedule_direct_3d_cuda", [[1, 192, 10, 10, 10], [192, 192, 3, 3, 3], [1, 1, 1], [1, 1, 1], 1], {}, ["schedule_direct_3d_cuda", [1, 192, 10, 10, 10], [192, 192, 3, 3, 3], [1, 1, 1], [1, 1, 1], 1], {"i": 135855602, "t": "", "c": null, "e": [["tile_f", "sp", [-1, 2, 8, 1]], ["tile_d", "sp", [-1, 1, 1, 5]], ["tile_y", "sp", [-1, 1, 5, 1]], ["tile_x", "sp", [-1, 1, 5, 2]], ["tile_rc", "sp", [-1, 1]], ["tile_rd", "sp", [-1, 3]], ["tile_ry", "sp", [-1, 3]], ["tile_rx", "sp", [-1, 3]], ["auto_unroll_max_step", "ot", 0], ["unroll_explicit", "ot", 0]]}], "r": [[0.0010288232016806723], 0, 2.4774169921875, 1575005951.869518], "v": 0.1}
{"i": ["cuda", "schedule_direct_3d_cuda", [[1, 192, 10, 10, 10], [192, 192, 3, 3, 3], [1, 1, 1], [1, 1, 1], 1], {}, ["schedule_direct_3d_cuda", [1, 192, 10, 10, 10], [192, 192, 3, 3, 3], [1, 1, 1], [1, 1, 1], 1], {"i": 444404738, "t": "", "c": null, "e": [["tile_f", "sp", [-1, 2, 8, 1]], ["tile_d", "sp", [-1, 1, 1, 2]], ["tile_y", "sp", [-1, 1, 10, 1]], ["tile_x", "sp", [-1, 1, 2, 5]], ["tile_rc", "sp", [-1, 1]], ["tile_rd", "sp", [-1, 3]], ["tile_ry", "sp", [-1, 3]], ["tile_rx", "sp", [-1, 3]], ["auto_unroll_max_step", "ot", 1500], ["unroll_explicit", "ot", 0]]}], "r": [[0.0005101198201892744], 0, 2.6138312816619873, 1575005953.1076012], "v": 0.1}
{"i": ["cuda", "schedule_direct_3d_cuda", [[1, 192, 10, 10, 10], [192, 192, 3, 3, 3], [1, 1, 1], [1, 1, 1], 1], {}, ["schedule_direct_3d_cuda", [1, 192, 10, 10, 10], [192, 192, 3, 3, 3], [1, 1, 1], [1, 1, 1], 1], {"i": 136123394, "t": "", "c": null, "e": [["tile_f", "sp", [-1, 2, 8, 1]], ["tile_d", "sp", [-1, 1, 1, 2]], ["tile_y", "sp", [-1, 1, 10, 1]], ["tile_x", "sp", [-1, 1, 2, 5]], ["tile_rc", "sp", [-1, 1]], ["tile_rd", "sp", [-1, 3]], ["tile_ry", "sp", [-1, 3]], ["tile_rx", "sp", [-1, 3]], ["auto_unroll_max_step", "ot", 0], ["unroll_explicit", "ot", 0]]}], "r": [[0.0006156670114503816], 0, 2.549795150756836, 1575005954.279365], "v": 0.1}
{"i": ["cuda", "schedule_direct_3d_cuda", [[1, 192, 10, 10, 10], [192, 192, 3, 3, 3], [1, 1, 1], [1, 1, 1], 1], {}, ["schedule_direct_3d_cuda", [1, 192, 10, 10, 10], [192, 192, 3, 3, 3], [1, 1, 1], [1, 1, 1], 1], {"i": 290264066, "t": "", "c": null, "e": [["tile_f", "sp", [-1, 2, 8, 1]], ["tile_d", "sp", [-1, 1, 1, 2]], ["tile_y", "sp", [-1, 1, 10, 1]], ["tile_x", "sp", [-1, 1, 2, 5]], ["tile_rc", "sp", [-1, 1]], ["tile_rd", "sp", [-1, 3]], ["tile_ry", "sp", [-1, 3]], ["tile_rx", "sp", [-1, 3]], ["auto_unroll_max_step", "ot", 512], ["unroll_explicit", "ot", 0]]}], "r": [[0.0006264883923076923], 0, 2.3897109031677246, 1575005955.450899], "v": 0.1}
{"i": ["cuda", "schedule_direct_3d_cuda", [[1, 192, 10, 10, 10], [192, 192, 3, 3, 3], [1, 1, 1], [1, 1, 1], 1], {}, ["schedule_direct_3d_cuda", [1, 192, 10, 10, 10], [192, 192, 3, 3, 3], [1, 1, 1], [1, 1, 1], 1], {"i": 289996274, "t": "", "c": null, "e": [["tile_f", "sp", [-1, 2, 8, 1]], ["tile_d", "sp", [-1, 1, 1, 5]], ["tile_y", "sp", [-1, 1, 5, 1]], ["tile_x", "sp", [-1, 1, 5, 2]], ["tile_rc", "sp", [-1, 1]], ["tile_rd", "sp", [-1, 3]], ["tile_ry", "sp", [-1, 3]], ["tile_rx", "sp", [-1, 3]], ["auto_unroll_max_step", "ot", 512], ["unroll_explicit", "ot", 0]]}], "r": [[0.0008170095609756098], 0, 2.0770561695098877, 1575005956.3478096], "v": 0.1}
{"i": ["cuda", "schedule_direct_3d_cuda", [[1, 192, 10, 10, 10], [192, 192, 3, 3, 3], [1, 1, 1], [1, 1, 1], 1], {}, ["schedule_direct_3d_cuda", [1, 192, 10, 10, 10], [192, 192, 3, 3, 3], [1, 1, 1], [1, 1, 1], 1], {"i": 235286410, "t": "", "c": null, "e": [["tile_f", "sp", [-1, 2, 12, 1]], ["tile_d", "sp", [-1, 2, 1, 1]], ["tile_y", "sp", [-1, 1, 5, 1]], ["tile_x", "sp", [-1, 1, 1, 10]], ["tile_rc", "sp", [-1, 3]], ["tile_rd", "sp", [-1, 1]], ["tile_ry", "sp", [-1, 1]], ["tile_rx", "sp", [-1, 3]], ["auto_unroll_max_step", "ot", 512], ["unroll_explicit", "ot", 0]]}], "r": [[0.000947358783018868], 0, 1.9952936172485352, 1575005957.369509], "v": 0.1}
{"i": ["cuda", "schedule_direct_3d_cuda", [[1, 192, 10, 10, 10], [192, 192, 3, 3, 3], [1, 1, 1], [1, 1, 1], 1], {}, ["schedule_direct_3d_cuda", [1, 192, 10, 10, 10], [192, 192, 3, 3, 3], [1, 1, 1], [1, 1, 1], 1], {"i": 390803338, "t": "", "c": null, "e": [["tile_f", "sp", [-1, 2, 12, 1]], ["tile_d", "sp", [-1, 2, 1, 1]], ["tile_y", "sp", [-1, 1, 5, 1]], ["tile_x", "sp", [-1, 1, 1, 10]], ["tile_rc", "sp", [-1, 4]], ["tile_rd", "sp", [-1, 1]], ["tile_ry", "sp", [-1, 1]], ["tile_rx", "sp", [-1, 3]], ["auto_unroll_max_step", "ot", 1500], ["unroll_explicit", "ot", 0]]}], "r": [[0.0007575124930232558], 0, 2.7958688735961914, 1575005961.719903], "v": 0.1}
{"i": ["cuda", "schedule_direct_3d_cuda", [[1, 192, 10, 10, 10], [192, 192, 3, 3, 3], [1, 1, 1], [1, 1, 1], 1], {}, ["schedule_direct_3d_cuda", [1, 192, 10, 10, 10], [192, 192, 3, 3, 3], [1, 1, 1], [1, 1, 1], 1], {"i": 236662666, "t": "", "c": null, "e": [["tile_f", "sp", [-1, 2, 12, 1]], ["tile_d", "sp", [-1, 2, 1, 1]], ["tile_y", "sp", [-1, 1, 5, 1]], ["tile_x", "sp", [-1, 1, 1, 10]], ["tile_rc", "sp", [-1, 4]], ["tile_rd", "sp", [-1, 1]], ["tile_ry", "sp", [-1, 1]], ["tile_rx", "sp", [-1, 3]], ["auto_unroll_max_step", "ot", 512], ["unroll_explicit", "ot", 0]]}], "r": [[0.0009394950373831777], 0, 2.2255256175994873, 1575005962.7950902], "v": 0.1}
{"i": ["cuda", "schedule_direct_3d_cuda", [[1, 192, 10, 10, 10], [192, 192, 3, 3, 3], [1, 1, 1], [1, 1, 1], 1], {}, ["schedule_direct_3d_cuda", [1, 192, 10, 10, 10], [192, 192, 3, 3, 3], [1, 1, 1], [1, 1, 1], 1], {"i": 389427082, "t": "", "c": null, "e": [["tile_f", "sp", [-1, 2, 12, 1]], ["tile_d", "sp", [-1, 2, 1, 1]], ["tile_y", "sp", [-1, 1, 5, 1]], ["tile_x", "sp", [-1, 1, 1, 10]], ["tile_rc", "sp", [-1, 3]], ["tile_rd", "sp", [-1, 1]], ["tile_ry", "sp", [-1, 1]], ["tile_rx", "sp", [-1, 3]], ["auto_unroll_max_step", "ot", 1500], ["unroll_explicit", "ot", 0]]}], "r": [[0.001881178], 0, 2.9251973628997803, 1575005964.3120303], "v": 0.1}
{"i": ["cuda", "schedule_direct_3d_cuda", [[1, 192, 10, 10, 10], [192, 192, 3, 3, 3], [1, 1, 1], [1, 1, 1], 1], {}, ["schedule_direct_3d_cuda", [1, 192, 10, 10, 10], [192, 192, 3, 3, 3], [1, 1, 1], [1, 1, 1], 1], {"i": 544957449, "t": "", "c": null, "e": [["tile_f", "sp", [-1, 1, 12, 1]], ["tile_d", "sp", [-1, 1, 1, 2]], ["tile_y", "sp", [-1, 1, 10, 1]], ["tile_x", "sp", [-1, 1, 1, 10]], ["tile_rc", "sp", [-1, 4]], ["tile_rd", "sp", [-1, 1]], ["tile_ry", "sp", [-1, 1]], ["tile_rx", "sp", [-1, 3]], ["auto_unroll_max_step", "ot", 0], ["unroll_explicit", "ot", 1]]}], "r": [[0.0008496791271186441], 0, 1.9539594650268555, 1575005965.1468625], "v": 0.1}
{"i": ["cuda", "schedule_direct_3d_cuda", [[1, 192, 10, 10, 10], [192, 192, 3, 3, 3], [1, 1, 1], [1, 1, 1], 1], {}, ["schedule_direct_3d_cuda", [1, 192, 10, 10, 10], [192, 192, 3, 3, 3], [1, 1, 1], [1, 1, 1], 1], {"i": 405601761, "t": "", "c": null, "e": [["tile_f", "sp", [-1, 1, 4, 1]], ["tile_d", "sp", [-1, 1, 1, 5]], ["tile_y", "sp", [-1, 1, 5, 1]], ["tile_x", "sp", [-1, 1, 5, 2]], ["tile_rc", "sp", [-1, 1]], ["tile_rd", "sp", [-1, 3]], ["tile_ry", "sp", [-1, 1]], ["tile_rx", "sp", [-1, 3]], ["auto_unroll_max_step", "ot", 1500], ["unroll_explicit", "ot", 0]]}], "r": [[0.0015623414], 0, 2.058504819869995, 1575005966.0885286], "v": 0.1}
{"i": ["cuda", "schedule_direct_3d_cuda", [[1, 192, 10, 10, 10], [192, 192, 3, 3, 3], [1, 1, 1], [1, 1, 1], 1], {}, ["schedule_direct_3d_cuda", [1, 192, 10, 10, 10], [192, 192, 3, 3, 3], [1, 1, 1], [1, 1, 1], 1], {"i": 97320417, "t": "", "c": null, "e": [["tile_f", "sp", [-1, 1, 4, 1]], ["tile_d", "sp", [-1, 1, 1, 5]], ["tile_y", "sp", [-1, 1, 5, 1]], ["tile_x", "sp", [-1, 1, 5, 2]], ["tile_rc", "sp", [-1, 1]], ["tile_rd", "sp", [-1, 3]], ["tile_ry", "sp", [-1, 1]], ["tile_rx", "sp", [-1, 3]], ["auto_unroll_max_step", "ot", 0], ["unroll_explicit", "ot", 0]]}], "r": [[0.0010941398804347826], 0, 2.2920796871185303, 1575005966.9901435], "v": 0.1}
{"i": ["cuda", "schedule_direct_3d_cuda", [[1, 192, 10, 10, 10], [192, 192, 3, 3, 3], [1, 1, 1], [1, 1, 1], 1], {}, ["schedule_direct_3d_cuda", [1, 192, 10, 10, 10], [192, 192, 3, 3, 3], [1, 1, 1], [1, 1, 1], 1], {"i": 733150689, "t": "", "c": null, "e": [["tile_f", "sp", [-1, 1, 4, 1]], ["tile_d", "sp", [-1, 1, 1, 5]], ["tile_y", "sp", [-1, 1, 5, 1]], ["tile_x", "sp", [-1, 1, 5, 2]], ["tile_rc", "sp", [-1, 1]], ["tile_rd", "sp", [-1, 1]], ["tile_ry", "sp", [-1, 3]], ["tile_rx", "sp", [-1, 3]], ["auto_unroll_max_step", "ot", 512], ["unroll_explicit", "ot", 1]]}], "r": [[0.00201673258], 0, 2.9018020629882812, 1575005967.9588478], "v": 0.1}
{"i": ["cuda", "schedule_direct_3d_cuda", [[1, 192, 10, 10, 10], [192, 192, 3, 3, 3], [1, 1, 1], [1, 1, 1], 1], {}, ["schedule_direct_3d_cuda", [1, 192, 10, 10, 10], [192, 192, 3, 3, 3], [1, 1, 1], [1, 1, 1], 1], {"i": 289728494, "t": "", "c": null, "e": [["tile_f", "sp", [-1, 1, 16, 1]], ["tile_d", "sp", [-1, 1, 1, 10]], ["tile_y", "sp", [-1, 1, 2, 1]], ["tile_x", "sp", [-1, 1, 10, 1]], ["tile_rc", "sp", [-1, 1]], ["tile_rd", "sp", [-1, 3]], ["tile_ry", "sp", [-1, 3]], ["tile_rx", "sp", [-1, 3]], ["auto_unroll_max_step", "ot", 512], ["unroll_explicit", "ot", 0]]}], "r": [[0.000579132690647482], 0, 2.7320449352264404, 1575005969.14876], "v": 0.1}
{"i": ["cuda", "schedule_direct_3d_cuda", [[1, 192, 10, 10, 10], [192, 192, 3, 3, 3], [1, 1, 1], [1, 1, 1], 1], {}, ["schedule_direct_3d_cuda", [1, 192, 10, 10, 10], [192, 192, 3, 3, 3], [1, 1, 1], [1, 1, 1], 1], {"i": 443869166, "t": "", "c": null, "e": [["tile_f", "sp", [-1, 1, 16, 1]], ["tile_d", "sp", [-1, 1, 1, 10]], ["tile_y", "sp", [-1, 1, 2, 1]], ["tile_x", "sp", [-1, 1, 10, 1]], ["tile_rc", "sp", [-1, 1]], ["tile_rd", "sp", [-1, 3]], ["tile_ry", "sp", [-1, 3]], ["tile_rx", "sp", [-1, 3]], ["auto_unroll_max_step", "ot", 1500], ["unroll_explicit", "ot", 0]]}], "r": [[0.0005918746982248521], 0, 2.3582069873809814, 1575005969.9934192], "v": 0.1}
{"i": ["cuda", "schedule_direct_3d_cuda", [[1, 192, 10, 10, 10], [192, 192, 3, 3, 3], [1, 1, 1], [1, 1, 1], 1], {}, ["schedule_direct_3d_cuda", [1, 192, 10, 10, 10], [192, 192, 3, 3, 3], [1, 1, 1], [1, 1, 1], 1], {"i": 135587822, "t": "", "c": null, "e": [["tile_f", "sp", [-1, 1, 16, 1]], ["tile_d", "sp", [-1, 1, 1, 10]], ["tile_y", "sp", [-1, 1, 2, 1]], ["tile_x", "sp", [-1, 1, 10, 1]], ["tile_rc", "sp", [-1, 1]], ["tile_rd", "sp", [-1, 3]], ["tile_ry", "sp", [-1, 3]], ["tile_rx", "sp", [-1, 3]], ["auto_unroll_max_step", "ot", 0], ["unroll_explicit", "ot", 0]]}], "r": [[0.0011557790804597701], 0, 2.3966896533966064, 1575005970.8794634], "v": 0.1}
{"i": ["cuda", "schedule_direct_3d_cuda", [[1, 192, 10, 10, 10], [192, 192, 3, 3, 3], [1, 1, 1], [1, 1, 1], 1], {}, ["schedule_direct_3d_cuda", [1, 192, 10, 10, 10], [192, 192, 3, 3, 3], [1, 1, 1], [1, 1, 1], 1], {"i": 290264049, "t": "", "c": null, "e": [["tile_f", "sp", [-1, 1, 4, 1]], ["tile_d", "sp", [-1, 1, 1, 2]], ["tile_y", "sp", [-1, 1, 10, 1]], ["tile_x", "sp", [-1, 1, 2, 5]], ["tile_rc", "sp", [-1, 1]], ["tile_rd", "sp", [-1, 3]], ["tile_ry", "sp", [-1, 3]], ["tile_rx", "sp", [-1, 3]], ["auto_unroll_max_step", "ot", 512], ["unroll_explicit", "ot", 0]]}], "r": [[0.0006944253073593074], 0, 2.548013210296631, 1575005972.1493006], "v": 0.1}
{"i": ["cuda", "schedule_direct_3d_cuda", [[1, 192, 10, 10, 10], [192, 192, 3, 3, 3], [1, 1, 1], [1, 1, 1], 1], {}, ["schedule_direct_3d_cuda", [1, 192, 10, 10, 10], [192, 192, 3, 3, 3], [1, 1, 1], [1, 1, 1], 1], {"i": 136123377, "t": "", "c": null, "e": [["tile_f", "sp", [-1, 1, 4, 1]], ["tile_d", "sp", [-1, 1, 1, 2]], ["tile_y", "sp", [-1, 1, 10, 1]], ["tile_x", "sp", [-1, 1, 2, 5]], ["tile_rc", "sp", [-1, 1]], ["tile_rd", "sp", [-1, 3]], ["tile_ry", "sp", [-1, 3]], ["tile_rx", "sp", [-1, 3]], ["auto_unroll_max_step", "ot", 0], ["unroll_explicit", "ot", 0]]}], "r": [[0.0006882592777777778], 0, 2.538844347000122, 1575005973.3306904], "v": 0.1}
{"i": ["cuda", "schedule_direct_3d_cuda", [[1, 192, 10, 10, 10], [192, 192, 3, 3, 3], [1, 1, 1], [1, 1, 1], 1], {}, ["schedule_direct_3d_cuda", [1, 192, 10, 10, 10], [192, 192, 3, 3, 3], [1, 1, 1], [1, 1, 1], 1], {"i": 350905330, "t": "", "c": null, "e": [["tile_f", "sp", [-1, 2, 4, 1]], ["tile_d", "sp", [-1, 1, 1, 2]], ["tile_y", "sp", [-1, 1, 10, 1]], ["tile_x", "sp", [-1, 1, 1, 10]], ["tile_rc", "sp", [-1, 3]], ["tile_rd", "sp", [-1, 1]], ["tile_ry", "sp", [-1, 3]], ["tile_rx", "sp", [-1, 1]], ["auto_unroll_max_step", "ot", 1500], ["unroll_explicit", "ot", 0]]}], "r": [[0.005429221222222223], 0, 3.2431952953338623, 1575005978.1020055], "v": 0.1}
{"i": ["cuda", "schedule_direct_3d_cuda", [[1, 192, 10, 10, 10], [192, 192, 3, 3, 3], [1, 1, 1], [1, 1, 1], 1], {}, ["schedule_direct_3d_cuda", [1, 192, 10, 10, 10], [192, 192, 3, 3, 3], [1, 1, 1], [1, 1, 1], 1], {"i": 270987057, "t": "", "c": null, "e": [["tile_f", "sp", [-1, 1, 4, 1]], ["tile_d", "sp", [-1, 2, 1, 5]], ["tile_y", "sp", [-1, 1, 5, 1]], ["tile_x", "sp", [-1, 1, 2, 5]], ["tile_rc", "sp", [-1, 1]], ["tile_rd", "sp", [-1, 1]], ["tile_ry", "sp", [-1, 3]], ["tile_rx", "sp", [-1, 3]], ["auto_unroll_max_step", "ot", 512], ["unroll_explicit", "ot", 0]]}], "r": [[0.0031684196875], 0, 2.186168909072876, 1575005979.3020477], "v": 0.1}
{"i": ["cuda", "schedule_direct_3d_cuda", [[1, 192, 10, 10, 10], [192, 192, 3, 3, 3], [1, 1, 1], [1, 1, 1], 1], {}, ["schedule_direct_3d_cuda", [1, 192, 10, 10, 10], [192, 192, 3, 3, 3], [1, 1, 1], [1, 1, 1], 1], {"i": 425127729, "t": "", "c": null, "e": [["tile_f", "sp", [-1, 1, 4, 1]], ["tile_d", "sp", [-1, 2, 1, 5]], ["tile_y", "sp", [-1, 1, 5, 1]], ["tile_x", "sp", [-1, 1, 2, 5]], ["tile_rc", "sp", [-1, 1]], ["tile_rd", "sp", [-1, 1]], ["tile_ry", "sp", [-1, 3]], ["tile_rx", "sp", [-1, 3]], ["auto_unroll_max_step", "ot", 1500], ["unroll_explicit", "ot", 0]]}], "r": [[0.002646389894736842], 0, 3.244380474090576, 1575005980.6332417], "v": 0.1}
{"i": ["cuda", "schedule_direct_3d_cuda", [[1, 192, 10, 10, 10], [192, 192, 3, 3, 3], [1, 1, 1], [1, 1, 1], 1], {}, ["schedule_direct_3d_cuda", [1, 192, 10, 10, 10], [192, 192, 3, 3, 3], [1, 1, 1], [1, 1, 1], 1], {"i": 906826754, "t": "", "c": null, "e": [["tile_f", "sp", [-1, 2, 8, 1]], ["tile_d", "sp", [-1, 1, 1, 2]], ["tile_y", "sp", [-1, 1, 10, 1]], ["tile_x", "sp", [-1, 1, 2, 5]], ["tile_rc", "sp", [-1, 1]], ["tile_rd", "sp", [-1, 3]], ["tile_ry", "sp", [-1, 3]], ["tile_rx", "sp", [-1, 3]], ["auto_unroll_max_step", "ot", 1500], ["unroll_explicit", "ot", 1]]}], "r": [[0.0005009805420560748], 0, 3.0391716957092285, 1575005981.8511665], "v": 0.1}
{"i": ["cuda", "schedule_direct_3d_cuda", [[1, 192, 10, 10, 10], [192, 192, 3, 3, 3], [1, 1, 1], [1, 1, 1], 1], {}, ["schedule_direct_3d_cuda", [1, 192, 10, 10, 10], [192, 192, 3, 3, 3], [1, 1, 1], [1, 1, 1], 1], {"i": 752686082, "t": "", "c": null, "e": [["tile_f", "sp", [-1, 2, 8, 1]], ["tile_d", "sp", [-1, 1, 1, 2]], ["tile_y", "sp", [-1, 1, 10, 1]], ["tile_x", "sp", [-1, 1, 2, 5]], ["tile_rc", "sp", [-1, 1]], ["tile_rd", "sp", [-1, 3]], ["tile_ry", "sp", [-1, 3]], ["tile_rx", "sp", [-1, 3]], ["auto_unroll_max_step", "ot", 512], ["unroll_explicit", "ot", 1]]}], "r": [[0.0006348309620253165], 0, 2.4234018325805664, 1575005982.7207398], "v": 0.1}
{"i": ["cuda", "schedule_direct_3d_cuda", [[1, 192, 10, 10, 10], [192, 192, 3, 3, 3], [1, 1, 1], [1, 1, 1], 1], {}, ["schedule_direct_3d_cuda", [1, 192, 10, 10, 10], [192, 192, 3, 3, 3], [1, 1, 1], [1, 1, 1], 1], {"i": 752418290, "t": "", "c": null, "e": [["tile_f", "sp", [-1, 2, 8, 1]], ["tile_d", "sp", [-1, 1, 1, 5]], ["tile_y", "sp", [-1, 1, 5, 1]], ["tile_x", "sp", [-1, 1, 5, 2]], ["tile_rc", "sp", [-1, 1]], ["tile_rd", "sp", [-1, 3]], ["tile_ry", "sp", [-1, 3]], ["tile_rx", "sp", [-1, 3]], ["auto_unroll_max_step", "ot", 512], ["unroll_explicit", "ot", 1]]}], "r": [[0.0008239546639344262], 0, 2.659169912338257, 1575005983.611963], "v": 0.1}
{"i": ["cuda", "schedule_direct_3d_cuda", [[1, 192, 10, 10, 10], [192, 192, 3, 3, 3], [1, 1, 1], [1, 1, 1], 1], {}, ["schedule_direct_3d_cuda", [1, 192, 10, 10, 10], [192, 192, 3, 3, 3], [1, 1, 1], [1, 1, 1], 1], {"i": 136206734, "t": "", "c": null, "e": [["tile_f", "sp", [-1, 1, 16, 1]], ["tile_d", "sp", [-1, 2, 1, 1]], ["tile_y", "sp", [-1, 1, 10, 1]], ["tile_x", "sp", [-1, 1, 1, 10]], ["tile_rc", "sp", [-1, 1]], ["tile_rd", "sp", [-1, 3]], ["tile_ry", "sp", [-1, 3]], ["tile_rx", "sp", [-1, 3]], ["auto_unroll_max_step", "ot", 0], ["unroll_explicit", "ot", 0]]}], "r": [[0.0007529994962406014], 0, 2.0667457580566406, 1575005984.4760575], "v": 0.1}
{"i": ["cuda", "schedule_direct_3d_cuda", [[1, 192, 10, 10, 10], [192, 192, 3, 3, 3], [1, 1, 1], [1, 1, 1], 1], {}, ["schedule_direct_3d_cuda", [1, 192, 10, 10, 10], [192, 192, 3, 3, 3], [1, 1, 1], [1, 1, 1], 1], {"i": 444488078, "t": "", "c": null, "e": [["tile_f", "sp", [-1, 1, 16, 1]], ["tile_d", "sp", [-1, 2, 1, 1]], ["tile_y", "sp", [-1, 1, 10, 1]], ["tile_x", "sp", [-1, 1, 1, 10]], ["tile_rc", "sp", [-1, 1]], ["tile_rd", "sp", [-1, 3]], ["tile_ry", "sp", [-1, 3]], ["tile_rx", "sp", [-1, 3]], ["auto_unroll_max_step", "ot", 1500], ["unroll_explicit", "ot", 0]]}], "r": [[0.00054739170790378], 0, 2.5299136638641357, 1575005985.6660395], "v": 0.1}
{"i": ["cuda", "schedule_direct_3d_cuda", [[1, 192, 10, 10, 10], [192, 192, 3, 3, 3], [1, 1, 1], [1, 1, 1], 1], {}, ["schedule_direct_3d_cuda", [1, 192, 10, 10, 10], [192, 192, 3, 3, 3], [1, 1, 1], [1, 1, 1], 1], {"i": 274883401, "t": "", "c": null, "e": [["tile_f", "sp", [-1, 2, 6, 2]], ["tile_d", "sp", [-1, 1, 1, 2]], ["tile_y", "sp", [-1, 1, 5, 2]], ["tile_x", "sp", [-1, 1, 5, 2]], ["tile_rc", "sp", [-1, 4]], ["tile_rd", "sp", [-1, 1]], ["tile_ry", "sp", [-1, 3]], ["tile_rx", "sp", [-1, 3]], ["auto_unroll_max_step", "ot", 512], ["unroll_explicit", "ot", 0]]}], "r": [[0.0010686823510638298], 0, 2.473883628845215, 1575005986.6628788], "v": 0.1}
{"i": ["cuda", "schedule_direct_3d_cuda", [[1, 192, 10, 10, 10], [192, 192, 3, 3, 3], [1, 1, 1], [1, 1, 1], 1], {}, ["schedule_direct_3d_cuda", [1, 192, 10, 10, 10], [192, 192, 3, 3, 3], [1, 1, 1], [1, 1, 1], 1], {"i": 429024073, "t": "", "c": null, "e": [["tile_f", "sp", [-1, 2, 6, 2]], ["tile_d", "sp", [-1, 1, 1, 2]], ["tile_y", "sp", [-1, 1, 5, 2]], ["tile_x", "sp", [-1, 1, 5, 2]], ["tile_rc", "sp", [-1, 4]], ["tile_rd", "sp", [-1, 1]], ["tile_ry", "sp", [-1, 3]], ["tile_rx", "sp", [-1, 3]], ["auto_unroll_max_step", "ot", 1500], ["unroll_explicit", "ot", 0]]}], "r": [[0.00232007625], 0, 2.8688037395477295, 1575005987.904973], "v": 0.1}
{"i": ["cuda", "schedule_direct_3d_cuda", [[1, 192, 10, 10, 10], [192, 192, 3, 3, 3], [1, 1, 1], [1, 1, 1], 1], {}, ["schedule_direct_3d_cuda", [1, 192, 10, 10, 10], [192, 192, 3, 3, 3], [1, 1, 1], [1, 1, 1], 1], {"i": 120742729, "t": "", "c": null, "e": [["tile_f", "sp", [-1, 2, 6, 2]], ["tile_d", "sp", [-1, 1, 1, 2]], ["tile_y", "sp", [-1, 1, 5, 2]], ["tile_x", "sp", [-1, 1, 5, 2]], ["tile_rc", "sp", [-1, 4]], ["tile_rd", "sp", [-1, 1]], ["tile_ry", "sp", [-1, 3]], ["tile_rx", "sp", [-1, 3]], ["auto_unroll_max_step", "ot", 0], ["unroll_explicit", "ot", 0]]}], "r": [[0.0010649546382978724], 0, 2.3299169540405273, 1575005988.8548653], "v": 0.1}
{"i": ["cuda", "schedule_direct_3d_cuda", [[1, 192, 10, 10, 10], [192, 192, 3, 3, 3], [1, 1, 1], [1, 1, 1], 1], {}, ["schedule_direct_3d_cuda", [1, 192, 10, 10, 10], [192, 192, 3, 3, 3], [1, 1, 1], [1, 1, 1], 1], {"i": 82532409, "t": "", "c": null, "e": [["tile_f", "sp", [-1, 1, 12, 1]], ["tile_d", "sp", [-1, 1, 1, 1]], ["tile_y", "sp", [-1, 1, 10, 1]], ["tile_x", "sp", [-1, 1, 1, 10]], ["tile_rc", "sp", [-1, 4]], ["tile_rd", "sp", [-1, 1]], ["tile_ry", "sp", [-1, 1]], ["tile_rx", "sp", [-1, 3]], ["auto_unroll_max_step", "ot", 0], ["unroll_explicit", "ot", 0]]}], "r": [[0.0007154818714285715], 0, 2.0850417613983154, 1575005989.7814937], "v": 0.1}
{"i": ["cuda", "schedule_direct_3d_cuda", [[1, 192, 10, 10, 10], [192, 192, 3, 3, 3], [1, 1, 1], [1, 1, 1], 1], {}, ["schedule_direct_3d_cuda", [1, 192, 10, 10, 10], [192, 192, 3, 3, 3], [1, 1, 1], [1, 1, 1], 1], {"i": 45201441, "t": "", "c": null, "e": [["tile_f", "sp", [-1, 1, 4, 1]], ["tile_d", "sp", [-1, 1, 1, 1]], ["tile_y", "sp", [-1, 1, 10, 1]], ["tile_x", "sp", [-1, 2, 1, 5]], ["tile_rc", "sp", [-1, 6]], ["tile_rd", "sp", [-1, 1]], ["tile_ry", "sp", [-1, 3]], ["tile_rx", "sp", [-1, 1]], ["auto_unroll_max_step", "ot", 0], ["unroll_explicit", "ot", 0]]}], "r": [[0.0017920757321428572], 0, 1.6894512176513672, 1575005993.3079026], "v": 0.1}
{"i": ["cuda", "schedule_direct_3d_cuda", [[1, 192, 10, 10, 10], [192, 192, 3, 3, 3], [1, 1, 1], [1, 1, 1], 1], {}, ["schedule_direct_3d_cuda", [1, 192, 10, 10, 10], [192, 192, 3, 3, 3], [1, 1, 1], [1, 1, 1], 1], {"i": 43825185, "t": "", "c": null, "e": [["tile_f", "sp", [-1, 1, 4, 1]], ["tile_d", "sp", [-1, 1, 1, 1]], ["tile_y", "sp", [-1, 1, 10, 1]], ["tile_x", "sp", [-1, 2, 1, 5]], ["tile_rc", "sp", [-1, 4]], ["tile_rd", "sp", [-1, 1]], ["tile_ry", "sp", [-1, 3]], ["tile_rx", "sp", [-1, 1]], ["auto_unroll_max_step", "ot", 0], ["unroll_explicit", "ot", 0]]}], "r": [[0.0015012989402985073], 0, 1.7170963287353516, 1575005994.2127655], "v": 0.1}
{"i": ["cuda", "schedule_direct_3d_cuda", [[1, 192, 10, 10, 10], [192, 192, 3, 3, 3], [1, 1, 1], [1, 1, 1], 1], {}, ["schedule_direct_3d_cuda", [1, 192, 10, 10, 10], [192, 192, 3, 3, 3], [1, 1, 1], [1, 1, 1], 1], {"i": 353482785, "t": "", "c": null, "e": [["tile_f", "sp", [-1, 1, 4, 1]], ["tile_d", "sp", [-1, 1, 1, 1]], ["tile_y", "sp", [-1, 1, 10, 1]], ["tile_x", "sp", [-1, 2, 1, 5]], ["tile_rc", "sp", [-1, 6]], ["tile_rd", "sp", [-1, 1]], ["tile_ry", "sp", [-1, 3]], ["tile_rx", "sp", [-1, 1]], ["auto_unroll_max_step", "ot", 1500], ["unroll_explicit", "ot", 0]]}], "r": [[0.001975280450980392], 0, 2.540607213973999, 1575005995.53394], "v": 0.1}
{"i": ["cuda", "schedule_direct_3d_cuda", [[1, 192, 10, 10, 10], [192, 192, 3, 3, 3], [1, 1, 1], [1, 1, 1], 1], {}, ["schedule_direct_3d_cuda", [1, 192, 10, 10, 10], [192, 192, 3, 3, 3], [1, 1, 1], [1, 1, 1], 1], {"i": 115997649, "t": "", "c": null, "e": [["tile_f", "sp", [-1, 1, 4, 1]], ["tile_d", "sp", [-1, 1, 1, 10]], ["tile_y", "sp", [-1, 1, 10, 1]], ["tile_x", "sp", [-1, 1, 2, 1]], ["tile_rc", "sp", [-1, 1]], ["tile_rd", "sp", [-1, 1]], ["tile_ry", "sp", [-1, 3]], ["tile_rx", "sp", [-1, 3]], ["auto_unroll_max_step", "ot", 0], ["unroll_explicit", "ot", 0]]}], "r": [[0.0019166527358490566], 0, 1.9741411209106445, 1575005996.459423], "v": 0.1}
{"i": ["cuda", "schedule_direct_3d_cuda", [[1, 192, 10, 10, 10], [192, 192, 3, 3, 3], [1, 1, 1], [1, 1, 1], 1], {}, ["schedule_direct_3d_cuda", [1, 192, 10, 10, 10], [192, 192, 3, 3, 3], [1, 1, 1], [1, 1, 1], 1], {"i": 270138321, "t": "", "c": null, "e": [["tile_f", "sp", [-1, 1, 4, 1]], ["tile_d", "sp", [-1, 1, 1, 10]], ["tile_y", "sp", [-1, 1, 10, 1]], ["tile_x", "sp", [-1, 1, 2, 1]], ["tile_rc", "sp", [-1, 1]], ["tile_rd", "sp", [-1, 1]], ["tile_ry", "sp", [-1, 3]], ["tile_rx", "sp", [-1, 3]], ["auto_unroll_max_step", "ot", 512], ["unroll_explicit", "ot", 0]]}], "r": [[0.0016233451612903225], 0, 2.122967004776001, 1575005997.4757404], "v": 0.1}
{"i": ["cuda", "schedule_direct_3d_cuda", [[1, 192, 10, 10, 10], [192, 192, 3, 3, 3], [1, 1, 1], [1, 1, 1], 1], {}, ["schedule_direct_3d_cuda", [1, 192, 10, 10, 10], [192, 192, 3, 3, 3], [1, 1, 1], [1, 1, 1], 1], {"i": 118232066, "t": "", "c": null, "e": [["tile_f", "sp", [-1, 2, 8, 1]], ["tile_d", "sp", [-1, 1, 1, 2]], ["tile_y", "sp", [-1, 1, 10, 1]], ["tile_x", "sp", [-1, 1, 2, 5]], ["tile_rc", "sp", [-1, 2]], ["tile_rd", "sp", [-1, 1]], ["tile_ry", "sp", [-1, 3]], ["tile_rx", "sp", [-1, 3]], ["auto_unroll_max_step", "ot", 0], ["unroll_explicit", "ot", 0]]}], "r": [[0.0008177053857868021], 0, 2.247779369354248, 1575005998.7004292], "v": 0.1}
{"i": ["cuda", "schedule_direct_3d_cuda", [[1, 192, 10, 10, 10], [192, 192, 3, 3, 3], [1, 1, 1], [1, 1, 1], 1], {}, ["schedule_direct_3d_cuda", [1, 192, 10, 10, 10], [192, 192, 3, 3, 3], [1, 1, 1], [1, 1, 1], 1], {"i": 426513410, "t": "", "c": null, "e": [["tile_f", "sp", [-1, 2, 8, 1]], ["tile_d", "sp", [-1, 1, 1, 2]], ["tile_y", "sp", [-1, 1, 10, 1]], ["tile_x", "sp", [-1, 1, 2, 5]], ["tile_rc", "sp", [-1, 2]], ["tile_rd", "sp", [-1, 1]], ["tile_ry", "sp", [-1, 3]], ["tile_rx", "sp", [-1, 3]], ["auto_unroll_max_step", "ot", 1500], ["unroll_explicit", "ot", 0]]}], "r": [[0.0007278333045454546], 0, 2.625152111053467, 1575006000.012078], "v": 0.1}
{"i": ["cuda", "schedule_direct_3d_cuda", [[1, 192, 10, 10, 10], [192, 192, 3, 3, 3], [1, 1, 1], [1, 1, 1], 1], {}, ["schedule_direct_3d_cuda", [1, 192, 10, 10, 10], [192, 192, 3, 3, 3], [1, 1, 1], [1, 1, 1], 1], {"i": 83290065, "t": "", "c": null, "e": [["tile_f", "sp", [-1, 1, 4, 1]], ["tile_d", "sp", [-1, 1, 1, 10]], ["tile_y", "sp", [-1, 1, 2, 1]], ["tile_x", "sp", [-1, 1, 10, 1]], ["tile_rc", "sp", [-1, 6]], ["tile_rd", "sp", [-1, 1]], ["tile_ry", "sp", [-1, 1]], ["tile_rx", "sp", [-1, 3]], ["auto_unroll_max_step", "ot", 0], ["unroll_explicit", "ot", 0]]}], "r": [[0.0020384664936708864], 0, 2.3305978775024414, 1575006001.1735225], "v": 0.1}
{"i": ["cuda", "schedule_direct_3d_cuda", [[1, 192, 10, 10, 10], [192, 192, 3, 3, 3], [1, 1, 1], [1, 1, 1], 1], {}, ["schedule_direct_3d_cuda", [1, 192, 10, 10, 10], [192, 192, 3, 3, 3], [1, 1, 1], [1, 1, 1], 1], {"i": 237430737, "t": "", "c": null, "e": [["tile_f", "sp", [-1, 1, 4, 1]], ["tile_d", "sp", [-1, 1, 1, 10]], ["tile_y", "sp", [-1, 1, 2, 1]], ["tile_x", "sp", [-1, 1, 10, 1]], ["tile_rc", "sp", [-1, 6]], ["tile_rd", "sp", [-1, 1]], ["tile_ry", "sp", [-1, 1]], ["tile_rx", "sp", [-1, 3]], ["auto_unroll_max_step", "ot", 512], ["unroll_explicit", "ot", 0]]}], "r": [[0.003508457103448276], 0, 2.3324227333068848, 1575006002.2675111], "v": 0.1}
{"i": ["cuda", "schedule_direct_3d_cuda", [[1, 192, 10, 10, 10], [192, 192, 3, 3, 3], [1, 1, 1], [1, 1, 1], 1], {}, ["schedule_direct_3d_cuda", [1, 192, 10, 10, 10], [192, 192, 3, 3, 3], [1, 1, 1], [1, 1, 1], 1], {"i": 391571409, "t": "", "c": null, "e": [["tile_f", "sp", [-1, 1, 4, 1]], ["tile_d", "sp", [-1, 1, 1, 10]], ["tile_y", "sp", [-1, 1, 2, 1]], ["tile_x", "sp", [-1, 1, 10, 1]], ["tile_rc", "sp", [-1, 6]], ["tile_rd", "sp", [-1, 1]], ["tile_ry", "sp", [-1, 1]], ["tile_rx", "sp", [-1, 3]], ["auto_unroll_max_step", "ot", 1500], ["unroll_explicit", "ot", 0]]}], "r": [[0.004919655142857143], 0, 3.207847833633423, 1575006004.1095726], "v": 0.1}
{"i": ["cuda", "schedule_direct_3d_cuda", [[1, 192, 10, 10, 10], [192, 192, 3, 3, 3], [1, 1, 1], [1, 1, 1], 1], {}, ["schedule_direct_3d_cuda", [1, 192, 10, 10, 10], [192, 192, 3, 3, 3], [1, 1, 1], [1, 1, 1], 1], {"i": 427962250, "t": "", "c": null, "e": [["tile_f", "sp", [-1, 2, 12, 1]], ["tile_d", "sp", [-1, 2, 1, 1]], ["tile_y", "sp", [-1, 1, 5, 1]], ["tile_x", "sp", [-1, 1, 1, 10]], ["tile_rc", "sp", [-1, 3]], ["tile_rd", "sp", [-1, 1]], ["tile_ry", "sp", [-1, 3]], ["tile_rx", "sp", [-1, 3]], ["auto_unroll_max_step", "ot", 1500], ["unroll_explicit", "ot", 0]]}], "r": [[0.0018376158181818182], 0, 2.5272722244262695, 1575006005.4041064], "v": 0.1}
{"i": ["cuda", "schedule_direct_3d_cuda", [[1, 192, 10, 10, 10], [192, 192, 3, 3, 3], [1, 1, 1], [1, 1, 1], 1], {}, ["schedule_direct_3d_cuda", [1, 192, 10, 10, 10], [192, 192, 3, 3, 3], [1, 1, 1], [1, 1, 1], 1], {"i": 273821578, "t": "", "c": null, "e": [["tile_f", "sp", [-1, 2, 12, 1]], ["tile_d", "sp", [-1, 2, 1, 1]], ["tile_y", "sp", [-1, 1, 5, 1]], ["tile_x", "sp", [-1, 1, 1, 10]], ["tile_rc", "sp", [-1, 3]], ["tile_rd", "sp", [-1, 1]], ["tile_ry", "sp", [-1, 3]], ["tile_rx", "sp", [-1, 3]], ["auto_unroll_max_step", "ot", 512], ["unroll_explicit", "ot", 0]]}], "r": [[0.0010579845789473684], 0, 2.1314949989318848, 1575006006.4982028], "v": 0.1}
{"i": ["cuda", "schedule_direct_3d_cuda", [[1, 192, 10, 10, 10], [192, 192, 3, 3, 3], [1, 1, 1], [1, 1, 1], 1], {}, ["schedule_direct_3d_cuda", [1, 192, 10, 10, 10], [192, 192, 3, 3, 3], [1, 1, 1], [1, 1, 1], 1], {"i": 85287937, "t": "", "c": null, "e": [["tile_f", "sp", [-1, 1, 8, 1]], ["tile_d", "sp", [-1, 1, 1, 2]], ["tile_y", "sp", [-1, 1, 10, 1]], ["tile_x", "sp", [-1, 1, 1, 10]], ["tile_rc", "sp", [-1, 8]], ["tile_rd", "sp", [-1, 1]], ["tile_ry", "sp", [-1, 1]], ["tile_rx", "sp", [-1, 3]], ["auto_unroll_max_step", "ot", 0], ["unroll_explicit", "ot", 0]]}], "r": [[0.0013228057105263158], 0, 1.6192469596862793, 1575006011.054431], "v": 0.1}
{"i": ["cuda", "schedule_direct_3d_cuda", [[1, 192, 10, 10, 10], [192, 192, 3, 3, 3], [1, 1, 1], [1, 1, 1], 1], {}, ["schedule_direct_3d_cuda", [1, 192, 10, 10, 10], [192, 192, 3, 3, 3], [1, 1, 1], [1, 1, 1], 1], {"i": 393569281, "t": "", "c": null, "e": [["tile_f", "sp", [-1, 1, 8, 1]], ["tile_d", "sp", [-1, 1, 1, 2]], ["tile_y", "sp", [-1, 1, 10, 1]], ["tile_x", "sp", [-1, 1, 1, 10]], ["tile_rc", "sp", [-1, 8]], ["tile_rd", "sp", [-1, 1]], ["tile_ry", "sp", [-1, 1]], ["tile_rx", "sp", [-1, 3]], ["auto_unroll_max_step", "ot", 1500], ["unroll_explicit", "ot", 0]]}], "r": [[0.0009436021886792453], 0, 2.0644028186798096, 1575006012.0597022], "v": 0.1}
{"i": ["cuda", "schedule_direct_3d_cuda", [[1, 192, 10, 10, 10], [192, 192, 3, 3, 3], [1, 1, 1], [1, 1, 1], 1], {}, ["schedule_direct_3d_cuda", [1, 192, 10, 10, 10], [192, 192, 3, 3, 3], [1, 1, 1], [1, 1, 1], 1], {"i": 239428609, "t": "", "c": null, "e": [["tile_f", "sp", [-1, 1, 8, 1]], ["tile_d", "sp", [-1, 1, 1, 2]], ["tile_y", "sp", [-1, 1, 10, 1]], ["tile_x", "sp", [-1, 1, 1, 10]], ["tile_rc", "sp", [-1, 8]], ["tile_rd", "sp", [-1, 1]], ["tile_ry", "sp", [-1, 1]], ["tile_rx", "sp", [-1, 3]], ["auto_unroll_max_step", "ot", 512], ["unroll_explicit", "ot", 0]]}], "r": [[0.0009438350188679245], 0, 1.9649858474731445, 1575006012.896898], "v": 0.1}
{"i": ["cuda", "schedule_direct_3d_cuda", [[1, 192, 10, 10, 10], [192, 192, 3, 3, 3], [1, 1, 1], [1, 1, 1], 1], {}, ["schedule_direct_3d_cuda", [1, 192, 10, 10, 10], [192, 192, 3, 3, 3], [1, 1, 1], [1, 1, 1], 1], {"i": 598009838, "t": "", "c": null, "e": [["tile_f", "sp", [-1, 1, 16, 1]], ["tile_d", "sp", [-1, 1, 1, 10]], ["tile_y", "sp", [-1, 1, 2, 1]], ["tile_x", "sp", [-1, 1, 10, 1]], ["tile_rc", "sp", [-1, 1]], ["tile_rd", "sp", [-1, 3]], ["tile_ry", "sp", [-1, 3]], ["tile_rx", "sp", [-1, 3]], ["auto_unroll_max_step", "ot", 0], ["unroll_explicit", "ot", 1]]}], "r": [[0.0011633846860465116], 0, 1.7140631675720215, 1575006013.7389333], "v": 0.1}
{"i": ["cuda", "schedule_direct_3d_cuda", [[1, 192, 10, 10, 10], [192, 192, 3, 3, 3], [1, 1, 1], [1, 1, 1], 1], {}, ["schedule_direct_3d_cuda", [1, 192, 10, 10, 10], [192, 192, 3, 3, 3], [1, 1, 1], [1, 1, 1], 1], {"i": 906291182, "t": "", "c": null, "e": [["tile_f", "sp", [-1, 1, 16, 1]], ["tile_d", "sp", [-1, 1, 1, 10]], ["tile_y", "sp", [-1, 1, 2, 1]], ["tile_x", "sp", [-1, 1, 10, 1]], ["tile_rc", "sp", [-1, 1]], ["tile_rd", "sp", [-1, 3]], ["tile_ry", "sp", [-1, 3]], ["tile_rx", "sp", [-1, 3]], ["auto_unroll_max_step", "ot", 1500], ["unroll_explicit", "ot", 1]]}], "r": [[0.0005938276481481482], 0, 2.4868030548095703, 1575006014.9193635], "v": 0.1}
{"i": ["cuda", "schedule_direct_3d_cuda", [[1, 192, 10, 10, 10], [192, 192, 3, 3, 3], [1, 1, 1], [1, 1, 1], 1], {}, ["schedule_direct_3d_cuda", [1, 192, 10, 10, 10], [192, 192, 3, 3, 3], [1, 1, 1], [1, 1, 1], 1], {"i": 752150510, "t": "", "c": null, "e": [["tile_f", "sp", [-1, 1, 16, 1]], ["tile_d", "sp", [-1, 1, 1, 10]], ["tile_y", "sp", [-1, 1, 2, 1]], ["tile_x", "sp", [-1, 1, 10, 1]], ["tile_rc", "sp", [-1, 1]], ["tile_rd", "sp", [-1, 3]], ["tile_ry", "sp", [-1, 3]], ["tile_rx", "sp", [-1, 3]], ["auto_unroll_max_step", "ot", 512], ["unroll_explicit", "ot", 1]]}], "r": [[0.000592550775147929], 0, 2.233870267868042, 1575006015.7545214], "v": 0.1}
{"i": ["cuda", "schedule_direct_3d_cuda", [[1, 192, 10, 10, 10], [192, 192, 3, 3, 3], [1, 1, 1], [1, 1, 1], 1], {}, ["schedule_direct_3d_cuda", [1, 192, 10, 10, 10], [192, 192, 3, 3, 3], [1, 1, 1], [1, 1, 1], 1], {"i": 659186674, "t": "", "c": null, "e": [["tile_f", "sp", [-1, 2, 4, 1]], ["tile_d", "sp", [-1, 1, 1, 2]], ["tile_y", "sp", [-1, 1, 10, 1]], ["tile_x", "sp", [-1, 1, 1, 10]], ["tile_rc", "sp", [-1, 3]], ["tile_rd", "sp", [-1, 1]], ["tile_ry", "sp", [-1, 3]], ["tile_rx", "sp", [-1, 1]], ["auto_unroll_max_step", "ot", 512], ["unroll_explicit", "ot", 1]]}], "r": [[0.004597662545454546], 0, 2.9979305267333984, 1575006016.9240317], "v": 0.1}
{"i": ["cuda", "schedule_direct_3d_cuda", [[1, 192, 10, 10, 10], [192, 192, 3, 3, 3], [1, 1, 1], [1, 1, 1], 1], {}, ["schedule_direct_3d_cuda", [1, 192, 10, 10, 10], [192, 192, 3, 3, 3], [1, 1, 1], [1, 1, 1], 1], {"i": 505046002, "t": "", "c": null, "e": [["tile_f", "sp", [-1, 2, 4, 1]], ["tile_d", "sp", [-1, 1, 1, 2]], ["tile_y", "sp", [-1, 1, 10, 1]], ["tile_x", "sp", [-1, 1, 1, 10]], ["tile_rc", "sp", [-1, 3]], ["tile_rd", "sp", [-1, 1]], ["tile_ry", "sp", [-1, 3]], ["tile_rx", "sp", [-1, 1]], ["auto_unroll_max_step", "ot", 0], ["unroll_explicit", "ot", 1]]}], "r": [[0.003051618060606061], 0, 2.0700647830963135, 1575006017.8049188], "v": 0.1}
{"i": ["cuda", "schedule_direct_3d_cuda", [[1, 192, 10, 10, 10], [192, 192, 3, 3, 3], [1, 1, 1], [1, 1, 1], 1], {}, ["schedule_direct_3d_cuda", [1, 192, 10, 10, 10], [192, 192, 3, 3, 3], [1, 1, 1], [1, 1, 1], 1], {"i": 813327346, "t": "", "c": null, "e": [["tile_f", "sp", [-1, 2, 4, 1]], ["tile_d", "sp", [-1, 1, 1, 2]], ["tile_y", "sp", [-1, 1, 10, 1]], ["tile_x", "sp", [-1, 1, 1, 10]], ["tile_rc", "sp", [-1, 3]], ["tile_rd", "sp", [-1, 1]], ["tile_ry", "sp", [-1, 3]], ["tile_rx", "sp", [-1, 1]], ["auto_unroll_max_step", "ot", 1500], ["unroll_explicit", "ot", 1]]}], "r": [[0.0037100213214285717], 0, 4.1179468631744385, 1575006019.3987892], "v": 0.1}
{"i": ["cuda", "schedule_direct_3d_cuda", [[1, 192, 10, 10, 10], [192, 192, 3, 3, 3], [1, 1, 1], [1, 1, 1], 1], {}, ["schedule_direct_3d_cuda", [1, 192, 10, 10, 10], [192, 192, 3, 3, 3], [1, 1, 1], [1, 1, 1], 1], {"i": 390816769, "t": "", "c": null, "e": [["tile_f", "sp", [-1, 1, 8, 1]], ["tile_d", "sp", [-1, 1, 1, 2]], ["tile_y", "sp", [-1, 1, 10, 1]], ["tile_x", "sp", [-1, 1, 1, 10]], ["tile_rc", "sp", [-1, 4]], ["tile_rd", "sp", [-1, 1]], ["tile_ry", "sp", [-1, 1]], ["tile_rx", "sp", [-1, 3]], ["auto_unroll_max_step", "ot", 1500], ["unroll_explicit", "ot", 0]]}], "r": [[0.0009035464684684684], 0, 2.329521417617798, 1575006020.5582302], "v": 0.1}
{"i": ["cuda", "schedule_direct_3d_cuda", [[1, 192, 10, 10, 10], [192, 192, 3, 3, 3], [1, 1, 1], [1, 1, 1], 1], {}, ["schedule_direct_3d_cuda", [1, 192, 10, 10, 10], [192, 192, 3, 3, 3], [1, 1, 1], [1, 1, 1], 1], {"i": 238052361, "t": "", "c": null, "e": [["tile_f", "sp", [-1, 1, 12, 1]], ["tile_d", "sp", [-1, 1, 1, 2]], ["tile_y", "sp", [-1, 1, 10, 1]], ["tile_x", "sp", [-1, 1, 1, 10]], ["tile_rc", "sp", [-1, 6]], ["tile_rd", "sp", [-1, 1]], ["tile_ry", "sp", [-1, 1]], ["tile_rx", "sp", [-1, 3]], ["auto_unroll_max_step", "ot", 512], ["unroll_explicit", "ot", 0]]}], "r": [[0.0009246433275862069], 0, 2.5736961364746094, 1575006022.0002527], "v": 0.1}
{"i": ["cuda", "schedule_direct_3d_cuda", [[1, 192, 10, 10, 10], [192, 192, 3, 3, 3], [1, 1, 1], [1, 1, 1], 1], {}, ["schedule_direct_3d_cuda", [1, 192, 10, 10, 10], [192, 192, 3, 3, 3], [1, 1, 1], [1, 1, 1], 1], {"i": 82535425, "t": "", "c": null, "e": [["tile_f", "sp", [-1, 1, 8, 1]], ["tile_d", "sp", [-1, 1, 1, 2]], ["tile_y", "sp", [-1, 1, 10, 1]], ["tile_x", "sp", [-1, 1, 1, 10]], ["tile_rc", "sp", [-1, 4]], ["tile_rd", "sp", [-1, 1]], ["tile_ry", "sp", [-1, 1]], ["tile_rx", "sp", [-1, 3]], ["auto_unroll_max_step", "ot", 0], ["unroll_explicit", "ot", 0]]}], "r": [[0.0008506919152542373], 0, 1.7581448554992676, 1575006022.8326542], "v": 0.1}
{"i": ["cuda", "schedule_direct_3d_cuda", [[1, 192, 10, 10, 10], [192, 192, 3, 3, 3], [1, 1, 1], [1, 1, 1], 1], {}, ["schedule_direct_3d_cuda", [1, 192, 10, 10, 10], [192, 192, 3, 3, 3], [1, 1, 1], [1, 1, 1], 1], {"i": 427886641, "t": "", "c": null, "e": [["tile_f", "sp", [-1, 1, 8, 1]], ["tile_d", "sp", [-1, 1, 1, 1]], ["tile_y", "sp", [-1, 1, 10, 1]], ["tile_x", "sp", [-1, 1, 2, 5]], ["tile_rc", "sp", [-1, 3]], ["tile_rd", "sp", [-1, 1]], ["tile_ry", "sp", [-1, 3]], ["tile_rx", "sp", [-1, 3]], ["auto_unroll_max_step", "ot", 1500], ["unroll_explicit", "ot", 0]]}], "r": [[0.0010390461395348837], 0, 2.1211588382720947, 1575006324.128649], "v": 0.1}
{"i": ["cuda", "schedule_direct_3d_cuda", [[1, 192, 10, 10, 10], [192, 192, 3, 3, 3], [1, 1, 1], [1, 1, 1], 1], {}, ["schedule_direct_3d_cuda", [1, 192, 10, 10, 10], [192, 192, 3, 3, 3], [1, 1, 1], [1, 1, 1], 1], {"i": 273745969, "t": "", "c": null, "e": [["tile_f", "sp", [-1, 1, 8, 1]], ["tile_d", "sp", [-1, 1, 1, 1]], ["tile_y", "sp", [-1, 1, 10, 1]], ["tile_x", "sp", [-1, 1, 2, 5]], ["tile_rc", "sp", [-1, 3]], ["tile_rd", "sp", [-1, 1]], ["tile_ry", "sp", [-1, 3]], ["tile_rx", "sp", [-1, 3]], ["auto_unroll_max_step", "ot", 512], ["unroll_explicit", "ot", 0]]}], "r": [[0.0009791928424242424], 0, 2.2138335704803467, 1575006325.2931266], "v": 0.1}
{"i": ["cuda", "schedule_direct_3d_cuda", [[1, 192, 10, 10, 10], [192, 192, 3, 3, 3], [1, 1, 1], [1, 1, 1], 1], {}, ["schedule_direct_3d_cuda", [1, 192, 10, 10, 10], [192, 192, 3, 3, 3], [1, 1, 1], [1, 1, 1], 1], {"i": 736167985, "t": "", "c": null, "e": [["tile_f", "sp", [-1, 1, 8, 1]], ["tile_d", "sp", [-1, 1, 1, 1]], ["tile_y", "sp", [-1, 1, 10, 1]], ["tile_x", "sp", [-1, 1, 2, 5]], ["tile_rc", "sp", [-1, 3]], ["tile_rd", "sp", [-1, 1]], ["tile_ry", "sp", [-1, 3]], ["tile_rx", "sp", [-1, 3]], ["auto_unroll_max_step", "ot", 512], ["unroll_explicit", "ot", 1]]}], "r": [[0.0009652161626506025], 0, 2.949160099029541, 1575006326.5169601], "v": 0.1}
{"i": ["cuda", "schedule_direct_3d_cuda", [[1, 192, 10, 10, 10], [192, 192, 3, 3, 3], [1, 1, 1], [1, 1, 1], 1], {}, ["schedule_direct_3d_cuda", [1, 192, 10, 10, 10], [192, 192, 3, 3, 3], [1, 1, 1], [1, 1, 1], 1], {"i": 890308657, "t": "", "c": null, "e": [["tile_f", "sp", [-1, 1, 8, 1]], ["tile_d", "sp", [-1, 1, 1, 1]], ["tile_y", "sp", [-1, 1, 10, 1]], ["tile_x", "sp", [-1, 1, 2, 5]], ["tile_rc", "sp", [-1, 3]], ["tile_rd", "sp", [-1, 1]], ["tile_ry", "sp", [-1, 3]], ["tile_rx", "sp", [-1, 3]], ["auto_unroll_max_step", "ot", 1500], ["unroll_explicit", "ot", 1]]}], "r": [[0.0009641448571428571], 0, 2.874948501586914, 1575006327.6603978], "v": 0.1}
{"i": ["cuda", "schedule_direct_3d_cuda", [[1, 192, 10, 10, 10], [192, 192, 3, 3, 3], [1, 1, 1], [1, 1, 1], 1], {}, ["schedule_direct_3d_cuda", [1, 192, 10, 10, 10], [192, 192, 3, 3, 3], [1, 1, 1], [1, 1, 1], 1], {"i": 273659953, "t": "", "c": null, "e": [["tile_f", "sp", [-1, 1, 8, 1]], ["tile_d", "sp", [-1, 1, 1, 1]], ["tile_y", "sp", [-1, 1, 10, 1]], ["tile_x", "sp", [-1, 2, 1, 5]], ["tile_rc", "sp", [-1, 3]], ["tile_rd", "sp", [-1, 1]], ["tile_ry", "sp", [-1, 3]], ["tile_rx", "sp", [-1, 3]], ["auto_unroll_max_step", "ot", 512], ["unroll_explicit", "ot", 0]]}], "r": [[0.0006977555902777778], 0, 2.322920799255371, 1575006328.657292], "v": 0.1}
{"i": ["cuda", "schedule_direct_3d_cuda", [[1, 192, 10, 10, 10], [192, 192, 3, 3, 3], [1, 1, 1], [1, 1, 1], 1], {}, ["schedule_direct_3d_cuda", [1, 192, 10, 10, 10], [192, 192, 3, 3, 3], [1, 1, 1], [1, 1, 1], 1], {"i": 427800625, "t": "", "c": null, "e": [["tile_f", "sp", [-1, 1, 8, 1]], ["tile_d", "sp", [-1, 1, 1, 1]], ["tile_y", "sp", [-1, 1, 10, 1]], ["tile_x", "sp", [-1, 2, 1, 5]], ["tile_rc", "sp", [-1, 3]], ["tile_rd", "sp", [-1, 1]], ["tile_ry", "sp", [-1, 3]], ["tile_rx", "sp", [-1, 3]], ["auto_unroll_max_step", "ot", 1500], ["unroll_explicit", "ot", 0]]}], "r": [[0.0009103129], 0, 2.4634134769439697, 1575006329.7338297], "v": 0.1}
{"i": ["cuda", "schedule_direct_3d_cuda", [[1, 192, 10, 10, 10], [192, 192, 3, 3, 3], [1, 1, 1], [1, 1, 1], 1], {}, ["schedule_direct_3d_cuda", [1, 192, 10, 10, 10], [192, 192, 3, 3, 3], [1, 1, 1], [1, 1, 1], 1], {"i": 119605297, "t": "", "c": null, "e": [["tile_f", "sp", [-1, 1, 8, 1]], ["tile_d", "sp", [-1, 1, 1, 1]], ["tile_y", "sp", [-1, 1, 10, 1]], ["tile_x", "sp", [-1, 1, 2, 5]], ["tile_rc", "sp", [-1, 3]], ["tile_rd", "sp", [-1, 1]], ["tile_ry", "sp", [-1, 3]], ["tile_rx", "sp", [-1, 3]], ["auto_unroll_max_step", "ot", 0], ["unroll_explicit", "ot", 0]]}], "r": [[0.001048713797385621], 0, 2.461616039276123, 1575006330.9533124], "v": 0.1}
{"i": ["cuda", "schedule_direct_3d_cuda", [[1, 192, 10, 10, 10], [192, 192, 3, 3, 3], [1, 1, 1], [1, 1, 1], 1], {}, ["schedule_direct_3d_cuda", [1, 192, 10, 10, 10], [192, 192, 3, 3, 3], [1, 1, 1], [1, 1, 1], 1], {"i": 737286264, "t": "", "c": null, "e": [["tile_f", "sp", [-1, 1, 6, 2]], ["tile_d", "sp", [-1, 1, 1, 1]], ["tile_y", "sp", [-1, 1, 10, 1]], ["tile_x", "sp", [-1, 1, 5, 2]], ["tile_rc", "sp", [-1, 4]], ["tile_rd", "sp", [-1, 1]], ["tile_ry", "sp", [-1, 3]], ["tile_rx", "sp", [-1, 3]], ["auto_unroll_max_step", "ot", 512], ["unroll_explicit", "ot", 1]]}], "r": [[0.0007387988302752295], 0, 3.0612740516662598, 1575006332.201961], "v": 0.1}
{"i": ["cuda", "schedule_direct_3d_cuda", [[1, 192, 10, 10, 10], [192, 192, 3, 3, 3], [1, 1, 1], [1, 1, 1], 1], {}, ["schedule_direct_3d_cuda", [1, 192, 10, 10, 10], [192, 192, 3, 3, 3], [1, 1, 1], [1, 1, 1], 1], {"i": 274864248, "t": "", "c": null, "e": [["tile_f", "sp", [-1, 1, 6, 2]], ["tile_d", "sp", [-1, 1, 1, 1]], ["tile_y", "sp", [-1, 1, 10, 1]], ["tile_x", "sp", [-1, 1, 5, 2]], ["tile_rc", "sp", [-1, 4]], ["tile_rd", "sp", [-1, 1]], ["tile_ry", "sp", [-1, 3]], ["tile_rx", "sp", [-1, 3]], ["auto_unroll_max_step", "ot", 512], ["unroll_explicit", "ot", 0]]}], "r": [[0.0007793851884057971], 0, 2.8125405311584473, 1575006333.485398], "v": 0.1}
{"i": ["cuda", "schedule_direct_3d_cuda", [[1, 192, 10, 10, 10], [192, 192, 3, 3, 3], [1, 1, 1], [1, 1, 1], 1], {}, ["schedule_direct_3d_cuda", [1, 192, 10, 10, 10], [192, 192, 3, 3, 3], [1, 1, 1], [1, 1, 1], 1], {"i": 890222641, "t": "", "c": null, "e": [["tile_f", "sp", [-1, 1, 8, 1]], ["tile_d", "sp", [-1, 1, 1, 1]], ["tile_y", "sp", [-1, 1, 10, 1]], ["tile_x", "sp", [-1, 2, 1, 5]], ["tile_rc", "sp", [-1, 3]], ["tile_rd", "sp", [-1, 1]], ["tile_ry", "sp", [-1, 3]], ["tile_rx", "sp", [-1, 3]], ["auto_unroll_max_step", "ot", 1500], ["unroll_explicit", "ot", 1]]}], "r": [[0.0009100966609195403], 0, 3.2260732650756836, 1575006334.778765], "v": 0.1}
{"i": ["cuda", "schedule_direct_3d_cuda", [[1, 192, 10, 10, 10], [192, 192, 3, 3, 3], [1, 1, 1], [1, 1, 1], 1], {}, ["schedule_direct_3d_cuda", [1, 192, 10, 10, 10], [192, 192, 3, 3, 3], [1, 1, 1], [1, 1, 1], 1], {"i": 736081969, "t": "", "c": null, "e": [["tile_f", "sp", [-1, 1, 8, 1]], ["tile_d", "sp", [-1, 1, 1, 1]], ["tile_y", "sp", [-1, 1, 10, 1]], ["tile_x", "sp", [-1, 2, 1, 5]], ["tile_rc", "sp", [-1, 3]], ["tile_rd", "sp", [-1, 1]], ["tile_ry", "sp", [-1, 3]], ["tile_rx", "sp", [-1, 3]], ["auto_unroll_max_step", "ot", 512], ["unroll_explicit", "ot", 1]]}], "r": [[0.0006951151458333333], 0, 2.3244307041168213, 1575006335.7321603], "v": 0.1}
{"i": ["cuda", "schedule_direct_3d_cuda", [[1, 192, 10, 10, 10], [192, 192, 3, 3, 3], [1, 1, 1], [1, 1, 1], 1], {}, ["schedule_direct_3d_cuda", [1, 192, 10, 10, 10], [192, 192, 3, 3, 3], [1, 1, 1], [1, 1, 1], 1], {"i": 582027313, "t": "", "c": null, "e": [["tile_f", "sp", [-1, 1, 8, 1]], ["tile_d", "sp", [-1, 1, 1, 1]], ["tile_y", "sp", [-1, 1, 10, 1]], ["tile_x", "sp", [-1, 1, 2, 5]], ["tile_rc", "sp", [-1, 3]], ["tile_rd", "sp", [-1, 1]], ["tile_ry", "sp", [-1, 3]], ["tile_rx", "sp", [-1, 3]], ["auto_unroll_max_step", "ot", 0], ["unroll_explicit", "ot", 1]]}], "r": [[0.00104919234375], 0, 1.895998477935791, 1575006336.5871449], "v": 0.1}
{"i": ["cuda", "schedule_direct_3d_cuda", [[1, 192, 10, 10, 10], [192, 192, 3, 3, 3], [1, 1, 1], [1, 1, 1], 1], {}, ["schedule_direct_3d_cuda", [1, 192, 10, 10, 10], [192, 192, 3, 3, 3], [1, 1, 1], [1, 1, 1], 1], {"i": 273748993, "t": "", "c": null, "e": [["tile_f", "sp", [-1, 1, 8, 1]], ["tile_d", "sp", [-1, 1, 1, 2]], ["tile_y", "sp", [-1, 1, 10, 1]], ["tile_x", "sp", [-1, 1, 2, 5]], ["tile_rc", "sp", [-1, 3]], ["tile_rd", "sp", [-1, 1]], ["tile_ry", "sp", [-1, 3]], ["tile_rx", "sp", [-1, 3]], ["auto_unroll_max_step", "ot", 512], ["unroll_explicit", "ot", 0]]}], "r": [[0.0009924506086956522], 0, 1.9777162075042725, 1575006339.6112661], "v": 0.1}
{"i": ["cuda", "schedule_direct_3d_cuda", [[1, 192, 10, 10, 10], [192, 192, 3, 3, 3], [1, 1, 1], [1, 1, 1], 1], {}, ["schedule_direct_3d_cuda", [1, 192, 10, 10, 10], [192, 192, 3, 3, 3], [1, 1, 1], [1, 1, 1], 1], {"i": 427889665, "t": "", "c": null, "e": [["tile_f", "sp", [-1, 1, 8, 1]], ["tile_d", "sp", [-1, 1, 1, 2]], ["tile_y", "sp", [-1, 1, 10, 1]], ["tile_x", "sp", [-1, 1, 2, 5]], ["tile_rc", "sp", [-1, 3]], ["tile_rd", "sp", [-1, 1]], ["tile_ry", "sp", [-1, 3]], ["tile_rx", "sp", [-1, 3]], ["auto_unroll_max_step", "ot", 1500], ["unroll_explicit", "ot", 0]]}], "r": [[0.0014115155810810812], 0, 1.9829161167144775, 1575006340.7174315], "v": 0.1}
{"i": ["cuda", "schedule_direct_3d_cuda", [[1, 192, 10, 10, 10], [192, 192, 3, 3, 3], [1, 1, 1], [1, 1, 1], 1], {}, ["schedule_direct_3d_cuda", [1, 192, 10, 10, 10], [192, 192, 3, 3, 3], [1, 1, 1], [1, 1, 1], 1], {"i": 276240427, "t": "", "c": null, "e": [["tile_f", "sp", [-1, 1, 6, 1]], ["tile_d", "sp", [-1, 1, 1, 1]], ["tile_y", "sp", [-1, 1, 10, 1]], ["tile_x", "sp", [-1, 1, 5, 2]], ["tile_rc", "sp", [-1, 6]], ["tile_rd", "sp", [-1, 1]], ["tile_ry", "sp", [-1, 3]], ["tile_rx", "sp", [-1, 3]], ["auto_unroll_max_step", "ot", 512], ["unroll_explicit", "ot", 0]]}], "r": [[0.0011201153], 0, 1.7313592433929443, 1575006341.7065377], "v": 0.1}
