fourth_layer_input_grad.log
{"i": ["cuda", "schedule_conv3d_transpose_nchw_cuda", [[1, 192, 10, 10, 10], [192, 192, 3, 3, 3], [1, 1, 1], [1, 1, 1], [0, 0, 0], "float32"], {}, ["schedule_conv3d_transpose_nchw_cuda", [1, 192, 10, 10, 10], [192, 192, 3, 3, 3], [1, 1, 1], [1, 1, 1], [0, 0, 0], "float32"], {"i": 289643513, "t": "", "c": null, "e": [["tile_f", "sp", [-1, 8, 1, 2]], ["tile_d", "sp", [-1, 5, 1, 1]], ["tile_y", "sp", [-1, 5, 2, 1]], ["tile_x", "sp", [-1, 2, 5, 1]], ["tile_rc", "sp", [-1, 1]], ["tile_rd", "sp", [-1, 3]], ["tile_ry", "sp", [-1, 3]], ["tile_rx", "sp", [-1, 3]], ["auto_unroll_max_step", "ot", 512], ["unroll_explicit", "ot", 0]]}], "r": [[0.0678879045], 0, 6.496468782424927, 1576306381.5495667], "v": 0.1}
{"i": ["cuda", "schedule_conv3d_transpose_nchw_cuda", [[1, 192, 10, 10, 10], [192, 192, 3, 3, 3], [1, 1, 1], [1, 1, 1], [0, 0, 0], "float32"], {}, ["schedule_conv3d_transpose_nchw_cuda", [1, 192, 10, 10, 10], [192, 192, 3, 3, 3], [1, 1, 1], [1, 1, 1], [0, 0, 0], "float32"], {"i": 98908583, "t": "", "c": null, "e": [["tile_f", "sp", [-1, 1, 6, 8]], ["tile_d", "sp", [-1, 5, 1, 1]], ["tile_y", "sp", [-1, 1, 2, 5]], ["tile_x", "sp", [-1, 2, 1, 5]], ["tile_rc", "sp", [-1, 2]], ["tile_rd", "sp", [-1, 3]], ["tile_ry", "sp", [-1, 1]], ["tile_rx", "sp", [-1, 3]], ["auto_unroll_max_step", "ot", 0], ["unroll_explicit", "ot", 0]]}], "r": [[0.1221782895], 0, 3.5404679775238037, 1576306384.3135574], "v": 0.1}
{"i": ["cuda", "schedule_conv3d_transpose_nchw_cuda", [[1, 192, 10, 10, 10], [192, 192, 3, 3, 3], [1, 1, 1], [1, 1, 1], [0, 0, 0], "float32"], {}, ["schedule_conv3d_transpose_nchw_cuda", [1, 192, 10, 10, 10], [192, 192, 3, 3, 3], [1, 1, 1], [1, 1, 1], [0, 0, 0], "float32"], {"i": 737608962, "t": "", "c": null, "e": [["tile_f", "sp", [-1, 8, 3, 8]], ["tile_d", "sp", [-1, 1, 1, 1]], ["tile_y", "sp", [-1, 1, 2, 1]], ["tile_x", "sp", [-1, 1, 1, 10]], ["tile_rc", "sp", [-1, 4]], ["tile_rd", "sp", [-1, 1]], ["tile_ry", "sp", [-1, 3]], ["tile_rx", "sp", [-1, 3]], ["auto_unroll_max_step", "ot", 512], ["unroll_explicit", "ot", 1]]}], "r": [[0.07304510625], 0, 2.54878568649292, 1576306396.1856692], "v": 0.1}
{"i": ["cuda", "schedule_conv3d_transpose_nchw_cuda", [[1, 192, 10, 10, 10], [192, 192, 3, 3, 3], [1, 1, 1], [1, 1, 1], [0, 0, 0], "float32"], {}, ["schedule_conv3d_transpose_nchw_cuda", [1, 192, 10, 10, 10], [192, 192, 3, 3, 3], [1, 1, 1], [1, 1, 1], [0, 0, 0], "float32"], {"i": 253258170, "t": "", "c": null, "e": [["tile_f", "sp", [-1, 2, 2, 4]], ["tile_d", "sp", [-1, 1, 1, 1]], ["tile_y", "sp", [-1, 5, 2, 1]], ["tile_x", "sp", [-1, 1, 1, 1]], ["tile_rc", "sp", [-1, 3]], ["tile_rd", "sp", [-1, 3]], ["tile_ry", "sp", [-1, 1]], ["tile_rx", "sp", [-1, 3]], ["auto_unroll_max_step", "ot", 512], ["unroll_explicit", "ot", 0]]}], "r": [[0.073496027], 0, 2.921163558959961, 1576306398.3306637], "v": 0.1}
{"i": ["cuda", "schedule_conv3d_transpose_nchw_cuda", [[1, 192, 10, 10, 10], [192, 192, 3, 3, 3], [1, 1, 1], [1, 1, 1], [0, 0, 0], "float32"], {}, ["schedule_conv3d_transpose_nchw_cuda", [1, 192, 10, 10, 10], [192, 192, 3, 3, 3], [1, 1, 1], [1, 1, 1], [0, 0, 0], "float32"], {"i": 698952986, "t": "", "c": null, "e": [["tile_f", "sp", [-1, 3, 32, 1]], ["tile_d", "sp", [-1, 1, 1, 2]], ["tile_y", "sp", [-1, 2, 1, 5]], ["tile_x", "sp", [-1, 2, 1, 5]], ["tile_rc", "sp", [-1, 4]], ["tile_rd", "sp", [-1, 1]], ["tile_ry", "sp", [-1, 1]], ["tile_rx", "sp", [-1, 3]], ["auto_unroll_max_step", "ot", 512], ["unroll_explicit", "ot", 1]]}], "r": [[0.03577627075], 0, 4.351576089859009, 1576306415.5024016], "v": 0.1}
{"i": ["cuda", "schedule_conv3d_transpose_nchw_cuda", [[1, 192, 10, 10, 10], [192, 192, 3, 3, 3], [1, 1, 1], [1, 1, 1], [0, 0, 0], "float32"], {}, ["schedule_conv3d_transpose_nchw_cuda", [1, 192, 10, 10, 10], [192, 192, 3, 3, 3], [1, 1, 1], [1, 1, 1], [0, 0, 0], "float32"], {"i": 831854146, "t": "", "c": null, "e": [["tile_f", "sp", [-1, 12, 8, 2]], ["tile_d", "sp", [-1, 1, 1, 5]], ["tile_y", "sp", [-1, 1, 2, 5]], ["tile_x", "sp", [-1, 1, 5, 1]], ["tile_rc", "sp", [-1, 3]], ["tile_rd", "sp", [-1, 3]], ["tile_ry", "sp", [-1, 3]], ["tile_rx", "sp", [-1, 1]], ["auto_unroll_max_step", "ot", 1500], ["unroll_explicit", "ot", 1]]}], "r": [[0.04513685675], 0, 4.788380861282349, 1576306421.1106427], "v": 0.1}
{"i": ["cuda", "schedule_conv3d_transpose_nchw_cuda", [[1, 192, 10, 10, 10], [192, 192, 3, 3, 3], [1, 1, 1], [1, 1, 1], [0, 0, 0], "float32"], {}, ["schedule_conv3d_transpose_nchw_cuda", [1, 192, 10, 10, 10], [192, 192, 3, 3, 3], [1, 1, 1], [1, 1, 1], [0, 0, 0], "float32"], {"i": 867176601, "t": "", "c": null, "e": [["tile_f", "sp", [-1, 1, 2, 8]], ["tile_d", "sp", [-1, 5, 1, 1]], ["tile_y", "sp", [-1, 1, 1, 2]], ["tile_x", "sp", [-1, 2, 1, 1]], ["tile_rc", "sp", [-1, 1]], ["tile_rd", "sp", [-1, 3]], ["tile_ry", "sp", [-1, 1]], ["tile_rx", "sp", [-1, 3]], ["auto_unroll_max_step", "ot", 1500], ["unroll_explicit", "ot", 1]]}], "r": [[0.007485078714285714], 0, 3.2529170513153076, 1576306422.259454], "v": 0.1}
{"i": ["cuda", "schedule_conv3d_transpose_nchw_cuda", [[1, 192, 10, 10, 10], [192, 192, 3, 3, 3], [1, 1, 1], [1, 1, 1], [0, 0, 0], "float32"], {}, ["schedule_conv3d_transpose_nchw_cuda", [1, 192, 10, 10, 10], [192, 192, 3, 3, 3], [1, 1, 1], [1, 1, 1], [0, 0, 0], "float32"], {"i": 270628945, "t": "", "c": null, "e": [["tile_f", "sp", [-1, 2, 2, 2]], ["tile_d", "sp", [-1, 10, 1, 1]], ["tile_y", "sp", [-1, 1, 2, 1]], ["tile_x", "sp", [-1, 5, 1, 2]], ["tile_rc", "sp", [-1, 1]], ["tile_rd", "sp", [-1, 1]], ["tile_ry", "sp", [-1, 3]], ["tile_rx", "sp", [-1, 3]], ["auto_unroll_max_step", "ot", 512], ["unroll_explicit", "ot", 0]]}], "r": [[0.021469754999999997], 0, 2.8506808280944824, 1576306445.2848814], "v": 0.1}
{"i": ["cuda", "schedule_conv3d_transpose_nchw_cuda", [[1, 192, 10, 10, 10], [192, 192, 3, 3, 3], [1, 1, 1], [1, 1, 1], [0, 0, 0], "float32"], {}, ["schedule_conv3d_transpose_nchw_cuda", [1, 192, 10, 10, 10], [192, 192, 3, 3, 3], [1, 1, 1], [1, 1, 1], [0, 0, 0], "float32"], {"i": 41508601, "t": "", "c": null, "e": [["tile_f", "sp", [-1, 1, 16, 3]], ["tile_d", "sp", [-1, 2, 1, 1]], ["tile_y", "sp", [-1, 1, 1, 2]], ["tile_x", "sp", [-1, 5, 1, 1]], ["tile_rc", "sp", [-1, 3]], ["tile_rd", "sp", [-1, 1]], ["tile_ry", "sp", [-1, 3]], ["tile_rx", "sp", [-1, 1]], ["auto_unroll_max_step", "ot", 0], ["unroll_explicit", "ot", 0]]}], "r": [[0.0025746709642857145], 0, 1.4144318103790283, 1576306448.5984085], "v": 0.1}
{"i": ["cuda", "schedule_conv3d_transpose_nchw_cuda", [[1, 192, 10, 10, 10], [192, 192, 3, 3, 3], [1, 1, 1], [1, 1, 1], [0, 0, 0], "float32"], {}, ["schedule_conv3d_transpose_nchw_cuda", [1, 192, 10, 10, 10], [192, 192, 3, 3, 3], [1, 1, 1], [1, 1, 1], [0, 0, 0], "float32"], {"i": 192848108, "t": "", "c": null, "e": [["tile_f", "sp", [-1, 2, 8, 6]], ["tile_d", "sp", [-1, 1, 1, 1]], ["tile_y", "sp", [-1, 1, 1, 1]], ["tile_x", "sp", [-1, 5, 1, 1]], ["tile_rc", "sp", [-1, 1]], ["tile_rd", "sp", [-1, 1]], ["tile_ry", "sp", [-1, 3]], ["tile_rx", "sp", [-1, 1]], ["auto_unroll_max_step", "ot", 512], ["unroll_explicit", "ot", 0]]}], "r": [[0.005450292962962963], 0, 1.800086498260498, 1576306708.6864407], "v": 0.1}
{"i": ["cuda", "schedule_conv3d_transpose_nchw_cuda", [[1, 192, 10, 10, 10], [192, 192, 3, 3, 3], [1, 1, 1], [1, 1, 1], [0, 0, 0], "float32"], {}, ["schedule_conv3d_transpose_nchw_cuda", [1, 192, 10, 10, 10], [192, 192, 3, 3, 3], [1, 1, 1], [1, 1, 1], [0, 0, 0], "float32"], {"i": 192851128, "t": "", "c": null, "e": [["tile_f", "sp", [-1, 2, 4, 6]], ["tile_d", "sp", [-1, 1, 1, 2]], ["tile_y", "sp", [-1, 1, 1, 1]], ["tile_x", "sp", [-1, 5, 1, 1]], ["tile_rc", "sp", [-1, 1]], ["tile_rd", "sp", [-1, 1]], ["tile_ry", "sp", [-1, 3]], ["tile_rx", "sp", [-1, 1]], ["auto_unroll_max_step", "ot", 512], ["unroll_explicit", "ot", 0]]}], "r": [[0.008236946153846155], 0, 1.8418986797332764, 1576306709.743927], "v": 0.1}
{"i": ["cuda", "schedule_conv3d_transpose_nchw_cuda", [[1, 192, 10, 10, 10], [192, 192, 3, 3, 3], [1, 1, 1], [1, 1, 1], [0, 0, 0], "float32"], {}, ["schedule_conv3d_transpose_nchw_cuda", [1, 192, 10, 10, 10], [192, 192, 3, 3, 3], [1, 1, 1], [1, 1, 1], [0, 0, 0], "float32"], {"i": 192851132, "t": "", "c": null, "e": [["tile_f", "sp", [-1, 2, 8, 6]], ["tile_d", "sp", [-1, 1, 1, 2]], ["tile_y", "sp", [-1, 1, 1, 1]], ["tile_x", "sp", [-1, 5, 1, 1]], ["tile_rc", "sp", [-1, 1]], ["tile_rd", "sp", [-1, 1]], ["tile_ry", "sp", [-1, 3]], ["tile_rx", "sp", [-1, 1]], ["auto_unroll_max_step", "ot", 512], ["unroll_explicit", "ot", 0]]}], "r": [[0.0033293010322580645], 0, 1.8635118007659912, 1576306710.7181282], "v": 0.1}
{"i": ["cuda", "schedule_conv3d_transpose_nchw_cuda", [[1, 192, 10, 10, 10], [192, 192, 3, 3, 3], [1, 1, 1], [1, 1, 1], [0, 0, 0], "float32"], {}, ["schedule_conv3d_transpose_nchw_cuda", [1, 192, 10, 10, 10], [192, 192, 3, 3, 3], [1, 1, 1], [1, 1, 1], [0, 0, 0], "float32"], {"i": 193127656, "t": "", "c": null, "e": [["tile_f", "sp", [-1, 2, 4, 6]], ["tile_d", "sp", [-1, 1, 1, 1]], ["tile_y", "sp", [-1, 1, 2, 1]], ["tile_x", "sp", [-1, 5, 2, 1]], ["tile_rc", "sp", [-1, 1]], ["tile_rd", "sp", [-1, 1]], ["tile_ry", "sp", [-1, 3]], ["tile_rx", "sp", [-1, 1]], ["auto_unroll_max_step", "ot", 512], ["unroll_explicit", "ot", 0]]}], "r": [[0.0016518125573770491], 0, 1.6164746284484863, 1576306711.629792], "v": 0.1}
{"i": ["cuda", "schedule_conv3d_transpose_nchw_cuda", [[1, 192, 10, 10, 10], [192, 192, 3, 3, 3], [1, 1, 1], [1, 1, 1], [0, 0, 0], "float32"], {}, ["schedule_conv3d_transpose_nchw_cuda", [1, 192, 10, 10, 10], [192, 192, 3, 3, 3], [1, 1, 1], [1, 1, 1], [0, 0, 0], "float32"], {"i": 193541612, "t": "", "c": null, "e": [["tile_f", "sp", [-1, 2, 8, 6]], ["tile_d", "sp", [-1, 1, 1, 1]], ["tile_y", "sp", [-1, 2, 1, 1]], ["tile_x", "sp", [-1, 5, 1, 2]], ["tile_rc", "sp", [-1, 1]], ["tile_rd", "sp", [-1, 1]], ["tile_ry", "sp", [-1, 3]], ["tile_rx", "sp", [-1, 1]], ["auto_unroll_max_step", "ot", 512], ["unroll_explicit", "ot", 0]]}], "r": [[0.010215017699999999], 0, 2.178926467895508, 1576306712.8683634], "v": 0.1}
{"i": ["cuda", "schedule_conv3d_transpose_nchw_cuda", [[1, 192, 10, 10, 10], [192, 192, 3, 3, 3], [1, 1, 1], [1, 1, 1], [0, 0, 0], "float32"], {}, ["schedule_conv3d_transpose_nchw_cuda", [1, 192, 10, 10, 10], [192, 192, 3, 3, 3], [1, 1, 1], [1, 1, 1], [0, 0, 0], "float32"], {"i": 193756984, "t": "", "c": null, "e": [["tile_f", "sp", [-1, 2, 4, 6]], ["tile_d", "sp", [-1, 2, 1, 1]], ["tile_y", "sp", [-1, 1, 1, 2]], ["tile_x", "sp", [-1, 1, 1, 5]], ["tile_rc", "sp", [-1, 1]], ["tile_rd", "sp", [-1, 1]], ["tile_ry", "sp", [-1, 3]], ["tile_rx", "sp", [-1, 1]], ["auto_unroll_max_step", "ot", 512], ["unroll_explicit", "ot", 0]]}], "r": [[0.03280895625], 0, 2.361771821975708, 1576306714.2216742], "v": 0.1}
{"i": ["cuda", "schedule_conv3d_transpose_nchw_cuda", [[1, 192, 10, 10, 10], [192, 192, 3, 3, 3], [1, 1, 1], [1, 1, 1], [0, 0, 0], "float32"], {}, ["schedule_conv3d_transpose_nchw_cuda", [1, 192, 10, 10, 10], [192, 192, 3, 3, 3], [1, 1, 1], [1, 1, 1], [0, 0, 0], "float32"], {"i": 192896492, "t": "", "c": null, "e": [["tile_f", "sp", [-1, 2, 8, 6]], ["tile_d", "sp", [-1, 1, 1, 1]], ["tile_y", "sp", [-1, 1, 1, 2]], ["tile_x", "sp", [-1, 5, 1, 1]], ["tile_rc", "sp", [-1, 1]], ["tile_rd", "sp", [-1, 1]], ["tile_ry", "sp", [-1, 3]], ["tile_rx", "sp", [-1, 1]], ["auto_unroll_max_step", "ot", 512], ["unroll_explicit", "ot", 0]]}], "r": [[0.0025758689743589744], 0, 1.7725894451141357, 1576306715.1934834], "v": 0.1}
{"i": ["cuda", "schedule_conv3d_transpose_nchw_cuda", [[1, 192, 10, 10, 10], [192, 192, 3, 3, 3], [1, 1, 1], [1, 1, 1], [0, 0, 0], "float32"], {}, ["schedule_conv3d_transpose_nchw_cuda", [1, 192, 10, 10, 10], [192, 192, 3, 3, 3], [1, 1, 1], [1, 1, 1], [0, 0, 0], "float32"], {"i": 347037160, "t": "", "c": null, "e": [["tile_f", "sp", [-1, 2, 4, 6]], ["tile_d", "sp", [-1, 1, 1, 1]], ["tile_y", "sp", [-1, 1, 1, 2]], ["tile_x", "sp", [-1, 5, 1, 1]], ["tile_rc", "sp", [-1, 1]], ["tile_rd", "sp", [-1, 1]], ["tile_ry", "sp", [-1, 3]], ["tile_rx", "sp", [-1, 1]], ["auto_unroll_max_step", "ot", 1500], ["unroll_explicit", "ot", 0]]}], "r": [[0.004455572478260869], 0, 2.0195765495300293, 1576306716.2257288], "v": 0.1}
{"i": ["cuda", "schedule_conv3d_transpose_nchw_cuda", [[1, 192, 10, 10, 10], [192, 192, 3, 3, 3], [1, 1, 1], [1, 1, 1], [0, 0, 0], "float32"], {}, ["schedule_conv3d_transpose_nchw_cuda", [1, 192, 10, 10, 10], [192, 192, 3, 3, 3], [1, 1, 1], [1, 1, 1], [0, 0, 0], "float32"], {"i": 193799656, "t": "", "c": null, "e": [["tile_f", "sp", [-1, 2, 4, 6]], ["tile_d", "sp", [-1, 1, 1, 1]], ["tile_y", "sp", [-1, 2, 1, 1]], ["tile_x", "sp", [-1, 2, 1, 5]], ["tile_rc", "sp", [-1, 1]], ["tile_rd", "sp", [-1, 1]], ["tile_ry", "sp", [-1, 3]], ["tile_rx", "sp", [-1, 1]], ["auto_unroll_max_step", "ot", 512], ["unroll_explicit", "ot", 0]]}], "r": [[0.024198392166666666], 0, 2.3789491653442383, 1576306717.6522958], "v": 0.1}
{"i": ["cuda", "schedule_conv3d_transpose_nchw_cuda", [[1, 192, 10, 10, 10], [192, 192, 3, 3, 3], [1, 1, 1], [1, 1, 1], [0, 0, 0], "float32"], {}, ["schedule_conv3d_transpose_nchw_cuda", [1, 192, 10, 10, 10], [192, 192, 3, 3, 3], [1, 1, 1], [1, 1, 1], [0, 0, 0], "float32"], {"i": 193711292, "t": "", "c": null, "e": [["tile_f", "sp", [-1, 2, 8, 6]], ["tile_d", "sp", [-1, 1, 1, 2]], ["tile_y", "sp", [-1, 1, 1, 1]], ["tile_x", "sp", [-1, 1, 1, 5]], ["tile_rc", "sp", [-1, 1]], ["tile_rd", "sp", [-1, 1]], ["tile_ry", "sp", [-1, 3]], ["tile_rx", "sp", [-1, 1]], ["auto_unroll_max_step", "ot", 512], ["unroll_explicit", "ot", 0]]}], "r": [[0.003312378709677419], 0, 1.8549690246582031, 1576306718.6469111], "v": 0.1}
{"i": ["cuda", "schedule_conv3d_transpose_nchw_cuda", [[1, 192, 10, 10, 10], [192, 192, 3, 3, 3], [1, 1, 1], [1, 1, 1], [0, 0, 0], "float32"], {}, ["schedule_conv3d_transpose_nchw_cuda", [1, 192, 10, 10, 10], [192, 192, 3, 3, 3], [1, 1, 1], [1, 1, 1], [0, 0, 0], "float32"], {"i": 193584620, "t": "", "c": null, "e": [["tile_f", "sp", [-1, 2, 8, 6]], ["tile_d", "sp", [-1, 1, 1, 1]], ["tile_y", "sp", [-1, 1, 1, 2]], ["tile_x", "sp", [-1, 5, 1, 2]], ["tile_rc", "sp", [-1, 1]], ["tile_rd", "sp", [-1, 1]], ["tile_ry", "sp", [-1, 3]], ["tile_rx", "sp", [-1, 1]], ["auto_unroll_max_step", "ot", 512], ["unroll_explicit", "ot", 0]]}], "r": [[0.0103006468], 0, 2.1413843631744385, 1576306719.8704257], "v": 0.1}
{"i": ["cuda", "schedule_conv3d_transpose_nchw_cuda", [[1, 192, 10, 10, 10], [192, 192, 3, 3, 3], [1, 1, 1], [1, 1, 1], [0, 0, 0], "float32"], {}, ["schedule_conv3d_transpose_nchw_cuda", [1, 192, 10, 10, 10], [192, 192, 3, 3, 3], [1, 1, 1], [1, 1, 1], [0, 0, 0], "float32"], {"i": 347857336, "t": "", "c": null, "e": [["tile_f", "sp", [-1, 2, 4, 6]], ["tile_d", "sp", [-1, 1, 1, 2]], ["tile_y", "sp", [-1, 2, 1, 1]], ["tile_x", "sp", [-1, 1, 1, 5]], ["tile_rc", "sp", [-1, 1]], ["tile_rd", "sp", [-1, 1]], ["tile_ry", "sp", [-1, 3]], ["tile_rx", "sp", [-1, 1]], ["auto_unroll_max_step", "ot", 1500], ["unroll_explicit", "ot", 0]]}], "r": [[0.03358655025], 0, 2.2926125526428223, 1576306721.2630827], "v": 0.1}
{"i": ["cuda", "schedule_conv3d_transpose_nchw_cuda", [[1, 192, 10, 10, 10], [192, 192, 3, 3, 3], [1, 1, 1], [1, 1, 1], [0, 0, 0], "float32"], {}, ["schedule_conv3d_transpose_nchw_cuda", [1, 192, 10, 10, 10], [192, 192, 3, 3, 3], [1, 1, 1], [1, 1, 1], [0, 0, 0], "float32"], {"i": 193988152, "t": "", "c": null, "e": [["tile_f", "sp", [-1, 2, 4, 6]], ["tile_d", "sp", [-1, 2, 1, 1]], ["tile_y", "sp", [-1, 1, 2, 1]], ["tile_x", "sp", [-1, 1, 1, 10]], ["tile_rc", "sp", [-1, 1]], ["tile_rd", "sp", [-1, 1]], ["tile_ry", "sp", [-1, 3]], ["tile_rx", "sp", [-1, 1]], ["auto_unroll_max_step", "ot", 512], ["unroll_explicit", "ot", 0]]}], "r": [[0.004764202666666667], 0, 2.0017635822296143, 1576306724.6095057], "v": 0.1}
{"i": ["cuda", "schedule_conv3d_transpose_nchw_cuda", [[1, 192, 10, 10, 10], [192, 192, 3, 3, 3], [1, 1, 1], [1, 1, 1], [0, 0, 0], "float32"], {}, ["schedule_conv3d_transpose_nchw_cuda", [1, 192, 10, 10, 10], [192, 192, 3, 3, 3], [1, 1, 1], [1, 1, 1], [0, 0, 0], "float32"], {"i": 193802680, "t": "", "c": null, "e": [["tile_f", "sp", [-1, 2, 4, 6]], ["tile_d", "sp", [-1, 1, 1, 2]], ["tile_y", "sp", [-1, 2, 1, 1]], ["tile_x", "sp", [-1, 2, 1, 5]], ["tile_rc", "sp", [-1, 1]], ["tile_rd", "sp", [-1, 1]], ["tile_ry", "sp", [-1, 3]], ["tile_rx", "sp", [-1, 1]], ["auto_unroll_max_step", "ot", 512], ["unroll_explicit", "ot", 0]]}], "r": [[0.094848388], 0, 3.823235511779785, 1576306726.8817625], "v": 0.1}
{"i": ["cuda", "schedule_conv3d_transpose_nchw_cuda", [[1, 192, 10, 10, 10], [192, 192, 3, 3, 3], [1, 1, 1], [1, 1, 1], [0, 0, 0], "float32"], {}, ["schedule_conv3d_transpose_nchw_cuda", [1, 192, 10, 10, 10], [192, 192, 3, 3, 3], [1, 1, 1], [1, 1, 1], [0, 0, 0], "float32"], {"i": 193972024, "t": "", "c": null, "e": [["tile_f", "sp", [-1, 2, 4, 6]], ["tile_d", "sp", [-1, 2, 1, 1]], ["tile_y", "sp", [-1, 2, 1, 1]], ["tile_x", "sp", [-1, 1, 1, 10]], ["tile_rc", "sp", [-1, 1]], ["tile_rd", "sp", [-1, 1]], ["tile_ry", "sp", [-1, 3]], ["tile_rx", "sp", [-1, 1]], ["auto_unroll_max_step", "ot", 512], ["unroll_explicit", "ot", 0]]}], "r": [[0.09447040925], 0, 3.7523515224456787, 1576306729.1493456], "v": 0.1}
{"i": ["cuda", "schedule_conv3d_transpose_nchw_cuda", [[1, 192, 10, 10, 10], [192, 192, 3, 3, 3], [1, 1, 1], [1, 1, 1], [0, 0, 0], "float32"], {}, ["schedule_conv3d_transpose_nchw_cuda", [1, 192, 10, 10, 10], [192, 192, 3, 3, 3], [1, 1, 1], [1, 1, 1], [0, 0, 0], "float32"], {"i": 347854648, "t": "", "c": null, "e": [["tile_f", "sp", [-1, 2, 4, 6]], ["tile_d", "sp", [-1, 2, 1, 1]], ["tile_y", "sp", [-1, 2, 1, 1]], ["tile_x", "sp", [-1, 1, 1, 5]], ["tile_rc", "sp", [-1, 1]], ["tile_rd", "sp", [-1, 1]], ["tile_ry", "sp", [-1, 3]], ["tile_rx", "sp", [-1, 1]], ["auto_unroll_max_step", "ot", 1500], ["unroll_explicit", "ot", 0]]}], "r": [[0.03411063725], 0, 2.452697515487671, 1576306730.5353873], "v": 0.1}
{"i": ["cuda", "schedule_conv3d_transpose_nchw_cuda", [[1, 192, 10, 10, 10], [192, 192, 3, 3, 3], [1, 1, 1], [1, 1, 1], [0, 0, 0], "float32"], {}, ["schedule_conv3d_transpose_nchw_cuda", [1, 192, 10, 10, 10], [192, 192, 3, 3, 3], [1, 1, 1], [1, 1, 1], [0, 0, 0], "float32"], {"i": 347080504, "t": "", "c": null, "e": [["tile_f", "sp", [-1, 2, 4, 6]], ["tile_d", "sp", [-1, 2, 1, 1]], ["tile_y", "sp", [-1, 2, 1, 1]], ["tile_x", "sp", [-1, 10, 1, 1]], ["tile_rc", "sp", [-1, 1]], ["tile_rd", "sp", [-1, 1]], ["tile_ry", "sp", [-1, 3]], ["tile_rx", "sp", [-1, 1]], ["auto_unroll_max_step", "ot", 1500], ["unroll_explicit", "ot", 0]]}], "r": [[0.091195201], 0, 3.9564738273620605, 1576306732.8325238], "v": 0.1}
{"i": ["cuda", "schedule_conv3d_transpose_nchw_cuda", [[1, 192, 10, 10, 10], [192, 192, 3, 3, 3], [1, 1, 1], [1, 1, 1], [0, 0, 0], "float32"], {}, ["schedule_conv3d_transpose_nchw_cuda", [1, 192, 10, 10, 10], [192, 192, 3, 3, 3], [1, 1, 1], [1, 1, 1], [0, 0, 0], "float32"], {"i": 347848940, "t": "", "c": null, "e": [["tile_f", "sp", [-1, 2, 8, 6]], ["tile_d", "sp", [-1, 1, 1, 1]], ["tile_y", "sp", [-1, 1, 1, 1]], ["tile_x", "sp", [-1, 1, 1, 5]], ["tile_rc", "sp", [-1, 1]], ["tile_rd", "sp", [-1, 1]], ["tile_ry", "sp", [-1, 3]], ["tile_rx", "sp", [-1, 1]], ["auto_unroll_max_step", "ot", 1500], ["unroll_explicit", "ot", 0]]}], "r": [[0.0028297079166666665], 0, 1.897409200668335, 1576306733.8558674], "v": 0.1}
{"i": ["cuda", "schedule_conv3d_transpose_nchw_cuda", [[1, 192, 10, 10, 10], [192, 192, 3, 3, 3], [1, 1, 1], [1, 1, 1], [0, 0, 0], "float32"], {}, ["schedule_conv3d_transpose_nchw_cuda", [1, 192, 10, 10, 10], [192, 192, 3, 3, 3], [1, 1, 1], [1, 1, 1], [0, 0, 0], "float32"], {"i": 193987816, "t": "", "c": null, "e": [["tile_f", "sp", [-1, 2, 4, 6]], ["tile_d", "sp", [-1, 1, 1, 1]], ["tile_y", "sp", [-1, 1, 2, 1]], ["tile_x", "sp", [-1, 1, 1, 10]], ["tile_rc", "sp", [-1, 1]], ["tile_rd", "sp", [-1, 1]], ["tile_ry", "sp", [-1, 3]], ["tile_rx", "sp", [-1, 1]], ["auto_unroll_max_step", "ot", 512], ["unroll_explicit", "ot", 0]]}], "r": [[0.00401851964], 0, 1.9527151584625244, 1576306734.9655888], "v": 0.1}
{"i": ["cuda", "schedule_conv3d_transpose_nchw_cuda", [[1, 192, 10, 10, 10], [192, 192, 3, 3, 3], [1, 1, 1], [1, 1, 1], [0, 0, 0], "float32"], {}, ["schedule_conv3d_transpose_nchw_cuda", [1, 192, 10, 10, 10], [192, 192, 3, 3, 3], [1, 1, 1], [1, 1, 1], [0, 0, 0], "float32"], {"i": 347859692, "t": "", "c": null, "e": [["tile_f", "sp", [-1, 2, 8, 6]], ["tile_d", "sp", [-1, 1, 1, 1]], ["tile_y", "sp", [-1, 5, 1, 1]], ["tile_x", "sp", [-1, 1, 1, 5]], ["tile_rc", "sp", [-1, 1]], ["tile_rd", "sp", [-1, 1]], ["tile_ry", "sp", [-1, 3]], ["tile_rx", "sp", [-1, 1]], ["auto_unroll_max_step", "ot", 1500], ["unroll_explicit", "ot", 0]]}], "r": [[0.00985711809090909], 0, 2.186896562576294, 1576306736.123643], "v": 0.1}
{"i": ["cuda", "schedule_conv3d_transpose_nchw_cuda", [[1, 192, 10, 10, 10], [192, 192, 3, 3, 3], [1, 1, 1], [1, 1, 1], [0, 0, 0], "float32"], {}, ["schedule_conv3d_transpose_nchw_cuda", [1, 192, 10, 10, 10], [192, 192, 3, 3, 3], [1, 1, 1], [1, 1, 1], [0, 0, 0], "float32"], {"i": 347252536, "t": "", "c": null, "e": [["tile_f", "sp", [-1, 2, 4, 6]], ["tile_d", "sp", [-1, 2, 1, 1]], ["tile_y", "sp", [-1, 2, 1, 1]], ["tile_x", "sp", [-1, 5, 2, 1]], ["tile_rc", "sp", [-1, 1]], ["tile_rd", "sp", [-1, 1]], ["tile_ry", "sp", [-1, 3]], ["tile_rx", "sp", [-1, 1]], ["auto_unroll_max_step", "ot", 1500], ["unroll_explicit", "ot", 0]]}], "r": [[0.0100511425], 0, 2.3544487953186035, 1576306737.3975396], "v": 0.1}
{"i": ["cuda", "schedule_conv3d_transpose_nchw_cuda", [[1, 192, 10, 10, 10], [192, 192, 3, 3, 3], [1, 1, 1], [1, 1, 1], [0, 0, 0], "float32"], {}, ["schedule_conv3d_transpose_nchw_cuda", [1, 192, 10, 10, 10], [192, 192, 3, 3, 3], [1, 1, 1], [1, 1, 1], [0, 0, 0], "float32"], {"i": 346988780, "t": "", "c": null, "e": [["tile_f", "sp", [-1, 2, 8, 6]], ["tile_d", "sp", [-1, 1, 1, 1]], ["tile_y", "sp", [-1, 1, 1, 1]], ["tile_x", "sp", [-1, 5, 1, 1]], ["tile_rc", "sp", [-1, 1]], ["tile_rd", "sp", [-1, 1]], ["tile_ry", "sp", [-1, 3]], ["tile_rx", "sp", [-1, 1]], ["auto_unroll_max_step", "ot", 1500], ["unroll_explicit", "ot", 0]]}], "r": [[0.002837512], 0, 1.8127310276031494, 1576306738.413333], "v": 0.1}
{"i": ["cuda", "schedule_conv3d_transpose_nchw_cuda", [[1, 192, 10, 10, 10], [192, 192, 3, 3, 3], [1, 1, 1], [1, 1, 1], [0, 0, 0], "float32"], {}, ["schedule_conv3d_transpose_nchw_cuda", [1, 192, 10, 10, 10], [192, 192, 3, 3, 3], [1, 1, 1], [1, 1, 1], [0, 0, 0], "float32"], {"i": 194015032, "t": "", "c": null, "e": [["tile_f", "sp", [-1, 2, 4, 6]], ["tile_d", "sp", [-1, 2, 1, 1]], ["tile_y", "sp", [-1, 1, 1, 2]], ["tile_x", "sp", [-1, 1, 1, 10]], ["tile_rc", "sp", [-1, 1]], ["tile_rd", "sp", [-1, 1]], ["tile_ry", "sp", [-1, 3]], ["tile_rx", "sp", [-1, 1]], ["auto_unroll_max_step", "ot", 512], ["unroll_explicit", "ot", 0]]}], "r": [[0.09634233925], 0, 3.7211556434631348, 1576306740.7147694], "v": 0.1}
{"i": ["cuda", "schedule_conv3d_transpose_nchw_cuda", [[1, 192, 10, 10, 10], [192, 192, 3, 3, 3], [1, 1, 1], [1, 1, 1], [0, 0, 0], "float32"], {}, ["schedule_conv3d_transpose_nchw_cuda", [1, 192, 10, 10, 10], [192, 192, 3, 3, 3], [1, 1, 1], [1, 1, 1], [0, 0, 0], "float32"], {"i": 347986360, "t": "", "c": null, "e": [["tile_f", "sp", [-1, 2, 4, 6]], ["tile_d", "sp", [-1, 1, 1, 2]], ["tile_y", "sp", [-1, 1, 1, 2]], ["tile_x", "sp", [-1, 2, 1, 5]], ["tile_rc", "sp", [-1, 1]], ["tile_rd", "sp", [-1, 1]], ["tile_ry", "sp", [-1, 3]], ["tile_rx", "sp", [-1, 1]], ["auto_unroll_max_step", "ot", 1500], ["unroll_explicit", "ot", 0]]}], "r": [[0.09209040275], 0, 3.6989781856536865, 1576306743.0075145], "v": 0.1}
{"i": ["cuda", "schedule_conv3d_transpose_nchw_cuda", [[1, 192, 10, 10, 10], [192, 192, 3, 3, 3], [1, 1, 1], [1, 1, 1], [0, 0, 0], "float32"], {}, ["schedule_conv3d_transpose_nchw_cuda", [1, 192, 10, 10, 10], [192, 192, 3, 3, 3], [1, 1, 1], [1, 1, 1], [0, 0, 0], "float32"], {"i": 347897320, "t": "", "c": null, "e": [["tile_f", "sp", [-1, 2, 4, 6]], ["tile_d", "sp", [-1, 1, 1, 1]], ["tile_y", "sp", [-1, 1, 1, 2]], ["tile_x", "sp", [-1, 1, 1, 5]], ["tile_rc", "sp", [-1, 1]], ["tile_rd", "sp", [-1, 1]], ["tile_ry", "sp", [-1, 3]], ["tile_rx", "sp", [-1, 1]], ["auto_unroll_max_step", "ot", 1500], ["unroll_explicit", "ot", 0]]}], "r": [[0.004503980826086956], 0, 2.0079281330108643, 1576306747.1643198], "v": 0.1}
{"i": ["cuda", "schedule_conv3d_transpose_nchw_cuda", [[1, 192, 10, 10, 10], [192, 192, 3, 3, 3], [1, 1, 1], [1, 1, 1], [0, 0, 0], "float32"], {}, ["schedule_conv3d_transpose_nchw_cuda", [1, 192, 10, 10, 10], [192, 192, 3, 3, 3], [1, 1, 1], [1, 1, 1], [0, 0, 0], "float32"], {"i": 655318508, "t": "", "c": null, "e": [["tile_f", "sp", [-1, 2, 8, 6]], ["tile_d", "sp", [-1, 1, 1, 1]], ["tile_y", "sp", [-1, 1, 1, 2]], ["tile_x", "sp", [-1, 5, 1, 1]], ["tile_rc", "sp", [-1, 1]], ["tile_rd", "sp", [-1, 1]], ["tile_ry", "sp", [-1, 3]], ["tile_rx", "sp", [-1, 1]], ["auto_unroll_max_step", "ot", 512], ["unroll_explicit", "ot", 1]]}], "r": [[0.002775084172413793], 0, 2.606840133666992, 1576306748.3921247], "v": 0.1}
{"i": ["cuda", "schedule_conv3d_transpose_nchw_cuda", [[1, 192, 10, 10, 10], [192, 192, 3, 3, 3], [1, 1, 1], [1, 1, 1], [0, 0, 0], "float32"], {}, ["schedule_conv3d_transpose_nchw_cuda", [1, 192, 10, 10, 10], [192, 192, 3, 3, 3], [1, 1, 1], [1, 1, 1], [0, 0, 0], "float32"], {"i": 346991804, "t": "", "c": null, "e": [["tile_f", "sp", [-1, 2, 8, 6]], ["tile_d", "sp", [-1, 1, 1, 2]], ["tile_y", "sp", [-1, 1, 1, 1]], ["tile_x", "sp", [-1, 5, 1, 1]], ["tile_rc", "sp", [-1, 1]], ["tile_rd", "sp", [-1, 1]], ["tile_ry", "sp", [-1, 3]], ["tile_rx", "sp", [-1, 1]], ["auto_unroll_max_step", "ot", 1500], ["unroll_explicit", "ot", 0]]}], "r": [[0.0032544792258064515], 0, 2.190835952758789, 1576306749.4721878], "v": 0.1}
{"i": ["cuda", "schedule_conv3d_transpose_nchw_cuda", [[1, 192, 10, 10, 10], [192, 192, 3, 3, 3], [1, 1, 1], [1, 1, 1], [0, 0, 0], "float32"], {}, ["schedule_conv3d_transpose_nchw_cuda", [1, 192, 10, 10, 10], [192, 192, 3, 3, 3], [1, 1, 1], [1, 1, 1], [0, 0, 0], "float32"], {"i": 347682284, "t": "", "c": null, "e": [["tile_f", "sp", [-1, 2, 8, 6]], ["tile_d", "sp", [-1, 1, 1, 1]], ["tile_y", "sp", [-1, 2, 1, 1]], ["tile_x", "sp", [-1, 5, 1, 2]], ["tile_rc", "sp", [-1, 1]], ["tile_rd", "sp", [-1, 1]], ["tile_ry", "sp", [-1, 3]], ["tile_rx", "sp", [-1, 1]], ["auto_unroll_max_step", "ot", 1500], ["unroll_explicit", "ot", 0]]}], "r": [[0.0105790948], 0, 2.48034930229187, 1576306750.7553918], "v": 0.1}
{"i": ["cuda", "schedule_conv3d_transpose_nchw_cuda", [[1, 192, 10, 10, 10], [192, 192, 3, 3, 3], [1, 1, 1], [1, 1, 1], [0, 0, 0], "float32"], {}, ["schedule_conv3d_transpose_nchw_cuda", [1, 192, 10, 10, 10], [192, 192, 3, 3, 3], [1, 1, 1], [1, 1, 1], [0, 0, 0], "float32"], {"i": 656388664, "t": "", "c": null, "e": [["tile_f", "sp", [-1, 2, 4, 6]], ["tile_d", "sp", [-1, 2, 1, 1]], ["tile_y", "sp", [-1, 1, 1, 1]], ["tile_x", "sp", [-1, 1, 1, 10]], ["tile_rc", "sp", [-1, 1]], ["tile_rd", "sp", [-1, 1]], ["tile_ry", "sp", [-1, 3]], ["tile_rx", "sp", [-1, 1]], ["auto_unroll_max_step", "ot", 512], ["unroll_explicit", "ot", 1]]}], "r": [[0.04871116875], 0, 3.214677333831787, 1576306752.3939097], "v": 0.1}
{"i": ["cuda", "schedule_conv3d_transpose_nchw_cuda", [[1, 192, 10, 10, 10], [192, 192, 3, 3, 3], [1, 1, 1], [1, 1, 1], [0, 0, 0], "float32"], {}, ["schedule_conv3d_transpose_nchw_cuda", [1, 192, 10, 10, 10], [192, 192, 3, 3, 3], [1, 1, 1], [1, 1, 1], [0, 0, 0], "float32"], {"i": 347897656, "t": "", "c": null, "e": [["tile_f", "sp", [-1, 2, 4, 6]], ["tile_d", "sp", [-1, 2, 1, 1]], ["tile_y", "sp", [-1, 1, 1, 2]], ["tile_x", "sp", [-1, 1, 1, 5]], ["tile_rc", "sp", [-1, 1]], ["tile_rd", "sp", [-1, 1]], ["tile_ry", "sp", [-1, 3]], ["tile_rx", "sp", [-1, 1]], ["auto_unroll_max_step", "ot", 1500], ["unroll_explicit", "ot", 0]]}], "r": [[0.0331298965], 0, 2.6496195793151855, 1576306753.7972448], "v": 0.1}
{"i": ["cuda", "schedule_conv3d_transpose_nchw_cuda", [[1, 192, 10, 10, 10], [192, 192, 3, 3, 3], [1, 1, 1], [1, 1, 1], [0, 0, 0], "float32"], {}, ["schedule_conv3d_transpose_nchw_cuda", [1, 192, 10, 10, 10], [192, 192, 3, 3, 3], [1, 1, 1], [1, 1, 1], [0, 0, 0], "float32"], {"i": 656437048, "t": "", "c": null, "e": [["tile_f", "sp", [-1, 2, 4, 6]], ["tile_d", "sp", [-1, 2, 1, 1]], ["tile_y", "sp", [-1, 1, 1, 2]], ["tile_x", "sp", [-1, 1, 1, 10]], ["tile_rc", "sp", [-1, 1]], ["tile_rd", "sp", [-1, 1]], ["tile_ry", "sp", [-1, 3]], ["tile_rx", "sp", [-1, 1]], ["auto_unroll_max_step", "ot", 512], ["unroll_explicit", "ot", 1]]}], "r": [[0.09239043775], 0, 4.578013896942139, 1576306756.0006378], "v": 0.1}
{"i": ["cuda", "schedule_conv3d_transpose_nchw_cuda", [[1, 192, 10, 10, 10], [192, 192, 3, 3, 3], [1, 1, 1], [1, 1, 1], [0, 0, 0], "float32"], {}, ["schedule_conv3d_transpose_nchw_cuda", [1, 192, 10, 10, 10], [192, 192, 3, 3, 3], [1, 1, 1], [1, 1, 1], [0, 0, 0], "float32"], {"i": 809459512, "t": "", "c": null, "e": [["tile_f", "sp", [-1, 2, 4, 6]], ["tile_d", "sp", [-1, 2, 1, 1]], ["tile_y", "sp", [-1, 1, 1, 2]], ["tile_x", "sp", [-1, 5, 1, 1]], ["tile_rc", "sp", [-1, 1]], ["tile_rd", "sp", [-1, 1]], ["tile_ry", "sp", [-1, 3]], ["tile_rx", "sp", [-1, 1]], ["auto_unroll_max_step", "ot", 1500], ["unroll_explicit", "ot", 1]]}], "r": [[0.038443184], 0, 3.392066478729248, 1576306757.4677515], "v": 0.1}
{"i": ["cuda", "schedule_conv3d_transpose_nchw_cuda", [[1, 192, 10, 10, 10], [192, 192, 3, 3, 3], [1, 1, 1], [1, 1, 1], [0, 0, 0], "float32"], {}, ["schedule_conv3d_transpose_nchw_cuda", [1, 192, 10, 10, 10], [192, 192, 3, 3, 3], [1, 1, 1], [1, 1, 1], [0, 0, 0], "float32"], {"i": 656324152, "t": "", "c": null, "e": [["tile_f", "sp", [-1, 2, 4, 6]], ["tile_d", "sp", [-1, 2, 1, 1]], ["tile_y", "sp", [-1, 1, 2, 1]], ["tile_x", "sp", [-1, 1, 2, 5]], ["tile_rc", "sp", [-1, 1]], ["tile_rd", "sp", [-1, 1]], ["tile_ry", "sp", [-1, 3]], ["tile_rx", "sp", [-1, 1]], ["auto_unroll_max_step", "ot", 512], ["unroll_explicit", "ot", 1]]}], "r": [[0.0019400276730769232], 0, 2.3639161586761475, 1576306758.4517875], "v": 0.1}
{"i": ["cuda", "schedule_conv3d_transpose_nchw_cuda", [[1, 192, 10, 10, 10], [192, 192, 3, 3, 3], [1, 1, 1], [1, 1, 1], [0, 0, 0], "float32"], {}, ["schedule_conv3d_transpose_nchw_cuda", [1, 192, 10, 10, 10], [192, 192, 3, 3, 3], [1, 1, 1], [1, 1, 1], [0, 0, 0], "float32"], {"i": 347851964, "t": "", "c": null, "e": [["tile_f", "sp", [-1, 2, 8, 6]], ["tile_d", "sp", [-1, 1, 1, 2]], ["tile_y", "sp", [-1, 1, 1, 1]], ["tile_x", "sp", [-1, 1, 1, 5]], ["tile_rc", "sp", [-1, 1]], ["tile_rd", "sp", [-1, 1]], ["tile_ry", "sp", [-1, 3]], ["tile_rx", "sp", [-1, 1]], ["auto_unroll_max_step", "ot", 1500], ["unroll_explicit", "ot", 0]]}], "r": [[0.0032682074193548386], 0, 2.305527687072754, 1576306759.5252094], "v": 0.1}
{"i": ["cuda", "schedule_conv3d_transpose_nchw_cuda", [[1, 192, 10, 10, 10], [192, 192, 3, 3, 3], [1, 1, 1], [1, 1, 1], [0, 0, 0], "float32"], {}, ["schedule_conv3d_transpose_nchw_cuda", [1, 192, 10, 10, 10], [192, 192, 3, 3, 3], [1, 1, 1], [1, 1, 1], [0, 0, 0], "float32"], {"i": 810550840, "t": "", "c": null, "e": [["tile_f", "sp", [-1, 2, 4, 6]], ["tile_d", "sp", [-1, 2, 1, 1]], ["tile_y", "sp", [-1, 1, 2, 1]], ["tile_x", "sp", [-1, 1, 1, 10]], ["tile_rc", "sp", [-1, 1]], ["tile_rd", "sp", [-1, 1]], ["tile_ry", "sp", [-1, 3]], ["tile_rx", "sp", [-1, 1]], ["auto_unroll_max_step", "ot", 1500], ["unroll_explicit", "ot", 1]]}], "r": [[0.013136708375], 0, 3.267845630645752, 1576306760.8768735], "v": 0.1}
{"i": ["cuda", "schedule_conv3d_transpose_nchw_cuda", [[1, 192, 10, 10, 10], [192, 192, 3, 3, 3], [1, 1, 1], [1, 1, 1], [0, 0, 0], "float32"], {}, ["schedule_conv3d_transpose_nchw_cuda", [1, 192, 10, 10, 10], [192, 192, 3, 3, 3], [1, 1, 1], [1, 1, 1], [0, 0, 0], "float32"], {"i": 656410168, "t": "", "c": null, "e": [["tile_f", "sp", [-1, 2, 4, 6]], ["tile_d", "sp", [-1, 2, 1, 1]], ["tile_y", "sp", [-1, 1, 2, 1]], ["tile_x", "sp", [-1, 1, 1, 10]], ["tile_rc", "sp", [-1, 1]], ["tile_rd", "sp", [-1, 1]], ["tile_ry", "sp", [-1, 3]], ["tile_rx", "sp", [-1, 1]], ["auto_unroll_max_step", "ot", 512], ["unroll_explicit", "ot", 1]]}], "r": [[0.0046952758636363634], 0, 2.346719264984131, 1576306761.7911897], "v": 0.1}
{"i": ["cuda", "schedule_conv3d_transpose_nchw_cuda", [[1, 192, 10, 10, 10], [192, 192, 3, 3, 3], [1, 1, 1], [1, 1, 1], [0, 0, 0], "float32"], {}, ["schedule_conv3d_transpose_nchw_cuda", [1, 192, 10, 10, 10], [192, 192, 3, 3, 3], [1, 1, 1], [1, 1, 1], [0, 0, 0], "float32"], {"i": 656135660, "t": "", "c": null, "e": [["tile_f", "sp", [-1, 2, 8, 6]], ["tile_d", "sp", [-1, 1, 1, 1]], ["tile_y", "sp", [-1, 2, 1, 1]], ["tile_x", "sp", [-1, 1, 1, 5]], ["tile_rc", "sp", [-1, 1]], ["tile_rd", "sp", [-1, 1]], ["tile_ry", "sp", [-1, 3]], ["tile_rx", "sp", [-1, 1]], ["auto_unroll_max_step", "ot", 512], ["unroll_explicit", "ot", 1]]}], "r": [[0.0027767459310344828], 0, 2.3021504878997803, 1576306767.4191415], "v": 0.1}
{"i": ["cuda", "schedule_conv3d_transpose_nchw_cuda", [[1, 192, 10, 10, 10], [192, 192, 3, 3, 3], [1, 1, 1], [1, 1, 1], [0, 0, 0], "float32"], {}, ["schedule_conv3d_transpose_nchw_cuda", [1, 192, 10, 10, 10], [192, 192, 3, 3, 3], [1, 1, 1], [1, 1, 1], [0, 0, 0], "float32"], {"i": 656006636, "t": "", "c": null, "e": [["tile_f", "sp", [-1, 2, 8, 6]], ["tile_d", "sp", [-1, 1, 1, 1]], ["tile_y", "sp", [-1, 1, 1, 2]], ["tile_x", "sp", [-1, 5, 1, 2]], ["tile_rc", "sp", [-1, 1]], ["tile_rd", "sp", [-1, 1]], ["tile_ry", "sp", [-1, 3]], ["tile_rx", "sp", [-1, 1]], ["auto_unroll_max_step", "ot", 512], ["unroll_explicit", "ot", 1]]}], "r": [[0.011668695], 0, 2.6034977436065674, 1576306768.6665945], "v": 0.1}
{"i": ["cuda", "schedule_conv3d_transpose_nchw_cuda", [[1, 192, 10, 10, 10], [192, 192, 3, 3, 3], [1, 1, 1], [1, 1, 1], [0, 0, 0], "float32"], {}, ["schedule_conv3d_transpose_nchw_cuda", [1, 192, 10, 10, 10], [192, 192, 3, 3, 3], [1, 1, 1], [1, 1, 1], [0, 0, 0], "float32"], {"i": 810319336, "t": "", "c": null, "e": [["tile_f", "sp", [-1, 2, 4, 6]], ["tile_d", "sp", [-1, 1, 1, 1]], ["tile_y", "sp", [-1, 1, 1, 2]], ["tile_x", "sp", [-1, 1, 1, 5]], ["tile_rc", "sp", [-1, 1]], ["tile_rd", "sp", [-1, 1]], ["tile_ry", "sp", [-1, 3]], ["tile_rx", "sp", [-1, 1]], ["auto_unroll_max_step", "ot", 1500], ["unroll_explicit", "ot", 1]]}], "r": [[0.00426278975], 0, 3.4253082275390625, 1576306769.7494466], "v": 0.1}
{"i": ["cuda", "schedule_conv3d_transpose_nchw_cuda", [[1, 192, 10, 10, 10], [192, 192, 3, 3, 3], [1, 1, 1], [1, 1, 1], [0, 0, 0], "float32"], {}, ["schedule_conv3d_transpose_nchw_cuda", [1, 192, 10, 10, 10], [192, 192, 3, 3, 3], [1, 1, 1], [1, 1, 1], [0, 0, 0], "float32"], {"i": 348112696, "t": "", "c": null, "e": [["tile_f", "sp", [-1, 2, 4, 6]], ["tile_d", "sp", [-1, 2, 1, 1]], ["tile_y", "sp", [-1, 2, 1, 1]], ["tile_x", "sp", [-1, 1, 1, 10]], ["tile_rc", "sp", [-1, 1]], ["tile_rd", "sp", [-1, 1]], ["tile_ry", "sp", [-1, 3]], ["tile_rx", "sp", [-1, 1]], ["auto_unroll_max_step", "ot", 1500], ["unroll_explicit", "ot", 0]]}], "r": [[0.09105962275], 0, 4.186798334121704, 1576306772.0266948], "v": 0.1}
{"i": ["cuda", "schedule_conv3d_transpose_nchw_cuda", [[1, 192, 10, 10, 10], [192, 192, 3, 3, 3], [1, 1, 1], [1, 1, 1], [0, 0, 0], "float32"], {}, ["schedule_conv3d_transpose_nchw_cuda", [1, 192, 10, 10, 10], [192, 192, 3, 3, 3], [1, 1, 1], [1, 1, 1], [0, 0, 0], "float32"], {"i": 656221676, "t": "", "c": null, "e": [["tile_f", "sp", [-1, 2, 8, 6]], ["tile_d", "sp", [-1, 1, 1, 1]], ["tile_y", "sp", [-1, 2, 1, 1]], ["tile_x", "sp", [-1, 2, 1, 5]], ["tile_rc", "sp", [-1, 1]], ["tile_rd", "sp", [-1, 1]], ["tile_ry", "sp", [-1, 3]], ["tile_rx", "sp", [-1, 1]], ["auto_unroll_max_step", "ot", 512], ["unroll_explicit", "ot", 1]]}], "r": [[0.0111026426], 0, 2.749354362487793, 1576306773.3092933], "v": 0.1}
{"i": ["cuda", "schedule_conv3d_transpose_nchw_cuda", [[1, 192, 10, 10, 10], [192, 192, 3, 3, 3], [1, 1, 1], [1, 1, 1], [0, 0, 0], "float32"], {}, ["schedule_conv3d_transpose_nchw_cuda", [1, 192, 10, 10, 10], [192, 192, 3, 3, 3], [1, 1, 1], [1, 1, 1], [0, 0, 0], "float32"], {"i": 347943352, "t": "", "c": null, "e": [["tile_f", "sp", [-1, 2, 4, 6]], ["tile_d", "sp", [-1, 1, 1, 2]], ["tile_y", "sp", [-1, 2, 1, 1]], ["tile_x", "sp", [-1, 2, 1, 5]], ["tile_rc", "sp", [-1, 1]], ["tile_rd", "sp", [-1, 1]], ["tile_ry", "sp", [-1, 3]], ["tile_rx", "sp", [-1, 1]], ["auto_unroll_max_step", "ot", 1500], ["unroll_explicit", "ot", 0]]}], "r": [[0.0910780675], 0, 4.187903165817261, 1576306775.5914843], "v": 0.1}
{"i": ["cuda", "schedule_conv3d_transpose_nchw_cuda", [[1, 192, 10, 10, 10], [192, 192, 3, 3, 3], [1, 1, 1], [1, 1, 1], [0, 0, 0], "float32"], {}, ["schedule_conv3d_transpose_nchw_cuda", [1, 192, 10, 10, 10], [192, 192, 3, 3, 3], [1, 1, 1], [1, 1, 1], [0, 0, 0], "float32"], {"i": 348128824, "t": "", "c": null, "e": [["tile_f", "sp", [-1, 2, 4, 6]], ["tile_d", "sp", [-1, 2, 1, 1]], ["tile_y", "sp", [-1, 1, 2, 1]], ["tile_x", "sp", [-1, 1, 1, 10]], ["tile_rc", "sp", [-1, 1]], ["tile_rd", "sp", [-1, 1]], ["tile_ry", "sp", [-1, 3]], ["tile_rx", "sp", [-1, 1]], ["auto_unroll_max_step", "ot", 1500], ["unroll_explicit", "ot", 0]]}], "r": [[0.016497182571428574], 0, 2.5283148288726807, 1576306776.959632], "v": 0.1}
{"i": ["cuda", "schedule_conv3d_transpose_nchw_cuda", [[1, 192, 10, 10, 10], [192, 192, 3, 3, 3], [1, 1, 1], [1, 1, 1], [0, 0, 0], "float32"], {}, ["schedule_conv3d_transpose_nchw_cuda", [1, 192, 10, 10, 10], [192, 192, 3, 3, 3], [1, 1, 1], [1, 1, 1], [0, 0, 0], "float32"], {"i": 348069688, "t": "", "c": null, "e": [["tile_f", "sp", [-1, 2, 4, 6]], ["tile_d", "sp", [-1, 2, 1, 1]], ["tile_y", "sp", [-1, 1, 1, 2]], ["tile_x", "sp", [-1, 1, 2, 5]], ["tile_rc", "sp", [-1, 1]], ["tile_rd", "sp", [-1, 1]], ["tile_ry", "sp", [-1, 3]], ["tile_rx", "sp", [-1, 1]], ["auto_unroll_max_step", "ot", 1500], ["unroll_explicit", "ot", 0]]}], "r": [[0.0107756839], 0, 2.521953582763672, 1576306778.2811568], "v": 0.1}
{"i": ["cuda", "schedule_conv3d_transpose_nchw_cuda", [[1, 192, 10, 10, 10], [192, 192, 3, 3, 3], [1, 1, 1], [1, 1, 1], [0, 0, 0], "float32"], {}, ["schedule_conv3d_transpose_nchw_cuda", [1, 192, 10, 10, 10], [192, 192, 3, 3, 3], [1, 1, 1], [1, 1, 1], [0, 0, 0], "float32"], {"i": 810405688, "t": "", "c": null, "e": [["tile_f", "sp", [-1, 2, 4, 6]], ["tile_d", "sp", [-1, 2, 1, 1]], ["tile_y", "sp", [-1, 1, 1, 2]], ["tile_x", "sp", [-1, 2, 1, 5]], ["tile_rc", "sp", [-1, 1]], ["tile_rd", "sp", [-1, 1]], ["tile_ry", "sp", [-1, 3]], ["tile_rx", "sp", [-1, 1]], ["auto_unroll_max_step", "ot", 1500], ["unroll_explicit", "ot", 1]]}], "r": [[0.0881323815], 0, 6.023305654525757, 1576306780.522992], "v": 0.1}
{"i": ["cuda", "schedule_conv3d_transpose_nchw_cuda", [[1, 192, 10, 10, 10], [192, 192, 3, 3, 3], [1, 1, 1], [1, 1, 1], [0, 0, 0], "float32"], {}, ["schedule_conv3d_transpose_nchw_cuda", [1, 192, 10, 10, 10], [192, 192, 3, 3, 3], [1, 1, 1], [1, 1, 1], [0, 0, 0], "float32"], {"i": 347725292, "t": "", "c": null, "e": [["tile_f", "sp", [-1, 2, 8, 6]], ["tile_d", "sp", [-1, 1, 1, 1]], ["tile_y", "sp", [-1, 1, 1, 2]], ["tile_x", "sp", [-1, 5, 1, 2]], ["tile_rc", "sp", [-1, 1]], ["tile_rd", "sp", [-1, 1]], ["tile_ry", "sp", [-1, 3]], ["tile_rx", "sp", [-1, 1]], ["auto_unroll_max_step", "ot", 1500], ["unroll_explicit", "ot", 0]]}], "r": [[0.0109589627], 0, 2.439375400543213, 1576306781.8169537], "v": 0.1}
{"i": ["cuda", "schedule_conv3d_transpose_nchw_cuda", [[1, 192, 10, 10, 10], [192, 192, 3, 3, 3], [1, 1, 1], [1, 1, 1], [0, 0, 0], "float32"], {}, ["schedule_conv3d_transpose_nchw_cuda", [1, 192, 10, 10, 10], [192, 192, 3, 3, 3], [1, 1, 1], [1, 1, 1], [0, 0, 0], "float32"], {"i": 347983672, "t": "", "c": null, "e": [["tile_f", "sp", [-1, 2, 4, 6]], ["tile_d", "sp", [-1, 2, 1, 1]], ["tile_y", "sp", [-1, 1, 1, 2]], ["tile_x", "sp", [-1, 2, 1, 5]], ["tile_rc", "sp", [-1, 1]], ["tile_rd", "sp", [-1, 1]], ["tile_ry", "sp", [-1, 3]], ["tile_rx", "sp", [-1, 1]], ["auto_unroll_max_step", "ot", 1500], ["unroll_explicit", "ot", 0]]}], "r": [[0.10152656], 0, 4.110972166061401, 1576306784.2308311], "v": 0.1}
{"i": ["cuda", "schedule_conv3d_transpose_nchw_cuda", [[1, 192, 10, 10, 10], [192, 192, 3, 3, 3], [1, 1, 1], [1, 1, 1], [0, 0, 0], "float32"], {}, ["schedule_conv3d_transpose_nchw_cuda", [1, 192, 10, 10, 10], [192, 192, 3, 3, 3], [1, 1, 1], [1, 1, 1], [0, 0, 0], "float32"], {"i": 656179000, "t": "", "c": null, "e": [["tile_f", "sp", [-1, 2, 4, 6]], ["tile_d", "sp", [-1, 2, 1, 1]], ["tile_y", "sp", [-1, 1, 1, 2]], ["tile_x", "sp", [-1, 1, 1, 5]], ["tile_rc", "sp", [-1, 1]], ["tile_rd", "sp", [-1, 1]], ["tile_ry", "sp", [-1, 3]], ["tile_rx", "sp", [-1, 1]], ["auto_unroll_max_step", "ot", 512], ["unroll_explicit", "ot", 1]]}], "r": [[0.037904324], 0, 2.9249489307403564, 1576306785.649129], "v": 0.1}
{"i": ["cuda", "schedule_conv3d_transpose_nchw_cuda", [[1, 192, 10, 10, 10], [192, 192, 3, 3, 3], [1, 1, 1], [1, 1, 1], [0, 0, 0], "float32"], {}, ["schedule_conv3d_transpose_nchw_cuda", [1, 192, 10, 10, 10], [192, 192, 3, 3, 3], [1, 1, 1], [1, 1, 1], [0, 0, 0], "float32"], {"i": 348106984, "t": "", "c": null, "e": [["tile_f", "sp", [-1, 2, 4, 6]], ["tile_d", "sp", [-1, 1, 1, 1]], ["tile_y", "sp", [-1, 1, 1, 1]], ["tile_x", "sp", [-1, 1, 1, 10]], ["tile_rc", "sp", [-1, 1]], ["tile_rd", "sp", [-1, 1]], ["tile_ry", "sp", [-1, 3]], ["tile_rx", "sp", [-1, 1]], ["auto_unroll_max_step", "ot", 1500], ["unroll_explicit", "ot", 0]]}], "r": [[0.006329856428571428], 0, 2.516615867614746, 1576306791.5641236], "v": 0.1}
{"i": ["cuda", "schedule_conv3d_transpose_nchw_cuda", [[1, 192, 10, 10, 10], [192, 192, 3, 3, 3], [1, 1, 1], [1, 1, 1], [0, 0, 0], "float32"], {}, ["schedule_conv3d_transpose_nchw_cuda", [1, 192, 10, 10, 10], [192, 192, 3, 3, 3], [1, 1, 1], [1, 1, 1], [0, 0, 0], "float32"], {"i": 656409832, "t": "", "c": null, "e": [["tile_f", "sp", [-1, 2, 4, 6]], ["tile_d", "sp", [-1, 1, 1, 1]], ["tile_y", "sp", [-1, 1, 2, 1]], ["tile_x", "sp", [-1, 1, 1, 10]], ["tile_rc", "sp", [-1, 1]], ["tile_rd", "sp", [-1, 1]], ["tile_ry", "sp", [-1, 3]], ["tile_rx", "sp", [-1, 1]], ["auto_unroll_max_step", "ot", 512], ["unroll_explicit", "ot", 1]]}], "r": [[0.0037311937037037037], 0, 2.422353982925415, 1576306792.717035], "v": 0.1}
{"i": ["cuda", "schedule_conv3d_transpose_nchw_cuda", [[1, 192, 10, 10, 10], [192, 192, 3, 3, 3], [1, 1, 1], [1, 1, 1], [0, 0, 0], "float32"], {}, ["schedule_conv3d_transpose_nchw_cuda", [1, 192, 10, 10, 10], [192, 192, 3, 3, 3], [1, 1, 1], [1, 1, 1], [0, 0, 0], "float32"], {"i": 348112360, "t": "", "c": null, "e": [["tile_f", "sp", [-1, 2, 4, 6]], ["tile_d", "sp", [-1, 1, 1, 1]], ["tile_y", "sp", [-1, 2, 1, 1]], ["tile_x", "sp", [-1, 1, 1, 10]], ["tile_rc", "sp", [-1, 1]], ["tile_rd", "sp", [-1, 1]], ["tile_ry", "sp", [-1, 3]], ["tile_rx", "sp", [-1, 1]], ["auto_unroll_max_step", "ot", 1500], ["unroll_explicit", "ot", 0]]}], "r": [[0.02705486725], 0, 2.481796979904175, 1576306793.9703689], "v": 0.1}
{"i": ["cuda", "schedule_conv3d_transpose_nchw_cuda", [[1, 192, 10, 10, 10], [192, 192, 3, 3, 3], [1, 1, 1], [1, 1, 1], [0, 0, 0], "float32"], {}, ["schedule_conv3d_transpose_nchw_cuda", [1, 192, 10, 10, 10], [192, 192, 3, 3, 3], [1, 1, 1], [1, 1, 1], [0, 0, 0], "float32"], {"i": 656133308, "t": "", "c": null, "e": [["tile_f", "sp", [-1, 2, 8, 6]], ["tile_d", "sp", [-1, 1, 1, 2]], ["tile_y", "sp", [-1, 1, 1, 1]], ["tile_x", "sp", [-1, 1, 1, 5]], ["tile_rc", "sp", [-1, 1]], ["tile_rd", "sp", [-1, 1]], ["tile_ry", "sp", [-1, 3]], ["tile_rx", "sp", [-1, 1]], ["auto_unroll_max_step", "ot", 512], ["unroll_explicit", "ot", 1]]}], "r": [[0.0032472329677419353], 0, 2.4107160568237305, 1576306794.949954], "v": 0.1}
{"i": ["cuda", "schedule_conv3d_transpose_nchw_cuda", [[1, 192, 10, 10, 10], [192, 192, 3, 3, 3], [1, 1, 1], [1, 1, 1], [0, 0, 0], "float32"], {}, ["schedule_conv3d_transpose_nchw_cuda", [1, 192, 10, 10, 10], [192, 192, 3, 3, 3], [1, 1, 1], [1, 1, 1], [0, 0, 0], "float32"], {"i": 809505208, "t": "", "c": null, "e": [["tile_f", "sp", [-1, 2, 4, 6]], ["tile_d", "sp", [-1, 1, 1, 2]], ["tile_y", "sp", [-1, 2, 1, 1]], ["tile_x", "sp", [-1, 10, 1, 1]], ["tile_rc", "sp", [-1, 1]], ["tile_rd", "sp", [-1, 1]], ["tile_ry", "sp", [-1, 3]], ["tile_rx", "sp", [-1, 1]], ["auto_unroll_max_step", "ot", 1500], ["unroll_explicit", "ot", 1]]}], "r": [[0.08648803825], 0, 6.17144250869751, 1576306797.1748028], "v": 0.1}
{"i": ["cuda", "schedule_conv3d_transpose_nchw_cuda", [[1, 192, 10, 10, 10], [192, 192, 3, 3, 3], [1, 1, 1], [1, 1, 1], [0, 0, 0], "float32"], {}, ["schedule_conv3d_transpose_nchw_cuda", [1, 192, 10, 10, 10], [192, 192, 3, 3, 3], [1, 1, 1], [1, 1, 1], [0, 0, 0], "float32"], {"i": 655273144, "t": "", "c": null, "e": [["tile_f", "sp", [-1, 2, 4, 6]], ["tile_d", "sp", [-1, 1, 1, 2]], ["tile_y", "sp", [-1, 1, 1, 1]], ["tile_x", "sp", [-1, 5, 1, 1]], ["tile_rc", "sp", [-1, 1]], ["tile_rd", "sp", [-1, 1]], ["tile_ry", "sp", [-1, 3]], ["tile_rx", "sp", [-1, 1]], ["auto_unroll_max_step", "ot", 512], ["unroll_explicit", "ot", 1]]}], "r": [[0.007318995285714286], 0, 2.480487585067749, 1576306798.2011275], "v": 0.1}
{"i": ["cuda", "schedule_conv3d_transpose_nchw_cuda", [[1, 192, 10, 10, 10], [192, 192, 3, 3, 3], [1, 1, 1], [1, 1, 1], [0, 0, 0], "float32"], {}, ["schedule_conv3d_transpose_nchw_cuda", [1, 192, 10, 10, 10], [192, 192, 3, 3, 3], [1, 1, 1], [1, 1, 1], [0, 0, 0], "float32"], {"i": 655963628, "t": "", "c": null, "e": [["tile_f", "sp", [-1, 2, 8, 6]], ["tile_d", "sp", [-1, 1, 1, 1]], ["tile_y", "sp", [-1, 2, 1, 1]], ["tile_x", "sp", [-1, 5, 1, 2]], ["tile_rc", "sp", [-1, 1]], ["tile_rd", "sp", [-1, 1]], ["tile_ry", "sp", [-1, 3]], ["tile_rx", "sp", [-1, 1]], ["auto_unroll_max_step", "ot", 512], ["unroll_explicit", "ot", 1]]}], "r": [[0.011504150999999999], 0, 2.8290209770202637, 1576306799.4751687], "v": 0.1}
{"i": ["cuda", "schedule_conv3d_transpose_nchw_cuda", [[1, 192, 10, 10, 10], [192, 192, 3, 3, 3], [1, 1, 1], [1, 1, 1], [0, 0, 0], "float32"], {}, ["schedule_conv3d_transpose_nchw_cuda", [1, 192, 10, 10, 10], [192, 192, 3, 3, 3], [1, 1, 1], [1, 1, 1], [0, 0, 0], "float32"], {"i": 655380664, "t": "", "c": null, "e": [["tile_f", "sp", [-1, 2, 4, 6]], ["tile_d", "sp", [-1, 1, 1, 2]], ["tile_y", "sp", [-1, 1, 2, 1]], ["tile_x", "sp", [-1, 10, 1, 1]], ["tile_rc", "sp", [-1, 1]], ["tile_rd", "sp", [-1, 1]], ["tile_ry", "sp", [-1, 3]], ["tile_rx", "sp", [-1, 1]], ["auto_unroll_max_step", "ot", 512], ["unroll_explicit", "ot", 1]]}], "r": [[0.003963158423076923], 0, 2.5530991554260254, 1576306800.404044], "v": 0.1}
{"i": ["cuda", "schedule_conv3d_transpose_nchw_cuda", [[1, 192, 10, 10, 10], [192, 192, 3, 3, 3], [1, 1, 1], [1, 1, 1], [0, 0, 0], "float32"], {}, ["schedule_conv3d_transpose_nchw_cuda", [1, 192, 10, 10, 10], [192, 192, 3, 3, 3], [1, 1, 1], [1, 1, 1], [0, 0, 0], "float32"], {"i": 810147308, "t": "", "c": null, "e": [["tile_f", "sp", [-1, 2, 8, 6]], ["tile_d", "sp", [-1, 1, 1, 1]], ["tile_y", "sp", [-1, 1, 1, 2]], ["tile_x", "sp", [-1, 5, 1, 2]], ["tile_rc", "sp", [-1, 1]], ["tile_rd", "sp", [-1, 1]], ["tile_ry", "sp", [-1, 3]], ["tile_rx", "sp", [-1, 1]], ["auto_unroll_max_step", "ot", 1500], ["unroll_explicit", "ot", 1]]}], "r": [[0.011881424222222221], 0, 3.165905714035034, 1576306801.7042437], "v": 0.1}
{"i": ["cuda", "schedule_conv3d_transpose_nchw_cuda", [[1, 192, 10, 10, 10], [192, 192, 3, 3, 3], [1, 1, 1], [1, 1, 1], [0, 0, 0], "float32"], {}, ["schedule_conv3d_transpose_nchw_cuda", [1, 192, 10, 10, 10], [192, 192, 3, 3, 3], [1, 1, 1], [1, 1, 1], [0, 0, 0], "float32"], {"i": 810279352, "t": "", "c": null, "e": [["tile_f", "sp", [-1, 2, 4, 6]], ["tile_d", "sp", [-1, 1, 1, 2]], ["tile_y", "sp", [-1, 2, 1, 1]], ["tile_x", "sp", [-1, 1, 1, 5]], ["tile_rc", "sp", [-1, 1]], ["tile_rd", "sp", [-1, 1]], ["tile_ry", "sp", [-1, 3]], ["tile_rx", "sp", [-1, 1]], ["auto_unroll_max_step", "ot", 1500], ["unroll_explicit", "ot", 1]]}], "r": [[0.03759271175], 0, 3.4608380794525146, 1576306803.1604934], "v": 0.1}
{"i": ["cuda", "schedule_conv3d_transpose_nchw_cuda", [[1, 192, 10, 10, 10], [192, 192, 3, 3, 3], [1, 1, 1], [1, 1, 1], [0, 0, 0], "float32"], {}, ["schedule_conv3d_transpose_nchw_cuda", [1, 192, 10, 10, 10], [192, 192, 3, 3, 3], [1, 1, 1], [1, 1, 1], [0, 0, 0], "float32"], {"i": 828683652, "t": "", "c": null, "e": [["tile_f", "sp", [-1, 2, 12, 2]], ["tile_d", "sp", [-1, 1, 1, 1]], ["tile_y", "sp", [-1, 2, 1, 1]], ["tile_x", "sp", [-1, 5, 1, 1]], ["tile_rc", "sp", [-1, 1]], ["tile_rd", "sp", [-1, 3]], ["tile_ry", "sp", [-1, 3]], ["tile_rx", "sp", [-1, 1]], ["auto_unroll_max_step", "ot", 1500], ["unroll_explicit", "ot", 1]]}], "r": [[0.0009189445028901734], 0, 3.484900712966919, 1576306804.4259405], "v": 0.1}
{"i": ["cuda", "schedule_conv3d_transpose_nchw_cuda", [[1, 192, 10, 10, 10], [192, 192, 3, 3, 3], [1, 1, 1], [1, 1, 1], [0, 0, 0], "float32"], {}, ["schedule_conv3d_transpose_nchw_cuda", [1, 192, 10, 10, 10], [192, 192, 3, 3, 3], [1, 1, 1], [1, 1, 1], [0, 0, 0], "float32"], {"i": 810529000, "t": "", "c": null, "e": [["tile_f", "sp", [-1, 2, 4, 6]], ["tile_d", "sp", [-1, 1, 1, 1]], ["tile_y", "sp", [-1, 1, 1, 1]], ["tile_x", "sp", [-1, 1, 1, 10]], ["tile_rc", "sp", [-1, 1]], ["tile_rd", "sp", [-1, 1]], ["tile_ry", "sp", [-1, 3]], ["tile_rx", "sp", [-1, 1]], ["auto_unroll_max_step", "ot", 1500], ["unroll_explicit", "ot", 1]]}], "r": [[0.00487513], 0, 3.4718313217163086, 1576306805.4913137], "v": 0.1}
{"i": ["cuda", "schedule_conv3d_transpose_nchw_cuda", [[1, 192, 10, 10, 10], [192, 192, 3, 3, 3], [1, 1, 1], [1, 1, 1], [0, 0, 0], "float32"], {}, ["schedule_conv3d_transpose_nchw_cuda", [1, 192, 10, 10, 10], [192, 192, 3, 3, 3], [1, 1, 1], [1, 1, 1], [0, 0, 0], "float32"], {"i": 193713574, "t": "", "c": null, "e": [["tile_f", "sp", [-1, 2, 8, 3]], ["tile_d", "sp", [-1, 1, 1, 1]], ["tile_y", "sp", [-1, 2, 1, 1]], ["tile_x", "sp", [-1, 1, 1, 5]], ["tile_rc", "sp", [-1, 1]], ["tile_rd", "sp", [-1, 1]], ["tile_ry", "sp", [-1, 3]], ["tile_rx", "sp", [-1, 1]], ["auto_unroll_max_step", "ot", 512], ["unroll_explicit", "ot", 0]]}], "r": [[0.006076966111111111], 0, 2.1015658378601074, 1576307047.2686586], "v": 0.1}
{"i": ["cuda", "schedule_conv3d_transpose_nchw_cuda", [[1, 192, 10, 10, 10], [192, 192, 3, 3, 3], [1, 1, 1], [1, 1, 1], [0, 0, 0], "float32"], {}, ["schedule_conv3d_transpose_nchw_cuda", [1, 192, 10, 10, 10], [192, 192, 3, 3, 3], [1, 1, 1], [1, 1, 1], [0, 0, 0], "float32"], {"i": 39572902, "t": "", "c": null, "e": [["tile_f", "sp", [-1, 2, 8, 3]], ["tile_d", "sp", [-1, 1, 1, 1]], ["tile_y", "sp", [-1, 2, 1, 1]], ["tile_x", "sp", [-1, 1, 1, 5]], ["tile_rc", "sp", [-1, 1]], ["tile_rd", "sp", [-1, 1]], ["tile_ry", "sp", [-1, 3]], ["tile_rx", "sp", [-1, 1]], ["auto_unroll_max_step", "ot", 0], ["unroll_explicit", "ot", 0]]}], "r": [[0.004004893814814815], 0, 1.9567553997039795, 1576307048.2829893], "v": 0.1}
{"i": ["cuda", "schedule_conv3d_transpose_nchw_cuda", [[1, 192, 10, 10, 10], [192, 192, 3, 3, 3], [1, 1, 1], [1, 1, 1], [0, 0, 0], "float32"], {}, ["schedule_conv3d_transpose_nchw_cuda", [1, 192, 10, 10, 10], [192, 192, 3, 3, 3], [1, 1, 1], [1, 1, 1], [0, 0, 0], "float32"], {"i": 39572971, "t": "", "c": null, "e": [["tile_f", "sp", [-1, 1, 8, 6]], ["tile_d", "sp", [-1, 1, 1, 1]], ["tile_y", "sp", [-1, 2, 1, 1]], ["tile_x", "sp", [-1, 1, 1, 5]], ["tile_rc", "sp", [-1, 1]], ["tile_rd", "sp", [-1, 1]], ["tile_ry", "sp", [-1, 3]], ["tile_rx", "sp", [-1, 1]], ["auto_unroll_max_step", "ot", 0], ["unroll_explicit", "ot", 0]]}], "r": [[0.0022767588666666666], 0, 2.122326374053955, 1576307049.262504], "v": 0.1}
{"i": ["cuda", "schedule_conv3d_transpose_nchw_cuda", [[1, 192, 10, 10, 10], [192, 192, 3, 3, 3], [1, 1, 1], [1, 1, 1], [0, 0, 0], "float32"], {}, ["schedule_conv3d_transpose_nchw_cuda", [1, 192, 10, 10, 10], [192, 192, 3, 3, 3], [1, 1, 1], [1, 1, 1], [0, 0, 0], "float32"], {"i": 20044918, "t": "", "c": null, "e": [["tile_f", "sp", [-1, 2, 8, 3]], ["tile_d", "sp", [-1, 1, 1, 2]], ["tile_y", "sp", [-1, 1, 1, 1]], ["tile_x", "sp", [-1, 1, 1, 2]], ["tile_rc", "sp", [-1, 1]], ["tile_rd", "sp", [-1, 3]], ["tile_ry", "sp", [-1, 1]], ["tile_rx", "sp", [-1, 1]], ["auto_unroll_max_step", "ot", 0], ["unroll_explicit", "ot", 0]]}], "r": [[0.004401322208333333], 0, 1.9393620491027832, 1576307050.168805], "v": 0.1}
{"i": ["cuda", "schedule_conv3d_transpose_nchw_cuda", [[1, 192, 10, 10, 10], [192, 192, 3, 3, 3], [1, 1, 1], [1, 1, 1], [0, 0, 0], "float32"], {}, ["schedule_conv3d_transpose_nchw_cuda", [1, 192, 10, 10, 10], [192, 192, 3, 3, 3], [1, 1, 1], [1, 1, 1], [0, 0, 0], "float32"], {"i": 174185590, "t": "", "c": null, "e": [["tile_f", "sp", [-1, 2, 8, 3]], ["tile_d", "sp", [-1, 1, 1, 2]], ["tile_y", "sp", [-1, 1, 1, 1]], ["tile_x", "sp", [-1, 1, 1, 2]], ["tile_rc", "sp", [-1, 1]], ["tile_rd", "sp", [-1, 3]], ["tile_ry", "sp", [-1, 1]], ["tile_rx", "sp", [-1, 1]], ["auto_unroll_max_step", "ot", 512], ["unroll_explicit", "ot", 0]]}], "r": [[0.003909263769230769], 0, 2.075958251953125, 1576307051.0906503], "v": 0.1}
{"i": ["cuda", "schedule_conv3d_transpose_nchw_cuda", [[1, 192, 10, 10, 10], [192, 192, 3, 3, 3], [1, 1, 1], [1, 1, 1], [0, 0, 0], "float32"], {}, ["schedule_conv3d_transpose_nchw_cuda", [1, 192, 10, 10, 10], [192, 192, 3, 3, 3], [1, 1, 1], [1, 1, 1], [0, 0, 0], "float32"], {"i": 39589096, "t": "", "c": null, "e": [["tile_f", "sp", [-1, 2, 4, 6]], ["tile_d", "sp", [-1, 1, 1, 1]], ["tile_y", "sp", [-1, 1, 2, 1]], ["tile_x", "sp", [-1, 1, 1, 5]], ["tile_rc", "sp", [-1, 1]], ["tile_rd", "sp", [-1, 1]], ["tile_ry", "sp", [-1, 3]], ["tile_rx", "sp", [-1, 1]], ["auto_unroll_max_step", "ot", 0], ["unroll_explicit", "ot", 0]]}], "r": [[0.0022614188666666667], 0, 2.0992658138275146, 1576307052.0537987], "v": 0.1}
{"i": ["cuda", "schedule_conv3d_transpose_nchw_cuda", [[1, 192, 10, 10, 10], [192, 192, 3, 3, 3], [1, 1, 1], [1, 1, 1], [0, 0, 0], "float32"], {}, ["schedule_conv3d_transpose_nchw_cuda", [1, 192, 10, 10, 10], [192, 192, 3, 3, 3], [1, 1, 1], [1, 1, 1], [0, 0, 0], "float32"], {"i": 193729768, "t": "", "c": null, "e": [["tile_f", "sp", [-1, 2, 4, 6]], ["tile_d", "sp", [-1, 1, 1, 1]], ["tile_y", "sp", [-1, 1, 2, 1]], ["tile_x", "sp", [-1, 1, 1, 5]], ["tile_rc", "sp", [-1, 1]], ["tile_rd", "sp", [-1, 1]], ["tile_ry", "sp", [-1, 3]], ["tile_rx", "sp", [-1, 1]], ["auto_unroll_max_step", "ot", 512], ["unroll_explicit", "ot", 0]]}], "r": [[0.004495785702702703], 0, 2.4344472885131836, 1576307053.2448776], "v": 0.1}
{"i": ["cuda", "schedule_conv3d_transpose_nchw_cuda", [[1, 192, 10, 10, 10], [192, 192, 3, 3, 3], [1, 1, 1], [1, 1, 1], [0, 0, 0], "float32"], {}, ["schedule_conv3d_transpose_nchw_cuda", [1, 192, 10, 10, 10], [192, 192, 3, 3, 3], [1, 1, 1], [1, 1, 1], [0, 0, 0], "float32"], {"i": 656135590, "t": "", "c": null, "e": [["tile_f", "sp", [-1, 2, 8, 3]], ["tile_d", "sp", [-1, 1, 1, 1]], ["tile_y", "sp", [-1, 2, 1, 1]], ["tile_x", "sp", [-1, 1, 1, 5]], ["tile_rc", "sp", [-1, 1]], ["tile_rd", "sp", [-1, 1]], ["tile_ry", "sp", [-1, 3]], ["tile_rx", "sp", [-1, 1]], ["auto_unroll_max_step", "ot", 512], ["unroll_explicit", "ot", 1]]}], "r": [[0.005056361206896552], 0, 2.5817222595214844, 1576307054.5423095], "v": 0.1}
{"i": ["cuda", "schedule_conv3d_transpose_nchw_cuda", [[1, 192, 10, 10, 10], [192, 192, 3, 3, 3], [1, 1, 1], [1, 1, 1], [0, 0, 0], "float32"], {}, ["schedule_conv3d_transpose_nchw_cuda", [1, 192, 10, 10, 10], [192, 192, 3, 3, 3], [1, 1, 1], [1, 1, 1], [0, 0, 0], "float32"], {"i": 501994918, "t": "", "c": null, "e": [["tile_f", "sp", [-1, 2, 8, 3]], ["tile_d", "sp", [-1, 1, 1, 1]], ["tile_y", "sp", [-1, 2, 1, 1]], ["tile_x", "sp", [-1, 1, 1, 5]], ["tile_rc", "sp", [-1, 1]], ["tile_rd", "sp", [-1, 1]], ["tile_ry", "sp", [-1, 3]], ["tile_rx", "sp", [-1, 1]], ["auto_unroll_max_step", "ot", 0], ["unroll_explicit", "ot", 1]]}], "r": [[0.00376283], 0, 2.091639518737793, 1576307055.3962264], "v": 0.1}
{"i": ["cuda", "schedule_conv3d_transpose_nchw_cuda", [[1, 192, 10, 10, 10], [192, 192, 3, 3, 3], [1, 1, 1], [1, 1, 1], [0, 0, 0], "float32"], {}, ["schedule_conv3d_transpose_nchw_cuda", [1, 192, 10, 10, 10], [192, 192, 3, 3, 3], [1, 1, 1], [1, 1, 1], [0, 0, 0], "float32"], {"i": 39567493, "t": "", "c": null, "e": [["tile_f", "sp", [-1, 4, 12, 2]], ["tile_d", "sp", [-1, 1, 1, 1]], ["tile_y", "sp", [-1, 1, 1, 1]], ["tile_x", "sp", [-1, 1, 1, 5]], ["tile_rc", "sp", [-1, 1]], ["tile_rd", "sp", [-1, 1]], ["tile_ry", "sp", [-1, 3]], ["tile_rx", "sp", [-1, 1]], ["auto_unroll_max_step", "ot", 0], ["unroll_explicit", "ot", 0]]}], "r": [[0.002703677440677966], 0, 2.382189989089966, 1576307056.5939212], "v": 0.1}
{"i": ["cuda", "schedule_conv3d_transpose_nchw_cuda", [[1, 192, 10, 10, 10], [192, 192, 3, 3, 3], [1, 1, 1], [1, 1, 1], [0, 0, 0], "float32"], {}, ["schedule_conv3d_transpose_nchw_cuda", [1, 192, 10, 10, 10], [192, 192, 3, 3, 3], [1, 1, 1], [1, 1, 1], [0, 0, 0], "float32"], {"i": 193708165, "t": "", "c": null, "e": [["tile_f", "sp", [-1, 4, 12, 2]], ["tile_d", "sp", [-1, 1, 1, 1]], ["tile_y", "sp", [-1, 1, 1, 1]], ["tile_x", "sp", [-1, 1, 1, 5]], ["tile_rc", "sp", [-1, 1]], ["tile_rd", "sp", [-1, 1]], ["tile_ry", "sp", [-1, 3]], ["tile_rx", "sp", [-1, 1]], ["auto_unroll_max_step", "ot", 512], ["unroll_explicit", "ot", 0]]}], "r": [[0.0027141984054054056], 0, 2.1129205226898193, 1576307057.5754719], "v": 0.1}
{"i": ["cuda", "schedule_conv3d_transpose_nchw_cuda", [[1, 192, 10, 10, 10], [192, 192, 3, 3, 3], [1, 1, 1], [1, 1, 1], [0, 0, 0], "float32"], {}, ["schedule_conv3d_transpose_nchw_cuda", [1, 192, 10, 10, 10], [192, 192, 3, 3, 3], [1, 1, 1], [1, 1, 1], [0, 0, 0], "float32"], {"i": 39572868, "t": "", "c": null, "e": [["tile_f", "sp", [-1, 2, 12, 2]], ["tile_d", "sp", [-1, 1, 1, 1]], ["tile_y", "sp", [-1, 2, 1, 1]], ["tile_x", "sp", [-1, 1, 1, 5]], ["tile_rc", "sp", [-1, 1]], ["tile_rd", "sp", [-1, 1]], ["tile_ry", "sp", [-1, 3]], ["tile_rx", "sp", [-1, 1]], ["auto_unroll_max_step", "ot", 0], ["unroll_explicit", "ot", 0]]}], "r": [[0.0019874084464285716], 0, 1.9306645393371582, 1576307058.5280633], "v": 0.1}
{"i": ["cuda", "schedule_conv3d_transpose_nchw_cuda", [[1, 192, 10, 10, 10], [192, 192, 3, 3, 3], [1, 1, 1], [1, 1, 1], [0, 0, 0], "float32"], {}, ["schedule_conv3d_transpose_nchw_cuda", [1, 192, 10, 10, 10], [192, 192, 3, 3, 3], [1, 1, 1], [1, 1, 1], [0, 0, 0], "float32"], {"i": 39567530, "t": "", "c": null, "e": [["tile_f", "sp", [-1, 2, 16, 3]], ["tile_d", "sp", [-1, 1, 1, 1]], ["tile_y", "sp", [-1, 1, 1, 1]], ["tile_x", "sp", [-1, 1, 1, 5]], ["tile_rc", "sp", [-1, 1]], ["tile_rd", "sp", [-1, 1]], ["tile_ry", "sp", [-1, 3]], ["tile_rx", "sp", [-1, 1]], ["auto_unroll_max_step", "ot", 0], ["unroll_explicit", "ot", 0]]}], "r": [[0.002691952789473684], 0, 1.6050400733947754, 1576307061.5752895], "v": 0.1}
{"i": ["cuda", "schedule_conv3d_transpose_nchw_cuda", [[1, 192, 10, 10, 10], [192, 192, 3, 3, 3], [1, 1, 1], [1, 1, 1], [0, 0, 0], "float32"], {}, ["schedule_conv3d_transpose_nchw_cuda", [1, 192, 10, 10, 10], [192, 192, 3, 3, 3], [1, 1, 1], [1, 1, 1], [0, 0, 0], "float32"], {"i": 193708202, "t": "", "c": null, "e": [["tile_f", "sp", [-1, 2, 16, 3]], ["tile_d", "sp", [-1, 1, 1, 1]], ["tile_y", "sp", [-1, 1, 1, 1]], ["tile_x", "sp", [-1, 1, 1, 5]], ["tile_rc", "sp", [-1, 1]], ["tile_rd", "sp", [-1, 1]], ["tile_ry", "sp", [-1, 3]], ["tile_rx", "sp", [-1, 1]], ["auto_unroll_max_step", "ot", 512], ["unroll_explicit", "ot", 0]]}], "r": [[0.0026559652368421055], 0, 1.7204790115356445, 1576307062.4877658], "v": 0.1}
{"i": ["cuda", "schedule_conv3d_transpose_nchw_cuda", [[1, 192, 10, 10, 10], [192, 192, 3, 3, 3], [1, 1, 1], [1, 1, 1], [0, 0, 0], "float32"], {}, ["schedule_conv3d_transpose_nchw_cuda", [1, 192, 10, 10, 10], [192, 192, 3, 3, 3], [1, 1, 1], [1, 1, 1], [0, 0, 0], "float32"], {"i": 174440916, "t": "", "c": null, "e": [["tile_f", "sp", [-1, 2, 12, 2]], ["tile_d", "sp", [-1, 2, 1, 1]], ["tile_y", "sp", [-1, 1, 1, 1]], ["tile_x", "sp", [-1, 1, 1, 5]], ["tile_rc", "sp", [-1, 1]], ["tile_rd", "sp", [-1, 3]], ["tile_ry", "sp", [-1, 1]], ["tile_rx", "sp", [-1, 1]], ["auto_unroll_max_step", "ot", 512], ["unroll_explicit", "ot", 0]]}], "r": [[0.002485475780487805], 0, 1.8789100646972656, 1576307063.4483287], "v": 0.1}
{"i": ["cuda", "schedule_conv3d_transpose_nchw_cuda", [[1, 192, 10, 10, 10], [192, 192, 3, 3, 3], [1, 1, 1], [1, 1, 1], [0, 0, 0], "float32"], {}, ["schedule_conv3d_transpose_nchw_cuda", [1, 192, 10, 10, 10], [192, 192, 3, 3, 3], [1, 1, 1], [1, 1, 1], [0, 0, 0], "float32"], {"i": 20300244, "t": "", "c": null, "e": [["tile_f", "sp", [-1, 2, 12, 2]], ["tile_d", "sp", [-1, 2, 1, 1]], ["tile_y", "sp", [-1, 1, 1, 1]], ["tile_x", "sp", [-1, 1, 1, 5]], ["tile_rc", "sp", [-1, 1]], ["tile_rd", "sp", [-1, 3]], ["tile_ry", "sp", [-1, 1]], ["tile_rx", "sp", [-1, 1]], ["auto_unroll_max_step", "ot", 0], ["unroll_explicit", "ot", 0]]}], "r": [[0.00237658911627907], 0, 1.7147750854492188, 1576307064.3792121], "v": 0.1}
{"i": ["cuda", "schedule_conv3d_transpose_nchw_cuda", [[1, 192, 10, 10, 10], [192, 192, 3, 3, 3], [1, 1, 1], [1, 1, 1], [0, 0, 0], "float32"], {}, ["schedule_conv3d_transpose_nchw_cuda", [1, 192, 10, 10, 10], [192, 192, 3, 3, 3], [1, 1, 1], [1, 1, 1], [0, 0, 0], "float32"], {"i": 19614904, "t": "", "c": null, "e": [["tile_f", "sp", [-1, 2, 4, 6]], ["tile_d", "sp", [-1, 1, 1, 2]], ["tile_y", "sp", [-1, 1, 1, 1]], ["tile_x", "sp", [-1, 1, 2, 1]], ["tile_rc", "sp", [-1, 1]], ["tile_rd", "sp", [-1, 3]], ["tile_ry", "sp", [-1, 1]], ["tile_rx", "sp", [-1, 1]], ["auto_unroll_max_step", "ot", 0], ["unroll_explicit", "ot", 0]]}], "r": [[0.004323485791666666], 0, 1.827507734298706, 1576307065.306775], "v": 0.1}
{"i": ["cuda", "schedule_conv3d_transpose_nchw_cuda", [[1, 192, 10, 10, 10], [192, 192, 3, 3, 3], [1, 1, 1], [1, 1, 1], [0, 0, 0], "float32"], {}, ["schedule_conv3d_transpose_nchw_cuda", [1, 192, 10, 10, 10], [192, 192, 3, 3, 3], [1, 1, 1], [1, 1, 1], [0, 0, 0], "float32"], {"i": 173755576, "t": "", "c": null, "e": [["tile_f", "sp", [-1, 2, 4, 6]], ["tile_d", "sp", [-1, 1, 1, 2]], ["tile_y", "sp", [-1, 1, 1, 1]], ["tile_x", "sp", [-1, 1, 2, 1]], ["tile_rc", "sp", [-1, 1]], ["tile_rd", "sp", [-1, 3]], ["tile_ry", "sp", [-1, 1]], ["tile_rx", "sp", [-1, 1]], ["auto_unroll_max_step", "ot", 512], ["unroll_explicit", "ot", 0]]}], "r": [[0.0041754625833333335], 0, 2.061946153640747, 1576307066.4095542], "v": 0.1}
{"i": ["cuda", "schedule_conv3d_transpose_nchw_cuda", [[1, 192, 10, 10, 10], [192, 192, 3, 3, 3], [1, 1, 1], [1, 1, 1], [0, 0, 0], "float32"], {}, ["schedule_conv3d_transpose_nchw_cuda", [1, 192, 10, 10, 10], [192, 192, 3, 3, 3], [1, 1, 1], [1, 1, 1], [0, 0, 0], "float32"], {"i": 193471720, "t": "", "c": null, "e": [["tile_f", "sp", [-1, 2, 4, 6]], ["tile_d", "sp", [-1, 1, 1, 1]], ["tile_y", "sp", [-1, 1, 2, 1]], ["tile_x", "sp", [-1, 1, 1, 2]], ["tile_rc", "sp", [-1, 1]], ["tile_rd", "sp", [-1, 1]], ["tile_ry", "sp", [-1, 3]], ["tile_rx", "sp", [-1, 1]], ["auto_unroll_max_step", "ot", 512], ["unroll_explicit", "ot", 0]]}], "r": [[0.0033573979354838707], 0, 1.8590455055236816, 1576307067.3436658], "v": 0.1}
{"i": ["cuda", "schedule_conv3d_transpose_nchw_cuda", [[1, 192, 10, 10, 10], [192, 192, 3, 3, 3], [1, 1, 1], [1, 1, 1], [0, 0, 0], "float32"], {}, ["schedule_conv3d_transpose_nchw_cuda", [1, 192, 10, 10, 10], [192, 192, 3, 3, 3], [1, 1, 1], [1, 1, 1], [0, 0, 0], "float32"], {"i": 19614838, "t": "", "c": null, "e": [["tile_f", "sp", [-1, 2, 8, 3]], ["tile_d", "sp", [-1, 1, 1, 2]], ["tile_y", "sp", [-1, 1, 1, 1]], ["tile_x", "sp", [-1, 1, 2, 1]], ["tile_rc", "sp", [-1, 1]], ["tile_rd", "sp", [-1, 3]], ["tile_ry", "sp", [-1, 1]], ["tile_rx", "sp", [-1, 1]], ["auto_unroll_max_step", "ot", 0], ["unroll_explicit", "ot", 0]]}], "r": [[0.00534846525], 0, 1.8115017414093018, 1576307068.229232], "v": 0.1}
