second_layer_input_grad.log
{"i": ["cuda", "schedule_conv3d_transpose_nchw_cuda", [[1, 64, 40, 40, 40], [64, 64, 3, 3, 3], [1, 1, 1], [1, 1, 1], [0, 0, 0], "float32"], {}, ["schedule_conv3d_transpose_nchw_cuda", [1, 64, 40, 40, 40], [64, 64, 3, 3, 3], [1, 1, 1], [1, 1, 1], [0, 0, 0], "float32"], {"i": 13629537724, "t": "", "c": null, "e": [["tile_f", "sp", [-1, 2, 4, 2]], ["tile_d", "sp", [-1, 2, 1, 1]], ["tile_y", "sp", [-1, 1, 10, 2]], ["tile_x", "sp", [-1, 4, 1, 10]], ["tile_rc", "sp", [-1, 2]], ["tile_rd", "sp", [-1, 3]], ["tile_ry", "sp", [-1, 1]], ["tile_rx", "sp", [-1, 3]], ["auto_unroll_max_step", "ot", 1500], ["unroll_explicit", "ot", 1]]}], "r": [[0.0734903055], 0, 7.128987073898315, 1576422512.6803553], "v": 0.1}
{"i": ["cuda", "schedule_conv3d_transpose_nchw_cuda", [[1, 64, 40, 40, 40], [64, 64, 3, 3, 3], [1, 1, 1], [1, 1, 1], [0, 0, 0], "float32"], {}, ["schedule_conv3d_transpose_nchw_cuda", [1, 64, 40, 40, 40], [64, 64, 3, 3, 3], [1, 1, 1], [1, 1, 1], [0, 0, 0], "float32"], {"i": 8502473441, "t": "", "c": null, "e": [["tile_f", "sp", [-1, 1, 2, 16]], ["tile_d", "sp", [-1, 2, 1, 1]], ["tile_y", "sp", [-1, 2, 1, 4]], ["tile_x", "sp", [-1, 2, 5, 4]], ["tile_rc", "sp", [-1, 2]], ["tile_rd", "sp", [-1, 1]], ["tile_ry", "sp", [-1, 1]], ["tile_rx", "sp", [-1, 3]], ["auto_unroll_max_step", "ot", 0], ["unroll_explicit", "ot", 1]]}], "r": [[0.27783145925], 0, 4.914488315582275, 1576422516.8609855], "v": 0.1}
{"i": ["cuda", "schedule_conv3d_transpose_nchw_cuda", [[1, 64, 40, 40, 40], [64, 64, 3, 3, 3], [1, 1, 1], [1, 1, 1], [0, 0, 0], "float32"], {}, ["schedule_conv3d_transpose_nchw_cuda", [1, 64, 40, 40, 40], [64, 64, 3, 3, 3], [1, 1, 1], [1, 1, 1], [0, 0, 0], "float32"], {"i": 8287641704, "t": "", "c": null, "e": [["tile_f", "sp", [-1, 4, 8, 1]], ["tile_d", "sp", [-1, 2, 1, 1]], ["tile_y", "sp", [-1, 1, 1, 1]], ["tile_x", "sp", [-1, 1, 10, 4]], ["tile_rc", "sp", [-1, 8]], ["tile_rd", "sp", [-1, 3]], ["tile_ry", "sp", [-1, 3]], ["tile_rx", "sp", [-1, 1]], ["auto_unroll_max_step", "ot", 0], ["unroll_explicit", "ot", 1]]}], "r": [[0.009282610818181818], 0, 1.1096770763397217, 1576422527.7290807], "v": 0.1}
{"i": ["cuda", "schedule_conv3d_transpose_nchw_cuda", [[1, 64, 40, 40, 40], [64, 64, 3, 3, 3], [1, 1, 1], [1, 1, 1], [0, 0, 0], "float32"], {}, ["schedule_conv3d_transpose_nchw_cuda", [1, 64, 40, 40, 40], [64, 64, 3, 3, 3], [1, 1, 1], [1, 1, 1], [0, 0, 0], "float32"], {"i": 969474529, "t": "", "c": null, "e": [["tile_f", "sp", [-1, 8, 2, 2]], ["tile_d", "sp", [-1, 5, 1, 1]], ["tile_y", "sp", [-1, 1, 20, 1]], ["tile_x", "sp", [-1, 2, 5, 2]], ["tile_rc", "sp", [-1, 2]], ["tile_rd", "sp", [-1, 3]], ["tile_ry", "sp", [-1, 3]], ["tile_rx", "sp", [-1, 1]], ["auto_unroll_max_step", "ot", 0], ["unroll_explicit", "ot", 0]]}], "r": [[0.2386331115], 0, 4.626227617263794, 1576422557.767136], "v": 0.1}
{"i": ["cuda", "schedule_conv3d_transpose_nchw_cuda", [[1, 64, 40, 40, 40], [64, 64, 3, 3, 3], [1, 1, 1], [1, 1, 1], [0, 0, 0], "float32"], {}, ["schedule_conv3d_transpose_nchw_cuda", [1, 64, 40, 40, 40], [64, 64, 3, 3, 3], [1, 1, 1], [1, 1, 1], [0, 0, 0], "float32"], {"i": 13140559338, "t": "", "c": null, "e": [["tile_f", "sp", [-1, 1, 8, 1]], ["tile_d", "sp", [-1, 1, 1, 2]], ["tile_y", "sp", [-1, 1, 1, 1]], ["tile_x", "sp", [-1, 2, 5, 2]], ["tile_rc", "sp", [-1, 16]], ["tile_rd", "sp", [-1, 3]], ["tile_ry", "sp", [-1, 3]], ["tile_rx", "sp", [-1, 1]], ["auto_unroll_max_step", "ot", 1500], ["unroll_explicit", "ot", 1]]}], "r": [[0.10389709825], 0, 7.071421384811401, 1576422830.1044054], "v": 0.1}
{"i": ["cuda", "schedule_conv3d_transpose_nchw_cuda", [[1, 64, 40, 40, 40], [64, 64, 3, 3, 3], [1, 1, 1], [1, 1, 1], [0, 0, 0], "float32"], {}, ["schedule_conv3d_transpose_nchw_cuda", [1, 64, 40, 40, 40], [64, 64, 3, 3, 3], [1, 1, 1], [1, 1, 1], [0, 0, 0], "float32"], {"i": 8323663338, "t": "", "c": null, "e": [["tile_f", "sp", [-1, 1, 8, 1]], ["tile_d", "sp", [-1, 1, 1, 2]], ["tile_y", "sp", [-1, 1, 1, 1]], ["tile_x", "sp", [-1, 2, 5, 2]], ["tile_rc", "sp", [-1, 16]], ["tile_rd", "sp", [-1, 3]], ["tile_ry", "sp", [-1, 3]], ["tile_rx", "sp", [-1, 1]], ["auto_unroll_max_step", "ot", 0], ["unroll_explicit", "ot", 1]]}], "r": [[0.05197707675], 0, 1.745814561843872, 1576422831.3196738], "v": 0.1}
{"i": ["cuda", "schedule_conv3d_transpose_nchw_cuda", [[1, 64, 40, 40, 40], [64, 64, 3, 3, 3], [1, 1, 1], [1, 1, 1], [0, 0, 0], "float32"], {}, ["schedule_conv3d_transpose_nchw_cuda", [1, 64, 40, 40, 40], [64, 64, 3, 3, 3], [1, 1, 1], [1, 1, 1], [0, 0, 0], "float32"], {"i": 1098319338, "t": "", "c": null, "e": [["tile_f", "sp", [-1, 1, 8, 1]], ["tile_d", "sp", [-1, 1, 1, 2]], ["tile_y", "sp", [-1, 1, 1, 1]], ["tile_x", "sp", [-1, 2, 5, 2]], ["tile_rc", "sp", [-1, 16]], ["tile_rd", "sp", [-1, 3]], ["tile_ry", "sp", [-1, 3]], ["tile_rx", "sp", [-1, 1]], ["auto_unroll_max_step", "ot", 0], ["unroll_explicit", "ot", 0]]}], "r": [[0.05198981075], 0, 1.7110557556152344, 1576422837.0108027], "v": 0.1}
{"i": ["cuda", "schedule_conv3d_transpose_nchw_cuda", [[1, 64, 40, 40, 40], [64, 64, 3, 3, 3], [1, 1, 1], [1, 1, 1], [0, 0, 0], "float32"], {}, ["schedule_conv3d_transpose_nchw_cuda", [1, 64, 40, 40, 40], [64, 64, 3, 3, 3], [1, 1, 1], [1, 1, 1], [0, 0, 0], "float32"], {"i": 5829199338, "t": "", "c": null, "e": [["tile_f", "sp", [-1, 1, 8, 1]], ["tile_d", "sp", [-1, 1, 1, 2]], ["tile_y", "sp", [-1, 1, 1, 1]], ["tile_x", "sp", [-1, 2, 5, 2]], ["tile_rc", "sp", [-1, 4]], ["tile_rd", "sp", [-1, 3]], ["tile_ry", "sp", [-1, 3]], ["tile_rx", "sp", [-1, 1]], ["auto_unroll_max_step", "ot", 1500], ["unroll_explicit", "ot", 0]]}], "r": [[0.022767355], 0, 2.735381841659546, 1576422838.5498178], "v": 0.1}
{"i": ["cuda", "schedule_conv3d_transpose_nchw_cuda", [[1, 64, 40, 40, 40], [64, 64, 3, 3, 3], [1, 1, 1], [1, 1, 1], [0, 0, 0], "float32"], {}, ["schedule_conv3d_transpose_nchw_cuda", [1, 64, 40, 40, 40], [64, 64, 3, 3, 3], [1, 1, 1], [1, 1, 1], [0, 0, 0], "float32"], {"i": 926822408, "t": "", "c": null, "e": [["tile_f", "sp", [-1, 2, 2, 1]], ["tile_d", "sp", [-1, 1, 1, 1]], ["tile_y", "sp", [-1, 1, 1, 1]], ["tile_x", "sp", [-1, 4, 5, 2]], ["tile_rc", "sp", [-1, 1]], ["tile_rd", "sp", [-1, 3]], ["tile_ry", "sp", [-1, 3]], ["tile_rx", "sp", [-1, 1]], ["auto_unroll_max_step", "ot", 0], ["unroll_explicit", "ot", 0]]}], "r": [[0.06549462925], 0, 2.0632457733154297, 1576422839.9519942], "v": 0.1}
{"i": ["cuda", "schedule_conv3d_transpose_nchw_cuda", [[1, 64, 40, 40, 40], [64, 64, 3, 3, 3], [1, 1, 1], [1, 1, 1], [0, 0, 0], "float32"], {}, ["schedule_conv3d_transpose_nchw_cuda", [1, 64, 40, 40, 40], [64, 64, 3, 3, 3], [1, 1, 1], [1, 1, 1], [0, 0, 0], "float32"], {"i": 8152166408, "t": "", "c": null, "e": [["tile_f", "sp", [-1, 2, 2, 1]], ["tile_d", "sp", [-1, 1, 1, 1]], ["tile_y", "sp", [-1, 1, 1, 1]], ["tile_x", "sp", [-1, 4, 5, 2]], ["tile_rc", "sp", [-1, 1]], ["tile_rd", "sp", [-1, 3]], ["tile_ry", "sp", [-1, 3]], ["tile_rx", "sp", [-1, 1]], ["auto_unroll_max_step", "ot", 0], ["unroll_explicit", "ot", 1]]}], "r": [[0.06549379025], 0, 1.9685826301574707, 1576422841.3139398], "v": 0.1}
{"i": ["cuda", "schedule_conv3d_transpose_nchw_cuda", [[1, 64, 40, 40, 40], [64, 64, 3, 3, 3], [1, 1, 1], [1, 1, 1], [0, 0, 0], "float32"], {}, ["schedule_conv3d_transpose_nchw_cuda", [1, 64, 40, 40, 40], [64, 64, 3, 3, 3], [1, 1, 1], [1, 1, 1], [0, 0, 0], "float32"], {"i": 975744094, "t": "", "c": null, "e": [["tile_f", "sp", [-1, 8, 2, 1]], ["tile_d", "sp", [-1, 2, 1, 1]], ["tile_y", "sp", [-1, 1, 1, 1]], ["tile_x", "sp", [-1, 2, 5, 4]], ["tile_rc", "sp", [-1, 2]], ["tile_rd", "sp", [-1, 3]], ["tile_ry", "sp", [-1, 3]], ["tile_rx", "sp", [-1, 1]], ["auto_unroll_max_step", "ot", 0], ["unroll_explicit", "ot", 0]]}], "r": [[0.0439900975], 0, 2.0017683506011963, 1576422851.5643814], "v": 0.1}
{"i": ["cuda", "schedule_conv3d_transpose_nchw_cuda", [[1, 64, 40, 40, 40], [64, 64, 3, 3, 3], [1, 1, 1], [1, 1, 1], [0, 0, 0], "float32"], {}, ["schedule_conv3d_transpose_nchw_cuda", [1, 64, 40, 40, 40], [64, 64, 3, 3, 3], [1, 1, 1], [1, 1, 1], [0, 0, 0], "float32"], {"i": 3378278420, "t": "", "c": null, "e": [["tile_f", "sp", [-1, 4, 8, 1]], ["tile_d", "sp", [-1, 1, 1, 1]], ["tile_y", "sp", [-1, 1, 1, 1]], ["tile_x", "sp", [-1, 4, 5, 2]], ["tile_rc", "sp", [-1, 2]], ["tile_rd", "sp", [-1, 3]], ["tile_ry", "sp", [-1, 3]], ["tile_rx", "sp", [-1, 1]], ["auto_unroll_max_step", "ot", 512], ["unroll_explicit", "ot", 0]]}], "r": [[0.01236154622222222], 0, 1.8283166885375977, 1576422852.68511], "v": 0.1}
{"i": ["cuda", "schedule_conv3d_transpose_nchw_cuda", [[1, 64, 40, 40, 40], [64, 64, 3, 3, 3], [1, 1, 1], [1, 1, 1], [0, 0, 0], "float32"], {}, ["schedule_conv3d_transpose_nchw_cuda", [1, 64, 40, 40, 40], [64, 64, 3, 3, 3], [1, 1, 1], [1, 1, 1], [0, 0, 0], "float32"], {"i": 8238182420, "t": "", "c": null, "e": [["tile_f", "sp", [-1, 4, 8, 1]], ["tile_d", "sp", [-1, 1, 1, 1]], ["tile_y", "sp", [-1, 1, 1, 1]], ["tile_x", "sp", [-1, 4, 5, 2]], ["tile_rc", "sp", [-1, 4]], ["tile_rd", "sp", [-1, 3]], ["tile_ry", "sp", [-1, 3]], ["tile_rx", "sp", [-1, 1]], ["auto_unroll_max_step", "ot", 0], ["unroll_explicit", "ot", 1]]}], "r": [[0.014112799875], 0, 1.557344913482666, 1576422853.6535003], "v": 0.1}
{"i": ["cuda", "schedule_conv3d_transpose_nchw_cuda", [[1, 64, 40, 40, 40], [64, 64, 3, 3, 3], [1, 1, 1], [1, 1, 1], [0, 0, 0], "float32"], {}, ["schedule_conv3d_transpose_nchw_cuda", [1, 64, 40, 40, 40], [64, 64, 3, 3, 3], [1, 1, 1], [1, 1, 1], [0, 0, 0], "float32"], {"i": 8201088094, "t": "", "c": null, "e": [["tile_f", "sp", [-1, 8, 2, 1]], ["tile_d", "sp", [-1, 2, 1, 1]], ["tile_y", "sp", [-1, 1, 1, 1]], ["tile_x", "sp", [-1, 2, 5, 4]], ["tile_rc", "sp", [-1, 2]], ["tile_rd", "sp", [-1, 3]], ["tile_ry", "sp", [-1, 3]], ["tile_rx", "sp", [-1, 1]], ["auto_unroll_max_step", "ot", 0], ["unroll_explicit", "ot", 1]]}], "r": [[0.04391945525], 0, 1.8675451278686523, 1576422858.6528628], "v": 0.1}
{"i": ["cuda", "schedule_conv3d_transpose_nchw_cuda", [[1, 64, 40, 40, 40], [64, 64, 3, 3, 3], [1, 1, 1], [1, 1, 1], [0, 0, 0], "float32"], {}, ["schedule_conv3d_transpose_nchw_cuda", [1, 64, 40, 40, 40], [64, 64, 3, 3, 3], [1, 1, 1], [1, 1, 1], [0, 0, 0], "float32"], {"i": 1098854420, "t": "", "c": null, "e": [["tile_f", "sp", [-1, 4, 8, 1]], ["tile_d", "sp", [-1, 1, 1, 1]], ["tile_y", "sp", [-1, 1, 1, 1]], ["tile_x", "sp", [-1, 4, 5, 2]], ["tile_rc", "sp", [-1, 16]], ["tile_rd", "sp", [-1, 3]], ["tile_ry", "sp", [-1, 3]], ["tile_rx", "sp", [-1, 1]], ["auto_unroll_max_step", "ot", 0], ["unroll_explicit", "ot", 0]]}], "r": [[0.0472583825], 0, 1.7386376857757568, 1576422859.8306603], "v": 0.1}
{"i": ["cuda", "schedule_conv3d_transpose_nchw_cuda", [[1, 64, 40, 40, 40], [64, 64, 3, 3, 3], [1, 1, 1], [1, 1, 1], [0, 0, 0], "float32"], {}, ["schedule_conv3d_transpose_nchw_cuda", [1, 64, 40, 40, 40], [64, 64, 3, 3, 3], [1, 1, 1], [1, 1, 1], [0, 0, 0], "float32"], {"i": 10732646420, "t": "", "c": null, "e": [["tile_f", "sp", [-1, 4, 8, 1]], ["tile_d", "sp", [-1, 1, 1, 1]], ["tile_y", "sp", [-1, 1, 1, 1]], ["tile_x", "sp", [-1, 4, 5, 2]], ["tile_rc", "sp", [-1, 16]], ["tile_rd", "sp", [-1, 3]], ["tile_ry", "sp", [-1, 3]], ["tile_rx", "sp", [-1, 1]], ["auto_unroll_max_step", "ot", 512], ["unroll_explicit", "ot", 1]]}], "r": [[0.07640040025], 0, 4.962646007537842, 1576422861.805422], "v": 0.1}
{"i": ["cuda", "schedule_conv3d_transpose_nchw_cuda", [[1, 64, 40, 40, 40], [64, 64, 3, 3, 3], [1, 1, 1], [1, 1, 1], [0, 0, 0], "float32"], {}, ["schedule_conv3d_transpose_nchw_cuda", [1, 64, 40, 40, 40], [64, 64, 3, 3, 3], [1, 1, 1], [1, 1, 1], [0, 0, 0], "float32"], {"i": 1055846420, "t": "", "c": null, "e": [["tile_f", "sp", [-1, 4, 8, 1]], ["tile_d", "sp", [-1, 1, 1, 1]], ["tile_y", "sp", [-1, 1, 1, 1]], ["tile_x", "sp", [-1, 4, 5, 2]], ["tile_rc", "sp", [-1, 8]], ["tile_rd", "sp", [-1, 3]], ["tile_ry", "sp", [-1, 3]], ["tile_rx", "sp", [-1, 1]], ["auto_unroll_max_step", "ot", 0], ["unroll_explicit", "ot", 0]]}], "r": [[0.023209731166666667], 0, 1.7210392951965332, 1576422862.9150808], "v": 0.1}
{"i": ["cuda", "schedule_conv3d_transpose_nchw_cuda", [[1, 64, 40, 40, 40], [64, 64, 3, 3, 3], [1, 1, 1], [1, 1, 1], [0, 0, 0], "float32"], {}, ["schedule_conv3d_transpose_nchw_cuda", [1, 64, 40, 40, 40], [64, 64, 3, 3, 3], [1, 1, 1], [1, 1, 1], [0, 0, 0], "float32"], {"i": 969830420, "t": "", "c": null, "e": [["tile_f", "sp", [-1, 4, 8, 1]], ["tile_d", "sp", [-1, 1, 1, 1]], ["tile_y", "sp", [-1, 1, 1, 1]], ["tile_x", "sp", [-1, 4, 5, 2]], ["tile_rc", "sp", [-1, 2]], ["tile_rd", "sp", [-1, 3]], ["tile_ry", "sp", [-1, 3]], ["tile_rx", "sp", [-1, 1]], ["auto_unroll_max_step", "ot", 0], ["unroll_explicit", "ot", 0]]}], "r": [[0.0106002288], 0, 1.555187463760376, 1576422863.8797164], "v": 0.1}
{"i": ["cuda", "schedule_conv3d_transpose_nchw_cuda", [[1, 64, 40, 40, 40], [64, 64, 3, 3, 3], [1, 1, 1], [1, 1, 1], [0, 0, 0], "float32"], {}, ["schedule_conv3d_transpose_nchw_cuda", [1, 64, 40, 40, 40], [64, 64, 3, 3, 3], [1, 1, 1], [1, 1, 1], [0, 0, 0], "float32"], {"i": 13017984094, "t": "", "c": null, "e": [["tile_f", "sp", [-1, 8, 2, 1]], ["tile_d", "sp", [-1, 2, 1, 1]], ["tile_y", "sp", [-1, 1, 1, 1]], ["tile_x", "sp", [-1, 2, 5, 4]], ["tile_rc", "sp", [-1, 2]], ["tile_rd", "sp", [-1, 3]], ["tile_ry", "sp", [-1, 3]], ["tile_rx", "sp", [-1, 1]], ["auto_unroll_max_step", "ot", 1500], ["unroll_explicit", "ot", 1]]}], "r": [[0.092997702], 0, 6.025939702987671, 1576422866.5401893], "v": 0.1}
{"i": ["cuda", "schedule_conv3d_transpose_nchw_cuda", [[1, 64, 40, 40, 40], [64, 64, 3, 3, 3], [1, 1, 1], [1, 1, 1], [0, 0, 0], "float32"], {}, ["schedule_conv3d_transpose_nchw_cuda", [1, 64, 40, 40, 40], [64, 64, 3, 3, 3], [1, 1, 1], [1, 1, 1], [0, 0, 0], "float32"], {"i": 968217694, "t": "", "c": null, "e": [["tile_f", "sp", [-1, 8, 2, 1]], ["tile_d", "sp", [-1, 2, 1, 1]], ["tile_y", "sp", [-1, 1, 1, 1]], ["tile_x", "sp", [-1, 5, 4, 2]], ["tile_rc", "sp", [-1, 2]], ["tile_rd", "sp", [-1, 3]], ["tile_ry", "sp", [-1, 3]], ["tile_rx", "sp", [-1, 1]], ["auto_unroll_max_step", "ot", 0], ["unroll_explicit", "ot", 0]]}], "r": [[0.03219292], 0, 2.18398118019104, 1576422867.7745461], "v": 0.1}
{"i": ["cuda", "schedule_conv3d_transpose_nchw_cuda", [[1, 64, 40, 40, 40], [64, 64, 3, 3, 3], [1, 1, 1], [1, 1, 1], [0, 0, 0], "float32"], {}, ["schedule_conv3d_transpose_nchw_cuda", [1, 64, 40, 40, 40], [64, 64, 3, 3, 3], [1, 1, 1], [1, 1, 1], [0, 0, 0], "float32"], {"i": 8237647338, "t": "", "c": null, "e": [["tile_f", "sp", [-1, 1, 8, 1]], ["tile_d", "sp", [-1, 1, 1, 2]], ["tile_y", "sp", [-1, 1, 1, 1]], ["tile_x", "sp", [-1, 2, 5, 2]], ["tile_rc", "sp", [-1, 4]], ["tile_rd", "sp", [-1, 3]], ["tile_ry", "sp", [-1, 3]], ["tile_rx", "sp", [-1, 1]], ["auto_unroll_max_step", "ot", 0], ["unroll_explicit", "ot", 1]]}], "r": [[0.01624239142857143], 0, 1.6315369606018066, 1576422868.7877474], "v": 0.1}
{"i": ["cuda", "schedule_conv3d_transpose_nchw_cuda", [[1, 64, 40, 40, 40], [64, 64, 3, 3, 3], [1, 1, 1], [1, 1, 1], [0, 0, 0], "float32"], {}, ["schedule_conv3d_transpose_nchw_cuda", [1, 64, 40, 40, 40], [64, 64, 3, 3, 3], [1, 1, 1], [1, 1, 1], [0, 0, 0], "float32"], {"i": 8324198420, "t": "", "c": null, "e": [["tile_f", "sp", [-1, 4, 8, 1]], ["tile_d", "sp", [-1, 1, 1, 1]], ["tile_y", "sp", [-1, 1, 1, 1]], ["tile_x", "sp", [-1, 4, 5, 2]], ["tile_rc", "sp", [-1, 16]], ["tile_rd", "sp", [-1, 3]], ["tile_ry", "sp", [-1, 3]], ["tile_rx", "sp", [-1, 1]], ["auto_unroll_max_step", "ot", 0], ["unroll_explicit", "ot", 1]]}], "r": [[0.04722888025], 0, 1.780318021774292, 1576422869.9166212], "v": 0.1}
{"i": ["cuda", "schedule_conv3d_transpose_nchw_cuda", [[1, 64, 40, 40, 40], [64, 64, 3, 3, 3], [1, 1, 1], [1, 1, 1], [0, 0, 0], "float32"], {}, ["schedule_conv3d_transpose_nchw_cuda", [1, 64, 40, 40, 40], [64, 64, 3, 3, 3], [1, 1, 1], [1, 1, 1], [0, 0, 0], "float32"], {"i": 13054543338, "t": "", "c": null, "e": [["tile_f", "sp", [-1, 1, 8, 1]], ["tile_d", "sp", [-1, 1, 1, 2]], ["tile_y", "sp", [-1, 1, 1, 1]], ["tile_x", "sp", [-1, 2, 5, 2]], ["tile_rc", "sp", [-1, 4]], ["tile_rd", "sp", [-1, 3]], ["tile_ry", "sp", [-1, 3]], ["tile_rx", "sp", [-1, 1]], ["auto_unroll_max_step", "ot", 1500], ["unroll_explicit", "ot", 1]]}], "r": [[0.016281704857142858], 0, 3.200960636138916, 1576422871.2279947], "v": 0.1}
{"i": ["cuda", "schedule_conv3d_transpose_nchw_cuda", [[1, 64, 40, 40, 40], [64, 64, 3, 3, 3], [1, 1, 1], [1, 1, 1], [0, 0, 0], "float32"], {}, ["schedule_conv3d_transpose_nchw_cuda", [1, 64, 40, 40, 40], [64, 64, 3, 3, 3], [1, 1, 1], [1, 1, 1], [0, 0, 0], "float32"], {"i": 13318112782, "t": "", "c": null, "e": [["tile_f", "sp", [-1, 1, 4, 4]], ["tile_d", "sp", [-1, 2, 1, 1]], ["tile_y", "sp", [-1, 1, 8, 1]], ["tile_x", "sp", [-1, 5, 2, 4]], ["tile_rc", "sp", [-1, 2]], ["tile_rd", "sp", [-1, 1]], ["tile_ry", "sp", [-1, 1]], ["tile_rx", "sp", [-1, 3]], ["auto_unroll_max_step", "ot", 1500], ["unroll_explicit", "ot", 1]]}], "r": [[0.00823052], 0, 3.1776115894317627, 1576422877.864822], "v": 0.1}
{"i": ["cuda", "schedule_conv3d_transpose_nchw_cuda", [[1, 64, 40, 40, 40], [64, 64, 3, 3, 3], [1, 1, 1], [1, 1, 1], [0, 0, 0], "float32"], {}, ["schedule_conv3d_transpose_nchw_cuda", [1, 64, 40, 40, 40], [64, 64, 3, 3, 3], [1, 1, 1], [1, 1, 1], [0, 0, 0], "float32"], {"i": 10269893902, "t": "", "c": null, "e": [["tile_f", "sp", [-1, 1, 4, 4]], ["tile_d", "sp", [-1, 2, 1, 1]], ["tile_y", "sp", [-1, 1, 5, 1]], ["tile_x", "sp", [-1, 4, 2, 5]], ["tile_rc", "sp", [-1, 1]], ["tile_rd", "sp", [-1, 1]], ["tile_ry", "sp", [-1, 3]], ["tile_rx", "sp", [-1, 1]], ["auto_unroll_max_step", "ot", 512], ["unroll_explicit", "ot", 1]]}], "r": [[0.009848674], 0, 3.198563575744629, 1576422883.147637], "v": 0.1}
{"i": ["cuda", "schedule_conv3d_transpose_nchw_cuda", [[1, 64, 40, 40, 40], [64, 64, 3, 3, 3], [1, 1, 1], [1, 1, 1], [0, 0, 0], "float32"], {}, ["schedule_conv3d_transpose_nchw_cuda", [1, 64, 40, 40, 40], [64, 64, 3, 3, 3], [1, 1, 1], [1, 1, 1], [0, 0, 0], "float32"], {"i": 3032621898, "t": "", "c": null, "e": [["tile_f", "sp", [-1, 1, 2, 4]], ["tile_d", "sp", [-1, 2, 1, 1]], ["tile_y", "sp", [-1, 5, 1, 1]], ["tile_x", "sp", [-1, 5, 4, 2]], ["tile_rc", "sp", [-1, 1]], ["tile_rd", "sp", [-1, 1]], ["tile_ry", "sp", [-1, 3]], ["tile_rx", "sp", [-1, 1]], ["auto_unroll_max_step", "ot", 512], ["unroll_explicit", "ot", 0]]}], "r": [[0.256788283], 0, 6.004834413528442, 1576422887.408931], "v": 0.1}
{"i": ["cuda", "schedule_conv3d_transpose_nchw_cuda", [[1, 64, 40, 40, 40], [64, 64, 3, 3, 3], [1, 1, 1], [1, 1, 1], [0, 0, 0], "float32"], {}, ["schedule_conv3d_transpose_nchw_cuda", [1, 64, 40, 40, 40], [64, 64, 3, 3, 3], [1, 1, 1], [1, 1, 1], [0, 0, 0], "float32"], {"i": 10257965898, "t": "", "c": null, "e": [["tile_f", "sp", [-1, 1, 2, 4]], ["tile_d", "sp", [-1, 2, 1, 1]], ["tile_y", "sp", [-1, 5, 1, 1]], ["tile_x", "sp", [-1, 5, 4, 2]], ["tile_rc", "sp", [-1, 1]], ["tile_rd", "sp", [-1, 1]], ["tile_ry", "sp", [-1, 3]], ["tile_rx", "sp", [-1, 1]], ["auto_unroll_max_step", "ot", 512], ["unroll_explicit", "ot", 1]]}], "r": [[0.242937306], 0, 6.8727288246154785, 1576422891.560342], "v": 0.1}
{"i": ["cuda", "schedule_conv3d_transpose_nchw_cuda", [[1, 64, 40, 40, 40], [64, 64, 3, 3, 3], [1, 1, 1], [1, 1, 1], [0, 0, 0], "float32"], {}, ["schedule_conv3d_transpose_nchw_cuda", [1, 64, 40, 40, 40], [64, 64, 3, 3, 3], [1, 1, 1], [1, 1, 1], [0, 0, 0], "float32"], {"i": 8458208782, "t": "", "c": null, "e": [["tile_f", "sp", [-1, 1, 4, 4]], ["tile_d", "sp", [-1, 2, 1, 1]], ["tile_y", "sp", [-1, 1, 8, 1]], ["tile_x", "sp", [-1, 5, 2, 4]], ["tile_rc", "sp", [-1, 1]], ["tile_rd", "sp", [-1, 1]], ["tile_ry", "sp", [-1, 1]], ["tile_rx", "sp", [-1, 3]], ["auto_unroll_max_step", "ot", 0], ["unroll_explicit", "ot", 1]]}], "r": [[0.010032989], 0, 1.7501788139343262, 1576422892.5070164], "v": 0.1}
{"i": ["cuda", "schedule_conv3d_transpose_nchw_cuda", [[1, 64, 40, 40, 40], [64, 64, 3, 3, 3], [1, 1, 1], [1, 1, 1], [0, 0, 0], "float32"], {}, ["schedule_conv3d_transpose_nchw_cuda", [1, 64, 40, 40, 40], [64, 64, 3, 3, 3], [1, 1, 1], [1, 1, 1], [0, 0, 0], "float32"], {"i": 636101902, "t": "", "c": null, "e": [["tile_f", "sp", [-1, 1, 4, 4]], ["tile_d", "sp", [-1, 2, 1, 1]], ["tile_y", "sp", [-1, 1, 5, 1]], ["tile_x", "sp", [-1, 4, 2, 5]], ["tile_rc", "sp", [-1, 1]], ["tile_rd", "sp", [-1, 1]], ["tile_ry", "sp", [-1, 3]], ["tile_rx", "sp", [-1, 1]], ["auto_unroll_max_step", "ot", 0], ["unroll_explicit", "ot", 0]]}], "r": [[0.013280707], 0, 1.7925539016723633, 1576422893.471548], "v": 0.1}
{"i": ["cuda", "schedule_conv3d_transpose_nchw_cuda", [[1, 64, 40, 40, 40], [64, 64, 3, 3, 3], [1, 1, 1], [1, 1, 1], [0, 0, 0], "float32"], {}, ["schedule_conv3d_transpose_nchw_cuda", [1, 64, 40, 40, 40], [64, 64, 3, 3, 3], [1, 1, 1], [1, 1, 1], [0, 0, 0], "float32"], {"i": 5146545739, "t": "", "c": null, "e": [["tile_f", "sp", [-1, 2, 2, 4]], ["tile_d", "sp", [-1, 2, 1, 1]], ["tile_y", "sp", [-1, 2, 4, 1]], ["tile_x", "sp", [-1, 5, 2, 4]], ["tile_rc", "sp", [-1, 1]], ["tile_rd", "sp", [-1, 3]], ["tile_ry", "sp", [-1, 1]], ["tile_rx", "sp", [-1, 1]], ["auto_unroll_max_step", "ot", 1500], ["unroll_explicit", "ot", 0]]}], "r": [[0.20600620575], 0, 5.872394800186157, 1576422902.6135995], "v": 0.1}
{"i": ["cuda", "schedule_conv3d_transpose_nchw_cuda", [[1, 64, 40, 40, 40], [64, 64, 3, 3, 3], [1, 1, 1], [1, 1, 1], [0, 0, 0], "float32"], {}, ["schedule_conv3d_transpose_nchw_cuda", [1, 64, 40, 40, 40], [64, 64, 3, 3, 3], [1, 1, 1], [1, 1, 1], [0, 0, 0], "float32"], {"i": 13275104782, "t": "", "c": null, "e": [["tile_f", "sp", [-1, 1, 4, 4]], ["tile_d", "sp", [-1, 2, 1, 1]], ["tile_y", "sp", [-1, 1, 8, 1]], ["tile_x", "sp", [-1, 5, 2, 4]], ["tile_rc", "sp", [-1, 1]], ["tile_rd", "sp", [-1, 1]], ["tile_ry", "sp", [-1, 1]], ["tile_rx", "sp", [-1, 3]], ["auto_unroll_max_step", "ot", 1500], ["unroll_explicit", "ot", 1]]}], "r": [[0.004702034636363636], 0, 4.418460130691528, 1576422903.8345985], "v": 0.1}
{"i": ["cuda", "schedule_conv3d_transpose_nchw_cuda", [[1, 64, 40, 40, 40], [64, 64, 3, 3, 3], [1, 1, 1], [1, 1, 1], [0, 0, 0], "float32"], {}, ["schedule_conv3d_transpose_nchw_cuda", [1, 64, 40, 40, 40], [64, 64, 3, 3, 3], [1, 1, 1], [1, 1, 1], [0, 0, 0], "float32"], {"i": 3044549902, "t": "", "c": null, "e": [["tile_f", "sp", [-1, 1, 4, 4]], ["tile_d", "sp", [-1, 2, 1, 1]], ["tile_y", "sp", [-1, 1, 5, 1]], ["tile_x", "sp", [-1, 4, 2, 5]], ["tile_rc", "sp", [-1, 1]], ["tile_rd", "sp", [-1, 1]], ["tile_ry", "sp", [-1, 3]], ["tile_rx", "sp", [-1, 1]], ["auto_unroll_max_step", "ot", 512], ["unroll_explicit", "ot", 0]]}], "r": [[0.007706279923076923], 0, 2.1351113319396973, 1576422905.100836], "v": 0.1}
{"i": ["cuda", "schedule_conv3d_transpose_nchw_cuda", [[1, 64, 40, 40, 40], [64, 64, 3, 3, 3], [1, 1, 1], [1, 1, 1], [0, 0, 0], "float32"], {}, ["schedule_conv3d_transpose_nchw_cuda", [1, 64, 40, 40, 40], [64, 64, 3, 3, 3], [1, 1, 1], [1, 1, 1], [0, 0, 0], "float32"], {"i": 5441069898, "t": "", "c": null, "e": [["tile_f", "sp", [-1, 1, 2, 4]], ["tile_d", "sp", [-1, 2, 1, 1]], ["tile_y", "sp", [-1, 5, 1, 1]], ["tile_x", "sp", [-1, 5, 4, 2]], ["tile_rc", "sp", [-1, 1]], ["tile_rd", "sp", [-1, 1]], ["tile_ry", "sp", [-1, 3]], ["tile_rx", "sp", [-1, 1]], ["auto_unroll_max_step", "ot", 1500], ["unroll_explicit", "ot", 0]]}], "r": [[0.1730884295], 0, 5.21134877204895, 1576422908.5115376], "v": 0.1}
{"i": ["cuda", "schedule_conv3d_transpose_nchw_cuda", [[1, 64, 40, 40, 40], [64, 64, 3, 3, 3], [1, 1, 1], [1, 1, 1], [0, 0, 0], "float32"], {}, ["schedule_conv3d_transpose_nchw_cuda", [1, 64, 40, 40, 40], [64, 64, 3, 3, 3], [1, 1, 1], [1, 1, 1], [0, 0, 0], "float32"], {"i": 6092768782, "t": "", "c": null, "e": [["tile_f", "sp", [-1, 1, 4, 4]], ["tile_d", "sp", [-1, 2, 1, 1]], ["tile_y", "sp", [-1, 1, 8, 1]], ["tile_x", "sp", [-1, 5, 2, 4]], ["tile_rc", "sp", [-1, 2]], ["tile_rd", "sp", [-1, 1]], ["tile_ry", "sp", [-1, 1]], ["tile_rx", "sp", [-1, 3]], ["auto_unroll_max_step", "ot", 1500], ["unroll_explicit", "ot", 0]]}], "r": [[0.009611733636363636], 0, 2.4741547107696533, 1576422909.8830433], "v": 0.1}
{"i": ["cuda", "schedule_conv3d_transpose_nchw_cuda", [[1, 64, 40, 40, 40], [64, 64, 3, 3, 3], [1, 1, 1], [1, 1, 1], [0, 0, 0], "float32"], {}, ["schedule_conv3d_transpose_nchw_cuda", [1, 64, 40, 40, 40], [64, 64, 3, 3, 3], [1, 1, 1], [1, 1, 1], [0, 0, 0], "float32"], {"i": 6351803782, "t": "", "c": null, "e": [["tile_f", "sp", [-1, 1, 4, 4]], ["tile_d", "sp", [-1, 2, 1, 10]], ["tile_y", "sp", [-1, 1, 2, 1]], ["tile_x", "sp", [-1, 2, 5, 4]], ["tile_rc", "sp", [-1, 1]], ["tile_rd", "sp", [-1, 3]], ["tile_ry", "sp", [-1, 1]], ["tile_rx", "sp", [-1, 3]], ["auto_unroll_max_step", "ot", 1500], ["unroll_explicit", "ot", 0]]}], "r": [[0.100813102], 0, 5.672936677932739, 1576422913.0590317], "v": 0.1}
{"i": ["cuda", "schedule_conv3d_transpose_nchw_cuda", [[1, 64, 40, 40, 40], [64, 64, 3, 3, 3], [1, 1, 1], [1, 1, 1], [0, 0, 0], "float32"], {}, ["schedule_conv3d_transpose_nchw_cuda", [1, 64, 40, 40, 40], [64, 64, 3, 3, 3], [1, 1, 1], [1, 1, 1], [0, 0, 0], "float32"], {"i": 6352028800, "t": "", "c": null, "e": [["tile_f", "sp", [-1, 2, 4, 2]], ["tile_d", "sp", [-1, 1, 1, 2]], ["tile_y", "sp", [-1, 1, 5, 2]], ["tile_x", "sp", [-1, 2, 5, 4]], ["tile_rc", "sp", [-1, 1]], ["tile_rd", "sp", [-1, 3]], ["tile_ry", "sp", [-1, 1]], ["tile_rx", "sp", [-1, 3]], ["auto_unroll_max_step", "ot", 1500], ["unroll_explicit", "ot", 0]]}], "r": [[0.011328122666666668], 0, 2.2902183532714844, 1576422917.7807171], "v": 0.1}
{"i": ["cuda", "schedule_conv3d_transpose_nchw_cuda", [[1, 64, 40, 40, 40], [64, 64, 3, 3, 3], [1, 1, 1], [1, 1, 1], [0, 0, 0], "float32"], {}, ["schedule_conv3d_transpose_nchw_cuda", [1, 64, 40, 40, 40], [64, 64, 3, 3, 3], [1, 1, 1], [1, 1, 1], [0, 0, 0], "float32"], {"i": 7900316831, "t": "", "c": null, "e": [["tile_f", "sp", [-1, 1, 4, 8]], ["tile_d", "sp", [-1, 1, 1, 2]], ["tile_y", "sp", [-1, 1, 5, 2]], ["tile_x", "sp", [-1, 2, 5, 4]], ["tile_rc", "sp", [-1, 2]], ["tile_rd", "sp", [-1, 1]], ["tile_ry", "sp", [-1, 3]], ["tile_rx", "sp", [-1, 1]], ["auto_unroll_max_step", "ot", 0], ["unroll_explicit", "ot", 1]]}], "r": [[0.18307834525], 0, 3.9985783100128174, 1576422920.8112688], "v": 0.1}
{"i": ["cuda", "schedule_conv3d_transpose_nchw_cuda", [[1, 64, 40, 40, 40], [64, 64, 3, 3, 3], [1, 1, 1], [1, 1, 1], [0, 0, 0], "float32"], {}, ["schedule_conv3d_transpose_nchw_cuda", [1, 64, 40, 40, 40], [64, 64, 3, 3, 3], [1, 1, 1], [1, 1, 1], [0, 0, 0], "float32"], {"i": 10308764818, "t": "", "c": null, "e": [["tile_f", "sp", [-1, 1, 4, 4]], ["tile_d", "sp", [-1, 1, 1, 2]], ["tile_y", "sp", [-1, 1, 5, 2]], ["tile_x", "sp", [-1, 2, 5, 4]], ["tile_rc", "sp", [-1, 2]], ["tile_rd", "sp", [-1, 1]], ["tile_ry", "sp", [-1, 3]], ["tile_rx", "sp", [-1, 1]], ["auto_unroll_max_step", "ot", 512], ["unroll_explicit", "ot", 1]]}], "r": [[0.005577002666666667], 0, 2.8042969703674316, 1576422921.8331623], "v": 0.1}
{"i": ["cuda", "schedule_conv3d_transpose_nchw_cuda", [[1, 64, 40, 40, 40], [64, 64, 3, 3, 3], [1, 1, 1], [1, 1, 1], [0, 0, 0], "float32"], {}, ["schedule_conv3d_transpose_nchw_cuda", [1, 64, 40, 40, 40], [64, 64, 3, 3, 3], [1, 1, 1], [1, 1, 1], [0, 0, 0], "float32"], {"i": 10863159620, "t": "", "c": null, "e": [["tile_f", "sp", [-1, 1, 2, 8]], ["tile_d", "sp", [-1, 1, 1, 4]], ["tile_y", "sp", [-1, 1, 2, 5]], ["tile_x", "sp", [-1, 2, 10, 2]], ["tile_rc", "sp", [-1, 1]], ["tile_rd", "sp", [-1, 1]], ["tile_ry", "sp", [-1, 1]], ["tile_rx", "sp", [-1, 3]], ["auto_unroll_max_step", "ot", 512], ["unroll_explicit", "ot", 1]]}], "r": [[0.1755387615], 0, 4.434634208679199, 1576422929.683578], "v": 0.1}
{"i": ["cuda", "schedule_conv3d_transpose_nchw_cuda", [[1, 64, 40, 40, 40], [64, 64, 3, 3, 3], [1, 1, 1], [1, 1, 1], [0, 0, 0], "float32"], {}, ["schedule_conv3d_transpose_nchw_cuda", [1, 64, 40, 40, 40], [64, 64, 3, 3, 3], [1, 1, 1], [1, 1, 1], [0, 0, 0], "float32"], {"i": 8454711620, "t": "", "c": null, "e": [["tile_f", "sp", [-1, 1, 2, 8]], ["tile_d", "sp", [-1, 1, 1, 4]], ["tile_y", "sp", [-1, 1, 2, 5]], ["tile_x", "sp", [-1, 2, 10, 2]], ["tile_rc", "sp", [-1, 1]], ["tile_rd", "sp", [-1, 1]], ["tile_ry", "sp", [-1, 1]], ["tile_rx", "sp", [-1, 3]], ["auto_unroll_max_step", "ot", 0], ["unroll_explicit", "ot", 1]]}], "r": [[0.187256144], 0, 4.138911724090576, 1576422932.789663], "v": 0.1}
{"i": ["cuda", "schedule_conv3d_transpose_nchw_cuda", [[1, 64, 40, 40, 40], [64, 64, 3, 3, 3], [1, 1, 1], [1, 1, 1], [0, 0, 0], "float32"], {}, ["schedule_conv3d_transpose_nchw_cuda", [1, 64, 40, 40, 40], [64, 64, 3, 3, 3], [1, 1, 1], [1, 1, 1], [0, 0, 0], "float32"], {"i": 10566812828, "t": "", "c": null, "e": [["tile_f", "sp", [-1, 1, 2, 8]], ["tile_d", "sp", [-1, 1, 1, 2]], ["tile_y", "sp", [-1, 1, 5, 2]], ["tile_x", "sp", [-1, 2, 5, 4]], ["tile_rc", "sp", [-1, 1]], ["tile_rd", "sp", [-1, 3]], ["tile_ry", "sp", [-1, 3]], ["tile_rx", "sp", [-1, 1]], ["auto_unroll_max_step", "ot", 512], ["unroll_explicit", "ot", 1]]}], "r": [[0.03767379], 0, 3.64286732673645, 1576422934.2156749], "v": 0.1}
{"i": ["cuda", "schedule_conv3d_transpose_nchw_cuda", [[1, 64, 40, 40, 40], [64, 64, 3, 3, 3], [1, 1, 1], [1, 1, 1], [0, 0, 0], "float32"], {}, ["schedule_conv3d_transpose_nchw_cuda", [1, 64, 40, 40, 40], [64, 64, 3, 3, 3], [1, 1, 1], [1, 1, 1], [0, 0, 0], "float32"], {"i": 11463531111, "t": "", "c": null, "e": [["tile_f", "sp", [-1, 1, 4, 2]], ["tile_d", "sp", [-1, 1, 1, 4]], ["tile_y", "sp", [-1, 1, 5, 2]], ["tile_x", "sp", [-1, 2, 5, 2]], ["tile_rc", "sp", [-1, 1]], ["tile_rd", "sp", [-1, 1]], ["tile_ry", "sp", [-1, 3]], ["tile_rx", "sp", [-1, 3]], ["auto_unroll_max_step", "ot", 512], ["unroll_explicit", "ot", 1]]}], "r": [[0.004730257], 0, 2.106383800506592, 1576422935.1749208], "v": 0.1}
{"i": ["cuda", "schedule_conv3d_transpose_nchw_cuda", [[1, 64, 40, 40, 40], [64, 64, 3, 3, 3], [1, 1, 1], [1, 1, 1], [0, 0, 0], "float32"], {}, ["schedule_conv3d_transpose_nchw_cuda", [1, 64, 40, 40, 40], [64, 64, 3, 3, 3], [1, 1, 1], [1, 1, 1], [0, 0, 0], "float32"], {"i": 11164128958, "t": "", "c": null, "e": [["tile_f", "sp", [-1, 8, 2, 1]], ["tile_d", "sp", [-1, 1, 1, 5]], ["tile_y", "sp", [-1, 1, 1, 4]], ["tile_x", "sp", [-1, 2, 10, 2]], ["tile_rc", "sp", [-1, 1]], ["tile_rd", "sp", [-1, 3]], ["tile_ry", "sp", [-1, 1]], ["tile_rx", "sp", [-1, 3]], ["auto_unroll_max_step", "ot", 512], ["unroll_explicit", "ot", 1]]}], "r": [[0.2400254395], 0, 6.411974906921387, 1576422939.3336353], "v": 0.1}
{"i": ["cuda", "schedule_conv3d_transpose_nchw_cuda", [[1, 64, 40, 40, 40], [64, 64, 3, 3, 3], [1, 1, 1], [1, 1, 1], [0, 0, 0], "float32"], {}, ["schedule_conv3d_transpose_nchw_cuda", [1, 64, 40, 40, 40], [64, 64, 3, 3, 3], [1, 1, 1], [1, 1, 1], [0, 0, 0], "float32"], {"i": 10308764831, "t": "", "c": null, "e": [["tile_f", "sp", [-1, 1, 4, 8]], ["tile_d", "sp", [-1, 1, 1, 2]], ["tile_y", "sp", [-1, 1, 5, 2]], ["tile_x", "sp", [-1, 2, 5, 4]], ["tile_rc", "sp", [-1, 2]], ["tile_rd", "sp", [-1, 1]], ["tile_ry", "sp", [-1, 3]], ["tile_rx", "sp", [-1, 1]], ["auto_unroll_max_step", "ot", 512], ["unroll_explicit", "ot", 1]]}], "r": [[0.024105305499999997], 0, 3.231905698776245, 1576422940.6971931], "v": 0.1}
{"i": ["cuda", "schedule_conv3d_transpose_nchw_cuda", [[1, 64, 40, 40, 40], [64, 64, 3, 3, 3], [1, 1, 1], [1, 1, 1], [0, 0, 0], "float32"], {}, ["schedule_conv3d_transpose_nchw_cuda", [1, 64, 40, 40, 40], [64, 64, 3, 3, 3], [1, 1, 1], [1, 1, 1], [0, 0, 0], "float32"], {"i": 11164128962, "t": "", "c": null, "e": [["tile_f", "sp", [-1, 2, 4, 1]], ["tile_d", "sp", [-1, 1, 1, 5]], ["tile_y", "sp", [-1, 1, 1, 4]], ["tile_x", "sp", [-1, 2, 10, 2]], ["tile_rc", "sp", [-1, 1]], ["tile_rd", "sp", [-1, 3]], ["tile_ry", "sp", [-1, 1]], ["tile_rx", "sp", [-1, 3]], ["auto_unroll_max_step", "ot", 512], ["unroll_explicit", "ot", 1]]}], "r": [[0.0173912195], 0, 3.235375165939331, 1576422941.8992813], "v": 0.1}
{"i": ["cuda", "schedule_conv3d_transpose_nchw_cuda", [[1, 64, 40, 40, 40], [64, 64, 3, 3, 3], [1, 1, 1], [1, 1, 1], [0, 0, 0], "float32"], {}, ["schedule_conv3d_transpose_nchw_cuda", [1, 64, 40, 40, 40], [64, 64, 3, 3, 3], [1, 1, 1], [1, 1, 1], [0, 0, 0], "float32"], {"i": 12975260819, "t": "", "c": null, "e": [["tile_f", "sp", [-1, 2, 4, 4]], ["tile_d", "sp", [-1, 1, 1, 2]], ["tile_y", "sp", [-1, 1, 5, 2]], ["tile_x", "sp", [-1, 2, 5, 4]], ["tile_rc", "sp", [-1, 1]], ["tile_rd", "sp", [-1, 3]], ["tile_ry", "sp", [-1, 3]], ["tile_rx", "sp", [-1, 1]], ["auto_unroll_max_step", "ot", 1500], ["unroll_explicit", "ot", 1]]}], "r": [[0.019030089333333333], 0, 3.781623125076294, 1576422943.1015363], "v": 0.1}
{"i": ["cuda", "schedule_conv3d_transpose_nchw_cuda", [[1, 64, 40, 40, 40], [64, 64, 3, 3, 3], [1, 1, 1], [1, 1, 1], [0, 0, 0], "float32"], {}, ["schedule_conv3d_transpose_nchw_cuda", [1, 64, 40, 40, 40], [64, 64, 3, 3, 3], [1, 1, 1], [1, 1, 1], [0, 0, 0], "float32"], {"i": 10863031940, "t": "", "c": null, "e": [["tile_f", "sp", [-1, 1, 2, 8]], ["tile_d", "sp", [-1, 1, 1, 4]], ["tile_y", "sp", [-1, 1, 5, 2]], ["tile_x", "sp", [-1, 2, 10, 2]], ["tile_rc", "sp", [-1, 1]], ["tile_rd", "sp", [-1, 1]], ["tile_ry", "sp", [-1, 1]], ["tile_rx", "sp", [-1, 3]], ["auto_unroll_max_step", "ot", 512], ["unroll_explicit", "ot", 1]]}], "r": [[0.0251556985], 0, 3.2139368057250977, 1576422951.6090848], "v": 0.1}
{"i": ["cuda", "schedule_conv3d_transpose_nchw_cuda", [[1, 64, 40, 40, 40], [64, 64, 3, 3, 3], [1, 1, 1], [1, 1, 1], [0, 0, 0], "float32"], {}, ["schedule_conv3d_transpose_nchw_cuda", [1, 64, 40, 40, 40], [64, 64, 3, 3, 3], [1, 1, 1], [1, 1, 1], [0, 0, 0], "float32"], {"i": 11475318835, "t": "", "c": null, "e": [["tile_f", "sp", [-1, 1, 8, 2]], ["tile_d", "sp", [-1, 2, 1, 5]], ["tile_y", "sp", [-1, 1, 2, 2]], ["tile_x", "sp", [-1, 2, 4, 5]], ["tile_rc", "sp", [-1, 1]], ["tile_rd", "sp", [-1, 1]], ["tile_ry", "sp", [-1, 3]], ["tile_rx", "sp", [-1, 3]], ["auto_unroll_max_step", "ot", 512], ["unroll_explicit", "ot", 1]]}], "r": [[0.0347817665], 0, 5.25869083404541, 1576422957.6842637], "v": 0.1}
{"i": ["cuda", "schedule_conv3d_transpose_nchw_cuda", [[1, 64, 40, 40, 40], [64, 64, 3, 3, 3], [1, 1, 1], [1, 1, 1], [0, 0, 0], "float32"], {}, ["schedule_conv3d_transpose_nchw_cuda", [1, 64, 40, 40, 40], [64, 64, 3, 3, 3], [1, 1, 1], [1, 1, 1], [0, 0, 0], "float32"], {"i": 13271479940, "t": "", "c": null, "e": [["tile_f", "sp", [-1, 1, 2, 8]], ["tile_d", "sp", [-1, 1, 1, 4]], ["tile_y", "sp", [-1, 1, 5, 2]], ["tile_x", "sp", [-1, 2, 10, 2]], ["tile_rc", "sp", [-1, 1]], ["tile_rd", "sp", [-1, 1]], ["tile_ry", "sp", [-1, 1]], ["tile_rx", "sp", [-1, 3]], ["auto_unroll_max_step", "ot", 1500], ["unroll_explicit", "ot", 1]]}], "r": [[0.06791051575], 0, 4.896327972412109, 1576422959.7685359], "v": 0.1}
{"i": ["cuda", "schedule_conv3d_transpose_nchw_cuda", [[1, 64, 40, 40, 40], [64, 64, 3, 3, 3], [1, 1, 1], [1, 1, 1], [0, 0, 0], "float32"], {}, ["schedule_conv3d_transpose_nchw_cuda", [1, 64, 40, 40, 40], [64, 64, 3, 3, 3], [1, 1, 1], [1, 1, 1], [0, 0, 0], "float32"], {"i": 13883766835, "t": "", "c": null, "e": [["tile_f", "sp", [-1, 1, 8, 2]], ["tile_d", "sp", [-1, 2, 1, 5]], ["tile_y", "sp", [-1, 1, 2, 2]], ["tile_x", "sp", [-1, 2, 4, 5]], ["tile_rc", "sp", [-1, 1]], ["tile_rd", "sp", [-1, 1]], ["tile_ry", "sp", [-1, 3]], ["tile_rx", "sp", [-1, 3]], ["auto_unroll_max_step", "ot", 1500], ["unroll_explicit", "ot", 1]]}], "r": [[0.034718533], 0, 6.876401901245117, 1576422961.4814856], "v": 0.1}
{"i": ["cuda", "schedule_conv3d_transpose_nchw_cuda", [[1, 64, 40, 40, 40], [64, 64, 3, 3, 3], [1, 1, 1], [1, 1, 1], [0, 0, 0], "float32"], {}, ["schedule_conv3d_transpose_nchw_cuda", [1, 64, 40, 40, 40], [64, 64, 3, 3, 3], [1, 1, 1], [1, 1, 1], [0, 0, 0], "float32"], {"i": 11463621188, "t": "", "c": null, "e": [["tile_f", "sp", [-1, 1, 2, 8]], ["tile_d", "sp", [-1, 1, 1, 1]], ["tile_y", "sp", [-1, 1, 10, 4]], ["tile_x", "sp", [-1, 2, 5, 2]], ["tile_rc", "sp", [-1, 1]], ["tile_rd", "sp", [-1, 1]], ["tile_ry", "sp", [-1, 3]], ["tile_rx", "sp", [-1, 3]], ["auto_unroll_max_step", "ot", 512], ["unroll_explicit", "ot", 1]]}], "r": [[0.0050937399500000004], 0, 2.508607864379883, 1576422962.4477918], "v": 0.1}
{"i": ["cuda", "schedule_conv3d_transpose_nchw_cuda", [[1, 64, 40, 40, 40], [64, 64, 3, 3, 3], [1, 1, 1], [1, 1, 1], [0, 0, 0], "float32"], {}, ["schedule_conv3d_transpose_nchw_cuda", [1, 64, 40, 40, 40], [64, 64, 3, 3, 3], [1, 1, 1], [1, 1, 1], [0, 0, 0], "float32"], {"i": 10566812818, "t": "", "c": null, "e": [["tile_f", "sp", [-1, 1, 4, 4]], ["tile_d", "sp", [-1, 1, 1, 2]], ["tile_y", "sp", [-1, 1, 5, 2]], ["tile_x", "sp", [-1, 2, 5, 4]], ["tile_rc", "sp", [-1, 1]], ["tile_rd", "sp", [-1, 3]], ["tile_ry", "sp", [-1, 3]], ["tile_rx", "sp", [-1, 1]], ["auto_unroll_max_step", "ot", 512], ["unroll_explicit", "ot", 1]]}], "r": [[0.004935385523809524], 0, 2.972554922103882, 1576422963.4341664], "v": 0.1}
{"i": ["cuda", "schedule_conv3d_transpose_nchw_cuda", [[1, 64, 40, 40, 40], [64, 64, 3, 3, 3], [1, 1, 1], [1, 1, 1], [0, 0, 0], "float32"], {}, ["schedule_conv3d_transpose_nchw_cuda", [1, 64, 40, 40, 40], [64, 64, 3, 3, 3], [1, 1, 1], [1, 1, 1], [0, 0, 0], "float32"], {"i": 11473559194, "t": "", "c": null, "e": [["tile_f", "sp", [-1, 1, 2, 2]], ["tile_d", "sp", [-1, 1, 1, 10]], ["tile_y", "sp", [-1, 1, 4, 1]], ["tile_x", "sp", [-1, 2, 2, 5]], ["tile_rc", "sp", [-1, 1]], ["tile_rd", "sp", [-1, 1]], ["tile_ry", "sp", [-1, 3]], ["tile_rx", "sp", [-1, 3]], ["auto_unroll_max_step", "ot", 512], ["unroll_explicit", "ot", 1]]}], "r": [[0.051627246], 0, 5.4586732387542725, 1576422965.6665778], "v": 0.1}
{"i": ["cuda", "schedule_conv3d_transpose_nchw_cuda", [[1, 64, 40, 40, 40], [64, 64, 3, 3, 3], [1, 1, 1], [1, 1, 1], [0, 0, 0], "float32"], {}, ["schedule_conv3d_transpose_nchw_cuda", [1, 64, 40, 40, 40], [64, 64, 3, 3, 3], [1, 1, 1], [1, 1, 1], [0, 0, 0], "float32"], {"i": 11164129003, "t": "", "c": null, "e": [["tile_f", "sp", [-1, 2, 2, 4]], ["tile_d", "sp", [-1, 1, 1, 5]], ["tile_y", "sp", [-1, 1, 1, 4]], ["tile_x", "sp", [-1, 2, 10, 2]], ["tile_rc", "sp", [-1, 1]], ["tile_rd", "sp", [-1, 3]], ["tile_ry", "sp", [-1, 1]], ["tile_rx", "sp", [-1, 3]], ["auto_unroll_max_step", "ot", 512], ["unroll_explicit", "ot", 1]]}], "r": [[0.2099807655], 0, 6.845910310745239, 1576422969.3401291], "v": 0.1}
{"i": ["cuda", "schedule_conv3d_transpose_nchw_cuda", [[1, 64, 40, 40, 40], [64, 64, 3, 3, 3], [1, 1, 1], [1, 1, 1], [0, 0, 0], "float32"], {}, ["schedule_conv3d_transpose_nchw_cuda", [1, 64, 40, 40, 40], [64, 64, 3, 3, 3], [1, 1, 1], [1, 1, 1], [0, 0, 0], "float32"], {"i": 13871979111, "t": "", "c": null, "e": [["tile_f", "sp", [-1, 1, 4, 2]], ["tile_d", "sp", [-1, 1, 1, 4]], ["tile_y", "sp", [-1, 1, 5, 2]], ["tile_x", "sp", [-1, 2, 5, 2]], ["tile_rc", "sp", [-1, 1]], ["tile_rd", "sp", [-1, 1]], ["tile_ry", "sp", [-1, 3]], ["tile_rx", "sp", [-1, 3]], ["auto_unroll_max_step", "ot", 1500], ["unroll_explicit", "ot", 1]]}], "r": [[0.004583144772727273], 0, 2.948610544204712, 1576422970.4227028], "v": 0.1}
{"i": ["cuda", "schedule_conv3d_transpose_nchw_cuda", [[1, 64, 40, 40, 40], [64, 64, 3, 3, 3], [1, 1, 1], [1, 1, 1], [0, 0, 0], "float32"], {}, ["schedule_conv3d_transpose_nchw_cuda", [1, 64, 40, 40, 40], [64, 64, 3, 3, 3], [1, 1, 1], [1, 1, 1], [0, 0, 0], "float32"], {"i": 11164128967, "t": "", "c": null, "e": [["tile_f", "sp", [-1, 2, 8, 1]], ["tile_d", "sp", [-1, 1, 1, 5]], ["tile_y", "sp", [-1, 1, 1, 4]], ["tile_x", "sp", [-1, 2, 10, 2]], ["tile_rc", "sp", [-1, 1]], ["tile_rd", "sp", [-1, 3]], ["tile_ry", "sp", [-1, 1]], ["tile_rx", "sp", [-1, 3]], ["auto_unroll_max_step", "ot", 512], ["unroll_explicit", "ot", 1]]}], "r": [[0.007273621928571429], 0, 3.4689700603485107, 1576422971.4895988], "v": 0.1}
{"i": ["cuda", "schedule_conv3d_transpose_nchw_cuda", [[1, 64, 40, 40, 40], [64, 64, 3, 3, 3], [1, 1, 1], [1, 1, 1], [0, 0, 0], "float32"], {}, ["schedule_conv3d_transpose_nchw_cuda", [1, 64, 40, 40, 40], [64, 64, 3, 3, 3], [1, 1, 1], [1, 1, 1], [0, 0, 0], "float32"], {"i": 13888565898, "t": "", "c": null, "e": [["tile_f", "sp", [-1, 1, 8, 1]], ["tile_d", "sp", [-1, 1, 1, 10]], ["tile_y", "sp", [-1, 1, 1, 2]], ["tile_x", "sp", [-1, 2, 2, 10]], ["tile_rc", "sp", [-1, 1]], ["tile_rd", "sp", [-1, 1]], ["tile_ry", "sp", [-1, 3]], ["tile_rx", "sp", [-1, 3]], ["auto_unroll_max_step", "ot", 1500], ["unroll_explicit", "ot", 1]]}], "r": [[0.08041446375], 0, 9.254438638687134, 1576422974.3309534], "v": 0.1}
{"i": ["cuda", "schedule_conv3d_transpose_nchw_cuda", [[1, 64, 40, 40, 40], [64, 64, 3, 3, 3], [1, 1, 1], [1, 1, 1], [0, 0, 0], "float32"], {}, ["schedule_conv3d_transpose_nchw_cuda", [1, 64, 40, 40, 40], [64, 64, 3, 3, 3], [1, 1, 1], [1, 1, 1], [0, 0, 0], "float32"], {"i": 11469322268, "t": "", "c": null, "e": [["tile_f", "sp", [-1, 1, 2, 8]], ["tile_d", "sp", [-1, 1, 1, 2]], ["tile_y", "sp", [-1, 1, 10, 1]], ["tile_x", "sp", [-1, 1, 5, 4]], ["tile_rc", "sp", [-1, 1]], ["tile_rd", "sp", [-1, 1]], ["tile_ry", "sp", [-1, 3]], ["tile_rx", "sp", [-1, 3]], ["auto_unroll_max_step", "ot", 512], ["unroll_explicit", "ot", 1]]}], "r": [[0.0042513865151515146], 0, 2.1203536987304688, 1576423216.0993595], "v": 0.1}
{"i": ["cuda", "schedule_conv3d_transpose_nchw_cuda", [[1, 64, 40, 40, 40], [64, 64, 3, 3, 3], [1, 1, 1], [1, 1, 1], [0, 0, 0], "float32"], {}, ["schedule_conv3d_transpose_nchw_cuda", [1, 64, 40, 40, 40], [64, 64, 3, 3, 3], [1, 1, 1], [1, 1, 1], [0, 0, 0], "float32"], {"i": 11469821050, "t": "", "c": null, "e": [["tile_f", "sp", [-1, 1, 4, 4]], ["tile_d", "sp", [-1, 1, 1, 4]], ["tile_y", "sp", [-1, 1, 5, 1]], ["tile_x", "sp", [-1, 2, 5, 4]], ["tile_rc", "sp", [-1, 1]], ["tile_rd", "sp", [-1, 1]], ["tile_ry", "sp", [-1, 3]], ["tile_rx", "sp", [-1, 3]], ["auto_unroll_max_step", "ot", 512], ["unroll_explicit", "ot", 1]]}], "r": [[0.0032033965], 0, 2.567850112915039, 1576423217.0791996], "v": 0.1}
{"i": ["cuda", "schedule_conv3d_transpose_nchw_cuda", [[1, 64, 40, 40, 40], [64, 64, 3, 3, 3], [1, 1, 1], [1, 1, 1], [0, 0, 0], "float32"], {}, ["schedule_conv3d_transpose_nchw_cuda", [1, 64, 40, 40, 40], [64, 64, 3, 3, 3], [1, 1, 1], [1, 1, 1], [0, 0, 0], "float32"], {"i": 11469463359, "t": "", "c": null, "e": [["tile_f", "sp", [-1, 1, 4, 2]], ["tile_d", "sp", [-1, 1, 1, 2]], ["tile_y", "sp", [-1, 1, 10, 2]], ["tile_x", "sp", [-1, 1, 5, 4]], ["tile_rc", "sp", [-1, 1]], ["tile_rd", "sp", [-1, 1]], ["tile_ry", "sp", [-1, 3]], ["tile_rx", "sp", [-1, 3]], ["auto_unroll_max_step", "ot", 512], ["unroll_explicit", "ot", 1]]}], "r": [[0.005765954611111112], 0, 2.199058771133423, 1576423218.0609264], "v": 0.1}
{"i": ["cuda", "schedule_conv3d_transpose_nchw_cuda", [[1, 64, 40, 40, 40], [64, 64, 3, 3, 3], [1, 1, 1], [1, 1, 1], [0, 0, 0], "float32"], {}, ["schedule_conv3d_transpose_nchw_cuda", [1, 64, 40, 40, 40], [64, 64, 3, 3, 3], [1, 1, 1], [1, 1, 1], [0, 0, 0], "float32"], {"i": 11470358650, "t": "", "c": null, "e": [["tile_f", "sp", [-1, 1, 4, 4]], ["tile_d", "sp", [-1, 1, 1, 4]], ["tile_y", "sp", [-1, 1, 5, 1]], ["tile_x", "sp", [-1, 1, 10, 4]], ["tile_rc", "sp", [-1, 1]], ["tile_rd", "sp", [-1, 1]], ["tile_ry", "sp", [-1, 3]], ["tile_rx", "sp", [-1, 3]], ["auto_unroll_max_step", "ot", 512], ["unroll_explicit", "ot", 1]]}], "r": [[0.0028484325], 0, 2.1463675498962402, 1576423218.970666], "v": 0.1}
{"i": ["cuda", "schedule_conv3d_transpose_nchw_cuda", [[1, 64, 40, 40, 40], [64, 64, 3, 3, 3], [1, 1, 1], [1, 1, 1], [0, 0, 0], "float32"], {}, ["schedule_conv3d_transpose_nchw_cuda", [1, 64, 40, 40, 40], [64, 64, 3, 3, 3], [1, 1, 1], [1, 1, 1], [0, 0, 0], "float32"], {"i": 11506524159, "t": "", "c": null, "e": [["tile_f", "sp", [-1, 1, 4, 2]], ["tile_d", "sp", [-1, 1, 1, 2]], ["tile_y", "sp", [-1, 1, 4, 2]], ["tile_x", "sp", [-1, 2, 5, 2]], ["tile_rc", "sp", [-1, 2]], ["tile_rd", "sp", [-1, 1]], ["tile_ry", "sp", [-1, 3]], ["tile_rx", "sp", [-1, 3]], ["auto_unroll_max_step", "ot", 512], ["unroll_explicit", "ot", 1]]}], "r": [[0.0028640726285714285], 0, 2.208887815475464, 1576423219.8913863], "v": 0.1}
{"i": ["cuda", "schedule_conv3d_transpose_nchw_cuda", [[1, 64, 40, 40, 40], [64, 64, 3, 3, 3], [1, 1, 1], [1, 1, 1], [0, 0, 0], "float32"], {}, ["schedule_conv3d_transpose_nchw_cuda", [1, 64, 40, 40, 40], [64, 64, 3, 3, 3], [1, 1, 1], [1, 1, 1], [0, 0, 0], "float32"], {"i": 9061373050, "t": "", "c": null, "e": [["tile_f", "sp", [-1, 1, 4, 4]], ["tile_d", "sp", [-1, 1, 1, 4]], ["tile_y", "sp", [-1, 1, 5, 1]], ["tile_x", "sp", [-1, 2, 5, 4]], ["tile_rc", "sp", [-1, 1]], ["tile_rd", "sp", [-1, 1]], ["tile_ry", "sp", [-1, 3]], ["tile_rx", "sp", [-1, 3]], ["auto_unroll_max_step", "ot", 0], ["unroll_explicit", "ot", 1]]}], "r": [[0.00522855515], 0, 2.0187716484069824, 1576423220.8530424], "v": 0.1}
{"i": ["cuda", "schedule_conv3d_transpose_nchw_cuda", [[1, 64, 40, 40, 40], [64, 64, 3, 3, 3], [1, 1, 1], [1, 1, 1], [0, 0, 0], "float32"], {}, ["schedule_conv3d_transpose_nchw_cuda", [1, 64, 40, 40, 40], [64, 64, 3, 3, 3], [1, 1, 1], [1, 1, 1], [0, 0, 0], "float32"], {"i": 9060874268, "t": "", "c": null, "e": [["tile_f", "sp", [-1, 1, 2, 8]], ["tile_d", "sp", [-1, 1, 1, 2]], ["tile_y", "sp", [-1, 1, 10, 1]], ["tile_x", "sp", [-1, 1, 5, 4]], ["tile_rc", "sp", [-1, 1]], ["tile_rd", "sp", [-1, 1]], ["tile_ry", "sp", [-1, 3]], ["tile_rx", "sp", [-1, 3]], ["auto_unroll_max_step", "ot", 0], ["unroll_explicit", "ot", 1]]}], "r": [[0.003587183285714286], 0, 1.8830749988555908, 1576423221.7567897], "v": 0.1}
{"i": ["cuda", "schedule_conv3d_transpose_nchw_cuda", [[1, 64, 40, 40, 40], [64, 64, 3, 3, 3], [1, 1, 1], [1, 1, 1], [0, 0, 0], "float32"], {}, ["schedule_conv3d_transpose_nchw_cuda", [1, 64, 40, 40, 40], [64, 64, 3, 3, 3], [1, 1, 1], [1, 1, 1], [0, 0, 0], "float32"], {"i": 9061015359, "t": "", "c": null, "e": [["tile_f", "sp", [-1, 1, 4, 2]], ["tile_d", "sp", [-1, 1, 1, 2]], ["tile_y", "sp", [-1, 1, 10, 2]], ["tile_x", "sp", [-1, 1, 5, 4]], ["tile_rc", "sp", [-1, 1]], ["tile_rd", "sp", [-1, 1]], ["tile_ry", "sp", [-1, 3]], ["tile_rx", "sp", [-1, 3]], ["auto_unroll_max_step", "ot", 0], ["unroll_explicit", "ot", 1]]}], "r": [[0.007897534384615384], 0, 1.7547540664672852, 1576423222.6886604], "v": 0.1}
{"i": ["cuda", "schedule_conv3d_transpose_nchw_cuda", [[1, 64, 40, 40, 40], [64, 64, 3, 3, 3], [1, 1, 1], [1, 1, 1], [0, 0, 0], "float32"], {}, ["schedule_conv3d_transpose_nchw_cuda", [1, 64, 40, 40, 40], [64, 64, 3, 3, 3], [1, 1, 1], [1, 1, 1], [0, 0, 0], "float32"], {"i": 11470502542, "t": "", "c": null, "e": [["tile_f", "sp", [-1, 1, 4, 4]], ["tile_d", "sp", [-1, 2, 1, 1]], ["tile_y", "sp", [-1, 1, 4, 2]], ["tile_x", "sp", [-1, 1, 10, 4]], ["tile_rc", "sp", [-1, 1]], ["tile_rd", "sp", [-1, 1]], ["tile_ry", "sp", [-1, 3]], ["tile_rx", "sp", [-1, 3]], ["auto_unroll_max_step", "ot", 512], ["unroll_explicit", "ot", 1]]}], "r": [[0.003420690133333333], 0, 2.1187057495117188, 1576423223.5979757], "v": 0.1}
{"i": ["cuda", "schedule_conv3d_transpose_nchw_cuda", [[1, 64, 40, 40, 40], [64, 64, 3, 3, 3], [1, 1, 1], [1, 1, 1], [0, 0, 0], "float32"], {}, ["schedule_conv3d_transpose_nchw_cuda", [1, 64, 40, 40, 40], [64, 64, 3, 3, 3], [1, 1, 1], [1, 1, 1], [0, 0, 0], "float32"], {"i": 11496929490, "t": "", "c": null, "e": [["tile_f", "sp", [-1, 1, 8, 1]], ["tile_d", "sp", [-1, 1, 1, 4]], ["tile_y", "sp", [-1, 1, 2, 4]], ["tile_x", "sp", [-1, 2, 10, 1]], ["tile_rc", "sp", [-1, 2]], ["tile_rd", "sp", [-1, 1]], ["tile_ry", "sp", [-1, 3]], ["tile_rx", "sp", [-1, 3]], ["auto_unroll_max_step", "ot", 512], ["unroll_explicit", "ot", 1]]}], "r": [[0.005723804888888889], 0, 2.321070432662964, 1576423224.5706], "v": 0.1}
{"i": ["cuda", "schedule_conv3d_transpose_nchw_cuda", [[1, 64, 40, 40, 40], [64, 64, 3, 3, 3], [1, 1, 1], [1, 1, 1], [0, 0, 0], "float32"], {}, ["schedule_conv3d_transpose_nchw_cuda", [1, 64, 40, 40, 40], [64, 64, 3, 3, 3], [1, 1, 1], [1, 1, 1], [0, 0, 0], "float32"], {"i": 4244477050, "t": "", "c": null, "e": [["tile_f", "sp", [-1, 1, 4, 4]], ["tile_d", "sp", [-1, 1, 1, 4]], ["tile_y", "sp", [-1, 1, 5, 1]], ["tile_x", "sp", [-1, 2, 5, 4]], ["tile_rc", "sp", [-1, 1]], ["tile_rd", "sp", [-1, 1]], ["tile_ry", "sp", [-1, 3]], ["tile_rx", "sp", [-1, 3]], ["auto_unroll_max_step", "ot", 512], ["unroll_explicit", "ot", 0]]}], "r": [[0.0053787639473684215], 0, 2.0984065532684326, 1576423225.5968845], "v": 0.1}
{"i": ["cuda", "schedule_conv3d_transpose_nchw_cuda", [[1, 64, 40, 40, 40], [64, 64, 3, 3, 3], [1, 1, 1], [1, 1, 1], [0, 0, 0], "float32"], {}, ["schedule_conv3d_transpose_nchw_cuda", [1, 64, 40, 40, 40], [64, 64, 3, 3, 3], [1, 1, 1], [1, 1, 1], [0, 0, 0], "float32"], {"i": 11480750439, "t": "", "c": null, "e": [["tile_f", "sp", [-1, 1, 4, 2]], ["tile_d", "sp", [-1, 1, 1, 1]], ["tile_y", "sp", [-1, 1, 10, 2]], ["tile_x", "sp", [-1, 1, 4, 10]], ["tile_rc", "sp", [-1, 1]], ["tile_rd", "sp", [-1, 1]], ["tile_ry", "sp", [-1, 3]], ["tile_rx", "sp", [-1, 3]], ["auto_unroll_max_step", "ot", 512], ["unroll_explicit", "ot", 1]]}], "r": [[0.0039840977307692305], 0, 2.203064441680908, 1576423226.618388], "v": 0.1}
{"i": ["cuda", "schedule_conv3d_transpose_nchw_cuda", [[1, 64, 40, 40, 40], [64, 64, 3, 3, 3], [1, 1, 1], [1, 1, 1], [0, 0, 0], "float32"], {}, ["schedule_conv3d_transpose_nchw_cuda", [1, 64, 40, 40, 40], [64, 64, 3, 3, 3], [1, 1, 1], [1, 1, 1], [0, 0, 0], "float32"], {"i": 4243978268, "t": "", "c": null, "e": [["tile_f", "sp", [-1, 1, 2, 8]], ["tile_d", "sp", [-1, 1, 1, 2]], ["tile_y", "sp", [-1, 1, 10, 1]], ["tile_x", "sp", [-1, 1, 5, 4]], ["tile_rc", "sp", [-1, 1]], ["tile_rd", "sp", [-1, 1]], ["tile_ry", "sp", [-1, 3]], ["tile_rx", "sp", [-1, 3]], ["auto_unroll_max_step", "ot", 512], ["unroll_explicit", "ot", 0]]}], "r": [[0.004120214285714285], 0, 1.8200623989105225, 1576423229.971613], "v": 0.1}
{"i": ["cuda", "schedule_conv3d_transpose_nchw_cuda", [[1, 64, 40, 40, 40], [64, 64, 3, 3, 3], [1, 1, 1], [1, 1, 1], [0, 0, 0], "float32"], {}, ["schedule_conv3d_transpose_nchw_cuda", [1, 64, 40, 40, 40], [64, 64, 3, 3, 3], [1, 1, 1], [1, 1, 1], [0, 0, 0], "float32"], {"i": 11517663567, "t": "", "c": null, "e": [["tile_f", "sp", [-1, 1, 4, 2]], ["tile_d", "sp", [-1, 4, 1, 1]], ["tile_y", "sp", [-1, 1, 5, 1]], ["tile_x", "sp", [-1, 1, 4, 5]], ["tile_rc", "sp", [-1, 2]], ["tile_rd", "sp", [-1, 1]], ["tile_ry", "sp", [-1, 3]], ["tile_rx", "sp", [-1, 3]], ["auto_unroll_max_step", "ot", 512], ["unroll_explicit", "ot", 1]]}], "r": [[0.005654078833333334], 0, 2.4715394973754883, 1576423230.9837158], "v": 0.1}
{"i": ["cuda", "schedule_conv3d_transpose_nchw_cuda", [[1, 64, 40, 40, 40], [64, 64, 3, 3, 3], [1, 1, 1], [1, 1, 1], [0, 0, 0], "float32"], {}, ["schedule_conv3d_transpose_nchw_cuda", [1, 64, 40, 40, 40], [64, 64, 3, 3, 3], [1, 1, 1], [1, 1, 1], [0, 0, 0], "float32"], {"i": 4245014650, "t": "", "c": null, "e": [["tile_f", "sp", [-1, 1, 4, 4]], ["tile_d", "sp", [-1, 1, 1, 4]], ["tile_y", "sp", [-1, 1, 5, 1]], ["tile_x", "sp", [-1, 1, 10, 4]], ["tile_rc", "sp", [-1, 1]], ["tile_rd", "sp", [-1, 1]], ["tile_ry", "sp", [-1, 3]], ["tile_rx", "sp", [-1, 3]], ["auto_unroll_max_step", "ot", 512], ["unroll_explicit", "ot", 0]]}], "r": [[0.003386507], 0, 1.7331287860870361, 1576423231.9258027], "v": 0.1}
{"i": ["cuda", "schedule_conv3d_transpose_nchw_cuda", [[1, 64, 40, 40, 40], [64, 64, 3, 3, 3], [1, 1, 1], [1, 1, 1], [0, 0, 0], "float32"], {}, ["schedule_conv3d_transpose_nchw_cuda", [1, 64, 40, 40, 40], [64, 64, 3, 3, 3], [1, 1, 1], [1, 1, 1], [0, 0, 0], "float32"], {"i": 9061910650, "t": "", "c": null, "e": [["tile_f", "sp", [-1, 1, 4, 4]], ["tile_d", "sp", [-1, 1, 1, 4]], ["tile_y", "sp", [-1, 1, 5, 1]], ["tile_x", "sp", [-1, 1, 10, 4]], ["tile_rc", "sp", [-1, 1]], ["tile_rd", "sp", [-1, 1]], ["tile_ry", "sp", [-1, 3]], ["tile_rx", "sp", [-1, 3]], ["auto_unroll_max_step", "ot", 0], ["unroll_explicit", "ot", 1]]}], "r": [[0.0033915868], 0, 1.613595962524414, 1576423232.8390765], "v": 0.1}
{"i": ["cuda", "schedule_conv3d_transpose_nchw_cuda", [[1, 64, 40, 40, 40], [64, 64, 3, 3, 3], [1, 1, 1], [1, 1, 1], [0, 0, 0], "float32"], {}, ["schedule_conv3d_transpose_nchw_cuda", [1, 64, 40, 40, 40], [64, 64, 3, 3, 3], [1, 1, 1], [1, 1, 1], [0, 0, 0], "float32"], {"i": 11507599359, "t": "", "c": null, "e": [["tile_f", "sp", [-1, 1, 4, 2]], ["tile_d", "sp", [-1, 1, 1, 2]], ["tile_y", "sp", [-1, 1, 4, 2]], ["tile_x", "sp", [-1, 1, 10, 2]], ["tile_rc", "sp", [-1, 2]], ["tile_rd", "sp", [-1, 1]], ["tile_ry", "sp", [-1, 3]], ["tile_rx", "sp", [-1, 3]], ["auto_unroll_max_step", "ot", 512], ["unroll_explicit", "ot", 1]]}], "r": [[0.003465042655172414], 0, 2.1670520305633545, 1576423233.8168359], "v": 0.1}
{"i": ["cuda", "schedule_conv3d_transpose_nchw_cuda", [[1, 64, 40, 40, 40], [64, 64, 3, 3, 3], [1, 1, 1], [1, 1, 1], [0, 0, 0], "float32"], {}, ["schedule_conv3d_transpose_nchw_cuda", [1, 64, 40, 40, 40], [64, 64, 3, 3, 3], [1, 1, 1], [1, 1, 1], [0, 0, 0], "float32"], {"i": 11507426151, "t": "", "c": null, "e": [["tile_f", "sp", [-1, 1, 4, 2]], ["tile_d", "sp", [-1, 1, 1, 4]], ["tile_y", "sp", [-1, 1, 4, 1]], ["tile_x", "sp", [-1, 1, 10, 2]], ["tile_rc", "sp", [-1, 2]], ["tile_rd", "sp", [-1, 1]], ["tile_ry", "sp", [-1, 3]], ["tile_rx", "sp", [-1, 3]], ["auto_unroll_max_step", "ot", 512], ["unroll_explicit", "ot", 1]]}], "r": [[0.005662691277777777], 0, 2.20015811920166, 1576423234.8178396], "v": 0.1}
{"i": ["cuda", "schedule_conv3d_transpose_nchw_cuda", [[1, 64, 40, 40, 40], [64, 64, 3, 3, 3], [1, 1, 1], [1, 1, 1], [0, 0, 0], "float32"], {}, ["schedule_conv3d_transpose_nchw_cuda", [1, 64, 40, 40, 40], [64, 64, 3, 3, 3], [1, 1, 1], [1, 1, 1], [0, 0, 0], "float32"], {"i": 9072302439, "t": "", "c": null, "e": [["tile_f", "sp", [-1, 1, 4, 2]], ["tile_d", "sp", [-1, 1, 1, 1]], ["tile_y", "sp", [-1, 1, 10, 2]], ["tile_x", "sp", [-1, 1, 4, 10]], ["tile_rc", "sp", [-1, 1]], ["tile_rd", "sp", [-1, 1]], ["tile_ry", "sp", [-1, 3]], ["tile_rx", "sp", [-1, 3]], ["auto_unroll_max_step", "ot", 0], ["unroll_explicit", "ot", 1]]}], "r": [[0.0037602241851851853], 0, 1.7842497825622559, 1576423235.709545], "v": 0.1}
{"i": ["cuda", "schedule_conv3d_transpose_nchw_cuda", [[1, 64, 40, 40, 40], [64, 64, 3, 3, 3], [1, 1, 1], [1, 1, 1], [0, 0, 0], "float32"], {}, ["schedule_conv3d_transpose_nchw_cuda", [1, 64, 40, 40, 40], [64, 64, 3, 3, 3], [1, 1, 1], [1, 1, 1], [0, 0, 0], "float32"], {"i": 11463490795, "t": "", "c": null, "e": [["tile_f", "sp", [-1, 1, 8, 2]], ["tile_d", "sp", [-1, 1, 1, 4]], ["tile_y", "sp", [-1, 1, 2, 2]], ["tile_x", "sp", [-1, 2, 5, 2]], ["tile_rc", "sp", [-1, 1]], ["tile_rd", "sp", [-1, 1]], ["tile_ry", "sp", [-1, 3]], ["tile_rx", "sp", [-1, 3]], ["auto_unroll_max_step", "ot", 512], ["unroll_explicit", "ot", 1]]}], "r": [[0.00400741048], 0, 2.089738607406616, 1576423236.6755583], "v": 0.1}
{"i": ["cuda", "schedule_conv3d_transpose_nchw_cuda", [[1, 64, 40, 40, 40], [64, 64, 3, 3, 3], [1, 1, 1], [1, 1, 1], [0, 0, 0], "float32"], {}, ["schedule_conv3d_transpose_nchw_cuda", [1, 64, 40, 40, 40], [64, 64, 3, 3, 3], [1, 1, 1], [1, 1, 1], [0, 0, 0], "float32"], {"i": 11464982650, "t": "", "c": null, "e": [["tile_f", "sp", [-1, 1, 4, 4]], ["tile_d", "sp", [-1, 1, 1, 4]], ["tile_y", "sp", [-1, 1, 5, 1]], ["tile_x", "sp", [-1, 2, 10, 2]], ["tile_rc", "sp", [-1, 1]], ["tile_rd", "sp", [-1, 1]], ["tile_ry", "sp", [-1, 3]], ["tile_rx", "sp", [-1, 3]], ["auto_unroll_max_step", "ot", 512], ["unroll_explicit", "ot", 1]]}], "r": [[0.00314763125], 0, 2.050243616104126, 1576423237.6043375], "v": 0.1}
{"i": ["cuda", "schedule_conv3d_transpose_nchw_cuda", [[1, 64, 40, 40, 40], [64, 64, 3, 3, 3], [1, 1, 1], [1, 1, 1], [0, 0, 0], "float32"], {}, ["schedule_conv3d_transpose_nchw_cuda", [1, 64, 40, 40, 40], [64, 64, 3, 3, 3], [1, 1, 1], [1, 1, 1], [0, 0, 0], "float32"], {"i": 10566154239, "t": "", "c": null, "e": [["tile_f", "sp", [-1, 1, 4, 2]], ["tile_d", "sp", [-1, 1, 1, 2]], ["tile_y", "sp", [-1, 1, 10, 1]], ["tile_x", "sp", [-1, 1, 5, 4]], ["tile_rc", "sp", [-1, 1]], ["tile_rd", "sp", [-1, 3]], ["tile_ry", "sp", [-1, 3]], ["tile_rx", "sp", [-1, 1]], ["auto_unroll_max_step", "ot", 512], ["unroll_explicit", "ot", 1]]}], "r": [[0.004352723652173913], 0, 2.1411566734313965, 1576423238.536239], "v": 0.1}
{"i": ["cuda", "schedule_conv3d_transpose_nchw_cuda", [[1, 64, 40, 40, 40], [64, 64, 3, 3, 3], [1, 1, 1], [1, 1, 1], [0, 0, 0], "float32"], {}, ["schedule_conv3d_transpose_nchw_cuda", [1, 64, 40, 40, 40], [64, 64, 3, 3, 3], [1, 1, 1], [1, 1, 1], [0, 0, 0], "float32"], {"i": 11463610239, "t": "", "c": null, "e": [["tile_f", "sp", [-1, 1, 4, 2]], ["tile_d", "sp", [-1, 1, 1, 2]], ["tile_y", "sp", [-1, 1, 5, 4]], ["tile_x", "sp", [-1, 2, 5, 2]], ["tile_rc", "sp", [-1, 1]], ["tile_rd", "sp", [-1, 1]], ["tile_ry", "sp", [-1, 3]], ["tile_rx", "sp", [-1, 3]], ["auto_unroll_max_step", "ot", 512], ["unroll_explicit", "ot", 1]]}], "r": [[0.0055606257777777775], 0, 2.1079347133636475, 1576423239.480427], "v": 0.1}
{"i": ["cuda", "schedule_conv3d_transpose_nchw_cuda", [[1, 64, 40, 40, 40], [64, 64, 3, 3, 3], [1, 1, 1], [1, 1, 1], [0, 0, 0], "float32"], {}, ["schedule_conv3d_transpose_nchw_cuda", [1, 64, 40, 40, 40], [64, 64, 3, 3, 3], [1, 1, 1], [1, 1, 1], [0, 0, 0], "float32"], {"i": 10308627898, "t": "", "c": null, "e": [["tile_f", "sp", [-1, 1, 4, 4]], ["tile_d", "sp", [-1, 1, 1, 1]], ["tile_y", "sp", [-1, 1, 8, 1]], ["tile_x", "sp", [-1, 2, 5, 4]], ["tile_rc", "sp", [-1, 2]], ["tile_rd", "sp", [-1, 1]], ["tile_ry", "sp", [-1, 3]], ["tile_rx", "sp", [-1, 1]], ["auto_unroll_max_step", "ot", 512], ["unroll_explicit", "ot", 1]]}], "r": [[0.004584937727272727], 0, 1.8922078609466553, 1576423240.4832337], "v": 0.1}
{"i": ["cuda", "schedule_conv3d_transpose_nchw_cuda", [[1, 64, 40, 40, 40], [64, 64, 3, 3, 3], [1, 1, 1], [1, 1, 1], [0, 0, 0], "float32"], {}, ["schedule_conv3d_transpose_nchw_cuda", [1, 64, 40, 40, 40], [64, 64, 3, 3, 3], [1, 1, 1], [1, 1, 1], [0, 0, 0], "float32"], {"i": 11516592210, "t": "", "c": null, "e": [["tile_f", "sp", [-1, 1, 8, 1]], ["tile_d", "sp", [-1, 1, 1, 4]], ["tile_y", "sp", [-1, 1, 5, 1]], ["tile_x", "sp", [-1, 2, 2, 5]], ["tile_rc", "sp", [-1, 2]], ["tile_rd", "sp", [-1, 1]], ["tile_ry", "sp", [-1, 3]], ["tile_rx", "sp", [-1, 3]], ["auto_unroll_max_step", "ot", 512], ["unroll_explicit", "ot", 1]]}], "r": [[0.004757146636363636], 0, 2.729276418685913, 1576423244.437031], "v": 0.1}
{"i": ["cuda", "schedule_conv3d_transpose_nchw_cuda", [[1, 64, 40, 40, 40], [64, 64, 3, 3, 3], [1, 1, 1], [1, 1, 1], [0, 0, 0], "float32"], {}, ["schedule_conv3d_transpose_nchw_cuda", [1, 64, 40, 40, 40], [64, 64, 3, 3, 3], [1, 1, 1], [1, 1, 1], [0, 0, 0], "float32"], {"i": 9088481490, "t": "", "c": null, "e": [["tile_f", "sp", [-1, 1, 8, 1]], ["tile_d", "sp", [-1, 1, 1, 4]], ["tile_y", "sp", [-1, 1, 2, 4]], ["tile_x", "sp", [-1, 2, 10, 1]], ["tile_rc", "sp", [-1, 2]], ["tile_rd", "sp", [-1, 1]], ["tile_ry", "sp", [-1, 3]], ["tile_rx", "sp", [-1, 3]], ["auto_unroll_max_step", "ot", 0], ["unroll_explicit", "ot", 1]]}], "r": [[0.00611835005882353], 0, 1.5610690116882324, 1576423245.391946], "v": 0.1}
{"i": ["cuda", "schedule_conv3d_transpose_nchw_cuda", [[1, 64, 40, 40, 40], [64, 64, 3, 3, 3], [1, 1, 1], [1, 1, 1], [0, 0, 0], "float32"], {}, ["schedule_conv3d_transpose_nchw_cuda", [1, 64, 40, 40, 40], [64, 64, 3, 3, 3], [1, 1, 1], [1, 1, 1], [0, 0, 0], "float32"], {"i": 11512327822, "t": "", "c": null, "e": [["tile_f", "sp", [-1, 1, 4, 4]], ["tile_d", "sp", [-1, 2, 1, 1]], ["tile_y", "sp", [-1, 1, 10, 1]], ["tile_x", "sp", [-1, 1, 5, 4]], ["tile_rc", "sp", [-1, 2]], ["tile_rd", "sp", [-1, 1]], ["tile_ry", "sp", [-1, 3]], ["tile_rx", "sp", [-1, 3]], ["auto_unroll_max_step", "ot", 512], ["unroll_explicit", "ot", 1]]}], "r": [[0.004082459399999999], 0, 2.1200571060180664, 1576423246.35376], "v": 0.1}
{"i": ["cuda", "schedule_conv3d_transpose_nchw_cuda", [[1, 64, 40, 40, 40], [64, 64, 3, 3, 3], [1, 1, 1], [1, 1, 1], [0, 0, 0], "float32"], {}, ["schedule_conv3d_transpose_nchw_cuda", [1, 64, 40, 40, 40], [64, 64, 3, 3, 3], [1, 1, 1], [1, 1, 1], [0, 0, 0], "float32"], {"i": 4245158542, "t": "", "c": null, "e": [["tile_f", "sp", [-1, 1, 4, 4]], ["tile_d", "sp", [-1, 2, 1, 1]], ["tile_y", "sp", [-1, 1, 4, 2]], ["tile_x", "sp", [-1, 1, 10, 4]], ["tile_rc", "sp", [-1, 1]], ["tile_rd", "sp", [-1, 1]], ["tile_ry", "sp", [-1, 3]], ["tile_rx", "sp", [-1, 3]], ["auto_unroll_max_step", "ot", 512], ["unroll_explicit", "ot", 0]]}], "r": [[0.0032777765483870966], 0, 1.642075538635254, 1576423247.2793877], "v": 0.1}
{"i": ["cuda", "schedule_conv3d_transpose_nchw_cuda", [[1, 64, 40, 40, 40], [64, 64, 3, 3, 3], [1, 1, 1], [1, 1, 1], [0, 0, 0], "float32"], {}, ["schedule_conv3d_transpose_nchw_cuda", [1, 64, 40, 40, 40], [64, 64, 3, 3, 3], [1, 1, 1], [1, 1, 1], [0, 0, 0], "float32"], {"i": 11469218083, "t": "", "c": null, "e": [["tile_f", "sp", [-1, 1, 8, 2]], ["tile_d", "sp", [-1, 1, 1, 10]], ["tile_y", "sp", [-1, 1, 2, 1]], ["tile_x", "sp", [-1, 1, 5, 4]], ["tile_rc", "sp", [-1, 1]], ["tile_rd", "sp", [-1, 1]], ["tile_ry", "sp", [-1, 3]], ["tile_rx", "sp", [-1, 3]], ["auto_unroll_max_step", "ot", 512], ["unroll_explicit", "ot", 1]]}], "r": [[0.0036916928214285713], 0, 2.3156051635742188, 1576423248.2454882], "v": 0.1}
{"i": ["cuda", "schedule_conv3d_transpose_nchw_cuda", [[1, 64, 40, 40, 40], [64, 64, 3, 3, 3], [1, 1, 1], [1, 1, 1], [0, 0, 0], "float32"], {}, ["schedule_conv3d_transpose_nchw_cuda", [1, 64, 40, 40, 40], [64, 64, 3, 3, 3], [1, 1, 1], [1, 1, 1], [0, 0, 0], "float32"], {"i": 11477383822, "t": "", "c": null, "e": [["tile_f", "sp", [-1, 1, 4, 4]], ["tile_d", "sp", [-1, 2, 1, 1]], ["tile_y", "sp", [-1, 1, 10, 1]], ["tile_x", "sp", [-1, 1, 5, 8]], ["tile_rc", "sp", [-1, 1]], ["tile_rd", "sp", [-1, 1]], ["tile_ry", "sp", [-1, 3]], ["tile_rx", "sp", [-1, 3]], ["auto_unroll_max_step", "ot", 512], ["unroll_explicit", "ot", 1]]}], "r": [[0.0036375387499999997], 0, 2.3392281532287598, 1576423249.392227], "v": 0.1}
{"i": ["cuda", "schedule_conv3d_transpose_nchw_cuda", [[1, 64, 40, 40, 40], [64, 64, 3, 3, 3], [1, 1, 1], [1, 1, 1], [0, 0, 0], "float32"], {}, ["schedule_conv3d_transpose_nchw_cuda", [1, 64, 40, 40, 40], [64, 64, 3, 3, 3], [1, 1, 1], [1, 1, 1], [0, 0, 0], "float32"], {"i": 11470058919, "t": "", "c": null, "e": [["tile_f", "sp", [-1, 1, 4, 2]], ["tile_d", "sp", [-1, 1, 1, 1]], ["tile_y", "sp", [-1, 1, 5, 4]], ["tile_x", "sp", [-1, 2, 5, 4]], ["tile_rc", "sp", [-1, 1]], ["tile_rd", "sp", [-1, 1]], ["tile_ry", "sp", [-1, 3]], ["tile_rx", "sp", [-1, 3]], ["auto_unroll_max_step", "ot", 512], ["unroll_explicit", "ot", 1]]}], "r": [[0.00512812995], 0, 2.2159793376922607, 1576423250.3383753], "v": 0.1}
{"i": ["cuda", "schedule_conv3d_transpose_nchw_cuda", [[1, 64, 40, 40, 40], [64, 64, 3, 3, 3], [1, 1, 1], [1, 1, 1], [0, 0, 0], "float32"], {}, ["schedule_conv3d_transpose_nchw_cuda", [1, 64, 40, 40, 40], [64, 64, 3, 3, 3], [1, 1, 1], [1, 1, 1], [0, 0, 0], "float32"], {"i": 10308641338, "t": "", "c": null, "e": [["tile_f", "sp", [-1, 1, 4, 4]], ["tile_d", "sp", [-1, 1, 1, 1]], ["tile_y", "sp", [-1, 1, 10, 1]], ["tile_x", "sp", [-1, 2, 5, 4]], ["tile_rc", "sp", [-1, 2]], ["tile_rd", "sp", [-1, 1]], ["tile_ry", "sp", [-1, 3]], ["tile_rx", "sp", [-1, 1]], ["auto_unroll_max_step", "ot", 512], ["unroll_explicit", "ot", 1]]}], "r": [[0.0054615073157894736], 0, 2.1139895915985107, 1576423251.4062777], "v": 0.1}
{"i": ["cuda", "schedule_conv3d_transpose_nchw_cuda", [[1, 64, 40, 40, 40], [64, 64, 3, 3, 3], [1, 1, 1], [1, 1, 1], [0, 0, 0], "float32"], {}, ["schedule_conv3d_transpose_nchw_cuda", [1, 64, 40, 40, 40], [64, 64, 3, 3, 3], [1, 1, 1], [1, 1, 1], [0, 0, 0], "float32"], {"i": 11464419999, "t": "", "c": null, "e": [["tile_f", "sp", [-1, 1, 4, 2]], ["tile_d", "sp", [-1, 1, 1, 10]], ["tile_y", "sp", [-1, 1, 4, 1]], ["tile_x", "sp", [-1, 1, 10, 2]], ["tile_rc", "sp", [-1, 1]], ["tile_rd", "sp", [-1, 1]], ["tile_ry", "sp", [-1, 3]], ["tile_rx", "sp", [-1, 3]], ["auto_unroll_max_step", "ot", 512], ["unroll_explicit", "ot", 1]]}], "r": [[0.0066489908125], 0, 2.46193528175354, 1576423252.4739952], "v": 0.1}
