third_layer_weight_grad_custom.log
{"i": ["cuda", "schedule_conv3d_nchw_cuda", [[128, 1, 20, 20, 20], [128, 1, 20, 20, 20], [1, 1, 1], [1, 1, 1], [1, 1, 1], 1], {}, ["schedule_conv3d_nchw_cuda", [128, 1, 20, 20, 20], [128, 1, 20, 20, 20], [1, 1, 1], [1, 1, 1], [1, 1, 1], 1], {"i": 1100535560, "t": "", "c": null, "e": [["tile_n", "sp", [-1, 2, 8, 4]], ["tile_f", "sp", [-1, 2, 2, 1]], ["tile_d", "sp", [-1, 1, 3, 1]], ["tile_y", "sp", [-1, 1, 3, 1]], ["tile_x", "sp", [-1, 1, 1, 1]], ["tile_rc", "sp", [-1, 1]], ["tile_rd", "sp", [-1, 1]], ["tile_ry", "sp", [-1, 2]], ["tile_rx", "sp", [-1, 5]], ["auto_unroll_max_step", "ot", 1500], ["unroll_explicit", "ot", 1], ["fuse_yx", "ot", 0]]}], "r": [[0.011860977], 0, 1.415294885635376, 1577631892.4387143], "v": 0.1}
{"i": ["cuda", "schedule_conv3d_nchw_cuda", [[128, 1, 20, 20, 20], [128, 1, 20, 20, 20], [1, 1, 1], [1, 1, 1], [1, 1, 1], 1], {}, ["schedule_conv3d_nchw_cuda", [128, 1, 20, 20, 20], [128, 1, 20, 20, 20], [1, 1, 1], [1, 1, 1], [1, 1, 1], 1], {"i": 520314781, "t": "", "c": null, "e": [["tile_n", "sp", [-1, 1, 32, 2]], ["tile_f", "sp", [-1, 1, 1, 64]], ["tile_d", "sp", [-1, 1, 1, 1]], ["tile_y", "sp", [-1, 3, 1, 1]], ["tile_x", "sp", [-1, 1, 3, 1]], ["tile_rc", "sp", [-1, 1]], ["tile_rd", "sp", [-1, 1]], ["tile_ry", "sp", [-1, 10]], ["tile_rx", "sp", [-1, 5]], ["auto_unroll_max_step", "ot", 1500], ["unroll_explicit", "ot", 0], ["fuse_yx", "ot", 0]]}], "r": [[0.035096575], 0, 2.945868968963623, 1577631894.2315578], "v": 0.1}
{"i": ["cuda", "schedule_conv3d_nchw_cuda", [[128, 1, 20, 20, 20], [128, 1, 20, 20, 20], [1, 1, 1], [1, 1, 1], [1, 1, 1], 1], {}, ["schedule_conv3d_nchw_cuda", [128, 1, 20, 20, 20], [128, 1, 20, 20, 20], [1, 1, 1], [1, 1, 1], [1, 1, 1], 1], {"i": 1626862870, "t": "", "c": null, "e": [["tile_n", "sp", [-1, 1, 2, 4]], ["tile_f", "sp", [-1, 1, 2, 4]], ["tile_d", "sp", [-1, 1, 1, 1]], ["tile_y", "sp", [-1, 1, 1, 1]], ["tile_x", "sp", [-1, 3, 1, 1]], ["tile_rc", "sp", [-1, 1]], ["tile_rd", "sp", [-1, 2]], ["tile_ry", "sp", [-1, 1]], ["tile_rx", "sp", [-1, 2]], ["auto_unroll_max_step", "ot", 1500], ["unroll_explicit", "ot", 0], ["fuse_yx", "ot", 1]]}], "r": [[0.04921494125], 0, 1.6774871349334717, 1577631902.3942525], "v": 0.1}
{"i": ["cuda", "schedule_conv3d_nchw_cuda", [[128, 1, 20, 20, 20], [128, 1, 20, 20, 20], [1, 1, 1], [1, 1, 1], [1, 1, 1], 1], {}, ["schedule_conv3d_nchw_cuda", [128, 1, 20, 20, 20], [128, 1, 20, 20, 20], [1, 1, 1], [1, 1, 1], [1, 1, 1], 1], {"i": 1271769170, "t": "", "c": null, "e": [["tile_n", "sp", [-1, 2, 4, 2]], ["tile_f", "sp", [-1, 1, 1, 2]], ["tile_d", "sp", [-1, 3, 1, 1]], ["tile_y", "sp", [-1, 1, 1, 3]], ["tile_x", "sp", [-1, 1, 1, 3]], ["tile_rc", "sp", [-1, 1]], ["tile_rd", "sp", [-1, 20]], ["tile_ry", "sp", [-1, 2]], ["tile_rx", "sp", [-1, 4]], ["auto_unroll_max_step", "ot", 0], ["unroll_explicit", "ot", 0], ["fuse_yx", "ot", 1]]}], "r": [[0.10436513875], 0, 2.6340484619140625, 1577631918.4704576], "v": 0.1}
{"i": ["cuda", "schedule_conv3d_nchw_cuda", [[128, 1, 20, 20, 20], [128, 1, 20, 20, 20], [1, 1, 1], [1, 1, 1], [1, 1, 1], 1], {}, ["schedule_conv3d_nchw_cuda", [128, 1, 20, 20, 20], [128, 1, 20, 20, 20], [1, 1, 1], [1, 1, 1], [1, 1, 1], 1], {"i": 2234144427, "t": "", "c": null, "e": [["tile_n", "sp", [-1, 2, 16, 1]], ["tile_f", "sp", [-1, 1, 1, 32]], ["tile_d", "sp", [-1, 1, 1, 1]], ["tile_y", "sp", [-1, 1, 1, 3]], ["tile_x", "sp", [-1, 1, 1, 1]], ["tile_rc", "sp", [-1, 1]], ["tile_rd", "sp", [-1, 1]], ["tile_ry", "sp", [-1, 4]], ["tile_rx", "sp", [-1, 2]], ["auto_unroll_max_step", "ot", 1500], ["unroll_explicit", "ot", 1], ["fuse_yx", "ot", 1]]}], "r": [[0.01012048125], 0, 2.3918397426605225, 1577631943.8198004], "v": 0.1}
{"i": ["cuda", "schedule_conv3d_nchw_cuda", [[128, 1, 20, 20, 20], [128, 1, 20, 20, 20], [1, 1, 1], [1, 1, 1], [1, 1, 1], 1], {}, ["schedule_conv3d_nchw_cuda", [128, 1, 20, 20, 20], [128, 1, 20, 20, 20], [1, 1, 1], [1, 1, 1], [1, 1, 1], 1], {"i": 282014365, "t": "", "c": null, "e": [["tile_n", "sp", [-1, 1, 1, 8]], ["tile_f", "sp", [-1, 8, 1, 2]], ["tile_d", "sp", [-1, 1, 1, 1]], ["tile_y", "sp", [-1, 1, 1, 1]], ["tile_x", "sp", [-1, 1, 1, 1]], ["tile_rc", "sp", [-1, 1]], ["tile_rd", "sp", [-1, 1]], ["tile_ry", "sp", [-1, 5]], ["tile_rx", "sp", [-1, 4]], ["auto_unroll_max_step", "ot", 512], ["unroll_explicit", "ot", 0], ["fuse_yx", "ot", 0]]}], "r": [[0.168072094], 0, 4.652399301528931, 1577631952.4309819], "v": 0.1}
{"i": ["cuda", "schedule_conv3d_nchw_cuda", [[128, 1, 20, 20, 20], [128, 1, 20, 20, 20], [1, 1, 1], [1, 1, 1], [1, 1, 1], 1], {}, ["schedule_conv3d_nchw_cuda", [128, 1, 20, 20, 20], [128, 1, 20, 20, 20], [1, 1, 1], [1, 1, 1], [1, 1, 1], 1], {"i": 1408235188, "t": "", "c": null, "e": [["tile_n", "sp", [-1, 4, 16, 1]], ["tile_f", "sp", [-1, 32, 2, 1]], ["tile_d", "sp", [-1, 1, 3, 1]], ["tile_y", "sp", [-1, 1, 1, 1]], ["tile_x", "sp", [-1, 1, 1, 1]], ["tile_rc", "sp", [-1, 1]], ["tile_rd", "sp", [-1, 10]], ["tile_ry", "sp", [-1, 4]], ["tile_rx", "sp", [-1, 1]], ["auto_unroll_max_step", "ot", 512], ["unroll_explicit", "ot", 0], ["fuse_yx", "ot", 1]]}], "r": [[0.00330436475], 0, 1.3337211608886719, 1577631962.0968695], "v": 0.1}
{"i": ["cuda", "schedule_conv3d_nchw_cuda", [[128, 1, 20, 20, 20], [128, 1, 20, 20, 20], [1, 1, 1], [1, 1, 1], [1, 1, 1], 1], {}, ["schedule_conv3d_nchw_cuda", [128, 1, 20, 20, 20], [128, 1, 20, 20, 20], [1, 1, 1], [1, 1, 1], [1, 1, 1], 1], {"i": 1639791741, "t": "", "c": null, "e": [["tile_n", "sp", [-1, 1, 8, 1]], ["tile_f", "sp", [-1, 4, 4, 2]], ["tile_d", "sp", [-1, 1, 3, 1]], ["tile_y", "sp", [-1, 1, 1, 1]], ["tile_x", "sp", [-1, 3, 1, 1]], ["tile_rc", "sp", [-1, 1]], ["tile_rd", "sp", [-1, 5]], ["tile_ry", "sp", [-1, 4]], ["tile_rx", "sp", [-1, 2]], ["auto_unroll_max_step", "ot", 1500], ["unroll_explicit", "ot", 0], ["fuse_yx", "ot", 1]]}], "r": [[0.00247921425], 0, 1.2013249397277832, 1577631982.3253212], "v": 0.1}
{"i": ["cuda", "schedule_conv3d_nchw_cuda", [[128, 1, 20, 20, 20], [128, 1, 20, 20, 20], [1, 1, 1], [1, 1, 1], [1, 1, 1], 1], {}, ["schedule_conv3d_nchw_cuda", [128, 1, 20, 20, 20], [128, 1, 20, 20, 20], [1, 1, 1], [1, 1, 1], [1, 1, 1], 1], {"i": 2194728464, "t": "", "c": null, "e": [["tile_n", "sp", [-1, 1, 2, 16]], ["tile_f", "sp", [-1, 2, 16, 4]], ["tile_d", "sp", [-1, 1, 1, 3]], ["tile_y", "sp", [-1, 1, 3, 1]], ["tile_x", "sp", [-1, 3, 1, 1]], ["tile_rc", "sp", [-1, 1]], ["tile_rd", "sp", [-1, 20]], ["tile_ry", "sp", [-1, 1]], ["tile_rx", "sp", [-1, 1]], ["auto_unroll_max_step", "ot", 1500], ["unroll_explicit", "ot", 1], ["fuse_yx", "ot", 1]]}], "r": [[0.164306876], 0, 11.048335075378418, 1577631986.2070658], "v": 0.1}
{"i": ["cuda", "schedule_conv3d_nchw_cuda", [[128, 1, 20, 20, 20], [128, 1, 20, 20, 20], [1, 1, 1], [1, 1, 1], [1, 1, 1], 1], {}, ["schedule_conv3d_nchw_cuda", [128, 1, 20, 20, 20], [128, 1, 20, 20, 20], [1, 1, 1], [1, 1, 1], [1, 1, 1], 1], {"i": 420876003, "t": "", "c": null, "e": [["tile_n", "sp", [-1, 8, 1, 1]], ["tile_f", "sp", [-1, 4, 16, 2]], ["tile_d", "sp", [-1, 1, 1, 3]], ["tile_y", "sp", [-1, 1, 3, 1]], ["tile_x", "sp", [-1, 1, 3, 1]], ["tile_rc", "sp", [-1, 1]], ["tile_rd", "sp", [-1, 1]], ["tile_ry", "sp", [-1, 10]], ["tile_rx", "sp", [-1, 1]], ["auto_unroll_max_step", "ot", 1500], ["unroll_explicit", "ot", 0], ["fuse_yx", "ot", 0]]}], "r": [[0.00301480375], 0, 1.0877211093902588, 1577631986.7677038], "v": 0.1}
{"i": ["cuda", "schedule_conv3d_nchw_cuda", [[128, 1, 20, 20, 20], [128, 1, 20, 20, 20], [1, 1, 1], [1, 1, 1], [1, 1, 1], 1], {}, ["schedule_conv3d_nchw_cuda", [128, 1, 20, 20, 20], [128, 1, 20, 20, 20], [1, 1, 1], [1, 1, 1], [1, 1, 1], 1], {"i": 2297858450, "t": "", "c": null, "e": [["tile_n", "sp", [-1, 2, 4, 2]], ["tile_f", "sp", [-1, 4, 16, 2]], ["tile_d", "sp", [-1, 3, 1, 1]], ["tile_y", "sp", [-1, 3, 1, 1]], ["tile_x", "sp", [-1, 3, 1, 1]], ["tile_rc", "sp", [-1, 1]], ["tile_rd", "sp", [-1, 5]], ["tile_ry", "sp", [-1, 2]], ["tile_rx", "sp", [-1, 5]], ["auto_unroll_max_step", "ot", 1500], ["unroll_explicit", "ot", 1], ["fuse_yx", "ot", 1]]}], "r": [[0.06359673875], 0, 8.08969497680664, 1577631994.4991257], "v": 0.1}
{"i": ["cuda", "schedule_conv3d_nchw_cuda", [[128, 1, 20, 20, 20], [128, 1, 20, 20, 20], [1, 1, 1], [1, 1, 1], [1, 1, 1], 1], {}, ["schedule_conv3d_nchw_cuda", [128, 1, 20, 20, 20], [128, 1, 20, 20, 20], [1, 1, 1], [1, 1, 1], [1, 1, 1], 1], {"i": 619805415, "t": "", "c": null, "e": [["tile_n", "sp", [-1, 1, 4, 1]], ["tile_f", "sp", [-1, 32, 1, 1]], ["tile_d", "sp", [-1, 1, 3, 1]], ["tile_y", "sp", [-1, 1, 1, 1]], ["tile_x", "sp", [-1, 1, 3, 1]], ["tile_rc", "sp", [-1, 1]], ["tile_rd", "sp", [-1, 1]], ["tile_ry", "sp", [-1, 10]], ["tile_rx", "sp", [-1, 1]], ["auto_unroll_max_step", "ot", 0], ["unroll_explicit", "ot", 1], ["fuse_yx", "ot", 0]]}], "r": [[0.0047680365], 0, 1.045452356338501, 1577632248.0556777], "v": 0.1}
{"i": ["cuda", "schedule_conv3d_nchw_cuda", [[128, 1, 20, 20, 20], [128, 1, 20, 20, 20], [1, 1, 1], [1, 1, 1], [1, 1, 1], 1], {}, ["schedule_conv3d_nchw_cuda", [128, 1, 20, 20, 20], [128, 1, 20, 20, 20], [1, 1, 1], [1, 1, 1], [1, 1, 1], 1], {"i": 237833366, "t": "", "c": null, "e": [["tile_n", "sp", [-1, 2, 1, 8]], ["tile_f", "sp", [-1, 8, 8, 1]], ["tile_d", "sp", [-1, 1, 1, 1]], ["tile_y", "sp", [-1, 3, 1, 1]], ["tile_x", "sp", [-1, 1, 1, 1]], ["tile_rc", "sp", [-1, 1]], ["tile_rd", "sp", [-1, 1]], ["tile_ry", "sp", [-1, 2]], ["tile_rx", "sp", [-1, 2]], ["auto_unroll_max_step", "ot", 512], ["unroll_explicit", "ot", 0], ["fuse_yx", "ot", 0]]}], "r": [[0.05429151675], 0, 2.6219308376312256, 1577632249.5636818], "v": 0.1}
{"i": ["cuda", "schedule_conv3d_nchw_cuda", [[128, 1, 20, 20, 20], [128, 1, 20, 20, 20], [1, 1, 1], [1, 1, 1], [1, 1, 1], 1], {}, ["schedule_conv3d_nchw_cuda", [128, 1, 20, 20, 20], [128, 1, 20, 20, 20], [1, 1, 1], [1, 1, 1], [1, 1, 1], 1], {"i": 868380926, "t": "", "c": null, "e": [["tile_n", "sp", [-1, 2, 1, 8]], ["tile_f", "sp", [-1, 2, 16, 1]], ["tile_d", "sp", [-1, 1, 1, 1]], ["tile_y", "sp", [-1, 1, 1, 1]], ["tile_x", "sp", [-1, 3, 1, 1]], ["tile_rc", "sp", [-1, 1]], ["tile_rd", "sp", [-1, 1]], ["tile_ry", "sp", [-1, 2]], ["tile_rx", "sp", [-1, 4]], ["auto_unroll_max_step", "ot", 512], ["unroll_explicit", "ot", 1], ["fuse_yx", "ot", 0]]}], "r": [[0.0044743965], 0, 1.4697623252868652, 1577632250.1784384], "v": 0.1}
{"i": ["cuda", "schedule_conv3d_nchw_cuda", [[128, 1, 20, 20, 20], [128, 1, 20, 20, 20], [1, 1, 1], [1, 1, 1], [1, 1, 1], 1], {}, ["schedule_conv3d_nchw_cuda", [128, 1, 20, 20, 20], [128, 1, 20, 20, 20], [1, 1, 1], [1, 1, 1], [1, 1, 1], 1], {"i": 1034095765, "t": "", "c": null, "e": [["tile_n", "sp", [-1, 1, 1, 8]], ["tile_f", "sp", [-1, 8, 8, 1]], ["tile_d", "sp", [-1, 1, 1, 1]], ["tile_y", "sp", [-1, 3, 1, 1]], ["tile_x", "sp", [-1, 1, 1, 1]], ["tile_rc", "sp", [-1, 1]], ["tile_rd", "sp", [-1, 1]], ["tile_ry", "sp", [-1, 2]], ["tile_rx", "sp", [-1, 2]], ["auto_unroll_max_step", "ot", 1500], ["unroll_explicit", "ot", 1], ["fuse_yx", "ot", 0]]}], "r": [[0.01155865325], 0, 2.2624127864837646, 1577632250.9727447], "v": 0.1}
{"i": ["cuda", "schedule_conv3d_nchw_cuda", [[128, 1, 20, 20, 20], [128, 1, 20, 20, 20], [1, 1, 1], [1, 1, 1], [1, 1, 1], 1], {}, ["schedule_conv3d_nchw_cuda", [128, 1, 20, 20, 20], [128, 1, 20, 20, 20], [1, 1, 1], [1, 1, 1], [1, 1, 1], 1], {"i": 1604047026, "t": "", "c": null, "e": [["tile_n", "sp", [-1, 4, 1, 4]], ["tile_f", "sp", [-1, 8, 4, 1]], ["tile_d", "sp", [-1, 1, 1, 1]], ["tile_y", "sp", [-1, 1, 1, 1]], ["tile_x", "sp", [-1, 1, 3, 1]], ["tile_rc", "sp", [-1, 1]], ["tile_rd", "sp", [-1, 1]], ["tile_ry", "sp", [-1, 4]], ["tile_rx", "sp", [-1, 1]], ["auto_unroll_max_step", "ot", 1500], ["unroll_explicit", "ot", 0], ["fuse_yx", "ot", 1]]}], "r": [[0.0137252645], 0, 1.5871641635894775, 1577632251.89095], "v": 0.1}
{"i": ["cuda", "schedule_conv3d_nchw_cuda", [[128, 1, 20, 20, 20], [128, 1, 20, 20, 20], [1, 1, 1], [1, 1, 1], [1, 1, 1], 1], {}, ["schedule_conv3d_nchw_cuda", [128, 1, 20, 20, 20], [128, 1, 20, 20, 20], [1, 1, 1], [1, 1, 1], [1, 1, 1], 1], {"i": 1604047025, "t": "", "c": null, "e": [["tile_n", "sp", [-1, 2, 1, 4]], ["tile_f", "sp", [-1, 8, 4, 1]], ["tile_d", "sp", [-1, 1, 1, 1]], ["tile_y", "sp", [-1, 1, 1, 1]], ["tile_x", "sp", [-1, 1, 3, 1]], ["tile_rc", "sp", [-1, 1]], ["tile_rd", "sp", [-1, 1]], ["tile_ry", "sp", [-1, 4]], ["tile_rx", "sp", [-1, 1]], ["auto_unroll_max_step", "ot", 1500], ["unroll_explicit", "ot", 0], ["fuse_yx", "ot", 1]]}], "r": [[0.005448626], 0, 1.5759193897247314, 1577632252.647438], "v": 0.1}
{"i": ["cuda", "schedule_conv3d_nchw_cuda", [[128, 1, 20, 20, 20], [128, 1, 20, 20, 20], [1, 1, 1], [1, 1, 1], [1, 1, 1], 1], {}, ["schedule_conv3d_nchw_cuda", [128, 1, 20, 20, 20], [128, 1, 20, 20, 20], [1, 1, 1], [1, 1, 1], [1, 1, 1], 1], {"i": 868668425, "t": "", "c": null, "e": [["tile_n", "sp", [-1, 2, 1, 4]], ["tile_f", "sp", [-1, 4, 8, 1]], ["tile_d", "sp", [-1, 1, 1, 1]], ["tile_y", "sp", [-1, 3, 1, 1]], ["tile_x", "sp", [-1, 1, 3, 1]], ["tile_rc", "sp", [-1, 1]], ["tile_rd", "sp", [-1, 1]], ["tile_ry", "sp", [-1, 2]], ["tile_rx", "sp", [-1, 4]], ["auto_unroll_max_step", "ot", 512], ["unroll_explicit", "ot", 1], ["fuse_yx", "ot", 0]]}], "r": [[0.00353064075], 0, 1.4317975044250488, 1577632253.2291422], "v": 0.1}
{"i": ["cuda", "schedule_conv3d_nchw_cuda", [[128, 1, 20, 20, 20], [128, 1, 20, 20, 20], [1, 1, 1], [1, 1, 1], [1, 1, 1], 1], {}, ["schedule_conv3d_nchw_cuda", [128, 1, 20, 20, 20], [128, 1, 20, 20, 20], [1, 1, 1], [1, 1, 1], [1, 1, 1], 1], {"i": 237833365, "t": "", "c": null, "e": [["tile_n", "sp", [-1, 1, 1, 8]], ["tile_f", "sp", [-1, 8, 8, 1]], ["tile_d", "sp", [-1, 1, 1, 1]], ["tile_y", "sp", [-1, 3, 1, 1]], ["tile_x", "sp", [-1, 1, 1, 1]], ["tile_rc", "sp", [-1, 1]], ["tile_rd", "sp", [-1, 1]], ["tile_ry", "sp", [-1, 2]], ["tile_rx", "sp", [-1, 2]], ["auto_unroll_max_step", "ot", 512], ["unroll_explicit", "ot", 0], ["fuse_yx", "ot", 0]]}], "r": [[0.00811025675], 0, 1.4908466339111328, 1577632253.9508717], "v": 0.1}
{"i": ["cuda", "schedule_conv3d_nchw_cuda", [[128, 1, 20, 20, 20], [128, 1, 20, 20, 20], [1, 1, 1], [1, 1, 1], [1, 1, 1], 1], {}, ["schedule_conv3d_nchw_cuda", [128, 1, 20, 20, 20], [128, 1, 20, 20, 20], [1, 1, 1], [1, 1, 1], [1, 1, 1], 1], {"i": 72118526, "t": "", "c": null, "e": [["tile_n", "sp", [-1, 2, 1, 8]], ["tile_f", "sp", [-1, 2, 16, 1]], ["tile_d", "sp", [-1, 1, 1, 1]], ["tile_y", "sp", [-1, 1, 1, 1]], ["tile_x", "sp", [-1, 3, 1, 1]], ["tile_rc", "sp", [-1, 1]], ["tile_rd", "sp", [-1, 1]], ["tile_ry", "sp", [-1, 2]], ["tile_rx", "sp", [-1, 4]], ["auto_unroll_max_step", "ot", 0], ["unroll_explicit", "ot", 0], ["fuse_yx", "ot", 0]]}], "r": [[0.0025006745], 0, 1.2015552520751953, 1577632259.48095], "v": 0.1}
{"i": ["cuda", "schedule_conv3d_nchw_cuda", [[128, 1, 20, 20, 20], [128, 1, 20, 20, 20], [1, 1, 1], [1, 1, 1], [1, 1, 1], 1], {}, ["schedule_conv3d_nchw_cuda", [128, 1, 20, 20, 20], [128, 1, 20, 20, 20], [1, 1, 1], [1, 1, 1], [1, 1, 1], 1], {"i": 436898965, "t": "", "c": null, "e": [["tile_n", "sp", [-1, 1, 1, 8]], ["tile_f", "sp", [-1, 8, 8, 1]], ["tile_d", "sp", [-1, 1, 1, 1]], ["tile_y", "sp", [-1, 3, 1, 1]], ["tile_x", "sp", [-1, 1, 1, 1]], ["tile_rc", "sp", [-1, 1]], ["tile_rd", "sp", [-1, 1]], ["tile_ry", "sp", [-1, 2]], ["tile_rx", "sp", [-1, 2]], ["auto_unroll_max_step", "ot", 1500], ["unroll_explicit", "ot", 0], ["fuse_yx", "ot", 0]]}], "r": [[0.0078210395], 0, 1.5628514289855957, 1577632260.2361145], "v": 0.1}
{"i": ["cuda", "schedule_conv3d_nchw_cuda", [[128, 1, 20, 20, 20], [128, 1, 20, 20, 20], [1, 1, 1], [1, 1, 1], [1, 1, 1], 1], {}, ["schedule_conv3d_nchw_cuda", [128, 1, 20, 20, 20], [128, 1, 20, 20, 20], [1, 1, 1], [1, 1, 1], [1, 1, 1], 1], {"i": 2228489365, "t": "", "c": null, "e": [["tile_n", "sp", [-1, 1, 1, 8]], ["tile_f", "sp", [-1, 8, 8, 1]], ["tile_d", "sp", [-1, 1, 1, 1]], ["tile_y", "sp", [-1, 3, 1, 1]], ["tile_x", "sp", [-1, 1, 1, 1]], ["tile_rc", "sp", [-1, 1]], ["tile_rd", "sp", [-1, 1]], ["tile_ry", "sp", [-1, 2]], ["tile_rx", "sp", [-1, 2]], ["auto_unroll_max_step", "ot", 1500], ["unroll_explicit", "ot", 1], ["fuse_yx", "ot", 1]]}], "r": [[0.01146775125], 0, 2.22002911567688, 1577632261.0528018], "v": 0.1}
{"i": ["cuda", "schedule_conv3d_nchw_cuda", [[128, 1, 20, 20, 20], [128, 1, 20, 20, 20], [1, 1, 1], [1, 1, 1], [1, 1, 1], 1], {}, ["schedule_conv3d_nchw_cuda", [128, 1, 20, 20, 20], [128, 1, 20, 20, 20], [1, 1, 1], [1, 1, 1], [1, 1, 1], 1], {"i": 2201243825, "t": "", "c": null, "e": [["tile_n", "sp", [-1, 2, 1, 4]], ["tile_f", "sp", [-1, 8, 4, 1]], ["tile_d", "sp", [-1, 1, 1, 1]], ["tile_y", "sp", [-1, 1, 1, 1]], ["tile_x", "sp", [-1, 1, 3, 1]], ["tile_rc", "sp", [-1, 1]], ["tile_rd", "sp", [-1, 1]], ["tile_ry", "sp", [-1, 4]], ["tile_rx", "sp", [-1, 1]], ["auto_unroll_max_step", "ot", 1500], ["unroll_explicit", "ot", 1], ["fuse_yx", "ot", 1]]}], "r": [[0.0068304485], 0, 2.6170296669006348, 1577632264.102171], "v": 0.1}
{"i": ["cuda", "schedule_conv3d_nchw_cuda", [[128, 1, 20, 20, 20], [128, 1, 20, 20, 20], [1, 1, 1], [1, 1, 1], [1, 1, 1], 1], {}, ["schedule_conv3d_nchw_cuda", [128, 1, 20, 20, 20], [128, 1, 20, 20, 20], [1, 1, 1], [1, 1, 1], [1, 1, 1], 1], {"i": 2063062025, "t": "", "c": null, "e": [["tile_n", "sp", [-1, 2, 1, 4]], ["tile_f", "sp", [-1, 4, 8, 1]], ["tile_d", "sp", [-1, 1, 1, 1]], ["tile_y", "sp", [-1, 3, 1, 1]], ["tile_x", "sp", [-1, 1, 3, 1]], ["tile_rc", "sp", [-1, 1]], ["tile_rd", "sp", [-1, 1]], ["tile_ry", "sp", [-1, 2]], ["tile_rx", "sp", [-1, 4]], ["auto_unroll_max_step", "ot", 512], ["unroll_explicit", "ot", 1], ["fuse_yx", "ot", 1]]}], "r": [[0.00445062625], 0, 1.3272387981414795, 1577632264.6776562], "v": 0.1}
{"i": ["cuda", "schedule_conv3d_nchw_cuda", [[128, 1, 20, 20, 20], [128, 1, 20, 20, 20], [1, 1, 1], [1, 1, 1], [1, 1, 1], 1], {}, ["schedule_conv3d_nchw_cuda", [128, 1, 20, 20, 20], [128, 1, 20, 20, 20], [1, 1, 1], [1, 1, 1], [1, 1, 1], 1], {"i": 669315326, "t": "", "c": null, "e": [["tile_n", "sp", [-1, 2, 1, 8]], ["tile_f", "sp", [-1, 2, 16, 1]], ["tile_d", "sp", [-1, 1, 1, 1]], ["tile_y", "sp", [-1, 1, 1, 1]], ["tile_x", "sp", [-1, 3, 1, 1]], ["tile_rc", "sp", [-1, 1]], ["tile_rd", "sp", [-1, 1]], ["tile_ry", "sp", [-1, 2]], ["tile_rx", "sp", [-1, 4]], ["auto_unroll_max_step", "ot", 0], ["unroll_explicit", "ot", 1], ["fuse_yx", "ot", 0]]}], "r": [[0.0032164785], 0, 1.0193753242492676, 1577632265.1891778], "v": 0.1}
{"i": ["cuda", "schedule_conv3d_nchw_cuda", [[128, 1, 20, 20, 20], [128, 1, 20, 20, 20], [1, 1, 1], [1, 1, 1], [1, 1, 1], 1], {}, ["schedule_conv3d_nchw_cuda", [128, 1, 20, 20, 20], [128, 1, 20, 20, 20], [1, 1, 1], [1, 1, 1], [1, 1, 1], 1], {"i": 1631292565, "t": "", "c": null, "e": [["tile_n", "sp", [-1, 1, 1, 8]], ["tile_f", "sp", [-1, 8, 8, 1]], ["tile_d", "sp", [-1, 1, 1, 1]], ["tile_y", "sp", [-1, 3, 1, 1]], ["tile_x", "sp", [-1, 1, 1, 1]], ["tile_rc", "sp", [-1, 1]], ["tile_rd", "sp", [-1, 1]], ["tile_ry", "sp", [-1, 2]], ["tile_rx", "sp", [-1, 2]], ["auto_unroll_max_step", "ot", 1500], ["unroll_explicit", "ot", 0], ["fuse_yx", "ot", 1]]}], "r": [[0.01014035175], 0, 1.534557580947876, 1577632265.990981], "v": 0.1}
{"i": ["cuda", "schedule_conv3d_nchw_cuda", [[128, 1, 20, 20, 20], [128, 1, 20, 20, 20], [1, 1, 1], [1, 1, 1], [1, 1, 1], 1], {}, ["schedule_conv3d_nchw_cuda", [128, 1, 20, 20, 20], [128, 1, 20, 20, 20], [1, 1, 1], [1, 1, 1], [1, 1, 1], 1], {"i": 216120016, "t": "", "c": null, "e": [["tile_n", "sp", [-1, 2, 4, 1]], ["tile_f", "sp", [-1, 16, 1, 2]], ["tile_d", "sp", [-1, 1, 1, 1]], ["tile_y", "sp", [-1, 1, 1, 1]], ["tile_x", "sp", [-1, 1, 3, 1]], ["tile_rc", "sp", [-1, 1]], ["tile_rd", "sp", [-1, 1]], ["tile_ry", "sp", [-1, 5]], ["tile_rx", "sp", [-1, 1]], ["auto_unroll_max_step", "ot", 512], ["unroll_explicit", "ot", 0], ["fuse_yx", "ot", 0]]}], "r": [[0.01055382325], 0, 1.466630220413208, 1577632266.8094275], "v": 0.1}
{"i": ["cuda", "schedule_conv3d_nchw_cuda", [[128, 1, 20, 20, 20], [128, 1, 20, 20, 20], [1, 1, 1], [1, 1, 1], [1, 1, 1], 1], {}, ["schedule_conv3d_nchw_cuda", [128, 1, 20, 20, 20], [128, 1, 20, 20, 20], [1, 1, 1], [1, 1, 1], [1, 1, 1], 1], {"i": 1006852511, "t": "", "c": null, "e": [["tile_n", "sp", [-1, 2, 2, 4]], ["tile_f", "sp", [-1, 2, 1, 2]], ["tile_d", "sp", [-1, 1, 1, 1]], ["tile_y", "sp", [-1, 1, 1, 1]], ["tile_x", "sp", [-1, 1, 3, 1]], ["tile_rc", "sp", [-1, 1]], ["tile_rd", "sp", [-1, 1]], ["tile_ry", "sp", [-1, 4]], ["tile_rx", "sp", [-1, 1]], ["auto_unroll_max_step", "ot", 1500], ["unroll_explicit", "ot", 1], ["fuse_yx", "ot", 0]]}], "r": [[0.02399281325], 0, 2.2646539211273193, 1577632267.78747], "v": 0.1}
{"i": ["cuda", "schedule_conv3d_nchw_cuda", [[128, 1, 20, 20, 20], [128, 1, 20, 20, 20], [1, 1, 1], [1, 1, 1], [1, 1, 1], 1], {}, ["schedule_conv3d_nchw_cuda", [128, 1, 20, 20, 20], [128, 1, 20, 20, 20], [1, 1, 1], [1, 1, 1], [1, 1, 1], 1], {"i": 1604049311, "t": "", "c": null, "e": [["tile_n", "sp", [-1, 2, 2, 4]], ["tile_f", "sp", [-1, 2, 1, 2]], ["tile_d", "sp", [-1, 1, 1, 1]], ["tile_y", "sp", [-1, 1, 1, 1]], ["tile_x", "sp", [-1, 1, 3, 1]], ["tile_rc", "sp", [-1, 1]], ["tile_rd", "sp", [-1, 1]], ["tile_ry", "sp", [-1, 4]], ["tile_rx", "sp", [-1, 1]], ["auto_unroll_max_step", "ot", 1500], ["unroll_explicit", "ot", 0], ["fuse_yx", "ot", 1]]}], "r": [[0.02443558825], 0, 1.7957069873809814, 1577632268.8199358], "v": 0.1}
{"i": ["cuda", "schedule_conv3d_nchw_cuda", [[128, 1, 20, 20, 20], [128, 1, 20, 20, 20], [1, 1, 1], [1, 1, 1], [1, 1, 1], 1], {}, ["schedule_conv3d_nchw_cuda", [128, 1, 20, 20, 20], [128, 1, 20, 20, 20], [1, 1, 1], [1, 1, 1], [1, 1, 1], 1], {"i": 11524511, "t": "", "c": null, "e": [["tile_n", "sp", [-1, 2, 2, 4]], ["tile_f", "sp", [-1, 2, 1, 2]], ["tile_d", "sp", [-1, 1, 1, 1]], ["tile_y", "sp", [-1, 1, 1, 1]], ["tile_x", "sp", [-1, 1, 3, 1]], ["tile_rc", "sp", [-1, 1]], ["tile_rd", "sp", [-1, 1]], ["tile_ry", "sp", [-1, 4]], ["tile_rx", "sp", [-1, 1]], ["auto_unroll_max_step", "ot", 0], ["unroll_explicit", "ot", 0], ["fuse_yx", "ot", 0]]}], "r": [[0.0087002465], 0, 1.1212310791015625, 1577632269.459342], "v": 0.1}
{"i": ["cuda", "schedule_conv3d_nchw_cuda", [[128, 1, 20, 20, 20], [128, 1, 20, 20, 20], [1, 1, 1], [1, 1, 1], [1, 1, 1], 1], {}, ["schedule_conv3d_nchw_cuda", [128, 1, 20, 20, 20], [128, 1, 20, 20, 20], [1, 1, 1], [1, 1, 1], [1, 1, 1], 1], {"i": 2201246049, "t": "", "c": null, "e": [["tile_n", "sp", [-1, 2, 2, 1]], ["tile_f", "sp", [-1, 2, 1, 2]], ["tile_d", "sp", [-1, 1, 1, 1]], ["tile_y", "sp", [-1, 1, 1, 1]], ["tile_x", "sp", [-1, 1, 3, 1]], ["tile_rc", "sp", [-1, 1]], ["tile_rd", "sp", [-1, 1]], ["tile_ry", "sp", [-1, 4]], ["tile_rx", "sp", [-1, 1]], ["auto_unroll_max_step", "ot", 1500], ["unroll_explicit", "ot", 1], ["fuse_yx", "ot", 1]]}], "r": [[0.0194934585], 0, 1.4524495601654053, 1577632270.2433586], "v": 0.1}
{"i": ["cuda", "schedule_conv3d_nchw_cuda", [[128, 1, 20, 20, 20], [128, 1, 20, 20, 20], [1, 1, 1], [1, 1, 1], [1, 1, 1], 1], {}, ["schedule_conv3d_nchw_cuda", [128, 1, 20, 20, 20], [128, 1, 20, 20, 20], [1, 1, 1], [1, 1, 1], [1, 1, 1], 1], {"i": 210590111, "t": "", "c": null, "e": [["tile_n", "sp", [-1, 2, 2, 4]], ["tile_f", "sp", [-1, 2, 1, 2]], ["tile_d", "sp", [-1, 1, 1, 1]], ["tile_y", "sp", [-1, 1, 1, 1]], ["tile_x", "sp", [-1, 1, 3, 1]], ["tile_rc", "sp", [-1, 1]], ["tile_rd", "sp", [-1, 1]], ["tile_ry", "sp", [-1, 4]], ["tile_rx", "sp", [-1, 1]], ["auto_unroll_max_step", "ot", 512], ["unroll_explicit", "ot", 0], ["fuse_yx", "ot", 0]]}], "r": [[0.01182351725], 0, 1.2591540813446045, 1577632270.9658592], "v": 0.1}
{"i": ["cuda", "schedule_conv3d_nchw_cuda", [[128, 1, 20, 20, 20], [128, 1, 20, 20, 20], [1, 1, 1], [1, 1, 1], [1, 1, 1], 1], {}, ["schedule_conv3d_nchw_cuda", [128, 1, 20, 20, 20], [128, 1, 20, 20, 20], [1, 1, 1], [1, 1, 1], [1, 1, 1], 1], {"i": 409655711, "t": "", "c": null, "e": [["tile_n", "sp", [-1, 2, 2, 4]], ["tile_f", "sp", [-1, 2, 1, 2]], ["tile_d", "sp", [-1, 1, 1, 1]], ["tile_y", "sp", [-1, 1, 1, 1]], ["tile_x", "sp", [-1, 1, 3, 1]], ["tile_rc", "sp", [-1, 1]], ["tile_rd", "sp", [-1, 1]], ["tile_ry", "sp", [-1, 4]], ["tile_rx", "sp", [-1, 1]], ["auto_unroll_max_step", "ot", 1500], ["unroll_explicit", "ot", 0], ["fuse_yx", "ot", 0]]}], "r": [[0.02441657025], 0, 1.7017979621887207, 1577632271.8706036], "v": 0.1}
{"i": ["cuda", "schedule_conv3d_nchw_cuda", [[128, 1, 20, 20, 20], [128, 1, 20, 20, 20], [1, 1, 1], [1, 1, 1], [1, 1, 1], 1], {}, ["schedule_conv3d_nchw_cuda", [128, 1, 20, 20, 20], [128, 1, 20, 20, 20], [1, 1, 1], [1, 1, 1], [1, 1, 1], 1], {"i": 2201246111, "t": "", "c": null, "e": [["tile_n", "sp", [-1, 2, 2, 4]], ["tile_f", "sp", [-1, 2, 1, 2]], ["tile_d", "sp", [-1, 1, 1, 1]], ["tile_y", "sp", [-1, 1, 1, 1]], ["tile_x", "sp", [-1, 1, 3, 1]], ["tile_rc", "sp", [-1, 1]], ["tile_rd", "sp", [-1, 1]], ["tile_ry", "sp", [-1, 4]], ["tile_rx", "sp", [-1, 1]], ["auto_unroll_max_step", "ot", 1500], ["unroll_explicit", "ot", 1], ["fuse_yx", "ot", 1]]}], "r": [[0.02421713825], 0, 2.1179897785186768, 1577632272.7259536], "v": 0.1}
{"i": ["cuda", "schedule_conv3d_nchw_cuda", [[128, 1, 20, 20, 20], [128, 1, 20, 20, 20], [1, 1, 1], [1, 1, 1], [1, 1, 1], 1], {}, ["schedule_conv3d_nchw_cuda", [128, 1, 20, 20, 20], [128, 1, 20, 20, 20], [1, 1, 1], [1, 1, 1], [1, 1, 1], 1], {"i": 11549048, "t": "", "c": null, "e": [["tile_n", "sp", [-1, 1, 2, 1]], ["tile_f", "sp", [-1, 4, 1, 1]], ["tile_d", "sp", [-1, 1, 3, 1]], ["tile_y", "sp", [-1, 1, 1, 1]], ["tile_x", "sp", [-1, 1, 3, 1]], ["tile_rc", "sp", [-1, 1]], ["tile_rd", "sp", [-1, 1]], ["tile_ry", "sp", [-1, 4]], ["tile_rx", "sp", [-1, 1]], ["auto_unroll_max_step", "ot", 0], ["unroll_explicit", "ot", 0], ["fuse_yx", "ot", 0]]}], "r": [[0.00765364575], 0, 0.9162943363189697, 1577632274.7084553], "v": 0.1}
{"i": ["cuda", "schedule_conv3d_nchw_cuda", [[128, 1, 20, 20, 20], [128, 1, 20, 20, 20], [1, 1, 1], [1, 1, 1], [1, 1, 1], 1], {}, ["schedule_conv3d_nchw_cuda", [128, 1, 20, 20, 20], [128, 1, 20, 20, 20], [1, 1, 1], [1, 1, 1], [1, 1, 1], 1], {"i": 11680921, "t": "", "c": null, "e": [["tile_n", "sp", [-1, 2, 1, 1]], ["tile_f", "sp", [-1, 1, 8, 1]], ["tile_d", "sp", [-1, 1, 1, 3]], ["tile_y", "sp", [-1, 1, 3, 1]], ["tile_x", "sp", [-1, 1, 3, 1]], ["tile_rc", "sp", [-1, 1]], ["tile_rd", "sp", [-1, 1]], ["tile_ry", "sp", [-1, 4]], ["tile_rx", "sp", [-1, 1]], ["auto_unroll_max_step", "ot", 0], ["unroll_explicit", "ot", 0], ["fuse_yx", "ot", 0]]}], "r": [[0.0059327275], 0, 0.95751953125, 1577632275.2661202], "v": 0.1}
{"i": ["cuda", "schedule_conv3d_nchw_cuda", [[128, 1, 20, 20, 20], [128, 1, 20, 20, 20], [1, 1, 1], [1, 1, 1], [1, 1, 1], 1], {}, ["schedule_conv3d_nchw_cuda", [128, 1, 20, 20, 20], [128, 1, 20, 20, 20], [1, 1, 1], [1, 1, 1], [1, 1, 1], 1], {"i": 11549288, "t": "", "c": null, "e": [["tile_n", "sp", [-1, 1, 2, 1]], ["tile_f", "sp", [-1, 16, 1, 1]], ["tile_d", "sp", [-1, 1, 3, 1]], ["tile_y", "sp", [-1, 1, 1, 1]], ["tile_x", "sp", [-1, 1, 3, 1]], ["tile_rc", "sp", [-1, 1]], ["tile_rd", "sp", [-1, 1]], ["tile_ry", "sp", [-1, 4]], ["tile_rx", "sp", [-1, 1]], ["auto_unroll_max_step", "ot", 0], ["unroll_explicit", "ot", 0], ["fuse_yx", "ot", 0]]}], "r": [[0.00353256675], 0, 0.970329761505127, 1577632275.8084972], "v": 0.1}
{"i": ["cuda", "schedule_conv3d_nchw_cuda", [[128, 1, 20, 20, 20], [128, 1, 20, 20, 20], [1, 1, 1], [1, 1, 1], [1, 1, 1], 1], {}, ["schedule_conv3d_nchw_cuda", [128, 1, 20, 20, 20], [128, 1, 20, 20, 20], [1, 1, 1], [1, 1, 1], [1, 1, 1], 1], {"i": 210730088, "t": "", "c": null, "e": [["tile_n", "sp", [-1, 1, 2, 1]], ["tile_f", "sp", [-1, 16, 1, 1]], ["tile_d", "sp", [-1, 1, 3, 1]], ["tile_y", "sp", [-1, 1, 3, 1]], ["tile_x", "sp", [-1, 1, 3, 1]], ["tile_rc", "sp", [-1, 1]], ["tile_rd", "sp", [-1, 1]], ["tile_ry", "sp", [-1, 4]], ["tile_rx", "sp", [-1, 1]], ["auto_unroll_max_step", "ot", 512], ["unroll_explicit", "ot", 0], ["fuse_yx", "ot", 0]]}], "r": [[0.00261817825], 0, 1.0343472957611084, 1577632276.421712], "v": 0.1}
{"i": ["cuda", "schedule_conv3d_nchw_cuda", [[128, 1, 20, 20, 20], [128, 1, 20, 20, 20], [1, 1, 1], [1, 1, 1], [1, 1, 1], 1], {}, ["schedule_conv3d_nchw_cuda", [128, 1, 20, 20, 20], [128, 1, 20, 20, 20], [1, 1, 1], [1, 1, 1], [1, 1, 1], 1], {"i": 17181721, "t": "", "c": null, "e": [["tile_n", "sp", [-1, 2, 1, 1]], ["tile_f", "sp", [-1, 1, 8, 1]], ["tile_d", "sp", [-1, 3, 1, 1]], ["tile_y", "sp", [-1, 1, 3, 1]], ["tile_x", "sp", [-1, 1, 3, 1]], ["tile_rc", "sp", [-1, 1]], ["tile_rd", "sp", [-1, 1]], ["tile_ry", "sp", [-1, 5]], ["tile_rx", "sp", [-1, 1]], ["auto_unroll_max_step", "ot", 0], ["unroll_explicit", "ot", 0], ["fuse_yx", "ot", 0]]}], "r": [[0.00662989625], 0, 1.2235362529754639, 1577632277.2130888], "v": 0.1}
{"i": ["cuda", "schedule_conv3d_nchw_cuda", [[128, 1, 20, 20, 20], [128, 1, 20, 20, 20], [1, 1, 1], [1, 1, 1], [1, 1, 1], 1], {}, ["schedule_conv3d_nchw_cuda", [128, 1, 20, 20, 20], [128, 1, 20, 20, 20], [1, 1, 1], [1, 1, 1], [1, 1, 1], 1], {"i": 11652121, "t": "", "c": null, "e": [["tile_n", "sp", [-1, 2, 1, 1]], ["tile_f", "sp", [-1, 1, 8, 1]], ["tile_d", "sp", [-1, 3, 1, 1]], ["tile_y", "sp", [-1, 1, 3, 1]], ["tile_x", "sp", [-1, 1, 3, 1]], ["tile_rc", "sp", [-1, 1]], ["tile_rd", "sp", [-1, 1]], ["tile_ry", "sp", [-1, 4]], ["tile_rx", "sp", [-1, 1]], ["auto_unroll_max_step", "ot", 0], ["unroll_explicit", "ot", 0], ["fuse_yx", "ot", 0]]}], "r": [[0.005932507], 0, 1.030280590057373, 1577632277.7912133], "v": 0.1}
{"i": ["cuda", "schedule_conv3d_nchw_cuda", [[128, 1, 20, 20, 20], [128, 1, 20, 20, 20], [1, 1, 1], [1, 1, 1], [1, 1, 1], 1], {}, ["schedule_conv3d_nchw_cuda", [128, 1, 20, 20, 20], [128, 1, 20, 20, 20], [1, 1, 1], [1, 1, 1], [1, 1, 1], 1], {"i": 210586129, "t": "", "c": null, "e": [["tile_n", "sp", [-1, 1, 4, 2]], ["tile_f", "sp", [-1, 16, 1, 1]], ["tile_d", "sp", [-1, 1, 1, 1]], ["tile_y", "sp", [-1, 1, 1, 1]], ["tile_x", "sp", [-1, 1, 3, 1]], ["tile_rc", "sp", [-1, 1]], ["tile_rd", "sp", [-1, 1]], ["tile_ry", "sp", [-1, 4]], ["tile_rx", "sp", [-1, 1]], ["auto_unroll_max_step", "ot", 512], ["unroll_explicit", "ot", 0], ["fuse_yx", "ot", 0]]}], "r": [[0.0042481035], 0, 1.0580980777740479, 1577632278.403844], "v": 0.1}
{"i": ["cuda", "schedule_conv3d_nchw_cuda", [[128, 1, 20, 20, 20], [128, 1, 20, 20, 20], [1, 1, 1], [1, 1, 1], [1, 1, 1], 1], {}, ["schedule_conv3d_nchw_cuda", [128, 1, 20, 20, 20], [128, 1, 20, 20, 20], [1, 1, 1], [1, 1, 1], [1, 1, 1], 1], {"i": 210730208, "t": "", "c": null, "e": [["tile_n", "sp", [-1, 1, 2, 1]], ["tile_f", "sp", [-1, 32, 1, 1]], ["tile_d", "sp", [-1, 1, 3, 1]], ["tile_y", "sp", [-1, 1, 3, 1]], ["tile_x", "sp", [-1, 1, 3, 1]], ["tile_rc", "sp", [-1, 1]], ["tile_rd", "sp", [-1, 1]], ["tile_ry", "sp", [-1, 4]], ["tile_rx", "sp", [-1, 1]], ["auto_unroll_max_step", "ot", 512], ["unroll_explicit", "ot", 0], ["fuse_yx", "ot", 0]]}], "r": [[0.00292517925], 0, 1.1017298698425293, 1577632279.027574], "v": 0.1}
{"i": ["cuda", "schedule_conv3d_nchw_cuda", [[128, 1, 20, 20, 20], [128, 1, 20, 20, 20], [1, 1, 1], [1, 1, 1], [1, 1, 1], 1], {}, ["schedule_conv3d_nchw_cuda", [128, 1, 20, 20, 20], [128, 1, 20, 20, 20], [1, 1, 1], [1, 1, 1], [1, 1, 1], 1], {"i": 409812121, "t": "", "c": null, "e": [["tile_n", "sp", [-1, 2, 1, 1]], ["tile_f", "sp", [-1, 1, 8, 1]], ["tile_d", "sp", [-1, 1, 1, 3]], ["tile_y", "sp", [-1, 1, 3, 1]], ["tile_x", "sp", [-1, 1, 3, 1]], ["tile_rc", "sp", [-1, 1]], ["tile_rd", "sp", [-1, 1]], ["tile_ry", "sp", [-1, 4]], ["tile_rx", "sp", [-1, 1]], ["auto_unroll_max_step", "ot", 1500], ["unroll_explicit", "ot", 0], ["fuse_yx", "ot", 0]]}], "r": [[0.0071660885], 0, 1.0602259635925293, 1577632279.6497147], "v": 0.1}
{"i": ["cuda", "schedule_conv3d_nchw_cuda", [[128, 1, 20, 20, 20], [128, 1, 20, 20, 20], [1, 1, 1], [1, 1, 1], [1, 1, 1], 1], {}, ["schedule_conv3d_nchw_cuda", [128, 1, 20, 20, 20], [128, 1, 20, 20, 20], [1, 1, 1], [1, 1, 1], [1, 1, 1], 1], {"i": 17210521, "t": "", "c": null, "e": [["tile_n", "sp", [-1, 2, 1, 1]], ["tile_f", "sp", [-1, 1, 8, 1]], ["tile_d", "sp", [-1, 1, 1, 3]], ["tile_y", "sp", [-1, 1, 3, 1]], ["tile_x", "sp", [-1, 1, 3, 1]], ["tile_rc", "sp", [-1, 1]], ["tile_rd", "sp", [-1, 1]], ["tile_ry", "sp", [-1, 5]], ["tile_rx", "sp", [-1, 1]], ["auto_unroll_max_step", "ot", 0], ["unroll_explicit", "ot", 0], ["fuse_yx", "ot", 0]]}], "r": [[0.00662405625], 0, 1.2227158546447754, 1577632280.4617908], "v": 0.1}
{"i": ["cuda", "schedule_conv3d_nchw_cuda", [[128, 1, 20, 20, 20], [128, 1, 20, 20, 20], [1, 1, 1], [1, 1, 1], [1, 1, 1], 1], {}, ["schedule_conv3d_nchw_cuda", [128, 1, 20, 20, 20], [128, 1, 20, 20, 20], [1, 1, 1], [1, 1, 1], [1, 1, 1], 1], {"i": 409680608, "t": "", "c": null, "e": [["tile_n", "sp", [-1, 1, 2, 1]], ["tile_f", "sp", [-1, 32, 1, 1]], ["tile_d", "sp", [-1, 1, 3, 1]], ["tile_y", "sp", [-1, 1, 1, 1]], ["tile_x", "sp", [-1, 1, 3, 1]], ["tile_rc", "sp", [-1, 1]], ["tile_rd", "sp", [-1, 1]], ["tile_ry", "sp", [-1, 4]], ["tile_rx", "sp", [-1, 1]], ["auto_unroll_max_step", "ot", 1500], ["unroll_explicit", "ot", 0], ["fuse_yx", "ot", 0]]}], "r": [[0.0045513525], 0, 1.4141771793365479, 1577632281.2418463], "v": 0.1}
{"i": ["cuda", "schedule_conv3d_nchw_cuda", [[128, 1, 20, 20, 20], [128, 1, 20, 20, 20], [1, 1, 1], [1, 1, 1], [1, 1, 1], 1], {}, ["schedule_conv3d_nchw_cuda", [128, 1, 20, 20, 20], [128, 1, 20, 20, 20], [1, 1, 1], [1, 1, 1], [1, 1, 1], 1], {"i": 210614888, "t": "", "c": null, "e": [["tile_n", "sp", [-1, 1, 2, 1]], ["tile_f", "sp", [-1, 16, 1, 1]], ["tile_d", "sp", [-1, 1, 3, 1]], ["tile_y", "sp", [-1, 1, 1, 1]], ["tile_x", "sp", [-1, 1, 3, 1]], ["tile_rc", "sp", [-1, 1]], ["tile_rd", "sp", [-1, 1]], ["tile_ry", "sp", [-1, 4]], ["tile_rx", "sp", [-1, 1]], ["auto_unroll_max_step", "ot", 512], ["unroll_explicit", "ot", 0], ["fuse_yx", "ot", 0]]}], "r": [[0.00395635775], 0, 1.1380383968353271, 1577632281.8893387], "v": 0.1}
{"i": ["cuda", "schedule_conv3d_nchw_cuda", [[128, 1, 20, 20, 20], [128, 1, 20, 20, 20], [1, 1, 1], [1, 1, 1], [1, 1, 1], 1], {}, ["schedule_conv3d_nchw_cuda", [128, 1, 20, 20, 20], [128, 1, 20, 20, 20], [1, 1, 1], [1, 1, 1], [1, 1, 1], 1], {"i": 210614689, "t": "", "c": null, "e": [["tile_n", "sp", [-1, 1, 4, 2]], ["tile_f", "sp", [-1, 4, 1, 1]], ["tile_d", "sp", [-1, 1, 3, 1]], ["tile_y", "sp", [-1, 1, 1, 1]], ["tile_x", "sp", [-1, 1, 3, 1]], ["tile_rc", "sp", [-1, 1]], ["tile_rd", "sp", [-1, 1]], ["tile_ry", "sp", [-1, 4]], ["tile_rx", "sp", [-1, 1]], ["auto_unroll_max_step", "ot", 512], ["unroll_explicit", "ot", 0], ["fuse_yx", "ot", 0]]}], "r": [[0.0049081565], 0, 0.9849874973297119, 1577632283.9758742], "v": 0.1}
{"i": ["cuda", "schedule_conv3d_nchw_cuda", [[128, 1, 20, 20, 20], [128, 1, 20, 20, 20], [1, 1, 1], [1, 1, 1], [1, 1, 1], 1], {}, ["schedule_conv3d_nchw_cuda", [128, 1, 20, 20, 20], [128, 1, 20, 20, 20], [1, 1, 1], [1, 1, 1], [1, 1, 1], 1], {"i": 1006877408, "t": "", "c": null, "e": [["tile_n", "sp", [-1, 1, 2, 1]], ["tile_f", "sp", [-1, 32, 1, 1]], ["tile_d", "sp", [-1, 1, 3, 1]], ["tile_y", "sp", [-1, 1, 1, 1]], ["tile_x", "sp", [-1, 1, 3, 1]], ["tile_rc", "sp", [-1, 1]], ["tile_rd", "sp", [-1, 1]], ["tile_ry", "sp", [-1, 4]], ["tile_rx", "sp", [-1, 1]], ["auto_unroll_max_step", "ot", 1500], ["unroll_explicit", "ot", 1], ["fuse_yx", "ot", 0]]}], "r": [[0.0035383565], 0, 1.7584924697875977, 1577632284.6764946], "v": 0.1}
{"i": ["cuda", "schedule_conv3d_nchw_cuda", [[128, 1, 20, 20, 20], [128, 1, 20, 20, 20], [1, 1, 1], [1, 1, 1], [1, 1, 1], 1], {}, ["schedule_conv3d_nchw_cuda", [128, 1, 20, 20, 20], [128, 1, 20, 20, 20], [1, 1, 1], [1, 1, 1], [1, 1, 1], 1], {"i": 807811808, "t": "", "c": null, "e": [["tile_n", "sp", [-1, 1, 2, 1]], ["tile_f", "sp", [-1, 32, 1, 1]], ["tile_d", "sp", [-1, 1, 3, 1]], ["tile_y", "sp", [-1, 1, 1, 1]], ["tile_x", "sp", [-1, 1, 3, 1]], ["tile_rc", "sp", [-1, 1]], ["tile_rd", "sp", [-1, 1]], ["tile_ry", "sp", [-1, 4]], ["tile_rx", "sp", [-1, 1]], ["auto_unroll_max_step", "ot", 512], ["unroll_explicit", "ot", 1], ["fuse_yx", "ot", 0]]}], "r": [[0.00418252925], 0, 1.1810102462768555, 1577632285.2870038], "v": 0.1}
{"i": ["cuda", "schedule_conv3d_nchw_cuda", [[128, 1, 20, 20, 20], [128, 1, 20, 20, 20], [1, 1, 1], [1, 1, 1], [1, 1, 1], 1], {}, ["schedule_conv3d_nchw_cuda", [128, 1, 20, 20, 20], [128, 1, 20, 20, 20], [1, 1, 1], [1, 1, 1], [1, 1, 1], 1], {"i": 210746521, "t": "", "c": null, "e": [["tile_n", "sp", [-1, 2, 1, 1]], ["tile_f", "sp", [-1, 1, 8, 1]], ["tile_d", "sp", [-1, 1, 1, 3]], ["tile_y", "sp", [-1, 1, 3, 1]], ["tile_x", "sp", [-1, 1, 3, 1]], ["tile_rc", "sp", [-1, 1]], ["tile_rd", "sp", [-1, 1]], ["tile_ry", "sp", [-1, 4]], ["tile_rx", "sp", [-1, 1]], ["auto_unroll_max_step", "ot", 512], ["unroll_explicit", "ot", 0], ["fuse_yx", "ot", 0]]}], "r": [[0.007105382], 0, 1.0374233722686768, 1577632285.84029], "v": 0.1}
{"i": ["cuda", "schedule_conv3d_nchw_cuda", [[128, 1, 20, 20, 20], [128, 1, 20, 20, 20], [1, 1, 1], [1, 1, 1], [1, 1, 1], 1], {}, ["schedule_conv3d_nchw_cuda", [128, 1, 20, 20, 20], [128, 1, 20, 20, 20], [1, 1, 1], [1, 1, 1], [1, 1, 1], 1], {"i": 807811489, "t": "", "c": null, "e": [["tile_n", "sp", [-1, 1, 4, 2]], ["tile_f", "sp", [-1, 4, 1, 1]], ["tile_d", "sp", [-1, 1, 3, 1]], ["tile_y", "sp", [-1, 1, 1, 1]], ["tile_x", "sp", [-1, 1, 3, 1]], ["tile_rc", "sp", [-1, 1]], ["tile_rd", "sp", [-1, 1]], ["tile_ry", "sp", [-1, 4]], ["tile_rx", "sp", [-1, 1]], ["auto_unroll_max_step", "ot", 512], ["unroll_explicit", "ot", 1], ["fuse_yx", "ot", 0]]}], "r": [[0.00535519875], 0, 1.297090768814087, 1577632286.4391403], "v": 0.1}
{"i": ["cuda", "schedule_conv3d_nchw_cuda", [[128, 1, 20, 20, 20], [128, 1, 20, 20, 20], [1, 1, 1], [1, 1, 1], [1, 1, 1], 1], {}, ["schedule_conv3d_nchw_cuda", [128, 1, 20, 20, 20], [128, 1, 20, 20, 20], [1, 1, 1], [1, 1, 1], [1, 1, 1], 1], {"i": 807782929, "t": "", "c": null, "e": [["tile_n", "sp", [-1, 1, 4, 2]], ["tile_f", "sp", [-1, 16, 1, 1]], ["tile_d", "sp", [-1, 1, 1, 1]], ["tile_y", "sp", [-1, 1, 1, 1]], ["tile_x", "sp", [-1, 1, 3, 1]], ["tile_rc", "sp", [-1, 1]], ["tile_rd", "sp", [-1, 1]], ["tile_ry", "sp", [-1, 4]], ["tile_rx", "sp", [-1, 1]], ["auto_unroll_max_step", "ot", 512], ["unroll_explicit", "ot", 1], ["fuse_yx", "ot", 0]]}], "r": [[0.00553105375], 0, 1.1799349784851074, 1577632287.0407288], "v": 0.1}
{"i": ["cuda", "schedule_conv3d_nchw_cuda", [[128, 1, 20, 20, 20], [128, 1, 20, 20, 20], [1, 1, 1], [1, 1, 1], [1, 1, 1], 1], {}, ["schedule_conv3d_nchw_cuda", [128, 1, 20, 20, 20], [128, 1, 20, 20, 20], [1, 1, 1], [1, 1, 1], [1, 1, 1], 1], {"i": 2002180729, "t": "", "c": null, "e": [["tile_n", "sp", [-1, 1, 4, 2]], ["tile_f", "sp", [-1, 8, 1, 2]], ["tile_d", "sp", [-1, 1, 1, 1]], ["tile_y", "sp", [-1, 1, 1, 1]], ["tile_x", "sp", [-1, 1, 3, 1]], ["tile_rc", "sp", [-1, 1]], ["tile_rd", "sp", [-1, 1]], ["tile_ry", "sp", [-1, 4]], ["tile_rx", "sp", [-1, 1]], ["auto_unroll_max_step", "ot", 512], ["unroll_explicit", "ot", 1], ["fuse_yx", "ot", 1]]}], "r": [[0.00553247475], 0, 1.1650054454803467, 1577632287.6691272], "v": 0.1}
{"i": ["cuda", "schedule_conv3d_nchw_cuda", [[128, 1, 20, 20, 20], [128, 1, 20, 20, 20], [1, 1, 1], [1, 1, 1], [1, 1, 1], 1], {}, ["schedule_conv3d_nchw_cuda", [128, 1, 20, 20, 20], [128, 1, 20, 20, 20], [1, 1, 1], [1, 1, 1], [1, 1, 1], 1], {"i": 608745848, "t": "", "c": null, "e": [["tile_n", "sp", [-1, 1, 2, 1]], ["tile_f", "sp", [-1, 4, 1, 1]], ["tile_d", "sp", [-1, 1, 3, 1]], ["tile_y", "sp", [-1, 1, 1, 1]], ["tile_x", "sp", [-1, 1, 3, 1]], ["tile_rc", "sp", [-1, 1]], ["tile_rd", "sp", [-1, 1]], ["tile_ry", "sp", [-1, 4]], ["tile_rx", "sp", [-1, 1]], ["auto_unroll_max_step", "ot", 0], ["unroll_explicit", "ot", 1], ["fuse_yx", "ot", 0]]}], "r": [[0.00765490375], 0, 0.9770510196685791, 1577632288.2166922], "v": 0.1}
{"i": ["cuda", "schedule_conv3d_nchw_cuda", [[128, 1, 20, 20, 20], [128, 1, 20, 20, 20], [1, 1, 1], [1, 1, 1], [1, 1, 1], 1], {}, ["schedule_conv3d_nchw_cuda", [128, 1, 20, 20, 20], [128, 1, 20, 20, 20], [1, 1, 1], [1, 1, 1], [1, 1, 1], 1], {"i": 210717721, "t": "", "c": null, "e": [["tile_n", "sp", [-1, 2, 1, 1]], ["tile_f", "sp", [-1, 1, 8, 1]], ["tile_d", "sp", [-1, 3, 1, 1]], ["tile_y", "sp", [-1, 1, 3, 1]], ["tile_x", "sp", [-1, 1, 3, 1]], ["tile_rc", "sp", [-1, 1]], ["tile_rd", "sp", [-1, 1]], ["tile_ry", "sp", [-1, 4]], ["tile_rx", "sp", [-1, 1]], ["auto_unroll_max_step", "ot", 512], ["unroll_explicit", "ot", 0], ["fuse_yx", "ot", 0]]}], "r": [[0.00712776375], 0, 1.0869476795196533, 1577632288.8342113], "v": 0.1}
{"i": ["cuda", "schedule_conv3d_nchw_cuda", [[128, 1, 20, 20, 20], [128, 1, 20, 20, 20], [1, 1, 1], [1, 1, 1], [1, 1, 1], 1], {}, ["schedule_conv3d_nchw_cuda", [128, 1, 20, 20, 20], [128, 1, 20, 20, 20], [1, 1, 1], [1, 1, 1], [1, 1, 1], 1], {"i": 807811510, "t": "", "c": null, "e": [["tile_n", "sp", [-1, 1, 2, 4]], ["tile_f", "sp", [-1, 4, 1, 1]], ["tile_d", "sp", [-1, 1, 3, 1]], ["tile_y", "sp", [-1, 1, 1, 1]], ["tile_x", "sp", [-1, 1, 3, 1]], ["tile_rc", "sp", [-1, 1]], ["tile_rd", "sp", [-1, 1]], ["tile_ry", "sp", [-1, 4]], ["tile_rx", "sp", [-1, 1]], ["auto_unroll_max_step", "ot", 512], ["unroll_explicit", "ot", 1], ["fuse_yx", "ot", 0]]}], "r": [[0.00659558525], 0, 1.4228639602661133, 1577632289.4839268], "v": 0.1}
{"i": ["cuda", "schedule_conv3d_nchw_cuda", [[128, 1, 20, 20, 20], [128, 1, 20, 20, 20], [1, 1, 1], [1, 1, 1], [1, 1, 1], 1], {}, ["schedule_conv3d_nchw_cuda", [128, 1, 20, 20, 20], [128, 1, 20, 20, 20], [1, 1, 1], [1, 1, 1], [1, 1, 1], 1], {"i": 409795808, "t": "", "c": null, "e": [["tile_n", "sp", [-1, 1, 2, 1]], ["tile_f", "sp", [-1, 32, 1, 1]], ["tile_d", "sp", [-1, 1, 3, 1]], ["tile_y", "sp", [-1, 1, 3, 1]], ["tile_x", "sp", [-1, 1, 3, 1]], ["tile_rc", "sp", [-1, 1]], ["tile_rd", "sp", [-1, 1]], ["tile_ry", "sp", [-1, 4]], ["tile_rx", "sp", [-1, 1]], ["auto_unroll_max_step", "ot", 1500], ["unroll_explicit", "ot", 0], ["fuse_yx", "ot", 0]]}], "r": [[0.003040024], 0, 1.3468208312988281, 1577632290.2164767], "v": 0.1}
{"i": ["cuda", "schedule_conv3d_nchw_cuda", [[128, 1, 20, 20, 20], [128, 1, 20, 20, 20], [1, 1, 1], [1, 1, 1], [1, 1, 1], 1], {}, ["schedule_conv3d_nchw_cuda", [128, 1, 20, 20, 20], [128, 1, 20, 20, 20], [1, 1, 1], [1, 1, 1], [1, 1, 1], 1], {"i": 210615008, "t": "", "c": null, "e": [["tile_n", "sp", [-1, 1, 2, 1]], ["tile_f", "sp", [-1, 32, 1, 1]], ["tile_d", "sp", [-1, 1, 3, 1]], ["tile_y", "sp", [-1, 1, 1, 1]], ["tile_x", "sp", [-1, 1, 3, 1]], ["tile_rc", "sp", [-1, 1]], ["tile_rd", "sp", [-1, 1]], ["tile_ry", "sp", [-1, 4]], ["tile_rx", "sp", [-1, 1]], ["auto_unroll_max_step", "ot", 512], ["unroll_explicit", "ot", 0], ["fuse_yx", "ot", 0]]}], "r": [[0.00414455175], 0, 1.0768120288848877, 1577632290.8360167], "v": 0.1}
{"i": ["cuda", "schedule_conv3d_nchw_cuda", [[128, 1, 20, 20, 20], [128, 1, 20, 20, 20], [1, 1, 1], [1, 1, 1], [1, 1, 1], 1], {}, ["schedule_conv3d_nchw_cuda", [128, 1, 20, 20, 20], [128, 1, 20, 20, 20], [1, 1, 1], [1, 1, 1], [1, 1, 1], 1], {"i": 409651729, "t": "", "c": null, "e": [["tile_n", "sp", [-1, 1, 4, 2]], ["tile_f", "sp", [-1, 16, 1, 1]], ["tile_d", "sp", [-1, 1, 1, 1]], ["tile_y", "sp", [-1, 1, 1, 1]], ["tile_x", "sp", [-1, 1, 3, 1]], ["tile_rc", "sp", [-1, 1]], ["tile_rd", "sp", [-1, 1]], ["tile_ry", "sp", [-1, 4]], ["tile_rx", "sp", [-1, 1]], ["auto_unroll_max_step", "ot", 1500], ["unroll_explicit", "ot", 0], ["fuse_yx", "ot", 0]]}], "r": [[0.00571294], 0, 1.2614498138427734, 1577632293.0057707], "v": 0.1}
{"i": ["cuda", "schedule_conv3d_nchw_cuda", [[128, 1, 20, 20, 20], [128, 1, 20, 20, 20], [1, 1, 1], [1, 1, 1], [1, 1, 1], 1], {}, ["schedule_conv3d_nchw_cuda", [128, 1, 20, 20, 20], [128, 1, 20, 20, 20], [1, 1, 1], [1, 1, 1], [1, 1, 1], 1], {"i": 1200273975, "t": "", "c": null, "e": [["tile_n", "sp", [-1, 1, 4, 1]], ["tile_f", "sp", [-1, 1, 2, 2]], ["tile_d", "sp", [-1, 1, 1, 1]], ["tile_y", "sp", [-1, 1, 3, 1]], ["tile_x", "sp", [-1, 3, 1, 1]], ["tile_rc", "sp", [-1, 1]], ["tile_rd", "sp", [-1, 1]], ["tile_ry", "sp", [-1, 2]], ["tile_rx", "sp", [-1, 1]], ["auto_unroll_max_step", "ot", 0], ["unroll_explicit", "ot", 0], ["fuse_yx", "ot", 1]]}], "r": [[0.00751364725], 0, 0.9680483341217041, 1577632293.584332], "v": 0.1}
{"i": ["cuda", "schedule_conv3d_nchw_cuda", [[128, 1, 20, 20, 20], [128, 1, 20, 20, 20], [1, 1, 1], [1, 1, 1], [1, 1, 1], 1], {}, ["schedule_conv3d_nchw_cuda", [128, 1, 20, 20, 20], [128, 1, 20, 20, 20], [1, 1, 1], [1, 1, 1], [1, 1, 1], 1], {"i": 1006852515, "t": "", "c": null, "e": [["tile_n", "sp", [-1, 1, 4, 4]], ["tile_f", "sp", [-1, 2, 1, 2]], ["tile_d", "sp", [-1, 1, 1, 1]], ["tile_y", "sp", [-1, 1, 1, 1]], ["tile_x", "sp", [-1, 1, 3, 1]], ["tile_rc", "sp", [-1, 1]], ["tile_rd", "sp", [-1, 1]], ["tile_ry", "sp", [-1, 4]], ["tile_rx", "sp", [-1, 1]], ["auto_unroll_max_step", "ot", 1500], ["unroll_explicit", "ot", 1], ["fuse_yx", "ot", 0]]}], "r": [[0.0101793075], 0, 1.5143895149230957, 1577632294.2973652], "v": 0.1}
{"i": ["cuda", "schedule_conv3d_nchw_cuda", [[128, 1, 20, 20, 20], [128, 1, 20, 20, 20], [1, 1, 1], [1, 1, 1], [1, 1, 1], 1], {}, ["schedule_conv3d_nchw_cuda", [128, 1, 20, 20, 20], [128, 1, 20, 20, 20], [1, 1, 1], [1, 1, 1], [1, 1, 1], 1], {"i": 1598405175, "t": "", "c": null, "e": [["tile_n", "sp", [-1, 1, 4, 1]], ["tile_f", "sp", [-1, 1, 2, 2]], ["tile_d", "sp", [-1, 1, 1, 1]], ["tile_y", "sp", [-1, 1, 3, 1]], ["tile_x", "sp", [-1, 3, 1, 1]], ["tile_rc", "sp", [-1, 1]], ["tile_rd", "sp", [-1, 1]], ["tile_ry", "sp", [-1, 2]], ["tile_rx", "sp", [-1, 1]], ["auto_unroll_max_step", "ot", 1500], ["unroll_explicit", "ot", 0], ["fuse_yx", "ot", 1]]}], "r": [[0.0075698505], 0, 1.0926792621612549, 1577632294.913483], "v": 0.1}
{"i": ["cuda", "schedule_conv3d_nchw_cuda", [[128, 1, 20, 20, 20], [128, 1, 20, 20, 20], [1, 1, 1], [1, 1, 1], [1, 1, 1], 1], {}, ["schedule_conv3d_nchw_cuda", [128, 1, 20, 20, 20], [128, 1, 20, 20, 20], [1, 1, 1], [1, 1, 1], [1, 1, 1], 1], {"i": 608721315, "t": "", "c": null, "e": [["tile_n", "sp", [-1, 1, 4, 4]], ["tile_f", "sp", [-1, 2, 1, 2]], ["tile_d", "sp", [-1, 1, 1, 1]], ["tile_y", "sp", [-1, 1, 1, 1]], ["tile_x", "sp", [-1, 1, 3, 1]], ["tile_rc", "sp", [-1, 1]], ["tile_rd", "sp", [-1, 1]], ["tile_ry", "sp", [-1, 4]], ["tile_rx", "sp", [-1, 1]], ["auto_unroll_max_step", "ot", 0], ["unroll_explicit", "ot", 1], ["fuse_yx", "ot", 0]]}], "r": [[0.00495371375], 0, 1.0237629413604736, 1577632295.4877386], "v": 0.1}
{"i": ["cuda", "schedule_conv3d_nchw_cuda", [[128, 1, 20, 20, 20], [128, 1, 20, 20, 20], [1, 1, 1], [1, 1, 1], [1, 1, 1], 1], {}, ["schedule_conv3d_nchw_cuda", [128, 1, 20, 20, 20], [128, 1, 20, 20, 20], [1, 1, 1], [1, 1, 1], [1, 1, 1], 1], {"i": 1404983929, "t": "", "c": null, "e": [["tile_n", "sp", [-1, 1, 4, 2]], ["tile_f", "sp", [-1, 8, 1, 2]], ["tile_d", "sp", [-1, 1, 1, 1]], ["tile_y", "sp", [-1, 1, 1, 1]], ["tile_x", "sp", [-1, 1, 3, 1]], ["tile_rc", "sp", [-1, 1]], ["tile_rd", "sp", [-1, 1]], ["tile_ry", "sp", [-1, 4]], ["tile_rx", "sp", [-1, 1]], ["auto_unroll_max_step", "ot", 512], ["unroll_explicit", "ot", 0], ["fuse_yx", "ot", 1]]}], "r": [[0.00425931825], 0, 1.0657169818878174, 1577632296.088684], "v": 0.1}
{"i": ["cuda", "schedule_conv3d_nchw_cuda", [[128, 1, 20, 20, 20], [128, 1, 20, 20, 20], [1, 1, 1], [1, 1, 1], [1, 1, 1], 1], {}, ["schedule_conv3d_nchw_cuda", [128, 1, 20, 20, 20], [128, 1, 20, 20, 20], [1, 1, 1], [1, 1, 1], [1, 1, 1], 1], {"i": 1404979729, "t": "", "c": null, "e": [["tile_n", "sp", [-1, 1, 4, 2]], ["tile_f", "sp", [-1, 16, 1, 1]], ["tile_d", "sp", [-1, 1, 1, 1]], ["tile_y", "sp", [-1, 1, 1, 1]], ["tile_x", "sp", [-1, 1, 3, 1]], ["tile_rc", "sp", [-1, 1]], ["tile_rd", "sp", [-1, 1]], ["tile_ry", "sp", [-1, 4]], ["tile_rx", "sp", [-1, 1]], ["auto_unroll_max_step", "ot", 512], ["unroll_explicit", "ot", 0], ["fuse_yx", "ot", 1]]}], "r": [[0.00424603725], 0, 1.026623010635376, 1577632296.6246383], "v": 0.1}
{"i": ["cuda", "schedule_conv3d_nchw_cuda", [[128, 1, 20, 20, 20], [128, 1, 20, 20, 20], [1, 1, 1], [1, 1, 1], [1, 1, 1], 1], {}, ["schedule_conv3d_nchw_cuda", [128, 1, 20, 20, 20], [128, 1, 20, 20, 20], [1, 1, 1], [1, 1, 1], [1, 1, 1], 1], {"i": 2201246115, "t": "", "c": null, "e": [["tile_n", "sp", [-1, 1, 4, 4]], ["tile_f", "sp", [-1, 2, 1, 2]], ["tile_d", "sp", [-1, 1, 1, 1]], ["tile_y", "sp", [-1, 1, 1, 1]], ["tile_x", "sp", [-1, 1, 3, 1]], ["tile_rc", "sp", [-1, 1]], ["tile_rd", "sp", [-1, 1]], ["tile_ry", "sp", [-1, 4]], ["tile_rx", "sp", [-1, 1]], ["auto_unroll_max_step", "ot", 1500], ["unroll_explicit", "ot", 1], ["fuse_yx", "ot", 1]]}], "r": [[0.01018183975], 0, 1.4184753894805908, 1577632297.2697542], "v": 0.1}
{"i": ["cuda", "schedule_conv3d_nchw_cuda", [[128, 1, 20, 20, 20], [128, 1, 20, 20, 20], [1, 1, 1], [1, 1, 1], [1, 1, 1], 1], {}, ["schedule_conv3d_nchw_cuda", [128, 1, 20, 20, 20], [128, 1, 20, 20, 20], [1, 1, 1], [1, 1, 1], [1, 1, 1], 1], {"i": 1399339575, "t": "", "c": null, "e": [["tile_n", "sp", [-1, 1, 4, 1]], ["tile_f", "sp", [-1, 1, 2, 2]], ["tile_d", "sp", [-1, 1, 1, 1]], ["tile_y", "sp", [-1, 1, 3, 1]], ["tile_x", "sp", [-1, 3, 1, 1]], ["tile_rc", "sp", [-1, 1]], ["tile_rd", "sp", [-1, 1]], ["tile_ry", "sp", [-1, 2]], ["tile_rx", "sp", [-1, 1]], ["auto_unroll_max_step", "ot", 512], ["unroll_explicit", "ot", 0], ["fuse_yx", "ot", 1]]}], "r": [[0.00755150875], 0, 1.057884693145752, 1577632297.8398774], "v": 0.1}
{"i": ["cuda", "schedule_conv3d_nchw_cuda", [[128, 1, 20, 20, 20], [128, 1, 20, 20, 20], [1, 1, 1], [1, 1, 1], [1, 1, 1], 1], {}, ["schedule_conv3d_nchw_cuda", [128, 1, 20, 20, 20], [128, 1, 20, 20, 20], [1, 1, 1], [1, 1, 1], [1, 1, 1], 1], {"i": 1996536375, "t": "", "c": null, "e": [["tile_n", "sp", [-1, 1, 4, 1]], ["tile_f", "sp", [-1, 1, 2, 2]], ["tile_d", "sp", [-1, 1, 1, 1]], ["tile_y", "sp", [-1, 1, 3, 1]], ["tile_x", "sp", [-1, 3, 1, 1]], ["tile_rc", "sp", [-1, 1]], ["tile_rd", "sp", [-1, 1]], ["tile_ry", "sp", [-1, 2]], ["tile_rx", "sp", [-1, 1]], ["auto_unroll_max_step", "ot", 512], ["unroll_explicit", "ot", 1], ["fuse_yx", "ot", 1]]}], "r": [[0.00716763975], 0, 1.2045023441314697, 1577632298.4443157], "v": 0.1}
{"i": ["cuda", "schedule_conv3d_nchw_cuda", [[128, 1, 20, 20, 20], [128, 1, 20, 20, 20], [1, 1, 1], [1, 1, 1], [1, 1, 1], 1], {}, ["schedule_conv3d_nchw_cuda", [128, 1, 20, 20, 20], [128, 1, 20, 20, 20], [1, 1, 1], [1, 1, 1], [1, 1, 1], 1], {"i": 1205914129, "t": "", "c": null, "e": [["tile_n", "sp", [-1, 1, 4, 2]], ["tile_f", "sp", [-1, 16, 1, 1]], ["tile_d", "sp", [-1, 1, 1, 1]], ["tile_y", "sp", [-1, 1, 1, 1]], ["tile_x", "sp", [-1, 1, 3, 1]], ["tile_rc", "sp", [-1, 1]], ["tile_rd", "sp", [-1, 1]], ["tile_ry", "sp", [-1, 4]], ["tile_rx", "sp", [-1, 1]], ["auto_unroll_max_step", "ot", 0], ["unroll_explicit", "ot", 0], ["fuse_yx", "ot", 1]]}], "r": [[0.00421496825], 0, 1.0033111572265625, 1577632299.050542], "v": 0.1}
{"i": ["cuda", "schedule_conv3d_nchw_cuda", [[128, 1, 20, 20, 20], [128, 1, 20, 20, 20], [1, 1, 1], [1, 1, 1], [1, 1, 1], 1], {}, ["schedule_conv3d_nchw_cuda", [128, 1, 20, 20, 20], [128, 1, 20, 20, 20], [1, 1, 1], [1, 1, 1], [1, 1, 1], 1], {"i": 608746208, "t": "", "c": null, "e": [["tile_n", "sp", [-1, 1, 2, 1]], ["tile_f", "sp", [-1, 32, 1, 1]], ["tile_d", "sp", [-1, 1, 3, 1]], ["tile_y", "sp", [-1, 1, 1, 1]], ["tile_x", "sp", [-1, 1, 3, 1]], ["tile_rc", "sp", [-1, 1]], ["tile_rd", "sp", [-1, 1]], ["tile_ry", "sp", [-1, 4]], ["tile_rx", "sp", [-1, 1]], ["auto_unroll_max_step", "ot", 0], ["unroll_explicit", "ot", 1], ["fuse_yx", "ot", 0]]}], "r": [[0.003933182], 0, 1.045480728149414, 1577632299.6602006], "v": 0.1}
{"i": ["cuda", "schedule_conv3d_nchw_cuda", [[128, 1, 20, 20, 20], [128, 1, 20, 20, 20], [1, 1, 1], [1, 1, 1], [1, 1, 1], 1], {}, ["schedule_conv3d_nchw_cuda", [128, 1, 20, 20, 20], [128, 1, 20, 20, 20], [1, 1, 1], [1, 1, 1], [1, 1, 1], 1], {"i": 11664488, "t": "", "c": null, "e": [["tile_n", "sp", [-1, 1, 2, 1]], ["tile_f", "sp", [-1, 16, 1, 1]], ["tile_d", "sp", [-1, 1, 3, 1]], ["tile_y", "sp", [-1, 1, 3, 1]], ["tile_x", "sp", [-1, 1, 3, 1]], ["tile_rc", "sp", [-1, 1]], ["tile_rd", "sp", [-1, 1]], ["tile_ry", "sp", [-1, 4]], ["tile_rx", "sp", [-1, 1]], ["auto_unroll_max_step", "ot", 0], ["unroll_explicit", "ot", 0], ["fuse_yx", "ot", 0]]}], "r": [[0.00334171925], 0, 0.9687037467956543, 1577632527.0977688], "v": 0.1}
{"i": ["cuda", "schedule_conv3d_nchw_cuda", [[128, 1, 20, 20, 20], [128, 1, 20, 20, 20], [1, 1, 1], [1, 1, 1], [1, 1, 1], 1], {}, ["schedule_conv3d_nchw_cuda", [128, 1, 20, 20, 20], [128, 1, 20, 20, 20], [1, 1, 1], [1, 1, 1], [1, 1, 1], 1], {"i": 807926888, "t": "", "c": null, "e": [["tile_n", "sp", [-1, 1, 2, 1]], ["tile_f", "sp", [-1, 16, 1, 1]], ["tile_d", "sp", [-1, 1, 3, 1]], ["tile_y", "sp", [-1, 1, 3, 1]], ["tile_x", "sp", [-1, 1, 3, 1]], ["tile_rc", "sp", [-1, 1]], ["tile_rd", "sp", [-1, 1]], ["tile_ry", "sp", [-1, 4]], ["tile_rx", "sp", [-1, 1]], ["auto_unroll_max_step", "ot", 512], ["unroll_explicit", "ot", 1], ["fuse_yx", "ot", 0]]}], "r": [[0.0032926375], 0, 1.3607518672943115, 1577632527.7395132], "v": 0.1}
{"i": ["cuda", "schedule_conv3d_nchw_cuda", [[128, 1, 20, 20, 20], [128, 1, 20, 20, 20], [1, 1, 1], [1, 1, 1], [1, 1, 1], 1], {}, ["schedule_conv3d_nchw_cuda", [128, 1, 20, 20, 20], [128, 1, 20, 20, 20], [1, 1, 1], [1, 1, 1], [1, 1, 1], 1], {"i": 608861288, "t": "", "c": null, "e": [["tile_n", "sp", [-1, 1, 2, 1]], ["tile_f", "sp", [-1, 16, 1, 1]], ["tile_d", "sp", [-1, 1, 3, 1]], ["tile_y", "sp", [-1, 1, 3, 1]], ["tile_x", "sp", [-1, 1, 3, 1]], ["tile_rc", "sp", [-1, 1]], ["tile_rd", "sp", [-1, 1]], ["tile_ry", "sp", [-1, 4]], ["tile_rx", "sp", [-1, 1]], ["auto_unroll_max_step", "ot", 0], ["unroll_explicit", "ot", 1], ["fuse_yx", "ot", 0]]}], "r": [[0.003334168], 0, 0.8665199279785156, 1577632528.246371], "v": 0.1}
{"i": ["cuda", "schedule_conv3d_nchw_cuda", [[128, 1, 20, 20, 20], [128, 1, 20, 20, 20], [1, 1, 1], [1, 1, 1], [1, 1, 1], 1], {}, ["schedule_conv3d_nchw_cuda", [128, 1, 20, 20, 20], [128, 1, 20, 20, 20], [1, 1, 1], [1, 1, 1], [1, 1, 1], 1], {"i": 409795688, "t": "", "c": null, "e": [["tile_n", "sp", [-1, 1, 2, 1]], ["tile_f", "sp", [-1, 16, 1, 1]], ["tile_d", "sp", [-1, 1, 3, 1]], ["tile_y", "sp", [-1, 1, 3, 1]], ["tile_x", "sp", [-1, 1, 3, 1]], ["tile_rc", "sp", [-1, 1]], ["tile_rd", "sp", [-1, 1]], ["tile_ry", "sp", [-1, 4]], ["tile_rx", "sp", [-1, 1]], ["auto_unroll_max_step", "ot", 1500], ["unroll_explicit", "ot", 0], ["fuse_yx", "ot", 0]]}], "r": [[0.00336432], 0, 1.0865142345428467, 1577632528.8385682], "v": 0.1}
{"i": ["cuda", "schedule_conv3d_nchw_cuda", [[128, 1, 20, 20, 20], [128, 1, 20, 20, 20], [1, 1, 1], [1, 1, 1], [1, 1, 1], 1], {}, ["schedule_conv3d_nchw_cuda", [128, 1, 20, 20, 20], [128, 1, 20, 20, 20], [1, 1, 1], [1, 1, 1], [1, 1, 1], 1], {"i": 1006992488, "t": "", "c": null, "e": [["tile_n", "sp", [-1, 1, 2, 1]], ["tile_f", "sp", [-1, 16, 1, 1]], ["tile_d", "sp", [-1, 1, 3, 1]], ["tile_y", "sp", [-1, 1, 3, 1]], ["tile_x", "sp", [-1, 1, 3, 1]], ["tile_rc", "sp", [-1, 1]], ["tile_rd", "sp", [-1, 1]], ["tile_ry", "sp", [-1, 4]], ["tile_rx", "sp", [-1, 1]], ["auto_unroll_max_step", "ot", 1500], ["unroll_explicit", "ot", 1], ["fuse_yx", "ot", 0]]}], "r": [[0.003252926], 0, 1.320113182067871, 1577632529.433723], "v": 0.1}
{"i": ["cuda", "schedule_conv3d_nchw_cuda", [[128, 1, 20, 20, 20], [128, 1, 20, 20, 20], [1, 1, 1], [1, 1, 1], [1, 1, 1], 1], {}, ["schedule_conv3d_nchw_cuda", [128, 1, 20, 20, 20], [128, 1, 20, 20, 20], [1, 1, 1], [1, 1, 1], [1, 1, 1], 1], {"i": 238378088, "t": "", "c": null, "e": [["tile_n", "sp", [-1, 1, 2, 1]], ["tile_f", "sp", [-1, 16, 1, 1]], ["tile_d", "sp", [-1, 1, 3, 1]], ["tile_y", "sp", [-1, 1, 3, 1]], ["tile_x", "sp", [-1, 1, 3, 1]], ["tile_rc", "sp", [-1, 1]], ["tile_rd", "sp", [-1, 1]], ["tile_ry", "sp", [-1, 2]], ["tile_rx", "sp", [-1, 2]], ["auto_unroll_max_step", "ot", 512], ["unroll_explicit", "ot", 0], ["fuse_yx", "ot", 0]]}], "r": [[0.00531631475], 0, 1.0806217193603516, 1577632530.0920844], "v": 0.1}
{"i": ["cuda", "schedule_conv3d_nchw_cuda", [[128, 1, 20, 20, 20], [128, 1, 20, 20, 20], [1, 1, 1], [1, 1, 1], [1, 1, 1], 1], {}, ["schedule_conv3d_nchw_cuda", [128, 1, 20, 20, 20], [128, 1, 20, 20, 20], [1, 1, 1], [1, 1, 1], [1, 1, 1], 1], {"i": 1205573421, "t": "", "c": null, "e": [["tile_n", "sp", [-1, 1, 8, 1]], ["tile_f", "sp", [-1, 4, 2, 2]], ["tile_d", "sp", [-1, 1, 1, 1]], ["tile_y", "sp", [-1, 1, 3, 1]], ["tile_x", "sp", [-1, 1, 1, 1]], ["tile_rc", "sp", [-1, 1]], ["tile_rd", "sp", [-1, 1]], ["tile_ry", "sp", [-1, 4]], ["tile_rx", "sp", [-1, 1]], ["auto_unroll_max_step", "ot", 0], ["unroll_explicit", "ot", 0], ["fuse_yx", "ot", 1]]}], "r": [[0.00534935375], 0, 1.0334832668304443, 1577632530.6998265], "v": 0.1}
{"i": ["cuda", "schedule_conv3d_nchw_cuda", [[128, 1, 20, 20, 20], [128, 1, 20, 20, 20], [1, 1, 1], [1, 1, 1], [1, 1, 1], 1], {}, ["schedule_conv3d_nchw_cuda", [128, 1, 20, 20, 20], [128, 1, 20, 20, 20], [1, 1, 1], [1, 1, 1], [1, 1, 1], 1], {"i": 1802770221, "t": "", "c": null, "e": [["tile_n", "sp", [-1, 1, 8, 1]], ["tile_f", "sp", [-1, 4, 2, 2]], ["tile_d", "sp", [-1, 1, 1, 1]], ["tile_y", "sp", [-1, 1, 3, 1]], ["tile_x", "sp", [-1, 1, 1, 1]], ["tile_rc", "sp", [-1, 1]], ["tile_rd", "sp", [-1, 1]], ["tile_ry", "sp", [-1, 4]], ["tile_rx", "sp", [-1, 1]], ["auto_unroll_max_step", "ot", 0], ["unroll_explicit", "ot", 1], ["fuse_yx", "ot", 1]]}], "r": [[0.00534905425], 0, 1.0394909381866455, 1577632531.2735138], "v": 0.1}
{"i": ["cuda", "schedule_conv3d_nchw_cuda", [[128, 1, 20, 20, 20], [128, 1, 20, 20, 20], [1, 1, 1], [1, 1, 1], [1, 1, 1], 1], {}, ["schedule_conv3d_nchw_cuda", [128, 1, 20, 20, 20], [128, 1, 20, 20, 20], [1, 1, 1], [1, 1, 1], [1, 1, 1], 1], {"i": 1238660541, "t": "", "c": null, "e": [["tile_n", "sp", [-1, 1, 8, 1]], ["tile_f", "sp", [-1, 8, 2, 1]], ["tile_d", "sp", [-1, 1, 3, 1]], ["tile_y", "sp", [-1, 1, 1, 1]], ["tile_x", "sp", [-1, 1, 1, 1]], ["tile_rc", "sp", [-1, 1]], ["tile_rd", "sp", [-1, 1]], ["tile_ry", "sp", [-1, 4]], ["tile_rx", "sp", [-1, 2]], ["auto_unroll_max_step", "ot", 0], ["unroll_explicit", "ot", 0], ["fuse_yx", "ot", 1]]}], "r": [[0.0056329295], 0, 1.1046946048736572, 1577632531.9088678], "v": 0.1}
{"i": ["cuda", "schedule_conv3d_nchw_cuda", [[128, 1, 20, 20, 20], [128, 1, 20, 20, 20], [1, 1, 1], [1, 1, 1], [1, 1, 1], 1], {}, ["schedule_conv3d_nchw_cuda", [128, 1, 20, 20, 20], [128, 1, 20, 20, 20], [1, 1, 1], [1, 1, 1], [1, 1, 1], 1], {"i": 437443688, "t": "", "c": null, "e": [["tile_n", "sp", [-1, 1, 2, 1]], ["tile_f", "sp", [-1, 16, 1, 1]], ["tile_d", "sp", [-1, 1, 3, 1]], ["tile_y", "sp", [-1, 1, 3, 1]], ["tile_x", "sp", [-1, 1, 3, 1]], ["tile_rc", "sp", [-1, 1]], ["tile_rd", "sp", [-1, 1]], ["tile_ry", "sp", [-1, 2]], ["tile_rx", "sp", [-1, 2]], ["auto_unroll_max_step", "ot", 1500], ["unroll_explicit", "ot", 0], ["fuse_yx", "ot", 0]]}], "r": [[0.00430684275], 0, 1.4160356521606445, 1577632532.7335362], "v": 0.1}
{"i": ["cuda", "schedule_conv3d_nchw_cuda", [[128, 1, 20, 20, 20], [128, 1, 20, 20, 20], [1, 1, 1], [1, 1, 1], [1, 1, 1], 1], {}, ["schedule_conv3d_nchw_cuda", [128, 1, 20, 20, 20], [128, 1, 20, 20, 20], [1, 1, 1], [1, 1, 1], [1, 1, 1], 1], {"i": 39312488, "t": "", "c": null, "e": [["tile_n", "sp", [-1, 1, 2, 1]], ["tile_f", "sp", [-1, 16, 1, 1]], ["tile_d", "sp", [-1, 1, 3, 1]], ["tile_y", "sp", [-1, 1, 3, 1]], ["tile_x", "sp", [-1, 1, 3, 1]], ["tile_rc", "sp", [-1, 1]], ["tile_rd", "sp", [-1, 1]], ["tile_ry", "sp", [-1, 2]], ["tile_rx", "sp", [-1, 2]], ["auto_unroll_max_step", "ot", 0], ["unroll_explicit", "ot", 0], ["fuse_yx", "ot", 0]]}], "r": [[0.00483555375], 0, 1.0750036239624023, 1577632533.3858783], "v": 0.1}
{"i": ["cuda", "schedule_conv3d_nchw_cuda", [[128, 1, 20, 20, 20], [128, 1, 20, 20, 20], [1, 1, 1], [1, 1, 1], [1, 1, 1], 1], {}, ["schedule_conv3d_nchw_cuda", [128, 1, 20, 20, 20], [128, 1, 20, 20, 20], [1, 1, 1], [1, 1, 1], [1, 1, 1], 1], {"i": 608404695, "t": "", "c": null, "e": [["tile_n", "sp", [-1, 1, 4, 1]], ["tile_f", "sp", [-1, 8, 1, 2]], ["tile_d", "sp", [-1, 1, 3, 1]], ["tile_y", "sp", [-1, 1, 3, 1]], ["tile_x", "sp", [-1, 1, 1, 1]], ["tile_rc", "sp", [-1, 1]], ["tile_rd", "sp", [-1, 1]], ["tile_ry", "sp", [-1, 4]], ["tile_rx", "sp", [-1, 1]], ["auto_unroll_max_step", "ot", 0], ["unroll_explicit", "ot", 1], ["fuse_yx", "ot", 0]]}], "r": [[0.00338948425], 0, 0.9779398441314697, 1577632533.966511], "v": 0.1}
{"i": ["cuda", "schedule_conv3d_nchw_cuda", [[128, 1, 20, 20, 20], [128, 1, 20, 20, 20], [1, 1, 1], [1, 1, 1], [1, 1, 1], 1], {}, ["schedule_conv3d_nchw_cuda", [128, 1, 20, 20, 20], [128, 1, 20, 20, 20], [1, 1, 1], [1, 1, 1], [1, 1, 1], 1], {"i": 210734408, "t": "", "c": null, "e": [["tile_n", "sp", [-1, 1, 2, 1]], ["tile_f", "sp", [-1, 16, 1, 2]], ["tile_d", "sp", [-1, 1, 3, 1]], ["tile_y", "sp", [-1, 1, 3, 1]], ["tile_x", "sp", [-1, 1, 3, 1]], ["tile_rc", "sp", [-1, 1]], ["tile_rd", "sp", [-1, 1]], ["tile_ry", "sp", [-1, 4]], ["tile_rx", "sp", [-1, 1]], ["auto_unroll_max_step", "ot", 512], ["unroll_explicit", "ot", 0], ["fuse_yx", "ot", 0]]}], "r": [[0.00379042975], 0, 1.0572617053985596, 1577632536.5804665], "v": 0.1}
{"i": ["cuda", "schedule_conv3d_nchw_cuda", [[128, 1, 20, 20, 20], [128, 1, 20, 20, 20], [1, 1, 1], [1, 1, 1], [1, 1, 1], 1], {}, ["schedule_conv3d_nchw_cuda", [128, 1, 20, 20, 20], [128, 1, 20, 20, 20], [1, 1, 1], [1, 1, 1], [1, 1, 1], 1], {"i": 1238664741, "t": "", "c": null, "e": [["tile_n", "sp", [-1, 1, 8, 1]], ["tile_f", "sp", [-1, 8, 2, 2]], ["tile_d", "sp", [-1, 1, 3, 1]], ["tile_y", "sp", [-1, 1, 1, 1]], ["tile_x", "sp", [-1, 1, 1, 1]], ["tile_rc", "sp", [-1, 1]], ["tile_rd", "sp", [-1, 1]], ["tile_ry", "sp", [-1, 4]], ["tile_rx", "sp", [-1, 2]], ["auto_unroll_max_step", "ot", 0], ["unroll_explicit", "ot", 0], ["fuse_yx", "ot", 1]]}], "r": [[0.00634480925], 0, 1.0893094539642334, 1577632537.1952477], "v": 0.1}
{"i": ["cuda", "schedule_conv3d_nchw_cuda", [[128, 1, 20, 20, 20], [128, 1, 20, 20, 20], [1, 1, 1], [1, 1, 1], [1, 1, 1], 1], {}, ["schedule_conv3d_nchw_cuda", [128, 1, 20, 20, 20], [128, 1, 20, 20, 20], [1, 1, 1], [1, 1, 1], [1, 1, 1], 1], {"i": 1835857341, "t": "", "c": null, "e": [["tile_n", "sp", [-1, 1, 8, 1]], ["tile_f", "sp", [-1, 8, 2, 1]], ["tile_d", "sp", [-1, 1, 3, 1]], ["tile_y", "sp", [-1, 1, 1, 1]], ["tile_x", "sp", [-1, 1, 1, 1]], ["tile_rc", "sp", [-1, 1]], ["tile_rd", "sp", [-1, 1]], ["tile_ry", "sp", [-1, 4]], ["tile_rx", "sp", [-1, 2]], ["auto_unroll_max_step", "ot", 0], ["unroll_explicit", "ot", 1], ["fuse_yx", "ot", 1]]}], "r": [[0.0057097745], 0, 1.0273017883300781, 1577632537.7554002], "v": 0.1}
{"i": ["cuda", "schedule_conv3d_nchw_cuda", [[128, 1, 20, 20, 20], [128, 1, 20, 20, 20], [1, 1, 1], [1, 1, 1], [1, 1, 1], 1], {}, ["schedule_conv3d_nchw_cuda", [128, 1, 20, 20, 20], [128, 1, 20, 20, 20], [1, 1, 1], [1, 1, 1], [1, 1, 1], 1], {"i": 807931208, "t": "", "c": null, "e": [["tile_n", "sp", [-1, 1, 2, 1]], ["tile_f", "sp", [-1, 16, 1, 2]], ["tile_d", "sp", [-1, 1, 3, 1]], ["tile_y", "sp", [-1, 1, 3, 1]], ["tile_x", "sp", [-1, 1, 3, 1]], ["tile_rc", "sp", [-1, 1]], ["tile_rd", "sp", [-1, 1]], ["tile_ry", "sp", [-1, 4]], ["tile_rx", "sp", [-1, 1]], ["auto_unroll_max_step", "ot", 512], ["unroll_explicit", "ot", 1], ["fuse_yx", "ot", 0]]}], "r": [[0.004265802], 0, 1.2891526222229004, 1577632538.4193485], "v": 0.1}
{"i": ["cuda", "schedule_conv3d_nchw_cuda", [[128, 1, 20, 20, 20], [128, 1, 20, 20, 20], [1, 1, 1], [1, 1, 1], [1, 1, 1], 1], {}, ["schedule_conv3d_nchw_cuda", [128, 1, 20, 20, 20], [128, 1, 20, 20, 20], [1, 1, 1], [1, 1, 1], [1, 1, 1], 1], {"i": 1034640488, "t": "", "c": null, "e": [["tile_n", "sp", [-1, 1, 2, 1]], ["tile_f", "sp", [-1, 16, 1, 1]], ["tile_d", "sp", [-1, 1, 3, 1]], ["tile_y", "sp", [-1, 1, 3, 1]], ["tile_x", "sp", [-1, 1, 3, 1]], ["tile_rc", "sp", [-1, 1]], ["tile_rd", "sp", [-1, 1]], ["tile_ry", "sp", [-1, 2]], ["tile_rx", "sp", [-1, 2]], ["auto_unroll_max_step", "ot", 1500], ["unroll_explicit", "ot", 1], ["fuse_yx", "ot", 0]]}], "r": [[0.00489591425], 0, 2.0252363681793213, 1577632539.2000484], "v": 0.1}
