third_input.log
{"i": ["cuda", "schedule_direct_3d_cuda", [[1, 128, 20, 20, 20], [128, 128, 3, 3, 3], [1, 1, 1], [1, 1, 1], 1], {}, ["schedule_direct_3d_cuda", [1, 128, 20, 20, 20], [128, 128, 3, 3, 3], [1, 1, 1], [1, 1, 1], 1], {"i": 2541497668, "t": "", "c": null, "e": [["tile_f", "sp", [-1, 4, 16, 1]], ["tile_d", "sp", [-1, 1, 1, 4]], ["tile_y", "sp", [-1, 1, 2, 10]], ["tile_x", "sp", [-1, 1, 1, 10]], ["tile_rc", "sp", [-1, 4]], ["tile_rd", "sp", [-1, 3]], ["tile_ry", "sp", [-1, 1]], ["tile_rx", "sp", [-1, 1]], ["auto_unroll_max_step", "ot", 1500], ["unroll_explicit", "ot", 1]]}], "r": [[0.15006878925], 0, 7.592148303985596, 1575002947.3156245], "v": 0.1}
{"i": ["cuda", "schedule_direct_3d_cuda", [[1, 128, 20, 20, 20], [128, 128, 3, 3, 3], [1, 1, 1], [1, 1, 1], 1], {}, ["schedule_direct_3d_cuda", [1, 128, 20, 20, 20], [128, 128, 3, 3, 3], [1, 1, 1], [1, 1, 1], 1], {"i": 2049989295, "t": "", "c": null, "e": [["tile_f", "sp", [-1, 1, 4, 1]], ["tile_d", "sp", [-1, 10, 1, 1]], ["tile_y", "sp", [-1, 2, 1, 1]], ["tile_x", "sp", [-1, 2, 1, 10]], ["tile_rc", "sp", [-1, 4]], ["tile_rd", "sp", [-1, 3]], ["tile_ry", "sp", [-1, 1]], ["tile_rx", "sp", [-1, 1]], ["auto_unroll_max_step", "ot", 512], ["unroll_explicit", "ot", 1]]}], "r": [[0.134203403], 0, 7.791003465652466, 1575002950.3856144], "v": 0.1}
{"i": ["cuda", "schedule_direct_3d_cuda", [[1, 128, 20, 20, 20], [128, 128, 3, 3, 3], [1, 1, 1], [1, 1, 1], 1], {}, ["schedule_direct_3d_cuda", [1, 128, 20, 20, 20], [128, 128, 3, 3, 3], [1, 1, 1], [1, 1, 1], 1], {"i": 2736580870, "t": "", "c": null, "e": [["tile_f", "sp", [-1, 1, 2, 4]], ["tile_d", "sp", [-1, 1, 1, 1]], ["tile_y", "sp", [-1, 2, 1, 1]], ["tile_x", "sp", [-1, 2, 5, 1]], ["tile_rc", "sp", [-1, 16]], ["tile_rd", "sp", [-1, 1]], ["tile_ry", "sp", [-1, 1]], ["tile_rx", "sp", [-1, 3]], ["auto_unroll_max_step", "ot", 1500], ["unroll_explicit", "ot", 1]]}], "r": [[0.019646024166666668], 0, 2.7642552852630615, 1575002955.8471966], "v": 0.1}
{"i": ["cuda", "schedule_direct_3d_cuda", [[1, 128, 20, 20, 20], [128, 128, 3, 3, 3], [1, 1, 1], [1, 1, 1], 1], {}, ["schedule_direct_3d_cuda", [1, 128, 20, 20, 20], [128, 128, 3, 3, 3], [1, 1, 1], [1, 1, 1], 1], {"i": 4065298, "t": "", "c": null, "e": [["tile_f", "sp", [-1, 1, 16, 2]], ["tile_d", "sp", [-1, 2, 1, 10]], ["tile_y", "sp", [-1, 1, 2, 1]], ["tile_x", "sp", [-1, 10, 1, 2]], ["tile_rc", "sp", [-1, 1]], ["tile_rd", "sp", [-1, 1]], ["tile_ry", "sp", [-1, 1]], ["tile_rx", "sp", [-1, 1]], ["auto_unroll_max_step", "ot", 0], ["unroll_explicit", "ot", 0]]}], "r": [[0.14632625175], 0, 3.0900187492370605, 1575002958.6040697], "v": 0.1}
{"i": ["cuda", "schedule_direct_3d_cuda", [[1, 128, 20, 20, 20], [128, 128, 3, 3, 3], [1, 1, 1], [1, 1, 1], 1], {}, ["schedule_direct_3d_cuda", [1, 128, 20, 20, 20], [128, 128, 3, 3, 3], [1, 1, 1], [1, 1, 1], 1], {"i": 2707064072, "t": "", "c": null, "e": [["tile_f", "sp", [-1, 4, 32, 1]], ["tile_d", "sp", [-1, 1, 1, 4]], ["tile_y", "sp", [-1, 5, 4, 1]], ["tile_x", "sp", [-1, 2, 1, 2]], ["tile_rc", "sp", [-1, 1]], ["tile_rd", "sp", [-1, 1]], ["tile_ry", "sp", [-1, 1]], ["tile_rx", "sp", [-1, 3]], ["auto_unroll_max_step", "ot", 1500], ["unroll_explicit", "ot", 1]]}], "r": [[0.023020630666666667], 0, 3.3706955909729004, 1575002985.834006], "v": 0.1}
{"i": ["cuda", "schedule_direct_3d_cuda", [[1, 128, 20, 20, 20], [128, 128, 3, 3, 3], [1, 1, 1], [1, 1, 1], 1], {}, ["schedule_direct_3d_cuda", [1, 128, 20, 20, 20], [128, 128, 3, 3, 3], [1, 1, 1], [1, 1, 1], 1], {"i": 2588512858, "t": "", "c": null, "e": [["tile_f", "sp", [-1, 1, 16, 2]], ["tile_d", "sp", [-1, 5, 1, 2]], ["tile_y", "sp", [-1, 1, 2, 5]], ["tile_x", "sp", [-1, 2, 1, 1]], ["tile_rc", "sp", [-1, 2]], ["tile_rd", "sp", [-1, 1]], ["tile_ry", "sp", [-1, 3]], ["tile_rx", "sp", [-1, 1]], ["auto_unroll_max_step", "ot", 1500], ["unroll_explicit", "ot", 1]]}], "r": [[0.008022325647058823], 0, 4.021671533584595, 1575002993.3312879], "v": 0.1}
{"i": ["cuda", "schedule_direct_3d_cuda", [[1, 128, 20, 20, 20], [128, 128, 3, 3, 3], [1, 1, 1], [1, 1, 1], 1], {}, ["schedule_direct_3d_cuda", [1, 128, 20, 20, 20], [128, 128, 3, 3, 3], [1, 1, 1], [1, 1, 1], 1], {"i": 615978043, "t": "", "c": null, "e": [["tile_f", "sp", [-1, 1, 2, 2]], ["tile_d", "sp", [-1, 1, 1, 5]], ["tile_y", "sp", [-1, 5, 2, 1]], ["tile_x", "sp", [-1, 5, 2, 1]], ["tile_rc", "sp", [-1, 1]], ["tile_rd", "sp", [-1, 1]], ["tile_ry", "sp", [-1, 3]], ["tile_rx", "sp", [-1, 1]], ["auto_unroll_max_step", "ot", 512], ["unroll_explicit", "ot", 0]]}], "r": [[0.20600720025], 0, 5.6840715408325195, 1575003837.9424415], "v": 0.1}
{"i": ["cuda", "schedule_direct_3d_cuda", [[1, 128, 20, 20, 20], [128, 128, 3, 3, 3], [1, 1, 1], [1, 1, 1], 1], {}, ["schedule_direct_3d_cuda", [1, 128, 20, 20, 20], [128, 128, 3, 3, 3], [1, 1, 1], [1, 1, 1], 1], {"i": 741354178, "t": "", "c": null, "e": [["tile_f", "sp", [-1, 1, 16, 2]], ["tile_d", "sp", [-1, 2, 1, 5]], ["tile_y", "sp", [-1, 5, 2, 1]], ["tile_x", "sp", [-1, 10, 1, 2]], ["tile_rc", "sp", [-1, 1]], ["tile_rd", "sp", [-1, 1]], ["tile_ry", "sp", [-1, 1]], ["tile_rx", "sp", [-1, 3]], ["auto_unroll_max_step", "ot", 512], ["unroll_explicit", "ot", 0]]}], "r": [[0.188936525], 0, 7.521606922149658, 1575003841.657329], "v": 0.1}
{"i": ["cuda", "schedule_direct_3d_cuda", [[1, 128, 20, 20, 20], [128, 128, 3, 3, 3], [1, 1, 1], [1, 1, 1], 1], {}, ["schedule_direct_3d_cuda", [1, 128, 20, 20, 20], [128, 128, 3, 3, 3], [1, 1, 1], [1, 1, 1], 1], {"i": 1004808396, "t": "", "c": null, "e": [["tile_f", "sp", [-1, 1, 1, 2]], ["tile_d", "sp", [-1, 5, 1, 1]], ["tile_y", "sp", [-1, 1, 10, 1]], ["tile_x", "sp", [-1, 1, 2, 5]], ["tile_rc", "sp", [-1, 4]], ["tile_rd", "sp", [-1, 1]], ["tile_ry", "sp", [-1, 1]], ["tile_rx", "sp", [-1, 1]], ["auto_unroll_max_step", "ot", 1500], ["unroll_explicit", "ot", 0]]}], "r": [[0.03066349925], 0, 5.529576539993286, 1575003851.3414254], "v": 0.1}
{"i": ["cuda", "schedule_direct_3d_cuda", [[1, 128, 20, 20, 20], [128, 128, 3, 3, 3], [1, 1, 1], [1, 1, 1], 1], {}, ["schedule_direct_3d_cuda", [1, 128, 20, 20, 20], [128, 128, 3, 3, 3], [1, 1, 1], [1, 1, 1], 1], {"i": 2786745825, "t": "", "c": null, "e": [["tile_f", "sp", [-1, 2, 2, 16]], ["tile_d", "sp", [-1, 2, 1, 1]], ["tile_y", "sp", [-1, 1, 5, 1]], ["tile_x", "sp", [-1, 2, 2, 5]], ["tile_rc", "sp", [-1, 4]], ["tile_rd", "sp", [-1, 3]], ["tile_ry", "sp", [-1, 1]], ["tile_rx", "sp", [-1, 3]], ["auto_unroll_max_step", "ot", 1500], ["unroll_explicit", "ot", 1]]}], "r": [[0.11810438475], 0, 9.332462549209595, 1575003855.235695], "v": 0.1}
{"i": ["cuda", "schedule_direct_3d_cuda", [[1, 128, 20, 20, 20], [128, 128, 3, 3, 3], [1, 1, 1], [1, 1, 1], 1], {}, ["schedule_direct_3d_cuda", [1, 128, 20, 20, 20], [128, 128, 3, 3, 3], [1, 1, 1], [1, 1, 1], 1], {"i": 565912827, "t": "", "c": null, "e": [["tile_f", "sp", [-1, 2, 16, 1]], ["tile_d", "sp", [-1, 5, 1, 2]], ["tile_y", "sp", [-1, 1, 1, 2]], ["tile_x", "sp", [-1, 1, 1, 4]], ["tile_rc", "sp", [-1, 2]], ["tile_rd", "sp", [-1, 3]], ["tile_ry", "sp", [-1, 1]], ["tile_rx", "sp", [-1, 1]], ["auto_unroll_max_step", "ot", 512], ["unroll_explicit", "ot", 0]]}], "r": [[0.007247393214285714], 0, 1.8535103797912598, 1575003965.8093555], "v": 0.1}
{"i": ["cuda", "schedule_direct_3d_cuda", [[1, 128, 20, 20, 20], [128, 128, 3, 3, 3], [1, 1, 1], [1, 1, 1], 1], {}, ["schedule_direct_3d_cuda", [1, 128, 20, 20, 20], [128, 128, 3, 3, 3], [1, 1, 1], [1, 1, 1], 1], {"i": 2153332957, "t": "", "c": null, "e": [["tile_f", "sp", [-1, 2, 1, 2]], ["tile_d", "sp", [-1, 2, 1, 1]], ["tile_y", "sp", [-1, 5, 4, 1]], ["tile_x", "sp", [-1, 1, 10, 1]], ["tile_rc", "sp", [-1, 1]], ["tile_rd", "sp", [-1, 3]], ["tile_ry", "sp", [-1, 3]], ["tile_rx", "sp", [-1, 1]], ["auto_unroll_max_step", "ot", 512], ["unroll_explicit", "ot", 1]]}], "r": [[0.00660937916], 0, 1.8287432193756104, 1575003973.0987964], "v": 0.1}
{"i": ["cuda", "schedule_direct_3d_cuda", [[1, 128, 20, 20, 20], [128, 128, 3, 3, 3], [1, 1, 1], [1, 1, 1], 1], {}, ["schedule_direct_3d_cuda", [1, 128, 20, 20, 20], [128, 128, 3, 3, 3], [1, 1, 1], [1, 1, 1], 1], {"i": 681460931, "t": "", "c": null, "e": [["tile_f", "sp", [-1, 8, 2, 1]], ["tile_d", "sp", [-1, 2, 1, 1]], ["tile_y", "sp", [-1, 5, 4, 1]], ["tile_x", "sp", [-1, 1, 5, 4]], ["tile_rc", "sp", [-1, 1]], ["tile_rd", "sp", [-1, 3]], ["tile_ry", "sp", [-1, 3]], ["tile_rx", "sp", [-1, 1]], ["auto_unroll_max_step", "ot", 512], ["unroll_explicit", "ot", 0]]}], "r": [[0.03791373475], 0, 2.777714729309082, 1575004760.2953424], "v": 0.1}
{"i": ["cuda", "schedule_direct_3d_cuda", [[1, 128, 20, 20, 20], [128, 128, 3, 3, 3], [1, 1, 1], [1, 1, 1], 1], {}, ["schedule_direct_3d_cuda", [1, 128, 20, 20, 20], [128, 128, 3, 3, 3], [1, 1, 1], [1, 1, 1], 1], {"i": 206508901, "t": "", "c": null, "e": [["tile_f", "sp", [-1, 1, 32, 2]], ["tile_d", "sp", [-1, 1, 1, 4]], ["tile_y", "sp", [-1, 1, 2, 2]], ["tile_x", "sp", [-1, 1, 4, 5]], ["tile_rc", "sp", [-1, 4]], ["tile_rd", "sp", [-1, 3]], ["tile_ry", "sp", [-1, 3]], ["tile_rx", "sp", [-1, 1]], ["auto_unroll_max_step", "ot", 0], ["unroll_explicit", "ot", 0]]}], "r": [[0.00199915931372549], 0, 1.6302368640899658, 1575004781.5075252], "v": 0.1}
{"i": ["cuda", "schedule_direct_3d_cuda", [[1, 128, 20, 20, 20], [128, 128, 3, 3, 3], [1, 1, 1], [1, 1, 1], 1], {}, ["schedule_direct_3d_cuda", [1, 128, 20, 20, 20], [128, 128, 3, 3, 3], [1, 1, 1], [1, 1, 1], 1], {"i": 209728721, "t": "", "c": null, "e": [["tile_f", "sp", [-1, 32, 1, 2]], ["tile_d", "sp", [-1, 2, 1, 2]], ["tile_y", "sp", [-1, 2, 5, 1]], ["tile_x", "sp", [-1, 1, 5, 1]], ["tile_rc", "sp", [-1, 8]], ["tile_rd", "sp", [-1, 3]], ["tile_ry", "sp", [-1, 3]], ["tile_rx", "sp", [-1, 1]], ["auto_unroll_max_step", "ot", 0], ["unroll_explicit", "ot", 0]]}], "r": [[0.10414214675], 0, 3.285151958465576, 1575004783.96245], "v": 0.1}
{"i": ["cuda", "schedule_direct_3d_cuda", [[1, 128, 20, 20, 20], [128, 128, 3, 3, 3], [1, 1, 1], [1, 1, 1], 1], {}, ["schedule_direct_3d_cuda", [1, 128, 20, 20, 20], [128, 128, 3, 3, 3], [1, 1, 1], [1, 1, 1], 1], {"i": 2162757373, "t": "", "c": null, "e": [["tile_f", "sp", [-1, 32, 2, 1]], ["tile_d", "sp", [-1, 1, 1, 2]], ["tile_y", "sp", [-1, 4, 5, 1]], ["tile_x", "sp", [-1, 1, 5, 2]], ["tile_rc", "sp", [-1, 2]], ["tile_rd", "sp", [-1, 3]], ["tile_ry", "sp", [-1, 3]], ["tile_rx", "sp", [-1, 1]], ["auto_unroll_max_step", "ot", 512], ["unroll_explicit", "ot", 1]]}], "r": [[0.07765576875], 0, 5.753623723983765, 1575004786.7531748], "v": 0.1}
{"i": ["cuda", "schedule_direct_3d_cuda", [[1, 128, 20, 20, 20], [128, 128, 3, 3, 3], [1, 1, 1], [1, 1, 1], 1], {}, ["schedule_direct_3d_cuda", [1, 128, 20, 20, 20], [128, 128, 3, 3, 3], [1, 1, 1], [1, 1, 1], 1], {"i": 2719992656, "t": "", "c": null, "e": [["tile_f", "sp", [-1, 4, 8, 2]], ["tile_d", "sp", [-1, 20, 1, 1]], ["tile_y", "sp", [-1, 2, 5, 2]], ["tile_x", "sp", [-1, 1, 2, 1]], ["tile_rc", "sp", [-1, 4]], ["tile_rd", "sp", [-1, 1]], ["tile_ry", "sp", [-1, 1]], ["tile_rx", "sp", [-1, 3]], ["auto_unroll_max_step", "ot", 1500], ["unroll_explicit", "ot", 1]]}], "r": [[0.0951711615], 0, 6.438270092010498, 1575004810.6606941], "v": 0.1}
{"i": ["cuda", "schedule_direct_3d_cuda", [[1, 128, 20, 20, 20], [128, 128, 3, 3, 3], [1, 1, 1], [1, 1, 1], 1], {}, ["schedule_direct_3d_cuda", [1, 128, 20, 20, 20], [128, 128, 3, 3, 3], [1, 1, 1], [1, 1, 1], 1], {"i": 1168653394, "t": "", "c": null, "e": [["tile_f", "sp", [-1, 2, 64, 1]], ["tile_d", "sp", [-1, 1, 1, 2]], ["tile_y", "sp", [-1, 1, 5, 4]], ["tile_x", "sp", [-1, 1, 2, 1]], ["tile_rc", "sp", [-1, 1]], ["tile_rd", "sp", [-1, 3]], ["tile_ry", "sp", [-1, 3]], ["tile_rx", "sp", [-1, 1]], ["auto_unroll_max_step", "ot", 1500], ["unroll_explicit", "ot", 0]]}], "r": [[0.0016035745949367088], 0, 1.5521364212036133, 1575004812.58487], "v": 0.1}
{"i": ["cuda", "schedule_direct_3d_cuda", [[1, 128, 20, 20, 20], [128, 128, 3, 3, 3], [1, 1, 1], [1, 1, 1], 1], {}, ["schedule_direct_3d_cuda", [1, 128, 20, 20, 20], [128, 128, 3, 3, 3], [1, 1, 1], [1, 1, 1], 1], {"i": 186405513, "t": "", "c": null, "e": [["tile_f", "sp", [-1, 1, 64, 1]], ["tile_d", "sp", [-1, 2, 1, 2]], ["tile_y", "sp", [-1, 2, 2, 5]], ["tile_x", "sp", [-1, 1, 4, 1]], ["tile_rc", "sp", [-1, 1]], ["tile_rd", "sp", [-1, 3]], ["tile_ry", "sp", [-1, 3]], ["tile_rx", "sp", [-1, 1]], ["auto_unroll_max_step", "ot", 0], ["unroll_explicit", "ot", 0]]}], "r": [[0.002251123796875], 0, 1.846778392791748, 1575005137.3229809], "v": 0.1}
{"i": ["cuda", "schedule_direct_3d_cuda", [[1, 128, 20, 20, 20], [128, 128, 3, 3, 3], [1, 1, 1], [1, 1, 1], 1], {}, ["schedule_direct_3d_cuda", [1, 128, 20, 20, 20], [128, 128, 3, 3, 3], [1, 1, 1], [1, 1, 1], 1], {"i": 193997092, "t": "", "c": null, "e": [["tile_f", "sp", [-1, 8, 4, 2]], ["tile_d", "sp", [-1, 4, 1, 1]], ["tile_y", "sp", [-1, 2, 10, 1]], ["tile_x", "sp", [-1, 1, 4, 1]], ["tile_rc", "sp", [-1, 2]], ["tile_rd", "sp", [-1, 3]], ["tile_ry", "sp", [-1, 3]], ["tile_rx", "sp", [-1, 1]], ["auto_unroll_max_step", "ot", 0], ["unroll_explicit", "ot", 0]]}], "r": [[0.00314951125], 0, 2.2427120208740234, 1575005138.3294733], "v": 0.1}
{"i": ["cuda", "schedule_direct_3d_cuda", [[1, 128, 20, 20, 20], [128, 128, 3, 3, 3], [1, 1, 1], [1, 1, 1], 1], {}, ["schedule_direct_3d_cuda", [1, 128, 20, 20, 20], [128, 128, 3, 3, 3], [1, 1, 1], [1, 1, 1], 1], {"i": 194486793, "t": "", "c": null, "e": [["tile_f", "sp", [-1, 1, 64, 1]], ["tile_d", "sp", [-1, 5, 1, 1]], ["tile_y", "sp", [-1, 1, 2, 10]], ["tile_x", "sp", [-1, 1, 5, 1]], ["tile_rc", "sp", [-1, 2]], ["tile_rd", "sp", [-1, 3]], ["tile_ry", "sp", [-1, 3]], ["tile_rx", "sp", [-1, 1]], ["auto_unroll_max_step", "ot", 0], ["unroll_explicit", "ot", 0]]}], "r": [[0.0015957078253968254], 0, 1.7128651142120361, 1575005139.3237336], "v": 0.1}
{"i": ["cuda", "schedule_direct_3d_cuda", [[1, 128, 20, 20, 20], [128, 128, 3, 3, 3], [1, 1, 1], [1, 1, 1], 1], {}, ["schedule_direct_3d_cuda", [1, 128, 20, 20, 20], [128, 128, 3, 3, 3], [1, 1, 1], [1, 1, 1], 1], {"i": 194347593, "t": "", "c": null, "e": [["tile_f", "sp", [-1, 1, 64, 1]], ["tile_d", "sp", [-1, 5, 1, 1]], ["tile_y", "sp", [-1, 10, 2, 1]], ["tile_x", "sp", [-1, 1, 5, 1]], ["tile_rc", "sp", [-1, 2]], ["tile_rd", "sp", [-1, 3]], ["tile_ry", "sp", [-1, 3]], ["tile_rx", "sp", [-1, 1]], ["auto_unroll_max_step", "ot", 0], ["unroll_explicit", "ot", 0]]}], "r": [[0.0019324408653846154], 0, 1.8230085372924805, 1575005140.184534], "v": 0.1}
{"i": ["cuda", "schedule_direct_3d_cuda", [[1, 128, 20, 20, 20], [128, 128, 3, 3, 3], [1, 1, 1], [1, 1, 1], 1], {}, ["schedule_direct_3d_cuda", [1, 128, 20, 20, 20], [128, 128, 3, 3, 3], [1, 1, 1], [1, 1, 1], 1], {"i": 194459908, "t": "", "c": null, "e": [["tile_f", "sp", [-1, 4, 16, 1]], ["tile_d", "sp", [-1, 2, 1, 2]], ["tile_y", "sp", [-1, 4, 1, 5]], ["tile_x", "sp", [-1, 1, 5, 1]], ["tile_rc", "sp", [-1, 2]], ["tile_rd", "sp", [-1, 3]], ["tile_ry", "sp", [-1, 3]], ["tile_rx", "sp", [-1, 1]], ["auto_unroll_max_step", "ot", 0], ["unroll_explicit", "ot", 0]]}], "r": [[0.09372817925], 0, 3.373481273651123, 1575005142.1363866], "v": 0.1}
{"i": ["cuda", "schedule_direct_3d_cuda", [[1, 128, 20, 20, 20], [128, 128, 3, 3, 3], [1, 1, 1], [1, 1, 1], 1], {}, ["schedule_direct_3d_cuda", [1, 128, 20, 20, 20], [128, 128, 3, 3, 3], [1, 1, 1], [1, 1, 1], 1], {"i": 194474308, "t": "", "c": null, "e": [["tile_f", "sp", [-1, 4, 16, 1]], ["tile_d", "sp", [-1, 2, 1, 2]], ["tile_y", "sp", [-1, 1, 4, 5]], ["tile_x", "sp", [-1, 1, 5, 1]], ["tile_rc", "sp", [-1, 2]], ["tile_rd", "sp", [-1, 3]], ["tile_ry", "sp", [-1, 3]], ["tile_rx", "sp", [-1, 1]], ["auto_unroll_max_step", "ot", 0], ["unroll_explicit", "ot", 0]]}], "r": [[0.0016657873114754097], 0, 1.906022310256958, 1575005143.0230117], "v": 0.1}
{"i": ["cuda", "schedule_direct_3d_cuda", [[1, 128, 20, 20, 20], [128, 128, 3, 3, 3], [1, 1, 1], [1, 1, 1], 1], {}, ["schedule_direct_3d_cuda", [1, 128, 20, 20, 20], [128, 128, 3, 3, 3], [1, 1, 1], [1, 1, 1], 1], {"i": 616375113, "t": "", "c": null, "e": [["tile_f", "sp", [-1, 1, 64, 1]], ["tile_d", "sp", [-1, 2, 1, 2]], ["tile_y", "sp", [-1, 5, 4, 1]], ["tile_x", "sp", [-1, 1, 4, 1]], ["tile_rc", "sp", [-1, 1]], ["tile_rd", "sp", [-1, 1]], ["tile_ry", "sp", [-1, 3]], ["tile_rx", "sp", [-1, 1]], ["auto_unroll_max_step", "ot", 512], ["unroll_explicit", "ot", 0]]}], "r": [[0.00403555728], 0, 1.829439401626587, 1575005143.9294286], "v": 0.1}
{"i": ["cuda", "schedule_direct_3d_cuda", [[1, 128, 20, 20, 20], [128, 128, 3, 3, 3], [1, 1, 1], [1, 1, 1], 1], {}, ["schedule_direct_3d_cuda", [1, 128, 20, 20, 20], [128, 128, 3, 3, 3], [1, 1, 1], [1, 1, 1], 1], {"i": 686469379, "t": "", "c": null, "e": [["tile_f", "sp", [-1, 16, 4, 1]], ["tile_d", "sp", [-1, 1, 1, 2]], ["tile_y", "sp", [-1, 4, 5, 1]], ["tile_x", "sp", [-1, 1, 10, 1]], ["tile_rc", "sp", [-1, 2]], ["tile_rd", "sp", [-1, 3]], ["tile_ry", "sp", [-1, 3]], ["tile_rx", "sp", [-1, 1]], ["auto_unroll_max_step", "ot", 512], ["unroll_explicit", "ot", 0]]}], "r": [[0.0027878573055555556], 0, 2.383573293685913, 1575005144.997958], "v": 0.1}
{"i": ["cuda", "schedule_direct_3d_cuda", [[1, 128, 20, 20, 20], [128, 128, 3, 3, 3], [1, 1, 1], [1, 1, 1], 1], {}, ["schedule_direct_3d_cuda", [1, 128, 20, 20, 20], [128, 128, 3, 3, 3], [1, 1, 1], [1, 1, 1], 1], {"i": 1177478548, "t": "", "c": null, "e": [["tile_f", "sp", [-1, 4, 16, 1]], ["tile_d", "sp", [-1, 2, 1, 1]], ["tile_y", "sp", [-1, 5, 1, 4]], ["tile_x", "sp", [-1, 1, 5, 1]], ["tile_rc", "sp", [-1, 2]], ["tile_rd", "sp", [-1, 3]], ["tile_ry", "sp", [-1, 3]], ["tile_rx", "sp", [-1, 1]], ["auto_unroll_max_step", "ot", 1500], ["unroll_explicit", "ot", 0]]}], "r": [[0.0034204549], 0, 2.6518633365631104, 1575005150.8943088], "v": 0.1}
{"i": ["cuda", "schedule_direct_3d_cuda", [[1, 128, 20, 20, 20], [128, 128, 3, 3, 3], [1, 1, 1], [1, 1, 1], 1], {}, ["schedule_direct_3d_cuda", [1, 128, 20, 20, 20], [128, 128, 3, 3, 3], [1, 1, 1], [1, 1, 1], 1], {"i": 693571344, "t": "", "c": null, "e": [["tile_f", "sp", [-1, 8, 8, 1]], ["tile_d", "sp", [-1, 2, 1, 1]], ["tile_y", "sp", [-1, 4, 5, 1]], ["tile_x", "sp", [-1, 1, 5, 1]], ["tile_rc", "sp", [-1, 4]], ["tile_rd", "sp", [-1, 3]], ["tile_ry", "sp", [-1, 3]], ["tile_rx", "sp", [-1, 1]], ["auto_unroll_max_step", "ot", 512], ["unroll_explicit", "ot", 0]]}], "r": [[0.0020164538], 0, 2.050926685333252, 1575005151.9007065], "v": 0.1}
{"i": ["cuda", "schedule_direct_3d_cuda", [[1, 128, 20, 20, 20], [128, 128, 3, 3, 3], [1, 1, 1], [1, 1, 1], 1], {}, ["schedule_direct_3d_cuda", [1, 128, 20, 20, 20], [128, 128, 3, 3, 3], [1, 1, 1], [1, 1, 1], 1], {"i": 1668998788, "t": "", "c": null, "e": [["tile_f", "sp", [-1, 4, 16, 1]], ["tile_d", "sp", [-1, 5, 1, 1]], ["tile_y", "sp", [-1, 5, 1, 4]], ["tile_x", "sp", [-1, 1, 5, 1]], ["tile_rc", "sp", [-1, 2]], ["tile_rd", "sp", [-1, 3]], ["tile_ry", "sp", [-1, 3]], ["tile_rx", "sp", [-1, 1]], ["auto_unroll_max_step", "ot", 0], ["unroll_explicit", "ot", 1]]}], "r": [[0.1341784475], 0, 4.026752233505249, 1575005154.4485698], "v": 0.1}
{"i": ["cuda", "schedule_direct_3d_cuda", [[1, 128, 20, 20, 20], [128, 128, 3, 3, 3], [1, 1, 1], [1, 1, 1], 1], {}, ["schedule_direct_3d_cuda", [1, 128, 20, 20, 20], [128, 128, 3, 3, 3], [1, 1, 1], [1, 1, 1], 1], {"i": 1169445513, "t": "", "c": null, "e": [["tile_f", "sp", [-1, 1, 64, 1]], ["tile_d", "sp", [-1, 2, 1, 2]], ["tile_y", "sp", [-1, 2, 2, 5]], ["tile_x", "sp", [-1, 1, 4, 1]], ["tile_rc", "sp", [-1, 1]], ["tile_rd", "sp", [-1, 3]], ["tile_ry", "sp", [-1, 3]], ["tile_rx", "sp", [-1, 1]], ["auto_unroll_max_step", "ot", 1500], ["unroll_explicit", "ot", 0]]}], "r": [[0.0013086483116883116], 0, 2.055143117904663, 1575005155.448096], "v": 0.1}
{"i": ["cuda", "schedule_direct_3d_cuda", [[1, 128, 20, 20, 20], [128, 128, 3, 3, 3], [1, 1, 1], [1, 1, 1], 1], {}, ["schedule_direct_3d_cuda", [1, 128, 20, 20, 20], [128, 128, 3, 3, 3], [1, 1, 1], [1, 1, 1], 1], {"i": 1123696588, "t": "", "c": null, "e": [["tile_f", "sp", [-1, 4, 16, 1]], ["tile_d", "sp", [-1, 1, 1, 2]], ["tile_y", "sp", [-1, 5, 2, 2]], ["tile_x", "sp", [-1, 1, 5, 1]], ["tile_rc", "sp", [-1, 4]], ["tile_rd", "sp", [-1, 1]], ["tile_ry", "sp", [-1, 3]], ["tile_rx", "sp", [-1, 1]], ["auto_unroll_max_step", "ot", 1500], ["unroll_explicit", "ot", 0]]}], "r": [[0.006656434375], 0, 2.3386588096618652, 1575005156.8242233], "v": 0.1}
{"i": ["cuda", "schedule_direct_3d_cuda", [[1, 128, 20, 20, 20], [128, 128, 3, 3, 3], [1, 1, 1], [1, 1, 1], 1], {}, ["schedule_direct_3d_cuda", [1, 128, 20, 20, 20], [128, 128, 3, 3, 3], [1, 1, 1], [1, 1, 1], 1], {"i": 195014581, "t": "", "c": null, "e": [["tile_f", "sp", [-1, 1, 32, 2]], ["tile_d", "sp", [-1, 2, 1, 1]], ["tile_y", "sp", [-1, 5, 1, 4]], ["tile_x", "sp", [-1, 1, 10, 1]], ["tile_rc", "sp", [-1, 2]], ["tile_rd", "sp", [-1, 3]], ["tile_ry", "sp", [-1, 3]], ["tile_rx", "sp", [-1, 1]], ["auto_unroll_max_step", "ot", 0], ["unroll_explicit", "ot", 0]]}], "r": [[0.001758481649122807], 0, 1.8441245555877686, 1575005157.733992], "v": 0.1}
{"i": ["cuda", "schedule_direct_3d_cuda", [[1, 128, 20, 20, 20], [128, 128, 3, 3, 3], [1, 1, 1], [1, 1, 1], 1], {}, ["schedule_direct_3d_cuda", [1, 128, 20, 20, 20], [128, 128, 3, 3, 3], [1, 1, 1], [1, 1, 1], 1], {"i": 1185136588, "t": "", "c": null, "e": [["tile_f", "sp", [-1, 4, 16, 1]], ["tile_d", "sp", [-1, 1, 1, 2]], ["tile_y", "sp", [-1, 5, 2, 2]], ["tile_x", "sp", [-1, 1, 5, 1]], ["tile_rc", "sp", [-1, 4]], ["tile_rd", "sp", [-1, 3]], ["tile_ry", "sp", [-1, 3]], ["tile_rx", "sp", [-1, 1]], ["auto_unroll_max_step", "ot", 1500], ["unroll_explicit", "ot", 0]]}], "r": [[0.002564791205128205], 0, 2.03957200050354, 1575005158.7376456], "v": 0.1}
{"i": ["cuda", "schedule_direct_3d_cuda", [[1, 128, 20, 20, 20], [128, 128, 3, 3, 3], [1, 1, 1], [1, 1, 1], 1], {}, ["schedule_direct_3d_cuda", [1, 128, 20, 20, 20], [128, 128, 3, 3, 3], [1, 1, 1], [1, 1, 1], 1], {"i": 677925513, "t": "", "c": null, "e": [["tile_f", "sp", [-1, 1, 64, 1]], ["tile_d", "sp", [-1, 2, 1, 2]], ["tile_y", "sp", [-1, 2, 2, 5]], ["tile_x", "sp", [-1, 1, 4, 1]], ["tile_rc", "sp", [-1, 1]], ["tile_rd", "sp", [-1, 3]], ["tile_ry", "sp", [-1, 3]], ["tile_rx", "sp", [-1, 1]], ["auto_unroll_max_step", "ot", 512], ["unroll_explicit", "ot", 0]]}], "r": [[0.001392340736111111], 0, 1.738293170928955, 1575005159.6619718], "v": 0.1}
{"i": ["cuda", "schedule_direct_3d_cuda", [[1, 128, 20, 20, 20], [128, 128, 3, 3, 3], [1, 1, 1], [1, 1, 1], 1], {}, ["schedule_direct_3d_cuda", [1, 128, 20, 20, 20], [128, 128, 3, 3, 3], [1, 1, 1], [1, 1, 1], 1], {"i": 632176588, "t": "", "c": null, "e": [["tile_f", "sp", [-1, 4, 16, 1]], ["tile_d", "sp", [-1, 1, 1, 2]], ["tile_y", "sp", [-1, 5, 2, 2]], ["tile_x", "sp", [-1, 1, 5, 1]], ["tile_rc", "sp", [-1, 4]], ["tile_rd", "sp", [-1, 1]], ["tile_ry", "sp", [-1, 3]], ["tile_rx", "sp", [-1, 1]], ["auto_unroll_max_step", "ot", 512], ["unroll_explicit", "ot", 0]]}], "r": [[0.0035637118500000003], 0, 1.9619951248168945, 1575005163.5632846], "v": 0.1}
{"i": ["cuda", "schedule_direct_3d_cuda", [[1, 128, 20, 20, 20], [128, 128, 3, 3, 3], [1, 1, 1], [1, 1, 1], 1], {}, ["schedule_direct_3d_cuda", [1, 128, 20, 20, 20], [128, 128, 3, 3, 3], [1, 1, 1], [1, 1, 1], 1], {"i": 1670837216, "t": "", "c": null, "e": [["tile_f", "sp", [-1, 4, 8, 2]], ["tile_d", "sp", [-1, 5, 1, 1]], ["tile_y", "sp", [-1, 5, 4, 1]], ["tile_x", "sp", [-1, 1, 2, 2]], ["tile_rc", "sp", [-1, 2]], ["tile_rd", "sp", [-1, 3]], ["tile_ry", "sp", [-1, 3]], ["tile_rx", "sp", [-1, 1]], ["auto_unroll_max_step", "ot", 0], ["unroll_explicit", "ot", 1]]}], "r": [[0.06926828325], 0, 3.522106885910034, 1575005165.2354589], "v": 0.1}
{"i": ["cuda", "schedule_direct_3d_cuda", [[1, 128, 20, 20, 20], [128, 128, 3, 3, 3], [1, 1, 1], [1, 1, 1], 1], {}, ["schedule_direct_3d_cuda", [1, 128, 20, 20, 20], [128, 128, 3, 3, 3], [1, 1, 1], [1, 1, 1], 1], {"i": 1177989379, "t": "", "c": null, "e": [["tile_f", "sp", [-1, 16, 4, 1]], ["tile_d", "sp", [-1, 1, 1, 2]], ["tile_y", "sp", [-1, 4, 5, 1]], ["tile_x", "sp", [-1, 1, 10, 1]], ["tile_rc", "sp", [-1, 2]], ["tile_rd", "sp", [-1, 3]], ["tile_ry", "sp", [-1, 3]], ["tile_rx", "sp", [-1, 1]], ["auto_unroll_max_step", "ot", 1500], ["unroll_explicit", "ot", 0]]}], "r": [[0.0027914653333333335], 0, 2.504866123199463, 1575005166.3436985], "v": 0.1}
{"i": ["cuda", "schedule_direct_3d_cuda", [[1, 128, 20, 20, 20], [128, 128, 3, 3, 3], [1, 1, 1], [1, 1, 1], 1], {}, ["schedule_direct_3d_cuda", [1, 128, 20, 20, 20], [128, 128, 3, 3, 3], [1, 1, 1], [1, 1, 1], 1], {"i": 1177128299, "t": "", "c": null, "e": [["tile_f", "sp", [-1, 2, 16, 2]], ["tile_d", "sp", [-1, 4, 1, 1]], ["tile_y", "sp", [-1, 1, 4, 5]], ["tile_x", "sp", [-1, 1, 4, 1]], ["tile_rc", "sp", [-1, 2]], ["tile_rd", "sp", [-1, 3]], ["tile_ry", "sp", [-1, 3]], ["tile_rx", "sp", [-1, 1]], ["auto_unroll_max_step", "ot", 1500], ["unroll_explicit", "ot", 0]]}], "r": [[0.0016445320655737706], 0, 2.226830005645752, 1575005168.1864195], "v": 0.1}
{"i": ["cuda", "schedule_direct_3d_cuda", [[1, 128, 20, 20, 20], [128, 128, 3, 3, 3], [1, 1, 1], [1, 1, 1], 1], {}, ["schedule_direct_3d_cuda", [1, 128, 20, 20, 20], [128, 128, 3, 3, 3], [1, 1, 1], [1, 1, 1], 1], {"i": 2644005513, "t": "", "c": null, "e": [["tile_f", "sp", [-1, 1, 64, 1]], ["tile_d", "sp", [-1, 2, 1, 2]], ["tile_y", "sp", [-1, 2, 2, 5]], ["tile_x", "sp", [-1, 1, 4, 1]], ["tile_rc", "sp", [-1, 1]], ["tile_rd", "sp", [-1, 3]], ["tile_ry", "sp", [-1, 3]], ["tile_rx", "sp", [-1, 1]], ["auto_unroll_max_step", "ot", 1500], ["unroll_explicit", "ot", 1]]}], "r": [[0.0013072373246753248], 0, 2.9722707271575928, 1575005169.1494682], "v": 0.1}
{"i": ["cuda", "schedule_direct_3d_cuda", [[1, 128, 20, 20, 20], [128, 128, 3, 3, 3], [1, 1, 1], [1, 1, 1], 1], {}, ["schedule_direct_3d_cuda", [1, 128, 20, 20, 20], [128, 128, 3, 3, 3], [1, 1, 1], [1, 1, 1], 1], {"i": 1669019908, "t": "", "c": null, "e": [["tile_f", "sp", [-1, 4, 16, 1]], ["tile_d", "sp", [-1, 2, 1, 2]], ["tile_y", "sp", [-1, 4, 1, 5]], ["tile_x", "sp", [-1, 1, 5, 1]], ["tile_rc", "sp", [-1, 2]], ["tile_rd", "sp", [-1, 3]], ["tile_ry", "sp", [-1, 3]], ["tile_rx", "sp", [-1, 1]], ["auto_unroll_max_step", "ot", 0], ["unroll_explicit", "ot", 1]]}], "r": [[0.09380034725], 0, 3.1909053325653076, 1575005171.5228536], "v": 0.1}
{"i": ["cuda", "schedule_direct_3d_cuda", [[1, 128, 20, 20, 20], [128, 128, 3, 3, 3], [1, 1, 1], [1, 1, 1], 1], {}, ["schedule_direct_3d_cuda", [1, 128, 20, 20, 20], [128, 128, 3, 3, 3], [1, 1, 1], [1, 1, 1], 1], {"i": 2152826308, "t": "", "c": null, "e": [["tile_f", "sp", [-1, 4, 16, 1]], ["tile_d", "sp", [-1, 2, 1, 2]], ["tile_y", "sp", [-1, 2, 5, 2]], ["tile_x", "sp", [-1, 1, 5, 1]], ["tile_rc", "sp", [-1, 1]], ["tile_rd", "sp", [-1, 3]], ["tile_ry", "sp", [-1, 3]], ["tile_rx", "sp", [-1, 1]], ["auto_unroll_max_step", "ot", 512], ["unroll_explicit", "ot", 1]]}], "r": [[0.002622098413043478], 0, 1.8387115001678467, 1575005176.1883993], "v": 0.1}
{"i": ["cuda", "schedule_direct_3d_cuda", [[1, 128, 20, 20, 20], [128, 128, 3, 3, 3], [1, 1, 1], [1, 1, 1], 1], {}, ["schedule_direct_3d_cuda", [1, 128, 20, 20, 20], [128, 128, 3, 3, 3], [1, 1, 1], [1, 1, 1], 1], {"i": 2659696588, "t": "", "c": null, "e": [["tile_f", "sp", [-1, 4, 16, 1]], ["tile_d", "sp", [-1, 1, 1, 2]], ["tile_y", "sp", [-1, 5, 2, 2]], ["tile_x", "sp", [-1, 1, 5, 1]], ["tile_rc", "sp", [-1, 4]], ["tile_rd", "sp", [-1, 3]], ["tile_ry", "sp", [-1, 3]], ["tile_rx", "sp", [-1, 1]], ["auto_unroll_max_step", "ot", 1500], ["unroll_explicit", "ot", 1]]}], "r": [[0.0015703918125], 0, 2.823991060256958, 1575005177.3825946], "v": 0.1}
{"i": ["cuda", "schedule_direct_3d_cuda", [[1, 128, 20, 20, 20], [128, 128, 3, 3, 3], [1, 1, 1], [1, 1, 1], 1], {}, ["schedule_direct_3d_cuda", [1, 128, 20, 20, 20], [128, 128, 3, 3, 3], [1, 1, 1], [1, 1, 1], 1], {"i": 1661306308, "t": "", "c": null, "e": [["tile_f", "sp", [-1, 4, 16, 1]], ["tile_d", "sp", [-1, 2, 1, 2]], ["tile_y", "sp", [-1, 2, 5, 2]], ["tile_x", "sp", [-1, 1, 5, 1]], ["tile_rc", "sp", [-1, 1]], ["tile_rd", "sp", [-1, 3]], ["tile_ry", "sp", [-1, 3]], ["tile_rx", "sp", [-1, 1]], ["auto_unroll_max_step", "ot", 0], ["unroll_explicit", "ot", 1]]}], "r": [[0.0022401015999999998], 0, 1.7057230472564697, 1575005178.822], "v": 0.1}
{"i": ["cuda", "schedule_direct_3d_cuda", [[1, 128, 20, 20, 20], [128, 128, 3, 3, 3], [1, 1, 1], [1, 1, 1], 1], {}, ["schedule_direct_3d_cuda", [1, 128, 20, 20, 20], [128, 128, 3, 3, 3], [1, 1, 1], [1, 1, 1], 1], {"i": 1668557092, "t": "", "c": null, "e": [["tile_f", "sp", [-1, 8, 4, 2]], ["tile_d", "sp", [-1, 4, 1, 1]], ["tile_y", "sp", [-1, 2, 10, 1]], ["tile_x", "sp", [-1, 1, 4, 1]], ["tile_rc", "sp", [-1, 2]], ["tile_rd", "sp", [-1, 3]], ["tile_ry", "sp", [-1, 3]], ["tile_rx", "sp", [-1, 1]], ["auto_unroll_max_step", "ot", 0], ["unroll_explicit", "ot", 1]]}], "r": [[0.00317279015625], 0, 1.963787317276001, 1575005179.6931477], "v": 0.1}
{"i": ["cuda", "schedule_direct_3d_cuda", [[1, 128, 20, 20, 20], [128, 128, 3, 3, 3], [1, 1, 1], [1, 1, 1], 1], {}, ["schedule_direct_3d_cuda", [1, 128, 20, 20, 20], [128, 128, 3, 3, 3], [1, 1, 1], [1, 1, 1], 1], {"i": 2160518788, "t": "", "c": null, "e": [["tile_f", "sp", [-1, 4, 16, 1]], ["tile_d", "sp", [-1, 5, 1, 1]], ["tile_y", "sp", [-1, 5, 1, 4]], ["tile_x", "sp", [-1, 1, 5, 1]], ["tile_rc", "sp", [-1, 2]], ["tile_rd", "sp", [-1, 3]], ["tile_ry", "sp", [-1, 3]], ["tile_rx", "sp", [-1, 1]], ["auto_unroll_max_step", "ot", 512], ["unroll_explicit", "ot", 1]]}], "r": [[0.018784434333333332], 0, 4.2221174240112305, 1575005183.326755], "v": 0.1}
{"i": ["cuda", "schedule_direct_3d_cuda", [[1, 128, 20, 20, 20], [128, 128, 3, 3, 3], [1, 1, 1], [1, 1, 1], 1], {}, ["schedule_direct_3d_cuda", [1, 128, 20, 20, 20], [128, 128, 3, 3, 3], [1, 1, 1], [1, 1, 1], 1], {"i": 1177444948, "t": "", "c": null, "e": [["tile_f", "sp", [-1, 4, 16, 1]], ["tile_d", "sp", [-1, 2, 1, 1]], ["tile_y", "sp", [-1, 10, 1, 2]], ["tile_x", "sp", [-1, 1, 5, 1]], ["tile_rc", "sp", [-1, 2]], ["tile_rd", "sp", [-1, 3]], ["tile_ry", "sp", [-1, 3]], ["tile_rx", "sp", [-1, 1]], ["auto_unroll_max_step", "ot", 1500], ["unroll_explicit", "ot", 0]]}], "r": [[0.003462708448275862], 0, 2.3028106689453125, 1575005184.4969223], "v": 0.1}
{"i": ["cuda", "schedule_direct_3d_cuda", [[1, 128, 20, 20, 20], [128, 128, 3, 3, 3], [1, 1, 1], [1, 1, 1], 1], {}, ["schedule_direct_3d_cuda", [1, 128, 20, 20, 20], [128, 128, 3, 3, 3], [1, 1, 1], [1, 1, 1], 1], {"i": 677926833, "t": "", "c": null, "e": [["tile_f", "sp", [-1, 1, 64, 1]], ["tile_d", "sp", [-1, 1, 1, 5]], ["tile_y", "sp", [-1, 2, 2, 5]], ["tile_x", "sp", [-1, 1, 4, 1]], ["tile_rc", "sp", [-1, 1]], ["tile_rd", "sp", [-1, 3]], ["tile_ry", "sp", [-1, 3]], ["tile_rx", "sp", [-1, 1]], ["auto_unroll_max_step", "ot", 512], ["unroll_explicit", "ot", 0]]}], "r": [[0.001628878564516129], 0, 1.5370147228240967, 1575005188.71686], "v": 0.1}
{"i": ["cuda", "schedule_direct_3d_cuda", [[1, 128, 20, 20, 20], [128, 128, 3, 3, 3], [1, 1, 1], [1, 1, 1], 1], {}, ["schedule_direct_3d_cuda", [1, 128, 20, 20, 20], [128, 128, 3, 3, 3], [1, 1, 1], [1, 1, 1], 1], {"i": 2160077092, "t": "", "c": null, "e": [["tile_f", "sp", [-1, 8, 4, 2]], ["tile_d", "sp", [-1, 4, 1, 1]], ["tile_y", "sp", [-1, 2, 10, 1]], ["tile_x", "sp", [-1, 1, 4, 1]], ["tile_rc", "sp", [-1, 2]], ["tile_rd", "sp", [-1, 3]], ["tile_ry", "sp", [-1, 3]], ["tile_rx", "sp", [-1, 1]], ["auto_unroll_max_step", "ot", 512], ["unroll_explicit", "ot", 1]]}], "r": [[0.002889554794871795], 0, 2.5907390117645264, 1575005189.8128276], "v": 0.1}
{"i": ["cuda", "schedule_direct_3d_cuda", [[1, 128, 20, 20, 20], [128, 128, 3, 3, 3], [1, 1, 1], [1, 1, 1], 1], {}, ["schedule_direct_3d_cuda", [1, 128, 20, 20, 20], [128, 128, 3, 3, 3], [1, 1, 1], [1, 1, 1], 1], {"i": 2152771499, "t": "", "c": null, "e": [["tile_f", "sp", [-1, 2, 16, 2]], ["tile_d", "sp", [-1, 4, 1, 1]], ["tile_y", "sp", [-1, 4, 5, 1]], ["tile_x", "sp", [-1, 1, 5, 1]], ["tile_rc", "sp", [-1, 1]], ["tile_rd", "sp", [-1, 3]], ["tile_ry", "sp", [-1, 3]], ["tile_rx", "sp", [-1, 1]], ["auto_unroll_max_step", "ot", 512], ["unroll_explicit", "ot", 1]]}], "r": [[0.0025534156999999997], 0, 1.632788896560669, 1575005190.7985501], "v": 0.1}
{"i": ["cuda", "schedule_direct_3d_cuda", [[1, 128, 20, 20, 20], [128, 128, 3, 3, 3], [1, 1, 1], [1, 1, 1], 1], {}, ["schedule_direct_3d_cuda", [1, 128, 20, 20, 20], [128, 128, 3, 3, 3], [1, 1, 1], [1, 1, 1], 1], {"i": 2161675708, "t": "", "c": null, "e": [["tile_f", "sp", [-1, 4, 16, 1]], ["tile_d", "sp", [-1, 10, 1, 1]], ["tile_y", "sp", [-1, 1, 5, 4]], ["tile_x", "sp", [-1, 1, 1, 2]], ["tile_rc", "sp", [-1, 2]], ["tile_rd", "sp", [-1, 3]], ["tile_ry", "sp", [-1, 3]], ["tile_rx", "sp", [-1, 1]], ["auto_unroll_max_step", "ot", 512], ["unroll_explicit", "ot", 1]]}], "r": [[0.009540723545454545], 0, 3.355058431625366, 1575005192.4330676], "v": 0.1}
{"i": ["cuda", "schedule_direct_3d_cuda", [[1, 128, 20, 20, 20], [128, 128, 3, 3, 3], [1, 1, 1], [1, 1, 1], 1], {}, ["schedule_direct_3d_cuda", [1, 128, 20, 20, 20], [128, 128, 3, 3, 3], [1, 1, 1], [1, 1, 1], 1], {"i": 2160460948, "t": "", "c": null, "e": [["tile_f", "sp", [-1, 4, 16, 1]], ["tile_d", "sp", [-1, 2, 1, 1]], ["tile_y", "sp", [-1, 2, 10, 1]], ["tile_x", "sp", [-1, 1, 5, 1]], ["tile_rc", "sp", [-1, 2]], ["tile_rd", "sp", [-1, 3]], ["tile_ry", "sp", [-1, 3]], ["tile_rx", "sp", [-1, 1]], ["auto_unroll_max_step", "ot", 512], ["unroll_explicit", "ot", 1]]}], "r": [[0.0014939369552238804], 0, 1.7863624095916748, 1575005193.3416104], "v": 0.1}
{"i": ["cuda", "schedule_direct_3d_cuda", [[1, 128, 20, 20, 20], [128, 128, 3, 3, 3], [1, 1, 1], [1, 1, 1], 1], {}, ["schedule_direct_3d_cuda", [1, 128, 20, 20, 20], [128, 128, 3, 3, 3], [1, 1, 1], [1, 1, 1], 1], {"i": 2152485633, "t": "", "c": null, "e": [["tile_f", "sp", [-1, 1, 64, 1]], ["tile_d", "sp", [-1, 5, 1, 2]], ["tile_y", "sp", [-1, 2, 2, 5]], ["tile_x", "sp", [-1, 1, 4, 1]], ["tile_rc", "sp", [-1, 1]], ["tile_rd", "sp", [-1, 3]], ["tile_ry", "sp", [-1, 3]], ["tile_rx", "sp", [-1, 1]], ["auto_unroll_max_step", "ot", 512], ["unroll_explicit", "ot", 1]]}], "r": [[0.0022375013333333334], 0, 1.9414899349212646, 1575005194.2643836], "v": 0.1}
{"i": ["cuda", "schedule_direct_3d_cuda", [[1, 128, 20, 20, 20], [128, 128, 3, 3, 3], [1, 1, 1], [1, 1, 1], 1], {}, ["schedule_direct_3d_cuda", [1, 128, 20, 20, 20], [128, 128, 3, 3, 3], [1, 1, 1], [1, 1, 1], 1], {"i": 186674481, "t": "", "c": null, "e": [["tile_f", "sp", [-1, 4, 8, 4]], ["tile_d", "sp", [-1, 5, 1, 2]], ["tile_y", "sp", [-1, 1, 4, 1]], ["tile_x", "sp", [-1, 1, 5, 1]], ["tile_rc", "sp", [-1, 1]], ["tile_rd", "sp", [-1, 3]], ["tile_ry", "sp", [-1, 3]], ["tile_rx", "sp", [-1, 1]], ["auto_unroll_max_step", "ot", 0], ["unroll_explicit", "ot", 0]]}], "r": [[0.0025246851886792454], 0, 2.3940927982330322, 1575005491.9375427], "v": 0.1}
{"i": ["cuda", "schedule_direct_3d_cuda", [[1, 128, 20, 20, 20], [128, 128, 3, 3, 3], [1, 1, 1], [1, 1, 1], 1], {}, ["schedule_direct_3d_cuda", [1, 128, 20, 20, 20], [128, 128, 3, 3, 3], [1, 1, 1], [1, 1, 1], 1], {"i": 186656220, "t": "", "c": null, "e": [["tile_f", "sp", [-1, 4, 16, 2]], ["tile_d", "sp", [-1, 5, 1, 4]], ["tile_y", "sp", [-1, 1, 2, 1]], ["tile_x", "sp", [-1, 1, 5, 1]], ["tile_rc", "sp", [-1, 1]], ["tile_rd", "sp", [-1, 3]], ["tile_ry", "sp", [-1, 3]], ["tile_rx", "sp", [-1, 1]], ["auto_unroll_max_step", "ot", 0], ["unroll_explicit", "ot", 0]]}], "r": [[0.0023961990714285713], 0, 2.031428813934326, 1575005492.8903813], "v": 0.1}
{"i": ["cuda", "schedule_direct_3d_cuda", [[1, 128, 20, 20, 20], [128, 128, 3, 3, 3], [1, 1, 1], [1, 1, 1], 1], {}, ["schedule_direct_3d_cuda", [1, 128, 20, 20, 20], [128, 128, 3, 3, 3], [1, 1, 1], [1, 1, 1], 1], {"i": 678194481, "t": "", "c": null, "e": [["tile_f", "sp", [-1, 4, 8, 4]], ["tile_d", "sp", [-1, 5, 1, 2]], ["tile_y", "sp", [-1, 1, 4, 1]], ["tile_x", "sp", [-1, 1, 5, 1]], ["tile_rc", "sp", [-1, 1]], ["tile_rd", "sp", [-1, 3]], ["tile_ry", "sp", [-1, 3]], ["tile_rx", "sp", [-1, 1]], ["auto_unroll_max_step", "ot", 512], ["unroll_explicit", "ot", 0]]}], "r": [[0.002367174976744186], 0, 2.2778496742248535, 1575005493.933532], "v": 0.1}
{"i": ["cuda", "schedule_direct_3d_cuda", [[1, 128, 20, 20, 20], [128, 128, 3, 3, 3], [1, 1, 1], [1, 1, 1], 1], {}, ["schedule_direct_3d_cuda", [1, 128, 20, 20, 20], [128, 128, 3, 3, 3], [1, 1, 1], [1, 1, 1], 1], {"i": 1169714481, "t": "", "c": null, "e": [["tile_f", "sp", [-1, 4, 8, 4]], ["tile_d", "sp", [-1, 5, 1, 2]], ["tile_y", "sp", [-1, 1, 4, 1]], ["tile_x", "sp", [-1, 1, 5, 1]], ["tile_rc", "sp", [-1, 1]], ["tile_rd", "sp", [-1, 3]], ["tile_ry", "sp", [-1, 3]], ["tile_rx", "sp", [-1, 1]], ["auto_unroll_max_step", "ot", 1500], ["unroll_explicit", "ot", 0]]}], "r": [[0.0034842302068965516], 0, 2.687185049057007, 1575005495.1238134], "v": 0.1}
{"i": ["cuda", "schedule_direct_3d_cuda", [[1, 128, 20, 20, 20], [128, 128, 3, 3, 3], [1, 1, 1], [1, 1, 1], 1], {}, ["schedule_direct_3d_cuda", [1, 128, 20, 20, 20], [128, 128, 3, 3, 3], [1, 1, 1], [1, 1, 1], 1], {"i": 1661216220, "t": "", "c": null, "e": [["tile_f", "sp", [-1, 4, 16, 2]], ["tile_d", "sp", [-1, 5, 1, 4]], ["tile_y", "sp", [-1, 1, 2, 1]], ["tile_x", "sp", [-1, 1, 5, 1]], ["tile_rc", "sp", [-1, 1]], ["tile_rd", "sp", [-1, 3]], ["tile_ry", "sp", [-1, 3]], ["tile_rx", "sp", [-1, 1]], ["auto_unroll_max_step", "ot", 0], ["unroll_explicit", "ot", 1]]}], "r": [[0.002396462595238095], 0, 2.167658567428589, 1575005495.9879024], "v": 0.1}
{"i": ["cuda", "schedule_direct_3d_cuda", [[1, 128, 20, 20, 20], [128, 128, 3, 3, 3], [1, 1, 1], [1, 1, 1], 1], {}, ["schedule_direct_3d_cuda", [1, 128, 20, 20, 20], [128, 128, 3, 3, 3], [1, 1, 1], [1, 1, 1], 1], {"i": 186348992, "t": "", "c": null, "e": [["tile_f", "sp", [-1, 4, 32, 1]], ["tile_d", "sp", [-1, 5, 1, 4]], ["tile_y", "sp", [-1, 1, 2, 2]], ["tile_x", "sp", [-1, 1, 4, 1]], ["tile_rc", "sp", [-1, 1]], ["tile_rd", "sp", [-1, 3]], ["tile_ry", "sp", [-1, 3]], ["tile_rx", "sp", [-1, 1]], ["auto_unroll_max_step", "ot", 0], ["unroll_explicit", "ot", 0]]}], "r": [[0.0012881191923076925], 0, 2.3478901386260986, 1575005496.9540744], "v": 0.1}
{"i": ["cuda", "schedule_direct_3d_cuda", [[1, 128, 20, 20, 20], [128, 128, 3, 3, 3], [1, 1, 1], [1, 1, 1], 1], {}, ["schedule_direct_3d_cuda", [1, 128, 20, 20, 20], [128, 128, 3, 3, 3], [1, 1, 1], [1, 1, 1], 1], {"i": 2766829349, "t": "", "c": null, "e": [["tile_f", "sp", [-1, 8, 16, 1]], ["tile_d", "sp", [-1, 2, 1, 5]], ["tile_y", "sp", [-1, 1, 2, 2]], ["tile_x", "sp", [-1, 1, 4, 1]], ["tile_rc", "sp", [-1, 1]], ["tile_rd", "sp", [-1, 3]], ["tile_ry", "sp", [-1, 1]], ["tile_rx", "sp", [-1, 3]], ["auto_unroll_max_step", "ot", 1500], ["unroll_explicit", "ot", 1]]}], "r": [[0.0017955189107142857], 0, 4.597096681594849, 1575005498.0855117], "v": 0.1}
{"i": ["cuda", "schedule_direct_3d_cuda", [[1, 128, 20, 20, 20], [128, 128, 3, 3, 3], [1, 1, 1], [1, 1, 1], 1], {}, ["schedule_direct_3d_cuda", [1, 128, 20, 20, 20], [128, 128, 3, 3, 3], [1, 1, 1], [1, 1, 1], 1], {"i": 1661234481, "t": "", "c": null, "e": [["tile_f", "sp", [-1, 4, 8, 4]], ["tile_d", "sp", [-1, 5, 1, 2]], ["tile_y", "sp", [-1, 1, 4, 1]], ["tile_x", "sp", [-1, 1, 5, 1]], ["tile_rc", "sp", [-1, 1]], ["tile_rd", "sp", [-1, 3]], ["tile_ry", "sp", [-1, 3]], ["tile_rx", "sp", [-1, 1]], ["auto_unroll_max_step", "ot", 0], ["unroll_explicit", "ot", 1]]}], "r": [[0.0024175485476190476], 0, 2.2363362312316895, 1575005498.9489565], "v": 0.1}
{"i": ["cuda", "schedule_direct_3d_cuda", [[1, 128, 20, 20, 20], [128, 128, 3, 3, 3], [1, 1, 1], [1, 1, 1], 1], {}, ["schedule_direct_3d_cuda", [1, 128, 20, 20, 20], [128, 128, 3, 3, 3], [1, 1, 1], [1, 1, 1], 1], {"i": 1661220081, "t": "", "c": null, "e": [["tile_f", "sp", [-1, 4, 8, 4]], ["tile_d", "sp", [-1, 5, 1, 2]], ["tile_y", "sp", [-1, 2, 2, 1]], ["tile_x", "sp", [-1, 1, 5, 1]], ["tile_rc", "sp", [-1, 1]], ["tile_rd", "sp", [-1, 3]], ["tile_ry", "sp", [-1, 3]], ["tile_rx", "sp", [-1, 1]], ["auto_unroll_max_step", "ot", 0], ["unroll_explicit", "ot", 1]]}], "r": [[0.0853718], 0, 3.502459764480591, 1575005500.7197752], "v": 0.1}
{"i": ["cuda", "schedule_direct_3d_cuda", [[1, 128, 20, 20, 20], [128, 128, 3, 3, 3], [1, 1, 1], [1, 1, 1], 1], {}, ["schedule_direct_3d_cuda", [1, 128, 20, 20, 20], [128, 128, 3, 3, 3], [1, 1, 1], [1, 1, 1], 1], {"i": 1663212032, "t": "", "c": null, "e": [["tile_f", "sp", [-1, 4, 32, 1]], ["tile_d", "sp", [-1, 5, 1, 2]], ["tile_y", "sp", [-1, 1, 2, 2]], ["tile_x", "sp", [-1, 1, 2, 2]], ["tile_rc", "sp", [-1, 1]], ["tile_rd", "sp", [-1, 3]], ["tile_ry", "sp", [-1, 3]], ["tile_rx", "sp", [-1, 1]], ["auto_unroll_max_step", "ot", 0], ["unroll_explicit", "ot", 1]]}], "r": [[0.0012161736626506024], 0, 2.2441303730010986, 1575005501.640839], "v": 0.1}
{"i": ["cuda", "schedule_direct_3d_cuda", [[1, 128, 20, 20, 20], [128, 128, 3, 3, 3], [1, 1, 1], [1, 1, 1], 1], {}, ["schedule_direct_3d_cuda", [1, 128, 20, 20, 20], [128, 128, 3, 3, 3], [1, 1, 1], [1, 1, 1], 1], {"i": 2152754481, "t": "", "c": null, "e": [["tile_f", "sp", [-1, 4, 8, 4]], ["tile_d", "sp", [-1, 5, 1, 2]], ["tile_y", "sp", [-1, 1, 4, 1]], ["tile_x", "sp", [-1, 1, 5, 1]], ["tile_rc", "sp", [-1, 1]], ["tile_rd", "sp", [-1, 3]], ["tile_ry", "sp", [-1, 3]], ["tile_rx", "sp", [-1, 1]], ["auto_unroll_max_step", "ot", 512], ["unroll_explicit", "ot", 1]]}], "r": [[0.002385387], 0, 2.730192184448242, 1575005502.6219537], "v": 0.1}
{"i": ["cuda", "schedule_direct_3d_cuda", [[1, 128, 20, 20, 20], [128, 128, 3, 3, 3], [1, 1, 1], [1, 1, 1], 1], {}, ["schedule_direct_3d_cuda", [1, 128, 20, 20, 20], [128, 128, 3, 3, 3], [1, 1, 1], [1, 1, 1], 1], {"i": 186349022, "t": "", "c": null, "e": [["tile_f", "sp", [-1, 2, 32, 2]], ["tile_d", "sp", [-1, 5, 1, 4]], ["tile_y", "sp", [-1, 1, 2, 2]], ["tile_x", "sp", [-1, 1, 4, 1]], ["tile_rc", "sp", [-1, 1]], ["tile_rd", "sp", [-1, 3]], ["tile_ry", "sp", [-1, 3]], ["tile_rx", "sp", [-1, 1]], ["auto_unroll_max_step", "ot", 0], ["unroll_explicit", "ot", 0]]}], "r": [[0.0012781467088607596], 0, 2.1175856590270996, 1575005503.5818102], "v": 0.1}
{"i": ["cuda", "schedule_direct_3d_cuda", [[1, 128, 20, 20, 20], [128, 128, 3, 3, 3], [1, 1, 1], [1, 1, 1], 1], {}, ["schedule_direct_3d_cuda", [1, 128, 20, 20, 20], [128, 128, 3, 3, 3], [1, 1, 1], [1, 1, 1], 1], {"i": 1664479228, "t": "", "c": null, "e": [["tile_f", "sp", [-1, 4, 16, 1]], ["tile_d", "sp", [-1, 5, 1, 2]], ["tile_y", "sp", [-1, 1, 2, 1]], ["tile_x", "sp", [-1, 1, 5, 4]], ["tile_rc", "sp", [-1, 1]], ["tile_rd", "sp", [-1, 3]], ["tile_ry", "sp", [-1, 3]], ["tile_rx", "sp", [-1, 1]], ["auto_unroll_max_step", "ot", 0], ["unroll_explicit", "ot", 1]]}], "r": [[0.00283775532], 0, 1.8506121635437012, 1575005508.1170108], "v": 0.1}
{"i": ["cuda", "schedule_direct_3d_cuda", [[1, 128, 20, 20, 20], [128, 128, 3, 3, 3], [1, 1, 1], [1, 1, 1], 1], {}, ["schedule_direct_3d_cuda", [1, 128, 20, 20, 20], [128, 128, 3, 3, 3], [1, 1, 1], [1, 1, 1], 1], {"i": 1660909469, "t": "", "c": null, "e": [["tile_f", "sp", [-1, 8, 16, 1]], ["tile_d", "sp", [-1, 4, 1, 5]], ["tile_y", "sp", [-1, 1, 2, 2]], ["tile_x", "sp", [-1, 1, 4, 1]], ["tile_rc", "sp", [-1, 1]], ["tile_rd", "sp", [-1, 3]], ["tile_ry", "sp", [-1, 3]], ["tile_rx", "sp", [-1, 1]], ["auto_unroll_max_step", "ot", 0], ["unroll_explicit", "ot", 1]]}], "r": [[0.075705522], 0, 2.723525285720825, 1575005509.7219243], "v": 0.1}
{"i": ["cuda", "schedule_direct_3d_cuda", [[1, 128, 20, 20, 20], [128, 128, 3, 3, 3], [1, 1, 1], [1, 1, 1], 1], {}, ["schedule_direct_3d_cuda", [1, 128, 20, 20, 20], [128, 128, 3, 3, 3], [1, 1, 1], [1, 1, 1], 1], {"i": 186349469, "t": "", "c": null, "e": [["tile_f", "sp", [-1, 8, 16, 1]], ["tile_d", "sp", [-1, 4, 1, 5]], ["tile_y", "sp", [-1, 1, 2, 2]], ["tile_x", "sp", [-1, 1, 4, 1]], ["tile_rc", "sp", [-1, 1]], ["tile_rd", "sp", [-1, 3]], ["tile_ry", "sp", [-1, 3]], ["tile_rx", "sp", [-1, 1]], ["auto_unroll_max_step", "ot", 0], ["unroll_explicit", "ot", 0]]}], "r": [[0.075351076], 0, 2.4098856449127197, 1575005511.2411325], "v": 0.1}
{"i": ["cuda", "schedule_direct_3d_cuda", [[1, 128, 20, 20, 20], [128, 128, 3, 3, 3], [1, 1, 1], [1, 1, 1], 1], {}, ["schedule_direct_3d_cuda", [1, 128, 20, 20, 20], [128, 128, 3, 3, 3], [1, 1, 1], [1, 1, 1], 1], {"i": 2646252032, "t": "", "c": null, "e": [["tile_f", "sp", [-1, 4, 32, 1]], ["tile_d", "sp", [-1, 5, 1, 2]], ["tile_y", "sp", [-1, 1, 2, 2]], ["tile_x", "sp", [-1, 1, 2, 2]], ["tile_rc", "sp", [-1, 1]], ["tile_rd", "sp", [-1, 3]], ["tile_ry", "sp", [-1, 3]], ["tile_rx", "sp", [-1, 1]], ["auto_unroll_max_step", "ot", 1500], ["unroll_explicit", "ot", 1]]}], "r": [[0.00157207003125], 0, 3.8374838829040527, 1575005512.3468332], "v": 0.1}
{"i": ["cuda", "schedule_direct_3d_cuda", [[1, 128, 20, 20, 20], [128, 128, 3, 3, 3], [1, 1, 1], [1, 1, 1], 1], {}, ["schedule_direct_3d_cuda", [1, 128, 20, 20, 20], [128, 128, 3, 3, 3], [1, 1, 1], [1, 1, 1], 1], {"i": 2644274481, "t": "", "c": null, "e": [["tile_f", "sp", [-1, 4, 8, 4]], ["tile_d", "sp", [-1, 5, 1, 2]], ["tile_y", "sp", [-1, 1, 4, 1]], ["tile_x", "sp", [-1, 1, 5, 1]], ["tile_rc", "sp", [-1, 1]], ["tile_rd", "sp", [-1, 3]], ["tile_ry", "sp", [-1, 3]], ["tile_rx", "sp", [-1, 1]], ["auto_unroll_max_step", "ot", 1500], ["unroll_explicit", "ot", 1]]}], "r": [[0.002805866277777778], 0, 3.837209463119507, 1575005513.520169], "v": 0.1}
{"i": ["cuda", "schedule_direct_3d_cuda", [[1, 128, 20, 20, 20], [128, 128, 3, 3, 3], [1, 1, 1], [1, 1, 1], 1], {}, ["schedule_direct_3d_cuda", [1, 128, 20, 20, 20], [128, 128, 3, 3, 3], [1, 1, 1], [1, 1, 1], 1], {"i": 1601784296, "t": "", "c": null, "e": [["tile_f", "sp", [-1, 4, 8, 2]], ["tile_d", "sp", [-1, 4, 1, 1]], ["tile_y", "sp", [-1, 2, 5, 2]], ["tile_x", "sp", [-1, 1, 2, 2]], ["tile_rc", "sp", [-1, 1]], ["tile_rd", "sp", [-1, 1]], ["tile_ry", "sp", [-1, 3]], ["tile_rx", "sp", [-1, 1]], ["auto_unroll_max_step", "ot", 0], ["unroll_explicit", "ot", 1]]}], "r": [[0.0071176116666666666], 0, 2.028762102127075, 1575005514.5560338], "v": 0.1}
{"i": ["cuda", "schedule_direct_3d_cuda", [[1, 128, 20, 20, 20], [128, 128, 3, 3, 3], [1, 1, 1], [1, 1, 1], 1], {}, ["schedule_direct_3d_cuda", [1, 128, 20, 20, 20], [128, 128, 3, 3, 3], [1, 1, 1], [1, 1, 1], 1], {"i": 380966712, "t": "", "c": null, "e": [["tile_f", "sp", [-1, 4, 2, 4]], ["tile_d", "sp", [-1, 4, 1, 1]], ["tile_y", "sp", [-1, 5, 2, 1]], ["tile_x", "sp", [-1, 1, 5, 2]], ["tile_rc", "sp", [-1, 2]], ["tile_rd", "sp", [-1, 1]], ["tile_ry", "sp", [-1, 3]], ["tile_rx", "sp", [-1, 3]], ["auto_unroll_max_step", "ot", 0], ["unroll_explicit", "ot", 0]]}], "r": [[0.25004296625], 0, 5.376172065734863, 1575006899.0652978], "v": 0.1}
{"i": ["cuda", "schedule_direct_3d_cuda", [[1, 128, 20, 20, 20], [128, 128, 3, 3, 3], [1, 1, 1], [1, 1, 1], 1], {}, ["schedule_direct_3d_cuda", [1, 128, 20, 20, 20], [128, 128, 3, 3, 3], [1, 1, 1], [1, 1, 1], 1], {"i": 185664110, "t": "", "c": null, "e": [["tile_f", "sp", [-1, 1, 1, 32]], ["tile_d", "sp", [-1, 1, 1, 1]], ["tile_y", "sp", [-1, 1, 1, 1]], ["tile_x", "sp", [-1, 2, 2, 1]], ["tile_rc", "sp", [-1, 1]], ["tile_rd", "sp", [-1, 3]], ["tile_ry", "sp", [-1, 3]], ["tile_rx", "sp", [-1, 1]], ["auto_unroll_max_step", "ot", 0], ["unroll_explicit", "ot", 0]]}], "r": [[0.0841568765], 0, 2.24822998046875, 1575006900.8935258], "v": 0.1}
{"i": ["cuda", "schedule_direct_3d_cuda", [[1, 128, 20, 20, 20], [128, 128, 3, 3, 3], [1, 1, 1], [1, 1, 1], 1], {}, ["schedule_direct_3d_cuda", [1, 128, 20, 20, 20], [128, 128, 3, 3, 3], [1, 1, 1], [1, 1, 1], 1], {"i": 532946176, "t": "", "c": null, "e": [["tile_f", "sp", [-1, 2, 4, 1]], ["tile_d", "sp", [-1, 1, 1, 2]], ["tile_y", "sp", [-1, 1, 1, 5]], ["tile_x", "sp", [-1, 1, 10, 1]], ["tile_rc", "sp", [-1, 32]], ["tile_rd", "sp", [-1, 1]], ["tile_ry", "sp", [-1, 1]], ["tile_rx", "sp", [-1, 1]], ["auto_unroll_max_step", "ot", 512], ["unroll_explicit", "ot", 0]]}], "r": [[0.009442843], 0, 1.7147369384765625, 1575006909.8406243], "v": 0.1}
{"i": ["cuda", "schedule_direct_3d_cuda", [[1, 128, 20, 20, 20], [128, 128, 3, 3, 3], [1, 1, 1], [1, 1, 1], 1], {}, ["schedule_direct_3d_cuda", [1, 128, 20, 20, 20], [128, 128, 3, 3, 3], [1, 1, 1], [1, 1, 1], 1], {"i": 1136969670, "t": "", "c": null, "e": [["tile_f", "sp", [-1, 1, 32, 1]], ["tile_d", "sp", [-1, 1, 1, 4]], ["tile_y", "sp", [-1, 5, 1, 4]], ["tile_x", "sp", [-1, 2, 1, 1]], ["tile_rc", "sp", [-1, 16]], ["tile_rd", "sp", [-1, 1]], ["tile_ry", "sp", [-1, 3]], ["tile_rx", "sp", [-1, 1]], ["auto_unroll_max_step", "ot", 1500], ["unroll_explicit", "ot", 0]]}], "r": [[0.0024015683199999998], 0, 2.037907361984253, 1575006922.672496], "v": 0.1}
{"i": ["cuda", "schedule_direct_3d_cuda", [[1, 128, 20, 20, 20], [128, 128, 3, 3, 3], [1, 1, 1], [1, 1, 1], 1], {}, ["schedule_direct_3d_cuda", [1, 128, 20, 20, 20], [128, 128, 3, 3, 3], [1, 1, 1], [1, 1, 1], 1], {"i": 1598768235, "t": "", "c": null, "e": [["tile_f", "sp", [-1, 1, 4, 4]], ["tile_d", "sp", [-1, 5, 1, 4]], ["tile_y", "sp", [-1, 1, 1, 10]], ["tile_x", "sp", [-1, 1, 2, 1]], ["tile_rc", "sp", [-1, 1]], ["tile_rd", "sp", [-1, 1]], ["tile_ry", "sp", [-1, 3]], ["tile_rx", "sp", [-1, 1]], ["auto_unroll_max_step", "ot", 0], ["unroll_explicit", "ot", 1]]}], "r": [[0.218054524], 0, 4.954354524612427, 1575006926.6850436], "v": 0.1}
{"i": ["cuda", "schedule_direct_3d_cuda", [[1, 128, 20, 20, 20], [128, 128, 3, 3, 3], [1, 1, 1], [1, 1, 1], 1], {}, ["schedule_direct_3d_cuda", [1, 128, 20, 20, 20], [128, 128, 3, 3, 3], [1, 1, 1], [1, 1, 1], 1], {"i": 2095384760, "t": "", "c": null, "e": [["tile_f", "sp", [-1, 2, 8, 4]], ["tile_d", "sp", [-1, 2, 1, 2]], ["tile_y", "sp", [-1, 1, 1, 2]], ["tile_x", "sp", [-1, 1, 2, 5]], ["tile_rc", "sp", [-1, 1]], ["tile_rd", "sp", [-1, 1]], ["tile_ry", "sp", [-1, 3]], ["tile_rx", "sp", [-1, 1]], ["auto_unroll_max_step", "ot", 512], ["unroll_explicit", "ot", 1]]}], "r": [[0.02229840283333333], 0, 2.5324270725250244, 1575006945.2613232], "v": 0.1}
{"i": ["cuda", "schedule_direct_3d_cuda", [[1, 128, 20, 20, 20], [128, 128, 3, 3, 3], [1, 1, 1], [1, 1, 1], 1], {}, ["schedule_direct_3d_cuda", [1, 128, 20, 20, 20], [128, 128, 3, 3, 3], [1, 1, 1], [1, 1, 1], 1], {"i": 1699601678, "t": "", "c": null, "e": [["tile_f", "sp", [-1, 4, 1, 2]], ["tile_d", "sp", [-1, 1, 1, 4]], ["tile_y", "sp", [-1, 5, 1, 1]], ["tile_x", "sp", [-1, 1, 5, 1]], ["tile_rc", "sp", [-1, 32]], ["tile_rd", "sp", [-1, 3]], ["tile_ry", "sp", [-1, 3]], ["tile_rx", "sp", [-1, 1]], ["auto_unroll_max_step", "ot", 0], ["unroll_explicit", "ot", 1]]}], "r": [[0.17080092725], 0, 3.3580141067504883, 1575006957.4982235], "v": 0.1}
{"i": ["cuda", "schedule_direct_3d_cuda", [[1, 128, 20, 20, 20], [128, 128, 3, 3, 3], [1, 1, 1], [1, 1, 1], 1], {}, ["schedule_direct_3d_cuda", [1, 128, 20, 20, 20], [128, 128, 3, 3, 3], [1, 1, 1], [1, 1, 1], 1], {"i": 61721782, "t": "", "c": null, "e": [["tile_f", "sp", [-1, 2, 8, 1]], ["tile_d", "sp", [-1, 5, 1, 4]], ["tile_y", "sp", [-1, 1, 1, 2]], ["tile_x", "sp", [-1, 2, 1, 1]], ["tile_rc", "sp", [-1, 1]], ["tile_rd", "sp", [-1, 3]], ["tile_ry", "sp", [-1, 1]], ["tile_rx", "sp", [-1, 1]], ["auto_unroll_max_step", "ot", 0], ["unroll_explicit", "ot", 0]]}], "r": [[0.017945937166666665], 0, 2.8197600841522217, 1575007036.2540255], "v": 0.1}
{"i": ["cuda", "schedule_direct_3d_cuda", [[1, 128, 20, 20, 20], [128, 128, 3, 3, 3], [1, 1, 1], [1, 1, 1], 1], {}, ["schedule_direct_3d_cuda", [1, 128, 20, 20, 20], [128, 128, 3, 3, 3], [1, 1, 1], [1, 1, 1], 1], {"i": 63448800, "t": "", "c": null, "e": [["tile_f", "sp", [-1, 1, 1, 1]], ["tile_d", "sp", [-1, 5, 1, 2]], ["tile_y", "sp", [-1, 1, 1, 2]], ["tile_x", "sp", [-1, 1, 4, 1]], ["tile_rc", "sp", [-1, 1]], ["tile_rd", "sp", [-1, 3]], ["tile_ry", "sp", [-1, 1]], ["tile_rx", "sp", [-1, 1]], ["auto_unroll_max_step", "ot", 0], ["unroll_explicit", "ot", 0]]}], "r": [[0.082705311], 0, 2.492272138595581, 1575007043.3831415], "v": 0.1}
{"i": ["cuda", "schedule_direct_3d_cuda", [[1, 128, 20, 20, 20], [128, 128, 3, 3, 3], [1, 1, 1], [1, 1, 1], 1], {}, ["schedule_direct_3d_cuda", [1, 128, 20, 20, 20], [128, 128, 3, 3, 3], [1, 1, 1], [1, 1, 1], 1], {"i": 63448891, "t": "", "c": null, "e": [["tile_f", "sp", [-1, 2, 2, 8]], ["tile_d", "sp", [-1, 5, 1, 2]], ["tile_y", "sp", [-1, 1, 1, 2]], ["tile_x", "sp", [-1, 1, 4, 1]], ["tile_rc", "sp", [-1, 1]], ["tile_rd", "sp", [-1, 3]], ["tile_ry", "sp", [-1, 1]], ["tile_rx", "sp", [-1, 1]], ["auto_unroll_max_step", "ot", 0], ["unroll_explicit", "ot", 0]]}], "r": [[0.247034511], 0, 5.199597597122192, 1575007047.1402953], "v": 0.1}
{"i": ["cuda", "schedule_direct_3d_cuda", [[1, 128, 20, 20, 20], [128, 128, 3, 3, 3], [1, 1, 1], [1, 1, 1], 1], {}, ["schedule_direct_3d_cuda", [1, 128, 20, 20, 20], [128, 128, 3, 3, 3], [1, 1, 1], [1, 1, 1], 1], {"i": 184338728, "t": "", "c": null, "e": [["tile_f", "sp", [-1, 1, 2, 1]], ["tile_d", "sp", [-1, 1, 1, 10]], ["tile_y", "sp", [-1, 5, 1, 1]], ["tile_x", "sp", [-1, 1, 1, 1]], ["tile_rc", "sp", [-1, 1]], ["tile_rd", "sp", [-1, 3]], ["tile_ry", "sp", [-1, 3]], ["tile_rx", "sp", [-1, 1]], ["auto_unroll_max_step", "ot", 0], ["unroll_explicit", "ot", 0]]}], "r": [[0.022431240666666668], 0, 2.2060110569000244, 1575007048.200817], "v": 0.1}
{"i": ["cuda", "schedule_direct_3d_cuda", [[1, 128, 20, 20, 20], [128, 128, 3, 3, 3], [1, 1, 1], [1, 1, 1], 1], {}, ["schedule_direct_3d_cuda", [1, 128, 20, 20, 20], [128, 128, 3, 3, 3], [1, 1, 1], [1, 1, 1], 1], {"i": 130841782, "t": "", "c": null, "e": [["tile_f", "sp", [-1, 2, 8, 1]], ["tile_d", "sp", [-1, 5, 1, 4]], ["tile_y", "sp", [-1, 1, 1, 2]], ["tile_x", "sp", [-1, 2, 1, 1]], ["tile_rc", "sp", [-1, 2]], ["tile_rd", "sp", [-1, 1]], ["tile_ry", "sp", [-1, 3]], ["tile_rx", "sp", [-1, 1]], ["auto_unroll_max_step", "ot", 0], ["unroll_explicit", "ot", 0]]}], "r": [[0.024279569833333334], 0, 2.58328914642334, 1575007049.4203668], "v": 0.1}
{"i": ["cuda", "schedule_direct_3d_cuda", [[1, 128, 20, 20, 20], [128, 128, 3, 3, 3], [1, 1, 1], [1, 1, 1], 1], {}, ["schedule_direct_3d_cuda", [1, 128, 20, 20, 20], [128, 128, 3, 3, 3], [1, 1, 1], [1, 1, 1], 1], {"i": 84760570, "t": "", "c": null, "e": [["tile_f", "sp", [-1, 4, 2, 1]], ["tile_d", "sp", [-1, 1, 1, 2]], ["tile_y", "sp", [-1, 1, 1, 2]], ["tile_x", "sp", [-1, 2, 1, 1]], ["tile_rc", "sp", [-1, 8]], ["tile_rd", "sp", [-1, 3]], ["tile_ry", "sp", [-1, 1]], ["tile_rx", "sp", [-1, 1]], ["auto_unroll_max_step", "ot", 0], ["unroll_explicit", "ot", 0]]}], "r": [[0.03646539125], 0, 2.0404858589172363, 1575007066.6743262], "v": 0.1}
{"i": ["cuda", "schedule_direct_3d_cuda", [[1, 128, 20, 20, 20], [128, 128, 3, 3, 3], [1, 1, 1], [1, 1, 1], 1], {}, ["schedule_direct_3d_cuda", [1, 128, 20, 20, 20], [128, 128, 3, 3, 3], [1, 1, 1], [1, 1, 1], 1], {"i": 1009547770, "t": "", "c": null, "e": [["tile_f", "sp", [-1, 4, 2, 1]], ["tile_d", "sp", [-1, 1, 1, 2]], ["tile_y", "sp", [-1, 4, 1, 1]], ["tile_x", "sp", [-1, 1, 1, 2]], ["tile_rc", "sp", [-1, 8]], ["tile_rd", "sp", [-1, 1]], ["tile_ry", "sp", [-1, 1]], ["tile_rx", "sp", [-1, 1]], ["auto_unroll_max_step", "ot", 1500], ["unroll_explicit", "ot", 0]]}], "r": [[0.108792957], 0, 3.830643653869629, 1575007069.1262639], "v": 0.1}
{"i": ["cuda", "schedule_direct_3d_cuda", [[1, 128, 20, 20, 20], [128, 128, 3, 3, 3], [1, 1, 1], [1, 1, 1], 1], {}, ["schedule_direct_3d_cuda", [1, 128, 20, 20, 20], [128, 128, 3, 3, 3], [1, 1, 1], [1, 1, 1], 1], {"i": 683801782, "t": "", "c": null, "e": [["tile_f", "sp", [-1, 2, 8, 1]], ["tile_d", "sp", [-1, 5, 1, 4]], ["tile_y", "sp", [-1, 1, 1, 2]], ["tile_x", "sp", [-1, 2, 1, 1]], ["tile_rc", "sp", [-1, 2]], ["tile_rd", "sp", [-1, 3]], ["tile_ry", "sp", [-1, 3]], ["tile_rx", "sp", [-1, 1]], ["auto_unroll_max_step", "ot", 512], ["unroll_explicit", "ot", 0]]}], "r": [[0.017365873333333334], 0, 2.961625576019287, 1575007073.5933158], "v": 0.1}
{"i": ["cuda", "schedule_direct_3d_cuda", [[1, 128, 20, 20, 20], [128, 128, 3, 3, 3], [1, 1, 1], [1, 1, 1], 1], {}, ["schedule_direct_3d_cuda", [1, 128, 20, 20, 20], [128, 128, 3, 3, 3], [1, 1, 1], [1, 1, 1], 1], {"i": 186328891, "t": "", "c": null, "e": [["tile_f", "sp", [-1, 2, 2, 8]], ["tile_d", "sp", [-1, 5, 1, 2]], ["tile_y", "sp", [-1, 1, 1, 2]], ["tile_x", "sp", [-1, 1, 4, 1]], ["tile_rc", "sp", [-1, 1]], ["tile_rd", "sp", [-1, 3]], ["tile_ry", "sp", [-1, 3]], ["tile_rx", "sp", [-1, 1]], ["auto_unroll_max_step", "ot", 0], ["unroll_explicit", "ot", 0]]}], "r": [[0.24078370575], 0, 4.828930616378784, 1575007077.2803771], "v": 0.1}
{"i": ["cuda", "schedule_direct_3d_cuda", [[1, 128, 20, 20, 20], [128, 128, 3, 3, 3], [1, 1, 1], [1, 1, 1], 1], {}, ["schedule_direct_3d_cuda", [1, 128, 20, 20, 20], [128, 128, 3, 3, 3], [1, 1, 1], [1, 1, 1], 1], {"i": 192281782, "t": "", "c": null, "e": [["tile_f", "sp", [-1, 2, 8, 1]], ["tile_d", "sp", [-1, 5, 1, 4]], ["tile_y", "sp", [-1, 1, 1, 2]], ["tile_x", "sp", [-1, 2, 1, 1]], ["tile_rc", "sp", [-1, 2]], ["tile_rd", "sp", [-1, 3]], ["tile_ry", "sp", [-1, 3]], ["tile_rx", "sp", [-1, 1]], ["auto_unroll_max_step", "ot", 0], ["unroll_explicit", "ot", 0]]}], "r": [[0.015190376], 0, 2.370168447494507, 1575007078.539832], "v": 0.1}
{"i": ["cuda", "schedule_direct_3d_cuda", [[1, 128, 20, 20, 20], [128, 128, 3, 3, 3], [1, 1, 1], [1, 1, 1], 1], {}, ["schedule_direct_3d_cuda", [1, 128, 20, 20, 20], [128, 128, 3, 3, 3], [1, 1, 1], [1, 1, 1], 1], {"i": 675858728, "t": "", "c": null, "e": [["tile_f", "sp", [-1, 1, 2, 1]], ["tile_d", "sp", [-1, 1, 1, 10]], ["tile_y", "sp", [-1, 5, 1, 1]], ["tile_x", "sp", [-1, 1, 1, 1]], ["tile_rc", "sp", [-1, 1]], ["tile_rd", "sp", [-1, 3]], ["tile_ry", "sp", [-1, 3]], ["tile_rx", "sp", [-1, 1]], ["auto_unroll_max_step", "ot", 512], ["unroll_explicit", "ot", 0]]}], "r": [[0.021549393], 0, 2.3514513969421387, 1575007084.6790733], "v": 0.1}
{"i": ["cuda", "schedule_direct_3d_cuda", [[1, 128, 20, 20, 20], [128, 128, 3, 3, 3], [1, 1, 1], [1, 1, 1], 1], {}, ["schedule_direct_3d_cuda", [1, 128, 20, 20, 20], [128, 128, 3, 3, 3], [1, 1, 1], [1, 1, 1], 1], {"i": 308500342, "t": "", "c": null, "e": [["tile_f", "sp", [-1, 2, 8, 1]], ["tile_d", "sp", [-1, 1, 1, 10]], ["tile_y", "sp", [-1, 1, 1, 5]], ["tile_x", "sp", [-1, 1, 2, 1]], ["tile_rc", "sp", [-1, 1]], ["tile_rd", "sp", [-1, 3]], ["tile_ry", "sp", [-1, 1]], ["tile_rx", "sp", [-1, 3]], ["auto_unroll_max_step", "ot", 0], ["unroll_explicit", "ot", 0]]}], "r": [[0.00515133375], 0, 2.0376131534576416, 1575007085.5631876], "v": 0.1}
{"i": ["cuda", "schedule_direct_3d_cuda", [[1, 128, 20, 20, 20], [128, 128, 3, 3, 3], [1, 1, 1], [1, 1, 1], 1], {}, ["schedule_direct_3d_cuda", [1, 128, 20, 20, 20], [128, 128, 3, 3, 3], [1, 1, 1], [1, 1, 1], 1], {"i": 1044573365, "t": "", "c": null, "e": [["tile_f", "sp", [-1, 32, 1, 1]], ["tile_d", "sp", [-1, 1, 1, 2]], ["tile_y", "sp", [-1, 2, 1, 2]], ["tile_x", "sp", [-1, 1, 1, 1]], ["tile_rc", "sp", [-1, 1]], ["tile_rd", "sp", [-1, 3]], ["tile_ry", "sp", [-1, 1]], ["tile_rx", "sp", [-1, 1]], ["auto_unroll_max_step", "ot", 1500], ["unroll_explicit", "ot", 0]]}], "r": [[0.09399022875], 0, 3.620359182357788, 1575007092.9410203], "v": 0.1}
{"i": ["cuda", "schedule_direct_3d_cuda", [[1, 128, 20, 20, 20], [128, 128, 3, 3, 3], [1, 1, 1], [1, 1, 1], 1], {}, ["schedule_direct_3d_cuda", [1, 128, 20, 20, 20], [128, 128, 3, 3, 3], [1, 1, 1], [1, 1, 1], 1], {"i": 184601782, "t": "", "c": null, "e": [["tile_f", "sp", [-1, 2, 8, 1]], ["tile_d", "sp", [-1, 5, 1, 4]], ["tile_y", "sp", [-1, 1, 1, 2]], ["tile_x", "sp", [-1, 2, 1, 1]], ["tile_rc", "sp", [-1, 1]], ["tile_rd", "sp", [-1, 3]], ["tile_ry", "sp", [-1, 3]], ["tile_rx", "sp", [-1, 1]], ["auto_unroll_max_step", "ot", 0], ["unroll_explicit", "ot", 0]]}], "r": [[0.01634101557142857], 0, 2.588951826095581, 1575007094.3401878], "v": 0.1}
{"i": ["cuda", "schedule_direct_3d_cuda", [[1, 128, 20, 20, 20], [128, 128, 3, 3, 3], [1, 1, 1], [1, 1, 1], 1], {}, ["schedule_direct_3d_cuda", [1, 128, 20, 20, 20], [128, 128, 3, 3, 3], [1, 1, 1], [1, 1, 1], 1], {"i": 1009547831, "t": "", "c": null, "e": [["tile_f", "sp", [-1, 2, 2, 4]], ["tile_d", "sp", [-1, 1, 1, 2]], ["tile_y", "sp", [-1, 4, 1, 1]], ["tile_x", "sp", [-1, 1, 1, 2]], ["tile_rc", "sp", [-1, 8]], ["tile_rd", "sp", [-1, 1]], ["tile_ry", "sp", [-1, 1]], ["tile_rx", "sp", [-1, 1]], ["auto_unroll_max_step", "ot", 1500], ["unroll_explicit", "ot", 0]]}], "r": [[0.03217883525], 0, 2.7909932136535645, 1575007095.5880377], "v": 0.1}
{"i": ["cuda", "schedule_direct_3d_cuda", [[1, 128, 20, 20, 20], [128, 128, 3, 3, 3], [1, 1, 1], [1, 1, 1], 1], {}, ["schedule_direct_3d_cuda", [1, 128, 20, 20, 20], [128, 128, 3, 3, 3], [1, 1, 1], [1, 1, 1], 1], {"i": 1167378728, "t": "", "c": null, "e": [["tile_f", "sp", [-1, 1, 2, 1]], ["tile_d", "sp", [-1, 1, 1, 10]], ["tile_y", "sp", [-1, 5, 1, 1]], ["tile_x", "sp", [-1, 1, 1, 1]], ["tile_rc", "sp", [-1, 1]], ["tile_rd", "sp", [-1, 3]], ["tile_ry", "sp", [-1, 3]], ["tile_rx", "sp", [-1, 1]], ["auto_unroll_max_step", "ot", 1500], ["unroll_explicit", "ot", 0]]}], "r": [[0.021537058333333334], 0, 2.0867106914520264, 1575007101.4332972], "v": 0.1}
{"i": ["cuda", "schedule_direct_3d_cuda", [[1, 128, 20, 20, 20], [128, 128, 3, 3, 3], [1, 1, 1], [1, 1, 1], 1], {}, ["schedule_direct_3d_cuda", [1, 128, 20, 20, 20], [128, 128, 3, 3, 3], [1, 1, 1], [1, 1, 1], 1], {"i": 1605401782, "t": "", "c": null, "e": [["tile_f", "sp", [-1, 2, 8, 1]], ["tile_d", "sp", [-1, 5, 1, 4]], ["tile_y", "sp", [-1, 1, 1, 2]], ["tile_x", "sp", [-1, 2, 1, 1]], ["tile_rc", "sp", [-1, 2]], ["tile_rd", "sp", [-1, 1]], ["tile_ry", "sp", [-1, 3]], ["tile_rx", "sp", [-1, 1]], ["auto_unroll_max_step", "ot", 0], ["unroll_explicit", "ot", 1]]}], "r": [[0.02446335133333333], 0, 2.314598798751831, 1575007111.4424636], "v": 0.1}
{"i": ["cuda", "schedule_direct_3d_cuda", [[1, 128, 20, 20, 20], [128, 128, 3, 3, 3], [1, 1, 1], [1, 1, 1], 1], {}, ["schedule_direct_3d_cuda", [1, 128, 20, 20, 20], [128, 128, 3, 3, 3], [1, 1, 1], [1, 1, 1], 1], {"i": 1981452855, "t": "", "c": null, "e": [["tile_f", "sp", [-1, 1, 4, 1]], ["tile_d", "sp", [-1, 1, 1, 4]], ["tile_y", "sp", [-1, 4, 1, 1]], ["tile_x", "sp", [-1, 1, 1, 1]], ["tile_rc", "sp", [-1, 4]], ["tile_rd", "sp", [-1, 1]], ["tile_ry", "sp", [-1, 1]], ["tile_rx", "sp", [-1, 1]], ["auto_unroll_max_step", "ot", 512], ["unroll_explicit", "ot", 1]]}], "r": [[0.0236524585], 0, 2.388669729232788, 1575007112.616835], "v": 0.1}
{"i": ["cuda", "schedule_direct_3d_cuda", [[1, 128, 20, 20, 20], [128, 128, 3, 3, 3], [1, 1, 1], [1, 1, 1], 1], {}, ["schedule_direct_3d_cuda", [1, 128, 20, 20, 20], [128, 128, 3, 3, 3], [1, 1, 1], [1, 1, 1], 1], {"i": 1493380702, "t": "", "c": null, "e": [["tile_f", "sp", [-1, 2, 8, 1]], ["tile_d", "sp", [-1, 1, 1, 20]], ["tile_y", "sp", [-1, 1, 1, 1]], ["tile_x", "sp", [-1, 1, 1, 2]], ["tile_rc", "sp", [-1, 4]], ["tile_rd", "sp", [-1, 1]], ["tile_ry", "sp", [-1, 1]], ["tile_rx", "sp", [-1, 1]], ["auto_unroll_max_step", "ot", 0], ["unroll_explicit", "ot", 1]]}], "r": [[0.027147215], 0, 2.32236647605896, 1575007119.250561], "v": 0.1}
{"i": ["cuda", "schedule_direct_3d_cuda", [[1, 128, 20, 20, 20], [128, 128, 3, 3, 3], [1, 1, 1], [1, 1, 1], 1], {}, ["schedule_direct_3d_cuda", [1, 128, 20, 20, 20], [128, 128, 3, 3, 3], [1, 1, 1], [1, 1, 1], 1], {"i": 557273782, "t": "", "c": null, "e": [["tile_f", "sp", [-1, 2, 8, 1]], ["tile_d", "sp", [-1, 5, 1, 4]], ["tile_y", "sp", [-1, 1, 1, 2]], ["tile_x", "sp", [-1, 1, 2, 2]], ["tile_rc", "sp", [-1, 1]], ["tile_rd", "sp", [-1, 3]], ["tile_ry", "sp", [-1, 1]], ["tile_rx", "sp", [-1, 1]], ["auto_unroll_max_step", "ot", 512], ["unroll_explicit", "ot", 0]]}], "r": [[0.006084004235294117], 0, 2.335021734237671, 1575007125.7791793], "v": 0.1}
{"i": ["cuda", "schedule_direct_3d_cuda", [[1, 128, 20, 20, 20], [128, 128, 3, 3, 3], [1, 1, 1], [1, 1, 1], 1], {}, ["schedule_direct_3d_cuda", [1, 128, 20, 20, 20], [128, 128, 3, 3, 3], [1, 1, 1], [1, 1, 1], 1], {"i": 2089298307, "t": "", "c": null, "e": [["tile_f", "sp", [-1, 2, 16, 1]], ["tile_d", "sp", [-1, 2, 1, 2]], ["tile_y", "sp", [-1, 1, 1, 5]], ["tile_x", "sp", [-1, 2, 1, 1]], ["tile_rc", "sp", [-1, 1]], ["tile_rd", "sp", [-1, 1]], ["tile_ry", "sp", [-1, 3]], ["tile_rx", "sp", [-1, 1]], ["auto_unroll_max_step", "ot", 512], ["unroll_explicit", "ot", 1]]}], "r": [[0.0035583011428571426], 0, 2.464087724685669, 1575007126.9710398], "v": 0.1}
