third_layer_input_grad.log
{"i": ["cuda", "schedule_conv3d_transpose_nchw_cuda", [[1, 128, 20, 20, 20], [128, 128, 3, 3, 3], [1, 1, 1], [1, 1, 1], [0, 0, 0], "float32"], {}, ["schedule_conv3d_transpose_nchw_cuda", [1, 128, 20, 20, 20], [128, 128, 3, 3, 3], [1, 1, 1], [1, 1, 1], [0, 0, 0], "float32"], {"i": 886699341, "t": "", "c": null, "e": [["tile_f", "sp", [-1, 1, 8, 1]], ["tile_d", "sp", [-1, 2, 1, 1]], ["tile_y", "sp", [-1, 10, 2, 1]], ["tile_x", "sp", [-1, 1, 1, 2]], ["tile_rc", "sp", [-1, 8]], ["tile_rd", "sp", [-1, 1]], ["tile_ry", "sp", [-1, 3]], ["tile_rx", "sp", [-1, 3]], ["auto_unroll_max_step", "ot", 512], ["unroll_explicit", "ot", 0]]}], "r": [[0.00313393796875], 0, 1.6284189224243164, 1576302563.0675774], "v": 0.1}
{"i": ["cuda", "schedule_conv3d_transpose_nchw_cuda", [[1, 128, 20, 20, 20], [128, 128, 3, 3, 3], [1, 1, 1], [1, 1, 1], [0, 0, 0], "float32"], {}, ["schedule_conv3d_transpose_nchw_cuda", [1, 128, 20, 20, 20], [128, 128, 3, 3, 3], [1, 1, 1], [1, 1, 1], [0, 0, 0], "float32"], {"i": 2504896655, "t": "", "c": null, "e": [["tile_f", "sp", [-1, 2, 4, 8]], ["tile_d", "sp", [-1, 1, 1, 2]], ["tile_y", "sp", [-1, 2, 5, 1]], ["tile_x", "sp", [-1, 1, 2, 1]], ["tile_rc", "sp", [-1, 64]], ["tile_rd", "sp", [-1, 1]], ["tile_ry", "sp", [-1, 1]], ["tile_rx", "sp", [-1, 1]], ["auto_unroll_max_step", "ot", 1500], ["unroll_explicit", "ot", 1]]}], "r": [[0.004319036567567568], 0, 2.576185941696167, 1576302564.4450278], "v": 0.1}
{"i": ["cuda", "schedule_conv3d_transpose_nchw_cuda", [[1, 128, 20, 20, 20], [128, 128, 3, 3, 3], [1, 1, 1], [1, 1, 1], [0, 0, 0], "float32"], {}, ["schedule_conv3d_transpose_nchw_cuda", [1, 128, 20, 20, 20], [128, 128, 3, 3, 3], [1, 1, 1], [1, 1, 1], [0, 0, 0], "float32"], {"i": 2519299723, "t": "", "c": null, "e": [["tile_f", "sp", [-1, 1, 2, 2]], ["tile_d", "sp", [-1, 10, 1, 1]], ["tile_y", "sp", [-1, 4, 5, 1]], ["tile_x", "sp", [-1, 2, 1, 1]], ["tile_rc", "sp", [-1, 1]], ["tile_rd", "sp", [-1, 3]], ["tile_ry", "sp", [-1, 1]], ["tile_rx", "sp", [-1, 1]], ["auto_unroll_max_step", "ot", 1500], ["unroll_explicit", "ot", 1]]}], "r": [[0.0264762455], 0, 2.1524128913879395, 1576302565.7442465], "v": 0.1}
{"i": ["cuda", "schedule_conv3d_transpose_nchw_cuda", [[1, 128, 20, 20, 20], [128, 128, 3, 3, 3], [1, 1, 1], [1, 1, 1], [0, 0, 0], "float32"], {}, ["schedule_conv3d_transpose_nchw_cuda", [1, 128, 20, 20, 20], [128, 128, 3, 3, 3], [1, 1, 1], [1, 1, 1], [0, 0, 0], "float32"], {"i": 1179326546, "t": "", "c": null, "e": [["tile_f", "sp", [-1, 1, 16, 1]], ["tile_d", "sp", [-1, 2, 1, 1]], ["tile_y", "sp", [-1, 2, 5, 1]], ["tile_x", "sp", [-1, 1, 2, 2]], ["tile_rc", "sp", [-1, 2]], ["tile_rd", "sp", [-1, 3]], ["tile_ry", "sp", [-1, 3]], ["tile_rx", "sp", [-1, 1]], ["auto_unroll_max_step", "ot", 1500], ["unroll_explicit", "ot", 0]]}], "r": [[0.0028580840555555553], 0, 1.2391977310180664, 1576302578.7704985], "v": 0.1}
{"i": ["cuda", "schedule_conv3d_transpose_nchw_cuda", [[1, 128, 20, 20, 20], [128, 128, 3, 3, 3], [1, 1, 1], [1, 1, 1], [0, 0, 0], "float32"], {}, ["schedule_conv3d_transpose_nchw_cuda", [1, 128, 20, 20, 20], [128, 128, 3, 3, 3], [1, 1, 1], [1, 1, 1], [0, 0, 0], "float32"], {"i": 2892301018, "t": "", "c": null, "e": [["tile_f", "sp", [-1, 1, 16, 2]], ["tile_d", "sp", [-1, 5, 1, 4]], ["tile_y", "sp", [-1, 4, 1, 1]], ["tile_x", "sp", [-1, 1, 5, 2]], ["tile_rc", "sp", [-1, 1]], ["tile_rd", "sp", [-1, 3]], ["tile_ry", "sp", [-1, 3]], ["tile_rx", "sp", [-1, 3]], ["auto_unroll_max_step", "ot", 1500], ["unroll_explicit", "ot", 1]]}], "r": [[0.023380309833333335], 0, 4.5930116176605225, 1576302594.1114569], "v": 0.1}
{"i": ["cuda", "schedule_conv3d_transpose_nchw_cuda", [[1, 128, 20, 20, 20], [128, 128, 3, 3, 3], [1, 1, 1], [1, 1, 1], [0, 0, 0], "float32"], {}, ["schedule_conv3d_transpose_nchw_cuda", [1, 128, 20, 20, 20], [128, 128, 3, 3, 3], [1, 1, 1], [1, 1, 1], [0, 0, 0], "float32"], {"i": 2219721640, "t": "", "c": null, "e": [["tile_f", "sp", [-1, 16, 1, 2]], ["tile_d", "sp", [-1, 1, 1, 1]], ["tile_y", "sp", [-1, 4, 1, 1]], ["tile_x", "sp", [-1, 2, 1, 1]], ["tile_rc", "sp", [-1, 2]], ["tile_rd", "sp", [-1, 1]], ["tile_ry", "sp", [-1, 1]], ["tile_rx", "sp", [-1, 3]], ["auto_unroll_max_step", "ot", 512], ["unroll_explicit", "ot", 1]]}], "r": [[0.1093085535], 0, 3.2859930992126465, 1576302601.3437467], "v": 0.1}
{"i": ["cuda", "schedule_conv3d_transpose_nchw_cuda", [[1, 128, 20, 20, 20], [128, 128, 3, 3, 3], [1, 1, 1], [1, 1, 1], [0, 0, 0], "float32"], {}, ["schedule_conv3d_transpose_nchw_cuda", [1, 128, 20, 20, 20], [128, 128, 3, 3, 3], [1, 1, 1], [1, 1, 1], [0, 0, 0], "float32"], {"i": 1178304681, "t": "", "c": null, "e": [["tile_f", "sp", [-1, 4, 8, 4]], ["tile_d", "sp", [-1, 20, 1, 1]], ["tile_y", "sp", [-1, 1, 1, 1]], ["tile_x", "sp", [-1, 1, 20, 1]], ["tile_rc", "sp", [-1, 2]], ["tile_rd", "sp", [-1, 3]], ["tile_ry", "sp", [-1, 3]], ["tile_rx", "sp", [-1, 1]], ["auto_unroll_max_step", "ot", 1500], ["unroll_explicit", "ot", 0]]}], "r": [[0.0178216465], 0, 2.1946113109588623, 1576302623.2726545], "v": 0.1}
{"i": ["cuda", "schedule_conv3d_transpose_nchw_cuda", [[1, 128, 20, 20, 20], [128, 128, 3, 3, 3], [1, 1, 1], [1, 1, 1], [0, 0, 0], "float32"], {}, ["schedule_conv3d_transpose_nchw_cuda", [1, 128, 20, 20, 20], [128, 128, 3, 3, 3], [1, 1, 1], [1, 1, 1], [0, 0, 0], "float32"], {"i": 1381720822, "t": "", "c": null, "e": [["tile_f", "sp", [-1, 2, 8, 1]], ["tile_d", "sp", [-1, 5, 1, 2]], ["tile_y", "sp", [-1, 1, 1, 2]], ["tile_x", "sp", [-1, 1, 1, 10]], ["tile_rc", "sp", [-1, 8]], ["tile_rd", "sp", [-1, 1]], ["tile_ry", "sp", [-1, 3]], ["tile_rx", "sp", [-1, 3]], ["auto_unroll_max_step", "ot", 1500], ["unroll_explicit", "ot", 0]]}], "r": [[0.08230304575], 0, 7.714120149612427, 1576302627.4577024], "v": 0.1}
{"i": ["cuda", "schedule_conv3d_transpose_nchw_cuda", [[1, 128, 20, 20, 20], [128, 128, 3, 3, 3], [1, 1, 1], [1, 1, 1], [0, 0, 0], "float32"], {}, ["schedule_conv3d_transpose_nchw_cuda", [1, 128, 20, 20, 20], [128, 128, 3, 3, 3], [1, 1, 1], [1, 1, 1], [0, 0, 0], "float32"], {"i": 1779355369, "t": "", "c": null, "e": [["tile_f", "sp", [-1, 1, 4, 2]], ["tile_d", "sp", [-1, 2, 1, 1]], ["tile_y", "sp", [-1, 2, 1, 2]], ["tile_x", "sp", [-1, 1, 1, 4]], ["tile_rc", "sp", [-1, 128]], ["tile_rd", "sp", [-1, 1]], ["tile_ry", "sp", [-1, 1]], ["tile_rx", "sp", [-1, 3]], ["auto_unroll_max_step", "ot", 0], ["unroll_explicit", "ot", 1]]}], "r": [[0.28078150125], 0, 4.507911920547485, 1576302631.674999], "v": 0.1}
{"i": ["cuda", "schedule_conv3d_transpose_nchw_cuda", [[1, 128, 20, 20, 20], [128, 128, 3, 3, 3], [1, 1, 1], [1, 1, 1], [0, 0, 0], "float32"], {}, ["schedule_conv3d_transpose_nchw_cuda", [1, 128, 20, 20, 20], [128, 128, 3, 3, 3], [1, 1, 1], [1, 1, 1], [0, 0, 0], "float32"], {"i": 1368993750, "t": "", "c": null, "e": [["tile_f", "sp", [-1, 1, 32, 1]], ["tile_d", "sp", [-1, 2, 1, 1]], ["tile_y", "sp", [-1, 2, 2, 1]], ["tile_x", "sp", [-1, 1, 4, 1]], ["tile_rc", "sp", [-1, 4]], ["tile_rd", "sp", [-1, 1]], ["tile_ry", "sp", [-1, 3]], ["tile_rx", "sp", [-1, 3]], ["auto_unroll_max_step", "ot", 1500], ["unroll_explicit", "ot", 0]]}], "r": [[0.0033987327619047617], 0, 1.8536710739135742, 1576302901.620517], "v": 0.1}
{"i": ["cuda", "schedule_conv3d_transpose_nchw_cuda", [[1, 128, 20, 20, 20], [128, 128, 3, 3, 3], [1, 1, 1], [1, 1, 1], [0, 0, 0], "float32"], {}, ["schedule_conv3d_transpose_nchw_cuda", [1, 128, 20, 20, 20], [128, 128, 3, 3, 3], [1, 1, 1], [1, 1, 1], [0, 0, 0], "float32"], {"i": 2843553750, "t": "", "c": null, "e": [["tile_f", "sp", [-1, 1, 32, 1]], ["tile_d", "sp", [-1, 2, 1, 1]], ["tile_y", "sp", [-1, 2, 2, 1]], ["tile_x", "sp", [-1, 1, 4, 1]], ["tile_rc", "sp", [-1, 4]], ["tile_rd", "sp", [-1, 1]], ["tile_ry", "sp", [-1, 3]], ["tile_rx", "sp", [-1, 3]], ["auto_unroll_max_step", "ot", 1500], ["unroll_explicit", "ot", 1]]}], "r": [[0.0027676173513513517], 0, 2.282998561859131, 1576302902.54662], "v": 0.1}
{"i": ["cuda", "schedule_conv3d_transpose_nchw_cuda", [[1, 128, 20, 20, 20], [128, 128, 3, 3, 3], [1, 1, 1], [1, 1, 1], [0, 0, 0], "float32"], {}, ["schedule_conv3d_transpose_nchw_cuda", [1, 128, 20, 20, 20], [128, 128, 3, 3, 3], [1, 1, 1], [1, 1, 1], [0, 0, 0], "float32"], {"i": 2844864298, "t": "", "c": null, "e": [["tile_f", "sp", [-1, 1, 16, 2]], ["tile_d", "sp", [-1, 4, 1, 1]], ["tile_y", "sp", [-1, 1, 1, 1]], ["tile_x", "sp", [-1, 1, 20, 1]], ["tile_rc", "sp", [-1, 4]], ["tile_rd", "sp", [-1, 1]], ["tile_ry", "sp", [-1, 3]], ["tile_rx", "sp", [-1, 3]], ["auto_unroll_max_step", "ot", 1500], ["unroll_explicit", "ot", 1]]}], "r": [[0.0023880570238095237], 0, 2.6980230808258057, 1576302903.531741], "v": 0.1}
{"i": ["cuda", "schedule_conv3d_transpose_nchw_cuda", [[1, 128, 20, 20, 20], [128, 128, 3, 3, 3], [1, 1, 1], [1, 1, 1], [0, 0, 0], "float32"], {}, ["schedule_conv3d_transpose_nchw_cuda", [1, 128, 20, 20, 20], [128, 128, 3, 3, 3], [1, 1, 1], [1, 1, 1], [0, 0, 0], "float32"], {"i": 2836848266, "t": "", "c": null, "e": [["tile_f", "sp", [-1, 1, 16, 1]], ["tile_d", "sp", [-1, 4, 1, 1]], ["tile_y", "sp", [-1, 1, 4, 1]], ["tile_x", "sp", [-1, 1, 10, 1]], ["tile_rc", "sp", [-1, 2]], ["tile_rd", "sp", [-1, 1]], ["tile_ry", "sp", [-1, 3]], ["tile_rx", "sp", [-1, 3]], ["auto_unroll_max_step", "ot", 1500], ["unroll_explicit", "ot", 1]]}], "r": [[0.005384402], 0, 1.8368120193481445, 1576302904.4167738], "v": 0.1}
{"i": ["cuda", "schedule_conv3d_transpose_nchw_cuda", [[1, 128, 20, 20, 20], [128, 128, 3, 3, 3], [1, 1, 1], [1, 1, 1], [0, 0, 0], "float32"], {}, ["schedule_conv3d_transpose_nchw_cuda", [1, 128, 20, 20, 20], [128, 128, 3, 3, 3], [1, 1, 1], [1, 1, 1], [0, 0, 0], "float32"], {"i": 1362288266, "t": "", "c": null, "e": [["tile_f", "sp", [-1, 1, 16, 1]], ["tile_d", "sp", [-1, 4, 1, 1]], ["tile_y", "sp", [-1, 1, 4, 1]], ["tile_x", "sp", [-1, 1, 10, 1]], ["tile_rc", "sp", [-1, 2]], ["tile_rd", "sp", [-1, 1]], ["tile_ry", "sp", [-1, 3]], ["tile_rx", "sp", [-1, 3]], ["auto_unroll_max_step", "ot", 1500], ["unroll_explicit", "ot", 0]]}], "r": [[0.0057935320000000005], 0, 1.699634313583374, 1576302905.315943], "v": 0.1}
{"i": ["cuda", "schedule_conv3d_transpose_nchw_cuda", [[1, 128, 20, 20, 20], [128, 128, 3, 3, 3], [1, 1, 1], [1, 1, 1], [0, 0, 0], "float32"], {}, ["schedule_conv3d_transpose_nchw_cuda", [1, 128, 20, 20, 20], [128, 128, 3, 3, 3], [1, 1, 1], [1, 1, 1], [0, 0, 0], "float32"], {"i": 2836992294, "t": "", "c": null, "e": [["tile_f", "sp", [-1, 1, 8, 2]], ["tile_d", "sp", [-1, 4, 1, 1]], ["tile_y", "sp", [-1, 1, 1, 1]], ["tile_x", "sp", [-1, 2, 10, 1]], ["tile_rc", "sp", [-1, 2]], ["tile_rd", "sp", [-1, 1]], ["tile_ry", "sp", [-1, 3]], ["tile_rx", "sp", [-1, 3]], ["auto_unroll_max_step", "ot", 1500], ["unroll_explicit", "ot", 1]]}], "r": [[0.0022861945454545453], 0, 2.6846768856048584, 1576302906.295713], "v": 0.1}
{"i": ["cuda", "schedule_conv3d_transpose_nchw_cuda", [[1, 128, 20, 20, 20], [128, 128, 3, 3, 3], [1, 1, 1], [1, 1, 1], [0, 0, 0], "float32"], {}, ["schedule_conv3d_transpose_nchw_cuda", [1, 128, 20, 20, 20], [128, 128, 3, 3, 3], [1, 1, 1], [1, 1, 1], [0, 0, 0], "float32"], {"i": 2836032386, "t": "", "c": null, "e": [["tile_f", "sp", [-1, 1, 16, 1]], ["tile_d", "sp", [-1, 5, 1, 1]], ["tile_y", "sp", [-1, 1, 1, 1]], ["tile_x", "sp", [-1, 5, 4, 1]], ["tile_rc", "sp", [-1, 2]], ["tile_rd", "sp", [-1, 1]], ["tile_ry", "sp", [-1, 3]], ["tile_rx", "sp", [-1, 3]], ["auto_unroll_max_step", "ot", 1500], ["unroll_explicit", "ot", 1]]}], "r": [[0.0063903939375], 0, 4.134497404098511, 1576302907.6028953], "v": 0.1}
{"i": ["cuda", "schedule_conv3d_transpose_nchw_cuda", [[1, 128, 20, 20, 20], [128, 128, 3, 3, 3], [1, 1, 1], [1, 1, 1], [0, 0, 0], "float32"], {}, ["schedule_conv3d_transpose_nchw_cuda", [1, 128, 20, 20, 20], [128, 128, 3, 3, 3], [1, 1, 1], [1, 1, 1], [0, 0, 0], "float32"], {"i": 1362432294, "t": "", "c": null, "e": [["tile_f", "sp", [-1, 1, 8, 2]], ["tile_d", "sp", [-1, 4, 1, 1]], ["tile_y", "sp", [-1, 1, 1, 1]], ["tile_x", "sp", [-1, 2, 10, 1]], ["tile_rc", "sp", [-1, 2]], ["tile_rd", "sp", [-1, 1]], ["tile_ry", "sp", [-1, 3]], ["tile_rx", "sp", [-1, 3]], ["auto_unroll_max_step", "ot", 1500], ["unroll_explicit", "ot", 0]]}], "r": [[0.0027166980540540542], 0, 2.1269049644470215, 1576302908.6350262], "v": 0.1}
{"i": ["cuda", "schedule_conv3d_transpose_nchw_cuda", [[1, 128, 20, 20, 20], [128, 128, 3, 3, 3], [1, 1, 1], [1, 1, 1], [0, 0, 0], "float32"], {}, ["schedule_conv3d_transpose_nchw_cuda", [1, 128, 20, 20, 20], [128, 128, 3, 3, 3], [1, 1, 1], [1, 1, 1], [0, 0, 0], "float32"], {"i": 2838720386, "t": "", "c": null, "e": [["tile_f", "sp", [-1, 1, 16, 1]], ["tile_d", "sp", [-1, 5, 1, 1]], ["tile_y", "sp", [-1, 1, 1, 1]], ["tile_x", "sp", [-1, 2, 5, 2]], ["tile_rc", "sp", [-1, 2]], ["tile_rd", "sp", [-1, 1]], ["tile_ry", "sp", [-1, 3]], ["tile_rx", "sp", [-1, 3]], ["auto_unroll_max_step", "ot", 1500], ["unroll_explicit", "ot", 1]]}], "r": [[0.0035740743555555555], 0, 3.566746234893799, 1576302910.0257907], "v": 0.1}
{"i": ["cuda", "schedule_conv3d_transpose_nchw_cuda", [[1, 128, 20, 20, 20], [128, 128, 3, 3, 3], [1, 1, 1], [1, 1, 1], [0, 0, 0], "float32"], {}, ["schedule_conv3d_transpose_nchw_cuda", [1, 128, 20, 20, 20], [128, 128, 3, 3, 3], [1, 1, 1], [1, 1, 1], [0, 0, 0], "float32"], {"i": 2836464266, "t": "", "c": null, "e": [["tile_f", "sp", [-1, 1, 16, 1]], ["tile_d", "sp", [-1, 4, 1, 1]], ["tile_y", "sp", [-1, 1, 4, 1]], ["tile_x", "sp", [-1, 2, 5, 1]], ["tile_rc", "sp", [-1, 2]], ["tile_rd", "sp", [-1, 1]], ["tile_ry", "sp", [-1, 3]], ["tile_rx", "sp", [-1, 3]], ["auto_unroll_max_step", "ot", 1500], ["unroll_explicit", "ot", 1]]}], "r": [[0.005376540368421053], 0, 2.255255699157715, 1576302910.9574912], "v": 0.1}
{"i": ["cuda", "schedule_conv3d_transpose_nchw_cuda", [[1, 128, 20, 20, 20], [128, 128, 3, 3, 3], [1, 1, 1], [1, 1, 1], [0, 0, 0], "float32"], {}, ["schedule_conv3d_transpose_nchw_cuda", [1, 128, 20, 20, 20], [128, 128, 3, 3, 3], [1, 1, 1], [1, 1, 1], [0, 0, 0], "float32"], {"i": 2837184386, "t": "", "c": null, "e": [["tile_f", "sp", [-1, 1, 16, 1]], ["tile_d", "sp", [-1, 5, 1, 1]], ["tile_y", "sp", [-1, 1, 1, 1]], ["tile_x", "sp", [-1, 1, 20, 1]], ["tile_rc", "sp", [-1, 2]], ["tile_rd", "sp", [-1, 1]], ["tile_ry", "sp", [-1, 3]], ["tile_rx", "sp", [-1, 3]], ["auto_unroll_max_step", "ot", 1500], ["unroll_explicit", "ot", 1]]}], "r": [[0.0039239000769230765], 0, 1.962813138961792, 1576302911.8454208], "v": 0.1}
{"i": ["cuda", "schedule_conv3d_transpose_nchw_cuda", [[1, 128, 20, 20, 20], [128, 128, 3, 3, 3], [1, 1, 1], [1, 1, 1], [0, 0, 0], "float32"], {}, ["schedule_conv3d_transpose_nchw_cuda", [1, 128, 20, 20, 20], [128, 128, 3, 3, 3], [1, 1, 1], [1, 1, 1], [0, 0, 0], "float32"], {"i": 1362624386, "t": "", "c": null, "e": [["tile_f", "sp", [-1, 1, 16, 1]], ["tile_d", "sp", [-1, 5, 1, 1]], ["tile_y", "sp", [-1, 1, 1, 1]], ["tile_x", "sp", [-1, 1, 20, 1]], ["tile_rc", "sp", [-1, 2]], ["tile_rd", "sp", [-1, 1]], ["tile_ry", "sp", [-1, 3]], ["tile_rx", "sp", [-1, 3]], ["auto_unroll_max_step", "ot", 1500], ["unroll_explicit", "ot", 0]]}], "r": [[0.003980666384615385], 0, 1.8225798606872559, 1576302912.7630591], "v": 0.1}
{"i": ["cuda", "schedule_conv3d_transpose_nchw_cuda", [[1, 128, 20, 20, 20], [128, 128, 3, 3, 3], [1, 1, 1], [1, 1, 1], [0, 0, 0], "float32"], {}, ["schedule_conv3d_transpose_nchw_cuda", [1, 128, 20, 20, 20], [128, 128, 3, 3, 3], [1, 1, 1], [1, 1, 1], [0, 0, 0], "float32"], {"i": 1361904266, "t": "", "c": null, "e": [["tile_f", "sp", [-1, 1, 16, 1]], ["tile_d", "sp", [-1, 4, 1, 1]], ["tile_y", "sp", [-1, 1, 4, 1]], ["tile_x", "sp", [-1, 2, 5, 1]], ["tile_rc", "sp", [-1, 2]], ["tile_rd", "sp", [-1, 1]], ["tile_ry", "sp", [-1, 3]], ["tile_rx", "sp", [-1, 3]], ["auto_unroll_max_step", "ot", 1500], ["unroll_explicit", "ot", 0]]}], "r": [[0.00541048852631579], 0, 1.7309486865997314, 1576302915.5404363], "v": 0.1}
{"i": ["cuda", "schedule_conv3d_transpose_nchw_cuda", [[1, 128, 20, 20, 20], [128, 128, 3, 3, 3], [1, 1, 1], [1, 1, 1], [0, 0, 0], "float32"], {}, ["schedule_conv3d_transpose_nchw_cuda", [1, 128, 20, 20, 20], [128, 128, 3, 3, 3], [1, 1, 1], [1, 1, 1], [0, 0, 0], "float32"], {"i": 1361472386, "t": "", "c": null, "e": [["tile_f", "sp", [-1, 1, 16, 1]], ["tile_d", "sp", [-1, 5, 1, 1]], ["tile_y", "sp", [-1, 1, 1, 1]], ["tile_x", "sp", [-1, 5, 4, 1]], ["tile_rc", "sp", [-1, 2]], ["tile_rd", "sp", [-1, 1]], ["tile_ry", "sp", [-1, 3]], ["tile_rx", "sp", [-1, 3]], ["auto_unroll_max_step", "ot", 1500], ["unroll_explicit", "ot", 0]]}], "r": [[0.004985959619047619], 0, 2.7040176391601562, 1576302916.8710184], "v": 0.1}
{"i": ["cuda", "schedule_conv3d_transpose_nchw_cuda", [[1, 128, 20, 20, 20], [128, 128, 3, 3, 3], [1, 1, 1], [1, 1, 1], [0, 0, 0], "float32"], {}, ["schedule_conv3d_transpose_nchw_cuda", [1, 128, 20, 20, 20], [128, 128, 3, 3, 3], [1, 1, 1], [1, 1, 1], [0, 0, 0], "float32"], {"i": 1351713626, "t": "", "c": null, "e": [["tile_f", "sp", [-1, 1, 16, 1]], ["tile_d", "sp", [-1, 1, 1, 1]], ["tile_y", "sp", [-1, 2, 2, 1]], ["tile_x", "sp", [-1, 1, 1, 1]], ["tile_rc", "sp", [-1, 1]], ["tile_rd", "sp", [-1, 1]], ["tile_ry", "sp", [-1, 3]], ["tile_rx", "sp", [-1, 3]], ["auto_unroll_max_step", "ot", 1500], ["unroll_explicit", "ot", 0]]}], "r": [[0.005859199944444444], 0, 1.5217185020446777, 1576302917.7409356], "v": 0.1}
{"i": ["cuda", "schedule_conv3d_transpose_nchw_cuda", [[1, 128, 20, 20, 20], [128, 128, 3, 3, 3], [1, 1, 1], [1, 1, 1], [0, 0, 0], "float32"], {}, ["schedule_conv3d_transpose_nchw_cuda", [1, 128, 20, 20, 20], [128, 128, 3, 3, 3], [1, 1, 1], [1, 1, 1], [0, 0, 0], "float32"], {"i": 1353624022, "t": "", "c": null, "e": [["tile_f", "sp", [-1, 2, 8, 1]], ["tile_d", "sp", [-1, 1, 1, 1]], ["tile_y", "sp", [-1, 20, 1, 1]], ["tile_x", "sp", [-1, 1, 4, 1]], ["tile_rc", "sp", [-1, 1]], ["tile_rd", "sp", [-1, 1]], ["tile_ry", "sp", [-1, 3]], ["tile_rx", "sp", [-1, 3]], ["auto_unroll_max_step", "ot", 1500], ["unroll_explicit", "ot", 0]]}], "r": [[0.0016901444210526315], 0, 2.263688087463379, 1576302919.032265], "v": 0.1}
{"i": ["cuda", "schedule_conv3d_transpose_nchw_cuda", [[1, 128, 20, 20, 20], [128, 128, 3, 3, 3], [1, 1, 1], [1, 1, 1], [0, 0, 0], "float32"], {}, ["schedule_conv3d_transpose_nchw_cuda", [1, 128, 20, 20, 20], [128, 128, 3, 3, 3], [1, 1, 1], [1, 1, 1], [0, 0, 0], "float32"], {"i": 1351728026, "t": "", "c": null, "e": [["tile_f", "sp", [-1, 1, 16, 1]], ["tile_d", "sp", [-1, 1, 1, 1]], ["tile_y", "sp", [-1, 1, 4, 1]], ["tile_x", "sp", [-1, 1, 1, 1]], ["tile_rc", "sp", [-1, 1]], ["tile_rd", "sp", [-1, 1]], ["tile_ry", "sp", [-1, 3]], ["tile_rx", "sp", [-1, 3]], ["auto_unroll_max_step", "ot", 1500], ["unroll_explicit", "ot", 0]]}], "r": [[0.007015656733333334], 0, 1.5662589073181152, 1576302919.8927758], "v": 0.1}
{"i": ["cuda", "schedule_conv3d_transpose_nchw_cuda", [[1, 128, 20, 20, 20], [128, 128, 3, 3, 3], [1, 1, 1], [1, 1, 1], [0, 0, 0], "float32"], {}, ["schedule_conv3d_transpose_nchw_cuda", [1, 128, 20, 20, 20], [128, 128, 3, 3, 3], [1, 1, 1], [1, 1, 1], [0, 0, 0], "float32"], {"i": 1354008022, "t": "", "c": null, "e": [["tile_f", "sp", [-1, 2, 8, 1]], ["tile_d", "sp", [-1, 1, 1, 1]], ["tile_y", "sp", [-1, 20, 1, 1]], ["tile_x", "sp", [-1, 1, 5, 1]], ["tile_rc", "sp", [-1, 1]], ["tile_rd", "sp", [-1, 1]], ["tile_ry", "sp", [-1, 3]], ["tile_rx", "sp", [-1, 3]], ["auto_unroll_max_step", "ot", 1500], ["unroll_explicit", "ot", 0]]}], "r": [[0.0021456331276595744], 0, 1.9743552207946777, 1576302920.8940341], "v": 0.1}
{"i": ["cuda", "schedule_conv3d_transpose_nchw_cuda", [[1, 128, 20, 20, 20], [128, 128, 3, 3, 3], [1, 1, 1], [1, 1, 1], [0, 0, 0], "float32"], {}, ["schedule_conv3d_transpose_nchw_cuda", [1, 128, 20, 20, 20], [128, 128, 3, 3, 3], [1, 1, 1], [1, 1, 1], [0, 0, 0], "float32"], {"i": 1353989181, "t": "", "c": null, "e": [["tile_f", "sp", [-1, 1, 8, 1]], ["tile_d", "sp", [-1, 5, 1, 1]], ["tile_y", "sp", [-1, 2, 1, 1]], ["tile_x", "sp", [-1, 1, 5, 1]], ["tile_rc", "sp", [-1, 1]], ["tile_rd", "sp", [-1, 1]], ["tile_ry", "sp", [-1, 3]], ["tile_rx", "sp", [-1, 3]], ["auto_unroll_max_step", "ot", 1500], ["unroll_explicit", "ot", 0]]}], "r": [[0.0048779628095238095], 0, 1.7064239978790283, 1576302921.7976031], "v": 0.1}
{"i": ["cuda", "schedule_conv3d_transpose_nchw_cuda", [[1, 128, 20, 20, 20], [128, 128, 3, 3, 3], [1, 1, 1], [1, 1, 1], [0, 0, 0], "float32"], {}, ["schedule_conv3d_transpose_nchw_cuda", [1, 128, 20, 20, 20], [128, 128, 3, 3, 3], [1, 1, 1], [1, 1, 1], [0, 0, 0], "float32"], {"i": 1361697986, "t": "", "c": null, "e": [["tile_f", "sp", [-1, 1, 16, 1]], ["tile_d", "sp", [-1, 5, 1, 1]], ["tile_y", "sp", [-1, 2, 2, 1]], ["tile_x", "sp", [-1, 1, 5, 1]], ["tile_rc", "sp", [-1, 2]], ["tile_rd", "sp", [-1, 1]], ["tile_ry", "sp", [-1, 3]], ["tile_rx", "sp", [-1, 3]], ["auto_unroll_max_step", "ot", 1500], ["unroll_explicit", "ot", 0]]}], "r": [[0.0030981212352941176], 0, 2.1021952629089355, 1576302923.017354], "v": 0.1}
{"i": ["cuda", "schedule_conv3d_transpose_nchw_cuda", [[1, 128, 20, 20, 20], [128, 128, 3, 3, 3], [1, 1, 1], [1, 1, 1], [0, 0, 0], "float32"], {}, ["schedule_conv3d_transpose_nchw_cuda", [1, 128, 20, 20, 20], [128, 128, 3, 3, 3], [1, 1, 1], [1, 1, 1], [0, 0, 0], "float32"], {"i": 1353605186, "t": "", "c": null, "e": [["tile_f", "sp", [-1, 1, 16, 1]], ["tile_d", "sp", [-1, 5, 1, 1]], ["tile_y", "sp", [-1, 2, 1, 1]], ["tile_x", "sp", [-1, 1, 4, 1]], ["tile_rc", "sp", [-1, 1]], ["tile_rd", "sp", [-1, 1]], ["tile_ry", "sp", [-1, 3]], ["tile_rx", "sp", [-1, 3]], ["auto_unroll_max_step", "ot", 1500], ["unroll_explicit", "ot", 0]]}], "r": [[0.0027390687027027028], 0, 1.6289896965026855, 1576302923.8748813], "v": 0.1}
{"i": ["cuda", "schedule_conv3d_transpose_nchw_cuda", [[1, 128, 20, 20, 20], [128, 128, 3, 3, 3], [1, 1, 1], [1, 1, 1], [0, 0, 0], "float32"], {}, ["schedule_conv3d_transpose_nchw_cuda", [1, 128, 20, 20, 20], [128, 128, 3, 3, 3], [1, 1, 1], [1, 1, 1], [0, 0, 0], "float32"], {"i": 1361697626, "t": "", "c": null, "e": [["tile_f", "sp", [-1, 1, 16, 1]], ["tile_d", "sp", [-1, 1, 1, 1]], ["tile_y", "sp", [-1, 2, 2, 1]], ["tile_x", "sp", [-1, 1, 5, 1]], ["tile_rc", "sp", [-1, 2]], ["tile_rd", "sp", [-1, 1]], ["tile_ry", "sp", [-1, 3]], ["tile_rx", "sp", [-1, 3]], ["auto_unroll_max_step", "ot", 1500], ["unroll_explicit", "ot", 0]]}], "r": [[0.0036298163928571428], 0, 1.5527687072753906, 1576302924.712246], "v": 0.1}
{"i": ["cuda", "schedule_conv3d_transpose_nchw_cuda", [[1, 128, 20, 20, 20], [128, 128, 3, 3, 3], [1, 1, 1], [1, 1, 1], [0, 0, 0], "float32"], {}, ["schedule_conv3d_transpose_nchw_cuda", [1, 128, 20, 20, 20], [128, 128, 3, 3, 3], [1, 1, 1], [1, 1, 1], [0, 0, 0], "float32"], {"i": 1414492946, "t": "", "c": null, "e": [["tile_f", "sp", [-1, 1, 16, 1]], ["tile_d", "sp", [-1, 2, 1, 1]], ["tile_y", "sp", [-1, 1, 2, 1]], ["tile_x", "sp", [-1, 2, 2, 1]], ["tile_rc", "sp", [-1, 1]], ["tile_rd", "sp", [-1, 3]], ["tile_ry", "sp", [-1, 3]], ["tile_rx", "sp", [-1, 3]], ["auto_unroll_max_step", "ot", 1500], ["unroll_explicit", "ot", 0]]}], "r": [[0.0024261487857142857], 0, 1.597210168838501, 1576302925.5617461], "v": 0.1}
{"i": ["cuda", "schedule_conv3d_transpose_nchw_cuda", [[1, 128, 20, 20, 20], [128, 128, 3, 3, 3], [1, 1, 1], [1, 1, 1], [0, 0, 0], "float32"], {}, ["schedule_conv3d_transpose_nchw_cuda", [1, 128, 20, 20, 20], [128, 128, 3, 3, 3], [1, 1, 1], [1, 1, 1], [0, 0, 0], "float32"], {"i": 1413168026, "t": "", "c": null, "e": [["tile_f", "sp", [-1, 1, 16, 1]], ["tile_d", "sp", [-1, 1, 1, 1]], ["tile_y", "sp", [-1, 1, 4, 1]], ["tile_x", "sp", [-1, 1, 1, 1]], ["tile_rc", "sp", [-1, 1]], ["tile_rd", "sp", [-1, 3]], ["tile_ry", "sp", [-1, 3]], ["tile_rx", "sp", [-1, 3]], ["auto_unroll_max_step", "ot", 1500], ["unroll_explicit", "ot", 0]]}], "r": [[0.006005819470588236], 0, 1.5348412990570068, 1576302926.4114115], "v": 0.1}
{"i": ["cuda", "schedule_conv3d_transpose_nchw_cuda", [[1, 128, 20, 20, 20], [128, 128, 3, 3, 3], [1, 1, 1], [1, 1, 1], [0, 0, 0], "float32"], {}, ["schedule_conv3d_transpose_nchw_cuda", [1, 128, 20, 20, 20], [128, 128, 3, 3, 3], [1, 1, 1], [1, 1, 1], [0, 0, 0], "float32"], {"i": 1361856386, "t": "", "c": null, "e": [["tile_f", "sp", [-1, 1, 16, 1]], ["tile_d", "sp", [-1, 5, 1, 1]], ["tile_y", "sp", [-1, 1, 1, 1]], ["tile_x", "sp", [-1, 2, 5, 1]], ["tile_rc", "sp", [-1, 2]], ["tile_rd", "sp", [-1, 1]], ["tile_ry", "sp", [-1, 3]], ["tile_rx", "sp", [-1, 3]], ["auto_unroll_max_step", "ot", 1500], ["unroll_explicit", "ot", 0]]}], "r": [[0.004779317238095238], 0, 2.025425910949707, 1576302929.2103817], "v": 0.1}
{"i": ["cuda", "schedule_conv3d_transpose_nchw_cuda", [[1, 128, 20, 20, 20], [128, 128, 3, 3, 3], [1, 1, 1], [1, 1, 1], [0, 0, 0], "float32"], {}, ["schedule_conv3d_transpose_nchw_cuda", [1, 128, 20, 20, 20], [128, 128, 3, 3, 3], [1, 1, 1], [1, 1, 1], [0, 0, 0], "float32"], {"i": 1361856146, "t": "", "c": null, "e": [["tile_f", "sp", [-1, 1, 16, 1]], ["tile_d", "sp", [-1, 2, 1, 1]], ["tile_y", "sp", [-1, 1, 1, 1]], ["tile_x", "sp", [-1, 2, 5, 1]], ["tile_rc", "sp", [-1, 2]], ["tile_rd", "sp", [-1, 1]], ["tile_ry", "sp", [-1, 3]], ["tile_rx", "sp", [-1, 3]], ["auto_unroll_max_step", "ot", 1500], ["unroll_explicit", "ot", 0]]}], "r": [[0.004967014095238095], 0, 1.559574842453003, 1576302930.1108863], "v": 0.1}
{"i": ["cuda", "schedule_conv3d_transpose_nchw_cuda", [[1, 128, 20, 20, 20], [128, 128, 3, 3, 3], [1, 1, 1], [1, 1, 1], [0, 0, 0], "float32"], {}, ["schedule_conv3d_transpose_nchw_cuda", [1, 128, 20, 20, 20], [128, 128, 3, 3, 3], [1, 1, 1], [1, 1, 1], [0, 0, 0], "float32"], {"i": 1362244826, "t": "", "c": null, "e": [["tile_f", "sp", [-1, 1, 16, 1]], ["tile_d", "sp", [-1, 1, 1, 1]], ["tile_y", "sp", [-1, 2, 1, 1]], ["tile_x", "sp", [-1, 1, 10, 1]], ["tile_rc", "sp", [-1, 2]], ["tile_rd", "sp", [-1, 1]], ["tile_ry", "sp", [-1, 3]], ["tile_rx", "sp", [-1, 3]], ["auto_unroll_max_step", "ot", 1500], ["unroll_explicit", "ot", 0]]}], "r": [[0.0032912996451612904], 0, 1.5610623359680176, 1576302930.9536023], "v": 0.1}
{"i": ["cuda", "schedule_conv3d_transpose_nchw_cuda", [[1, 128, 20, 20, 20], [128, 128, 3, 3, 3], [1, 1, 1], [1, 1, 1], [0, 0, 0], "float32"], {}, ["schedule_conv3d_transpose_nchw_cuda", [1, 128, 20, 20, 20], [128, 128, 3, 3, 3], [1, 1, 1], [1, 1, 1], [0, 0, 0], "float32"], {"i": 1353989186, "t": "", "c": null, "e": [["tile_f", "sp", [-1, 1, 16, 1]], ["tile_d", "sp", [-1, 5, 1, 1]], ["tile_y", "sp", [-1, 2, 1, 1]], ["tile_x", "sp", [-1, 1, 5, 1]], ["tile_rc", "sp", [-1, 1]], ["tile_rd", "sp", [-1, 1]], ["tile_ry", "sp", [-1, 3]], ["tile_rx", "sp", [-1, 3]], ["auto_unroll_max_step", "ot", 1500], ["unroll_explicit", "ot", 0]]}], "r": [[0.0028325530277777777], 0, 1.677474021911621, 1576302931.8265562], "v": 0.1}
{"i": ["cuda", "schedule_conv3d_transpose_nchw_cuda", [[1, 128, 20, 20, 20], [128, 128, 3, 3, 3], [1, 1, 1], [1, 1, 1], [0, 0, 0], "float32"], {}, ["schedule_conv3d_transpose_nchw_cuda", [1, 128, 20, 20, 20], [128, 128, 3, 3, 3], [1, 1, 1], [1, 1, 1], [0, 0, 0], "float32"], {"i": 1353988946, "t": "", "c": null, "e": [["tile_f", "sp", [-1, 1, 16, 1]], ["tile_d", "sp", [-1, 2, 1, 1]], ["tile_y", "sp", [-1, 2, 1, 1]], ["tile_x", "sp", [-1, 1, 5, 1]], ["tile_rc", "sp", [-1, 1]], ["tile_rd", "sp", [-1, 1]], ["tile_ry", "sp", [-1, 3]], ["tile_rx", "sp", [-1, 3]], ["auto_unroll_max_step", "ot", 1500], ["unroll_explicit", "ot", 0]]}], "r": [[0.003324575833333333], 0, 1.8126966953277588, 1576302932.9428203], "v": 0.1}
{"i": ["cuda", "schedule_conv3d_transpose_nchw_cuda", [[1, 128, 20, 20, 20], [128, 128, 3, 3, 3], [1, 1, 1], [1, 1, 1], [0, 0, 0], "float32"], {}, ["schedule_conv3d_transpose_nchw_cuda", [1, 128, 20, 20, 20], [128, 128, 3, 3, 3], [1, 1, 1], [1, 1, 1], [0, 0, 0], "float32"], {"i": 1415045186, "t": "", "c": null, "e": [["tile_f", "sp", [-1, 1, 16, 1]], ["tile_d", "sp", [-1, 5, 1, 1]], ["tile_y", "sp", [-1, 2, 1, 1]], ["tile_x", "sp", [-1, 1, 4, 1]], ["tile_rc", "sp", [-1, 1]], ["tile_rd", "sp", [-1, 3]], ["tile_ry", "sp", [-1, 3]], ["tile_rx", "sp", [-1, 3]], ["auto_unroll_max_step", "ot", 1500], ["unroll_explicit", "ot", 0]]}], "r": [[0.001459926231884058], 0, 1.6780540943145752, 1576302933.7991407], "v": 0.1}
{"i": ["cuda", "schedule_conv3d_transpose_nchw_cuda", [[1, 128, 20, 20, 20], [128, 128, 3, 3, 3], [1, 1, 1], [1, 1, 1], [0, 0, 0], "float32"], {}, ["schedule_conv3d_transpose_nchw_cuda", [1, 128, 20, 20, 20], [128, 128, 3, 3, 3], [1, 1, 1], [1, 1, 1], [0, 0, 0], "float32"], {"i": 2827430422, "t": "", "c": null, "e": [["tile_f", "sp", [-1, 2, 8, 1]], ["tile_d", "sp", [-1, 1, 1, 1]], ["tile_y", "sp", [-1, 5, 2, 1]], ["tile_x", "sp", [-1, 1, 2, 1]], ["tile_rc", "sp", [-1, 1]], ["tile_rd", "sp", [-1, 1]], ["tile_ry", "sp", [-1, 3]], ["tile_rx", "sp", [-1, 3]], ["auto_unroll_max_step", "ot", 1500], ["unroll_explicit", "ot", 1]]}], "r": [[0.001866887074074074], 0, 1.8577499389648438, 1576302934.6530743], "v": 0.1}
{"i": ["cuda", "schedule_conv3d_transpose_nchw_cuda", [[1, 128, 20, 20, 20], [128, 128, 3, 3, 3], [1, 1, 1], [1, 1, 1], [0, 0, 0], "float32"], {}, ["schedule_conv3d_transpose_nchw_cuda", [1, 128, 20, 20, 20], [128, 128, 3, 3, 3], [1, 1, 1], [1, 1, 1], [0, 0, 0], "float32"], {"i": 2826269066, "t": "", "c": null, "e": [["tile_f", "sp", [-1, 1, 16, 1]], ["tile_d", "sp", [-1, 4, 1, 1]], ["tile_y", "sp", [-1, 1, 2, 1]], ["tile_x", "sp", [-1, 1, 1, 1]], ["tile_rc", "sp", [-1, 1]], ["tile_rd", "sp", [-1, 1]], ["tile_ry", "sp", [-1, 3]], ["tile_rx", "sp", [-1, 3]], ["auto_unroll_max_step", "ot", 1500], ["unroll_explicit", "ot", 1]]}], "r": [[0.003944483076923077], 0, 1.676856517791748, 1576302935.4993], "v": 0.1}
{"i": ["cuda", "schedule_conv3d_transpose_nchw_cuda", [[1, 128, 20, 20, 20], [128, 128, 3, 3, 3], [1, 1, 1], [1, 1, 1], [0, 0, 0], "float32"], {}, ["schedule_conv3d_transpose_nchw_cuda", [1, 128, 20, 20, 20], [128, 128, 3, 3, 3], [1, 1, 1], [1, 1, 1], [0, 0, 0], "float32"], {"i": 1415429186, "t": "", "c": null, "e": [["tile_f", "sp", [-1, 1, 16, 1]], ["tile_d", "sp", [-1, 5, 1, 1]], ["tile_y", "sp", [-1, 2, 1, 1]], ["tile_x", "sp", [-1, 1, 5, 1]], ["tile_rc", "sp", [-1, 1]], ["tile_rd", "sp", [-1, 3]], ["tile_ry", "sp", [-1, 3]], ["tile_rx", "sp", [-1, 3]], ["auto_unroll_max_step", "ot", 1500], ["unroll_explicit", "ot", 0]]}], "r": [[0.002056473163265306], 0, 1.6649770736694336, 1576302936.3624184], "v": 0.1}
{"i": ["cuda", "schedule_conv3d_transpose_nchw_cuda", [[1, 128, 20, 20, 20], [128, 128, 3, 3, 3], [1, 1, 1], [1, 1, 1], [0, 0, 0], "float32"], {}, ["schedule_conv3d_transpose_nchw_cuda", [1, 128, 20, 20, 20], [128, 128, 3, 3, 3], [1, 1, 1], [1, 1, 1], [0, 0, 0], "float32"], {"i": 2828549186, "t": "", "c": null, "e": [["tile_f", "sp", [-1, 1, 16, 1]], ["tile_d", "sp", [-1, 5, 1, 1]], ["tile_y", "sp", [-1, 2, 1, 1]], ["tile_x", "sp", [-1, 1, 5, 1]], ["tile_rc", "sp", [-1, 1]], ["tile_rd", "sp", [-1, 1]], ["tile_ry", "sp", [-1, 3]], ["tile_rx", "sp", [-1, 3]], ["auto_unroll_max_step", "ot", 1500], ["unroll_explicit", "ot", 1]]}], "r": [[0.002900365857142857], 0, 1.8469767570495605, 1576302937.2432728], "v": 0.1}
{"i": ["cuda", "schedule_conv3d_transpose_nchw_cuda", [[1, 128, 20, 20, 20], [128, 128, 3, 3, 3], [1, 1, 1], [1, 1, 1], [0, 0, 0], "float32"], {}, ["schedule_conv3d_transpose_nchw_cuda", [1, 128, 20, 20, 20], [128, 128, 3, 3, 3], [1, 1, 1], [1, 1, 1], [0, 0, 0], "float32"], {"i": 1415616386, "t": "", "c": null, "e": [["tile_f", "sp", [-1, 1, 16, 1]], ["tile_d", "sp", [-1, 5, 1, 1]], ["tile_y", "sp", [-1, 1, 1, 1]], ["tile_x", "sp", [-1, 2, 5, 1]], ["tile_rc", "sp", [-1, 1]], ["tile_rd", "sp", [-1, 3]], ["tile_ry", "sp", [-1, 3]], ["tile_rx", "sp", [-1, 3]], ["auto_unroll_max_step", "ot", 1500], ["unroll_explicit", "ot", 0]]}], "r": [[0.0028947237090909093], 0, 1.998502492904663, 1576302938.3944852], "v": 0.1}
{"i": ["cuda", "schedule_conv3d_transpose_nchw_cuda", [[1, 128, 20, 20, 20], [128, 128, 3, 3, 3], [1, 1, 1], [1, 1, 1], [0, 0, 0], "float32"], {}, ["schedule_conv3d_transpose_nchw_cuda", [1, 128, 20, 20, 20], [128, 128, 3, 3, 3], [1, 1, 1], [1, 1, 1], [0, 0, 0], "float32"], {"i": 2826268826, "t": "", "c": null, "e": [["tile_f", "sp", [-1, 1, 16, 1]], ["tile_d", "sp", [-1, 1, 1, 1]], ["tile_y", "sp", [-1, 1, 2, 1]], ["tile_x", "sp", [-1, 1, 1, 1]], ["tile_rc", "sp", [-1, 1]], ["tile_rd", "sp", [-1, 1]], ["tile_ry", "sp", [-1, 3]], ["tile_rx", "sp", [-1, 3]], ["auto_unroll_max_step", "ot", 1500], ["unroll_explicit", "ot", 1]]}], "r": [[0.0105790475], 0, 1.6339433193206787, 1576302939.285995], "v": 0.1}
{"i": ["cuda", "schedule_conv3d_transpose_nchw_cuda", [[1, 128, 20, 20, 20], [128, 128, 3, 3, 3], [1, 1, 1], [1, 1, 1], [0, 0, 0], "float32"], {}, ["schedule_conv3d_transpose_nchw_cuda", [1, 128, 20, 20, 20], [128, 128, 3, 3, 3], [1, 1, 1], [1, 1, 1], [0, 0, 0], "float32"], {"i": 2889072026, "t": "", "c": null, "e": [["tile_f", "sp", [-1, 1, 16, 1]], ["tile_d", "sp", [-1, 1, 1, 1]], ["tile_y", "sp", [-1, 1, 4, 1]], ["tile_x", "sp", [-1, 2, 2, 1]], ["tile_rc", "sp", [-1, 1]], ["tile_rd", "sp", [-1, 3]], ["tile_ry", "sp", [-1, 3]], ["tile_rx", "sp", [-1, 3]], ["auto_unroll_max_step", "ot", 1500], ["unroll_explicit", "ot", 1]]}], "r": [[0.004349038260869565], 0, 1.5962674617767334, 1576302942.6349254], "v": 0.1}
{"i": ["cuda", "schedule_conv3d_transpose_nchw_cuda", [[1, 128, 20, 20, 20], [128, 128, 3, 3, 3], [1, 1, 1], [1, 1, 1], [0, 0, 0], "float32"], {}, ["schedule_conv3d_transpose_nchw_cuda", [1, 128, 20, 20, 20], [128, 128, 3, 3, 3], [1, 1, 1], [1, 1, 1], [0, 0, 0], "float32"], {"i": 1362249746, "t": "", "c": null, "e": [["tile_f", "sp", [-1, 1, 16, 1]], ["tile_d", "sp", [-1, 2, 1, 1]], ["tile_y", "sp", [-1, 4, 1, 1]], ["tile_x", "sp", [-1, 1, 10, 1]], ["tile_rc", "sp", [-1, 2]], ["tile_rd", "sp", [-1, 1]], ["tile_ry", "sp", [-1, 3]], ["tile_rx", "sp", [-1, 3]], ["auto_unroll_max_step", "ot", 1500], ["unroll_explicit", "ot", 0]]}], "r": [[0.002375234], 0, 1.950498104095459, 1576302943.8726897], "v": 0.1}
{"i": ["cuda", "schedule_conv3d_transpose_nchw_cuda", [[1, 128, 20, 20, 20], [128, 128, 3, 3, 3], [1, 1, 1], [1, 1, 1], [0, 0, 0], "float32"], {}, ["schedule_conv3d_transpose_nchw_cuda", [1, 128, 20, 20, 20], [128, 128, 3, 3, 3], [1, 1, 1], [1, 1, 1], [0, 0, 0], "float32"], {"i": 1362259226, "t": "", "c": null, "e": [["tile_f", "sp", [-1, 1, 16, 1]], ["tile_d", "sp", [-1, 1, 1, 1]], ["tile_y", "sp", [-1, 10, 1, 1]], ["tile_x", "sp", [-1, 1, 10, 1]], ["tile_rc", "sp", [-1, 2]], ["tile_rd", "sp", [-1, 1]], ["tile_ry", "sp", [-1, 3]], ["tile_rx", "sp", [-1, 3]], ["auto_unroll_max_step", "ot", 1500], ["unroll_explicit", "ot", 0]]}], "r": [[0.0018243418000000002], 0, 1.7250242233276367, 1576302944.7813797], "v": 0.1}
{"i": ["cuda", "schedule_conv3d_transpose_nchw_cuda", [[1, 128, 20, 20, 20], [128, 128, 3, 3, 3], [1, 1, 1], [1, 1, 1], [0, 0, 0], "float32"], {}, ["schedule_conv3d_transpose_nchw_cuda", [1, 128, 20, 20, 20], [128, 128, 3, 3, 3], [1, 1, 1], [1, 1, 1], [0, 0, 0], "float32"], {"i": 2827420822, "t": "", "c": null, "e": [["tile_f", "sp", [-1, 2, 8, 1]], ["tile_d", "sp", [-1, 1, 1, 1]], ["tile_y", "sp", [-1, 1, 2, 1]], ["tile_x", "sp", [-1, 1, 2, 1]], ["tile_rc", "sp", [-1, 1]], ["tile_rd", "sp", [-1, 1]], ["tile_ry", "sp", [-1, 3]], ["tile_rx", "sp", [-1, 3]], ["auto_unroll_max_step", "ot", 1500], ["unroll_explicit", "ot", 1]]}], "r": [[0.005732880555555556], 0, 1.573476791381836, 1576302945.639639], "v": 0.1}
{"i": ["cuda", "schedule_conv3d_transpose_nchw_cuda", [[1, 128, 20, 20, 20], [128, 128, 3, 3, 3], [1, 1, 1], [1, 1, 1], [0, 0, 0], "float32"], {}, ["schedule_conv3d_transpose_nchw_cuda", [1, 128, 20, 20, 20], [128, 128, 3, 3, 3], [1, 1, 1], [1, 1, 1], [0, 0, 0], "float32"], {"i": 2826273626, "t": "", "c": null, "e": [["tile_f", "sp", [-1, 1, 16, 1]], ["tile_d", "sp", [-1, 1, 1, 1]], ["tile_y", "sp", [-1, 2, 2, 1]], ["tile_x", "sp", [-1, 1, 1, 1]], ["tile_rc", "sp", [-1, 1]], ["tile_rd", "sp", [-1, 1]], ["tile_ry", "sp", [-1, 3]], ["tile_rx", "sp", [-1, 3]], ["auto_unroll_max_step", "ot", 1500], ["unroll_explicit", "ot", 1]]}], "r": [[0.005912430764705883], 0, 1.544553279876709, 1576302946.4728606], "v": 0.1}
{"i": ["cuda", "schedule_conv3d_transpose_nchw_cuda", [[1, 128, 20, 20, 20], [128, 128, 3, 3, 3], [1, 1, 1], [1, 1, 1], [0, 0, 0], "float32"], {}, ["schedule_conv3d_transpose_nchw_cuda", [1, 128, 20, 20, 20], [128, 128, 3, 3, 3], [1, 1, 1], [1, 1, 1], [0, 0, 0], "float32"], {"i": 1414305746, "t": "", "c": null, "e": [["tile_f", "sp", [-1, 1, 16, 1]], ["tile_d", "sp", [-1, 2, 1, 1]], ["tile_y", "sp", [-1, 2, 2, 1]], ["tile_x", "sp", [-1, 1, 2, 1]], ["tile_rc", "sp", [-1, 1]], ["tile_rd", "sp", [-1, 3]], ["tile_ry", "sp", [-1, 3]], ["tile_rx", "sp", [-1, 3]], ["auto_unroll_max_step", "ot", 1500], ["unroll_explicit", "ot", 0]]}], "r": [[0.0024278859761904764], 0, 1.6734964847564697, 1576302947.3397171], "v": 0.1}
{"i": ["cuda", "schedule_conv3d_transpose_nchw_cuda", [[1, 128, 20, 20, 20], [128, 128, 3, 3, 3], [1, 1, 1], [1, 1, 1], [0, 0, 0], "float32"], {}, ["schedule_conv3d_transpose_nchw_cuda", [1, 128, 20, 20, 20], [128, 128, 3, 3, 3], [1, 1, 1], [1, 1, 1], [0, 0, 0], "float32"], {"i": 1353993861, "t": "", "c": null, "e": [["tile_f", "sp", [-1, 1, 8, 1]], ["tile_d", "sp", [-1, 4, 1, 1]], ["tile_y", "sp", [-1, 4, 1, 1]], ["tile_x", "sp", [-1, 1, 5, 1]], ["tile_rc", "sp", [-1, 1]], ["tile_rd", "sp", [-1, 1]], ["tile_ry", "sp", [-1, 3]], ["tile_rx", "sp", [-1, 3]], ["auto_unroll_max_step", "ot", 1500], ["unroll_explicit", "ot", 0]]}], "r": [[0.0052191023], 0, 1.809600591659546, 1576302948.2910933], "v": 0.1}
{"i": ["cuda", "schedule_conv3d_transpose_nchw_cuda", [[1, 128, 20, 20, 20], [128, 128, 3, 3, 3], [1, 1, 1], [1, 1, 1], [0, 0, 0], "float32"], {}, ["schedule_conv3d_transpose_nchw_cuda", [1, 128, 20, 20, 20], [128, 128, 3, 3, 3], [1, 1, 1], [1, 1, 1], [0, 0, 0], "float32"], {"i": 1415428946, "t": "", "c": null, "e": [["tile_f", "sp", [-1, 1, 16, 1]], ["tile_d", "sp", [-1, 2, 1, 1]], ["tile_y", "sp", [-1, 2, 1, 1]], ["tile_x", "sp", [-1, 1, 5, 1]], ["tile_rc", "sp", [-1, 1]], ["tile_rd", "sp", [-1, 3]], ["tile_ry", "sp", [-1, 3]], ["tile_rx", "sp", [-1, 3]], ["auto_unroll_max_step", "ot", 1500], ["unroll_explicit", "ot", 0]]}], "r": [[0.0030715686363636365], 0, 1.5870845317840576, 1576302949.1237137], "v": 0.1}
{"i": ["cuda", "schedule_conv3d_transpose_nchw_cuda", [[1, 128, 20, 20, 20], [128, 128, 3, 3, 3], [1, 1, 1], [1, 1, 1], [0, 0, 0], "float32"], {}, ["schedule_conv3d_transpose_nchw_cuda", [1, 128, 20, 20, 20], [128, 128, 3, 3, 3], [1, 1, 1], [1, 1, 1], [0, 0, 0], "float32"], {"i": 2828549181, "t": "", "c": null, "e": [["tile_f", "sp", [-1, 1, 8, 1]], ["tile_d", "sp", [-1, 5, 1, 1]], ["tile_y", "sp", [-1, 2, 1, 1]], ["tile_x", "sp", [-1, 1, 5, 1]], ["tile_rc", "sp", [-1, 1]], ["tile_rd", "sp", [-1, 1]], ["tile_ry", "sp", [-1, 3]], ["tile_rx", "sp", [-1, 3]], ["auto_unroll_max_step", "ot", 1500], ["unroll_explicit", "ot", 1]]}], "r": [[0.0049205655238095235], 0, 1.8323774337768555, 1576302950.0137079], "v": 0.1}
{"i": ["cuda", "schedule_conv3d_transpose_nchw_cuda", [[1, 128, 20, 20, 20], [128, 128, 3, 3, 3], [1, 1, 1], [1, 1, 1], [0, 0, 0], "float32"], {}, ["schedule_conv3d_transpose_nchw_cuda", [1, 128, 20, 20, 20], [128, 128, 3, 3, 3], [1, 1, 1], [1, 1, 1], [0, 0, 0], "float32"], {"i": 1415433746, "t": "", "c": null, "e": [["tile_f", "sp", [-1, 1, 16, 1]], ["tile_d", "sp", [-1, 2, 1, 1]], ["tile_y", "sp", [-1, 4, 1, 1]], ["tile_x", "sp", [-1, 1, 5, 1]], ["tile_rc", "sp", [-1, 1]], ["tile_rd", "sp", [-1, 3]], ["tile_ry", "sp", [-1, 3]], ["tile_rx", "sp", [-1, 3]], ["auto_unroll_max_step", "ot", 1500], ["unroll_explicit", "ot", 0]]}], "r": [[0.0021217430833333334], 0, 1.5814208984375, 1576302950.8605926], "v": 0.1}
{"i": ["cuda", "schedule_conv3d_transpose_nchw_cuda", [[1, 128, 20, 20, 20], [128, 128, 3, 3, 3], [1, 1, 1], [1, 1, 1], [0, 0, 0], "float32"], {}, ["schedule_conv3d_transpose_nchw_cuda", [1, 128, 20, 20, 20], [128, 128, 3, 3, 3], [1, 1, 1], [1, 1, 1], [0, 0, 0], "float32"], {"i": 2828568022, "t": "", "c": null, "e": [["tile_f", "sp", [-1, 2, 8, 1]], ["tile_d", "sp", [-1, 1, 1, 1]], ["tile_y", "sp", [-1, 20, 1, 1]], ["tile_x", "sp", [-1, 1, 5, 1]], ["tile_rc", "sp", [-1, 1]], ["tile_rd", "sp", [-1, 1]], ["tile_ry", "sp", [-1, 3]], ["tile_rx", "sp", [-1, 3]], ["auto_unroll_max_step", "ot", 1500], ["unroll_explicit", "ot", 1]]}], "r": [[0.002494955243902439], 0, 2.561466932296753, 1576302951.8441408], "v": 0.1}
{"i": ["cuda", "schedule_conv3d_transpose_nchw_cuda", [[1, 128, 20, 20, 20], [128, 128, 3, 3, 3], [1, 1, 1], [1, 1, 1], [0, 0, 0], "float32"], {}, ["schedule_conv3d_transpose_nchw_cuda", [1, 128, 20, 20, 20], [128, 128, 3, 3, 3], [1, 1, 1], [1, 1, 1], [0, 0, 0], "float32"], {"i": 2889648386, "t": "", "c": null, "e": [["tile_f", "sp", [-1, 1, 16, 1]], ["tile_d", "sp", [-1, 5, 1, 1]], ["tile_y", "sp", [-1, 1, 4, 1]], ["tile_x", "sp", [-1, 1, 4, 1]], ["tile_rc", "sp", [-1, 1]], ["tile_rd", "sp", [-1, 3]], ["tile_ry", "sp", [-1, 3]], ["tile_rx", "sp", [-1, 3]], ["auto_unroll_max_step", "ot", 1500], ["unroll_explicit", "ot", 1]]}], "r": [[0.0020716065510204083], 0, 1.5836684703826904, 1576302952.6792371], "v": 0.1}
{"i": ["cuda", "schedule_conv3d_transpose_nchw_cuda", [[1, 128, 20, 20, 20], [128, 128, 3, 3, 3], [1, 1, 1], [1, 1, 1], [0, 0, 0], "float32"], {}, ["schedule_conv3d_transpose_nchw_cuda", [1, 128, 20, 20, 20], [128, 128, 3, 3, 3], [1, 1, 1], [1, 1, 1], [0, 0, 0], "float32"], {"i": 2826288026, "t": "", "c": null, "e": [["tile_f", "sp", [-1, 1, 16, 1]], ["tile_d", "sp", [-1, 1, 1, 1]], ["tile_y", "sp", [-1, 1, 4, 1]], ["tile_x", "sp", [-1, 1, 1, 1]], ["tile_rc", "sp", [-1, 1]], ["tile_rd", "sp", [-1, 1]], ["tile_ry", "sp", [-1, 3]], ["tile_rx", "sp", [-1, 3]], ["auto_unroll_max_step", "ot", 1500], ["unroll_explicit", "ot", 1]]}], "r": [[0.007188031142857143], 0, 1.4324183464050293, 1576302956.0443985], "v": 0.1}
{"i": ["cuda", "schedule_conv3d_transpose_nchw_cuda", [[1, 128, 20, 20, 20], [128, 128, 3, 3, 3], [1, 1, 1], [1, 1, 1], [0, 0, 0], "float32"], {}, ["schedule_conv3d_transpose_nchw_cuda", [1, 128, 20, 20, 20], [128, 128, 3, 3, 3], [1, 1, 1], [1, 1, 1], [0, 0, 0], "float32"], {"i": 2889638546, "t": "", "c": null, "e": [["tile_f", "sp", [-1, 1, 16, 1]], ["tile_d", "sp", [-1, 2, 1, 1]], ["tile_y", "sp", [-1, 5, 2, 1]], ["tile_x", "sp", [-1, 1, 4, 1]], ["tile_rc", "sp", [-1, 1]], ["tile_rd", "sp", [-1, 3]], ["tile_ry", "sp", [-1, 3]], ["tile_rx", "sp", [-1, 3]], ["auto_unroll_max_step", "ot", 1500], ["unroll_explicit", "ot", 1]]}], "r": [[0.001866118111111111], 0, 1.8899152278900146, 1576302956.9132802], "v": 0.1}
{"i": ["cuda", "schedule_conv3d_transpose_nchw_cuda", [[1, 128, 20, 20, 20], [128, 128, 3, 3, 3], [1, 1, 1], [1, 1, 1], [0, 0, 0], "float32"], {}, ["schedule_conv3d_transpose_nchw_cuda", [1, 128, 20, 20, 20], [128, 128, 3, 3, 3], [1, 1, 1], [1, 1, 1], [0, 0, 0], "float32"], {"i": 2828558421, "t": "", "c": null, "e": [["tile_f", "sp", [-1, 1, 8, 1]], ["tile_d", "sp", [-1, 1, 1, 1]], ["tile_y", "sp", [-1, 5, 1, 1]], ["tile_x", "sp", [-1, 1, 5, 1]], ["tile_rc", "sp", [-1, 1]], ["tile_rd", "sp", [-1, 1]], ["tile_ry", "sp", [-1, 3]], ["tile_rx", "sp", [-1, 3]], ["auto_unroll_max_step", "ot", 1500], ["unroll_explicit", "ot", 1]]}], "r": [[0.004057682], 0, 1.606111764907837, 1576302957.7678583], "v": 0.1}
{"i": ["cuda", "schedule_conv3d_transpose_nchw_cuda", [[1, 128, 20, 20, 20], [128, 128, 3, 3, 3], [1, 1, 1], [1, 1, 1], [0, 0, 0], "float32"], {}, ["schedule_conv3d_transpose_nchw_cuda", [1, 128, 20, 20, 20], [128, 128, 3, 3, 3], [1, 1, 1], [1, 1, 1], [0, 0, 0], "float32"], {"i": 2889989186, "t": "", "c": null, "e": [["tile_f", "sp", [-1, 1, 16, 1]], ["tile_d", "sp", [-1, 5, 1, 1]], ["tile_y", "sp", [-1, 2, 1, 1]], ["tile_x", "sp", [-1, 1, 5, 1]], ["tile_rc", "sp", [-1, 1]], ["tile_rd", "sp", [-1, 3]], ["tile_ry", "sp", [-1, 3]], ["tile_rx", "sp", [-1, 3]], ["auto_unroll_max_step", "ot", 1500], ["unroll_explicit", "ot", 1]]}], "r": [[0.0016880853666666668], 0, 1.7504932880401611, 1576302958.6171582], "v": 0.1}
{"i": ["cuda", "schedule_conv3d_transpose_nchw_cuda", [[1, 128, 20, 20, 20], [128, 128, 3, 3, 3], [1, 1, 1], [1, 1, 1], [0, 0, 0], "float32"], {}, ["schedule_conv3d_transpose_nchw_cuda", [1, 128, 20, 20, 20], [128, 128, 3, 3, 3], [1, 1, 1], [1, 1, 1], [0, 0, 0], "float32"], {"i": 2889705746, "t": "", "c": null, "e": [["tile_f", "sp", [-1, 1, 16, 1]], ["tile_d", "sp", [-1, 2, 1, 1]], ["tile_y", "sp", [-1, 1, 2, 2]], ["tile_x", "sp", [-1, 1, 4, 1]], ["tile_rc", "sp", [-1, 1]], ["tile_rd", "sp", [-1, 3]], ["tile_ry", "sp", [-1, 3]], ["tile_rx", "sp", [-1, 3]], ["auto_unroll_max_step", "ot", 1500], ["unroll_explicit", "ot", 1]]}], "r": [[0.0019662956862745097], 0, 1.6346898078918457, 1576302959.4531796], "v": 0.1}
{"i": ["cuda", "schedule_conv3d_transpose_nchw_cuda", [[1, 128, 20, 20, 20], [128, 128, 3, 3, 3], [1, 1, 1], [1, 1, 1], [0, 0, 0], "float32"], {}, ["schedule_conv3d_transpose_nchw_cuda", [1, 128, 20, 20, 20], [128, 128, 3, 3, 3], [1, 1, 1], [1, 1, 1], [0, 0, 0], "float32"], {"i": 2890176386, "t": "", "c": null, "e": [["tile_f", "sp", [-1, 1, 16, 1]], ["tile_d", "sp", [-1, 5, 1, 1]], ["tile_y", "sp", [-1, 1, 1, 1]], ["tile_x", "sp", [-1, 2, 5, 1]], ["tile_rc", "sp", [-1, 1]], ["tile_rd", "sp", [-1, 3]], ["tile_ry", "sp", [-1, 3]], ["tile_rx", "sp", [-1, 3]], ["auto_unroll_max_step", "ot", 1500], ["unroll_explicit", "ot", 1]]}], "r": [[0.0024566304375], 0, 2.1220080852508545, 1576302960.5892234], "v": 0.1}
{"i": ["cuda", "schedule_conv3d_transpose_nchw_cuda", [[1, 128, 20, 20, 20], [128, 128, 3, 3, 3], [1, 1, 1], [1, 1, 1], [0, 0, 0], "float32"], {}, ["schedule_conv3d_transpose_nchw_cuda", [1, 128, 20, 20, 20], [128, 128, 3, 3, 3], [1, 1, 1], [1, 1, 1], [0, 0, 0], "float32"], {"i": 2828184022, "t": "", "c": null, "e": [["tile_f", "sp", [-1, 2, 8, 1]], ["tile_d", "sp", [-1, 1, 1, 1]], ["tile_y", "sp", [-1, 20, 1, 1]], ["tile_x", "sp", [-1, 1, 4, 1]], ["tile_rc", "sp", [-1, 1]], ["tile_rd", "sp", [-1, 1]], ["tile_ry", "sp", [-1, 3]], ["tile_rx", "sp", [-1, 3]], ["auto_unroll_max_step", "ot", 1500], ["unroll_explicit", "ot", 1]]}], "r": [[0.0020882747708333336], 0, 2.791152000427246, 1576302961.580756], "v": 0.1}
{"i": ["cuda", "schedule_conv3d_transpose_nchw_cuda", [[1, 128, 20, 20, 20], [128, 128, 3, 3, 3], [1, 1, 1], [1, 1, 1], [0, 0, 0], "float32"], {}, ["schedule_conv3d_transpose_nchw_cuda", [1, 128, 20, 20, 20], [128, 128, 3, 3, 3], [1, 1, 1], [1, 1, 1], [0, 0, 0], "float32"], {"i": 2835859226, "t": "", "c": null, "e": [["tile_f", "sp", [-1, 1, 16, 1]], ["tile_d", "sp", [-1, 1, 1, 1]], ["tile_y", "sp", [-1, 10, 1, 1]], ["tile_x", "sp", [-1, 1, 4, 1]], ["tile_rc", "sp", [-1, 2]], ["tile_rd", "sp", [-1, 1]], ["tile_ry", "sp", [-1, 3]], ["tile_rx", "sp", [-1, 3]], ["auto_unroll_max_step", "ot", 1500], ["unroll_explicit", "ot", 1]]}], "r": [[0.001810886464285714], 0, 2.1070950031280518, 1576302962.4945807], "v": 0.1}
{"i": ["cuda", "schedule_conv3d_transpose_nchw_cuda", [[1, 128, 20, 20, 20], [128, 128, 3, 3, 3], [1, 1, 1], [1, 1, 1], [0, 0, 0], "float32"], {}, ["schedule_conv3d_transpose_nchw_cuda", [1, 128, 20, 20, 20], [128, 128, 3, 3, 3], [1, 1, 1], [1, 1, 1], [0, 0, 0], "float32"], {"i": 2887728026, "t": "", "c": null, "e": [["tile_f", "sp", [-1, 1, 16, 1]], ["tile_d", "sp", [-1, 1, 1, 1]], ["tile_y", "sp", [-1, 1, 4, 1]], ["tile_x", "sp", [-1, 1, 1, 1]], ["tile_rc", "sp", [-1, 1]], ["tile_rd", "sp", [-1, 3]], ["tile_ry", "sp", [-1, 3]], ["tile_rx", "sp", [-1, 3]], ["auto_unroll_max_step", "ot", 1500], ["unroll_explicit", "ot", 1]]}], "r": [[0.006069204], 0, 1.601708173751831, 1576302963.3363256], "v": 0.1}
{"i": ["cuda", "schedule_conv3d_transpose_nchw_cuda", [[1, 128, 20, 20, 20], [128, 128, 3, 3, 3], [1, 1, 1], [1, 1, 1], [0, 0, 0], "float32"], {}, ["schedule_conv3d_transpose_nchw_cuda", [1, 128, 20, 20, 20], [128, 128, 3, 3, 3], [1, 1, 1], [1, 1, 1], [0, 0, 0], "float32"], {"i": 2828544021, "t": "", "c": null, "e": [["tile_f", "sp", [-1, 1, 8, 1]], ["tile_d", "sp", [-1, 1, 1, 1]], ["tile_y", "sp", [-1, 1, 1, 1]], ["tile_x", "sp", [-1, 1, 5, 1]], ["tile_rc", "sp", [-1, 1]], ["tile_rd", "sp", [-1, 1]], ["tile_ry", "sp", [-1, 3]], ["tile_rx", "sp", [-1, 3]], ["auto_unroll_max_step", "ot", 1500], ["unroll_explicit", "ot", 1]]}], "r": [[0.011590460444444443], 0, 1.612567663192749, 1576302964.2202635], "v": 0.1}
{"i": ["cuda", "schedule_conv3d_transpose_nchw_cuda", [[1, 128, 20, 20, 20], [128, 128, 3, 3, 3], [1, 1, 1], [1, 1, 1], [0, 0, 0], "float32"], {}, ["schedule_conv3d_transpose_nchw_cuda", [1, 128, 20, 20, 20], [128, 128, 3, 3, 3], [1, 1, 1], [1, 1, 1], [0, 0, 0], "float32"], {"i": 2891952026, "t": "", "c": null, "e": [["tile_f", "sp", [-1, 1, 16, 1]], ["tile_d", "sp", [-1, 1, 1, 1]], ["tile_y", "sp", [-1, 1, 4, 1]], ["tile_x", "sp", [-1, 1, 2, 2]], ["tile_rc", "sp", [-1, 1]], ["tile_rd", "sp", [-1, 3]], ["tile_ry", "sp", [-1, 3]], ["tile_rx", "sp", [-1, 3]], ["auto_unroll_max_step", "ot", 1500], ["unroll_explicit", "ot", 1]]}], "r": [[0.00312805759375], 0, 1.6749682426452637, 1576302965.0443826], "v": 0.1}
{"i": ["cuda", "schedule_conv3d_transpose_nchw_cuda", [[1, 128, 20, 20, 20], [128, 128, 3, 3, 3], [1, 1, 1], [1, 1, 1], [0, 0, 0], "float32"], {}, ["schedule_conv3d_transpose_nchw_cuda", [1, 128, 20, 20, 20], [128, 128, 3, 3, 3], [1, 1, 1], [1, 1, 1], [0, 0, 0], "float32"], {"i": 2836819226, "t": "", "c": null, "e": [["tile_f", "sp", [-1, 1, 16, 1]], ["tile_d", "sp", [-1, 1, 1, 1]], ["tile_y", "sp", [-1, 10, 1, 1]], ["tile_x", "sp", [-1, 1, 10, 1]], ["tile_rc", "sp", [-1, 2]], ["tile_rd", "sp", [-1, 1]], ["tile_ry", "sp", [-1, 3]], ["tile_rx", "sp", [-1, 3]], ["auto_unroll_max_step", "ot", 1500], ["unroll_explicit", "ot", 1]]}], "r": [[0.0016822954], 0, 1.9799785614013672, 1576302965.9327004], "v": 0.1}
{"i": ["cuda", "schedule_conv3d_transpose_nchw_cuda", [[1, 128, 20, 20, 20], [128, 128, 3, 3, 3], [1, 1, 1], [1, 1, 1], [0, 0, 0], "float32"], {}, ["schedule_conv3d_transpose_nchw_cuda", [1, 128, 20, 20, 20], [128, 128, 3, 3, 3], [1, 1, 1], [1, 1, 1], [0, 0, 0], "float32"], {"i": 1906565186, "t": "", "c": null, "e": [["tile_f", "sp", [-1, 1, 16, 1]], ["tile_d", "sp", [-1, 5, 1, 1]], ["tile_y", "sp", [-1, 2, 1, 1]], ["tile_x", "sp", [-1, 1, 4, 1]], ["tile_rc", "sp", [-1, 1]], ["tile_rd", "sp", [-1, 3]], ["tile_ry", "sp", [-1, 3]], ["tile_rx", "sp", [-1, 3]], ["auto_unroll_max_step", "ot", 0], ["unroll_explicit", "ot", 1]]}], "r": [[0.0026392799811320758], 0, 1.6778569221496582, 1576303206.2977602], "v": 0.1}
{"i": ["cuda", "schedule_conv3d_transpose_nchw_cuda", [[1, 128, 20, 20, 20], [128, 128, 3, 3, 3], [1, 1, 1], [1, 1, 1], [0, 0, 0], "float32"], {}, ["schedule_conv3d_transpose_nchw_cuda", [1, 128, 20, 20, 20], [128, 128, 3, 3, 3], [1, 1, 1], [1, 1, 1], [0, 0, 0], "float32"], {"i": 2398085186, "t": "", "c": null, "e": [["tile_f", "sp", [-1, 1, 16, 1]], ["tile_d", "sp", [-1, 5, 1, 1]], ["tile_y", "sp", [-1, 2, 1, 1]], ["tile_x", "sp", [-1, 1, 4, 1]], ["tile_rc", "sp", [-1, 1]], ["tile_rd", "sp", [-1, 3]], ["tile_ry", "sp", [-1, 3]], ["tile_rx", "sp", [-1, 3]], ["auto_unroll_max_step", "ot", 512], ["unroll_explicit", "ot", 1]]}], "r": [[0.001341444], 0, 1.7203035354614258, 1576303207.1530228], "v": 0.1}
{"i": ["cuda", "schedule_conv3d_transpose_nchw_cuda", [[1, 128, 20, 20, 20], [128, 128, 3, 3, 3], [1, 1, 1], [1, 1, 1], [0, 0, 0], "float32"], {}, ["schedule_conv3d_transpose_nchw_cuda", [1, 128, 20, 20, 20], [128, 128, 3, 3, 3], [1, 1, 1], [1, 1, 1], [0, 0, 0], "float32"], {"i": 2889605186, "t": "", "c": null, "e": [["tile_f", "sp", [-1, 1, 16, 1]], ["tile_d", "sp", [-1, 5, 1, 1]], ["tile_y", "sp", [-1, 2, 1, 1]], ["tile_x", "sp", [-1, 1, 4, 1]], ["tile_rc", "sp", [-1, 1]], ["tile_rd", "sp", [-1, 3]], ["tile_ry", "sp", [-1, 3]], ["tile_rx", "sp", [-1, 3]], ["auto_unroll_max_step", "ot", 1500], ["unroll_explicit", "ot", 1]]}], "r": [[0.0013454429444444444], 0, 1.9141910076141357, 1576303208.1950438], "v": 0.1}
{"i": ["cuda", "schedule_conv3d_transpose_nchw_cuda", [[1, 128, 20, 20, 20], [128, 128, 3, 3, 3], [1, 1, 1], [1, 1, 1], [0, 0, 0], "float32"], {}, ["schedule_conv3d_transpose_nchw_cuda", [1, 128, 20, 20, 20], [128, 128, 3, 3, 3], [1, 1, 1], [1, 1, 1], [0, 0, 0], "float32"], {"i": 2889614542, "t": "", "c": null, "e": [["tile_f", "sp", [-1, 2, 8, 1]], ["tile_d", "sp", [-1, 2, 1, 1]], ["tile_y", "sp", [-1, 5, 1, 1]], ["tile_x", "sp", [-1, 1, 4, 1]], ["tile_rc", "sp", [-1, 1]], ["tile_rd", "sp", [-1, 3]], ["tile_ry", "sp", [-1, 3]], ["tile_rx", "sp", [-1, 3]], ["auto_unroll_max_step", "ot", 1500], ["unroll_explicit", "ot", 1]]}], "r": [[0.0009627527403846154], 0, 2.2159998416900635, 1576303209.1317234], "v": 0.1}
{"i": ["cuda", "schedule_conv3d_transpose_nchw_cuda", [[1, 128, 20, 20, 20], [128, 128, 3, 3, 3], [1, 1, 1], [1, 1, 1], [0, 0, 0], "float32"], {}, ["schedule_conv3d_transpose_nchw_cuda", [1, 128, 20, 20, 20], [128, 128, 3, 3, 3], [1, 1, 1], [1, 1, 1], [0, 0, 0], "float32"], {"i": 1906574542, "t": "", "c": null, "e": [["tile_f", "sp", [-1, 2, 8, 1]], ["tile_d", "sp", [-1, 2, 1, 1]], ["tile_y", "sp", [-1, 5, 1, 1]], ["tile_x", "sp", [-1, 1, 4, 1]], ["tile_rc", "sp", [-1, 1]], ["tile_rd", "sp", [-1, 3]], ["tile_ry", "sp", [-1, 3]], ["tile_rx", "sp", [-1, 3]], ["auto_unroll_max_step", "ot", 0], ["unroll_explicit", "ot", 1]]}], "r": [[0.00230023175], 0, 1.7152979373931885, 1576303209.9908566], "v": 0.1}
{"i": ["cuda", "schedule_conv3d_transpose_nchw_cuda", [[1, 128, 20, 20, 20], [128, 128, 3, 3, 3], [1, 1, 1], [1, 1, 1], [0, 0, 0], "float32"], {}, ["schedule_conv3d_transpose_nchw_cuda", [1, 128, 20, 20, 20], [128, 128, 3, 3, 3], [1, 1, 1], [1, 1, 1], [0, 0, 0], "float32"], {"i": 2398094542, "t": "", "c": null, "e": [["tile_f", "sp", [-1, 2, 8, 1]], ["tile_d", "sp", [-1, 2, 1, 1]], ["tile_y", "sp", [-1, 5, 1, 1]], ["tile_x", "sp", [-1, 1, 4, 1]], ["tile_rc", "sp", [-1, 1]], ["tile_rd", "sp", [-1, 3]], ["tile_ry", "sp", [-1, 3]], ["tile_rx", "sp", [-1, 3]], ["auto_unroll_max_step", "ot", 512], ["unroll_explicit", "ot", 1]]}], "r": [[0.0010693941914893617], 0, 2.0060908794403076, 1576303210.8640132], "v": 0.1}
{"i": ["cuda", "schedule_conv3d_transpose_nchw_cuda", [[1, 128, 20, 20, 20], [128, 128, 3, 3, 3], [1, 1, 1], [1, 1, 1], [0, 0, 0], "float32"], {}, ["schedule_conv3d_transpose_nchw_cuda", [1, 128, 20, 20, 20], [128, 128, 3, 3, 3], [1, 1, 1], [1, 1, 1], [0, 0, 0], "float32"], {"i": 432005186, "t": "", "c": null, "e": [["tile_f", "sp", [-1, 1, 16, 1]], ["tile_d", "sp", [-1, 5, 1, 1]], ["tile_y", "sp", [-1, 2, 1, 1]], ["tile_x", "sp", [-1, 1, 4, 1]], ["tile_rc", "sp", [-1, 1]], ["tile_rd", "sp", [-1, 3]], ["tile_ry", "sp", [-1, 3]], ["tile_rx", "sp", [-1, 3]], ["auto_unroll_max_step", "ot", 0], ["unroll_explicit", "ot", 0]]}], "r": [[0.0024503694634146343], 0, 1.6460280418395996, 1576303211.6753173], "v": 0.1}
{"i": ["cuda", "schedule_conv3d_transpose_nchw_cuda", [[1, 128, 20, 20, 20], [128, 128, 3, 3, 3], [1, 1, 1], [1, 1, 1], [0, 0, 0], "float32"], {}, ["schedule_conv3d_transpose_nchw_cuda", [1, 128, 20, 20, 20], [128, 128, 3, 3, 3], [1, 1, 1], [1, 1, 1], [0, 0, 0], "float32"], {"i": 923525186, "t": "", "c": null, "e": [["tile_f", "sp", [-1, 1, 16, 1]], ["tile_d", "sp", [-1, 5, 1, 1]], ["tile_y", "sp", [-1, 2, 1, 1]], ["tile_x", "sp", [-1, 1, 4, 1]], ["tile_rc", "sp", [-1, 1]], ["tile_rd", "sp", [-1, 3]], ["tile_ry", "sp", [-1, 3]], ["tile_rx", "sp", [-1, 3]], ["auto_unroll_max_step", "ot", 512], ["unroll_explicit", "ot", 0]]}], "r": [[0.0014677877272727274], 0, 2.0212008953094482, 1576303212.8001168], "v": 0.1}
{"i": ["cuda", "schedule_conv3d_transpose_nchw_cuda", [[1, 128, 20, 20, 20], [128, 128, 3, 3, 3], [1, 1, 1], [1, 1, 1], [0, 0, 0], "float32"], {}, ["schedule_conv3d_transpose_nchw_cuda", [1, 128, 20, 20, 20], [128, 128, 3, 3, 3], [1, 1, 1], [1, 1, 1], [0, 0, 0], "float32"], {"i": 1852819226, "t": "", "c": null, "e": [["tile_f", "sp", [-1, 1, 16, 1]], ["tile_d", "sp", [-1, 1, 1, 1]], ["tile_y", "sp", [-1, 10, 1, 1]], ["tile_x", "sp", [-1, 1, 4, 1]], ["tile_rc", "sp", [-1, 2]], ["tile_rd", "sp", [-1, 1]], ["tile_ry", "sp", [-1, 3]], ["tile_rx", "sp", [-1, 3]], ["auto_unroll_max_step", "ot", 0], ["unroll_explicit", "ot", 1]]}], "r": [[0.0019605327804878047], 0, 2.0369367599487305, 1576303213.9216456], "v": 0.1}
{"i": ["cuda", "schedule_conv3d_transpose_nchw_cuda", [[1, 128, 20, 20, 20], [128, 128, 3, 3, 3], [1, 1, 1], [1, 1, 1], [0, 0, 0], "float32"], {}, ["schedule_conv3d_transpose_nchw_cuda", [1, 128, 20, 20, 20], [128, 128, 3, 3, 3], [1, 1, 1], [1, 1, 1], [0, 0, 0], "float32"], {"i": 2344339226, "t": "", "c": null, "e": [["tile_f", "sp", [-1, 1, 16, 1]], ["tile_d", "sp", [-1, 1, 1, 1]], ["tile_y", "sp", [-1, 10, 1, 1]], ["tile_x", "sp", [-1, 1, 4, 1]], ["tile_rc", "sp", [-1, 2]], ["tile_rd", "sp", [-1, 1]], ["tile_ry", "sp", [-1, 3]], ["tile_rx", "sp", [-1, 3]], ["auto_unroll_max_step", "ot", 512], ["unroll_explicit", "ot", 1]]}], "r": [[0.001795240732142857], 0, 1.8366904258728027, 1576303214.8185155], "v": 0.1}
{"i": ["cuda", "schedule_conv3d_transpose_nchw_cuda", [[1, 128, 20, 20, 20], [128, 128, 3, 3, 3], [1, 1, 1], [1, 1, 1], [0, 0, 0], "float32"], {}, ["schedule_conv3d_transpose_nchw_cuda", [1, 128, 20, 20, 20], [128, 128, 3, 3, 3], [1, 1, 1], [1, 1, 1], [0, 0, 0], "float32"], {"i": 2889053186, "t": "", "c": null, "e": [["tile_f", "sp", [-1, 1, 16, 1]], ["tile_d", "sp", [-1, 5, 1, 1]], ["tile_y", "sp", [-1, 1, 2, 1]], ["tile_x", "sp", [-1, 2, 2, 1]], ["tile_rc", "sp", [-1, 1]], ["tile_rd", "sp", [-1, 3]], ["tile_ry", "sp", [-1, 3]], ["tile_rx", "sp", [-1, 3]], ["auto_unroll_max_step", "ot", 1500], ["unroll_explicit", "ot", 1]]}], "r": [[0.001744395896551724], 0, 1.886101484298706, 1576303215.6992962], "v": 0.1}
{"i": ["cuda", "schedule_conv3d_transpose_nchw_cuda", [[1, 128, 20, 20, 20], [128, 128, 3, 3, 3], [1, 1, 1], [1, 1, 1], [0, 0, 0], "float32"], {}, ["schedule_conv3d_transpose_nchw_cuda", [1, 128, 20, 20, 20], [128, 128, 3, 3, 3], [1, 1, 1], [1, 1, 1], [0, 0, 0], "float32"], {"i": 1906013186, "t": "", "c": null, "e": [["tile_f", "sp", [-1, 1, 16, 1]], ["tile_d", "sp", [-1, 5, 1, 1]], ["tile_y", "sp", [-1, 1, 2, 1]], ["tile_x", "sp", [-1, 2, 2, 1]], ["tile_rc", "sp", [-1, 1]], ["tile_rd", "sp", [-1, 3]], ["tile_ry", "sp", [-1, 3]], ["tile_rx", "sp", [-1, 3]], ["auto_unroll_max_step", "ot", 0], ["unroll_explicit", "ot", 1]]}], "r": [[0.0027617186551724135], 0, 1.8965966701507568, 1576303216.762322], "v": 0.1}
{"i": ["cuda", "schedule_conv3d_transpose_nchw_cuda", [[1, 128, 20, 20, 20], [128, 128, 3, 3, 3], [1, 1, 1], [1, 1, 1], [0, 0, 0], "float32"], {}, ["schedule_conv3d_transpose_nchw_cuda", [1, 128, 20, 20, 20], [128, 128, 3, 3, 3], [1, 1, 1], [1, 1, 1], [0, 0, 0], "float32"], {"i": 2397533186, "t": "", "c": null, "e": [["tile_f", "sp", [-1, 1, 16, 1]], ["tile_d", "sp", [-1, 5, 1, 1]], ["tile_y", "sp", [-1, 1, 2, 1]], ["tile_x", "sp", [-1, 2, 2, 1]], ["tile_rc", "sp", [-1, 1]], ["tile_rd", "sp", [-1, 3]], ["tile_ry", "sp", [-1, 3]], ["tile_rx", "sp", [-1, 3]], ["auto_unroll_max_step", "ot", 512], ["unroll_explicit", "ot", 1]]}], "r": [[0.0018204991351351352], 0, 2.097111701965332, 1576303220.0721488], "v": 0.1}
{"i": ["cuda", "schedule_conv3d_transpose_nchw_cuda", [[1, 128, 20, 20, 20], [128, 128, 3, 3, 3], [1, 1, 1], [1, 1, 1], [0, 0, 0], "float32"], {}, ["schedule_conv3d_transpose_nchw_cuda", [1, 128, 20, 20, 20], [128, 128, 3, 3, 3], [1, 1, 1], [1, 1, 1], [0, 0, 0], "float32"], {"i": 432014542, "t": "", "c": null, "e": [["tile_f", "sp", [-1, 2, 8, 1]], ["tile_d", "sp", [-1, 2, 1, 1]], ["tile_y", "sp", [-1, 5, 1, 1]], ["tile_x", "sp", [-1, 1, 4, 1]], ["tile_rc", "sp", [-1, 1]], ["tile_rd", "sp", [-1, 3]], ["tile_ry", "sp", [-1, 3]], ["tile_rx", "sp", [-1, 3]], ["auto_unroll_max_step", "ot", 0], ["unroll_explicit", "ot", 0]]}], "r": [[0.0023004458181818182], 0, 1.5450177192687988, 1576303220.8961146], "v": 0.1}
{"i": ["cuda", "schedule_conv3d_transpose_nchw_cuda", [[1, 128, 20, 20, 20], [128, 128, 3, 3, 3], [1, 1, 1], [1, 1, 1], [0, 0, 0], "float32"], {}, ["schedule_conv3d_transpose_nchw_cuda", [1, 128, 20, 20, 20], [128, 128, 3, 3, 3], [1, 1, 1], [1, 1, 1], [0, 0, 0], "float32"], {"i": 1415054542, "t": "", "c": null, "e": [["tile_f", "sp", [-1, 2, 8, 1]], ["tile_d", "sp", [-1, 2, 1, 1]], ["tile_y", "sp", [-1, 5, 1, 1]], ["tile_x", "sp", [-1, 1, 4, 1]], ["tile_rc", "sp", [-1, 1]], ["tile_rd", "sp", [-1, 3]], ["tile_ry", "sp", [-1, 3]], ["tile_rx", "sp", [-1, 3]], ["auto_unroll_max_step", "ot", 1500], ["unroll_explicit", "ot", 0]]}], "r": [[0.0024587906097560974], 0, 1.7370879650115967, 1576303221.86964], "v": 0.1}
{"i": ["cuda", "schedule_conv3d_transpose_nchw_cuda", [[1, 128, 20, 20, 20], [128, 128, 3, 3, 3], [1, 1, 1], [1, 1, 1], [0, 0, 0], "float32"], {}, ["schedule_conv3d_transpose_nchw_cuda", [1, 128, 20, 20, 20], [128, 128, 3, 3, 3], [1, 1, 1], [1, 1, 1], [0, 0, 0], "float32"], {"i": 2398109182, "t": "", "c": null, "e": [["tile_f", "sp", [-1, 2, 8, 1]], ["tile_d", "sp", [-1, 5, 1, 1]], ["tile_y", "sp", [-1, 1, 2, 1]], ["tile_x", "sp", [-1, 1, 4, 1]], ["tile_rc", "sp", [-1, 1]], ["tile_rd", "sp", [-1, 3]], ["tile_ry", "sp", [-1, 3]], ["tile_rx", "sp", [-1, 3]], ["auto_unroll_max_step", "ot", 512], ["unroll_explicit", "ot", 1]]}], "r": [[0.0014714912205882353], 0, 1.9973013401031494, 1576303222.7483459], "v": 0.1}
{"i": ["cuda", "schedule_conv3d_transpose_nchw_cuda", [[1, 128, 20, 20, 20], [128, 128, 3, 3, 3], [1, 1, 1], [1, 1, 1], [0, 0, 0], "float32"], {}, ["schedule_conv3d_transpose_nchw_cuda", [1, 128, 20, 20, 20], [128, 128, 3, 3, 3], [1, 1, 1], [1, 1, 1], [0, 0, 0], "float32"], {"i": 1414493186, "t": "", "c": null, "e": [["tile_f", "sp", [-1, 1, 16, 1]], ["tile_d", "sp", [-1, 5, 1, 1]], ["tile_y", "sp", [-1, 1, 2, 1]], ["tile_x", "sp", [-1, 2, 2, 1]], ["tile_rc", "sp", [-1, 1]], ["tile_rd", "sp", [-1, 3]], ["tile_ry", "sp", [-1, 3]], ["tile_rx", "sp", [-1, 3]], ["auto_unroll_max_step", "ot", 1500], ["unroll_explicit", "ot", 0]]}], "r": [[0.0018142756818181817], 0, 2.0214099884033203, 1576303223.9117324], "v": 0.1}
{"i": ["cuda", "schedule_conv3d_transpose_nchw_cuda", [[1, 128, 20, 20, 20], [128, 128, 3, 3, 3], [1, 1, 1], [1, 1, 1], [0, 0, 0], "float32"], {}, ["schedule_conv3d_transpose_nchw_cuda", [1, 128, 20, 20, 20], [128, 128, 3, 3, 3], [1, 1, 1], [1, 1, 1], [0, 0, 0], "float32"], {"i": 922973186, "t": "", "c": null, "e": [["tile_f", "sp", [-1, 1, 16, 1]], ["tile_d", "sp", [-1, 5, 1, 1]], ["tile_y", "sp", [-1, 1, 2, 1]], ["tile_x", "sp", [-1, 2, 2, 1]], ["tile_rc", "sp", [-1, 1]], ["tile_rd", "sp", [-1, 3]], ["tile_ry", "sp", [-1, 3]], ["tile_rx", "sp", [-1, 3]], ["auto_unroll_max_step", "ot", 512], ["unroll_explicit", "ot", 0]]}], "r": [[0.0018101025892857143], 0, 1.8502802848815918, 1576303224.7607942], "v": 0.1}
{"i": ["cuda", "schedule_conv3d_transpose_nchw_cuda", [[1, 128, 20, 20, 20], [128, 128, 3, 3, 3], [1, 1, 1], [1, 1, 1], [0, 0, 0], "float32"], {}, ["schedule_conv3d_transpose_nchw_cuda", [1, 128, 20, 20, 20], [128, 128, 3, 3, 3], [1, 1, 1], [1, 1, 1], [0, 0, 0], "float32"], {"i": 431453186, "t": "", "c": null, "e": [["tile_f", "sp", [-1, 1, 16, 1]], ["tile_d", "sp", [-1, 5, 1, 1]], ["tile_y", "sp", [-1, 1, 2, 1]], ["tile_x", "sp", [-1, 2, 2, 1]], ["tile_rc", "sp", [-1, 1]], ["tile_rd", "sp", [-1, 3]], ["tile_ry", "sp", [-1, 3]], ["tile_rx", "sp", [-1, 3]], ["auto_unroll_max_step", "ot", 0], ["unroll_explicit", "ot", 0]]}], "r": [[0.002730199918918919], 0, 1.7861378192901611, 1576303225.5646594], "v": 0.1}
{"i": ["cuda", "schedule_conv3d_transpose_nchw_cuda", [[1, 128, 20, 20, 20], [128, 128, 3, 3, 3], [1, 1, 1], [1, 1, 1], [0, 0, 0], "float32"], {}, ["schedule_conv3d_transpose_nchw_cuda", [1, 128, 20, 20, 20], [128, 128, 3, 3, 3], [1, 1, 1], [1, 1, 1], [0, 0, 0], "float32"], {"i": 1852814546, "t": "", "c": null, "e": [["tile_f", "sp", [-1, 1, 16, 1]], ["tile_d", "sp", [-1, 2, 1, 1]], ["tile_y", "sp", [-1, 5, 1, 1]], ["tile_x", "sp", [-1, 1, 4, 1]], ["tile_rc", "sp", [-1, 2]], ["tile_rd", "sp", [-1, 1]], ["tile_ry", "sp", [-1, 3]], ["tile_rx", "sp", [-1, 3]], ["auto_unroll_max_step", "ot", 0], ["unroll_explicit", "ot", 1]]}], "r": [[0.0021108825625], 0, 1.7643589973449707, 1576303226.4860845], "v": 0.1}
