fast3d/first_layer_weight_grad_custom.log
{"i": ["cuda", "schedule_conv3d_nchw_cuda", [[1, 1, 80, 160, 160], [32, 1, 80, 80, 80], [1, 1, 1], [1, 1, 1], [1, 2, 2], 1], {}, ["schedule_conv3d_nchw_cuda", [1, 1, 80, 160, 160], [32, 1, 80, 80, 80], [1, 1, 1], [1, 1, 1], [1, 2, 2], 1], {"i": 71688487, "t": "", "c": null, "e": [["tile_n", "sp", [-1, 1, 1, 1]], ["tile_f", "sp", [-1, 2, 4, 2]], ["tile_d", "sp", [-1, 1, 1, 3]], ["tile_y", "sp", [-1, 2, 1, 2]], ["tile_x", "sp", [-1, 1, 2, 1]], ["tile_rc", "sp", [-1, 1]], ["tile_rd", "sp", [-1, 1]], ["tile_ry", "sp", [-1, 1]], ["tile_rx", "sp", [-1, 4]], ["auto_unroll_max_step", "ot", 0], ["unroll_explicit", "ot", 1], ["fuse_yx", "ot", 0]]}], "r": [[0.22220527975], 0, 3.6246893405914307, 1578227623.0212958], "v": 0.1}
{"i": ["cuda", "schedule_conv3d_nchw_cuda", [[1, 1, 80, 160, 160], [32, 1, 80, 80, 80], [1, 1, 1], [1, 1, 1], [1, 2, 2], 1], {}, ["schedule_conv3d_nchw_cuda", [1, 1, 80, 160, 160], [32, 1, 80, 80, 80], [1, 1, 1], [1, 1, 1], [1, 2, 2], 1], {"i": 242004184, "t": "", "c": null, "e": [["tile_n", "sp", [-1, 1, 1, 1]], ["tile_f", "sp", [-1, 2, 8, 1]], ["tile_d", "sp", [-1, 1, 1, 3]], ["tile_y", "sp", [-1, 1, 4, 1]], ["tile_x", "sp", [-1, 2, 1, 2]], ["tile_rc", "sp", [-1, 1]], ["tile_rd", "sp", [-1, 5]], ["tile_ry", "sp", [-1, 1]], ["tile_rx", "sp", [-1, 40]], ["auto_unroll_max_step", "ot", 512], ["unroll_explicit", "ot", 1], ["fuse_yx", "ot", 1]]}], "r": [[0.04760487875], 0, 2.3675413131713867, 1578227648.844423], "v": 0.1}
{"i": ["cuda", "schedule_conv3d_nchw_cuda", [[1, 1, 80, 160, 160], [32, 1, 80, 80, 80], [1, 1, 1], [1, 1, 1], [1, 2, 2], 1], {}, ["schedule_conv3d_nchw_cuda", [1, 1, 80, 160, 160], [32, 1, 80, 80, 80], [1, 1, 1], [1, 1, 1], [1, 2, 2], 1], {"i": 244212991, "t": "", "c": null, "e": [["tile_n", "sp", [-1, 1, 1, 1]], ["tile_f", "sp", [-1, 1, 8, 1]], ["tile_d", "sp", [-1, 1, 3, 1]], ["tile_y", "sp", [-1, 1, 1, 2]], ["tile_x", "sp", [-1, 1, 2, 1]], ["tile_rc", "sp", [-1, 1]], ["tile_rd", "sp", [-1, 4]], ["tile_ry", "sp", [-1, 1]], ["tile_rx", "sp", [-1, 80]], ["auto_unroll_max_step", "ot", 512], ["unroll_explicit", "ot", 1], ["fuse_yx", "ot", 1]]}], "r": [[0.02216490475], 0, 1.6533265113830566, 1578227654.0714087], "v": 0.1}
{"i": ["cuda", "schedule_conv3d_nchw_cuda", [[1, 1, 80, 160, 160], [32, 1, 80, 80, 80], [1, 1, 1], [1, 1, 1], [1, 2, 2], 1], {}, ["schedule_conv3d_nchw_cuda", [1, 1, 80, 160, 160], [32, 1, 80, 80, 80], [1, 1, 1], [1, 1, 1], [1, 2, 2], 1], {"i": 159336084, "t": "", "c": null, "e": [["tile_n", "sp", [-1, 1, 1, 1]], ["tile_f", "sp", [-1, 2, 4, 1]], ["tile_d", "sp", [-1, 1, 1, 3]], ["tile_y", "sp", [-1, 2, 1, 1]], ["tile_x", "sp", [-1, 4, 1, 1]], ["tile_rc", "sp", [-1, 1]], ["tile_rd", "sp", [-1, 5]], ["tile_ry", "sp", [-1, 2]], ["tile_rx", "sp", [-1, 2]], ["auto_unroll_max_step", "ot", 512], ["unroll_explicit", "ot", 0], ["fuse_yx", "ot", 1]]}], "r": [[0.133781855], 0, 3.0041685104370117, 1578227670.9937732], "v": 0.1}
{"i": ["cuda", "schedule_conv3d_nchw_cuda", [[1, 1, 80, 160, 160], [32, 1, 80, 80, 80], [1, 1, 1], [1, 1, 1], [1, 2, 2], 1], {}, ["schedule_conv3d_nchw_cuda", [1, 1, 80, 160, 160], [32, 1, 80, 80, 80], [1, 1, 1], [1, 1, 1], [1, 2, 2], 1], {"i": 179236683, "t": "", "c": null, "e": [["tile_n", "sp", [-1, 1, 1, 1]], ["tile_f", "sp", [-1, 8, 1, 1]], ["tile_d", "sp", [-1, 1, 1, 3]], ["tile_y", "sp", [-1, 1, 2, 1]], ["tile_x", "sp", [-1, 1, 1, 2]], ["tile_rc", "sp", [-1, 1]], ["tile_rd", "sp", [-1, 2]], ["tile_ry", "sp", [-1, 1]], ["tile_rx", "sp", [-1, 1]], ["auto_unroll_max_step", "ot", 1500], ["unroll_explicit", "ot", 0], ["fuse_yx", "ot", 1]]}], "r": [[0.09791604025], 0, 2.026332378387451, 1578227672.727109], "v": 0.1}
{"i": ["cuda", "schedule_conv3d_nchw_cuda", [[1, 1, 80, 160, 160], [32, 1, 80, 80, 80], [1, 1, 1], [1, 1, 1], [1, 2, 2], 1], {}, ["schedule_conv3d_nchw_cuda", [1, 1, 80, 160, 160], [32, 1, 80, 80, 80], [1, 1, 1], [1, 1, 1], [1, 2, 2], 1], {"i": 92271215, "t": "", "c": null, "e": [["tile_n", "sp", [-1, 1, 1, 1]], ["tile_f", "sp", [-1, 1, 8, 1]], ["tile_d", "sp", [-1, 1, 1, 1]], ["tile_y", "sp", [-1, 1, 4, 1]], ["tile_x", "sp", [-1, 4, 1, 1]], ["tile_rc", "sp", [-1, 1]], ["tile_rd", "sp", [-1, 80]], ["tile_ry", "sp", [-1, 2]], ["tile_rx", "sp", [-1, 2]], ["auto_unroll_max_step", "ot", 512], ["unroll_explicit", "ot", 1], ["fuse_yx", "ot", 0]]}], "r": [[0.0393492725], 0, 2.3511102199554443, 1578227679.1701417], "v": 0.1}
{"i": ["cuda", "schedule_conv3d_nchw_cuda", [[1, 1, 80, 160, 160], [32, 1, 80, 80, 80], [1, 1, 1], [1, 1, 1], [1, 2, 2], 1], {}, ["schedule_conv3d_nchw_cuda", [1, 1, 80, 160, 160], [32, 1, 80, 80, 80], [1, 1, 1], [1, 1, 1], [1, 2, 2], 1], {"i": 137338462, "t": "", "c": null, "e": [["tile_n", "sp", [-1, 1, 1, 1]], ["tile_f", "sp", [-1, 1, 4, 2]], ["tile_d", "sp", [-1, 1, 1, 1]], ["tile_y", "sp", [-1, 1, 2, 2]], ["tile_x", "sp", [-1, 2, 1, 1]], ["tile_rc", "sp", [-1, 1]], ["tile_rd", "sp", [-1, 2]], ["tile_ry", "sp", [-1, 5]], ["tile_rx", "sp", [-1, 2]], ["auto_unroll_max_step", "ot", 0], ["unroll_explicit", "ot", 0], ["fuse_yx", "ot", 1]]}], "r": [[0.1429764795], 0, 2.596365451812744, 1578227681.5788913], "v": 0.1}
{"i": ["cuda", "schedule_conv3d_nchw_cuda", [[1, 1, 80, 160, 160], [32, 1, 80, 80, 80], [1, 1, 1], [1, 1, 1], [1, 2, 2], 1], {}, ["schedule_conv3d_nchw_cuda", [1, 1, 80, 160, 160], [32, 1, 80, 80, 80], [1, 1, 1], [1, 1, 1], [1, 2, 2], 1], {"i": 232138175, "t": "", "c": null, "e": [["tile_n", "sp", [-1, 1, 1, 1]], ["tile_f", "sp", [-1, 2, 4, 2]], ["tile_d", "sp", [-1, 1, 1, 1]], ["tile_y", "sp", [-1, 2, 1, 1]], ["tile_x", "sp", [-1, 1, 2, 1]], ["tile_rc", "sp", [-1, 1]], ["tile_rd", "sp", [-1, 5]], ["tile_ry", "sp", [-1, 16]], ["tile_rx", "sp", [-1, 5]], ["auto_unroll_max_step", "ot", 512], ["unroll_explicit", "ot", 1], ["fuse_yx", "ot", 1]]}], "r": [[0.111843301], 0, 4.080563306808472, 1578227691.5110502], "v": 0.1}
{"i": ["cuda", "schedule_conv3d_nchw_cuda", [[1, 1, 80, 160, 160], [32, 1, 80, 80, 80], [1, 1, 1], [1, 1, 1], [1, 2, 2], 1], {}, ["schedule_conv3d_nchw_cuda", [1, 1, 80, 160, 160], [32, 1, 80, 80, 80], [1, 1, 1], [1, 1, 1], [1, 2, 2], 1], {"i": 224119994, "t": "", "c": null, "e": [["tile_n", "sp", [-1, 1, 1, 1]], ["tile_f", "sp", [-1, 4, 2, 4]], ["tile_d", "sp", [-1, 1, 3, 1]], ["tile_y", "sp", [-1, 1, 4, 1]], ["tile_x", "sp", [-1, 1, 2, 1]], ["tile_rc", "sp", [-1, 1]], ["tile_rd", "sp", [-1, 10]], ["tile_ry", "sp", [-1, 1]], ["tile_rx", "sp", [-1, 1]], ["auto_unroll_max_step", "ot", 512], ["unroll_explicit", "ot", 1], ["fuse_yx", "ot", 1]]}], "r": [[0.06032974125], 0, 1.7324271202087402, 1578227692.744597], "v": 0.1}
{"i": ["cuda", "schedule_conv3d_nchw_cuda", [[1, 1, 80, 160, 160], [32, 1, 80, 80, 80], [1, 1, 1], [1, 1, 1], [1, 2, 2], 1], {}, ["schedule_conv3d_nchw_cuda", [1, 1, 80, 160, 160], [32, 1, 80, 80, 80], [1, 1, 1], [1, 1, 1], [1, 2, 2], 1], {"i": 208547279, "t": "", "c": null, "e": [["tile_n", "sp", [-1, 1, 1, 1]], ["tile_f", "sp", [-1, 2, 4, 2]], ["tile_d", "sp", [-1, 1, 3, 1]], ["tile_y", "sp", [-1, 2, 2, 1]], ["tile_x", "sp", [-1, 2, 1, 1]], ["tile_rc", "sp", [-1, 1]], ["tile_rd", "sp", [-1, 1]], ["tile_ry", "sp", [-1, 2]], ["tile_rx", "sp", [-1, 5]], ["auto_unroll_max_step", "ot", 0], ["unroll_explicit", "ot", 1], ["fuse_yx", "ot", 1]]}], "r": [[0.03439396725], 0, 1.2426650524139404, 1578227693.6508353], "v": 0.1}
{"i": ["cuda", "schedule_conv3d_nchw_cuda", [[1, 1, 80, 160, 160], [32, 1, 80, 80, 80], [1, 1, 1], [1, 1, 1], [1, 2, 2], 1], {}, ["schedule_conv3d_nchw_cuda", [1, 1, 80, 160, 160], [32, 1, 80, 80, 80], [1, 1, 1], [1, 1, 1], [1, 2, 2], 1], {"i": 8514061, "t": "", "c": null, "e": [["tile_n", "sp", [-1, 1, 1, 1]], ["tile_f", "sp", [-1, 1, 8, 4]], ["tile_d", "sp", [-1, 1, 1, 1]], ["tile_y", "sp", [-1, 1, 1, 4]], ["tile_x", "sp", [-1, 1, 1, 1]], ["tile_rc", "sp", [-1, 1]], ["tile_rd", "sp", [-1, 1]], ["tile_ry", "sp", [-1, 40]], ["tile_rx", "sp", [-1, 5]], ["auto_unroll_max_step", "ot", 0], ["unroll_explicit", "ot", 0], ["fuse_yx", "ot", 0]]}], "r": [[0.22973128675], 0, 3.792941093444824, 1578227697.1285567], "v": 0.1}
{"i": ["cuda", "schedule_conv3d_nchw_cuda", [[1, 1, 80, 160, 160], [32, 1, 80, 80, 80], [1, 1, 1], [1, 1, 1], [1, 2, 2], 1], {}, ["schedule_conv3d_nchw_cuda", [1, 1, 80, 160, 160], [32, 1, 80, 80, 80], [1, 1, 1], [1, 1, 1], [1, 2, 2], 1], {"i": 211923188, "t": "", "c": null, "e": [["tile_n", "sp", [-1, 1, 1, 1]], ["tile_f", "sp", [-1, 1, 1, 4]], ["tile_d", "sp", [-1, 1, 3, 1]], ["tile_y", "sp", [-1, 1, 4, 1]], ["tile_x", "sp", [-1, 1, 2, 2]], ["tile_rc", "sp", [-1, 1]], ["tile_rd", "sp", [-1, 1]], ["tile_ry", "sp", [-1, 16]], ["tile_rx", "sp", [-1, 8]], ["auto_unroll_max_step", "ot", 0], ["unroll_explicit", "ot", 1], ["fuse_yx", "ot", 1]]}], "r": [[0.12179893725], 0, 2.420787811279297, 1578227704.6063628], "v": 0.1}
{"i": ["cuda", "schedule_conv3d_nchw_cuda", [[1, 1, 80, 160, 160], [32, 1, 80, 80, 80], [1, 1, 1], [1, 1, 1], [1, 2, 2], 1], {}, ["schedule_conv3d_nchw_cuda", [1, 1, 80, 160, 160], [32, 1, 80, 80, 80], [1, 1, 1], [1, 1, 1], [1, 2, 2], 1], {"i": 225452387, "t": "", "c": null, "e": [["tile_n", "sp", [-1, 1, 1, 1]], ["tile_f", "sp", [-1, 2, 2, 2]], ["tile_d", "sp", [-1, 1, 1, 3]], ["tile_y", "sp", [-1, 1, 2, 1]], ["tile_x", "sp", [-1, 1, 2, 2]], ["tile_rc", "sp", [-1, 1]], ["tile_rd", "sp", [-1, 8]], ["tile_ry", "sp", [-1, 16]], ["tile_rx", "sp", [-1, 1]], ["auto_unroll_max_step", "ot", 512], ["unroll_explicit", "ot", 1], ["fuse_yx", "ot", 1]]}], "r": [[0.0710525515], 0, 4.6663618087768555, 1578227717.734711], "v": 0.1}
{"i": ["cuda", "schedule_conv3d_nchw_cuda", [[1, 1, 80, 160, 160], [32, 1, 80, 80, 80], [1, 1, 1], [1, 1, 1], [1, 2, 2], 1], {}, ["schedule_conv3d_nchw_cuda", [1, 1, 80, 160, 160], [32, 1, 80, 80, 80], [1, 1, 1], [1, 1, 1], [1, 2, 2], 1], {"i": 224002958, "t": "", "c": null, "e": [["tile_n", "sp", [-1, 1, 1, 1]], ["tile_f", "sp", [-1, 1, 1, 8]], ["tile_d", "sp", [-1, 1, 1, 1]], ["tile_y", "sp", [-1, 1, 2, 1]], ["tile_x", "sp", [-1, 2, 1, 1]], ["tile_rc", "sp", [-1, 1]], ["tile_rd", "sp", [-1, 1]], ["tile_ry", "sp", [-1, 1]], ["tile_rx", "sp", [-1, 1]], ["auto_unroll_max_step", "ot", 512], ["unroll_explicit", "ot", 1], ["fuse_yx", "ot", 1]]}], "r": [[0.209612441], 0, 3.459824562072754, 1578227720.8810456], "v": 0.1}
{"i": ["cuda", "schedule_conv3d_nchw_cuda", [[1, 1, 80, 160, 160], [32, 1, 80, 80, 80], [1, 1, 1], [1, 1, 1], [1, 2, 2], 1], {}, ["schedule_conv3d_nchw_cuda", [1, 1, 80, 160, 160], [32, 1, 80, 80, 80], [1, 1, 1], [1, 1, 1], [1, 2, 2], 1], {"i": 123483155, "t": "", "c": null, "e": [["tile_n", "sp", [-1, 1, 1, 1]], ["tile_f", "sp", [-1, 2, 16, 1]], ["tile_d", "sp", [-1, 1, 1, 1]], ["tile_y", "sp", [-1, 2, 2, 1]], ["tile_x", "sp", [-1, 1, 1, 2]], ["tile_rc", "sp", [-1, 1]], ["tile_rd", "sp", [-1, 4]], ["tile_ry", "sp", [-1, 2]], ["tile_rx", "sp", [-1, 10]], ["auto_unroll_max_step", "ot", 1500], ["unroll_explicit", "ot", 1], ["fuse_yx", "ot", 0]]}], "r": [[0.02673893475], 0, 2.1282877922058105, 1578227721.9014463], "v": 0.1}
{"i": ["cuda", "schedule_conv3d_nchw_cuda", [[1, 1, 80, 160, 160], [32, 1, 80, 80, 80], [1, 1, 1], [1, 1, 1], [1, 2, 2], 1], {}, ["schedule_conv3d_nchw_cuda", [1, 1, 80, 160, 160], [32, 1, 80, 80, 80], [1, 1, 1], [1, 1, 1], [1, 2, 2], 1], {"i": 79149014, "t": "", "c": null, "e": [["tile_n", "sp", [-1, 1, 1, 1]], ["tile_f", "sp", [-1, 8, 4, 1]], ["tile_d", "sp", [-1, 1, 1, 3]], ["tile_y", "sp", [-1, 1, 2, 1]], ["tile_x", "sp", [-1, 2, 2, 1]], ["tile_rc", "sp", [-1, 1]], ["tile_rd", "sp", [-1, 5]], ["tile_ry", "sp", [-1, 5]], ["tile_rx", "sp", [-1, 10]], ["auto_unroll_max_step", "ot", 0], ["unroll_explicit", "ot", 1], ["fuse_yx", "ot", 0]]}], "r": [[0.26955991225], 0, 4.593013763427734, 1578227739.417539], "v": 0.1}
{"i": ["cuda", "schedule_conv3d_nchw_cuda", [[1, 1, 80, 160, 160], [32, 1, 80, 80, 80], [1, 1, 1], [1, 1, 1], [1, 2, 2], 1], {}, ["schedule_conv3d_nchw_cuda", [1, 1, 80, 160, 160], [32, 1, 80, 80, 80], [1, 1, 1], [1, 1, 1], [1, 2, 2], 1], {"i": 201922912, "t": "", "c": null, "e": [["tile_n", "sp", [-1, 1, 1, 1]], ["tile_f", "sp", [-1, 2, 8, 1]], ["tile_d", "sp", [-1, 1, 3, 1]], ["tile_y", "sp", [-1, 2, 1, 1]], ["tile_x", "sp", [-1, 2, 2, 1]], ["tile_rc", "sp", [-1, 1]], ["tile_rd", "sp", [-1, 8]], ["tile_ry", "sp", [-1, 2]], ["tile_rx", "sp", [-1, 1]], ["auto_unroll_max_step", "ot", 0], ["unroll_explicit", "ot", 1], ["fuse_yx", "ot", 1]]}], "r": [[0.05482059], 0, 1.8571672439575195, 1578228027.5564923], "v": 0.1}
{"i": ["cuda", "schedule_conv3d_nchw_cuda", [[1, 1, 80, 160, 160], [32, 1, 80, 80, 80], [1, 1, 1], [1, 1, 1], [1, 2, 2], 1], {}, ["schedule_conv3d_nchw_cuda", [1, 1, 80, 160, 160], [32, 1, 80, 80, 80], [1, 1, 1], [1, 1, 1], [1, 2, 2], 1], {"i": 201878112, "t": "", "c": null, "e": [["tile_n", "sp", [-1, 1, 1, 1]], ["tile_f", "sp", [-1, 2, 8, 1]], ["tile_d", "sp", [-1, 1, 3, 1]], ["tile_y", "sp", [-1, 2, 1, 1]], ["tile_x", "sp", [-1, 2, 2, 1]], ["tile_rc", "sp", [-1, 1]], ["tile_rd", "sp", [-1, 4]], ["tile_ry", "sp", [-1, 2]], ["tile_rx", "sp", [-1, 1]], ["auto_unroll_max_step", "ot", 0], ["unroll_explicit", "ot", 1], ["fuse_yx", "ot", 1]]}], "r": [[0.0645721205], 0, 1.9555799961090088, 1578228029.023514], "v": 0.1}
{"i": ["cuda", "schedule_conv3d_nchw_cuda", [[1, 1, 80, 160, 160], [32, 1, 80, 80, 80], [1, 1, 1], [1, 1, 1], [1, 2, 2], 1], {}, ["schedule_conv3d_nchw_cuda", [1, 1, 80, 160, 160], [32, 1, 80, 80, 80], [1, 1, 1], [1, 1, 1], [1, 2, 2], 1], {"i": 201896031, "t": "", "c": null, "e": [["tile_n", "sp", [-1, 1, 1, 1]], ["tile_f", "sp", [-1, 1, 8, 1]], ["tile_d", "sp", [-1, 1, 3, 1]], ["tile_y", "sp", [-1, 2, 1, 1]], ["tile_x", "sp", [-1, 4, 1, 1]], ["tile_rc", "sp", [-1, 1]], ["tile_rd", "sp", [-1, 5]], ["tile_ry", "sp", [-1, 2]], ["tile_rx", "sp", [-1, 1]], ["auto_unroll_max_step", "ot", 0], ["unroll_explicit", "ot", 1], ["fuse_yx", "ot", 1]]}], "r": [[0.0584239935], 0, 1.7195653915405273, 1578228030.2773018], "v": 0.1}
{"i": ["cuda", "schedule_conv3d_nchw_cuda", [[1, 1, 80, 160, 160], [32, 1, 80, 80, 80], [1, 1, 1], [1, 1, 1], [1, 2, 2], 1], {}, ["schedule_conv3d_nchw_cuda", [1, 1, 80, 160, 160], [32, 1, 80, 80, 80], [1, 1, 1], [1, 1, 1], [1, 2, 2], 1], {"i": 224278112, "t": "", "c": null, "e": [["tile_n", "sp", [-1, 1, 1, 1]], ["tile_f", "sp", [-1, 2, 8, 1]], ["tile_d", "sp", [-1, 1, 3, 1]], ["tile_y", "sp", [-1, 2, 1, 1]], ["tile_x", "sp", [-1, 2, 2, 1]], ["tile_rc", "sp", [-1, 1]], ["tile_rd", "sp", [-1, 4]], ["tile_ry", "sp", [-1, 2]], ["tile_rx", "sp", [-1, 1]], ["auto_unroll_max_step", "ot", 512], ["unroll_explicit", "ot", 1], ["fuse_yx", "ot", 1]]}], "r": [[0.04510023925], 0, 1.728135108947754, 1578228031.4676144], "v": 0.1}
{"i": ["cuda", "schedule_conv3d_nchw_cuda", [[1, 1, 80, 160, 160], [32, 1, 80, 80, 80], [1, 1, 1], [1, 1, 1], [1, 2, 2], 1], {}, ["schedule_conv3d_nchw_cuda", [1, 1, 80, 160, 160], [32, 1, 80, 80, 80], [1, 1, 1], [1, 1, 1], [1, 2, 2], 1], {"i": 246722912, "t": "", "c": null, "e": [["tile_n", "sp", [-1, 1, 1, 1]], ["tile_f", "sp", [-1, 2, 8, 1]], ["tile_d", "sp", [-1, 1, 3, 1]], ["tile_y", "sp", [-1, 2, 1, 1]], ["tile_x", "sp", [-1, 2, 2, 1]], ["tile_rc", "sp", [-1, 1]], ["tile_rd", "sp", [-1, 8]], ["tile_ry", "sp", [-1, 2]], ["tile_rx", "sp", [-1, 1]], ["auto_unroll_max_step", "ot", 1500], ["unroll_explicit", "ot", 1], ["fuse_yx", "ot", 1]]}], "r": [[0.033755291], 0, 1.5343992710113525, 1578228032.4108362], "v": 0.1}
{"i": ["cuda", "schedule_conv3d_nchw_cuda", [[1, 1, 80, 160, 160], [32, 1, 80, 80, 80], [1, 1, 1], [1, 1, 1], [1, 2, 2], 1], {}, ["schedule_conv3d_nchw_cuda", [1, 1, 80, 160, 160], [32, 1, 80, 80, 80], [1, 1, 1], [1, 1, 1], [1, 2, 2], 1], {"i": 246696031, "t": "", "c": null, "e": [["tile_n", "sp", [-1, 1, 1, 1]], ["tile_f", "sp", [-1, 1, 8, 1]], ["tile_d", "sp", [-1, 1, 3, 1]], ["tile_y", "sp", [-1, 2, 1, 1]], ["tile_x", "sp", [-1, 4, 1, 1]], ["tile_rc", "sp", [-1, 1]], ["tile_rd", "sp", [-1, 5]], ["tile_ry", "sp", [-1, 2]], ["tile_rx", "sp", [-1, 1]], ["auto_unroll_max_step", "ot", 1500], ["unroll_explicit", "ot", 1], ["fuse_yx", "ot", 1]]}], "r": [[0.058678745], 0, 1.899548053741455, 1578228033.6687636], "v": 0.1}
{"i": ["cuda", "schedule_conv3d_nchw_cuda", [[1, 1, 80, 160, 160], [32, 1, 80, 80, 80], [1, 1, 1], [1, 1, 1], [1, 2, 2], 1], {}, ["schedule_conv3d_nchw_cuda", [1, 1, 80, 160, 160], [32, 1, 80, 80, 80], [1, 1, 1], [1, 1, 1], [1, 2, 2], 1], {"i": 224296031, "t": "", "c": null, "e": [["tile_n", "sp", [-1, 1, 1, 1]], ["tile_f", "sp", [-1, 1, 8, 1]], ["tile_d", "sp", [-1, 1, 3, 1]], ["tile_y", "sp", [-1, 2, 1, 1]], ["tile_x", "sp", [-1, 4, 1, 1]], ["tile_rc", "sp", [-1, 1]], ["tile_rd", "sp", [-1, 5]], ["tile_ry", "sp", [-1, 2]], ["tile_rx", "sp", [-1, 1]], ["auto_unroll_max_step", "ot", 512], ["unroll_explicit", "ot", 1], ["fuse_yx", "ot", 1]]}], "r": [[0.05866574225], 0, 1.776714563369751, 1578228034.87524], "v": 0.1}
{"i": ["cuda", "schedule_conv3d_nchw_cuda", [[1, 1, 80, 160, 160], [32, 1, 80, 80, 80], [1, 1, 1], [1, 1, 1], [1, 2, 2], 1], {}, ["schedule_conv3d_nchw_cuda", [1, 1, 80, 160, 160], [32, 1, 80, 80, 80], [1, 1, 1], [1, 1, 1], [1, 2, 2], 1], {"i": 224322912, "t": "", "c": null, "e": [["tile_n", "sp", [-1, 1, 1, 1]], ["tile_f", "sp", [-1, 2, 8, 1]], ["tile_d", "sp", [-1, 1, 3, 1]], ["tile_y", "sp", [-1, 2, 1, 1]], ["tile_x", "sp", [-1, 2, 2, 1]], ["tile_rc", "sp", [-1, 1]], ["tile_rd", "sp", [-1, 8]], ["tile_ry", "sp", [-1, 2]], ["tile_rx", "sp", [-1, 1]], ["auto_unroll_max_step", "ot", 512], ["unroll_explicit", "ot", 1], ["fuse_yx", "ot", 1]]}], "r": [[0.0336860735], 0, 1.4696669578552246, 1578228035.7573245], "v": 0.1}
{"i": ["cuda", "schedule_conv3d_nchw_cuda", [[1, 1, 80, 160, 160], [32, 1, 80, 80, 80], [1, 1, 1], [1, 1, 1], [1, 2, 2], 1], {}, ["schedule_conv3d_nchw_cuda", [1, 1, 80, 160, 160], [32, 1, 80, 80, 80], [1, 1, 1], [1, 1, 1], [1, 2, 2], 1], {"i": 246678112, "t": "", "c": null, "e": [["tile_n", "sp", [-1, 1, 1, 1]], ["tile_f", "sp", [-1, 2, 8, 1]], ["tile_d", "sp", [-1, 1, 3, 1]], ["tile_y", "sp", [-1, 2, 1, 1]], ["tile_x", "sp", [-1, 2, 2, 1]], ["tile_rc", "sp", [-1, 1]], ["tile_rd", "sp", [-1, 4]], ["tile_ry", "sp", [-1, 2]], ["tile_rx", "sp", [-1, 1]], ["auto_unroll_max_step", "ot", 1500], ["unroll_explicit", "ot", 1], ["fuse_yx", "ot", 1]]}], "r": [[0.045139694], 0, 1.544919729232788, 1578228036.796709], "v": 0.1}
{"i": ["cuda", "schedule_conv3d_nchw_cuda", [[1, 1, 80, 160, 160], [32, 1, 80, 80, 80], [1, 1, 1], [1, 1, 1], [1, 2, 2], 1], {}, ["schedule_conv3d_nchw_cuda", [1, 1, 80, 160, 160], [32, 1, 80, 80, 80], [1, 1, 1], [1, 1, 1], [1, 2, 2], 1], {"i": 201916418, "t": "", "c": null, "e": [["tile_n", "sp", [-1, 1, 1, 1]], ["tile_f", "sp", [-1, 1, 16, 1]], ["tile_d", "sp", [-1, 1, 3, 1]], ["tile_y", "sp", [-1, 4, 1, 1]], ["tile_x", "sp", [-1, 2, 1, 1]], ["tile_rc", "sp", [-1, 1]], ["tile_rd", "sp", [-1, 8]], ["tile_ry", "sp", [-1, 2]], ["tile_rx", "sp", [-1, 1]], ["auto_unroll_max_step", "ot", 0], ["unroll_explicit", "ot", 1], ["fuse_yx", "ot", 1]]}], "r": [[0.07515109275], 0, 1.991255283355713, 1578228038.261125], "v": 0.1}
{"i": ["cuda", "schedule_conv3d_nchw_cuda", [[1, 1, 80, 160, 160], [32, 1, 80, 80, 80], [1, 1, 1], [1, 1, 1], [1, 2, 2], 1], {}, ["schedule_conv3d_nchw_cuda", [1, 1, 80, 160, 160], [32, 1, 80, 80, 80], [1, 1, 1], [1, 1, 1], [1, 2, 2], 1], {"i": 246723474, "t": "", "c": null, "e": [["tile_n", "sp", [-1, 1, 1, 1]], ["tile_f", "sp", [-1, 1, 16, 1]], ["tile_d", "sp", [-1, 1, 1, 1]], ["tile_y", "sp", [-1, 2, 2, 1]], ["tile_x", "sp", [-1, 2, 2, 1]], ["tile_rc", "sp", [-1, 1]], ["tile_rd", "sp", [-1, 8]], ["tile_ry", "sp", [-1, 2]], ["tile_rx", "sp", [-1, 1]], ["auto_unroll_max_step", "ot", 1500], ["unroll_explicit", "ot", 1], ["fuse_yx", "ot", 1]]}], "r": [[0.03246517525], 0, 1.4217743873596191, 1578228039.184697], "v": 0.1}
{"i": ["cuda", "schedule_conv3d_nchw_cuda", [[1, 1, 80, 160, 160], [32, 1, 80, 80, 80], [1, 1, 1], [1, 1, 1], [1, 2, 2], 1], {}, ["schedule_conv3d_nchw_cuda", [1, 1, 80, 160, 160], [32, 1, 80, 80, 80], [1, 1, 1], [1, 1, 1], [1, 2, 2], 1], {"i": 224320898, "t": "", "c": null, "e": [["tile_n", "sp", [-1, 1, 1, 1]], ["tile_f", "sp", [-1, 1, 16, 1]], ["tile_d", "sp", [-1, 1, 3, 1]], ["tile_y", "sp", [-1, 4, 1, 1]], ["tile_x", "sp", [-1, 1, 2, 1]], ["tile_rc", "sp", [-1, 1]], ["tile_rd", "sp", [-1, 8]], ["tile_ry", "sp", [-1, 2]], ["tile_rx", "sp", [-1, 1]], ["auto_unroll_max_step", "ot", 512], ["unroll_explicit", "ot", 1], ["fuse_yx", "ot", 1]]}], "r": [[0.0320492275], 0, 1.6060140132904053, 1578228040.266335], "v": 0.1}
{"i": ["cuda", "schedule_conv3d_nchw_cuda", [[1, 1, 80, 160, 160], [32, 1, 80, 80, 80], [1, 1, 1], [1, 1, 1], [1, 2, 2], 1], {}, ["schedule_conv3d_nchw_cuda", [1, 1, 80, 160, 160], [32, 1, 80, 80, 80], [1, 1, 1], [1, 1, 1], [1, 2, 2], 1], {"i": 201923474, "t": "", "c": null, "e": [["tile_n", "sp", [-1, 1, 1, 1]], ["tile_f", "sp", [-1, 1, 16, 1]], ["tile_d", "sp", [-1, 1, 1, 1]], ["tile_y", "sp", [-1, 2, 2, 1]], ["tile_x", "sp", [-1, 2, 2, 1]], ["tile_rc", "sp", [-1, 1]], ["tile_rd", "sp", [-1, 8]], ["tile_ry", "sp", [-1, 2]], ["tile_rx", "sp", [-1, 1]], ["auto_unroll_max_step", "ot", 0], ["unroll_explicit", "ot", 1], ["fuse_yx", "ot", 1]]}], "r": [[0.02923734475], 0, 1.6831505298614502, 1578228042.8730683], "v": 0.1}
{"i": ["cuda", "schedule_conv3d_nchw_cuda", [[1, 1, 80, 160, 160], [32, 1, 80, 80, 80], [1, 1, 1], [1, 1, 1], [1, 2, 2], 1], {}, ["schedule_conv3d_nchw_cuda", [1, 1, 80, 160, 160], [32, 1, 80, 80, 80], [1, 1, 1], [1, 1, 1], [1, 2, 2], 1], {"i": 224323474, "t": "", "c": null, "e": [["tile_n", "sp", [-1, 1, 1, 1]], ["tile_f", "sp", [-1, 1, 16, 1]], ["tile_d", "sp", [-1, 1, 1, 1]], ["tile_y", "sp", [-1, 2, 2, 1]], ["tile_x", "sp", [-1, 2, 2, 1]], ["tile_rc", "sp", [-1, 1]], ["tile_rd", "sp", [-1, 8]], ["tile_ry", "sp", [-1, 2]], ["tile_rx", "sp", [-1, 1]], ["auto_unroll_max_step", "ot", 512], ["unroll_explicit", "ot", 1], ["fuse_yx", "ot", 1]]}], "r": [[0.0324693315], 0, 1.3663995265960693, 1578228043.7338014], "v": 0.1}
{"i": ["cuda", "schedule_conv3d_nchw_cuda", [[1, 1, 80, 160, 160], [32, 1, 80, 80, 80], [1, 1, 1], [1, 1, 1], [1, 2, 2], 1], {}, ["schedule_conv3d_nchw_cuda", [1, 1, 80, 160, 160], [32, 1, 80, 80, 80], [1, 1, 1], [1, 1, 1], [1, 2, 2], 1], {"i": 248699264, "t": "", "c": null, "e": [["tile_n", "sp", [-1, 1, 1, 1]], ["tile_f", "sp", [-1, 2, 8, 1]], ["tile_d", "sp", [-1, 1, 3, 1]], ["tile_y", "sp", [-1, 2, 2, 1]], ["tile_x", "sp", [-1, 1, 1, 2]], ["tile_rc", "sp", [-1, 1]], ["tile_rd", "sp", [-1, 4]], ["tile_ry", "sp", [-1, 1]], ["tile_rx", "sp", [-1, 2]], ["auto_unroll_max_step", "ot", 1500], ["unroll_explicit", "ot", 1], ["fuse_yx", "ot", 1]]}], "r": [[0.042733013], 0, 1.522533893585205, 1578228044.7461207], "v": 0.1}
{"i": ["cuda", "schedule_conv3d_nchw_cuda", [[1, 1, 80, 160, 160], [32, 1, 80, 80, 80], [1, 1, 1], [1, 1, 1], [1, 2, 2], 1], {}, ["schedule_conv3d_nchw_cuda", [1, 1, 80, 160, 160], [32, 1, 80, 80, 80], [1, 1, 1], [1, 1, 1], [1, 2, 2], 1], {"i": 201920898, "t": "", "c": null, "e": [["tile_n", "sp", [-1, 1, 1, 1]], ["tile_f", "sp", [-1, 1, 16, 1]], ["tile_d", "sp", [-1, 1, 3, 1]], ["tile_y", "sp", [-1, 4, 1, 1]], ["tile_x", "sp", [-1, 1, 2, 1]], ["tile_rc", "sp", [-1, 1]], ["tile_rd", "sp", [-1, 8]], ["tile_ry", "sp", [-1, 2]], ["tile_rx", "sp", [-1, 1]], ["auto_unroll_max_step", "ot", 0], ["unroll_explicit", "ot", 1], ["fuse_yx", "ot", 1]]}], "r": [[0.03608978], 0, 1.6314201354980469, 1578228045.9021106], "v": 0.1}
{"i": ["cuda", "schedule_conv3d_nchw_cuda", [[1, 1, 80, 160, 160], [32, 1, 80, 80, 80], [1, 1, 1], [1, 1, 1], [1, 2, 2], 1], {}, ["schedule_conv3d_nchw_cuda", [1, 1, 80, 160, 160], [32, 1, 80, 80, 80], [1, 1, 1], [1, 1, 1], [1, 2, 2], 1], {"i": 224316863, "t": "", "c": null, "e": [["tile_n", "sp", [-1, 1, 1, 1]], ["tile_f", "sp", [-1, 1, 8, 1]], ["tile_d", "sp", [-1, 1, 3, 1]], ["tile_y", "sp", [-1, 2, 2, 1]], ["tile_x", "sp", [-1, 2, 1, 1]], ["tile_rc", "sp", [-1, 1]], ["tile_rd", "sp", [-1, 8]], ["tile_ry", "sp", [-1, 2]], ["tile_rx", "sp", [-1, 1]], ["auto_unroll_max_step", "ot", 512], ["unroll_explicit", "ot", 1], ["fuse_yx", "ot", 1]]}], "r": [[0.03774089], 0, 1.5714032649993896, 1578228046.8723214], "v": 0.1}
{"i": ["cuda", "schedule_conv3d_nchw_cuda", [[1, 1, 80, 160, 160], [32, 1, 80, 80, 80], [1, 1, 1], [1, 1, 1], [1, 2, 2], 1], {}, ["schedule_conv3d_nchw_cuda", [1, 1, 80, 160, 160], [32, 1, 80, 80, 80], [1, 1, 1], [1, 1, 1], [1, 2, 2], 1], {"i": 250910816, "t": "", "c": null, "e": [["tile_n", "sp", [-1, 1, 1, 1]], ["tile_f", "sp", [-1, 2, 8, 1]], ["tile_d", "sp", [-1, 1, 3, 1]], ["tile_y", "sp", [-1, 2, 1, 2]], ["tile_x", "sp", [-1, 1, 2, 1]], ["tile_rc", "sp", [-1, 1]], ["tile_rd", "sp", [-1, 2]], ["tile_ry", "sp", [-1, 1]], ["tile_rx", "sp", [-1, 4]], ["auto_unroll_max_step", "ot", 1500], ["unroll_explicit", "ot", 1], ["fuse_yx", "ot", 1]]}], "r": [[0.04797809725], 0, 1.6268978118896484, 1578228047.9644556], "v": 0.1}
{"i": ["cuda", "schedule_conv3d_nchw_cuda", [[1, 1, 80, 160, 160], [32, 1, 80, 80, 80], [1, 1, 1], [1, 1, 1], [1, 2, 2], 1], {}, ["schedule_conv3d_nchw_cuda", [1, 1, 80, 160, 160], [32, 1, 80, 80, 80], [1, 1, 1], [1, 1, 1], [1, 2, 2], 1], {"i": 201916864, "t": "", "c": null, "e": [["tile_n", "sp", [-1, 1, 1, 1]], ["tile_f", "sp", [-1, 2, 8, 1]], ["tile_d", "sp", [-1, 1, 3, 1]], ["tile_y", "sp", [-1, 2, 2, 1]], ["tile_x", "sp", [-1, 2, 1, 1]], ["tile_rc", "sp", [-1, 1]], ["tile_rd", "sp", [-1, 8]], ["tile_ry", "sp", [-1, 2]], ["tile_rx", "sp", [-1, 1]], ["auto_unroll_max_step", "ot", 0], ["unroll_explicit", "ot", 1], ["fuse_yx", "ot", 1]]}], "r": [[0.05690223], 0, 1.8235743045806885, 1578228049.1996248], "v": 0.1}
{"i": ["cuda", "schedule_conv3d_nchw_cuda", [[1, 1, 80, 160, 160], [32, 1, 80, 80, 80], [1, 1, 1], [1, 1, 1], [1, 2, 2], 1], {}, ["schedule_conv3d_nchw_cuda", [1, 1, 80, 160, 160], [32, 1, 80, 80, 80], [1, 1, 1], [1, 1, 1], [1, 2, 2], 1], {"i": 246716863, "t": "", "c": null, "e": [["tile_n", "sp", [-1, 1, 1, 1]], ["tile_f", "sp", [-1, 1, 8, 1]], ["tile_d", "sp", [-1, 1, 3, 1]], ["tile_y", "sp", [-1, 2, 2, 1]], ["tile_x", "sp", [-1, 2, 1, 1]], ["tile_rc", "sp", [-1, 1]], ["tile_rd", "sp", [-1, 8]], ["tile_ry", "sp", [-1, 2]], ["tile_rx", "sp", [-1, 1]], ["auto_unroll_max_step", "ot", 1500], ["unroll_explicit", "ot", 1], ["fuse_yx", "ot", 1]]}], "r": [[0.03778440875], 0, 1.454317331314087, 1578228050.135096], "v": 0.1}
{"i": ["cuda", "schedule_conv3d_nchw_cuda", [[1, 1, 80, 160, 160], [32, 1, 80, 80, 80], [1, 1, 1], [1, 1, 1], [1, 2, 2], 1], {}, ["schedule_conv3d_nchw_cuda", [1, 1, 80, 160, 160], [32, 1, 80, 80, 80], [1, 1, 1], [1, 1, 1], [1, 2, 2], 1], {"i": 246716864, "t": "", "c": null, "e": [["tile_n", "sp", [-1, 1, 1, 1]], ["tile_f", "sp", [-1, 2, 8, 1]], ["tile_d", "sp", [-1, 1, 3, 1]], ["tile_y", "sp", [-1, 2, 2, 1]], ["tile_x", "sp", [-1, 2, 1, 1]], ["tile_rc", "sp", [-1, 1]], ["tile_rd", "sp", [-1, 8]], ["tile_ry", "sp", [-1, 2]], ["tile_rx", "sp", [-1, 1]], ["auto_unroll_max_step", "ot", 1500], ["unroll_explicit", "ot", 1], ["fuse_yx", "ot", 1]]}], "r": [[0.0431201195], 0, 1.6366007328033447, 1578228051.189443], "v": 0.1}
{"i": ["cuda", "schedule_conv3d_nchw_cuda", [[1, 1, 80, 160, 160], [32, 1, 80, 80, 80], [1, 1, 1], [1, 1, 1], [1, 2, 2], 1], {}, ["schedule_conv3d_nchw_cuda", [1, 1, 80, 160, 160], [32, 1, 80, 80, 80], [1, 1, 1], [1, 1, 1], [1, 2, 2], 1], {"i": 246716418, "t": "", "c": null, "e": [["tile_n", "sp", [-1, 1, 1, 1]], ["tile_f", "sp", [-1, 1, 16, 1]], ["tile_d", "sp", [-1, 1, 3, 1]], ["tile_y", "sp", [-1, 4, 1, 1]], ["tile_x", "sp", [-1, 2, 1, 1]], ["tile_rc", "sp", [-1, 1]], ["tile_rd", "sp", [-1, 8]], ["tile_ry", "sp", [-1, 2]], ["tile_rx", "sp", [-1, 1]], ["auto_unroll_max_step", "ot", 1500], ["unroll_explicit", "ot", 1], ["fuse_yx", "ot", 1]]}], "r": [[0.05727895175], 0, 1.8582587242126465, 1578228052.4213767], "v": 0.1}
{"i": ["cuda", "schedule_conv3d_nchw_cuda", [[1, 1, 80, 160, 160], [32, 1, 80, 80, 80], [1, 1, 1], [1, 1, 1], [1, 2, 2], 1], {}, ["schedule_conv3d_nchw_cuda", [1, 1, 80, 160, 160], [32, 1, 80, 80, 80], [1, 1, 1], [1, 1, 1], [1, 2, 2], 1], {"i": 201925152, "t": "", "c": null, "e": [["tile_n", "sp", [-1, 1, 1, 1]], ["tile_f", "sp", [-1, 2, 8, 1]], ["tile_d", "sp", [-1, 1, 3, 1]], ["tile_y", "sp", [-1, 2, 1, 1]], ["tile_x", "sp", [-1, 1, 4, 1]], ["tile_rc", "sp", [-1, 1]], ["tile_rd", "sp", [-1, 8]], ["tile_ry", "sp", [-1, 2]], ["tile_rx", "sp", [-1, 1]], ["auto_unroll_max_step", "ot", 0], ["unroll_explicit", "ot", 1], ["fuse_yx", "ot", 1]]}], "r": [[0.03246141775], 0, 1.5940539836883545, 1578228053.507202], "v": 0.1}
{"i": ["cuda", "schedule_conv3d_nchw_cuda", [[1, 1, 80, 160, 160], [32, 1, 80, 80, 80], [1, 1, 1], [1, 1, 1], [1, 2, 2], 1], {}, ["schedule_conv3d_nchw_cuda", [1, 1, 80, 160, 160], [32, 1, 80, 80, 80], [1, 1, 1], [1, 1, 1], [1, 2, 2], 1], {"i": 224316864, "t": "", "c": null, "e": [["tile_n", "sp", [-1, 1, 1, 1]], ["tile_f", "sp", [-1, 2, 8, 1]], ["tile_d", "sp", [-1, 1, 3, 1]], ["tile_y", "sp", [-1, 2, 2, 1]], ["tile_x", "sp", [-1, 2, 1, 1]], ["tile_rc", "sp", [-1, 1]], ["tile_rd", "sp", [-1, 8]], ["tile_ry", "sp", [-1, 2]], ["tile_rx", "sp", [-1, 1]], ["auto_unroll_max_step", "ot", 512], ["unroll_explicit", "ot", 1], ["fuse_yx", "ot", 1]]}], "r": [[0.0443577615], 0, 1.6319327354431152, 1578228054.50827], "v": 0.1}
{"i": ["cuda", "schedule_conv3d_nchw_cuda", [[1, 1, 80, 160, 160], [32, 1, 80, 80, 80], [1, 1, 1], [1, 1, 1], [1, 2, 2], 1], {}, ["schedule_conv3d_nchw_cuda", [1, 1, 80, 160, 160], [32, 1, 80, 80, 80], [1, 1, 1], [1, 1, 1], [1, 2, 2], 1], {"i": 201698912, "t": "", "c": null, "e": [["tile_n", "sp", [-1, 1, 1, 1]], ["tile_f", "sp", [-1, 2, 8, 1]], ["tile_d", "sp", [-1, 1, 3, 1]], ["tile_y", "sp", [-1, 2, 1, 1]], ["tile_x", "sp", [-1, 2, 2, 1]], ["tile_rc", "sp", [-1, 1]], ["tile_rd", "sp", [-1, 8]], ["tile_ry", "sp", [-1, 1]], ["tile_rx", "sp", [-1, 1]], ["auto_unroll_max_step", "ot", 0], ["unroll_explicit", "ot", 1], ["fuse_yx", "ot", 1]]}], "r": [[0.05017493825], 0, 1.55361008644104, 1578228057.1087604], "v": 0.1}
{"i": ["cuda", "schedule_conv3d_nchw_cuda", [[1, 1, 80, 160, 160], [32, 1, 80, 80, 80], [1, 1, 1], [1, 1, 1], [1, 2, 2], 1], {}, ["schedule_conv3d_nchw_cuda", [1, 1, 80, 160, 160], [32, 1, 80, 80, 80], [1, 1, 1], [1, 1, 1], [1, 2, 2], 1], {"i": 228510816, "t": "", "c": null, "e": [["tile_n", "sp", [-1, 1, 1, 1]], ["tile_f", "sp", [-1, 2, 8, 1]], ["tile_d", "sp", [-1, 1, 3, 1]], ["tile_y", "sp", [-1, 2, 1, 2]], ["tile_x", "sp", [-1, 1, 2, 1]], ["tile_rc", "sp", [-1, 1]], ["tile_rd", "sp", [-1, 2]], ["tile_ry", "sp", [-1, 1]], ["tile_rx", "sp", [-1, 4]], ["auto_unroll_max_step", "ot", 512], ["unroll_explicit", "ot", 1], ["fuse_yx", "ot", 1]]}], "r": [[0.04625609975], 0, 1.5023093223571777, 1578228058.1365483], "v": 0.1}
{"i": ["cuda", "schedule_conv3d_nchw_cuda", [[1, 1, 80, 160, 160], [32, 1, 80, 80, 80], [1, 1, 1], [1, 1, 1], [1, 2, 2], 1], {}, ["schedule_conv3d_nchw_cuda", [1, 1, 80, 160, 160], [32, 1, 80, 80, 80], [1, 1, 1], [1, 1, 1], [1, 2, 2], 1], {"i": 201878113, "t": "", "c": null, "e": [["tile_n", "sp", [-1, 1, 1, 1]], ["tile_f", "sp", [-1, 4, 8, 1]], ["tile_d", "sp", [-1, 1, 3, 1]], ["tile_y", "sp", [-1, 2, 1, 1]], ["tile_x", "sp", [-1, 2, 2, 1]], ["tile_rc", "sp", [-1, 1]], ["tile_rd", "sp", [-1, 4]], ["tile_ry", "sp", [-1, 2]], ["tile_rx", "sp", [-1, 1]], ["auto_unroll_max_step", "ot", 0], ["unroll_explicit", "ot", 1], ["fuse_yx", "ot", 1]]}], "r": [[0.06229662875], 0, 1.7682921886444092, 1578228059.4165678], "v": 0.1}
{"i": ["cuda", "schedule_conv3d_nchw_cuda", [[1, 1, 80, 160, 160], [32, 1, 80, 80, 80], [1, 1, 1], [1, 1, 1], [1, 2, 2], 1], {}, ["schedule_conv3d_nchw_cuda", [1, 1, 80, 160, 160], [32, 1, 80, 80, 80], [1, 1, 1], [1, 1, 1], [1, 2, 2], 1], {"i": 224278113, "t": "", "c": null, "e": [["tile_n", "sp", [-1, 1, 1, 1]], ["tile_f", "sp", [-1, 4, 8, 1]], ["tile_d", "sp", [-1, 1, 3, 1]], ["tile_y", "sp", [-1, 2, 1, 1]], ["tile_x", "sp", [-1, 2, 2, 1]], ["tile_rc", "sp", [-1, 1]], ["tile_rd", "sp", [-1, 4]], ["tile_ry", "sp", [-1, 2]], ["tile_rx", "sp", [-1, 1]], ["auto_unroll_max_step", "ot", 512], ["unroll_explicit", "ot", 1], ["fuse_yx", "ot", 1]]}], "r": [[0.05283906425], 0, 1.7256965637207031, 1578228060.5825505], "v": 0.1}
{"i": ["cuda", "schedule_conv3d_nchw_cuda", [[1, 1, 80, 160, 160], [32, 1, 80, 80, 80], [1, 1, 1], [1, 1, 1], [1, 2, 2], 1], {}, ["schedule_conv3d_nchw_cuda", [1, 1, 80, 160, 160], [32, 1, 80, 80, 80], [1, 1, 1], [1, 1, 1], [1, 2, 2], 1], {"i": 224296033, "t": "", "c": null, "e": [["tile_n", "sp", [-1, 1, 1, 1]], ["tile_f", "sp", [-1, 4, 8, 1]], ["tile_d", "sp", [-1, 1, 3, 1]], ["tile_y", "sp", [-1, 2, 1, 1]], ["tile_x", "sp", [-1, 4, 1, 1]], ["tile_rc", "sp", [-1, 1]], ["tile_rd", "sp", [-1, 5]], ["tile_ry", "sp", [-1, 2]], ["tile_rx", "sp", [-1, 1]], ["auto_unroll_max_step", "ot", 512], ["unroll_explicit", "ot", 1], ["fuse_yx", "ot", 1]]}], "r": [[0.08444953775], 0, 2.42010235786438, 1578228062.2198129], "v": 0.1}
{"i": ["cuda", "schedule_conv3d_nchw_cuda", [[1, 1, 80, 160, 160], [32, 1, 80, 80, 80], [1, 1, 1], [1, 1, 1], [1, 2, 2], 1], {}, ["schedule_conv3d_nchw_cuda", [1, 1, 80, 160, 160], [32, 1, 80, 80, 80], [1, 1, 1], [1, 1, 1], [1, 2, 2], 1], {"i": 246696033, "t": "", "c": null, "e": [["tile_n", "sp", [-1, 1, 1, 1]], ["tile_f", "sp", [-1, 4, 8, 1]], ["tile_d", "sp", [-1, 1, 3, 1]], ["tile_y", "sp", [-1, 2, 1, 1]], ["tile_x", "sp", [-1, 4, 1, 1]], ["tile_rc", "sp", [-1, 1]], ["tile_rd", "sp", [-1, 5]], ["tile_ry", "sp", [-1, 2]], ["tile_rx", "sp", [-1, 1]], ["auto_unroll_max_step", "ot", 1500], ["unroll_explicit", "ot", 1], ["fuse_yx", "ot", 1]]}], "r": [[0.084441918], 0, 2.3800034523010254, 1578228063.801346], "v": 0.1}
{"i": ["cuda", "schedule_conv3d_nchw_cuda", [[1, 1, 80, 160, 160], [32, 1, 80, 80, 80], [1, 1, 1], [1, 1, 1], [1, 2, 2], 1], {}, ["schedule_conv3d_nchw_cuda", [1, 1, 80, 160, 160], [32, 1, 80, 80, 80], [1, 1, 1], [1, 1, 1], [1, 2, 2], 1], {"i": 201896033, "t": "", "c": null, "e": [["tile_n", "sp", [-1, 1, 1, 1]], ["tile_f", "sp", [-1, 4, 8, 1]], ["tile_d", "sp", [-1, 1, 3, 1]], ["tile_y", "sp", [-1, 2, 1, 1]], ["tile_x", "sp", [-1, 4, 1, 1]], ["tile_rc", "sp", [-1, 1]], ["tile_rd", "sp", [-1, 5]], ["tile_ry", "sp", [-1, 2]], ["tile_rx", "sp", [-1, 1]], ["auto_unroll_max_step", "ot", 0], ["unroll_explicit", "ot", 1], ["fuse_yx", "ot", 1]]}], "r": [[0.26297150325], 0, 4.472071647644043, 1578228067.7260478], "v": 0.1}
{"i": ["cuda", "schedule_conv3d_nchw_cuda", [[1, 1, 80, 160, 160], [32, 1, 80, 80, 80], [1, 1, 1], [1, 1, 1], [1, 2, 2], 1], {}, ["schedule_conv3d_nchw_cuda", [1, 1, 80, 160, 160], [32, 1, 80, 80, 80], [1, 1, 1], [1, 1, 1], [1, 2, 2], 1], {"i": 246678113, "t": "", "c": null, "e": [["tile_n", "sp", [-1, 1, 1, 1]], ["tile_f", "sp", [-1, 4, 8, 1]], ["tile_d", "sp", [-1, 1, 3, 1]], ["tile_y", "sp", [-1, 2, 1, 1]], ["tile_x", "sp", [-1, 2, 2, 1]], ["tile_rc", "sp", [-1, 1]], ["tile_rd", "sp", [-1, 4]], ["tile_ry", "sp", [-1, 2]], ["tile_rx", "sp", [-1, 1]], ["auto_unroll_max_step", "ot", 1500], ["unroll_explicit", "ot", 1], ["fuse_yx", "ot", 1]]}], "r": [[0.05199364625], 0, 1.731980800628662, 1578228068.8338783], "v": 0.1}
{"i": ["cuda", "schedule_conv3d_nchw_cuda", [[1, 1, 80, 160, 160], [32, 1, 80, 80, 80], [1, 1, 1], [1, 1, 1], [1, 2, 2], 1], {}, ["schedule_conv3d_nchw_cuda", [1, 1, 80, 160, 160], [32, 1, 80, 80, 80], [1, 1, 1], [1, 1, 1], [1, 2, 2], 1], {"i": 246700512, "t": "", "c": null, "e": [["tile_n", "sp", [-1, 1, 1, 1]], ["tile_f", "sp", [-1, 2, 8, 1]], ["tile_d", "sp", [-1, 1, 3, 1]], ["tile_y", "sp", [-1, 2, 1, 1]], ["tile_x", "sp", [-1, 2, 2, 1]], ["tile_rc", "sp", [-1, 1]], ["tile_rd", "sp", [-1, 5]], ["tile_ry", "sp", [-1, 2]], ["tile_rx", "sp", [-1, 1]], ["auto_unroll_max_step", "ot", 1500], ["unroll_explicit", "ot", 1], ["fuse_yx", "ot", 1]]}], "r": [[0.0366368245], 0, 1.474827766418457, 1578228069.783408], "v": 0.1}
{"i": ["cuda", "schedule_conv3d_nchw_cuda", [[1, 1, 80, 160, 160], [32, 1, 80, 80, 80], [1, 1, 1], [1, 1, 1], [1, 2, 2], 1], {}, ["schedule_conv3d_nchw_cuda", [1, 1, 80, 160, 160], [32, 1, 80, 80, 80], [1, 1, 1], [1, 1, 1], [1, 2, 2], 1], {"i": 201900513, "t": "", "c": null, "e": [["tile_n", "sp", [-1, 1, 1, 1]], ["tile_f", "sp", [-1, 4, 8, 1]], ["tile_d", "sp", [-1, 1, 3, 1]], ["tile_y", "sp", [-1, 2, 1, 1]], ["tile_x", "sp", [-1, 2, 2, 1]], ["tile_rc", "sp", [-1, 1]], ["tile_rd", "sp", [-1, 5]], ["tile_ry", "sp", [-1, 2]], ["tile_rx", "sp", [-1, 1]], ["auto_unroll_max_step", "ot", 0], ["unroll_explicit", "ot", 1], ["fuse_yx", "ot", 1]]}], "r": [[0.06071554725], 0, 1.8176853656768799, 1578228071.061758], "v": 0.1}
{"i": ["cuda", "schedule_conv3d_nchw_cuda", [[1, 1, 80, 160, 160], [32, 1, 80, 80, 80], [1, 1, 1], [1, 1, 1], [1, 2, 2], 1], {}, ["schedule_conv3d_nchw_cuda", [1, 1, 80, 160, 160], [32, 1, 80, 80, 80], [1, 1, 1], [1, 1, 1], [1, 2, 2], 1], {"i": 201900512, "t": "", "c": null, "e": [["tile_n", "sp", [-1, 1, 1, 1]], ["tile_f", "sp", [-1, 2, 8, 1]], ["tile_d", "sp", [-1, 1, 3, 1]], ["tile_y", "sp", [-1, 2, 1, 1]], ["tile_x", "sp", [-1, 2, 2, 1]], ["tile_rc", "sp", [-1, 1]], ["tile_rd", "sp", [-1, 5]], ["tile_ry", "sp", [-1, 2]], ["tile_rx", "sp", [-1, 1]], ["auto_unroll_max_step", "ot", 0], ["unroll_explicit", "ot", 1], ["fuse_yx", "ot", 1]]}], "r": [[0.03978032475], 0, 1.4861299991607666, 1578228072.0645528], "v": 0.1}
{"i": ["cuda", "schedule_conv3d_nchw_cuda", [[1, 1, 80, 160, 160], [32, 1, 80, 80, 80], [1, 1, 1], [1, 1, 1], [1, 2, 2], 1], {}, ["schedule_conv3d_nchw_cuda", [1, 1, 80, 160, 160], [32, 1, 80, 80, 80], [1, 1, 1], [1, 1, 1], [1, 2, 2], 1], {"i": 201922913, "t": "", "c": null, "e": [["tile_n", "sp", [-1, 1, 1, 1]], ["tile_f", "sp", [-1, 4, 8, 1]], ["tile_d", "sp", [-1, 1, 3, 1]], ["tile_y", "sp", [-1, 2, 1, 1]], ["tile_x", "sp", [-1, 2, 2, 1]], ["tile_rc", "sp", [-1, 1]], ["tile_rd", "sp", [-1, 8]], ["tile_ry", "sp", [-1, 2]], ["tile_rx", "sp", [-1, 1]], ["auto_unroll_max_step", "ot", 0], ["unroll_explicit", "ot", 1], ["fuse_yx", "ot", 1]]}], "r": [[0.06376745325], 0, 1.8401050567626953, 1578228073.3862848], "v": 0.1}
{"i": ["cuda", "schedule_conv3d_nchw_cuda", [[1, 1, 80, 160, 160], [32, 1, 80, 80, 80], [1, 1, 1], [1, 1, 1], [1, 2, 2], 1], {}, ["schedule_conv3d_nchw_cuda", [1, 1, 80, 160, 160], [32, 1, 80, 80, 80], [1, 1, 1], [1, 1, 1], [1, 2, 2], 1], {"i": 224280407, "t": "", "c": null, "e": [["tile_n", "sp", [-1, 1, 1, 1]], ["tile_f", "sp", [-1, 1, 8, 1]], ["tile_d", "sp", [-1, 1, 1, 3]], ["tile_y", "sp", [-1, 2, 1, 1]], ["tile_x", "sp", [-1, 1, 4, 1]], ["tile_rc", "sp", [-1, 1]], ["tile_rd", "sp", [-1, 4]], ["tile_ry", "sp", [-1, 2]], ["tile_rx", "sp", [-1, 1]], ["auto_unroll_max_step", "ot", 512], ["unroll_explicit", "ot", 1], ["fuse_yx", "ot", 1]]}], "r": [[0.062603744], 0, 1.8469548225402832, 1578228076.6106029], "v": 0.1}
{"i": ["cuda", "schedule_conv3d_nchw_cuda", [[1, 1, 80, 160, 160], [32, 1, 80, 80, 80], [1, 1, 1], [1, 1, 1], [1, 2, 2], 1], {}, ["schedule_conv3d_nchw_cuda", [1, 1, 80, 160, 160], [32, 1, 80, 80, 80], [1, 1, 1], [1, 1, 1], [1, 2, 2], 1], {"i": 246707232, "t": "", "c": null, "e": [["tile_n", "sp", [-1, 1, 1, 1]], ["tile_f", "sp", [-1, 2, 8, 1]], ["tile_d", "sp", [-1, 1, 3, 1]], ["tile_y", "sp", [-1, 2, 1, 1]], ["tile_x", "sp", [-1, 2, 1, 2]], ["tile_rc", "sp", [-1, 1]], ["tile_rd", "sp", [-1, 5]], ["tile_ry", "sp", [-1, 2]], ["tile_rx", "sp", [-1, 1]], ["auto_unroll_max_step", "ot", 1500], ["unroll_explicit", "ot", 1], ["fuse_yx", "ot", 1]]}], "r": [[0.06930424675], 0, 2.0218594074249268, 1578228078.0172431], "v": 0.1}
{"i": ["cuda", "schedule_conv3d_nchw_cuda", [[1, 1, 80, 160, 160], [32, 1, 80, 80, 80], [1, 1, 1], [1, 1, 1], [1, 2, 2], 1], {}, ["schedule_conv3d_nchw_cuda", [1, 1, 80, 160, 160], [32, 1, 80, 80, 80], [1, 1, 1], [1, 1, 1], [1, 2, 2], 1], {"i": 246680407, "t": "", "c": null, "e": [["tile_n", "sp", [-1, 1, 1, 1]], ["tile_f", "sp", [-1, 1, 8, 1]], ["tile_d", "sp", [-1, 1, 1, 3]], ["tile_y", "sp", [-1, 2, 1, 1]], ["tile_x", "sp", [-1, 1, 4, 1]], ["tile_rc", "sp", [-1, 1]], ["tile_rd", "sp", [-1, 4]], ["tile_ry", "sp", [-1, 2]], ["tile_rx", "sp", [-1, 1]], ["auto_unroll_max_step", "ot", 1500], ["unroll_explicit", "ot", 1], ["fuse_yx", "ot", 1]]}], "r": [[0.0626147165], 0, 1.7576878070831299, 1578228079.2762246], "v": 0.1}
{"i": ["cuda", "schedule_conv3d_nchw_cuda", [[1, 1, 80, 160, 160], [32, 1, 80, 80, 80], [1, 1, 1], [1, 1, 1], [1, 2, 2], 1], {}, ["schedule_conv3d_nchw_cuda", [1, 1, 80, 160, 160], [32, 1, 80, 80, 80], [1, 1, 1], [1, 1, 1], [1, 2, 2], 1], {"i": 201880407, "t": "", "c": null, "e": [["tile_n", "sp", [-1, 1, 1, 1]], ["tile_f", "sp", [-1, 1, 8, 1]], ["tile_d", "sp", [-1, 1, 1, 3]], ["tile_y", "sp", [-1, 2, 1, 1]], ["tile_x", "sp", [-1, 1, 4, 1]], ["tile_rc", "sp", [-1, 1]], ["tile_rd", "sp", [-1, 4]], ["tile_ry", "sp", [-1, 2]], ["tile_rx", "sp", [-1, 1]], ["auto_unroll_max_step", "ot", 0], ["unroll_explicit", "ot", 1], ["fuse_yx", "ot", 1]]}], "r": [[0.0823074605], 0, 2.267685890197754, 1578228081.0351362], "v": 0.1}
{"i": ["cuda", "schedule_conv3d_nchw_cuda", [[1, 1, 80, 160, 160], [32, 1, 80, 80, 80], [1, 1, 1], [1, 1, 1], [1, 2, 2], 1], {}, ["schedule_conv3d_nchw_cuda", [1, 1, 80, 160, 160], [32, 1, 80, 80, 80], [1, 1, 1], [1, 1, 1], [1, 2, 2], 1], {"i": 89925714, "t": "", "c": null, "e": [["tile_n", "sp", [-1, 1, 1, 1]], ["tile_f", "sp", [-1, 1, 16, 1]], ["tile_d", "sp", [-1, 1, 1, 1]], ["tile_y", "sp", [-1, 2, 2, 1]], ["tile_x", "sp", [-1, 1, 4, 1]], ["tile_rc", "sp", [-1, 1]], ["tile_rd", "sp", [-1, 8]], ["tile_ry", "sp", [-1, 2]], ["tile_rx", "sp", [-1, 1]], ["auto_unroll_max_step", "ot", 512], ["unroll_explicit", "ot", 1], ["fuse_yx", "ot", 0]]}], "r": [[0.02883609575], 0, 1.4812240600585938, 1578228081.979595], "v": 0.1}
{"i": ["cuda", "schedule_conv3d_nchw_cuda", [[1, 1, 80, 160, 160], [32, 1, 80, 80, 80], [1, 1, 1], [1, 1, 1], [1, 2, 2], 1], {}, ["schedule_conv3d_nchw_cuda", [1, 1, 80, 160, 160], [32, 1, 80, 80, 80], [1, 1, 1], [1, 1, 1], [1, 2, 2], 1], {"i": 201916419, "t": "", "c": null, "e": [["tile_n", "sp", [-1, 1, 1, 1]], ["tile_f", "sp", [-1, 2, 16, 1]], ["tile_d", "sp", [-1, 1, 3, 1]], ["tile_y", "sp", [-1, 4, 1, 1]], ["tile_x", "sp", [-1, 2, 1, 1]], ["tile_rc", "sp", [-1, 1]], ["tile_rd", "sp", [-1, 8]], ["tile_ry", "sp", [-1, 2]], ["tile_rx", "sp", [-1, 1]], ["auto_unroll_max_step", "ot", 0], ["unroll_explicit", "ot", 1], ["fuse_yx", "ot", 1]]}], "r": [[0.06307419875], 0, 1.8561575412750244, 1578228083.2822921], "v": 0.1}
{"i": ["cuda", "schedule_conv3d_nchw_cuda", [[1, 1, 80, 160, 160], [32, 1, 80, 80, 80], [1, 1, 1], [1, 1, 1], [1, 2, 2], 1], {}, ["schedule_conv3d_nchw_cuda", [1, 1, 80, 160, 160], [32, 1, 80, 80, 80], [1, 1, 1], [1, 1, 1], [1, 2, 2], 1], {"i": 246725153, "t": "", "c": null, "e": [["tile_n", "sp", [-1, 1, 1, 1]], ["tile_f", "sp", [-1, 4, 8, 1]], ["tile_d", "sp", [-1, 1, 3, 1]], ["tile_y", "sp", [-1, 2, 1, 1]], ["tile_x", "sp", [-1, 1, 4, 1]], ["tile_rc", "sp", [-1, 1]], ["tile_rd", "sp", [-1, 8]], ["tile_ry", "sp", [-1, 2]], ["tile_rx", "sp", [-1, 1]], ["auto_unroll_max_step", "ot", 1500], ["unroll_explicit", "ot", 1], ["fuse_yx", "ot", 1]]}], "r": [[0.03056219825], 0, 1.4955930709838867, 1578228084.164873], "v": 0.1}
{"i": ["cuda", "schedule_conv3d_nchw_cuda", [[1, 1, 80, 160, 160], [32, 1, 80, 80, 80], [1, 1, 1], [1, 1, 1], [1, 2, 2], 1], {}, ["schedule_conv3d_nchw_cuda", [1, 1, 80, 160, 160], [32, 1, 80, 80, 80], [1, 1, 1], [1, 1, 1], [1, 2, 2], 1], {"i": 224094433, "t": "", "c": null, "e": [["tile_n", "sp", [-1, 1, 1, 1]], ["tile_f", "sp", [-1, 4, 8, 1]], ["tile_d", "sp", [-1, 1, 3, 1]], ["tile_y", "sp", [-1, 2, 1, 1]], ["tile_x", "sp", [-1, 4, 1, 1]], ["tile_rc", "sp", [-1, 1]], ["tile_rd", "sp", [-1, 8]], ["tile_ry", "sp", [-1, 1]], ["tile_rx", "sp", [-1, 1]], ["auto_unroll_max_step", "ot", 512], ["unroll_explicit", "ot", 1], ["fuse_yx", "ot", 1]]}], "r": [[0.09307142775], 0, 2.4720816612243652, 1578228085.8810723], "v": 0.1}
{"i": ["cuda", "schedule_conv3d_nchw_cuda", [[1, 1, 80, 160, 160], [32, 1, 80, 80, 80], [1, 1, 1], [1, 1, 1], [1, 2, 2], 1], {}, ["schedule_conv3d_nchw_cuda", [1, 1, 80, 160, 160], [32, 1, 80, 80, 80], [1, 1, 1], [1, 1, 1], [1, 2, 2], 1], {"i": 112323474, "t": "", "c": null, "e": [["tile_n", "sp", [-1, 1, 1, 1]], ["tile_f", "sp", [-1, 1, 16, 1]], ["tile_d", "sp", [-1, 1, 1, 1]], ["tile_y", "sp", [-1, 2, 2, 1]], ["tile_x", "sp", [-1, 2, 2, 1]], ["tile_rc", "sp", [-1, 1]], ["tile_rd", "sp", [-1, 8]], ["tile_ry", "sp", [-1, 2]], ["tile_rx", "sp", [-1, 1]], ["auto_unroll_max_step", "ot", 1500], ["unroll_explicit", "ot", 1], ["fuse_yx", "ot", 0]]}], "r": [[0.03703835], 0, 1.5306575298309326, 1578228086.8548777], "v": 0.1}
{"i": ["cuda", "schedule_conv3d_nchw_cuda", [[1, 1, 80, 160, 160], [32, 1, 80, 80, 80], [1, 1, 1], [1, 1, 1], [1, 2, 2], 1], {}, ["schedule_conv3d_nchw_cuda", [1, 1, 80, 160, 160], [32, 1, 80, 80, 80], [1, 1, 1], [1, 1, 1], [1, 2, 2], 1], {"i": 202111634, "t": "", "c": null, "e": [["tile_n", "sp", [-1, 1, 1, 1]], ["tile_f", "sp", [-1, 1, 16, 1]], ["tile_d", "sp", [-1, 1, 1, 1]], ["tile_y", "sp", [-1, 2, 2, 1]], ["tile_x", "sp", [-1, 1, 2, 2]], ["tile_rc", "sp", [-1, 1]], ["tile_rd", "sp", [-1, 4]], ["tile_ry", "sp", [-1, 4]], ["tile_rx", "sp", [-1, 1]], ["auto_unroll_max_step", "ot", 0], ["unroll_explicit", "ot", 1], ["fuse_yx", "ot", 1]]}], "r": [[0.044995207], 0, 1.6638648509979248, 1578228088.0175076], "v": 0.1}
{"i": ["cuda", "schedule_conv3d_nchw_cuda", [[1, 1, 80, 160, 160], [32, 1, 80, 80, 80], [1, 1, 1], [1, 1, 1], [1, 2, 2], 1], {}, ["schedule_conv3d_nchw_cuda", [1, 1, 80, 160, 160], [32, 1, 80, 80, 80], [1, 1, 1], [1, 1, 1], [1, 2, 2], 1], {"i": 247352914, "t": "", "c": null, "e": [["tile_n", "sp", [-1, 1, 1, 1]], ["tile_f", "sp", [-1, 1, 16, 1]], ["tile_d", "sp", [-1, 1, 1, 1]], ["tile_y", "sp", [-1, 2, 2, 1]], ["tile_x", "sp", [-1, 1, 4, 1]], ["tile_rc", "sp", [-1, 1]], ["tile_rd", "sp", [-1, 4]], ["tile_ry", "sp", [-1, 8]], ["tile_rx", "sp", [-1, 1]], ["auto_unroll_max_step", "ot", 1500], ["unroll_explicit", "ot", 1], ["fuse_yx", "ot", 1]]}], "r": [[0.02085267975], 0, 2.10410737991333, 1578228088.972452], "v": 0.1}
{"i": ["cuda", "schedule_conv3d_nchw_cuda", [[1, 1, 80, 160, 160], [32, 1, 80, 80, 80], [1, 1, 1], [1, 1, 1], [1, 2, 2], 1], {}, ["schedule_conv3d_nchw_cuda", [1, 1, 80, 160, 160], [32, 1, 80, 80, 80], [1, 1, 1], [1, 1, 1], [1, 2, 2], 1], {"i": 202552914, "t": "", "c": null, "e": [["tile_n", "sp", [-1, 1, 1, 1]], ["tile_f", "sp", [-1, 1, 16, 1]], ["tile_d", "sp", [-1, 1, 1, 1]], ["tile_y", "sp", [-1, 2, 2, 1]], ["tile_x", "sp", [-1, 1, 4, 1]], ["tile_rc", "sp", [-1, 1]], ["tile_rd", "sp", [-1, 4]], ["tile_ry", "sp", [-1, 8]], ["tile_rx", "sp", [-1, 1]], ["auto_unroll_max_step", "ot", 0], ["unroll_explicit", "ot", 1], ["fuse_yx", "ot", 1]]}], "r": [[0.02654189025], 0, 1.4286212921142578, 1578228089.8214176], "v": 0.1}
{"i": ["cuda", "schedule_conv3d_nchw_cuda", [[1, 1, 80, 160, 160], [32, 1, 80, 80, 80], [1, 1, 1], [1, 1, 1], [1, 2, 2], 1], {}, ["schedule_conv3d_nchw_cuda", [1, 1, 80, 160, 160], [32, 1, 80, 80, 80], [1, 1, 1], [1, 1, 1], [1, 2, 2], 1], {"i": 224952914, "t": "", "c": null, "e": [["tile_n", "sp", [-1, 1, 1, 1]], ["tile_f", "sp", [-1, 1, 16, 1]], ["tile_d", "sp", [-1, 1, 1, 1]], ["tile_y", "sp", [-1, 2, 2, 1]], ["tile_x", "sp", [-1, 1, 4, 1]], ["tile_rc", "sp", [-1, 1]], ["tile_rd", "sp", [-1, 4]], ["tile_ry", "sp", [-1, 8]], ["tile_rx", "sp", [-1, 1]], ["auto_unroll_max_step", "ot", 512], ["unroll_explicit", "ot", 1], ["fuse_yx", "ot", 1]]}], "r": [[0.0233163125], 0, 1.3905067443847656, 1578228092.0669105], "v": 0.1}
{"i": ["cuda", "schedule_conv3d_nchw_cuda", [[1, 1, 80, 160, 160], [32, 1, 80, 80, 80], [1, 1, 1], [1, 1, 1], [1, 2, 2], 1], {}, ["schedule_conv3d_nchw_cuda", [1, 1, 80, 160, 160], [32, 1, 80, 80, 80], [1, 1, 1], [1, 1, 1], [1, 2, 2], 1], {"i": 224511634, "t": "", "c": null, "e": [["tile_n", "sp", [-1, 1, 1, 1]], ["tile_f", "sp", [-1, 1, 16, 1]], ["tile_d", "sp", [-1, 1, 1, 1]], ["tile_y", "sp", [-1, 2, 2, 1]], ["tile_x", "sp", [-1, 1, 2, 2]], ["tile_rc", "sp", [-1, 1]], ["tile_rd", "sp", [-1, 4]], ["tile_ry", "sp", [-1, 4]], ["tile_rx", "sp", [-1, 1]], ["auto_unroll_max_step", "ot", 512], ["unroll_explicit", "ot", 1], ["fuse_yx", "ot", 1]]}], "r": [[0.0409288885], 0, 1.5629737377166748, 1578228093.1936371], "v": 0.1}
{"i": ["cuda", "schedule_conv3d_nchw_cuda", [[1, 1, 80, 160, 160], [32, 1, 80, 80, 80], [1, 1, 1], [1, 1, 1], [1, 2, 2], 1], {}, ["schedule_conv3d_nchw_cuda", [1, 1, 80, 160, 160], [32, 1, 80, 80, 80], [1, 1, 1], [1, 1, 1], [1, 2, 2], 1], {"i": 204116544, "t": "", "c": null, "e": [["tile_n", "sp", [-1, 1, 1, 1]], ["tile_f", "sp", [-1, 2, 8, 1]], ["tile_d", "sp", [-1, 1, 3, 1]], ["tile_y", "sp", [-1, 2, 2, 1]], ["tile_x", "sp", [-1, 1, 2, 1]], ["tile_rc", "sp", [-1, 1]], ["tile_rd", "sp", [-1, 4]], ["tile_ry", "sp", [-1, 2]], ["tile_rx", "sp", [-1, 2]], ["auto_unroll_max_step", "ot", 0], ["unroll_explicit", "ot", 1], ["fuse_yx", "ot", 1]]}], "r": [[0.03080875325], 0, 1.5597233772277832, 1578228094.23738], "v": 0.1}
{"i": ["cuda", "schedule_conv3d_nchw_cuda", [[1, 1, 80, 160, 160], [32, 1, 80, 80, 80], [1, 1, 1], [1, 1, 1], [1, 2, 2], 1], {}, ["schedule_conv3d_nchw_cuda", [1, 1, 80, 160, 160], [32, 1, 80, 80, 80], [1, 1, 1], [1, 1, 1], [1, 2, 2], 1], {"i": 204116098, "t": "", "c": null, "e": [["tile_n", "sp", [-1, 1, 1, 1]], ["tile_f", "sp", [-1, 1, 16, 1]], ["tile_d", "sp", [-1, 1, 3, 1]], ["tile_y", "sp", [-1, 4, 1, 1]], ["tile_x", "sp", [-1, 1, 2, 1]], ["tile_rc", "sp", [-1, 1]], ["tile_rd", "sp", [-1, 4]], ["tile_ry", "sp", [-1, 2]], ["tile_rx", "sp", [-1, 2]], ["auto_unroll_max_step", "ot", 0], ["unroll_explicit", "ot", 1], ["fuse_yx", "ot", 1]]}], "r": [[0.033522762], 0, 1.6748547554016113, 1578228095.3564804], "v": 0.1}
{"i": ["cuda", "schedule_conv3d_nchw_cuda", [[1, 1, 80, 160, 160], [32, 1, 80, 80, 80], [1, 1, 1], [1, 1, 1], [1, 2, 2], 1], {}, ["schedule_conv3d_nchw_cuda", [1, 1, 80, 160, 160], [32, 1, 80, 80, 80], [1, 1, 1], [1, 1, 1], [1, 2, 2], 1], {"i": 226516544, "t": "", "c": null, "e": [["tile_n", "sp", [-1, 1, 1, 1]], ["tile_f", "sp", [-1, 2, 8, 1]], ["tile_d", "sp", [-1, 1, 3, 1]], ["tile_y", "sp", [-1, 2, 2, 1]], ["tile_x", "sp", [-1, 1, 2, 1]], ["tile_rc", "sp", [-1, 1]], ["tile_rd", "sp", [-1, 4]], ["tile_ry", "sp", [-1, 2]], ["tile_rx", "sp", [-1, 2]], ["auto_unroll_max_step", "ot", 512], ["unroll_explicit", "ot", 1], ["fuse_yx", "ot", 1]]}], "r": [[0.02613831825], 0, 1.563446283340454, 1578228096.346939], "v": 0.1}
{"i": ["cuda", "schedule_conv3d_nchw_cuda", [[1, 1, 80, 160, 160], [32, 1, 80, 80, 80], [1, 1, 1], [1, 1, 1], [1, 2, 2], 1], {}, ["schedule_conv3d_nchw_cuda", [1, 1, 80, 160, 160], [32, 1, 80, 80, 80], [1, 1, 1], [1, 1, 1], [1, 2, 2], 1], {"i": 206110159, "t": "", "c": null, "e": [["tile_n", "sp", [-1, 1, 1, 1]], ["tile_f", "sp", [-1, 2, 4, 2]], ["tile_d", "sp", [-1, 1, 3, 1]], ["tile_y", "sp", [-1, 2, 2, 1]], ["tile_x", "sp", [-1, 1, 2, 1]], ["tile_rc", "sp", [-1, 1]], ["tile_rd", "sp", [-1, 2]], ["tile_ry", "sp", [-1, 1]], ["tile_rx", "sp", [-1, 4]], ["auto_unroll_max_step", "ot", 0], ["unroll_explicit", "ot", 1], ["fuse_yx", "ot", 1]]}], "r": [[0.0472210205], 0, 1.5771193504333496, 1578228097.4444077], "v": 0.1}
{"i": ["cuda", "schedule_conv3d_nchw_cuda", [[1, 1, 80, 160, 160], [32, 1, 80, 80, 80], [1, 1, 1], [1, 1, 1], [1, 2, 2], 1], {}, ["schedule_conv3d_nchw_cuda", [1, 1, 80, 160, 160], [32, 1, 80, 80, 80], [1, 1, 1], [1, 1, 1], [1, 2, 2], 1], {"i": 201917088, "t": "", "c": null, "e": [["tile_n", "sp", [-1, 1, 1, 1]], ["tile_f", "sp", [-1, 2, 8, 1]], ["tile_d", "sp", [-1, 1, 3, 1]], ["tile_y", "sp", [-1, 1, 4, 1]], ["tile_x", "sp", [-1, 2, 1, 1]], ["tile_rc", "sp", [-1, 1]], ["tile_rd", "sp", [-1, 8]], ["tile_ry", "sp", [-1, 2]], ["tile_rx", "sp", [-1, 1]], ["auto_unroll_max_step", "ot", 0], ["unroll_explicit", "ot", 1], ["fuse_yx", "ot", 1]]}], "r": [[0.02887451825], 0, 1.5766994953155518, 1578228098.5063574], "v": 0.1}
{"i": ["cuda", "schedule_conv3d_nchw_cuda", [[1, 1, 80, 160, 160], [32, 1, 80, 80, 80], [1, 1, 1], [1, 1, 1], [1, 2, 2], 1], {}, ["schedule_conv3d_nchw_cuda", [1, 1, 80, 160, 160], [32, 1, 80, 80, 80], [1, 1, 1], [1, 1, 1], [1, 2, 2], 1], {"i": 228510592, "t": "", "c": null, "e": [["tile_n", "sp", [-1, 1, 1, 1]], ["tile_f", "sp", [-1, 2, 8, 1]], ["tile_d", "sp", [-1, 1, 3, 1]], ["tile_y", "sp", [-1, 1, 1, 2]], ["tile_x", "sp", [-1, 1, 2, 1]], ["tile_rc", "sp", [-1, 1]], ["tile_rd", "sp", [-1, 2]], ["tile_ry", "sp", [-1, 1]], ["tile_rx", "sp", [-1, 4]], ["auto_unroll_max_step", "ot", 512], ["unroll_explicit", "ot", 1], ["fuse_yx", "ot", 1]]}], "r": [[0.04105499425], 0, 1.513091802597046, 1578228099.5180774], "v": 0.1}
{"i": ["cuda", "schedule_conv3d_nchw_cuda", [[1, 1, 80, 160, 160], [32, 1, 80, 80, 80], [1, 1, 1], [1, 1, 1], [1, 2, 2], 1], {}, ["schedule_conv3d_nchw_cuda", [1, 1, 80, 160, 160], [32, 1, 80, 80, 80], [1, 1, 1], [1, 1, 1], [1, 2, 2], 1], {"i": 201917087, "t": "", "c": null, "e": [["tile_n", "sp", [-1, 1, 1, 1]], ["tile_f", "sp", [-1, 1, 8, 1]], ["tile_d", "sp", [-1, 1, 3, 1]], ["tile_y", "sp", [-1, 1, 4, 1]], ["tile_x", "sp", [-1, 2, 1, 1]], ["tile_rc", "sp", [-1, 1]], ["tile_rd", "sp", [-1, 8]], ["tile_ry", "sp", [-1, 2]], ["tile_rx", "sp", [-1, 1]], ["auto_unroll_max_step", "ot", 0], ["unroll_explicit", "ot", 1], ["fuse_yx", "ot", 1]]}], "r": [[0.02508301425], 0, 1.4571130275726318, 1578228100.4537518], "v": 0.1}
{"i": ["cuda", "schedule_conv3d_nchw_cuda", [[1, 1, 80, 160, 160], [32, 1, 80, 80, 80], [1, 1, 1], [1, 1, 1], [1, 2, 2], 1], {}, ["schedule_conv3d_nchw_cuda", [1, 1, 80, 160, 160], [32, 1, 80, 80, 80], [1, 1, 1], [1, 1, 1], [1, 2, 2], 1], {"i": 226288960, "t": "", "c": null, "e": [["tile_n", "sp", [-1, 1, 1, 1]], ["tile_f", "sp", [-1, 2, 8, 1]], ["tile_d", "sp", [-1, 1, 3, 1]], ["tile_y", "sp", [-1, 1, 2, 2]], ["tile_x", "sp", [-1, 2, 1, 1]], ["tile_rc", "sp", [-1, 1]], ["tile_rd", "sp", [-1, 4]], ["tile_ry", "sp", [-1, 1]], ["tile_rx", "sp", [-1, 2]], ["auto_unroll_max_step", "ot", 512], ["unroll_explicit", "ot", 1], ["fuse_yx", "ot", 1]]}], "r": [[0.046222344], 0, 1.6185357570648193, 1578228101.5392249], "v": 0.1}
{"i": ["cuda", "schedule_conv3d_nchw_cuda", [[1, 1, 80, 160, 160], [32, 1, 80, 80, 80], [1, 1, 1], [1, 1, 1], [1, 2, 2], 1], {}, ["schedule_conv3d_nchw_cuda", [1, 1, 80, 160, 160], [32, 1, 80, 80, 80], [1, 1, 1], [1, 1, 1], [1, 2, 2], 1], {"i": 224317088, "t": "", "c": null, "e": [["tile_n", "sp", [-1, 1, 1, 1]], ["tile_f", "sp", [-1, 2, 8, 1]], ["tile_d", "sp", [-1, 1, 3, 1]], ["tile_y", "sp", [-1, 1, 4, 1]], ["tile_x", "sp", [-1, 2, 1, 1]], ["tile_rc", "sp", [-1, 1]], ["tile_rd", "sp", [-1, 8]], ["tile_ry", "sp", [-1, 2]], ["tile_rx", "sp", [-1, 1]], ["auto_unroll_max_step", "ot", 512], ["unroll_explicit", "ot", 1], ["fuse_yx", "ot", 1]]}], "r": [[0.0222771825], 0, 1.4405627250671387, 1578228102.4412577], "v": 0.1}
{"i": ["cuda", "schedule_conv3d_nchw_cuda", [[1, 1, 80, 160, 160], [32, 1, 80, 80, 80], [1, 1, 1], [1, 1, 1], [1, 2, 2], 1], {}, ["schedule_conv3d_nchw_cuda", [1, 1, 80, 160, 160], [32, 1, 80, 80, 80], [1, 1, 1], [1, 1, 1], [1, 2, 2], 1], {"i": 224317087, "t": "", "c": null, "e": [["tile_n", "sp", [-1, 1, 1, 1]], ["tile_f", "sp", [-1, 1, 8, 1]], ["tile_d", "sp", [-1, 1, 3, 1]], ["tile_y", "sp", [-1, 1, 4, 1]], ["tile_x", "sp", [-1, 2, 1, 1]], ["tile_rc", "sp", [-1, 1]], ["tile_rd", "sp", [-1, 8]], ["tile_ry", "sp", [-1, 2]], ["tile_rx", "sp", [-1, 1]], ["auto_unroll_max_step", "ot", 512], ["unroll_explicit", "ot", 1], ["fuse_yx", "ot", 1]]}], "r": [[0.01968047075], 0, 1.3642451763153076, 1578228103.2552657], "v": 0.1}
{"i": ["cuda", "schedule_conv3d_nchw_cuda", [[1, 1, 80, 160, 160], [32, 1, 80, 80, 80], [1, 1, 1], [1, 1, 1], [1, 2, 2], 1], {}, ["schedule_conv3d_nchw_cuda", [1, 1, 80, 160, 160], [32, 1, 80, 80, 80], [1, 1, 1], [1, 1, 1], [1, 2, 2], 1], {"i": 159321136, "t": "", "c": null, "e": [["tile_n", "sp", [-1, 1, 1, 1]], ["tile_f", "sp", [-1, 2, 8, 1]], ["tile_d", "sp", [-1, 1, 1, 1]], ["tile_y", "sp", [-1, 1, 4, 1]], ["tile_x", "sp", [-1, 1, 4, 1]], ["tile_rc", "sp", [-1, 1]], ["tile_rd", "sp", [-1, 4]], ["tile_ry", "sp", [-1, 2]], ["tile_rx", "sp", [-1, 2]], ["auto_unroll_max_step", "ot", 512], ["unroll_explicit", "ot", 0], ["fuse_yx", "ot", 1]]}], "r": [[0.03044369925], 0, 1.619798183441162, 1578228374.694815], "v": 0.1}
{"i": ["cuda", "schedule_conv3d_nchw_cuda", [[1, 1, 80, 160, 160], [32, 1, 80, 80, 80], [1, 1, 1], [1, 1, 1], [1, 2, 2], 1], {}, ["schedule_conv3d_nchw_cuda", [1, 1, 80, 160, 160], [32, 1, 80, 80, 80], [1, 1, 1], [1, 1, 1], [1, 2, 2], 1], {"i": 226521136, "t": "", "c": null, "e": [["tile_n", "sp", [-1, 1, 1, 1]], ["tile_f", "sp", [-1, 2, 8, 1]], ["tile_d", "sp", [-1, 1, 1, 1]], ["tile_y", "sp", [-1, 1, 4, 1]], ["tile_x", "sp", [-1, 1, 4, 1]], ["tile_rc", "sp", [-1, 1]], ["tile_rd", "sp", [-1, 4]], ["tile_ry", "sp", [-1, 2]], ["tile_rx", "sp", [-1, 2]], ["auto_unroll_max_step", "ot", 512], ["unroll_explicit", "ot", 1], ["fuse_yx", "ot", 1]]}], "r": [[0.01978050725], 0, 1.3840913772583008, 1578228375.5675757], "v": 0.1}
{"i": ["cuda", "schedule_conv3d_nchw_cuda", [[1, 1, 80, 160, 160], [32, 1, 80, 80, 80], [1, 1, 1], [1, 1, 1], [1, 2, 2], 1], {}, ["schedule_conv3d_nchw_cuda", [1, 1, 80, 160, 160], [32, 1, 80, 80, 80], [1, 1, 1], [1, 1, 1], [1, 2, 2], 1], {"i": 159361567, "t": "", "c": null, "e": [["tile_n", "sp", [-1, 1, 1, 1]], ["tile_f", "sp", [-1, 1, 8, 1]], ["tile_d", "sp", [-1, 1, 3, 1]], ["tile_y", "sp", [-1, 1, 4, 1]], ["tile_x", "sp", [-1, 1, 2, 1]], ["tile_rc", "sp", [-1, 1]], ["tile_rd", "sp", [-1, 8]], ["tile_ry", "sp", [-1, 2]], ["tile_rx", "sp", [-1, 2]], ["auto_unroll_max_step", "ot", 512], ["unroll_explicit", "ot", 0], ["fuse_yx", "ot", 1]]}], "r": [[0.01391338125], 0, 1.394653081893921, 1578228376.4074264], "v": 0.1}
{"i": ["cuda", "schedule_conv3d_nchw_cuda", [[1, 1, 80, 160, 160], [32, 1, 80, 80, 80], [1, 1, 1], [1, 1, 1], [1, 2, 2], 1], {}, ["schedule_conv3d_nchw_cuda", [1, 1, 80, 160, 160], [32, 1, 80, 80, 80], [1, 1, 1], [1, 1, 1], [1, 2, 2], 1], {"i": 226561567, "t": "", "c": null, "e": [["tile_n", "sp", [-1, 1, 1, 1]], ["tile_f", "sp", [-1, 1, 8, 1]], ["tile_d", "sp", [-1, 1, 3, 1]], ["tile_y", "sp", [-1, 1, 4, 1]], ["tile_x", "sp", [-1, 1, 2, 1]], ["tile_rc", "sp", [-1, 1]], ["tile_rd", "sp", [-1, 8]], ["tile_ry", "sp", [-1, 2]], ["tile_rx", "sp", [-1, 2]], ["auto_unroll_max_step", "ot", 512], ["unroll_explicit", "ot", 1], ["fuse_yx", "ot", 1]]}], "r": [[0.01260041], 0, 1.3180568218231201, 1578228377.2115448], "v": 0.1}
{"i": ["cuda", "schedule_conv3d_nchw_cuda", [[1, 1, 80, 160, 160], [32, 1, 80, 80, 80], [1, 1, 1], [1, 1, 1], [1, 2, 2], 1], {}, ["schedule_conv3d_nchw_cuda", [1, 1, 80, 160, 160], [32, 1, 80, 80, 80], [1, 1, 1], [1, 1, 1], [1, 2, 2], 1], {"i": 157125936, "t": "", "c": null, "e": [["tile_n", "sp", [-1, 1, 1, 1]], ["tile_f", "sp", [-1, 2, 8, 1]], ["tile_d", "sp", [-1, 1, 1, 1]], ["tile_y", "sp", [-1, 1, 4, 1]], ["tile_x", "sp", [-1, 1, 4, 1]], ["tile_rc", "sp", [-1, 1]], ["tile_rd", "sp", [-1, 8]], ["tile_ry", "sp", [-1, 2]], ["tile_rx", "sp", [-1, 1]], ["auto_unroll_max_step", "ot", 512], ["unroll_explicit", "ot", 0], ["fuse_yx", "ot", 1]]}], "r": [[0.027952618], 0, 1.514251708984375, 1578228378.2363262], "v": 0.1}
{"i": ["cuda", "schedule_conv3d_nchw_cuda", [[1, 1, 80, 160, 160], [32, 1, 80, 80, 80], [1, 1, 1], [1, 1, 1], [1, 2, 2], 1], {}, ["schedule_conv3d_nchw_cuda", [1, 1, 80, 160, 160], [32, 1, 80, 80, 80], [1, 1, 1], [1, 1, 1], [1, 2, 2], 1], {"i": 224325936, "t": "", "c": null, "e": [["tile_n", "sp", [-1, 1, 1, 1]], ["tile_f", "sp", [-1, 2, 8, 1]], ["tile_d", "sp", [-1, 1, 1, 1]], ["tile_y", "sp", [-1, 1, 4, 1]], ["tile_x", "sp", [-1, 1, 4, 1]], ["tile_rc", "sp", [-1, 1]], ["tile_rd", "sp", [-1, 8]], ["tile_ry", "sp", [-1, 2]], ["tile_rx", "sp", [-1, 1]], ["auto_unroll_max_step", "ot", 512], ["unroll_explicit", "ot", 1], ["fuse_yx", "ot", 1]]}], "r": [[0.01983404625], 0, 1.449449062347412, 1578228379.132478], "v": 0.1}
{"i": ["cuda", "schedule_conv3d_nchw_cuda", [[1, 1, 80, 160, 160], [32, 1, 80, 80, 80], [1, 1, 1], [1, 1, 1], [1, 2, 2], 1], {}, ["schedule_conv3d_nchw_cuda", [1, 1, 80, 160, 160], [32, 1, 80, 80, 80], [1, 1, 1], [1, 1, 1], [1, 2, 2], 1], {"i": 224545567, "t": "", "c": null, "e": [["tile_n", "sp", [-1, 1, 1, 1]], ["tile_f", "sp", [-1, 1, 8, 1]], ["tile_d", "sp", [-1, 1, 3, 1]], ["tile_y", "sp", [-1, 1, 4, 1]], ["tile_x", "sp", [-1, 1, 2, 1]], ["tile_rc", "sp", [-1, 1]], ["tile_rd", "sp", [-1, 8]], ["tile_ry", "sp", [-1, 4]], ["tile_rx", "sp", [-1, 1]], ["auto_unroll_max_step", "ot", 512], ["unroll_explicit", "ot", 1], ["fuse_yx", "ot", 1]]}], "r": [[0.01956414675], 0, 1.5233747959136963, 1578228380.0513332], "v": 0.1}
{"i": ["cuda", "schedule_conv3d_nchw_cuda", [[1, 1, 80, 160, 160], [32, 1, 80, 80, 80], [1, 1, 1], [1, 1, 1], [1, 2, 2], 1], {}, ["schedule_conv3d_nchw_cuda", [1, 1, 80, 160, 160], [32, 1, 80, 80, 80], [1, 1, 1], [1, 1, 1], [1, 2, 2], 1], {"i": 157345567, "t": "", "c": null, "e": [["tile_n", "sp", [-1, 1, 1, 1]], ["tile_f", "sp", [-1, 1, 8, 1]], ["tile_d", "sp", [-1, 1, 3, 1]], ["tile_y", "sp", [-1, 1, 4, 1]], ["tile_x", "sp", [-1, 1, 2, 1]], ["tile_rc", "sp", [-1, 1]], ["tile_rd", "sp", [-1, 8]], ["tile_ry", "sp", [-1, 4]], ["tile_rx", "sp", [-1, 1]], ["auto_unroll_max_step", "ot", 512], ["unroll_explicit", "ot", 0], ["fuse_yx", "ot", 1]]}], "r": [[0.019145391], 0, 1.4503052234649658, 1578228380.9117603], "v": 0.1}
{"i": ["cuda", "schedule_conv3d_nchw_cuda", [[1, 1, 80, 160, 160], [32, 1, 80, 80, 80], [1, 1, 1], [1, 1, 1], [1, 2, 2], 1], {}, ["schedule_conv3d_nchw_cuda", [1, 1, 80, 160, 160], [32, 1, 80, 80, 80], [1, 1, 1], [1, 1, 1], [1, 2, 2], 1], {"i": 224549714, "t": "", "c": null, "e": [["tile_n", "sp", [-1, 1, 1, 1]], ["tile_f", "sp", [-1, 1, 16, 1]], ["tile_d", "sp", [-1, 1, 1, 1]], ["tile_y", "sp", [-1, 2, 2, 1]], ["tile_x", "sp", [-1, 1, 4, 1]], ["tile_rc", "sp", [-1, 1]], ["tile_rd", "sp", [-1, 8]], ["tile_ry", "sp", [-1, 4]], ["tile_rx", "sp", [-1, 1]], ["auto_unroll_max_step", "ot", 512], ["unroll_explicit", "ot", 1], ["fuse_yx", "ot", 1]]}], "r": [[0.025649883], 0, 1.5961370468139648, 1578228381.9395278], "v": 0.1}
{"i": ["cuda", "schedule_conv3d_nchw_cuda", [[1, 1, 80, 160, 160], [32, 1, 80, 80, 80], [1, 1, 1], [1, 1, 1], [1, 2, 2], 1], {}, ["schedule_conv3d_nchw_cuda", [1, 1, 80, 160, 160], [32, 1, 80, 80, 80], [1, 1, 1], [1, 1, 1], [1, 2, 2], 1], {"i": 157349714, "t": "", "c": null, "e": [["tile_n", "sp", [-1, 1, 1, 1]], ["tile_f", "sp", [-1, 1, 16, 1]], ["tile_d", "sp", [-1, 1, 1, 1]], ["tile_y", "sp", [-1, 2, 2, 1]], ["tile_x", "sp", [-1, 1, 4, 1]], ["tile_rc", "sp", [-1, 1]], ["tile_rd", "sp", [-1, 8]], ["tile_ry", "sp", [-1, 4]], ["tile_rx", "sp", [-1, 1]], ["auto_unroll_max_step", "ot", 512], ["unroll_explicit", "ot", 0], ["fuse_yx", "ot", 1]]}], "r": [[0.02912433725], 0, 1.5872509479522705, 1578228383.0384848], "v": 0.1}
{"i": ["cuda", "schedule_conv3d_nchw_cuda", [[1, 1, 80, 160, 160], [32, 1, 80, 80, 80], [1, 1, 1], [1, 1, 1], [1, 2, 2], 1], {}, ["schedule_conv3d_nchw_cuda", [1, 1, 80, 160, 160], [32, 1, 80, 80, 80], [1, 1, 1], [1, 1, 1], [1, 2, 2], 1], {"i": 224325714, "t": "", "c": null, "e": [["tile_n", "sp", [-1, 1, 1, 1]], ["tile_f", "sp", [-1, 1, 16, 1]], ["tile_d", "sp", [-1, 1, 1, 1]], ["tile_y", "sp", [-1, 2, 2, 1]], ["tile_x", "sp", [-1, 1, 4, 1]], ["tile_rc", "sp", [-1, 1]], ["tile_rd", "sp", [-1, 8]], ["tile_ry", "sp", [-1, 2]], ["tile_rx", "sp", [-1, 1]], ["auto_unroll_max_step", "ot", 512], ["unroll_explicit", "ot", 1], ["fuse_yx", "ot", 1]]}], "r": [[0.026653041], 0, 1.5562965869903564, 1578228384.0515447], "v": 0.1}
{"i": ["cuda", "schedule_conv3d_nchw_cuda", [[1, 1, 80, 160, 160], [32, 1, 80, 80, 80], [1, 1, 1], [1, 1, 1], [1, 2, 2], 1], {}, ["schedule_conv3d_nchw_cuda", [1, 1, 80, 160, 160], [32, 1, 80, 80, 80], [1, 1, 1], [1, 1, 1], [1, 2, 2], 1], {"i": 224523168, "t": "", "c": null, "e": [["tile_n", "sp", [-1, 1, 1, 1]], ["tile_f", "sp", [-1, 2, 8, 1]], ["tile_d", "sp", [-1, 1, 3, 1]], ["tile_y", "sp", [-1, 1, 4, 1]], ["tile_x", "sp", [-1, 1, 2, 1]], ["tile_rc", "sp", [-1, 1]], ["tile_rd", "sp", [-1, 5]], ["tile_ry", "sp", [-1, 4]], ["tile_rx", "sp", [-1, 1]], ["auto_unroll_max_step", "ot", 512], ["unroll_explicit", "ot", 1], ["fuse_yx", "ot", 1]]}], "r": [[0.02214699475], 0, 1.35746431350708, 1578228384.8983066], "v": 0.1}
