fast3d/second_input.log
{"i": ["cuda", "schedule_direct_3d_cuda", [[1, 64, 40, 40, 40], [64, 64, 3, 3, 3], [1, 1, 1], [1, 1, 1], 1], {}, ["schedule_direct_3d_cuda", [1, 64, 40, 40, 40], [64, 64, 3, 3, 3], [1, 1, 1], [1, 1, 1], 1], {"i": 2427538707, "t": "", "c": null, "e": [["tile_f", "sp", [-1, 1, 64, 1]], ["tile_d", "sp", [-1, 1, 1, 10]], ["tile_y", "sp", [-1, 1, 4, 2]], ["tile_x", "sp", [-1, 20, 1, 2]], ["tile_rc", "sp", [-1, 1]], ["tile_rd", "sp", [-1, 1]], ["tile_ry", "sp", [-1, 1]], ["tile_rx", "sp", [-1, 1]], ["auto_unroll_max_step", "ot", 512], ["unroll_explicit", "ot", 0]]}], "r": [[0.17088910325], 0, 3.427513360977173, 1575003048.6168396], "v": 0.1}
{"i": ["cuda", "schedule_direct_3d_cuda", [[1, 64, 40, 40, 40], [64, 64, 3, 3, 3], [1, 1, 1], [1, 1, 1], 1], {}, ["schedule_direct_3d_cuda", [1, 64, 40, 40, 40], [64, 64, 3, 3, 3], [1, 1, 1], [1, 1, 1], 1], {"i": 52873005, "t": "", "c": null, "e": [["tile_f", "sp", [-1, 4, 8, 2]], ["tile_d", "sp", [-1, 1, 1, 1]], ["tile_y", "sp", [-1, 2, 20, 1]], ["tile_x", "sp", [-1, 1, 5, 1]], ["tile_rc", "sp", [-1, 2]], ["tile_rd", "sp", [-1, 1]], ["tile_ry", "sp", [-1, 1]], ["tile_rx", "sp", [-1, 1]], ["auto_unroll_max_step", "ot", 0], ["unroll_explicit", "ot", 0]]}], "r": [[0.007540536052631578], 0, 1.5720784664154053, 1575003124.1999373], "v": 0.1}
{"i": ["cuda", "schedule_direct_3d_cuda", [[1, 64, 40, 40, 40], [64, 64, 3, 3, 3], [1, 1, 1], [1, 1, 1], 1], {}, ["schedule_direct_3d_cuda", [1, 64, 40, 40, 40], [64, 64, 3, 3, 3], [1, 1, 1], [1, 1, 1], 1], {"i": 52940205, "t": "", "c": null, "e": [["tile_f", "sp", [-1, 4, 8, 2]], ["tile_d", "sp", [-1, 1, 1, 1]], ["tile_y", "sp", [-1, 5, 2, 2]], ["tile_x", "sp", [-1, 1, 5, 1]], ["tile_rc", "sp", [-1, 2]], ["tile_rd", "sp", [-1, 1]], ["tile_ry", "sp", [-1, 1]], ["tile_rx", "sp", [-1, 1]], ["auto_unroll_max_step", "ot", 0], ["unroll_explicit", "ot", 0]]}], "r": [[0.011593856666666666], 0, 1.4759666919708252, 1575003125.3111858], "v": 0.1}
{"i": ["cuda", "schedule_direct_3d_cuda", [[1, 64, 40, 40, 40], [64, 64, 3, 3, 3], [1, 1, 1], [1, 1, 1], 1], {}, ["schedule_direct_3d_cuda", [1, 64, 40, 40, 40], [64, 64, 3, 3, 3], [1, 1, 1], [1, 1, 1], 1], {"i": 52691563, "t": "", "c": null, "e": [["tile_f", "sp", [-1, 1, 8, 2]], ["tile_d", "sp", [-1, 1, 1, 1]], ["tile_y", "sp", [-1, 2, 1, 1]], ["tile_x", "sp", [-1, 1, 5, 1]], ["tile_rc", "sp", [-1, 2]], ["tile_rd", "sp", [-1, 1]], ["tile_ry", "sp", [-1, 1]], ["tile_rx", "sp", [-1, 1]], ["auto_unroll_max_step", "ot", 0], ["unroll_explicit", "ot", 0]]}], "r": [[0.0191432425], 0, 1.3502442836761475, 1575003126.35002], "v": 0.1}
{"i": ["cuda", "schedule_direct_3d_cuda", [[1, 64, 40, 40, 40], [64, 64, 3, 3, 3], [1, 1, 1], [1, 1, 1], 1], {}, ["schedule_direct_3d_cuda", [1, 64, 40, 40, 40], [64, 64, 3, 3, 3], [1, 1, 1], [1, 1, 1], 1], {"i": 353929005, "t": "", "c": null, "e": [["tile_f", "sp", [-1, 4, 8, 2]], ["tile_d", "sp", [-1, 1, 1, 1]], ["tile_y", "sp", [-1, 2, 20, 1]], ["tile_x", "sp", [-1, 1, 5, 1]], ["tile_rc", "sp", [-1, 2]], ["tile_rd", "sp", [-1, 3]], ["tile_ry", "sp", [-1, 1]], ["tile_rx", "sp", [-1, 1]], ["auto_unroll_max_step", "ot", 0], ["unroll_explicit", "ot", 0]]}], "r": [[0.0063877530625], 0, 1.302872896194458, 1575003127.2587502], "v": 0.1}
{"i": ["cuda", "schedule_direct_3d_cuda", [[1, 64, 40, 40, 40], [64, 64, 3, 3, 3], [1, 1, 1], [1, 1, 1], 1], {}, ["schedule_direct_3d_cuda", [1, 64, 40, 40, 40], [64, 64, 3, 3, 3], [1, 1, 1], [1, 1, 1], 1], {"i": 52940203, "t": "", "c": null, "e": [["tile_f", "sp", [-1, 1, 8, 2]], ["tile_d", "sp", [-1, 1, 1, 1]], ["tile_y", "sp", [-1, 5, 2, 2]], ["tile_x", "sp", [-1, 1, 5, 1]], ["tile_rc", "sp", [-1, 2]], ["tile_rd", "sp", [-1, 1]], ["tile_ry", "sp", [-1, 1]], ["tile_rx", "sp", [-1, 1]], ["auto_unroll_max_step", "ot", 0], ["unroll_explicit", "ot", 0]]}], "r": [[0.011239594333333333], 0, 1.5004851818084717, 1575003128.4819307], "v": 0.1}
{"i": ["cuda", "schedule_direct_3d_cuda", [[1, 64, 40, 40, 40], [64, 64, 3, 3, 3], [1, 1, 1], [1, 1, 1], 1], {}, ["schedule_direct_3d_cuda", [1, 64, 40, 40, 40], [64, 64, 3, 3, 3], [1, 1, 1], [1, 1, 1], 1], {"i": 353996205, "t": "", "c": null, "e": [["tile_f", "sp", [-1, 4, 8, 2]], ["tile_d", "sp", [-1, 1, 1, 1]], ["tile_y", "sp", [-1, 5, 2, 2]], ["tile_x", "sp", [-1, 1, 5, 1]], ["tile_rc", "sp", [-1, 2]], ["tile_rd", "sp", [-1, 3]], ["tile_ry", "sp", [-1, 1]], ["tile_rx", "sp", [-1, 1]], ["auto_unroll_max_step", "ot", 0], ["unroll_explicit", "ot", 0]]}], "r": [[0.006983927666666666], 0, 1.358013391494751, 1575003130.1228914], "v": 0.1}
{"i": ["cuda", "schedule_direct_3d_cuda", [[1, 64, 40, 40, 40], [64, 64, 3, 3, 3], [1, 1, 1], [1, 1, 1], 1], {}, ["schedule_direct_3d_cuda", [1, 64, 40, 40, 40], [64, 64, 3, 3, 3], [1, 1, 1], [1, 1, 1], 1], {"i": 52953618, "t": "", "c": null, "e": [["tile_f", "sp", [-1, 1, 8, 1]], ["tile_d", "sp", [-1, 1, 1, 1]], ["tile_y", "sp", [-1, 1, 4, 2]], ["tile_x", "sp", [-1, 1, 5, 1]], ["tile_rc", "sp", [-1, 2]], ["tile_rd", "sp", [-1, 1]], ["tile_ry", "sp", [-1, 1]], ["tile_rx", "sp", [-1, 1]], ["auto_unroll_max_step", "ot", 0], ["unroll_explicit", "ot", 0]]}], "r": [[0.02790670725], 0, 1.2679321765899658, 1575003130.9812863], "v": 0.1}
{"i": ["cuda", "schedule_direct_3d_cuda", [[1, 64, 40, 40, 40], [64, 64, 3, 3, 3], [1, 1, 1], [1, 1, 1], 1], {}, ["schedule_direct_3d_cuda", [1, 64, 40, 40, 40], [64, 64, 3, 3, 3], [1, 1, 1], [1, 1, 1], 1], {"i": 4895448875, "t": "", "c": null, "e": [["tile_f", "sp", [-1, 2, 16, 1]], ["tile_d", "sp", [-1, 5, 1, 2]], ["tile_y", "sp", [-1, 2, 2, 1]], ["tile_x", "sp", [-1, 1, 8, 5]], ["tile_rc", "sp", [-1, 2]], ["tile_rd", "sp", [-1, 1]], ["tile_ry", "sp", [-1, 1]], ["tile_rx", "sp", [-1, 1]], ["auto_unroll_max_step", "ot", 1500], ["unroll_explicit", "ot", 0]]}], "r": [[0.06166631175], 0, 4.090437412261963, 1575003136.246779], "v": 0.1}
{"i": ["cuda", "schedule_direct_3d_cuda", [[1, 64, 40, 40, 40], [64, 64, 3, 3, 3], [1, 1, 1], [1, 1, 1], 1], {}, ["schedule_direct_3d_cuda", [1, 64, 40, 40, 40], [64, 64, 3, 3, 3], [1, 1, 1], [1, 1, 1], 1], {"i": 2487141995, "t": "", "c": null, "e": [["tile_f", "sp", [-1, 2, 16, 1]], ["tile_d", "sp", [-1, 5, 1, 2]], ["tile_y", "sp", [-1, 1, 1, 2]], ["tile_x", "sp", [-1, 1, 8, 5]], ["tile_rc", "sp", [-1, 2]], ["tile_rd", "sp", [-1, 1]], ["tile_ry", "sp", [-1, 1]], ["tile_rx", "sp", [-1, 1]], ["auto_unroll_max_step", "ot", 512], ["unroll_explicit", "ot", 0]]}], "r": [[0.04713081025], 0, 2.4992380142211914, 1575003137.862791], "v": 0.1}
{"i": ["cuda", "schedule_direct_3d_cuda", [[1, 64, 40, 40, 40], [64, 64, 3, 3, 3], [1, 1, 1], [1, 1, 1], 1], {}, ["schedule_direct_3d_cuda", [1, 64, 40, 40, 40], [64, 64, 3, 3, 3], [1, 1, 1], [1, 1, 1], 1], {"i": 4869836205, "t": "", "c": null, "e": [["tile_f", "sp", [-1, 4, 8, 2]], ["tile_d", "sp", [-1, 1, 1, 1]], ["tile_y", "sp", [-1, 5, 2, 2]], ["tile_x", "sp", [-1, 1, 5, 1]], ["tile_rc", "sp", [-1, 2]], ["tile_rd", "sp", [-1, 1]], ["tile_ry", "sp", [-1, 1]], ["tile_rx", "sp", [-1, 1]], ["auto_unroll_max_step", "ot", 1500], ["unroll_explicit", "ot", 0]]}], "r": [[0.006411120875], 0, 2.1685028076171875, 1575003139.0084684], "v": 0.1}
{"i": ["cuda", "schedule_direct_3d_cuda", [[1, 64, 40, 40, 40], [64, 64, 3, 3, 3], [1, 1, 1], [1, 1, 1], 1], {}, ["schedule_direct_3d_cuda", [1, 64, 40, 40, 40], [64, 64, 3, 3, 3], [1, 1, 1], [1, 1, 1], 1], {"i": 52953643, "t": "", "c": null, "e": [["tile_f", "sp", [-1, 1, 8, 2]], ["tile_d", "sp", [-1, 1, 1, 1]], ["tile_y", "sp", [-1, 1, 4, 2]], ["tile_x", "sp", [-1, 1, 5, 1]], ["tile_rc", "sp", [-1, 2]], ["tile_rd", "sp", [-1, 1]], ["tile_ry", "sp", [-1, 1]], ["tile_rx", "sp", [-1, 1]], ["auto_unroll_max_step", "ot", 0], ["unroll_explicit", "ot", 0]]}], "r": [[0.015779993285714285], 0, 1.474982738494873, 1575003139.9423318], "v": 0.1}
{"i": ["cuda", "schedule_direct_3d_cuda", [[1, 64, 40, 40, 40], [64, 64, 3, 3, 3], [1, 1, 1], [1, 1, 1], 1], {}, ["schedule_direct_3d_cuda", [1, 64, 40, 40, 40], [64, 64, 3, 3, 3], [1, 1, 1], [1, 1, 1], 1], {"i": 2444140715, "t": "", "c": null, "e": [["tile_f", "sp", [-1, 2, 16, 1]], ["tile_d", "sp", [-1, 5, 1, 2]], ["tile_y", "sp", [-1, 2, 1, 2]], ["tile_x", "sp", [-1, 1, 8, 5]], ["tile_rc", "sp", [-1, 1]], ["tile_rd", "sp", [-1, 1]], ["tile_ry", "sp", [-1, 1]], ["tile_rx", "sp", [-1, 1]], ["auto_unroll_max_step", "ot", 512], ["unroll_explicit", "ot", 0]]}], "r": [[0.214572849], 0, 5.175149202346802, 1575003143.9067237], "v": 0.1}
{"i": ["cuda", "schedule_direct_3d_cuda", [[1, 64, 40, 40, 40], [64, 64, 3, 3, 3], [1, 1, 1], [1, 1, 1], 1], {}, ["schedule_direct_3d_cuda", [1, 64, 40, 40, 40], [64, 64, 3, 3, 3], [1, 1, 1], [1, 1, 1], 1], {"i": 2444133995, "t": "", "c": null, "e": [["tile_f", "sp", [-1, 2, 16, 1]], ["tile_d", "sp", [-1, 5, 1, 2]], ["tile_y", "sp", [-1, 1, 1, 2]], ["tile_x", "sp", [-1, 1, 8, 5]], ["tile_rc", "sp", [-1, 1]], ["tile_rd", "sp", [-1, 1]], ["tile_ry", "sp", [-1, 1]], ["tile_rx", "sp", [-1, 1]], ["auto_unroll_max_step", "ot", 512], ["unroll_explicit", "ot", 0]]}], "r": [[0.019184074333333332], 0, 2.369044542312622, 1575003145.4395564], "v": 0.1}
{"i": ["cuda", "schedule_direct_3d_cuda", [[1, 64, 40, 40, 40], [64, 64, 3, 3, 3], [1, 1, 1], [1, 1, 1], 1], {}, ["schedule_direct_3d_cuda", [1, 64, 40, 40, 40], [64, 64, 3, 3, 3], [1, 1, 1], [1, 1, 1], 1], {"i": 5170892205, "t": "", "c": null, "e": [["tile_f", "sp", [-1, 4, 8, 2]], ["tile_d", "sp", [-1, 1, 1, 1]], ["tile_y", "sp", [-1, 5, 2, 2]], ["tile_x", "sp", [-1, 1, 5, 1]], ["tile_rc", "sp", [-1, 2]], ["tile_rd", "sp", [-1, 3]], ["tile_ry", "sp", [-1, 1]], ["tile_rx", "sp", [-1, 1]], ["auto_unroll_max_step", "ot", 1500], ["unroll_explicit", "ot", 0]]}], "r": [[0.010910072583333333], 0, 2.213095188140869, 1575003151.4682658], "v": 0.1}
{"i": ["cuda", "schedule_direct_3d_cuda", [[1, 64, 40, 40, 40], [64, 64, 3, 3, 3], [1, 1, 1], [1, 1, 1], 1], {}, ["schedule_direct_3d_cuda", [1, 64, 40, 40, 40], [64, 64, 3, 3, 3], [1, 1, 1], [1, 1, 1], 1], {"i": 7280999062, "t": "", "c": null, "e": [["tile_f", "sp", [-1, 1, 16, 1]], ["tile_d", "sp", [-1, 1, 1, 1]], ["tile_y", "sp", [-1, 1, 5, 2]], ["tile_x", "sp", [-1, 5, 8, 1]], ["tile_rc", "sp", [-1, 2]], ["tile_rd", "sp", [-1, 1]], ["tile_ry", "sp", [-1, 1]], ["tile_rx", "sp", [-1, 1]], ["auto_unroll_max_step", "ot", 0], ["unroll_explicit", "ot", 1]]}], "r": [[0.02486694416666667], 0, 1.4916801452636719, 1575003152.7099552], "v": 0.1}
{"i": ["cuda", "schedule_direct_3d_cuda", [[1, 64, 40, 40, 40], [64, 64, 3, 3, 3], [1, 1, 1], [1, 1, 1], 1], {}, ["schedule_direct_3d_cuda", [1, 64, 40, 40, 40], [64, 64, 3, 3, 3], [1, 1, 1], [1, 1, 1], 1], {"i": 9633992782, "t": "", "c": null, "e": [["tile_f", "sp", [-1, 1, 16, 1]], ["tile_d", "sp", [-1, 1, 1, 10]], ["tile_y", "sp", [-1, 1, 40, 1]], ["tile_x", "sp", [-1, 1, 1, 1]], ["tile_rc", "sp", [-1, 1]], ["tile_rd", "sp", [-1, 1]], ["tile_ry", "sp", [-1, 1]], ["tile_rx", "sp", [-1, 1]], ["auto_unroll_max_step", "ot", 512], ["unroll_explicit", "ot", 1]]}], "r": [[0.027167669], 0, 1.485644817352295, 1575003153.6348162], "v": 0.1}
{"i": ["cuda", "schedule_direct_3d_cuda", [[1, 64, 40, 40, 40], [64, 64, 3, 3, 3], [1, 1, 1], [1, 1, 1], 1], {}, ["schedule_direct_3d_cuda", [1, 64, 40, 40, 40], [64, 64, 3, 3, 3], [1, 1, 1], [1, 1, 1], 1], {"i": 2463552018, "t": "", "c": null, "e": [["tile_f", "sp", [-1, 1, 8, 1]], ["tile_d", "sp", [-1, 1, 1, 1]], ["tile_y", "sp", [-1, 1, 4, 2]], ["tile_x", "sp", [-1, 1, 8, 1]], ["tile_rc", "sp", [-1, 2]], ["tile_rd", "sp", [-1, 1]], ["tile_ry", "sp", [-1, 1]], ["tile_rx", "sp", [-1, 1]], ["auto_unroll_max_step", "ot", 512], ["unroll_explicit", "ot", 0]]}], "r": [[0.0288210075], 0, 1.3121180534362793, 1575003154.6203408], "v": 0.1}
{"i": ["cuda", "schedule_direct_3d_cuda", [[1, 64, 40, 40, 40], [64, 64, 3, 3, 3], [1, 1, 1], [1, 1, 1], 1], {}, ["schedule_direct_3d_cuda", [1, 64, 40, 40, 40], [64, 64, 3, 3, 3], [1, 1, 1], [1, 1, 1], 1], {"i": 12396236205, "t": "", "c": null, "e": [["tile_f", "sp", [-1, 4, 8, 2]], ["tile_d", "sp", [-1, 1, 1, 1]], ["tile_y", "sp", [-1, 5, 2, 2]], ["tile_x", "sp", [-1, 1, 5, 1]], ["tile_rc", "sp", [-1, 2]], ["tile_rd", "sp", [-1, 3]], ["tile_ry", "sp", [-1, 1]], ["tile_rx", "sp", [-1, 1]], ["auto_unroll_max_step", "ot", 1500], ["unroll_explicit", "ot", 1]]}], "r": [[0.009110029545454547], 0, 3.792916774749756, 1575003156.074989], "v": 0.1}
{"i": ["cuda", "schedule_direct_3d_cuda", [[1, 64, 40, 40, 40], [64, 64, 3, 3, 3], [1, 1, 1], [1, 1, 1], 1], {}, ["schedule_direct_3d_cuda", [1, 64, 40, 40, 40], [64, 64, 3, 3, 3], [1, 1, 1], [1, 1, 1], 1], {"i": 4551075636, "t": "", "c": null, "e": [["tile_f", "sp", [-1, 2, 4, 8]], ["tile_d", "sp", [-1, 2, 1, 2]], ["tile_y", "sp", [-1, 2, 5, 2]], ["tile_x", "sp", [-1, 2, 4, 5]], ["tile_rc", "sp", [-1, 1]], ["tile_rd", "sp", [-1, 3]], ["tile_ry", "sp", [-1, 3]], ["tile_rx", "sp", [-1, 3]], ["auto_unroll_max_step", "ot", 512], ["unroll_explicit", "ot", 0]]}], "r": [[0.1887330285], 0, 6.3180811405181885, 1575003443.445914], "v": 0.1}
{"i": ["cuda", "schedule_direct_3d_cuda", [[1, 64, 40, 40, 40], [64, 64, 3, 3, 3], [1, 1, 1], [1, 1, 1], 1], {}, ["schedule_direct_3d_cuda", [1, 64, 40, 40, 40], [64, 64, 3, 3, 3], [1, 1, 1], [1, 1, 1], 1], {"i": 3346338320, "t": "", "c": null, "e": [["tile_f", "sp", [-1, 1, 1, 32]], ["tile_d", "sp", [-1, 1, 1, 1]], ["tile_y", "sp", [-1, 1, 20, 2]], ["tile_x", "sp", [-1, 1, 4, 5]], ["tile_rc", "sp", [-1, 1]], ["tile_rd", "sp", [-1, 3]], ["tile_ry", "sp", [-1, 3]], ["tile_rx", "sp", [-1, 1]], ["auto_unroll_max_step", "ot", 512], ["unroll_explicit", "ot", 0]]}], "r": [[0.0450091595], 0, 2.4666965007781982, 1575003463.3833175], "v": 0.1}
{"i": ["cuda", "schedule_direct_3d_cuda", [[1, 64, 40, 40, 40], [64, 64, 3, 3, 3], [1, 1, 1], [1, 1, 1], 1], {}, ["schedule_direct_3d_cuda", [1, 64, 40, 40, 40], [64, 64, 3, 3, 3], [1, 1, 1], [1, 1, 1], 1], {"i": 45313051, "t": "", "c": null, "e": [["tile_f", "sp", [-1, 1, 2, 1]], ["tile_d", "sp", [-1, 2, 1, 1]], ["tile_y", "sp", [-1, 5, 8, 1]], ["tile_x", "sp", [-1, 8, 1, 1]], ["tile_rc", "sp", [-1, 2]], ["tile_rd", "sp", [-1, 1]], ["tile_ry", "sp", [-1, 1]], ["tile_rx", "sp", [-1, 1]], ["auto_unroll_max_step", "ot", 0], ["unroll_explicit", "ot", 0]]}], "r": [[0.12040445725], 0, 2.584636926651001, 1575003543.9841268], "v": 0.1}
{"i": ["cuda", "schedule_direct_3d_cuda", [[1, 64, 40, 40, 40], [64, 64, 3, 3, 3], [1, 1, 1], [1, 1, 1], 1], {}, ["schedule_direct_3d_cuda", [1, 64, 40, 40, 40], [64, 64, 3, 3, 3], [1, 1, 1], [1, 1, 1], 1], {"i": 11241428583, "t": "", "c": null, "e": [["tile_f", "sp", [-1, 1, 16, 4]], ["tile_d", "sp", [-1, 5, 1, 4]], ["tile_y", "sp", [-1, 2, 1, 2]], ["tile_x", "sp", [-1, 1, 1, 2]], ["tile_rc", "sp", [-1, 4]], ["tile_rd", "sp", [-1, 3]], ["tile_ry", "sp", [-1, 1]], ["tile_rx", "sp", [-1, 3]], ["auto_unroll_max_step", "ot", 512], ["unroll_explicit", "ot", 1]]}], "r": [[0.2275560045], 0, 5.5454630851745605, 1575003550.2077868], "v": 0.1}
{"i": ["cuda", "schedule_direct_3d_cuda", [[1, 64, 40, 40, 40], [64, 64, 3, 3, 3], [1, 1, 1], [1, 1, 1], 1], {}, ["schedule_direct_3d_cuda", [1, 64, 40, 40, 40], [64, 64, 3, 3, 3], [1, 1, 1], [1, 1, 1], 1], {"i": 3133041467, "t": "", "c": null, "e": [["tile_f", "sp", [-1, 2, 4, 4]], ["tile_d", "sp", [-1, 4, 1, 2]], ["tile_y", "sp", [-1, 1, 8, 5]], ["tile_x", "sp", [-1, 1, 1, 8]], ["tile_rc", "sp", [-1, 4]], ["tile_rd", "sp", [-1, 1]], ["tile_ry", "sp", [-1, 3]], ["tile_rx", "sp", [-1, 1]], ["auto_unroll_max_step", "ot", 512], ["unroll_explicit", "ot", 0]]}], "r": [[0.203080121], 0, 6.648602724075317, 1575003570.206944], "v": 0.1}
{"i": ["cuda", "schedule_direct_3d_cuda", [[1, 64, 40, 40, 40], [64, 64, 3, 3, 3], [1, 1, 1], [1, 1, 1], 1], {}, ["schedule_direct_3d_cuda", [1, 64, 40, 40, 40], [64, 64, 3, 3, 3], [1, 1, 1], [1, 1, 1], 1], {"i": 511103233, "t": "", "c": null, "e": [["tile_f", "sp", [-1, 1, 32, 1]], ["tile_d", "sp", [-1, 4, 1, 1]], ["tile_y", "sp", [-1, 1, 1, 5]], ["tile_x", "sp", [-1, 1, 1, 10]], ["tile_rc", "sp", [-1, 16]], ["tile_rd", "sp", [-1, 3]], ["tile_ry", "sp", [-1, 1]], ["tile_rx", "sp", [-1, 1]], ["auto_unroll_max_step", "ot", 0], ["unroll_explicit", "ot", 0]]}], "r": [[0.0193287815], 0, 1.9776060581207275, 1575003816.4673758], "v": 0.1}
{"i": ["cuda", "schedule_direct_3d_cuda", [[1, 64, 40, 40, 40], [64, 64, 3, 3, 3], [1, 1, 1], [1, 1, 1], 1], {}, ["schedule_direct_3d_cuda", [1, 64, 40, 40, 40], [64, 64, 3, 3, 3], [1, 1, 1], [1, 1, 1], 1], {"i": 2869433427, "t": "", "c": null, "e": [["tile_f", "sp", [-1, 1, 16, 4]], ["tile_d", "sp", [-1, 2, 1, 1]], ["tile_y", "sp", [-1, 10, 2, 2]], ["tile_x", "sp", [-1, 1, 1, 5]], ["tile_rc", "sp", [-1, 8]], ["tile_rd", "sp", [-1, 3]], ["tile_ry", "sp", [-1, 1]], ["tile_rx", "sp", [-1, 1]], ["auto_unroll_max_step", "ot", 512], ["unroll_explicit", "ot", 0]]}], "r": [[0.1601179085], 0, 4.943390130996704, 1575003822.1744182], "v": 0.1}
{"i": ["cuda", "schedule_direct_3d_cuda", [[1, 64, 40, 40, 40], [64, 64, 3, 3, 3], [1, 1, 1], [1, 1, 1], 1], {}, ["schedule_direct_3d_cuda", [1, 64, 40, 40, 40], [64, 64, 3, 3, 3], [1, 1, 1], [1, 1, 1], 1], {"i": 10114759890, "t": "", "c": null, "e": [["tile_f", "sp", [-1, 1, 8, 1]], ["tile_d", "sp", [-1, 1, 1, 4]], ["tile_y", "sp", [-1, 1, 2, 4]], ["tile_x", "sp", [-1, 1, 4, 1]], ["tile_rc", "sp", [-1, 16]], ["tile_rd", "sp", [-1, 3]], ["tile_ry", "sp", [-1, 1]], ["tile_rx", "sp", [-1, 1]], ["auto_unroll_max_step", "ot", 512], ["unroll_explicit", "ot", 1]]}], "r": [[0.017367322], 0, 1.5868825912475586, 1575004036.2186987], "v": 0.1}
{"i": ["cuda", "schedule_direct_3d_cuda", [[1, 64, 40, 40, 40], [64, 64, 3, 3, 3], [1, 1, 1], [1, 1, 1], 1], {}, ["schedule_direct_3d_cuda", [1, 64, 40, 40, 40], [64, 64, 3, 3, 3], [1, 1, 1], [1, 1, 1], 1], {"i": 12071380564, "t": "", "c": null, "e": [["tile_f", "sp", [-1, 2, 4, 2]], ["tile_d", "sp", [-1, 2, 1, 2]], ["tile_y", "sp", [-1, 5, 4, 1]], ["tile_x", "sp", [-1, 1, 5, 4]], ["tile_rc", "sp", [-1, 1]], ["tile_rd", "sp", [-1, 1]], ["tile_ry", "sp", [-1, 1]], ["tile_rx", "sp", [-1, 1]], ["auto_unroll_max_step", "ot", 1500], ["unroll_explicit", "ot", 1]]}], "r": [[0.08511251725], 0, 5.513005256652832, 1575004064.1353118], "v": 0.1}
{"i": ["cuda", "schedule_direct_3d_cuda", [[1, 64, 40, 40, 40], [64, 64, 3, 3, 3], [1, 1, 1], [1, 1, 1], 1], {}, ["schedule_direct_3d_cuda", [1, 64, 40, 40, 40], [64, 64, 3, 3, 3], [1, 1, 1], [1, 1, 1], 1], {"i": 15469642, "t": "", "c": null, "e": [["tile_f", "sp", [-1, 1, 2, 2]], ["tile_d", "sp", [-1, 4, 1, 1]], ["tile_y", "sp", [-1, 2, 2, 5]], ["tile_x", "sp", [-1, 2, 20, 1]], ["tile_rc", "sp", [-1, 1]], ["tile_rd", "sp", [-1, 1]], ["tile_ry", "sp", [-1, 1]], ["tile_rx", "sp", [-1, 1]], ["auto_unroll_max_step", "ot", 0], ["unroll_explicit", "ot", 0]]}], "r": [[0.02351209983333333], 0, 1.5778229236602783, 1575004070.332253], "v": 0.1}
{"i": ["cuda", "schedule_direct_3d_cuda", [[1, 64, 40, 40, 40], [64, 64, 3, 3, 3], [1, 1, 1], [1, 1, 1], 1], {}, ["schedule_direct_3d_cuda", [1, 64, 40, 40, 40], [64, 64, 3, 3, 3], [1, 1, 1], [1, 1, 1], 1], {"i": 96898239, "t": "", "c": null, "e": [["tile_f", "sp", [-1, 1, 4, 2]], ["tile_d", "sp", [-1, 1, 1, 2]], ["tile_y", "sp", [-1, 2, 5, 1]], ["tile_x", "sp", [-1, 4, 5, 1]], ["tile_rc", "sp", [-1, 4]], ["tile_rd", "sp", [-1, 1]], ["tile_ry", "sp", [-1, 1]], ["tile_rx", "sp", [-1, 1]], ["auto_unroll_max_step", "ot", 0], ["unroll_explicit", "ot", 0]]}], "r": [[0.019304823833333335], 0, 1.4086649417877197, 1575004357.3187358], "v": 0.1}
{"i": ["cuda", "schedule_direct_3d_cuda", [[1, 64, 40, 40, 40], [64, 64, 3, 3, 3], [1, 1, 1], [1, 1, 1], 1], {}, ["schedule_direct_3d_cuda", [1, 64, 40, 40, 40], [64, 64, 3, 3, 3], [1, 1, 1], [1, 1, 1], 1], {"i": 2459619049, "t": "", "c": null, "e": [["tile_f", "sp", [-1, 1, 4, 1]], ["tile_d", "sp", [-1, 4, 1, 5]], ["tile_y", "sp", [-1, 1, 4, 1]], ["tile_x", "sp", [-1, 2, 4, 1]], ["tile_rc", "sp", [-1, 2]], ["tile_rd", "sp", [-1, 1]], ["tile_ry", "sp", [-1, 1]], ["tile_rx", "sp", [-1, 1]], ["auto_unroll_max_step", "ot", 512], ["unroll_explicit", "ot", 0]]}], "r": [[0.063119463], 0, 2.7679433822631836, 1575004359.3964272], "v": 0.1}
{"i": ["cuda", "schedule_direct_3d_cuda", [[1, 64, 40, 40, 40], [64, 64, 3, 3, 3], [1, 1, 1], [1, 1, 1], 1], {}, ["schedule_direct_3d_cuda", [1, 64, 40, 40, 40], [64, 64, 3, 3, 3], [1, 1, 1], [1, 1, 1], 1], {"i": 2421074893, "t": "", "c": null, "e": [["tile_f", "sp", [-1, 1, 4, 1]], ["tile_d", "sp", [-1, 1, 1, 1]], ["tile_y", "sp", [-1, 10, 2, 2]], ["tile_x", "sp", [-1, 5, 8, 1]], ["tile_rc", "sp", [-1, 1]], ["tile_rd", "sp", [-1, 1]], ["tile_ry", "sp", [-1, 1]], ["tile_rx", "sp", [-1, 1]], ["auto_unroll_max_step", "ot", 512], ["unroll_explicit", "ot", 0]]}], "r": [[0.01915328033333333], 0, 2.9661407470703125, 1575004369.4466121], "v": 0.1}
{"i": ["cuda", "schedule_direct_3d_cuda", [[1, 64, 40, 40, 40], [64, 64, 3, 3, 3], [1, 1, 1], [1, 1, 1], 1], {}, ["schedule_direct_3d_cuda", [1, 64, 40, 40, 40], [64, 64, 3, 3, 3], [1, 1, 1], [1, 1, 1], 1], {"i": 2475166950, "t": "", "c": null, "e": [["tile_f", "sp", [-1, 1, 8, 1]], ["tile_d", "sp", [-1, 5, 1, 2]], ["tile_y", "sp", [-1, 1, 2, 1]], ["tile_x", "sp", [-1, 4, 5, 2]], ["tile_rc", "sp", [-1, 2]], ["tile_rd", "sp", [-1, 1]], ["tile_ry", "sp", [-1, 1]], ["tile_rx", "sp", [-1, 1]], ["auto_unroll_max_step", "ot", 512], ["unroll_explicit", "ot", 0]]}], "r": [[0.02687452775], 0, 1.8313474655151367, 1575004371.0174363], "v": 0.1}
{"i": ["cuda", "schedule_direct_3d_cuda", [[1, 64, 40, 40, 40], [64, 64, 3, 3, 3], [1, 1, 1], [1, 1, 1], 1], {}, ["schedule_direct_3d_cuda", [1, 64, 40, 40, 40], [64, 64, 3, 3, 3], [1, 1, 1], [1, 1, 1], 1], {"i": 2505346239, "t": "", "c": null, "e": [["tile_f", "sp", [-1, 1, 4, 2]], ["tile_d", "sp", [-1, 1, 1, 2]], ["tile_y", "sp", [-1, 2, 5, 1]], ["tile_x", "sp", [-1, 4, 5, 1]], ["tile_rc", "sp", [-1, 4]], ["tile_rd", "sp", [-1, 1]], ["tile_ry", "sp", [-1, 1]], ["tile_rx", "sp", [-1, 1]], ["auto_unroll_max_step", "ot", 512], ["unroll_explicit", "ot", 0]]}], "r": [[0.0368326235], 0, 2.254964590072632, 1575004372.470875], "v": 0.1}
{"i": ["cuda", "schedule_direct_3d_cuda", [[1, 64, 40, 40, 40], [64, 64, 3, 3, 3], [1, 1, 1], [1, 1, 1], 1], {}, ["schedule_direct_3d_cuda", [1, 64, 40, 40, 40], [64, 64, 3, 3, 3], [1, 1, 1], [1, 1, 1], 1], {"i": 4868067049, "t": "", "c": null, "e": [["tile_f", "sp", [-1, 1, 4, 1]], ["tile_d", "sp", [-1, 4, 1, 5]], ["tile_y", "sp", [-1, 1, 4, 1]], ["tile_x", "sp", [-1, 2, 4, 1]], ["tile_rc", "sp", [-1, 2]], ["tile_rd", "sp", [-1, 1]], ["tile_ry", "sp", [-1, 1]], ["tile_rx", "sp", [-1, 1]], ["auto_unroll_max_step", "ot", 1500], ["unroll_explicit", "ot", 0]]}], "r": [[0.053270447], 0, 4.514618158340454, 1575004382.4628005], "v": 0.1}
{"i": ["cuda", "schedule_direct_3d_cuda", [[1, 64, 40, 40, 40], [64, 64, 3, 3, 3], [1, 1, 1], [1, 1, 1], 1], {}, ["schedule_direct_3d_cuda", [1, 64, 40, 40, 40], [64, 64, 3, 3, 3], [1, 1, 1], [1, 1, 1], 1], {"i": 4842492746, "t": "", "c": null, "e": [["tile_f", "sp", [-1, 2, 4, 1]], ["tile_d", "sp", [-1, 5, 1, 1]], ["tile_y", "sp", [-1, 2, 1, 4]], ["tile_x", "sp", [-1, 1, 20, 2]], ["tile_rc", "sp", [-1, 1]], ["tile_rd", "sp", [-1, 1]], ["tile_ry", "sp", [-1, 1]], ["tile_rx", "sp", [-1, 1]], ["auto_unroll_max_step", "ot", 1500], ["unroll_explicit", "ot", 0]]}], "r": [[0.08080984325], 0, 3.305912494659424, 1575004385.0506032], "v": 0.1}
{"i": ["cuda", "schedule_direct_3d_cuda", [[1, 64, 40, 40, 40], [64, 64, 3, 3, 3], [1, 1, 1], [1, 1, 1], 1], {}, ["schedule_direct_3d_cuda", [1, 64, 40, 40, 40], [64, 64, 3, 3, 3], [1, 1, 1], [1, 1, 1], 1], {"i": 7282340449, "t": "", "c": null, "e": [["tile_f", "sp", [-1, 1, 4, 1]], ["tile_d", "sp", [-1, 2, 1, 4]], ["tile_y", "sp", [-1, 2, 1, 1]], ["tile_x", "sp", [-1, 4, 10, 1]], ["tile_rc", "sp", [-1, 2]], ["tile_rd", "sp", [-1, 1]], ["tile_ry", "sp", [-1, 1]], ["tile_rx", "sp", [-1, 1]], ["auto_unroll_max_step", "ot", 0], ["unroll_explicit", "ot", 1]]}], "r": [[0.061686533], 0, 1.665210247039795, 1575004387.205039], "v": 0.1}
{"i": ["cuda", "schedule_direct_3d_cuda", [[1, 64, 40, 40, 40], [64, 64, 3, 3, 3], [1, 1, 1], [1, 1, 1], 1], {}, ["schedule_direct_3d_cuda", [1, 64, 40, 40, 40], [64, 64, 3, 3, 3], [1, 1, 1], [1, 1, 1], 1], {"i": 4883614950, "t": "", "c": null, "e": [["tile_f", "sp", [-1, 1, 8, 1]], ["tile_d", "sp", [-1, 5, 1, 2]], ["tile_y", "sp", [-1, 1, 2, 1]], ["tile_x", "sp", [-1, 4, 5, 2]], ["tile_rc", "sp", [-1, 2]], ["tile_rd", "sp", [-1, 1]], ["tile_ry", "sp", [-1, 1]], ["tile_rx", "sp", [-1, 1]], ["auto_unroll_max_step", "ot", 1500], ["unroll_explicit", "ot", 0]]}], "r": [[0.04100920475], 0, 2.8593857288360596, 1575004392.5177934], "v": 0.1}
{"i": ["cuda", "schedule_direct_3d_cuda", [[1, 64, 40, 40, 40], [64, 64, 3, 3, 3], [1, 1, 1], [1, 1, 1], 1], {}, ["schedule_direct_3d_cuda", [1, 64, 40, 40, 40], [64, 64, 3, 3, 3], [1, 1, 1], [1, 1, 1], 1], {"i": 9732179811, "t": "", "c": null, "e": [["tile_f", "sp", [-1, 1, 4, 2]], ["tile_d", "sp", [-1, 5, 1, 1]], ["tile_y", "sp", [-1, 2, 1, 1]], ["tile_x", "sp", [-1, 5, 8, 1]], ["tile_rc", "sp", [-1, 4]], ["tile_rd", "sp", [-1, 1]], ["tile_ry", "sp", [-1, 1]], ["tile_rx", "sp", [-1, 1]], ["auto_unroll_max_step", "ot", 512], ["unroll_explicit", "ot", 1]]}], "r": [[0.08449528575], 0, 3.998729705810547, 1575004395.0088067], "v": 0.1}
{"i": ["cuda", "schedule_direct_3d_cuda", [[1, 64, 40, 40, 40], [64, 64, 3, 3, 3], [1, 1, 1], [1, 1, 1], 1], {}, ["schedule_direct_3d_cuda", [1, 64, 40, 40, 40], [64, 64, 3, 3, 3], [1, 1, 1], [1, 1, 1], 1], {"i": 12093411049, "t": "", "c": null, "e": [["tile_f", "sp", [-1, 1, 4, 1]], ["tile_d", "sp", [-1, 4, 1, 5]], ["tile_y", "sp", [-1, 1, 4, 1]], ["tile_x", "sp", [-1, 2, 4, 1]], ["tile_rc", "sp", [-1, 2]], ["tile_rd", "sp", [-1, 1]], ["tile_ry", "sp", [-1, 1]], ["tile_rx", "sp", [-1, 1]], ["auto_unroll_max_step", "ot", 1500], ["unroll_explicit", "ot", 1]]}], "r": [[0.02516466725], 0, 4.772178649902344, 1575004397.067474], "v": 0.1}
{"i": ["cuda", "schedule_direct_3d_cuda", [[1, 64, 40, 40, 40], [64, 64, 3, 3, 3], [1, 1, 1], [1, 1, 1], 1], {}, ["schedule_direct_3d_cuda", [1, 64, 40, 40, 40], [64, 64, 3, 3, 3], [1, 1, 1], [1, 1, 1], 1], {"i": 12051755538, "t": "", "c": null, "e": [["tile_f", "sp", [-1, 1, 8, 1]], ["tile_d", "sp", [-1, 1, 1, 1]], ["tile_y", "sp", [-1, 1, 10, 4]], ["tile_x", "sp", [-1, 10, 4, 1]], ["tile_rc", "sp", [-1, 1]], ["tile_rd", "sp", [-1, 1]], ["tile_ry", "sp", [-1, 1]], ["tile_rx", "sp", [-1, 1]], ["auto_unroll_max_step", "ot", 1500], ["unroll_explicit", "ot", 1]]}], "r": [[0.03970447975], 0, 3.610435724258423, 1575004398.6781263], "v": 0.1}
{"i": ["cuda", "schedule_direct_3d_cuda", [[1, 64, 40, 40, 40], [64, 64, 3, 3, 3], [1, 1, 1], [1, 1, 1], 1], {}, ["schedule_direct_3d_cuda", [1, 64, 40, 40, 40], [64, 64, 3, 3, 3], [1, 1, 1], [1, 1, 1], 1], {"i": 7538886026, "t": "", "c": null, "e": [["tile_f", "sp", [-1, 2, 4, 1]], ["tile_d", "sp", [-1, 5, 1, 1]], ["tile_y", "sp", [-1, 1, 5, 1]], ["tile_x", "sp", [-1, 5, 8, 1]], ["tile_rc", "sp", [-1, 1]], ["tile_rd", "sp", [-1, 3]], ["tile_ry", "sp", [-1, 1]], ["tile_rx", "sp", [-1, 1]], ["auto_unroll_max_step", "ot", 0], ["unroll_explicit", "ot", 1]]}], "r": [[0.018566897833333335], 0, 1.7647655010223389, 1575004401.2496822], "v": 0.1}
{"i": ["cuda", "schedule_direct_3d_cuda", [[1, 64, 40, 40, 40], [64, 64, 3, 3, 3], [1, 1, 1], [1, 1, 1], 1], {}, ["schedule_direct_3d_cuda", [1, 64, 40, 40, 40], [64, 64, 3, 3, 3], [1, 1, 1], [1, 1, 1], 1], {"i": 12109500750, "t": "", "c": null, "e": [["tile_f", "sp", [-1, 1, 8, 1]], ["tile_d", "sp", [-1, 5, 1, 1]], ["tile_y", "sp", [-1, 2, 2, 1]], ["tile_x", "sp", [-1, 1, 10, 2]], ["tile_rc", "sp", [-1, 2]], ["tile_rd", "sp", [-1, 1]], ["tile_ry", "sp", [-1, 1]], ["tile_rx", "sp", [-1, 1]], ["auto_unroll_max_step", "ot", 1500], ["unroll_explicit", "ot", 1]]}], "r": [[0.021084597833333333], 0, 6.683513879776001, 1575004719.0712287], "v": 0.1}
{"i": ["cuda", "schedule_direct_3d_cuda", [[1, 64, 40, 40, 40], [64, 64, 3, 3, 3], [1, 1, 1], [1, 1, 1], 1], {}, ["schedule_direct_3d_cuda", [1, 64, 40, 40, 40], [64, 64, 3, 3, 3], [1, 1, 1], [1, 1, 1], 1], {"i": 4830584821, "t": "", "c": null, "e": [["tile_f", "sp", [-1, 1, 4, 1]], ["tile_d", "sp", [-1, 4, 1, 1]], ["tile_y", "sp", [-1, 2, 2, 2]], ["tile_x", "sp", [-1, 2, 10, 1]], ["tile_rc", "sp", [-1, 1]], ["tile_rd", "sp", [-1, 1]], ["tile_ry", "sp", [-1, 1]], ["tile_rx", "sp", [-1, 1]], ["auto_unroll_max_step", "ot", 1500], ["unroll_explicit", "ot", 0]]}], "r": [[0.029052563], 0, 4.355018138885498, 1575004720.7267003], "v": 0.1}
{"i": ["cuda", "schedule_direct_3d_cuda", [[1, 64, 40, 40, 40], [64, 64, 3, 3, 3], [1, 1, 1], [1, 1, 1], 1], {}, ["schedule_direct_3d_cuda", [1, 64, 40, 40, 40], [64, 64, 3, 3, 3], [1, 1, 1], [1, 1, 1], 1], {"i": 12055928821, "t": "", "c": null, "e": [["tile_f", "sp", [-1, 1, 4, 1]], ["tile_d", "sp", [-1, 4, 1, 1]], ["tile_y", "sp", [-1, 2, 2, 2]], ["tile_x", "sp", [-1, 2, 10, 1]], ["tile_rc", "sp", [-1, 1]], ["tile_rd", "sp", [-1, 1]], ["tile_ry", "sp", [-1, 1]], ["tile_rx", "sp", [-1, 1]], ["auto_unroll_max_step", "ot", 1500], ["unroll_explicit", "ot", 1]]}], "r": [[0.029109809], 0, 6.4094319343566895, 1575004722.0218263], "v": 0.1}
{"i": ["cuda", "schedule_direct_3d_cuda", [[1, 64, 40, 40, 40], [64, 64, 3, 3, 3], [1, 1, 1], [1, 1, 1], 1], {}, ["schedule_direct_3d_cuda", [1, 64, 40, 40, 40], [64, 64, 3, 3, 3], [1, 1, 1], [1, 1, 1], 1], {"i": 12098748745, "t": "", "c": null, "e": [["tile_f", "sp", [-1, 1, 4, 1]], ["tile_d", "sp", [-1, 5, 1, 1]], ["tile_y", "sp", [-1, 2, 2, 1]], ["tile_x", "sp", [-1, 2, 10, 1]], ["tile_rc", "sp", [-1, 2]], ["tile_rd", "sp", [-1, 1]], ["tile_ry", "sp", [-1, 1]], ["tile_rx", "sp", [-1, 1]], ["auto_unroll_max_step", "ot", 1500], ["unroll_explicit", "ot", 1]]}], "r": [[0.03289288175], 0, 10.219232559204102, 1575004723.5434191], "v": 0.1}
{"i": ["cuda", "schedule_direct_3d_cuda", [[1, 64, 40, 40, 40], [64, 64, 3, 3, 3], [1, 1, 1], [1, 1, 1], 1], {}, ["schedule_direct_3d_cuda", [1, 64, 40, 40, 40], [64, 64, 3, 3, 3], [1, 1, 1], [1, 1, 1], 1], {"i": 4830403381, "t": "", "c": null, "e": [["tile_f", "sp", [-1, 1, 4, 1]], ["tile_d", "sp", [-1, 4, 1, 1]], ["tile_y", "sp", [-1, 4, 2, 1]], ["tile_x", "sp", [-1, 2, 10, 1]], ["tile_rc", "sp", [-1, 1]], ["tile_rd", "sp", [-1, 1]], ["tile_ry", "sp", [-1, 1]], ["tile_rx", "sp", [-1, 1]], ["auto_unroll_max_step", "ot", 1500], ["unroll_explicit", "ot", 0]]}], "r": [[0.02747550175], 0, 4.694796085357666, 1575004725.243347], "v": 0.1}
{"i": ["cuda", "schedule_direct_3d_cuda", [[1, 64, 40, 40, 40], [64, 64, 3, 3, 3], [1, 1, 1], [1, 1, 1], 1], {}, ["schedule_direct_3d_cuda", [1, 64, 40, 40, 40], [64, 64, 3, 3, 3], [1, 1, 1], [1, 1, 1], 1], {"i": 12055747381, "t": "", "c": null, "e": [["tile_f", "sp", [-1, 1, 4, 1]], ["tile_d", "sp", [-1, 4, 1, 1]], ["tile_y", "sp", [-1, 4, 2, 1]], ["tile_x", "sp", [-1, 2, 10, 1]], ["tile_rc", "sp", [-1, 1]], ["tile_rd", "sp", [-1, 1]], ["tile_ry", "sp", [-1, 1]], ["tile_rx", "sp", [-1, 1]], ["auto_unroll_max_step", "ot", 1500], ["unroll_explicit", "ot", 1]]}], "r": [[0.02529701825], 0, 6.231685161590576, 1575004726.5792432], "v": 0.1}
{"i": ["cuda", "schedule_direct_3d_cuda", [[1, 64, 40, 40, 40], [64, 64, 3, 3, 3], [1, 1, 1], [1, 1, 1], 1], {}, ["schedule_direct_3d_cuda", [1, 64, 40, 40, 40], [64, 64, 3, 3, 3], [1, 1, 1], [1, 1, 1], 1], {"i": 13259426893, "t": "", "c": null, "e": [["tile_f", "sp", [-1, 1, 4, 1]], ["tile_d", "sp", [-1, 1, 1, 1]], ["tile_y", "sp", [-1, 2, 2, 1]], ["tile_x", "sp", [-1, 1, 10, 1]], ["tile_rc", "sp", [-1, 1]], ["tile_rd", "sp", [-1, 1]], ["tile_ry", "sp", [-1, 1]], ["tile_rx", "sp", [-1, 3]], ["auto_unroll_max_step", "ot", 1500], ["unroll_explicit", "ot", 1]]}], "r": [[0.0189504895], 0, 1.9926927089691162, 1575004727.5544927], "v": 0.1}
{"i": ["cuda", "schedule_direct_3d_cuda", [[1, 64, 40, 40, 40], [64, 64, 3, 3, 3], [1, 1, 1], [1, 1, 1], 1], {}, ["schedule_direct_3d_cuda", [1, 64, 40, 40, 40], [64, 64, 3, 3, 3], [1, 1, 1], [1, 1, 1], 1], {"i": 6034082893, "t": "", "c": null, "e": [["tile_f", "sp", [-1, 1, 4, 1]], ["tile_d", "sp", [-1, 1, 1, 1]], ["tile_y", "sp", [-1, 2, 2, 1]], ["tile_x", "sp", [-1, 1, 10, 1]], ["tile_rc", "sp", [-1, 1]], ["tile_rd", "sp", [-1, 1]], ["tile_ry", "sp", [-1, 1]], ["tile_rx", "sp", [-1, 3]], ["auto_unroll_max_step", "ot", 1500], ["unroll_explicit", "ot", 0]]}], "r": [[0.019398238666666668], 0, 1.9177229404449463, 1575004728.527944], "v": 0.1}
{"i": ["cuda", "schedule_direct_3d_cuda", [[1, 64, 40, 40, 40], [64, 64, 3, 3, 3], [1, 1, 1], [1, 1, 1], 1], {}, ["schedule_direct_3d_cuda", [1, 64, 40, 40, 40], [64, 64, 3, 3, 3], [1, 1, 1], [1, 1, 1], 1], {"i": 12055196623, "t": "", "c": null, "e": [["tile_f", "sp", [-1, 1, 8, 2]], ["tile_d", "sp", [-1, 10, 1, 1]], ["tile_y", "sp", [-1, 1, 2, 1]], ["tile_x", "sp", [-1, 1, 10, 1]], ["tile_rc", "sp", [-1, 1]], ["tile_rd", "sp", [-1, 1]], ["tile_ry", "sp", [-1, 1]], ["tile_rx", "sp", [-1, 1]], ["auto_unroll_max_step", "ot", 1500], ["unroll_explicit", "ot", 1]]}], "r": [[0.012245933777777778], 0, 4.4081830978393555, 1575004729.6469247], "v": 0.1}
{"i": ["cuda", "schedule_direct_3d_cuda", [[1, 64, 40, 40, 40], [64, 64, 3, 3, 3], [1, 1, 1], [1, 1, 1], 1], {}, ["schedule_direct_3d_cuda", [1, 64, 40, 40, 40], [64, 64, 3, 3, 3], [1, 1, 1], [1, 1, 1], 1], {"i": 4872887083, "t": "", "c": null, "e": [["tile_f", "sp", [-1, 1, 8, 2]], ["tile_d", "sp", [-1, 1, 1, 1]], ["tile_y", "sp", [-1, 10, 2, 1]], ["tile_x", "sp", [-1, 1, 10, 1]], ["tile_rc", "sp", [-1, 2]], ["tile_rd", "sp", [-1, 1]], ["tile_ry", "sp", [-1, 1]], ["tile_rx", "sp", [-1, 1]], ["auto_unroll_max_step", "ot", 1500], ["unroll_explicit", "ot", 0]]}], "r": [[0.008889454307692309], 0, 3.4071707725524902, 1575004731.049556], "v": 0.1}
{"i": ["cuda", "schedule_direct_3d_cuda", [[1, 64, 40, 40, 40], [64, 64, 3, 3, 3], [1, 1, 1], [1, 1, 1], 1], {}, ["schedule_direct_3d_cuda", [1, 64, 40, 40, 40], [64, 64, 3, 3, 3], [1, 1, 1], [1, 1, 1], 1], {"i": 12098231083, "t": "", "c": null, "e": [["tile_f", "sp", [-1, 1, 8, 2]], ["tile_d", "sp", [-1, 1, 1, 1]], ["tile_y", "sp", [-1, 10, 2, 1]], ["tile_x", "sp", [-1, 1, 10, 1]], ["tile_rc", "sp", [-1, 2]], ["tile_rd", "sp", [-1, 1]], ["tile_ry", "sp", [-1, 1]], ["tile_rx", "sp", [-1, 1]], ["auto_unroll_max_step", "ot", 1500], ["unroll_explicit", "ot", 1]]}], "r": [[0.009902986454545454], 0, 5.2705113887786865, 1575004732.230951], "v": 0.1}
{"i": ["cuda", "schedule_direct_3d_cuda", [[1, 64, 40, 40, 40], [64, 64, 3, 3, 3], [1, 1, 1], [1, 1, 1], 1], {}, ["schedule_direct_3d_cuda", [1, 64, 40, 40, 40], [64, 64, 3, 3, 3], [1, 1, 1], [1, 1, 1], 1], {"i": 4872860623, "t": "", "c": null, "e": [["tile_f", "sp", [-1, 1, 8, 2]], ["tile_d", "sp", [-1, 10, 1, 1]], ["tile_y", "sp", [-1, 1, 2, 1]], ["tile_x", "sp", [-1, 1, 10, 1]], ["tile_rc", "sp", [-1, 2]], ["tile_rd", "sp", [-1, 1]], ["tile_ry", "sp", [-1, 1]], ["tile_rx", "sp", [-1, 1]], ["auto_unroll_max_step", "ot", 1500], ["unroll_explicit", "ot", 0]]}], "r": [[0.0104162792], 0, 3.564361095428467, 1575004733.5889552], "v": 0.1}
{"i": ["cuda", "schedule_direct_3d_cuda", [[1, 64, 40, 40, 40], [64, 64, 3, 3, 3], [1, 1, 1], [1, 1, 1], 1], {}, ["schedule_direct_3d_cuda", [1, 64, 40, 40, 40], [64, 64, 3, 3, 3], [1, 1, 1], [1, 1, 1], 1], {"i": 4829852623, "t": "", "c": null, "e": [["tile_f", "sp", [-1, 1, 8, 2]], ["tile_d", "sp", [-1, 10, 1, 1]], ["tile_y", "sp", [-1, 1, 2, 1]], ["tile_x", "sp", [-1, 1, 10, 1]], ["tile_rc", "sp", [-1, 1]], ["tile_rd", "sp", [-1, 1]], ["tile_ry", "sp", [-1, 1]], ["tile_rx", "sp", [-1, 1]], ["auto_unroll_max_step", "ot", 1500], ["unroll_explicit", "ot", 0]]}], "r": [[0.01274809], 0, 2.097865581512451, 1575004738.4939945], "v": 0.1}
{"i": ["cuda", "schedule_direct_3d_cuda", [[1, 64, 40, 40, 40], [64, 64, 3, 3, 3], [1, 1, 1], [1, 1, 1], 1], {}, ["schedule_direct_3d_cuda", [1, 64, 40, 40, 40], [64, 64, 3, 3, 3], [1, 1, 1], [1, 1, 1], 1], {"i": 12098204623, "t": "", "c": null, "e": [["tile_f", "sp", [-1, 1, 8, 2]], ["tile_d", "sp", [-1, 10, 1, 1]], ["tile_y", "sp", [-1, 1, 2, 1]], ["tile_x", "sp", [-1, 1, 10, 1]], ["tile_rc", "sp", [-1, 2]], ["tile_rd", "sp", [-1, 1]], ["tile_ry", "sp", [-1, 1]], ["tile_rx", "sp", [-1, 1]], ["auto_unroll_max_step", "ot", 1500], ["unroll_explicit", "ot", 1]]}], "r": [[0.01096501], 0, 4.5515735149383545, 1575004739.6735518], "v": 0.1}
{"i": ["cuda", "schedule_direct_3d_cuda", [[1, 64, 40, 40, 40], [64, 64, 3, 3, 3], [1, 1, 1], [1, 1, 1], 1], {}, ["schedule_direct_3d_cuda", [1, 64, 40, 40, 40], [64, 64, 3, 3, 3], [1, 1, 1], [1, 1, 1], 1], {"i": 4871784974, "t": "", "c": null, "e": [["tile_f", "sp", [-1, 2, 4, 1]], ["tile_d", "sp", [-1, 1, 1, 1]], ["tile_y", "sp", [-1, 1, 2, 1]], ["tile_x", "sp", [-1, 1, 8, 1]], ["tile_rc", "sp", [-1, 2]], ["tile_rd", "sp", [-1, 1]], ["tile_ry", "sp", [-1, 1]], ["tile_rx", "sp", [-1, 1]], ["auto_unroll_max_step", "ot", 1500], ["unroll_explicit", "ot", 0]]}], "r": [[0.021514983666666668], 0, 1.661517858505249, 1575004740.771634], "v": 0.1}
{"i": ["cuda", "schedule_direct_3d_cuda", [[1, 64, 40, 40, 40], [64, 64, 3, 3, 3], [1, 1, 1], [1, 1, 1], 1], {}, ["schedule_direct_3d_cuda", [1, 64, 40, 40, 40], [64, 64, 3, 3, 3], [1, 1, 1], [1, 1, 1], 1], {"i": 12097128974, "t": "", "c": null, "e": [["tile_f", "sp", [-1, 2, 4, 1]], ["tile_d", "sp", [-1, 1, 1, 1]], ["tile_y", "sp", [-1, 1, 2, 1]], ["tile_x", "sp", [-1, 1, 8, 1]], ["tile_rc", "sp", [-1, 2]], ["tile_rd", "sp", [-1, 1]], ["tile_ry", "sp", [-1, 1]], ["tile_rx", "sp", [-1, 1]], ["auto_unroll_max_step", "ot", 1500], ["unroll_explicit", "ot", 1]]}], "r": [[0.020536453166666666], 0, 2.071248769760132, 1575004741.874413], "v": 0.1}
{"i": ["cuda", "schedule_direct_3d_cuda", [[1, 64, 40, 40, 40], [64, 64, 3, 3, 3], [1, 1, 1], [1, 1, 1], 1], {}, ["schedule_direct_3d_cuda", [1, 64, 40, 40, 40], [64, 64, 3, 3, 3], [1, 1, 1], [1, 1, 1], 1], {"i": 4871787493, "t": "", "c": null, "e": [["tile_f", "sp", [-1, 1, 4, 1]], ["tile_d", "sp", [-1, 1, 1, 2]], ["tile_y", "sp", [-1, 1, 2, 1]], ["tile_x", "sp", [-1, 1, 8, 1]], ["tile_rc", "sp", [-1, 2]], ["tile_rd", "sp", [-1, 1]], ["tile_ry", "sp", [-1, 1]], ["tile_rx", "sp", [-1, 1]], ["auto_unroll_max_step", "ot", 1500], ["unroll_explicit", "ot", 0]]}], "r": [[0.0136161135], 0, 1.7824578285217285, 1575004742.8638182], "v": 0.1}
{"i": ["cuda", "schedule_direct_3d_cuda", [[1, 64, 40, 40, 40], [64, 64, 3, 3, 3], [1, 1, 1], [1, 1, 1], 1], {}, ["schedule_direct_3d_cuda", [1, 64, 40, 40, 40], [64, 64, 3, 3, 3], [1, 1, 1], [1, 1, 1], 1], {"i": 7280232974, "t": "", "c": null, "e": [["tile_f", "sp", [-1, 2, 4, 1]], ["tile_d", "sp", [-1, 1, 1, 1]], ["tile_y", "sp", [-1, 1, 2, 1]], ["tile_x", "sp", [-1, 1, 8, 1]], ["tile_rc", "sp", [-1, 2]], ["tile_rd", "sp", [-1, 1]], ["tile_ry", "sp", [-1, 1]], ["tile_rx", "sp", [-1, 1]], ["auto_unroll_max_step", "ot", 0], ["unroll_explicit", "ot", 1]]}], "r": [[0.0179781195], 0, 1.4942779541015625, 1575004743.797426], "v": 0.1}
{"i": ["cuda", "schedule_direct_3d_cuda", [[1, 64, 40, 40, 40], [64, 64, 3, 3, 3], [1, 1, 1], [1, 1, 1], 1], {}, ["schedule_direct_3d_cuda", [1, 64, 40, 40, 40], [64, 64, 3, 3, 3], [1, 1, 1], [1, 1, 1], 1], {"i": 5143006869, "t": "", "c": null, "e": [["tile_f", "sp", [-1, 8, 8, 1]], ["tile_d", "sp", [-1, 4, 1, 2]], ["tile_y", "sp", [-1, 1, 1, 4]], ["tile_x", "sp", [-1, 2, 10, 2]], ["tile_rc", "sp", [-1, 1]], ["tile_rd", "sp", [-1, 3]], ["tile_ry", "sp", [-1, 1]], ["tile_rx", "sp", [-1, 1]], ["auto_unroll_max_step", "ot", 1500], ["unroll_explicit", "ot", 0]]}], "r": [[0.13998873125], 0, 6.0545055866241455, 1575006410.4706624], "v": 0.1}
{"i": ["cuda", "schedule_direct_3d_cuda", [[1, 64, 40, 40, 40], [64, 64, 3, 3, 3], [1, 1, 1], [1, 1, 1], 1], {}, ["schedule_direct_3d_cuda", [1, 64, 40, 40, 40], [64, 64, 3, 3, 3], [1, 1, 1], [1, 1, 1], 1], {"i": 10549748173, "t": "", "c": null, "e": [["tile_f", "sp", [-1, 1, 4, 1]], ["tile_d", "sp", [-1, 1, 1, 1]], ["tile_y", "sp", [-1, 4, 2, 5]], ["tile_x", "sp", [-1, 5, 8, 1]], ["tile_rc", "sp", [-1, 1]], ["tile_rd", "sp", [-1, 3]], ["tile_ry", "sp", [-1, 3]], ["tile_rx", "sp", [-1, 1]], ["auto_unroll_max_step", "ot", 512], ["unroll_explicit", "ot", 1]]}], "r": [[0.04844422325], 0, 3.2319982051849365, 1575006436.370118], "v": 0.1}
{"i": ["cuda", "schedule_direct_3d_cuda", [[1, 64, 40, 40, 40], [64, 64, 3, 3, 3], [1, 1, 1], [1, 1, 1], 1], {}, ["schedule_direct_3d_cuda", [1, 64, 40, 40, 40], [64, 64, 3, 3, 3], [1, 1, 1], [1, 1, 1], 1], {"i": 19364559, "t": "", "c": null, "e": [["tile_f", "sp", [-1, 1, 4, 2]], ["tile_d", "sp", [-1, 5, 1, 4]], ["tile_y", "sp", [-1, 2, 1, 1]], ["tile_x", "sp", [-1, 1, 2, 2]], ["tile_rc", "sp", [-1, 1]], ["tile_rd", "sp", [-1, 1]], ["tile_ry", "sp", [-1, 1]], ["tile_rx", "sp", [-1, 1]], ["auto_unroll_max_step", "ot", 0], ["unroll_explicit", "ot", 0]]}], "r": [[0.08719974775], 0, 3.3430569171905518, 1575006706.6258435], "v": 0.1}
{"i": ["cuda", "schedule_direct_3d_cuda", [[1, 64, 40, 40, 40], [64, 64, 3, 3, 3], [1, 1, 1], [1, 1, 1], 1], {}, ["schedule_direct_3d_cuda", [1, 64, 40, 40, 40], [64, 64, 3, 3, 3], [1, 1, 1], [1, 1, 1], 1], {"i": 1519293733, "t": "", "c": null, "e": [["tile_f", "sp", [-1, 1, 4, 1]], ["tile_d", "sp", [-1, 1, 1, 2]], ["tile_y", "sp", [-1, 10, 1, 1]], ["tile_x", "sp", [-1, 4, 10, 1]], ["tile_rc", "sp", [-1, 1]], ["tile_rd", "sp", [-1, 3]], ["tile_ry", "sp", [-1, 1]], ["tile_rx", "sp", [-1, 3]], ["auto_unroll_max_step", "ot", 0], ["unroll_explicit", "ot", 0]]}], "r": [[0.0103491335], 0, 2.192671775817871, 1575006717.4161348], "v": 0.1}
{"i": ["cuda", "schedule_direct_3d_cuda", [[1, 64, 40, 40, 40], [64, 64, 3, 3, 3], [1, 1, 1], [1, 1, 1], 1], {}, ["schedule_direct_3d_cuda", [1, 64, 40, 40, 40], [64, 64, 3, 3, 3], [1, 1, 1], [1, 1, 1], 1], {"i": 1519260133, "t": "", "c": null, "e": [["tile_f", "sp", [-1, 1, 4, 1]], ["tile_d", "sp", [-1, 1, 1, 2]], ["tile_y", "sp", [-1, 1, 1, 1]], ["tile_x", "sp", [-1, 4, 10, 1]], ["tile_rc", "sp", [-1, 1]], ["tile_rd", "sp", [-1, 3]], ["tile_ry", "sp", [-1, 1]], ["tile_rx", "sp", [-1, 3]], ["auto_unroll_max_step", "ot", 0], ["unroll_explicit", "ot", 0]]}], "r": [[0.009449357090909091], 0, 1.8717775344848633, 1575006718.30598], "v": 0.1}
{"i": ["cuda", "schedule_direct_3d_cuda", [[1, 64, 40, 40, 40], [64, 64, 3, 3, 3], [1, 1, 1], [1, 1, 1], 1], {}, ["schedule_direct_3d_cuda", [1, 64, 40, 40, 40], [64, 64, 3, 3, 3], [1, 1, 1], [1, 1, 1], 1], {"i": 3623992525, "t": "", "c": null, "e": [["tile_f", "sp", [-1, 1, 4, 1]], ["tile_d", "sp", [-1, 1, 1, 4]], ["tile_y", "sp", [-1, 8, 1, 1]], ["tile_x", "sp", [-1, 8, 5, 1]], ["tile_rc", "sp", [-1, 1]], ["tile_rd", "sp", [-1, 1]], ["tile_ry", "sp", [-1, 1]], ["tile_rx", "sp", [-1, 3]], ["auto_unroll_max_step", "ot", 512], ["unroll_explicit", "ot", 0]]}], "r": [[0.16185218125], 0, 6.089540958404541, 1575006727.0317183], "v": 0.1}
{"i": ["cuda", "schedule_direct_3d_cuda", [[1, 64, 40, 40, 40], [64, 64, 3, 3, 3], [1, 1, 1], [1, 1, 1], 1], {}, ["schedule_direct_3d_cuda", [1, 64, 40, 40, 40], [64, 64, 3, 3, 3], [1, 1, 1], [1, 1, 1], 1], {"i": 6336156133, "t": "", "c": null, "e": [["tile_f", "sp", [-1, 1, 4, 1]], ["tile_d", "sp", [-1, 1, 1, 2]], ["tile_y", "sp", [-1, 1, 1, 1]], ["tile_x", "sp", [-1, 4, 10, 1]], ["tile_rc", "sp", [-1, 1]], ["tile_rd", "sp", [-1, 3]], ["tile_ry", "sp", [-1, 1]], ["tile_rx", "sp", [-1, 3]], ["auto_unroll_max_step", "ot", 1500], ["unroll_explicit", "ot", 0]]}], "r": [[0.009525918181818182], 0, 2.0780460834503174, 1575006728.020611], "v": 0.1}
{"i": ["cuda", "schedule_direct_3d_cuda", [[1, 64, 40, 40, 40], [64, 64, 3, 3, 3], [1, 1, 1], [1, 1, 1], 1], {}, ["schedule_direct_3d_cuda", [1, 64, 40, 40, 40], [64, 64, 3, 3, 3], [1, 1, 1], [1, 1, 1], 1], {"i": 2410657129, "t": "", "c": null, "e": [["tile_f", "sp", [-1, 1, 4, 1]], ["tile_d", "sp", [-1, 4, 1, 5]], ["tile_y", "sp", [-1, 1, 2, 1]], ["tile_x", "sp", [-1, 8, 1, 1]], ["tile_rc", "sp", [-1, 1]], ["tile_rd", "sp", [-1, 1]], ["tile_ry", "sp", [-1, 1]], ["tile_rx", "sp", [-1, 1]], ["auto_unroll_max_step", "ot", 512], ["unroll_explicit", "ot", 0]]}], "r": [[0.13015390075], 0, 4.552083492279053, 1575006731.1975126], "v": 0.1}
{"i": ["cuda", "schedule_direct_3d_cuda", [[1, 64, 40, 40, 40], [64, 64, 3, 3, 3], [1, 1, 1], [1, 1, 1], 1], {}, ["schedule_direct_3d_cuda", [1, 64, 40, 40, 40], [64, 64, 3, 3, 3], [1, 1, 1], [1, 1, 1], 1], {"i": 2425120417, "t": "", "c": null, "e": [["tile_f", "sp", [-1, 1, 4, 1]], ["tile_d", "sp", [-1, 2, 1, 1]], ["tile_y", "sp", [-1, 2, 1, 1]], ["tile_x", "sp", [-1, 2, 1, 2]], ["tile_rc", "sp", [-1, 1]], ["tile_rd", "sp", [-1, 1]], ["tile_ry", "sp", [-1, 1]], ["tile_rx", "sp", [-1, 1]], ["auto_unroll_max_step", "ot", 512], ["unroll_explicit", "ot", 0]]}], "r": [[0.0434528785], 0, 2.0370757579803467, 1575006737.7343276], "v": 0.1}
{"i": ["cuda", "schedule_direct_3d_cuda", [[1, 64, 40, 40, 40], [64, 64, 3, 3, 3], [1, 1, 1], [1, 1, 1], 1], {}, ["schedule_direct_3d_cuda", [1, 64, 40, 40, 40], [64, 64, 3, 3, 3], [1, 1, 1], [1, 1, 1], 1], {"i": 4250272417, "t": "", "c": null, "e": [["tile_f", "sp", [-1, 1, 4, 1]], ["tile_d", "sp", [-1, 2, 1, 1]], ["tile_y", "sp", [-1, 2, 1, 1]], ["tile_x", "sp", [-1, 1, 8, 5]], ["tile_rc", "sp", [-1, 1]], ["tile_rd", "sp", [-1, 1]], ["tile_ry", "sp", [-1, 3]], ["tile_rx", "sp", [-1, 3]], ["auto_unroll_max_step", "ot", 512], ["unroll_explicit", "ot", 0]]}], "r": [[0.008779451625], 0, 1.9967122077941895, 1575006749.050183], "v": 0.1}
{"i": ["cuda", "schedule_direct_3d_cuda", [[1, 64, 40, 40, 40], [64, 64, 3, 3, 3], [1, 1, 1], [1, 1, 1], 1], {}, ["schedule_direct_3d_cuda", [1, 64, 40, 40, 40], [64, 64, 3, 3, 3], [1, 1, 1], [1, 1, 1], 1], {"i": 4833568417, "t": "", "c": null, "e": [["tile_f", "sp", [-1, 1, 4, 1]], ["tile_d", "sp", [-1, 2, 1, 1]], ["tile_y", "sp", [-1, 2, 1, 1]], ["tile_x", "sp", [-1, 2, 1, 2]], ["tile_rc", "sp", [-1, 1]], ["tile_rd", "sp", [-1, 1]], ["tile_ry", "sp", [-1, 1]], ["tile_rx", "sp", [-1, 1]], ["auto_unroll_max_step", "ot", 1500], ["unroll_explicit", "ot", 0]]}], "r": [[0.05304316125], 0, 2.979858160018921, 1575006761.270444], "v": 0.1}
{"i": ["cuda", "schedule_direct_3d_cuda", [[1, 64, 40, 40, 40], [64, 64, 3, 3, 3], [1, 1, 1], [1, 1, 1], 1], {}, ["schedule_direct_3d_cuda", [1, 64, 40, 40, 40], [64, 64, 3, 3, 3], [1, 1, 1], [1, 1, 1], 1], {"i": 8754816097, "t": "", "c": null, "e": [["tile_f", "sp", [-1, 1, 4, 1]], ["tile_d", "sp", [-1, 2, 1, 1]], ["tile_y", "sp", [-1, 1, 1, 1]], ["tile_x", "sp", [-1, 1, 10, 2]], ["tile_rc", "sp", [-1, 1]], ["tile_rd", "sp", [-1, 3]], ["tile_ry", "sp", [-1, 1]], ["tile_rx", "sp", [-1, 3]], ["auto_unroll_max_step", "ot", 0], ["unroll_explicit", "ot", 1]]}], "r": [[0.0105179066], 0, 1.756035566329956, 1575006766.6563964], "v": 0.1}
{"i": ["cuda", "schedule_direct_3d_cuda", [[1, 64, 40, 40, 40], [64, 64, 3, 3, 3], [1, 1, 1], [1, 1, 1], 1], {}, ["schedule_direct_3d_cuda", [1, 64, 40, 40, 40], [64, 64, 3, 3, 3], [1, 1, 1], [1, 1, 1], 1], {"i": 9633850646, "t": "", "c": null, "e": [["tile_f", "sp", [-1, 2, 4, 1]], ["tile_d", "sp", [-1, 2, 1, 5]], ["tile_y", "sp", [-1, 1, 2, 1]], ["tile_x", "sp", [-1, 1, 1, 1]], ["tile_rc", "sp", [-1, 1]], ["tile_rd", "sp", [-1, 1]], ["tile_ry", "sp", [-1, 1]], ["tile_rx", "sp", [-1, 1]], ["auto_unroll_max_step", "ot", 512], ["unroll_explicit", "ot", 1]]}], "r": [[0.0296864385], 0, 2.300485372543335, 1575006767.6304672], "v": 0.1}
{"i": ["cuda", "schedule_direct_3d_cuda", [[1, 64, 40, 40, 40], [64, 64, 3, 3, 3], [1, 1, 1], [1, 1, 1], 1], {}, ["schedule_direct_3d_cuda", [1, 64, 40, 40, 40], [64, 64, 3, 3, 3], [1, 1, 1], [1, 1, 1], 1], {"i": 7244708559, "t": "", "c": null, "e": [["tile_f", "sp", [-1, 1, 4, 2]], ["tile_d", "sp", [-1, 5, 1, 4]], ["tile_y", "sp", [-1, 2, 1, 1]], ["tile_x", "sp", [-1, 1, 2, 2]], ["tile_rc", "sp", [-1, 1]], ["tile_rd", "sp", [-1, 1]], ["tile_ry", "sp", [-1, 1]], ["tile_rx", "sp", [-1, 1]], ["auto_unroll_max_step", "ot", 0], ["unroll_explicit", "ot", 1]]}], "r": [[0.08883485775], 0, 2.862018346786499, 1575006774.7013092], "v": 0.1}
{"i": ["cuda", "schedule_direct_3d_cuda", [[1, 64, 40, 40, 40], [64, 64, 3, 3, 3], [1, 1, 1], [1, 1, 1], 1], {}, ["schedule_direct_3d_cuda", [1, 64, 40, 40, 40], [64, 64, 3, 3, 3], [1, 1, 1], [1, 1, 1], 1], {"i": 2440166670, "t": "", "c": null, "e": [["tile_f", "sp", [-1, 1, 8, 1]], ["tile_d", "sp", [-1, 5, 1, 1]], ["tile_y", "sp", [-1, 1, 1, 1]], ["tile_x", "sp", [-1, 4, 1, 5]], ["tile_rc", "sp", [-1, 1]], ["tile_rd", "sp", [-1, 1]], ["tile_ry", "sp", [-1, 1]], ["tile_rx", "sp", [-1, 1]], ["auto_unroll_max_step", "ot", 512], ["unroll_explicit", "ot", 0]]}], "r": [[0.11917719625], 0, 3.90906023979187, 1575006777.1862285], "v": 0.1}
{"i": ["cuda", "schedule_direct_3d_cuda", [[1, 64, 40, 40, 40], [64, 64, 3, 3, 3], [1, 1, 1], [1, 1, 1], 1], {}, ["schedule_direct_3d_cuda", [1, 64, 40, 40, 40], [64, 64, 3, 3, 3], [1, 1, 1], [1, 1, 1], 1], {"i": 10849332577, "t": "", "c": null, "e": [["tile_f", "sp", [-1, 1, 4, 1]], ["tile_d", "sp", [-1, 2, 1, 1]], ["tile_y", "sp", [-1, 8, 1, 1]], ["tile_x", "sp", [-1, 8, 5, 1]], ["tile_rc", "sp", [-1, 1]], ["tile_rd", "sp", [-1, 1]], ["tile_ry", "sp", [-1, 1]], ["tile_rx", "sp", [-1, 3]], ["auto_unroll_max_step", "ot", 512], ["unroll_explicit", "ot", 1]]}], "r": [[0.0793385995], 0, 4.9447340965271, 1575006796.5744543], "v": 0.1}
{"i": ["cuda", "schedule_direct_3d_cuda", [[1, 64, 40, 40, 40], [64, 64, 3, 3, 3], [1, 1, 1], [1, 1, 1], 1], {}, ["schedule_direct_3d_cuda", [1, 64, 40, 40, 40], [64, 64, 3, 3, 3], [1, 1, 1], [1, 1, 1], 1], {"i": 4818539730, "t": "", "c": null, "e": [["tile_f", "sp", [-1, 1, 8, 1]], ["tile_d", "sp", [-1, 1, 1, 4]], ["tile_y", "sp", [-1, 8, 1, 1]], ["tile_x", "sp", [-1, 5, 1, 1]], ["tile_rc", "sp", [-1, 1]], ["tile_rd", "sp", [-1, 1]], ["tile_ry", "sp", [-1, 1]], ["tile_rx", "sp", [-1, 1]], ["auto_unroll_max_step", "ot", 1500], ["unroll_explicit", "ot", 0]]}], "r": [[0.09038645325], 0, 4.062731981277466, 1575006804.111819], "v": 0.1}
{"i": ["cuda", "schedule_direct_3d_cuda", [[1, 64, 40, 40, 40], [64, 64, 3, 3, 3], [1, 1, 1], [1, 1, 1], 1], {}, ["schedule_direct_3d_cuda", [1, 64, 40, 40, 40], [64, 64, 3, 3, 3], [1, 1, 1], [1, 1, 1], 1], {"i": 11153085733, "t": "", "c": null, "e": [["tile_f", "sp", [-1, 1, 4, 1]], ["tile_d", "sp", [-1, 1, 1, 2]], ["tile_y", "sp", [-1, 10, 1, 1]], ["tile_x", "sp", [-1, 4, 10, 1]], ["tile_rc", "sp", [-1, 1]], ["tile_rd", "sp", [-1, 3]], ["tile_ry", "sp", [-1, 1]], ["tile_rx", "sp", [-1, 3]], ["auto_unroll_max_step", "ot", 512], ["unroll_explicit", "ot", 1]]}], "r": [[0.00882022475], 0, 3.009600877761841, 1575006805.1118739], "v": 0.1}
{"i": ["cuda", "schedule_direct_3d_cuda", [[1, 64, 40, 40, 40], [64, 64, 3, 3, 3], [1, 1, 1], [1, 1, 1], 1], {}, ["schedule_direct_3d_cuda", [1, 64, 40, 40, 40], [64, 64, 3, 3, 3], [1, 1, 1], [1, 1, 1], 1], {"i": 9636001046, "t": "", "c": null, "e": [["tile_f", "sp", [-1, 2, 4, 1]], ["tile_d", "sp", [-1, 2, 1, 5]], ["tile_y", "sp", [-1, 1, 2, 1]], ["tile_x", "sp", [-1, 8, 1, 1]], ["tile_rc", "sp", [-1, 1]], ["tile_rd", "sp", [-1, 1]], ["tile_ry", "sp", [-1, 1]], ["tile_rx", "sp", [-1, 1]], ["auto_unroll_max_step", "ot", 512], ["unroll_explicit", "ot", 1]]}], "r": [[0.15193790125], 0, 4.601258993148804, 1575006807.8722117], "v": 0.1}
{"i": ["cuda", "schedule_direct_3d_cuda", [[1, 64, 40, 40, 40], [64, 64, 3, 3, 3], [1, 1, 1], [1, 1, 1], 1], {}, ["schedule_direct_3d_cuda", [1, 64, 40, 40, 40], [64, 64, 3, 3, 3], [1, 1, 1], [1, 1, 1], 1], {"i": 9943295053, "t": "", "c": null, "e": [["tile_f", "sp", [-1, 1, 4, 1]], ["tile_d", "sp", [-1, 1, 1, 1]], ["tile_y", "sp", [-1, 1, 1, 5]], ["tile_x", "sp", [-1, 2, 4, 1]], ["tile_rc", "sp", [-1, 1]], ["tile_rd", "sp", [-1, 3]], ["tile_ry", "sp", [-1, 1]], ["tile_rx", "sp", [-1, 1]], ["auto_unroll_max_step", "ot", 512], ["unroll_explicit", "ot", 1]]}], "r": [[0.02770153825], 0, 2.8856520652770996, 1575006840.5092578], "v": 0.1}
{"i": ["cuda", "schedule_direct_3d_cuda", [[1, 64, 40, 40, 40], [64, 64, 3, 3, 3], [1, 1, 1], [1, 1, 1], 1], {}, ["schedule_direct_3d_cuda", [1, 64, 40, 40, 40], [64, 64, 3, 3, 3], [1, 1, 1], [1, 1, 1], 1], {"i": 12061600670, "t": "", "c": null, "e": [["tile_f", "sp", [-1, 2, 4, 1]], ["tile_d", "sp", [-1, 8, 1, 1]], ["tile_y", "sp", [-1, 2, 1, 1]], ["tile_x", "sp", [-1, 1, 2, 2]], ["tile_rc", "sp", [-1, 1]], ["tile_rd", "sp", [-1, 1]], ["tile_ry", "sp", [-1, 1]], ["tile_rx", "sp", [-1, 1]], ["auto_unroll_max_step", "ot", 1500], ["unroll_explicit", "ot", 1]]}], "r": [[0.03281974125], 0, 3.577805995941162, 1575006852.3996413], "v": 0.1}
{"i": ["cuda", "schedule_direct_3d_cuda", [[1, 64, 40, 40, 40], [64, 64, 3, 3, 3], [1, 1, 1], [1, 1, 1], 1], {}, ["schedule_direct_3d_cuda", [1, 64, 40, 40, 40], [64, 64, 3, 3, 3], [1, 1, 1], [1, 1, 1], 1], {"i": 13572592334, "t": "", "c": null, "e": [["tile_f", "sp", [-1, 2, 4, 1]], ["tile_d", "sp", [-1, 1, 1, 1]], ["tile_y", "sp", [-1, 10, 1, 4]], ["tile_x", "sp", [-1, 2, 10, 2]], ["tile_rc", "sp", [-1, 1]], ["tile_rd", "sp", [-1, 3]], ["tile_ry", "sp", [-1, 1]], ["tile_rx", "sp", [-1, 3]], ["auto_unroll_max_step", "ot", 1500], ["unroll_explicit", "ot", 1]]}], "r": [[0.05255561875], 0, 6.408757209777832, 1575006859.2637317], "v": 0.1}
{"i": ["cuda", "schedule_direct_3d_cuda", [[1, 64, 40, 40, 40], [64, 64, 3, 3, 3], [1, 1, 1], [1, 1, 1], 1], {}, ["schedule_direct_3d_cuda", [1, 64, 40, 40, 40], [64, 64, 3, 3, 3], [1, 1, 1], [1, 1, 1], 1], {"i": 8754818533, "t": "", "c": null, "e": [["tile_f", "sp", [-1, 1, 4, 1]], ["tile_d", "sp", [-1, 1, 1, 2]], ["tile_y", "sp", [-1, 1, 1, 1]], ["tile_x", "sp", [-1, 1, 10, 2]], ["tile_rc", "sp", [-1, 1]], ["tile_rd", "sp", [-1, 3]], ["tile_ry", "sp", [-1, 1]], ["tile_rx", "sp", [-1, 3]], ["auto_unroll_max_step", "ot", 0], ["unroll_explicit", "ot", 1]]}], "r": [[0.0110481657], 0, 1.9029819965362549, 1575006865.6036532], "v": 0.1}
{"i": ["cuda", "schedule_direct_3d_cuda", [[1, 64, 40, 40, 40], [64, 64, 3, 3, 3], [1, 1, 1], [1, 1, 1], 1], {}, ["schedule_direct_3d_cuda", [1, 64, 40, 40, 40], [64, 64, 3, 3, 3], [1, 1, 1], [1, 1, 1], 1], {"i": 11163479305, "t": "", "c": null, "e": [["tile_f", "sp", [-1, 1, 4, 1]], ["tile_d", "sp", [-1, 5, 1, 1]], ["tile_y", "sp", [-1, 4, 1, 2]], ["tile_x", "sp", [-1, 1, 10, 2]], ["tile_rc", "sp", [-1, 1]], ["tile_rd", "sp", [-1, 3]], ["tile_ry", "sp", [-1, 1]], ["tile_rx", "sp", [-1, 3]], ["auto_unroll_max_step", "ot", 512], ["unroll_explicit", "ot", 1]]}], "r": [[0.014573626142857144], 0, 3.302738904953003, 1575006866.7002597], "v": 0.1}
{"i": ["cuda", "schedule_direct_3d_cuda", [[1, 64, 40, 40, 40], [64, 64, 3, 3, 3], [1, 1, 1], [1, 1, 1], 1], {}, ["schedule_direct_3d_cuda", [1, 64, 40, 40, 40], [64, 64, 3, 3, 3], [1, 1, 1], [1, 1, 1], 1], {"i": 4836276746, "t": "", "c": null, "e": [["tile_f", "sp", [-1, 2, 4, 1]], ["tile_d", "sp", [-1, 5, 1, 1]], ["tile_y", "sp", [-1, 8, 1, 1]], ["tile_x", "sp", [-1, 1, 2, 2]], ["tile_rc", "sp", [-1, 1]], ["tile_rd", "sp", [-1, 1]], ["tile_ry", "sp", [-1, 1]], ["tile_rx", "sp", [-1, 1]], ["auto_unroll_max_step", "ot", 1500], ["unroll_explicit", "ot", 0]]}], "r": [[0.08343260175], 0, 3.9380106925964355, 1575006868.7676497], "v": 0.1}
{"i": ["cuda", "schedule_direct_3d_cuda", [[1, 64, 40, 40, 40], [64, 64, 3, 3, 3], [1, 1, 1], [1, 1, 1], 1], {}, ["schedule_direct_3d_cuda", [1, 64, 40, 40, 40], [64, 64, 3, 3, 3], [1, 1, 1], [1, 1, 1], 1], {"i": 9653156559, "t": "", "c": null, "e": [["tile_f", "sp", [-1, 1, 4, 2]], ["tile_d", "sp", [-1, 5, 1, 4]], ["tile_y", "sp", [-1, 2, 1, 1]], ["tile_x", "sp", [-1, 1, 2, 2]], ["tile_rc", "sp", [-1, 1]], ["tile_rd", "sp", [-1, 1]], ["tile_ry", "sp", [-1, 1]], ["tile_rx", "sp", [-1, 1]], ["auto_unroll_max_step", "ot", 512], ["unroll_explicit", "ot", 1]]}], "r": [[0.17009613425], 0, 4.883370876312256, 1575006872.1522548], "v": 0.1}
{"i": ["cuda", "schedule_direct_3d_cuda", [[1, 64, 40, 40, 40], [64, 64, 3, 3, 3], [1, 1, 1], [1, 1, 1], 1], {}, ["schedule_direct_3d_cuda", [1, 64, 40, 40, 40], [64, 64, 3, 3, 3], [1, 1, 1], [1, 1, 1], 1], {"i": 13561533733, "t": "", "c": null, "e": [["tile_f", "sp", [-1, 1, 4, 1]], ["tile_d", "sp", [-1, 1, 1, 2]], ["tile_y", "sp", [-1, 10, 1, 1]], ["tile_x", "sp", [-1, 4, 10, 1]], ["tile_rc", "sp", [-1, 1]], ["tile_rd", "sp", [-1, 3]], ["tile_ry", "sp", [-1, 1]], ["tile_rx", "sp", [-1, 3]], ["auto_unroll_max_step", "ot", 1500], ["unroll_explicit", "ot", 1]]}], "r": [[0.01591609966666667], 0, 4.303345680236816, 1575006874.01557], "v": 0.1}
{"i": ["cuda", "schedule_direct_3d_cuda", [[1, 64, 40, 40, 40], [64, 64, 3, 3, 3], [1, 1, 1], [1, 1, 1], 1], {}, ["schedule_direct_3d_cuda", [1, 64, 40, 40, 40], [64, 64, 3, 3, 3], [1, 1, 1], [1, 1, 1], 1], {"i": 8754816433, "t": "", "c": null, "e": [["tile_f", "sp", [-1, 1, 4, 1]], ["tile_d", "sp", [-1, 10, 1, 1]], ["tile_y", "sp", [-1, 1, 1, 1]], ["tile_x", "sp", [-1, 1, 10, 2]], ["tile_rc", "sp", [-1, 1]], ["tile_rd", "sp", [-1, 3]], ["tile_ry", "sp", [-1, 1]], ["tile_rx", "sp", [-1, 3]], ["auto_unroll_max_step", "ot", 0], ["unroll_explicit", "ot", 1]]}], "r": [[0.010285014333333333], 0, 1.9767189025878906, 1575006880.3625133], "v": 0.1}
{"i": ["cuda", "schedule_direct_3d_cuda", [[1, 64, 40, 40, 40], [64, 64, 3, 3, 3], [1, 1, 1], [1, 1, 1], 1], {}, ["schedule_direct_3d_cuda", [1, 64, 40, 40, 40], [64, 64, 3, 3, 3], [1, 1, 1], [1, 1, 1], 1], {"i": 8876131930, "t": "", "c": null, "e": [["tile_f", "sp", [-1, 1, 16, 1]], ["tile_d", "sp", [-1, 2, 1, 20]], ["tile_y", "sp", [-1, 1, 2, 4]], ["tile_x", "sp", [-1, 1, 1, 2]], ["tile_rc", "sp", [-1, 8]], ["tile_rd", "sp", [-1, 3]], ["tile_ry", "sp", [-1, 1]], ["tile_rx", "sp", [-1, 3]], ["auto_unroll_max_step", "ot", 0], ["unroll_explicit", "ot", 1]]}], "r": [[0.112483169], 0, 2.7866711616516113, 1575007758.6976142], "v": 0.1}
{"i": ["cuda", "schedule_direct_3d_cuda", [[1, 64, 40, 40, 40], [64, 64, 3, 3, 3], [1, 1, 1], [1, 1, 1], 1], {}, ["schedule_direct_3d_cuda", [1, 64, 40, 40, 40], [64, 64, 3, 3, 3], [1, 1, 1], [1, 1, 1], 1], {"i": 602369903, "t": "", "c": null, "e": [["tile_f", "sp", [-1, 2, 16, 1]], ["tile_d", "sp", [-1, 1, 1, 2]], ["tile_y", "sp", [-1, 5, 2, 2]], ["tile_x", "sp", [-1, 1, 1, 1]], ["tile_rc", "sp", [-1, 1]], ["tile_rd", "sp", [-1, 1]], ["tile_ry", "sp", [-1, 3]], ["tile_rx", "sp", [-1, 1]], ["auto_unroll_max_step", "ot", 0], ["unroll_explicit", "ot", 0]]}], "r": [[0.00540337124], 0, 2.452972650527954, 1575007946.1052454], "v": 0.1}
{"i": ["cuda", "schedule_direct_3d_cuda", [[1, 64, 40, 40, 40], [64, 64, 3, 3, 3], [1, 1, 1], [1, 1, 1], 1], {}, ["schedule_direct_3d_cuda", [1, 64, 40, 40, 40], [64, 64, 3, 3, 3], [1, 1, 1], [1, 1, 1], 1], {"i": 645642255, "t": "", "c": null, "e": [["tile_f", "sp", [-1, 1, 64, 1]], ["tile_d", "sp", [-1, 1, 1, 5]], ["tile_y", "sp", [-1, 2, 1, 20]], ["tile_x", "sp", [-1, 1, 1, 1]], ["tile_rc", "sp", [-1, 2]], ["tile_rd", "sp", [-1, 1]], ["tile_ry", "sp", [-1, 3]], ["tile_rx", "sp", [-1, 1]], ["auto_unroll_max_step", "ot", 0], ["unroll_explicit", "ot", 0]]}], "r": [[0.012988308700000001], 0, 3.387360095977783, 1575007947.9327178], "v": 0.1}
{"i": ["cuda", "schedule_direct_3d_cuda", [[1, 64, 40, 40, 40], [64, 64, 3, 3, 3], [1, 1, 1], [1, 1, 1], 1], {}, ["schedule_direct_3d_cuda", [1, 64, 40, 40, 40], [64, 64, 3, 3, 3], [1, 1, 1], [1, 1, 1], 1], {"i": 1247558785, "t": "", "c": null, "e": [["tile_f", "sp", [-1, 1, 32, 1]], ["tile_d", "sp", [-1, 5, 1, 4]], ["tile_y", "sp", [-1, 1, 1, 4]], ["tile_x", "sp", [-1, 1, 1, 1]], ["tile_rc", "sp", [-1, 2]], ["tile_rd", "sp", [-1, 1]], ["tile_ry", "sp", [-1, 1]], ["tile_rx", "sp", [-1, 3]], ["auto_unroll_max_step", "ot", 0], ["unroll_explicit", "ot", 0]]}], "r": [[0.0101761809], 0, 2.1125736236572266, 1575007948.996608], "v": 0.1}
{"i": ["cuda", "schedule_direct_3d_cuda", [[1, 64, 40, 40, 40], [64, 64, 3, 3, 3], [1, 1, 1], [1, 1, 1], 1], {}, ["schedule_direct_3d_cuda", [1, 64, 40, 40, 40], [64, 64, 3, 3, 3], [1, 1, 1], [1, 1, 1], 1], {"i": 688650255, "t": "", "c": null, "e": [["tile_f", "sp", [-1, 1, 64, 1]], ["tile_d", "sp", [-1, 1, 1, 5]], ["tile_y", "sp", [-1, 2, 1, 20]], ["tile_x", "sp", [-1, 1, 1, 1]], ["tile_rc", "sp", [-1, 4]], ["tile_rd", "sp", [-1, 1]], ["tile_ry", "sp", [-1, 3]], ["tile_rx", "sp", [-1, 1]], ["auto_unroll_max_step", "ot", 0], ["unroll_explicit", "ot", 0]]}], "r": [[0.00523524125], 0, 3.2626049518585205, 1575007950.535387], "v": 0.1}
{"i": ["cuda", "schedule_direct_3d_cuda", [[1, 64, 40, 40, 40], [64, 64, 3, 3, 3], [1, 1, 1], [1, 1, 1], 1], {}, ["schedule_direct_3d_cuda", [1, 64, 40, 40, 40], [64, 64, 3, 3, 3], [1, 1, 1], [1, 1, 1], 1], {"i": 1204481905, "t": "", "c": null, "e": [["tile_f", "sp", [-1, 1, 32, 1]], ["tile_d", "sp", [-1, 1, 1, 2]], ["tile_y", "sp", [-1, 5, 2, 2]], ["tile_x", "sp", [-1, 1, 1, 1]], ["tile_rc", "sp", [-1, 1]], ["tile_rd", "sp", [-1, 1]], ["tile_ry", "sp", [-1, 1]], ["tile_rx", "sp", [-1, 3]], ["auto_unroll_max_step", "ot", 0], ["unroll_explicit", "ot", 0]]}], "r": [[0.006162389352941176], 0, 1.947411298751831, 1575007951.4697094], "v": 0.1}
{"i": ["cuda", "schedule_direct_3d_cuda", [[1, 64, 40, 40, 40], [64, 64, 3, 3, 3], [1, 1, 1], [1, 1, 1], 1], {}, ["schedule_direct_3d_cuda", [1, 64, 40, 40, 40], [64, 64, 3, 3, 3], [1, 1, 1], [1, 1, 1], 1], {"i": 1591689855, "t": "", "c": null, "e": [["tile_f", "sp", [-1, 1, 16, 4]], ["tile_d", "sp", [-1, 1, 1, 4]], ["tile_y", "sp", [-1, 2, 1, 5]], ["tile_x", "sp", [-1, 1, 1, 1]], ["tile_rc", "sp", [-1, 4]], ["tile_rd", "sp", [-1, 3]], ["tile_ry", "sp", [-1, 1]], ["tile_rx", "sp", [-1, 3]], ["auto_unroll_max_step", "ot", 0], ["unroll_explicit", "ot", 0]]}], "r": [[0.0108665634], 0, 2.371748447418213, 1575007952.674129], "v": 0.1}
{"i": ["cuda", "schedule_direct_3d_cuda", [[1, 64, 40, 40, 40], [64, 64, 3, 3, 3], [1, 1, 1], [1, 1, 1], 1], {}, ["schedule_direct_3d_cuda", [1, 64, 40, 40, 40], [64, 64, 3, 3, 3], [1, 1, 1], [1, 1, 1], 1], {"i": 1849673053, "t": "", "c": null, "e": [["tile_f", "sp", [-1, 1, 32, 1]], ["tile_d", "sp", [-1, 2, 1, 20]], ["tile_y", "sp", [-1, 1, 1, 4]], ["tile_x", "sp", [-1, 1, 1, 1]], ["tile_rc", "sp", [-1, 2]], ["tile_rd", "sp", [-1, 1]], ["tile_ry", "sp", [-1, 3]], ["tile_rx", "sp", [-1, 3]], ["auto_unroll_max_step", "ot", 0], ["unroll_explicit", "ot", 0]]}], "r": [[0.03271816725], 0, 3.1828501224517822, 1575007954.2662039], "v": 0.1}
{"i": ["cuda", "schedule_direct_3d_cuda", [[1, 64, 40, 40, 40], [64, 64, 3, 3, 3], [1, 1, 1], [1, 1, 1], 1], {}, ["schedule_direct_3d_cuda", [1, 64, 40, 40, 40], [64, 64, 3, 3, 3], [1, 1, 1], [1, 1, 1], 1], {"i": 1892874255, "t": "", "c": null, "e": [["tile_f", "sp", [-1, 1, 64, 1]], ["tile_d", "sp", [-1, 1, 1, 5]], ["tile_y", "sp", [-1, 2, 1, 20]], ["tile_x", "sp", [-1, 1, 1, 1]], ["tile_rc", "sp", [-1, 4]], ["tile_rd", "sp", [-1, 1]], ["tile_ry", "sp", [-1, 3]], ["tile_rx", "sp", [-1, 3]], ["auto_unroll_max_step", "ot", 0], ["unroll_explicit", "ot", 0]]}], "r": [[0.025507944], 0, 2.995173692703247, 1575007955.57814], "v": 0.1}
{"i": ["cuda", "schedule_direct_3d_cuda", [[1, 64, 40, 40, 40], [64, 64, 3, 3, 3], [1, 1, 1], [1, 1, 1], 1], {}, ["schedule_direct_3d_cuda", [1, 64, 40, 40, 40], [64, 64, 3, 3, 3], [1, 1, 1], [1, 1, 1], 1], {"i": 2510596055, "t": "", "c": null, "e": [["tile_f", "sp", [-1, 2, 16, 1]], ["tile_d", "sp", [-1, 1, 1, 4]], ["tile_y", "sp", [-1, 1, 1, 1]], ["tile_x", "sp", [-1, 1, 1, 2]], ["tile_rc", "sp", [-1, 4]], ["tile_rd", "sp", [-1, 1]], ["tile_ry", "sp", [-1, 1]], ["tile_rx", "sp", [-1, 1]], ["auto_unroll_max_step", "ot", 512], ["unroll_explicit", "ot", 0]]}], "r": [[0.02196801716666667], 0, 2.574647903442383, 1575007956.7614913], "v": 0.1}
{"i": ["cuda", "schedule_direct_3d_cuda", [[1, 64, 40, 40, 40], [64, 64, 3, 3, 3], [1, 1, 1], [1, 1, 1], 1], {}, ["schedule_direct_3d_cuda", [1, 64, 40, 40, 40], [64, 64, 3, 3, 3], [1, 1, 1], [1, 1, 1], 1], {"i": 3612681265, "t": "", "c": null, "e": [["tile_f", "sp", [-1, 1, 32, 1]], ["tile_d", "sp", [-1, 1, 1, 2]], ["tile_y", "sp", [-1, 2, 1, 1]], ["tile_x", "sp", [-1, 1, 1, 1]], ["tile_rc", "sp", [-1, 1]], ["tile_rd", "sp", [-1, 1]], ["tile_ry", "sp", [-1, 1]], ["tile_rx", "sp", [-1, 3]], ["auto_unroll_max_step", "ot", 512], ["unroll_explicit", "ot", 0]]}], "r": [[0.018464729], 0, 2.2673678398132324, 1575007957.7650883], "v": 0.1}
