fast3d/second_layer_weight_grad_custom.log
{"i": ["cuda", "schedule_conv3d_nchw_cuda", [[64, 1, 40, 40, 40], [64, 1, 40, 40, 40], [1, 1, 1], [1, 1, 1], [1, 1, 1], 1], {}, ["schedule_conv3d_nchw_cuda", [64, 1, 40, 40, 40], [64, 1, 40, 40, 40], [1, 1, 1], [1, 1, 1], [1, 1, 1], 1], {"i": 2557094583, "t": "", "c": null, "e": [["tile_n", "sp", [-1, 4, 4, 1]], ["tile_f", "sp", [-1, 4, 1, 1]], ["tile_d", "sp", [-1, 1, 1, 1]], ["tile_y", "sp", [-1, 1, 1, 1]], ["tile_x", "sp", [-1, 1, 3, 1]], ["tile_rc", "sp", [-1, 1]], ["tile_rd", "sp", [-1, 20]], ["tile_ry", "sp", [-1, 5]], ["tile_rx", "sp", [-1, 1]], ["auto_unroll_max_step", "ot", 1500], ["unroll_explicit", "ot", 1], ["fuse_yx", "ot", 1]]}], "r": [[0.1131278655], 0, 5.641833543777466, 1577696139.4757135], "v": 0.1}
{"i": ["cuda", "schedule_conv3d_nchw_cuda", [[64, 1, 40, 40, 40], [64, 1, 40, 40, 40], [1, 1, 1], [1, 1, 1], [1, 1, 1], 1], {}, ["schedule_conv3d_nchw_cuda", [64, 1, 40, 40, 40], [64, 1, 40, 40, 40], [1, 1, 1], [1, 1, 1], [1, 1, 1], 1], {"i": 2153395425, "t": "", "c": null, "e": [["tile_n", "sp", [-1, 2, 2, 8]], ["tile_f", "sp", [-1, 2, 2, 2]], ["tile_d", "sp", [-1, 1, 3, 1]], ["tile_y", "sp", [-1, 1, 1, 1]], ["tile_x", "sp", [-1, 1, 3, 1]], ["tile_rc", "sp", [-1, 1]], ["tile_rd", "sp", [-1, 1]], ["tile_ry", "sp", [-1, 8]], ["tile_rx", "sp", [-1, 4]], ["auto_unroll_max_step", "ot", 0], ["unroll_explicit", "ot", 1], ["fuse_yx", "ot", 1]]}], "r": [[0.08585332925], 0, 1.9641966819763184, 1577696151.6480832], "v": 0.1}
{"i": ["cuda", "schedule_conv3d_nchw_cuda", [[64, 1, 40, 40, 40], [64, 1, 40, 40, 40], [1, 1, 1], [1, 1, 1], [1, 1, 1], 1], {}, ["schedule_conv3d_nchw_cuda", [64, 1, 40, 40, 40], [64, 1, 40, 40, 40], [1, 1, 1], [1, 1, 1], [1, 1, 1], 1], {"i": 404907275, "t": "", "c": null, "e": [["tile_n", "sp", [-1, 2, 4, 4]], ["tile_f", "sp", [-1, 1, 2, 8]], ["tile_d", "sp", [-1, 1, 1, 1]], ["tile_y", "sp", [-1, 1, 3, 1]], ["tile_x", "sp", [-1, 1, 3, 1]], ["tile_rc", "sp", [-1, 1]], ["tile_rd", "sp", [-1, 1]], ["tile_ry", "sp", [-1, 1]], ["tile_rx", "sp", [-1, 20]], ["auto_unroll_max_step", "ot", 512], ["unroll_explicit", "ot", 0], ["fuse_yx", "ot", 0]]}], "r": [[0.02942377825], 0, 1.3874707221984863, 1577696170.3114848], "v": 0.1}
{"i": ["cuda", "schedule_conv3d_nchw_cuda", [[64, 1, 40, 40, 40], [64, 1, 40, 40, 40], [1, 1, 1], [1, 1, 1], [1, 1, 1], 1], {}, ["schedule_conv3d_nchw_cuda", [64, 1, 40, 40, 40], [64, 1, 40, 40, 40], [1, 1, 1], [1, 1, 1], [1, 1, 1], 1], {"i": 1055031181, "t": "", "c": null, "e": [["tile_n", "sp", [-1, 2, 1, 1]], ["tile_f", "sp", [-1, 2, 16, 2]], ["tile_d", "sp", [-1, 1, 3, 1]], ["tile_y", "sp", [-1, 1, 1, 1]], ["tile_x", "sp", [-1, 3, 1, 1]], ["tile_rc", "sp", [-1, 1]], ["tile_rd", "sp", [-1, 1]], ["tile_ry", "sp", [-1, 8]], ["tile_rx", "sp", [-1, 8]], ["auto_unroll_max_step", "ot", 512], ["unroll_explicit", "ot", 1], ["fuse_yx", "ot", 0]]}], "r": [[0.00709698], 0, 1.1603529453277588, 1577696172.079085], "v": 0.1}
{"i": ["cuda", "schedule_conv3d_nchw_cuda", [[64, 1, 40, 40, 40], [64, 1, 40, 40, 40], [1, 1, 1], [1, 1, 1], [1, 1, 1], 1], {}, ["schedule_conv3d_nchw_cuda", [64, 1, 40, 40, 40], [64, 1, 40, 40, 40], [1, 1, 1], [1, 1, 1], [1, 1, 1], 1], {"i": 870917259, "t": "", "c": null, "e": [["tile_n", "sp", [-1, 4, 1, 4]], ["tile_f", "sp", [-1, 2, 32, 1]], ["tile_d", "sp", [-1, 3, 1, 1]], ["tile_y", "sp", [-1, 3, 1, 1]], ["tile_x", "sp", [-1, 1, 3, 1]], ["tile_rc", "sp", [-1, 1]], ["tile_rd", "sp", [-1, 1]], ["tile_ry", "sp", [-1, 2]], ["tile_rx", "sp", [-1, 20]], ["auto_unroll_max_step", "ot", 0], ["unroll_explicit", "ot", 1], ["fuse_yx", "ot", 0]]}], "r": [[0.22307061125], 0, 4.227275609970093, 1577696175.8102033], "v": 0.1}
{"i": ["cuda", "schedule_conv3d_nchw_cuda", [[64, 1, 40, 40, 40], [64, 1, 40, 40, 40], [1, 1, 1], [1, 1, 1], [1, 1, 1], 1], {}, ["schedule_conv3d_nchw_cuda", [64, 1, 40, 40, 40], [64, 1, 40, 40, 40], [1, 1, 1], [1, 1, 1], [1, 1, 1], 1], {"i": 14734051, "t": "", "c": null, "e": [["tile_n", "sp", [-1, 8, 1, 2]], ["tile_f", "sp", [-1, 1, 4, 1]], ["tile_d", "sp", [-1, 1, 1, 1]], ["tile_y", "sp", [-1, 1, 3, 1]], ["tile_x", "sp", [-1, 1, 3, 1]], ["tile_rc", "sp", [-1, 1]], ["tile_rd", "sp", [-1, 1]], ["tile_ry", "sp", [-1, 8]], ["tile_rx", "sp", [-1, 1]], ["auto_unroll_max_step", "ot", 0], ["unroll_explicit", "ot", 0], ["fuse_yx", "ot", 0]]}], "r": [[0.052587329], 0, 1.6200249195098877, 1577696281.4506075], "v": 0.1}
{"i": ["cuda", "schedule_conv3d_nchw_cuda", [[64, 1, 40, 40, 40], [64, 1, 40, 40, 40], [1, 1, 1], [1, 1, 1], [1, 1, 1], 1], {}, ["schedule_conv3d_nchw_cuda", [64, 1, 40, 40, 40], [64, 1, 40, 40, 40], [1, 1, 1], [1, 1, 1], [1, 1, 1], 1], {"i": 14734071, "t": "", "c": null, "e": [["tile_n", "sp", [-1, 4, 1, 4]], ["tile_f", "sp", [-1, 1, 4, 1]], ["tile_d", "sp", [-1, 1, 1, 1]], ["tile_y", "sp", [-1, 1, 3, 1]], ["tile_x", "sp", [-1, 1, 3, 1]], ["tile_rc", "sp", [-1, 1]], ["tile_rd", "sp", [-1, 1]], ["tile_ry", "sp", [-1, 8]], ["tile_rx", "sp", [-1, 1]], ["auto_unroll_max_step", "ot", 0], ["unroll_explicit", "ot", 0], ["fuse_yx", "ot", 0]]}], "r": [[0.05027329275], 0, 1.5066282749176025, 1577696282.5613818], "v": 0.1}
{"i": ["cuda", "schedule_conv3d_nchw_cuda", [[64, 1, 40, 40, 40], [64, 1, 40, 40, 40], [1, 1, 1], [1, 1, 1], [1, 1, 1], 1], {}, ["schedule_conv3d_nchw_cuda", [64, 1, 40, 40, 40], [64, 1, 40, 40, 40], [1, 1, 1], [1, 1, 1], [1, 1, 1], 1], {"i": 57986993, "t": "", "c": null, "e": [["tile_n", "sp", [-1, 2, 1, 2]], ["tile_f", "sp", [-1, 4, 2, 1]], ["tile_d", "sp", [-1, 1, 3, 1]], ["tile_y", "sp", [-1, 1, 3, 1]], ["tile_x", "sp", [-1, 3, 1, 1]], ["tile_rc", "sp", [-1, 1]], ["tile_rd", "sp", [-1, 1]], ["tile_ry", "sp", [-1, 1]], ["tile_rx", "sp", [-1, 4]], ["auto_unroll_max_step", "ot", 0], ["unroll_explicit", "ot", 0], ["fuse_yx", "ot", 0]]}], "r": [[0.01055154425], 0, 1.1094589233398438, 1577696288.5021195], "v": 0.1}
{"i": ["cuda", "schedule_conv3d_nchw_cuda", [[64, 1, 40, 40, 40], [64, 1, 40, 40, 40], [1, 1, 1], [1, 1, 1], [1, 1, 1], 1], {}, ["schedule_conv3d_nchw_cuda", [64, 1, 40, 40, 40], [64, 1, 40, 40, 40], [1, 1, 1], [1, 1, 1], [1, 1, 1], 1], {"i": 245733697, "t": "", "c": null, "e": [["tile_n", "sp", [-1, 1, 4, 1]], ["tile_f", "sp", [-1, 16, 4, 1]], ["tile_d", "sp", [-1, 1, 3, 1]], ["tile_y", "sp", [-1, 1, 3, 1]], ["tile_x", "sp", [-1, 1, 1, 1]], ["tile_rc", "sp", [-1, 1]], ["tile_rd", "sp", [-1, 1]], ["tile_ry", "sp", [-1, 8]], ["tile_rx", "sp", [-1, 1]], ["auto_unroll_max_step", "ot", 512], ["unroll_explicit", "ot", 0], ["fuse_yx", "ot", 0]]}], "r": [[0.01026383225], 0, 1.0682852268218994, 1577696289.1573167], "v": 0.1}
{"i": ["cuda", "schedule_conv3d_nchw_cuda", [[64, 1, 40, 40, 40], [64, 1, 40, 40, 40], [1, 1, 1], [1, 1, 1], [1, 1, 1], 1], {}, ["schedule_conv3d_nchw_cuda", [64, 1, 40, 40, 40], [64, 1, 40, 40, 40], [1, 1, 1], [1, 1, 1], [1, 1, 1], 1], {"i": 238608403, "t": "", "c": null, "e": [["tile_n", "sp", [-1, 2, 8, 1]], ["tile_f", "sp", [-1, 16, 1, 2]], ["tile_d", "sp", [-1, 1, 1, 1]], ["tile_y", "sp", [-1, 1, 3, 1]], ["tile_x", "sp", [-1, 3, 1, 1]], ["tile_rc", "sp", [-1, 1]], ["tile_rd", "sp", [-1, 1]], ["tile_ry", "sp", [-1, 4]], ["tile_rx", "sp", [-1, 1]], ["auto_unroll_max_step", "ot", 512], ["unroll_explicit", "ot", 0], ["fuse_yx", "ot", 0]]}], "r": [[0.0510258015], 0, 1.9256401062011719, 1577696290.451378], "v": 0.1}
{"i": ["cuda", "schedule_conv3d_nchw_cuda", [[64, 1, 40, 40, 40], [64, 1, 40, 40, 40], [1, 1, 1], [1, 1, 1], [1, 1, 1], 1], {}, ["schedule_conv3d_nchw_cuda", [64, 1, 40, 40, 40], [64, 1, 40, 40, 40], [1, 1, 1], [1, 1, 1], [1, 1, 1], 1], {"i": 581876250, "t": "", "c": null, "e": [["tile_n", "sp", [-1, 1, 8, 1]], ["tile_f", "sp", [-1, 16, 2, 2]], ["tile_d", "sp", [-1, 3, 1, 1]], ["tile_y", "sp", [-1, 1, 1, 1]], ["tile_x", "sp", [-1, 1, 3, 1]], ["tile_rc", "sp", [-1, 1]], ["tile_rd", "sp", [-1, 1]], ["tile_ry", "sp", [-1, 2]], ["tile_rx", "sp", [-1, 8]], ["auto_unroll_max_step", "ot", 1500], ["unroll_explicit", "ot", 0], ["fuse_yx", "ot", 0]]}], "r": [[0.01957103875], 0, 1.4636173248291016, 1577696291.3132727], "v": 0.1}
{"i": ["cuda", "schedule_conv3d_nchw_cuda", [[64, 1, 40, 40, 40], [64, 1, 40, 40, 40], [1, 1, 1], [1, 1, 1], [1, 1, 1], 1], {}, ["schedule_conv3d_nchw_cuda", [64, 1, 40, 40, 40], [64, 1, 40, 40, 40], [1, 1, 1], [1, 1, 1], [1, 1, 1], 1], {"i": 1874994283, "t": "", "c": null, "e": [["tile_n", "sp", [-1, 1, 8, 2]], ["tile_f", "sp", [-1, 2, 4, 2]], ["tile_d", "sp", [-1, 1, 3, 1]], ["tile_y", "sp", [-1, 1, 1, 1]], ["tile_x", "sp", [-1, 1, 1, 1]], ["tile_rc", "sp", [-1, 1]], ["tile_rd", "sp", [-1, 1]], ["tile_ry", "sp", [-1, 40]], ["tile_rx", "sp", [-1, 1]], ["auto_unroll_max_step", "ot", 1500], ["unroll_explicit", "ot", 0], ["fuse_yx", "ot", 1]]}], "r": [[0.01431776625], 0, 1.3003578186035156, 1577696292.1432803], "v": 0.1}
{"i": ["cuda", "schedule_conv3d_nchw_cuda", [[64, 1, 40, 40, 40], [64, 1, 40, 40, 40], [1, 1, 1], [1, 1, 1], [1, 1, 1], 1], {}, ["schedule_conv3d_nchw_cuda", [64, 1, 40, 40, 40], [64, 1, 40, 40, 40], [1, 1, 1], [1, 1, 1], [1, 1, 1], 1], {"i": 260338436, "t": "", "c": null, "e": [["tile_n", "sp", [-1, 2, 2, 1]], ["tile_f", "sp", [-1, 8, 1, 1]], ["tile_d", "sp", [-1, 1, 1, 1]], ["tile_y", "sp", [-1, 1, 1, 1]], ["tile_x", "sp", [-1, 1, 3, 1]], ["tile_rc", "sp", [-1, 1]], ["tile_rd", "sp", [-1, 1]], ["tile_ry", "sp", [-1, 1]], ["tile_rx", "sp", [-1, 2]], ["auto_unroll_max_step", "ot", 512], ["unroll_explicit", "ot", 0], ["fuse_yx", "ot", 0]]}], "r": [[0.044081709], 0, 1.3811967372894287, 1577696293.1490662], "v": 0.1}
{"i": ["cuda", "schedule_conv3d_nchw_cuda", [[64, 1, 40, 40, 40], [64, 1, 40, 40, 40], [1, 1, 1], [1, 1, 1], [1, 1, 1], 1], {}, ["schedule_conv3d_nchw_cuda", [64, 1, 40, 40, 40], [64, 1, 40, 40, 40], [1, 1, 1], [1, 1, 1], [1, 1, 1], 1], {"i": 491613478, "t": "", "c": null, "e": [["tile_n", "sp", [-1, 1, 2, 2]], ["tile_f", "sp", [-1, 4, 2, 1]], ["tile_d", "sp", [-1, 3, 1, 1]], ["tile_y", "sp", [-1, 1, 3, 1]], ["tile_x", "sp", [-1, 1, 3, 1]], ["tile_rc", "sp", [-1, 1]], ["tile_rd", "sp", [-1, 1]], ["tile_ry", "sp", [-1, 1]], ["tile_rx", "sp", [-1, 2]], ["auto_unroll_max_step", "ot", 1500], ["unroll_explicit", "ot", 0], ["fuse_yx", "ot", 0]]}], "r": [[0.01403468925], 0, 1.192591667175293, 1577696293.9244797], "v": 0.1}
{"i": ["cuda", "schedule_conv3d_nchw_cuda", [[64, 1, 40, 40, 40], [64, 1, 40, 40, 40], [1, 1, 1], [1, 1, 1], [1, 1, 1], 1], {}, ["schedule_conv3d_nchw_cuda", [64, 1, 40, 40, 40], [64, 1, 40, 40, 40], [1, 1, 1], [1, 1, 1], [1, 1, 1], 1], {"i": 296473318, "t": "", "c": null, "e": [["tile_n", "sp", [-1, 1, 16, 1]], ["tile_f", "sp", [-1, 8, 4, 1]], ["tile_d", "sp", [-1, 3, 1, 1]], ["tile_y", "sp", [-1, 1, 1, 1]], ["tile_x", "sp", [-1, 1, 3, 1]], ["tile_rc", "sp", [-1, 1]], ["tile_rd", "sp", [-1, 1]], ["tile_ry", "sp", [-1, 4]], ["tile_rx", "sp", [-1, 4]], ["auto_unroll_max_step", "ot", 512], ["unroll_explicit", "ot", 0], ["fuse_yx", "ot", 0]]}], "r": [[0.00820114025], 0, 1.0736322402954102, 1577696294.5511298], "v": 0.1}
{"i": ["cuda", "schedule_conv3d_nchw_cuda", [[64, 1, 40, 40, 40], [64, 1, 40, 40, 40], [1, 1, 1], [1, 1, 1], [1, 1, 1], 1], {}, ["schedule_conv3d_nchw_cuda", [64, 1, 40, 40, 40], [64, 1, 40, 40, 40], [1, 1, 1], [1, 1, 1], [1, 1, 1], 1], {"i": 242056879, "t": "", "c": null, "e": [["tile_n", "sp", [-1, 1, 8, 2]], ["tile_f", "sp", [-1, 4, 2, 1]], ["tile_d", "sp", [-1, 3, 1, 1]], ["tile_y", "sp", [-1, 1, 1, 1]], ["tile_x", "sp", [-1, 1, 1, 1]], ["tile_rc", "sp", [-1, 1]], ["tile_rd", "sp", [-1, 1]], ["tile_ry", "sp", [-1, 5]], ["tile_rx", "sp", [-1, 1]], ["auto_unroll_max_step", "ot", 512], ["unroll_explicit", "ot", 0], ["fuse_yx", "ot", 0]]}], "r": [[0.05378476775], 0, 1.81819486618042, 1577696297.2724817], "v": 0.1}
{"i": ["cuda", "schedule_conv3d_nchw_cuda", [[64, 1, 40, 40, 40], [64, 1, 40, 40, 40], [1, 1, 1], [1, 1, 1], [1, 1, 1], 1], {}, ["schedule_conv3d_nchw_cuda", [64, 1, 40, 40, 40], [64, 1, 40, 40, 40], [1, 1, 1], [1, 1, 1], [1, 1, 1], 1], {"i": 581876334, "t": "", "c": null, "e": [["tile_n", "sp", [-1, 1, 8, 1]], ["tile_f", "sp", [-1, 1, 4, 2]], ["tile_d", "sp", [-1, 3, 1, 1]], ["tile_y", "sp", [-1, 1, 1, 1]], ["tile_x", "sp", [-1, 1, 3, 1]], ["tile_rc", "sp", [-1, 1]], ["tile_rd", "sp", [-1, 1]], ["tile_ry", "sp", [-1, 2]], ["tile_rx", "sp", [-1, 8]], ["auto_unroll_max_step", "ot", 1500], ["unroll_explicit", "ot", 0], ["fuse_yx", "ot", 0]]}], "r": [[0.0138584225], 0, 1.2360343933105469, 1577696298.1656556], "v": 0.1}
{"i": ["cuda", "schedule_conv3d_nchw_cuda", [[64, 1, 40, 40, 40], [64, 1, 40, 40, 40], [1, 1, 1], [1, 1, 1], [1, 1, 1], 1], {}, ["schedule_conv3d_nchw_cuda", [64, 1, 40, 40, 40], [64, 1, 40, 40, 40], [1, 1, 1], [1, 1, 1], [1, 1, 1], 1], {"i": 935937207, "t": "", "c": null, "e": [["tile_n", "sp", [-1, 4, 1, 4]], ["tile_f", "sp", [-1, 1, 4, 1]], ["tile_d", "sp", [-1, 1, 1, 1]], ["tile_y", "sp", [-1, 3, 1, 1]], ["tile_x", "sp", [-1, 1, 3, 1]], ["tile_rc", "sp", [-1, 1]], ["tile_rd", "sp", [-1, 1]], ["tile_ry", "sp", [-1, 5]], ["tile_rx", "sp", [-1, 1]], ["auto_unroll_max_step", "ot", 512], ["unroll_explicit", "ot", 1], ["fuse_yx", "ot", 0]]}], "r": [[0.08196811925], 0, 2.767430543899536, 1577696300.1367033], "v": 0.1}
{"i": ["cuda", "schedule_conv3d_nchw_cuda", [[64, 1, 40, 40, 40], [64, 1, 40, 40, 40], [1, 1, 1], [1, 1, 1], [1, 1, 1], 1], {}, ["schedule_conv3d_nchw_cuda", [64, 1, 40, 40, 40], [64, 1, 40, 40, 40], [1, 1, 1], [1, 1, 1], [1, 1, 1], 1], {"i": 755345437, "t": "", "c": null, "e": [["tile_n", "sp", [-1, 1, 1, 4]], ["tile_f", "sp", [-1, 1, 2, 1]], ["tile_d", "sp", [-1, 1, 3, 1]], ["tile_y", "sp", [-1, 1, 3, 1]], ["tile_x", "sp", [-1, 1, 3, 1]], ["tile_rc", "sp", [-1, 1]], ["tile_rd", "sp", [-1, 1]], ["tile_ry", "sp", [-1, 2]], ["tile_rx", "sp", [-1, 4]], ["auto_unroll_max_step", "ot", 0], ["unroll_explicit", "ot", 1], ["fuse_yx", "ot", 0]]}], "r": [[0.04593022525], 0, 1.6589810848236084, 1577696301.446268], "v": 0.1}
{"i": ["cuda", "schedule_conv3d_nchw_cuda", [[64, 1, 40, 40, 40], [64, 1, 40, 40, 40], [1, 1, 1], [1, 1, 1], [1, 1, 1], 1], {}, ["schedule_conv3d_nchw_cuda", [64, 1, 40, 40, 40], [64, 1, 40, 40, 40], [1, 1, 1], [1, 1, 1], [1, 1, 1], 1], {"i": 2081424354, "t": "", "c": null, "e": [["tile_n", "sp", [-1, 4, 1, 2]], ["tile_f", "sp", [-1, 8, 2, 2]], ["tile_d", "sp", [-1, 1, 3, 1]], ["tile_y", "sp", [-1, 1, 3, 1]], ["tile_x", "sp", [-1, 1, 1, 1]], ["tile_rc", "sp", [-1, 1]], ["tile_rd", "sp", [-1, 2]], ["tile_ry", "sp", [-1, 1]], ["tile_rx", "sp", [-1, 1]], ["auto_unroll_max_step", "ot", 0], ["unroll_explicit", "ot", 1], ["fuse_yx", "ot", 1]]}], "r": [[0.06764169975], 0, 2.0030765533447266, 1577696302.8384848], "v": 0.1}
{"i": ["cuda", "schedule_conv3d_nchw_cuda", [[64, 1, 40, 40, 40], [64, 1, 40, 40, 40], [1, 1, 1], [1, 1, 1], [1, 1, 1], 1], {}, ["schedule_conv3d_nchw_cuda", [64, 1, 40, 40, 40], [64, 1, 40, 40, 40], [1, 1, 1], [1, 1, 1], [1, 1, 1], 1], {"i": 1879098859, "t": "", "c": null, "e": [["tile_n", "sp", [-1, 1, 8, 2]], ["tile_f", "sp", [-1, 8, 4, 1]], ["tile_d", "sp", [-1, 1, 1, 1]], ["tile_y", "sp", [-1, 1, 3, 1]], ["tile_x", "sp", [-1, 1, 1, 1]], ["tile_rc", "sp", [-1, 1]], ["tile_rd", "sp", [-1, 2]], ["tile_ry", "sp", [-1, 1]], ["tile_rx", "sp", [-1, 2]], ["auto_unroll_max_step", "ot", 1500], ["unroll_explicit", "ot", 0], ["fuse_yx", "ot", 1]]}], "r": [[0.01512421], 0, 1.249671459197998, 1577696303.652345], "v": 0.1}
{"i": ["cuda", "schedule_conv3d_nchw_cuda", [[64, 1, 40, 40, 40], [64, 1, 40, 40, 40], [1, 1, 1], [1, 1, 1], [1, 1, 1], 1], {}, ["schedule_conv3d_nchw_cuda", [64, 1, 40, 40, 40], [64, 1, 40, 40, 40], [1, 1, 1], [1, 1, 1], [1, 1, 1], 1], {"i": 466268059, "t": "", "c": null, "e": [["tile_n", "sp", [-1, 2, 8, 1]], ["tile_f", "sp", [-1, 64, 1, 1]], ["tile_d", "sp", [-1, 3, 1, 1]], ["tile_y", "sp", [-1, 1, 1, 1]], ["tile_x", "sp", [-1, 1, 3, 1]], ["tile_rc", "sp", [-1, 1]], ["tile_rd", "sp", [-1, 1]], ["tile_ry", "sp", [-1, 2]], ["tile_rx", "sp", [-1, 1]], ["auto_unroll_max_step", "ot", 1500], ["unroll_explicit", "ot", 0], ["fuse_yx", "ot", 0]]}], "r": [[0.19064059825], 0, 4.0935444831848145, 1577696306.8268645], "v": 0.1}
{"i": ["cuda", "schedule_conv3d_nchw_cuda", [[64, 1, 40, 40, 40], [64, 1, 40, 40, 40], [1, 1, 1], [1, 1, 1], [1, 1, 1], 1], {}, ["schedule_conv3d_nchw_cuda", [64, 1, 40, 40, 40], [64, 1, 40, 40, 40], [1, 1, 1], [1, 1, 1], [1, 1, 1], 1], {"i": 1178029778, "t": "", "c": null, "e": [["tile_n", "sp", [-1, 4, 1, 1]], ["tile_f", "sp", [-1, 1, 1, 2]], ["tile_d", "sp", [-1, 1, 3, 1]], ["tile_y", "sp", [-1, 1, 3, 1]], ["tile_x", "sp", [-1, 1, 3, 1]], ["tile_rc", "sp", [-1, 1]], ["tile_rd", "sp", [-1, 1]], ["tile_ry", "sp", [-1, 20]], ["tile_rx", "sp", [-1, 1]], ["auto_unroll_max_step", "ot", 1500], ["unroll_explicit", "ot", 1], ["fuse_yx", "ot", 0]]}], "r": [[0.034052637], 0, 1.950401782989502, 1577696307.9329002], "v": 0.1}
{"i": ["cuda", "schedule_conv3d_nchw_cuda", [[64, 1, 40, 40, 40], [64, 1, 40, 40, 40], [1, 1, 1], [1, 1, 1], [1, 1, 1], 1], {}, ["schedule_conv3d_nchw_cuda", [64, 1, 40, 40, 40], [64, 1, 40, 40, 40], [1, 1, 1], [1, 1, 1], [1, 1, 1], 1], {"i": 708367095, "t": "", "c": null, "e": [["tile_n", "sp", [-1, 4, 1, 4]], ["tile_f", "sp", [-1, 1, 4, 1]], ["tile_d", "sp", [-1, 1, 1, 1]], ["tile_y", "sp", [-1, 1, 3, 1]], ["tile_x", "sp", [-1, 1, 3, 1]], ["tile_rc", "sp", [-1, 1]], ["tile_rd", "sp", [-1, 1]], ["tile_ry", "sp", [-1, 8]], ["tile_rx", "sp", [-1, 1]], ["auto_unroll_max_step", "ot", 0], ["unroll_explicit", "ot", 1], ["fuse_yx", "ot", 0]]}], "r": [[0.0508444595], 0, 1.489396572113037, 1577696309.0135965], "v": 0.1}
{"i": ["cuda", "schedule_conv3d_nchw_cuda", [[64, 1, 40, 40, 40], [64, 1, 40, 40, 40], [1, 1, 1], [1, 1, 1], [1, 1, 1], 1], {}, ["schedule_conv3d_nchw_cuda", [64, 1, 40, 40, 40], [64, 1, 40, 40, 40], [1, 1, 1], [1, 1, 1], [1, 1, 1], 1], {"i": 1206872375, "t": "", "c": null, "e": [["tile_n", "sp", [-1, 2, 16, 1]], ["tile_f", "sp", [-1, 1, 1, 1]], ["tile_d", "sp", [-1, 1, 3, 1]], ["tile_y", "sp", [-1, 1, 1, 1]], ["tile_x", "sp", [-1, 1, 3, 1]], ["tile_rc", "sp", [-1, 1]], ["tile_rd", "sp", [-1, 1]], ["tile_ry", "sp", [-1, 20]], ["tile_rx", "sp", [-1, 2]], ["auto_unroll_max_step", "ot", 1500], ["unroll_explicit", "ot", 1], ["fuse_yx", "ot", 0]]}], "r": [[0.0619335455], 0, 2.282724380493164, 1577696310.4299421], "v": 0.1}
{"i": ["cuda", "schedule_conv3d_nchw_cuda", [[64, 1, 40, 40, 40], [64, 1, 40, 40, 40], [1, 1, 1], [1, 1, 1], [1, 1, 1], 1], {}, ["schedule_conv3d_nchw_cuda", [64, 1, 40, 40, 40], [64, 1, 40, 40, 40], [1, 1, 1], [1, 1, 1], [1, 1, 1], 1], {"i": 469884007, "t": "", "c": null, "e": [["tile_n", "sp", [-1, 2, 8, 1]], ["tile_f", "sp", [-1, 4, 8, 2]], ["tile_d", "sp", [-1, 3, 1, 1]], ["tile_y", "sp", [-1, 1, 1, 1]], ["tile_x", "sp", [-1, 1, 3, 1]], ["tile_rc", "sp", [-1, 1]], ["tile_rd", "sp", [-1, 1]], ["tile_ry", "sp", [-1, 4]], ["tile_rx", "sp", [-1, 1]], ["auto_unroll_max_step", "ot", 1500], ["unroll_explicit", "ot", 0], ["fuse_yx", "ot", 0]]}], "r": [[0.0278587935], 0, 1.373319149017334, 1577696311.3565316], "v": 0.1}
{"i": ["cuda", "schedule_conv3d_nchw_cuda", [[64, 1, 40, 40, 40], [64, 1, 40, 40, 40], [1, 1, 1], [1, 1, 1], [1, 1, 1], 1], {}, ["schedule_conv3d_nchw_cuda", [64, 1, 40, 40, 40], [64, 1, 40, 40, 40], [1, 1, 1], [1, 1, 1], [1, 1, 1], 1], {"i": 581658091, "t": "", "c": null, "e": [["tile_n", "sp", [-1, 1, 2, 1]], ["tile_f", "sp", [-1, 4, 8, 2]], ["tile_d", "sp", [-1, 1, 3, 1]], ["tile_y", "sp", [-1, 1, 1, 1]], ["tile_x", "sp", [-1, 1, 1, 1]], ["tile_rc", "sp", [-1, 1]], ["tile_rd", "sp", [-1, 1]], ["tile_ry", "sp", [-1, 2]], ["tile_rx", "sp", [-1, 8]], ["auto_unroll_max_step", "ot", 1500], ["unroll_explicit", "ot", 0], ["fuse_yx", "ot", 0]]}], "r": [[0.02579209275], 0, 1.283693790435791, 1577696314.9852793], "v": 0.1}
{"i": ["cuda", "schedule_conv3d_nchw_cuda", [[64, 1, 40, 40, 40], [64, 1, 40, 40, 40], [1, 1, 1], [1, 1, 1], [1, 1, 1], 1], {}, ["schedule_conv3d_nchw_cuda", [64, 1, 40, 40, 40], [64, 1, 40, 40, 40], [1, 1, 1], [1, 1, 1], [1, 1, 1], 1], {"i": 694142682, "t": "", "c": null, "e": [["tile_n", "sp", [-1, 4, 1, 2]], ["tile_f", "sp", [-1, 2, 8, 1]], ["tile_d", "sp", [-1, 1, 1, 1]], ["tile_y", "sp", [-1, 1, 3, 1]], ["tile_x", "sp", [-1, 1, 1, 1]], ["tile_rc", "sp", [-1, 1]], ["tile_rd", "sp", [-1, 2]], ["tile_ry", "sp", [-1, 1]], ["tile_rx", "sp", [-1, 1]], ["auto_unroll_max_step", "ot", 0], ["unroll_explicit", "ot", 1], ["fuse_yx", "ot", 0]]}], "r": [[0.0241887005], 0, 1.1422030925750732, 1577696315.8336165], "v": 0.1}
{"i": ["cuda", "schedule_conv3d_nchw_cuda", [[64, 1, 40, 40, 40], [64, 1, 40, 40, 40], [1, 1, 1], [1, 1, 1], [1, 1, 1], 1], {}, ["schedule_conv3d_nchw_cuda", [64, 1, 40, 40, 40], [64, 1, 40, 40, 40], [1, 1, 1], [1, 1, 1], [1, 1, 1], 1], {"i": 466268058, "t": "", "c": null, "e": [["tile_n", "sp", [-1, 1, 8, 1]], ["tile_f", "sp", [-1, 64, 1, 1]], ["tile_d", "sp", [-1, 3, 1, 1]], ["tile_y", "sp", [-1, 1, 1, 1]], ["tile_x", "sp", [-1, 1, 3, 1]], ["tile_rc", "sp", [-1, 1]], ["tile_rd", "sp", [-1, 1]], ["tile_ry", "sp", [-1, 2]], ["tile_rx", "sp", [-1, 1]], ["auto_unroll_max_step", "ot", 1500], ["unroll_explicit", "ot", 0], ["fuse_yx", "ot", 0]]}], "r": [[0.02352134225], 0, 1.5381252765655518, 1577696316.6920874], "v": 0.1}
{"i": ["cuda", "schedule_conv3d_nchw_cuda", [[64, 1, 40, 40, 40], [64, 1, 40, 40, 40], [1, 1, 1], [1, 1, 1], [1, 1, 1], 1], {}, ["schedule_conv3d_nchw_cuda", [64, 1, 40, 40, 40], [64, 1, 40, 40, 40], [1, 1, 1], [1, 1, 1], [1, 1, 1], 1], {"i": 1159958722, "t": "", "c": null, "e": [["tile_n", "sp", [-1, 1, 2, 2]], ["tile_f", "sp", [-1, 4, 8, 1]], ["tile_d", "sp", [-1, 3, 1, 1]], ["tile_y", "sp", [-1, 1, 3, 1]], ["tile_x", "sp", [-1, 1, 3, 1]], ["tile_rc", "sp", [-1, 1]], ["tile_rd", "sp", [-1, 1]], ["tile_ry", "sp", [-1, 2]], ["tile_rx", "sp", [-1, 1]], ["auto_unroll_max_step", "ot", 1500], ["unroll_explicit", "ot", 1], ["fuse_yx", "ot", 0]]}], "r": [[0.00904021825], 0, 2.237997531890869, 1577696317.421468], "v": 0.1}
{"i": ["cuda", "schedule_conv3d_nchw_cuda", [[64, 1, 40, 40, 40], [64, 1, 40, 40, 40], [1, 1, 1], [1, 1, 1], [1, 1, 1], 1], {}, ["schedule_conv3d_nchw_cuda", [64, 1, 40, 40, 40], [64, 1, 40, 40, 40], [1, 1, 1], [1, 1, 1], [1, 1, 1], 1], {"i": 953971460, "t": "", "c": null, "e": [["tile_n", "sp", [-1, 2, 2, 1]], ["tile_f", "sp", [-1, 8, 1, 1]], ["tile_d", "sp", [-1, 1, 1, 1]], ["tile_y", "sp", [-1, 1, 1, 1]], ["tile_x", "sp", [-1, 1, 3, 1]], ["tile_rc", "sp", [-1, 1]], ["tile_rd", "sp", [-1, 1]], ["tile_ry", "sp", [-1, 1]], ["tile_rx", "sp", [-1, 2]], ["auto_unroll_max_step", "ot", 512], ["unroll_explicit", "ot", 1], ["fuse_yx", "ot", 0]]}], "r": [[0.0473885045], 0, 1.507978916168213, 1577696318.4807158], "v": 0.1}
{"i": ["cuda", "schedule_conv3d_nchw_cuda", [[64, 1, 40, 40, 40], [64, 1, 40, 40, 40], [1, 1, 1], [1, 1, 1], [1, 1, 1], 1], {}, ["schedule_conv3d_nchw_cuda", [64, 1, 40, 40, 40], [64, 1, 40, 40, 40], [1, 1, 1], [1, 1, 1], [1, 1, 1], 1], {"i": 697926439, "t": "", "c": null, "e": [["tile_n", "sp", [-1, 1, 2, 1]], ["tile_f", "sp", [-1, 2, 4, 2]], ["tile_d", "sp", [-1, 1, 1, 1]], ["tile_y", "sp", [-1, 1, 1, 1]], ["tile_x", "sp", [-1, 1, 3, 1]], ["tile_rc", "sp", [-1, 1]], ["tile_rd", "sp", [-1, 2]], ["tile_ry", "sp", [-1, 2]], ["tile_rx", "sp", [-1, 1]], ["auto_unroll_max_step", "ot", 0], ["unroll_explicit", "ot", 1], ["fuse_yx", "ot", 0]]}], "r": [[0.025554905], 0, 1.239469051361084, 1577696319.301898], "v": 0.1}
{"i": ["cuda", "schedule_conv3d_nchw_cuda", [[64, 1, 40, 40, 40], [64, 1, 40, 40, 40], [1, 1, 1], [1, 1, 1], [1, 1, 1], 1], {}, ["schedule_conv3d_nchw_cuda", [64, 1, 40, 40, 40], [64, 1, 40, 40, 40], [1, 1, 1], [1, 1, 1], [1, 1, 1], 1], {"i": 939578103, "t": "", "c": null, "e": [["tile_n", "sp", [-1, 4, 1, 4]], ["tile_f", "sp", [-1, 1, 4, 1]], ["tile_d", "sp", [-1, 1, 1, 1]], ["tile_y", "sp", [-1, 1, 3, 1]], ["tile_x", "sp", [-1, 1, 3, 1]], ["tile_rc", "sp", [-1, 1]], ["tile_rd", "sp", [-1, 1]], ["tile_ry", "sp", [-1, 8]], ["tile_rx", "sp", [-1, 1]], ["auto_unroll_max_step", "ot", 512], ["unroll_explicit", "ot", 1], ["fuse_yx", "ot", 0]]}], "r": [[0.03280731525], 0, 1.738044261932373, 1577696320.3197296], "v": 0.1}
{"i": ["cuda", "schedule_conv3d_nchw_cuda", [[64, 1, 40, 40, 40], [64, 1, 40, 40, 40], [1, 1, 1], [1, 1, 1], [1, 1, 1], 1], {}, ["schedule_conv3d_nchw_cuda", [64, 1, 40, 40, 40], [64, 1, 40, 40, 40], [1, 1, 1], [1, 1, 1], [1, 1, 1], 1], {"i": 1160179158, "t": "", "c": null, "e": [["tile_n", "sp", [-1, 1, 2, 4]], ["tile_f", "sp", [-1, 2, 4, 2]], ["tile_d", "sp", [-1, 1, 1, 1]], ["tile_y", "sp", [-1, 1, 3, 1]], ["tile_x", "sp", [-1, 1, 1, 1]], ["tile_rc", "sp", [-1, 1]], ["tile_rd", "sp", [-1, 2]], ["tile_ry", "sp", [-1, 2]], ["tile_rx", "sp", [-1, 1]], ["auto_unroll_max_step", "ot", 1500], ["unroll_explicit", "ot", 1], ["fuse_yx", "ot", 0]]}], "r": [[0.01295596275], 0, 3.170316696166992, 1577696321.2043219], "v": 0.1}
{"i": ["cuda", "schedule_conv3d_nchw_cuda", [[64, 1, 40, 40, 40], [64, 1, 40, 40, 40], [1, 1, 1], [1, 1, 1], [1, 1, 1], 1], {}, ["schedule_conv3d_nchw_cuda", [64, 1, 40, 40, 40], [64, 1, 40, 40, 40], [1, 1, 1], [1, 1, 1], [1, 1, 1], 1], {"i": 1687183027, "t": "", "c": null, "e": [["tile_n", "sp", [-1, 2, 8, 1]], ["tile_f", "sp", [-1, 4, 8, 1]], ["tile_d", "sp", [-1, 3, 1, 1]], ["tile_y", "sp", [-1, 1, 3, 1]], ["tile_x", "sp", [-1, 1, 1, 1]], ["tile_rc", "sp", [-1, 1]], ["tile_rd", "sp", [-1, 1]], ["tile_ry", "sp", [-1, 5]], ["tile_rx", "sp", [-1, 4]], ["auto_unroll_max_step", "ot", 512], ["unroll_explicit", "ot", 0], ["fuse_yx", "ot", 1]]}], "r": [[0.0124410295], 0, 1.2728533744812012, 1577696321.949754], "v": 0.1}
{"i": ["cuda", "schedule_conv3d_nchw_cuda", [[64, 1, 40, 40, 40], [64, 1, 40, 40, 40], [1, 1, 1], [1, 1, 1], [1, 1, 1], 1], {}, ["schedule_conv3d_nchw_cuda", [64, 1, 40, 40, 40], [64, 1, 40, 40, 40], [1, 1, 1], [1, 1, 1], [1, 1, 1], 1], {"i": 1857150055, "t": "", "c": null, "e": [["tile_n", "sp", [-1, 2, 8, 1]], ["tile_f", "sp", [-1, 4, 8, 2]], ["tile_d", "sp", [-1, 3, 1, 1]], ["tile_y", "sp", [-1, 1, 1, 1]], ["tile_x", "sp", [-1, 1, 3, 1]], ["tile_rc", "sp", [-1, 1]], ["tile_rd", "sp", [-1, 1]], ["tile_ry", "sp", [-1, 4]], ["tile_rx", "sp", [-1, 1]], ["auto_unroll_max_step", "ot", 1500], ["unroll_explicit", "ot", 0], ["fuse_yx", "ot", 1]]}], "r": [[0.0280294585], 0, 1.4297058582305908, 1577696322.8705726], "v": 0.1}
{"i": ["cuda", "schedule_conv3d_nchw_cuda", [[64, 1, 40, 40, 40], [64, 1, 40, 40, 40], [1, 1, 1], [1, 1, 1], [1, 1, 1], 1], {}, ["schedule_conv3d_nchw_cuda", [64, 1, 40, 40, 40], [64, 1, 40, 40, 40], [1, 1, 1], [1, 1, 1], [1, 1, 1], 1], {"i": 1651500535, "t": "", "c": null, "e": [["tile_n", "sp", [-1, 2, 2, 4]], ["tile_f", "sp", [-1, 8, 4, 1]], ["tile_d", "sp", [-1, 1, 1, 1]], ["tile_y", "sp", [-1, 1, 3, 1]], ["tile_x", "sp", [-1, 1, 1, 1]], ["tile_rc", "sp", [-1, 1]], ["tile_rd", "sp", [-1, 2]], ["tile_ry", "sp", [-1, 2]], ["tile_rx", "sp", [-1, 2]], ["auto_unroll_max_step", "ot", 512], ["unroll_explicit", "ot", 0], ["fuse_yx", "ot", 1]]}], "r": [[0.039836936], 0, 1.7335784435272217, 1577696323.9410868], "v": 0.1}
{"i": ["cuda", "schedule_conv3d_nchw_cuda", [[64, 1, 40, 40, 40], [64, 1, 40, 40, 40], [1, 1, 1], [1, 1, 1], [1, 1, 1], 1], {}, ["schedule_conv3d_nchw_cuda", [64, 1, 40, 40, 40], [64, 1, 40, 40, 40], [1, 1, 1], [1, 1, 1], [1, 1, 1], 1], {"i": 2380816068, "t": "", "c": null, "e": [["tile_n", "sp", [-1, 4, 2, 2]], ["tile_f", "sp", [-1, 4, 8, 1]], ["tile_d", "sp", [-1, 3, 1, 1]], ["tile_y", "sp", [-1, 1, 3, 1]], ["tile_x", "sp", [-1, 1, 1, 1]], ["tile_rc", "sp", [-1, 1]], ["tile_rd", "sp", [-1, 1]], ["tile_ry", "sp", [-1, 5]], ["tile_rx", "sp", [-1, 4]], ["auto_unroll_max_step", "ot", 512], ["unroll_explicit", "ot", 1], ["fuse_yx", "ot", 1]]}], "r": [[0.0283135015], 0, 2.3794190883636475, 1577696324.9807053], "v": 0.1}
{"i": ["cuda", "schedule_conv3d_nchw_cuda", [[64, 1, 40, 40, 40], [64, 1, 40, 40, 40], [1, 1, 1], [1, 1, 1], [1, 1, 1], 1], {}, ["schedule_conv3d_nchw_cuda", [64, 1, 40, 40, 40], [64, 1, 40, 40, 40], [1, 1, 1], [1, 1, 1], [1, 1, 1], 1], {"i": 2348463203, "t": "", "c": null, "e": [["tile_n", "sp", [-1, 2, 16, 1]], ["tile_f", "sp", [-1, 1, 2, 1]], ["tile_d", "sp", [-1, 1, 1, 1]], ["tile_y", "sp", [-1, 1, 1, 1]], ["tile_x", "sp", [-1, 1, 3, 1]], ["tile_rc", "sp", [-1, 1]], ["tile_rd", "sp", [-1, 1]], ["tile_ry", "sp", [-1, 4]], ["tile_rx", "sp", [-1, 2]], ["auto_unroll_max_step", "ot", 512], ["unroll_explicit", "ot", 1], ["fuse_yx", "ot", 1]]}], "r": [[0.0206669065], 0, 1.5986156463623047, 1577696327.603064], "v": 0.1}
{"i": ["cuda", "schedule_conv3d_nchw_cuda", [[64, 1, 40, 40, 40], [64, 1, 40, 40, 40], [1, 1, 1], [1, 1, 1], [1, 1, 1], 1], {}, ["schedule_conv3d_nchw_cuda", [64, 1, 40, 40, 40], [64, 1, 40, 40, 40], [1, 1, 1], [1, 1, 1], [1, 1, 1], 1], {"i": 2575900411, "t": "", "c": null, "e": [["tile_n", "sp", [-1, 1, 2, 1]], ["tile_f", "sp", [-1, 8, 8, 1]], ["tile_d", "sp", [-1, 3, 1, 1]], ["tile_y", "sp", [-1, 1, 3, 1]], ["tile_x", "sp", [-1, 1, 1, 1]], ["tile_rc", "sp", [-1, 1]], ["tile_rd", "sp", [-1, 1]], ["tile_ry", "sp", [-1, 2]], ["tile_rx", "sp", [-1, 2]], ["auto_unroll_max_step", "ot", 1500], ["unroll_explicit", "ot", 1], ["fuse_yx", "ot", 1]]}], "r": [[0.01185251275], 0, 1.1943864822387695, 1577696328.3100293], "v": 0.1}
{"i": ["cuda", "schedule_conv3d_nchw_cuda", [[64, 1, 40, 40, 40], [64, 1, 40, 40, 40], [1, 1, 1], [1, 1, 1], [1, 1, 1], 1], {}, ["schedule_conv3d_nchw_cuda", [64, 1, 40, 40, 40], [64, 1, 40, 40, 40], [1, 1, 1], [1, 1, 1], [1, 1, 1], 1], {"i": 2341237508, "t": "", "c": null, "e": [["tile_n", "sp", [-1, 2, 2, 1]], ["tile_f", "sp", [-1, 8, 1, 1]], ["tile_d", "sp", [-1, 1, 1, 1]], ["tile_y", "sp", [-1, 1, 1, 1]], ["tile_x", "sp", [-1, 1, 3, 1]], ["tile_rc", "sp", [-1, 1]], ["tile_rd", "sp", [-1, 1]], ["tile_ry", "sp", [-1, 1]], ["tile_rx", "sp", [-1, 2]], ["auto_unroll_max_step", "ot", 512], ["unroll_explicit", "ot", 1], ["fuse_yx", "ot", 1]]}], "r": [[0.0474900315], 0, 1.48268461227417, 1577696329.3345637], "v": 0.1}
{"i": ["cuda", "schedule_conv3d_nchw_cuda", [[64, 1, 40, 40, 40], [64, 1, 40, 40, 40], [1, 1, 1], [1, 1, 1], [1, 1, 1], 1], {}, ["schedule_conv3d_nchw_cuda", [64, 1, 40, 40, 40], [64, 1, 40, 40, 40], [1, 1, 1], [1, 1, 1], [1, 1, 1], 1], {"i": 1477712248, "t": "", "c": null, "e": [["tile_n", "sp", [-1, 2, 4, 2]], ["tile_f", "sp", [-1, 1, 1, 2]], ["tile_d", "sp", [-1, 1, 3, 1]], ["tile_y", "sp", [-1, 1, 1, 1]], ["tile_x", "sp", [-1, 3, 1, 1]], ["tile_rc", "sp", [-1, 1]], ["tile_rd", "sp", [-1, 1]], ["tile_ry", "sp", [-1, 2]], ["tile_rx", "sp", [-1, 5]], ["auto_unroll_max_step", "ot", 0], ["unroll_explicit", "ot", 0], ["fuse_yx", "ot", 1]]}], "r": [[0.117210075], 0, 2.4604685306549072, 1577696331.339462], "v": 0.1}
{"i": ["cuda", "schedule_conv3d_nchw_cuda", [[64, 1, 40, 40, 40], [64, 1, 40, 40, 40], [1, 1, 1], [1, 1, 1], [1, 1, 1], 1], {}, ["schedule_conv3d_nchw_cuda", [64, 1, 40, 40, 40], [64, 1, 40, 40, 40], [1, 1, 1], [1, 1, 1], [1, 1, 1], 1], {"i": 1647887863, "t": "", "c": null, "e": [["tile_n", "sp", [-1, 2, 2, 4]], ["tile_f", "sp", [-1, 8, 4, 1]], ["tile_d", "sp", [-1, 1, 1, 1]], ["tile_y", "sp", [-1, 1, 3, 1]], ["tile_x", "sp", [-1, 1, 1, 1]], ["tile_rc", "sp", [-1, 1]], ["tile_rd", "sp", [-1, 2]], ["tile_ry", "sp", [-1, 1]], ["tile_rx", "sp", [-1, 2]], ["auto_unroll_max_step", "ot", 512], ["unroll_explicit", "ot", 0], ["fuse_yx", "ot", 1]]}], "r": [[0.03113118725], 0, 1.4892921447753906, 1577696332.2465148], "v": 0.1}
{"i": ["cuda", "schedule_conv3d_nchw_cuda", [[64, 1, 40, 40, 40], [64, 1, 40, 40, 40], [1, 1, 1], [1, 1, 1], [1, 1, 1], 1], {}, ["schedule_conv3d_nchw_cuda", [64, 1, 40, 40, 40], [64, 1, 40, 40, 40], [1, 1, 1], [1, 1, 1], [1, 1, 1], 1], {"i": 2546999035, "t": "", "c": null, "e": [["tile_n", "sp", [-1, 1, 2, 1]], ["tile_f", "sp", [-1, 8, 8, 1]], ["tile_d", "sp", [-1, 3, 1, 1]], ["tile_y", "sp", [-1, 1, 3, 1]], ["tile_x", "sp", [-1, 1, 1, 1]], ["tile_rc", "sp", [-1, 1]], ["tile_rd", "sp", [-1, 1]], ["tile_ry", "sp", [-1, 2]], ["tile_rx", "sp", [-1, 1]], ["auto_unroll_max_step", "ot", 1500], ["unroll_explicit", "ot", 1], ["fuse_yx", "ot", 1]]}], "r": [[0.01472212], 0, 2.253298282623291, 1577696333.0290818], "v": 0.1}
{"i": ["cuda", "schedule_conv3d_nchw_cuda", [[64, 1, 40, 40, 40], [64, 1, 40, 40, 40], [1, 1, 1], [1, 1, 1], [1, 1, 1], 1], {}, ["schedule_conv3d_nchw_cuda", [64, 1, 40, 40, 40], [64, 1, 40, 40, 40], [1, 1, 1], [1, 1, 1], [1, 1, 1], 1], {"i": 2380816051, "t": "", "c": null, "e": [["tile_n", "sp", [-1, 2, 8, 1]], ["tile_f", "sp", [-1, 4, 8, 1]], ["tile_d", "sp", [-1, 3, 1, 1]], ["tile_y", "sp", [-1, 1, 3, 1]], ["tile_x", "sp", [-1, 1, 1, 1]], ["tile_rc", "sp", [-1, 1]], ["tile_rd", "sp", [-1, 1]], ["tile_ry", "sp", [-1, 5]], ["tile_rx", "sp", [-1, 4]], ["auto_unroll_max_step", "ot", 512], ["unroll_explicit", "ot", 1], ["fuse_yx", "ot", 1]]}], "r": [[0.01030240475], 0, 1.5421559810638428, 1577696333.7231264], "v": 0.1}
{"i": ["cuda", "schedule_conv3d_nchw_cuda", [[64, 1, 40, 40, 40], [64, 1, 40, 40, 40], [1, 1, 1], [1, 1, 1], [1, 1, 1], 1], {}, ["schedule_conv3d_nchw_cuda", [64, 1, 40, 40, 40], [64, 1, 40, 40, 40], [1, 1, 1], [1, 1, 1], [1, 1, 1], 1], {"i": 2124487878, "t": "", "c": null, "e": [["tile_n", "sp", [-1, 4, 1, 2]], ["tile_f", "sp", [-1, 1, 16, 2]], ["tile_d", "sp", [-1, 3, 1, 1]], ["tile_y", "sp", [-1, 1, 1, 1]], ["tile_x", "sp", [-1, 1, 3, 1]], ["tile_rc", "sp", [-1, 1]], ["tile_rd", "sp", [-1, 1]], ["tile_ry", "sp", [-1, 8]], ["tile_rx", "sp", [-1, 2]], ["auto_unroll_max_step", "ot", 0], ["unroll_explicit", "ot", 1], ["fuse_yx", "ot", 1]]}], "r": [[0.012172142], 0, 1.2416601181030273, 1577696334.4296737], "v": 0.1}
{"i": ["cuda", "schedule_conv3d_nchw_cuda", [[64, 1, 40, 40, 40], [64, 1, 40, 40, 40], [1, 1, 1], [1, 1, 1], [1, 1, 1], 1], {}, ["schedule_conv3d_nchw_cuda", [64, 1, 40, 40, 40], [64, 1, 40, 40, 40], [1, 1, 1], [1, 1, 1], [1, 1, 1], 1], {"i": 1849704826, "t": "", "c": null, "e": [["tile_n", "sp", [-1, 1, 16, 2]], ["tile_f", "sp", [-1, 8, 1, 2]], ["tile_d", "sp", [-1, 1, 3, 1]], ["tile_y", "sp", [-1, 1, 1, 1]], ["tile_x", "sp", [-1, 1, 1, 1]], ["tile_rc", "sp", [-1, 1]], ["tile_rd", "sp", [-1, 1]], ["tile_ry", "sp", [-1, 1]], ["tile_rx", "sp", [-1, 1]], ["auto_unroll_max_step", "ot", 1500], ["unroll_explicit", "ot", 0], ["fuse_yx", "ot", 1]]}], "r": [[0.03666264125], 0, 2.2940969467163086, 1577696335.7444122], "v": 0.1}
{"i": ["cuda", "schedule_conv3d_nchw_cuda", [[64, 1, 40, 40, 40], [64, 1, 40, 40, 40], [1, 1, 1], [1, 1, 1], [1, 1, 1], 1], {}, ["schedule_conv3d_nchw_cuda", [64, 1, 40, 40, 40], [64, 1, 40, 40, 40], [1, 1, 1], [1, 1, 1], [1, 1, 1], 1], {"i": 2171345272, "t": "", "c": null, "e": [["tile_n", "sp", [-1, 2, 4, 2]], ["tile_f", "sp", [-1, 1, 1, 2]], ["tile_d", "sp", [-1, 1, 3, 1]], ["tile_y", "sp", [-1, 1, 1, 1]], ["tile_x", "sp", [-1, 3, 1, 1]], ["tile_rc", "sp", [-1, 1]], ["tile_rd", "sp", [-1, 1]], ["tile_ry", "sp", [-1, 2]], ["tile_rx", "sp", [-1, 5]], ["auto_unroll_max_step", "ot", 0], ["unroll_explicit", "ot", 1], ["fuse_yx", "ot", 1]]}], "r": [[0.11662062075], 0, 2.402614116668701, 1577696337.6782928], "v": 0.1}
{"i": ["cuda", "schedule_conv3d_nchw_cuda", [[64, 1, 40, 40, 40], [64, 1, 40, 40, 40], [1, 1, 1], [1, 1, 1], [1, 1, 1], 1], {}, ["schedule_conv3d_nchw_cuda", [64, 1, 40, 40, 40], [64, 1, 40, 40, 40], [1, 1, 1], [1, 1, 1], [1, 1, 1], 1], {"i": 2380815900, "t": "", "c": null, "e": [["tile_n", "sp", [-1, 4, 2, 2]], ["tile_f", "sp", [-1, 1, 8, 1]], ["tile_d", "sp", [-1, 3, 1, 1]], ["tile_y", "sp", [-1, 1, 3, 1]], ["tile_x", "sp", [-1, 1, 1, 1]], ["tile_rc", "sp", [-1, 1]], ["tile_rd", "sp", [-1, 1]], ["tile_ry", "sp", [-1, 5]], ["tile_rx", "sp", [-1, 4]], ["auto_unroll_max_step", "ot", 512], ["unroll_explicit", "ot", 1], ["fuse_yx", "ot", 1]]}], "r": [[0.03143718475], 0, 2.3012771606445312, 1577696338.7572472], "v": 0.1}
{"i": ["cuda", "schedule_conv3d_nchw_cuda", [[64, 1, 40, 40, 40], [64, 1, 40, 40, 40], [1, 1, 1], [1, 1, 1], [1, 1, 1], 1], {}, ["schedule_conv3d_nchw_cuda", [64, 1, 40, 40, 40], [64, 1, 40, 40, 40], [1, 1, 1], [1, 1, 1], [1, 1, 1], 1], {"i": 752848602, "t": "", "c": null, "e": [["tile_n", "sp", [-1, 4, 1, 2]], ["tile_f", "sp", [-1, 2, 8, 1]], ["tile_d", "sp", [-1, 1, 1, 1]], ["tile_y", "sp", [-1, 1, 3, 1]], ["tile_x", "sp", [-1, 1, 1, 1]], ["tile_rc", "sp", [-1, 1]], ["tile_rd", "sp", [-1, 5]], ["tile_ry", "sp", [-1, 1]], ["tile_rx", "sp", [-1, 4]], ["auto_unroll_max_step", "ot", 0], ["unroll_explicit", "ot", 1], ["fuse_yx", "ot", 0]]}], "r": [[0.0257722825], 0, 1.337602138519287, 1577696339.617257], "v": 0.1}
{"i": ["cuda", "schedule_conv3d_nchw_cuda", [[64, 1, 40, 40, 40], [64, 1, 40, 40, 40], [1, 1, 1], [1, 1, 1], [1, 1, 1], 1], {}, ["schedule_conv3d_nchw_cuda", [64, 1, 40, 40, 40], [64, 1, 40, 40, 40], [1, 1, 1], [1, 1, 1], [1, 1, 1], 1], {"i": 1640453397, "t": "", "c": null, "e": [["tile_n", "sp", [-1, 4, 2, 1]], ["tile_f", "sp", [-1, 2, 16, 2]], ["tile_d", "sp", [-1, 1, 3, 1]], ["tile_y", "sp", [-1, 1, 3, 1]], ["tile_x", "sp", [-1, 1, 3, 1]], ["tile_rc", "sp", [-1, 1]], ["tile_rd", "sp", [-1, 1]], ["tile_ry", "sp", [-1, 20]], ["tile_rx", "sp", [-1, 1]], ["auto_unroll_max_step", "ot", 512], ["unroll_explicit", "ot", 0], ["fuse_yx", "ot", 1]]}], "r": [[0.015804323], 0, 1.1938848495483398, 1577696342.0525284], "v": 0.1}
{"i": ["cuda", "schedule_conv3d_nchw_cuda", [[64, 1, 40, 40, 40], [64, 1, 40, 40, 40], [1, 1, 1], [1, 1, 1], [1, 1, 1], 1], {}, ["schedule_conv3d_nchw_cuda", [64, 1, 40, 40, 40], [64, 1, 40, 40, 40], [1, 1, 1], [1, 1, 1], [1, 1, 1], 1], {"i": 1159727574, "t": "", "c": null, "e": [["tile_n", "sp", [-1, 1, 2, 4]], ["tile_f", "sp", [-1, 2, 4, 2]], ["tile_d", "sp", [-1, 1, 1, 1]], ["tile_y", "sp", [-1, 1, 3, 1]], ["tile_x", "sp", [-1, 1, 1, 1]], ["tile_rc", "sp", [-1, 1]], ["tile_rd", "sp", [-1, 1]], ["tile_ry", "sp", [-1, 2]], ["tile_rx", "sp", [-1, 1]], ["auto_unroll_max_step", "ot", 1500], ["unroll_explicit", "ot", 1], ["fuse_yx", "ot", 0]]}], "r": [[0.01655013625], 0, 1.9746835231781006, 1577696342.8227296], "v": 0.1}
{"i": ["cuda", "schedule_conv3d_nchw_cuda", [[64, 1, 40, 40, 40], [64, 1, 40, 40, 40], [1, 1, 1], [1, 1, 1], [1, 1, 1], 1], {}, ["schedule_conv3d_nchw_cuda", [64, 1, 40, 40, 40], [64, 1, 40, 40, 40], [1, 1, 1], [1, 1, 1], [1, 1, 1], 1], {"i": 1918394035, "t": "", "c": null, "e": [["tile_n", "sp", [-1, 2, 8, 1]], ["tile_f", "sp", [-1, 4, 8, 1]], ["tile_d", "sp", [-1, 3, 1, 1]], ["tile_y", "sp", [-1, 1, 3, 1]], ["tile_x", "sp", [-1, 1, 1, 1]], ["tile_rc", "sp", [-1, 1]], ["tile_rd", "sp", [-1, 1]], ["tile_ry", "sp", [-1, 5]], ["tile_rx", "sp", [-1, 4]], ["auto_unroll_max_step", "ot", 1500], ["unroll_explicit", "ot", 0], ["fuse_yx", "ot", 1]]}], "r": [[0.01241568575], 0, 1.2269830703735352, 1577696343.4644659], "v": 0.1}
{"i": ["cuda", "schedule_conv3d_nchw_cuda", [[64, 1, 40, 40, 40], [64, 1, 40, 40, 40], [1, 1, 1], [1, 1, 1], [1, 1, 1], 1], {}, ["schedule_conv3d_nchw_cuda", [64, 1, 40, 40, 40], [64, 1, 40, 40, 40], [1, 1, 1], [1, 1, 1], [1, 1, 1], 1], {"i": 1914781363, "t": "", "c": null, "e": [["tile_n", "sp", [-1, 2, 8, 1]], ["tile_f", "sp", [-1, 4, 8, 1]], ["tile_d", "sp", [-1, 3, 1, 1]], ["tile_y", "sp", [-1, 1, 3, 1]], ["tile_x", "sp", [-1, 1, 1, 1]], ["tile_rc", "sp", [-1, 1]], ["tile_rd", "sp", [-1, 1]], ["tile_ry", "sp", [-1, 4]], ["tile_rx", "sp", [-1, 4]], ["auto_unroll_max_step", "ot", 1500], ["unroll_explicit", "ot", 0], ["fuse_yx", "ot", 1]]}], "r": [[0.00672137825], 0, 1.1454687118530273, 1577696344.0679357], "v": 0.1}
{"i": ["cuda", "schedule_conv3d_nchw_cuda", [[64, 1, 40, 40, 40], [64, 1, 40, 40, 40], [1, 1, 1], [1, 1, 1], [1, 1, 1], 1], {}, ["schedule_conv3d_nchw_cuda", [64, 1, 40, 40, 40], [64, 1, 40, 40, 40], [1, 1, 1], [1, 1, 1], [1, 1, 1], 1], {"i": 2081408730, "t": "", "c": null, "e": [["tile_n", "sp", [-1, 4, 1, 2]], ["tile_f", "sp", [-1, 2, 8, 1]], ["tile_d", "sp", [-1, 1, 1, 1]], ["tile_y", "sp", [-1, 1, 3, 1]], ["tile_x", "sp", [-1, 1, 1, 1]], ["tile_rc", "sp", [-1, 1]], ["tile_rd", "sp", [-1, 2]], ["tile_ry", "sp", [-1, 1]], ["tile_rx", "sp", [-1, 1]], ["auto_unroll_max_step", "ot", 0], ["unroll_explicit", "ot", 1], ["fuse_yx", "ot", 1]]}], "r": [[0.02433875875], 0, 1.264240026473999, 1577696344.9135697], "v": 0.1}
{"i": ["cuda", "schedule_conv3d_nchw_cuda", [[64, 1, 40, 40, 40], [64, 1, 40, 40, 40], [1, 1, 1], [1, 1, 1], [1, 1, 1], 1], {}, ["schedule_conv3d_nchw_cuda", [64, 1, 40, 40, 40], [64, 1, 40, 40, 40], [1, 1, 1], [1, 1, 1], [1, 1, 1], 1], {"i": 1531957169, "t": "", "c": null, "e": [["tile_n", "sp", [-1, 2, 1, 2]], ["tile_f", "sp", [-1, 4, 2, 1]], ["tile_d", "sp", [-1, 1, 3, 1]], ["tile_y", "sp", [-1, 1, 3, 1]], ["tile_x", "sp", [-1, 3, 1, 1]], ["tile_rc", "sp", [-1, 1]], ["tile_rd", "sp", [-1, 1]], ["tile_ry", "sp", [-1, 1]], ["tile_rx", "sp", [-1, 10]], ["auto_unroll_max_step", "ot", 0], ["unroll_explicit", "ot", 0], ["fuse_yx", "ot", 1]]}], "r": [[0.0352610095], 0, 1.4269399642944336, 1577696345.8402233], "v": 0.1}
{"i": ["cuda", "schedule_conv3d_nchw_cuda", [[64, 1, 40, 40, 40], [64, 1, 40, 40, 40], [1, 1, 1], [1, 1, 1], [1, 1, 1], 1], {}, ["schedule_conv3d_nchw_cuda", [64, 1, 40, 40, 40], [64, 1, 40, 40, 40], [1, 1, 1], [1, 1, 1], [1, 1, 1], 1], {"i": 939549879, "t": "", "c": null, "e": [["tile_n", "sp", [-1, 4, 1, 4]], ["tile_f", "sp", [-1, 1, 4, 1]], ["tile_d", "sp", [-1, 1, 1, 1]], ["tile_y", "sp", [-1, 3, 1, 1]], ["tile_x", "sp", [-1, 1, 3, 1]], ["tile_rc", "sp", [-1, 1]], ["tile_rd", "sp", [-1, 1]], ["tile_ry", "sp", [-1, 8]], ["tile_rx", "sp", [-1, 1]], ["auto_unroll_max_step", "ot", 512], ["unroll_explicit", "ot", 1], ["fuse_yx", "ot", 0]]}], "r": [[0.078958833], 0, 3.1169495582580566, 1577696347.8256464], "v": 0.1}
{"i": ["cuda", "schedule_conv3d_nchw_cuda", [[64, 1, 40, 40, 40], [64, 1, 40, 40, 40], [1, 1, 1], [1, 1, 1], [1, 1, 1], 1], {}, ["schedule_conv3d_nchw_cuda", [64, 1, 40, 40, 40], [64, 1, 40, 40, 40], [1, 1, 1], [1, 1, 1], [1, 1, 1], 1], {"i": 1903895659, "t": "", "c": null, "e": [["tile_n", "sp", [-1, 1, 8, 2]], ["tile_f", "sp", [-1, 2, 4, 2]], ["tile_d", "sp", [-1, 1, 3, 1]], ["tile_y", "sp", [-1, 1, 1, 1]], ["tile_x", "sp", [-1, 1, 1, 1]], ["tile_rc", "sp", [-1, 1]], ["tile_rd", "sp", [-1, 1]], ["tile_ry", "sp", [-1, 40]], ["tile_rx", "sp", [-1, 2]], ["auto_unroll_max_step", "ot", 1500], ["unroll_explicit", "ot", 0], ["fuse_yx", "ot", 1]]}], "r": [[0.03345741975], 0, 2.1249256134033203, 1577696349.1572757], "v": 0.1}
{"i": ["cuda", "schedule_conv3d_nchw_cuda", [[64, 1, 40, 40, 40], [64, 1, 40, 40, 40], [1, 1, 1], [1, 1, 1], [1, 1, 1], 1], {}, ["schedule_conv3d_nchw_cuda", [64, 1, 40, 40, 40], [64, 1, 40, 40, 40], [1, 1, 1], [1, 1, 1], [1, 1, 1], 1], {"i": 2633703163, "t": "", "c": null, "e": [["tile_n", "sp", [-1, 1, 2, 1]], ["tile_f", "sp", [-1, 8, 8, 1]], ["tile_d", "sp", [-1, 3, 1, 1]], ["tile_y", "sp", [-1, 1, 3, 1]], ["tile_x", "sp", [-1, 1, 1, 1]], ["tile_rc", "sp", [-1, 1]], ["tile_rd", "sp", [-1, 1]], ["tile_ry", "sp", [-1, 2]], ["tile_rx", "sp", [-1, 5]], ["auto_unroll_max_step", "ot", 1500], ["unroll_explicit", "ot", 1], ["fuse_yx", "ot", 1]]}], "r": [[0.0086716105], 0, 1.2766029834747314, 1577696349.7832236], "v": 0.1}
{"i": ["cuda", "schedule_conv3d_nchw_cuda", [[64, 1, 40, 40, 40], [64, 1, 40, 40, 40], [1, 1, 1], [1, 1, 1], [1, 1, 1], 1], {}, ["schedule_conv3d_nchw_cuda", [64, 1, 40, 40, 40], [64, 1, 40, 40, 40], [1, 1, 1], [1, 1, 1], [1, 1, 1], 1], {"i": 2348463192, "t": "", "c": null, "e": [["tile_n", "sp", [-1, 32, 2, 1]], ["tile_f", "sp", [-1, 1, 2, 1]], ["tile_d", "sp", [-1, 1, 1, 1]], ["tile_y", "sp", [-1, 1, 1, 1]], ["tile_x", "sp", [-1, 1, 3, 1]], ["tile_rc", "sp", [-1, 1]], ["tile_rd", "sp", [-1, 1]], ["tile_ry", "sp", [-1, 4]], ["tile_rx", "sp", [-1, 2]], ["auto_unroll_max_step", "ot", 512], ["unroll_explicit", "ot", 1], ["fuse_yx", "ot", 1]]}], "r": [[0.10774040625], 0, 3.141644239425659, 1577696351.7700417], "v": 0.1}
{"i": ["cuda", "schedule_conv3d_nchw_cuda", [[64, 1, 40, 40, 40], [64, 1, 40, 40, 40], [1, 1, 1], [1, 1, 1], [1, 1, 1], 1], {}, ["schedule_conv3d_nchw_cuda", [64, 1, 40, 40, 40], [64, 1, 40, 40, 40], [1, 1, 1], [1, 1, 1], [1, 1, 1], 1], {"i": 2380815913, "t": "", "c": null, "e": [["tile_n", "sp", [-1, 1, 1, 4]], ["tile_f", "sp", [-1, 1, 8, 1]], ["tile_d", "sp", [-1, 3, 1, 1]], ["tile_y", "sp", [-1, 1, 3, 1]], ["tile_x", "sp", [-1, 1, 1, 1]], ["tile_rc", "sp", [-1, 1]], ["tile_rd", "sp", [-1, 1]], ["tile_ry", "sp", [-1, 5]], ["tile_rx", "sp", [-1, 4]], ["auto_unroll_max_step", "ot", 512], ["unroll_explicit", "ot", 1], ["fuse_yx", "ot", 1]]}], "r": [[0.0175234155], 0, 1.9058876037597656, 1577696352.8391001], "v": 0.1}
{"i": ["cuda", "schedule_conv3d_nchw_cuda", [[64, 1, 40, 40, 40], [64, 1, 40, 40, 40], [1, 1, 1], [1, 1, 1], [1, 1, 1], 1], {}, ["schedule_conv3d_nchw_cuda", [64, 1, 40, 40, 40], [64, 1, 40, 40, 40], [1, 1, 1], [1, 1, 1], [1, 1, 1], 1], {"i": 2355688208, "t": "", "c": null, "e": [["tile_n", "sp", [-1, 4, 8, 1]], ["tile_f", "sp", [-1, 8, 1, 1]], ["tile_d", "sp", [-1, 1, 1, 1]], ["tile_y", "sp", [-1, 1, 1, 1]], ["tile_x", "sp", [-1, 1, 3, 1]], ["tile_rc", "sp", [-1, 1]], ["tile_rd", "sp", [-1, 1]], ["tile_ry", "sp", [-1, 8]], ["tile_rx", "sp", [-1, 2]], ["auto_unroll_max_step", "ot", 512], ["unroll_explicit", "ot", 1], ["fuse_yx", "ot", 1]]}], "r": [[0.02877993075], 0, 1.920069694519043, 1577696353.7980528], "v": 0.1}
{"i": ["cuda", "schedule_conv3d_nchw_cuda", [[64, 1, 40, 40, 40], [64, 1, 40, 40, 40], [1, 1, 1], [1, 1, 1], [1, 1, 1], 1], {}, ["schedule_conv3d_nchw_cuda", [64, 1, 40, 40, 40], [64, 1, 40, 40, 40], [1, 1, 1], [1, 1, 1], [1, 1, 1], 1], {"i": 2402597833, "t": "", "c": null, "e": [["tile_n", "sp", [-1, 1, 4, 1]], ["tile_f", "sp", [-1, 2, 8, 1]], ["tile_d", "sp", [-1, 1, 1, 1]], ["tile_y", "sp", [-1, 1, 3, 1]], ["tile_x", "sp", [-1, 3, 1, 1]], ["tile_rc", "sp", [-1, 1]], ["tile_rd", "sp", [-1, 1]], ["tile_ry", "sp", [-1, 2]], ["tile_rx", "sp", [-1, 5]], ["auto_unroll_max_step", "ot", 512], ["unroll_explicit", "ot", 1], ["fuse_yx", "ot", 1]]}], "r": [[0.007644975], 0, 1.0463836193084717, 1577696592.6179488], "v": 0.1}
{"i": ["cuda", "schedule_conv3d_nchw_cuda", [[64, 1, 40, 40, 40], [64, 1, 40, 40, 40], [1, 1, 1], [1, 1, 1], [1, 1, 1], 1], {}, ["schedule_conv3d_nchw_cuda", [64, 1, 40, 40, 40], [64, 1, 40, 40, 40], [1, 1, 1], [1, 1, 1], [1, 1, 1], 1], {"i": 2633808841, "t": "", "c": null, "e": [["tile_n", "sp", [-1, 1, 4, 1]], ["tile_f", "sp", [-1, 2, 8, 1]], ["tile_d", "sp", [-1, 1, 1, 1]], ["tile_y", "sp", [-1, 1, 3, 1]], ["tile_x", "sp", [-1, 3, 1, 1]], ["tile_rc", "sp", [-1, 1]], ["tile_rd", "sp", [-1, 1]], ["tile_ry", "sp", [-1, 2]], ["tile_rx", "sp", [-1, 5]], ["auto_unroll_max_step", "ot", 1500], ["unroll_explicit", "ot", 1], ["fuse_yx", "ot", 1]]}], "r": [[0.00543270325], 0, 2.7511963844299316, 1577696593.4209802], "v": 0.1}
{"i": ["cuda", "schedule_conv3d_nchw_cuda", [[64, 1, 40, 40, 40], [64, 1, 40, 40, 40], [1, 1, 1], [1, 1, 1], [1, 1, 1], 1], {}, ["schedule_conv3d_nchw_cuda", [64, 1, 40, 40, 40], [64, 1, 40, 40, 40], [1, 1, 1], [1, 1, 1], [1, 1, 1], 1], {"i": 2377182200, "t": "", "c": null, "e": [["tile_n", "sp", [-1, 2, 2, 1]], ["tile_f", "sp", [-1, 4, 8, 1]], ["tile_d", "sp", [-1, 1, 3, 1]], ["tile_y", "sp", [-1, 3, 1, 1]], ["tile_x", "sp", [-1, 1, 1, 1]], ["tile_rc", "sp", [-1, 1]], ["tile_rd", "sp", [-1, 1]], ["tile_ry", "sp", [-1, 4]], ["tile_rx", "sp", [-1, 4]], ["auto_unroll_max_step", "ot", 512], ["unroll_explicit", "ot", 1], ["fuse_yx", "ot", 1]]}], "r": [[0.00825656525], 0, 1.4727394580841064, 1577696594.069843], "v": 0.1}
{"i": ["cuda", "schedule_conv3d_nchw_cuda", [[64, 1, 40, 40, 40], [64, 1, 40, 40, 40], [1, 1, 1], [1, 1, 1], [1, 1, 1], 1], {}, ["schedule_conv3d_nchw_cuda", [64, 1, 40, 40, 40], [64, 1, 40, 40, 40], [1, 1, 1], [1, 1, 1], [1, 1, 1], 1], {"i": 2608393208, "t": "", "c": null, "e": [["tile_n", "sp", [-1, 2, 2, 1]], ["tile_f", "sp", [-1, 4, 8, 1]], ["tile_d", "sp", [-1, 1, 3, 1]], ["tile_y", "sp", [-1, 3, 1, 1]], ["tile_x", "sp", [-1, 1, 1, 1]], ["tile_rc", "sp", [-1, 1]], ["tile_rd", "sp", [-1, 1]], ["tile_ry", "sp", [-1, 4]], ["tile_rx", "sp", [-1, 4]], ["auto_unroll_max_step", "ot", 1500], ["unroll_explicit", "ot", 1], ["fuse_yx", "ot", 1]]}], "r": [[0.007723209], 0, 1.4103477001190186, 1577696594.659971], "v": 0.1}
{"i": ["cuda", "schedule_conv3d_nchw_cuda", [[64, 1, 40, 40, 40], [64, 1, 40, 40, 40], [1, 1, 1], [1, 1, 1], [1, 1, 1], 1], {}, ["schedule_conv3d_nchw_cuda", [64, 1, 40, 40, 40], [64, 1, 40, 40, 40], [1, 1, 1], [1, 1, 1], [1, 1, 1], 1], {"i": 2659111645, "t": "", "c": null, "e": [["tile_n", "sp", [-1, 2, 1, 1]], ["tile_f", "sp", [-1, 2, 8, 1]], ["tile_d", "sp", [-1, 1, 3, 1]], ["tile_y", "sp", [-1, 1, 3, 1]], ["tile_x", "sp", [-1, 3, 1, 1]], ["tile_rc", "sp", [-1, 1]], ["tile_rd", "sp", [-1, 1]], ["tile_ry", "sp", [-1, 1]], ["tile_rx", "sp", [-1, 8]], ["auto_unroll_max_step", "ot", 1500], ["unroll_explicit", "ot", 1], ["fuse_yx", "ot", 1]]}], "r": [[0.011360568], 0, 1.1829962730407715, 1577696595.3301265], "v": 0.1}
{"i": ["cuda", "schedule_conv3d_nchw_cuda", [[64, 1, 40, 40, 40], [64, 1, 40, 40, 40], [1, 1, 1], [1, 1, 1], [1, 1, 1], 1], {}, ["schedule_conv3d_nchw_cuda", [64, 1, 40, 40, 40], [64, 1, 40, 40, 40], [1, 1, 1], [1, 1, 1], [1, 1, 1], 1], {"i": 2427900637, "t": "", "c": null, "e": [["tile_n", "sp", [-1, 2, 1, 1]], ["tile_f", "sp", [-1, 2, 8, 1]], ["tile_d", "sp", [-1, 1, 3, 1]], ["tile_y", "sp", [-1, 1, 3, 1]], ["tile_x", "sp", [-1, 3, 1, 1]], ["tile_rc", "sp", [-1, 1]], ["tile_rd", "sp", [-1, 1]], ["tile_ry", "sp", [-1, 1]], ["tile_rx", "sp", [-1, 8]], ["auto_unroll_max_step", "ot", 512], ["unroll_explicit", "ot", 1], ["fuse_yx", "ot", 1]]}], "r": [[0.01142750975], 0, 1.0758183002471924, 1577696595.9343832], "v": 0.1}
{"i": ["cuda", "schedule_conv3d_nchw_cuda", [[64, 1, 40, 40, 40], [64, 1, 40, 40, 40], [1, 1, 1], [1, 1, 1], [1, 1, 1], 1], {}, ["schedule_conv3d_nchw_cuda", [64, 1, 40, 40, 40], [64, 1, 40, 40, 40], [1, 1, 1], [1, 1, 1], [1, 1, 1], 1], {"i": 2427900721, "t": "", "c": null, "e": [["tile_n", "sp", [-1, 2, 1, 1]], ["tile_f", "sp", [-1, 4, 8, 1]], ["tile_d", "sp", [-1, 1, 3, 1]], ["tile_y", "sp", [-1, 1, 3, 1]], ["tile_x", "sp", [-1, 3, 1, 1]], ["tile_rc", "sp", [-1, 1]], ["tile_rd", "sp", [-1, 1]], ["tile_ry", "sp", [-1, 1]], ["tile_rx", "sp", [-1, 8]], ["auto_unroll_max_step", "ot", 512], ["unroll_explicit", "ot", 1], ["fuse_yx", "ot", 1]]}], "r": [[0.01000235675], 0, 1.2470550537109375, 1577696596.601394], "v": 0.1}
{"i": ["cuda", "schedule_conv3d_nchw_cuda", [[64, 1, 40, 40, 40], [64, 1, 40, 40, 40], [1, 1, 1], [1, 1, 1], [1, 1, 1], 1], {}, ["schedule_conv3d_nchw_cuda", [64, 1, 40, 40, 40], [64, 1, 40, 40, 40], [1, 1, 1], [1, 1, 1], [1, 1, 1], 1], {"i": 2659111729, "t": "", "c": null, "e": [["tile_n", "sp", [-1, 2, 1, 1]], ["tile_f", "sp", [-1, 4, 8, 1]], ["tile_d", "sp", [-1, 1, 3, 1]], ["tile_y", "sp", [-1, 1, 3, 1]], ["tile_x", "sp", [-1, 3, 1, 1]], ["tile_rc", "sp", [-1, 1]], ["tile_rd", "sp", [-1, 1]], ["tile_ry", "sp", [-1, 1]], ["tile_rx", "sp", [-1, 8]], ["auto_unroll_max_step", "ot", 1500], ["unroll_explicit", "ot", 1], ["fuse_yx", "ot", 1]]}], "r": [[0.00992167275], 0, 1.2543034553527832, 1577696597.1971352], "v": 0.1}
{"i": ["cuda", "schedule_conv3d_nchw_cuda", [[64, 1, 40, 40, 40], [64, 1, 40, 40, 40], [1, 1, 1], [1, 1, 1], [1, 1, 1], 1], {}, ["schedule_conv3d_nchw_cuda", [64, 1, 40, 40, 40], [64, 1, 40, 40, 40], [1, 1, 1], [1, 1, 1], [1, 1, 1], 1], {"i": 2456787582, "t": "", "c": null, "e": [["tile_n", "sp", [-1, 1, 8, 1]], ["tile_f", "sp", [-1, 4, 4, 1]], ["tile_d", "sp", [-1, 1, 1, 1]], ["tile_y", "sp", [-1, 1, 3, 1]], ["tile_x", "sp", [-1, 3, 1, 1]], ["tile_rc", "sp", [-1, 1]], ["tile_rd", "sp", [-1, 1]], ["tile_ry", "sp", [-1, 1]], ["tile_rx", "sp", [-1, 10]], ["auto_unroll_max_step", "ot", 512], ["unroll_explicit", "ot", 1], ["fuse_yx", "ot", 1]]}], "r": [[0.00720802], 0, 1.1888048648834229, 1577696597.8314853], "v": 0.1}
{"i": ["cuda", "schedule_conv3d_nchw_cuda", [[64, 1, 40, 40, 40], [64, 1, 40, 40, 40], [1, 1, 1], [1, 1, 1], [1, 1, 1], 1], {}, ["schedule_conv3d_nchw_cuda", [64, 1, 40, 40, 40], [64, 1, 40, 40, 40], [1, 1, 1], [1, 1, 1], [1, 1, 1], 1], {"i": 2687998590, "t": "", "c": null, "e": [["tile_n", "sp", [-1, 1, 8, 1]], ["tile_f", "sp", [-1, 4, 4, 1]], ["tile_d", "sp", [-1, 1, 1, 1]], ["tile_y", "sp", [-1, 1, 3, 1]], ["tile_x", "sp", [-1, 3, 1, 1]], ["tile_rc", "sp", [-1, 1]], ["tile_rd", "sp", [-1, 1]], ["tile_ry", "sp", [-1, 1]], ["tile_rx", "sp", [-1, 10]], ["auto_unroll_max_step", "ot", 1500], ["unroll_explicit", "ot", 1], ["fuse_yx", "ot", 1]]}], "r": [[0.00719138775], 0, 1.080352544784546, 1577696598.3988218], "v": 0.1}
{"i": ["cuda", "schedule_conv3d_nchw_cuda", [[64, 1, 40, 40, 40], [64, 1, 40, 40, 40], [1, 1, 1], [1, 1, 1], [1, 1, 1], 1], {}, ["schedule_conv3d_nchw_cuda", [64, 1, 40, 40, 40], [64, 1, 40, 40, 40], [1, 1, 1], [1, 1, 1], [1, 1, 1], 1], {"i": 1188740166, "t": "", "c": null, "e": [["tile_n", "sp", [-1, 1, 2, 4]], ["tile_f", "sp", [-1, 4, 8, 1]], ["tile_d", "sp", [-1, 1, 1, 1]], ["tile_y", "sp", [-1, 1, 3, 1]], ["tile_x", "sp", [-1, 3, 1, 1]], ["tile_rc", "sp", [-1, 1]], ["tile_rd", "sp", [-1, 1]], ["tile_ry", "sp", [-1, 2]], ["tile_rx", "sp", [-1, 2]], ["auto_unroll_max_step", "ot", 1500], ["unroll_explicit", "ot", 1], ["fuse_yx", "ot", 0]]}], "r": [[0.0129452525], 0, 1.2668616771697998, 1577696599.0895915], "v": 0.1}
{"i": ["cuda", "schedule_conv3d_nchw_cuda", [[64, 1, 40, 40, 40], [64, 1, 40, 40, 40], [1, 1, 1], [1, 1, 1], [1, 1, 1], 1], {}, ["schedule_conv3d_nchw_cuda", [64, 1, 40, 40, 40], [64, 1, 40, 40, 40], [1, 1, 1], [1, 1, 1], [1, 1, 1], 1], {"i": 2456872585, "t": "", "c": null, "e": [["tile_n", "sp", [-1, 1, 4, 1]], ["tile_f", "sp", [-1, 2, 8, 1]], ["tile_d", "sp", [-1, 1, 1, 1]], ["tile_y", "sp", [-1, 3, 1, 1]], ["tile_x", "sp", [-1, 1, 3, 1]], ["tile_rc", "sp", [-1, 1]], ["tile_rd", "sp", [-1, 1]], ["tile_ry", "sp", [-1, 1]], ["tile_rx", "sp", [-1, 10]], ["auto_unroll_max_step", "ot", 512], ["unroll_explicit", "ot", 1], ["fuse_yx", "ot", 1]]}], "r": [[0.00906191875], 0, 1.206125020980835, 1577696599.8104212], "v": 0.1}
{"i": ["cuda", "schedule_conv3d_nchw_cuda", [[64, 1, 40, 40, 40], [64, 1, 40, 40, 40], [1, 1, 1], [1, 1, 1], [1, 1, 1], 1], {}, ["schedule_conv3d_nchw_cuda", [64, 1, 40, 40, 40], [64, 1, 40, 40, 40], [1, 1, 1], [1, 1, 1], [1, 1, 1], 1], {"i": 1188743154, "t": "", "c": null, "e": [["tile_n", "sp", [-1, 1, 8, 1]], ["tile_f", "sp", [-1, 4, 2, 4]], ["tile_d", "sp", [-1, 1, 1, 1]], ["tile_y", "sp", [-1, 1, 3, 1]], ["tile_x", "sp", [-1, 3, 1, 1]], ["tile_rc", "sp", [-1, 1]], ["tile_rd", "sp", [-1, 1]], ["tile_ry", "sp", [-1, 2]], ["tile_rx", "sp", [-1, 2]], ["auto_unroll_max_step", "ot", 1500], ["unroll_explicit", "ot", 1], ["fuse_yx", "ot", 0]]}], "r": [[0.0156789135], 0, 1.359513282775879, 1577696602.7682385], "v": 0.1}
{"i": ["cuda", "schedule_conv3d_nchw_cuda", [[64, 1, 40, 40, 40], [64, 1, 40, 40, 40], [1, 1, 1], [1, 1, 1], [1, 1, 1], 1], {}, ["schedule_conv3d_nchw_cuda", [64, 1, 40, 40, 40], [64, 1, 40, 40, 40], [1, 1, 1], [1, 1, 1], [1, 1, 1], 1], {"i": 2608583641, "t": "", "c": null, "e": [["tile_n", "sp", [-1, 1, 4, 1]], ["tile_f", "sp", [-1, 2, 8, 1]], ["tile_d", "sp", [-1, 3, 1, 1]], ["tile_y", "sp", [-1, 1, 1, 1]], ["tile_x", "sp", [-1, 1, 3, 1]], ["tile_rc", "sp", [-1, 1]], ["tile_rd", "sp", [-1, 1]], ["tile_ry", "sp", [-1, 4]], ["tile_rx", "sp", [-1, 4]], ["auto_unroll_max_step", "ot", 1500], ["unroll_explicit", "ot", 1], ["fuse_yx", "ot", 1]]}], "r": [[0.006299728], 0, 2.2095236778259277, 1577696603.5453477], "v": 0.1}
{"i": ["cuda", "schedule_conv3d_nchw_cuda", [[64, 1, 40, 40, 40], [64, 1, 40, 40, 40], [1, 1, 1], [1, 1, 1], [1, 1, 1], 1], {}, ["schedule_conv3d_nchw_cuda", [64, 1, 40, 40, 40], [64, 1, 40, 40, 40], [1, 1, 1], [1, 1, 1], [1, 1, 1], 1], {"i": 2608414297, "t": "", "c": null, "e": [["tile_n", "sp", [-1, 1, 4, 1]], ["tile_f", "sp", [-1, 2, 8, 1]], ["tile_d", "sp", [-1, 3, 1, 1]], ["tile_y", "sp", [-1, 1, 3, 1]], ["tile_x", "sp", [-1, 1, 1, 1]], ["tile_rc", "sp", [-1, 1]], ["tile_rd", "sp", [-1, 1]], ["tile_ry", "sp", [-1, 4]], ["tile_rx", "sp", [-1, 4]], ["auto_unroll_max_step", "ot", 1500], ["unroll_explicit", "ot", 1], ["fuse_yx", "ot", 1]]}], "r": [[0.00644012025], 0, 2.3287980556488037, 1577696604.336566], "v": 0.1}
{"i": ["cuda", "schedule_conv3d_nchw_cuda", [[64, 1, 40, 40, 40], [64, 1, 40, 40, 40], [1, 1, 1], [1, 1, 1], [1, 1, 1], 1], {}, ["schedule_conv3d_nchw_cuda", [64, 1, 40, 40, 40], [64, 1, 40, 40, 40], [1, 1, 1], [1, 1, 1], [1, 1, 1], 1], {"i": 2377372633, "t": "", "c": null, "e": [["tile_n", "sp", [-1, 1, 4, 1]], ["tile_f", "sp", [-1, 2, 8, 1]], ["tile_d", "sp", [-1, 3, 1, 1]], ["tile_y", "sp", [-1, 1, 1, 1]], ["tile_x", "sp", [-1, 1, 3, 1]], ["tile_rc", "sp", [-1, 1]], ["tile_rd", "sp", [-1, 1]], ["tile_ry", "sp", [-1, 4]], ["tile_rx", "sp", [-1, 4]], ["auto_unroll_max_step", "ot", 512], ["unroll_explicit", "ot", 1], ["fuse_yx", "ot", 1]]}], "r": [[0.006249417], 0, 1.159303903579712, 1577696605.0008526], "v": 0.1}
{"i": ["cuda", "schedule_conv3d_nchw_cuda", [[64, 1, 40, 40, 40], [64, 1, 40, 40, 40], [1, 1, 1], [1, 1, 1], [1, 1, 1], 1], {}, ["schedule_conv3d_nchw_cuda", [64, 1, 40, 40, 40], [64, 1, 40, 40, 40], [1, 1, 1], [1, 1, 1], [1, 1, 1], 1], {"i": 2377203289, "t": "", "c": null, "e": [["tile_n", "sp", [-1, 1, 4, 1]], ["tile_f", "sp", [-1, 2, 8, 1]], ["tile_d", "sp", [-1, 3, 1, 1]], ["tile_y", "sp", [-1, 1, 3, 1]], ["tile_x", "sp", [-1, 1, 1, 1]], ["tile_rc", "sp", [-1, 1]], ["tile_rd", "sp", [-1, 1]], ["tile_ry", "sp", [-1, 4]], ["tile_rx", "sp", [-1, 4]], ["auto_unroll_max_step", "ot", 512], ["unroll_explicit", "ot", 1], ["fuse_yx", "ot", 1]]}], "r": [[0.00598519025], 0, 1.2359890937805176, 1577696605.646444], "v": 0.1}
{"i": ["cuda", "schedule_conv3d_nchw_cuda", [[64, 1, 40, 40, 40], [64, 1, 40, 40, 40], [1, 1, 1], [1, 1, 1], [1, 1, 1], 1], {}, ["schedule_conv3d_nchw_cuda", [64, 1, 40, 40, 40], [64, 1, 40, 40, 40], [1, 1, 1], [1, 1, 1], [1, 1, 1], 1], {"i": 2171386825, "t": "", "c": null, "e": [["tile_n", "sp", [-1, 1, 4, 1]], ["tile_f", "sp", [-1, 2, 8, 1]], ["tile_d", "sp", [-1, 1, 1, 1]], ["tile_y", "sp", [-1, 1, 3, 1]], ["tile_x", "sp", [-1, 3, 1, 1]], ["tile_rc", "sp", [-1, 1]], ["tile_rd", "sp", [-1, 1]], ["tile_ry", "sp", [-1, 2]], ["tile_rx", "sp", [-1, 5]], ["auto_unroll_max_step", "ot", 0], ["unroll_explicit", "ot", 1], ["fuse_yx", "ot", 1]]}], "r": [[0.006884262], 0, 1.094801902770996, 1577696606.3219416], "v": 0.1}
{"i": ["cuda", "schedule_conv3d_nchw_cuda", [[64, 1, 40, 40, 40], [64, 1, 40, 40, 40], [1, 1, 1], [1, 1, 1], [1, 1, 1], 1], {}, ["schedule_conv3d_nchw_cuda", [64, 1, 40, 40, 40], [64, 1, 40, 40, 40], [1, 1, 1], [1, 1, 1], [1, 1, 1], 1], {"i": 722601303, "t": "", "c": null, "e": [["tile_n", "sp", [-1, 1, 4, 2]], ["tile_f", "sp", [-1, 2, 4, 2]], ["tile_d", "sp", [-1, 3, 1, 1]], ["tile_y", "sp", [-1, 1, 3, 1]], ["tile_x", "sp", [-1, 1, 1, 1]], ["tile_rc", "sp", [-1, 1]], ["tile_rd", "sp", [-1, 1]], ["tile_ry", "sp", [-1, 1]], ["tile_rx", "sp", [-1, 2]], ["auto_unroll_max_step", "ot", 0], ["unroll_explicit", "ot", 1], ["fuse_yx", "ot", 0]]}], "r": [[0.021956163], 0, 1.4046435356140137, 1577696607.2426133], "v": 0.1}
{"i": ["cuda", "schedule_conv3d_nchw_cuda", [[64, 1, 40, 40, 40], [64, 1, 40, 40, 40], [1, 1, 1], [1, 1, 1], [1, 1, 1], 1], {}, ["schedule_conv3d_nchw_cuda", [64, 1, 40, 40, 40], [64, 1, 40, 40, 40], [1, 1, 1], [1, 1, 1], [1, 1, 1], 1], {"i": 1940175817, "t": "", "c": null, "e": [["tile_n", "sp", [-1, 1, 4, 1]], ["tile_f", "sp", [-1, 2, 8, 1]], ["tile_d", "sp", [-1, 1, 1, 1]], ["tile_y", "sp", [-1, 1, 3, 1]], ["tile_x", "sp", [-1, 3, 1, 1]], ["tile_rc", "sp", [-1, 1]], ["tile_rd", "sp", [-1, 1]], ["tile_ry", "sp", [-1, 2]], ["tile_rx", "sp", [-1, 5]], ["auto_unroll_max_step", "ot", 1500], ["unroll_explicit", "ot", 0], ["fuse_yx", "ot", 1]]}], "r": [[0.00611777925], 0, 1.7284066677093506, 1577696608.133698], "v": 0.1}
{"i": ["cuda", "schedule_conv3d_nchw_cuda", [[64, 1, 40, 40, 40], [64, 1, 40, 40, 40], [1, 1, 1], [1, 1, 1], [1, 1, 1], 1], {}, ["schedule_conv3d_nchw_cuda", [64, 1, 40, 40, 40], [64, 1, 40, 40, 40], [1, 1, 1], [1, 1, 1], [1, 1, 1], 1], {"i": 2145971192, "t": "", "c": null, "e": [["tile_n", "sp", [-1, 2, 2, 1]], ["tile_f", "sp", [-1, 4, 8, 1]], ["tile_d", "sp", [-1, 1, 3, 1]], ["tile_y", "sp", [-1, 3, 1, 1]], ["tile_x", "sp", [-1, 1, 1, 1]], ["tile_rc", "sp", [-1, 1]], ["tile_rd", "sp", [-1, 1]], ["tile_ry", "sp", [-1, 4]], ["tile_rx", "sp", [-1, 4]], ["auto_unroll_max_step", "ot", 0], ["unroll_explicit", "ot", 1], ["fuse_yx", "ot", 1]]}], "r": [[0.007664697], 0, 1.1424341201782227, 1577696608.7719412], "v": 0.1}
{"i": ["cuda", "schedule_conv3d_nchw_cuda", [[64, 1, 40, 40, 40], [64, 1, 40, 40, 40], [1, 1, 1], [1, 1, 1], [1, 1, 1], 1], {}, ["schedule_conv3d_nchw_cuda", [64, 1, 40, 40, 40], [64, 1, 40, 40, 40], [1, 1, 1], [1, 1, 1], [1, 1, 1], 1], {"i": 1683549176, "t": "", "c": null, "e": [["tile_n", "sp", [-1, 2, 2, 1]], ["tile_f", "sp", [-1, 4, 8, 1]], ["tile_d", "sp", [-1, 1, 3, 1]], ["tile_y", "sp", [-1, 3, 1, 1]], ["tile_x", "sp", [-1, 1, 1, 1]], ["tile_rc", "sp", [-1, 1]], ["tile_rd", "sp", [-1, 1]], ["tile_ry", "sp", [-1, 4]], ["tile_rx", "sp", [-1, 4]], ["auto_unroll_max_step", "ot", 512], ["unroll_explicit", "ot", 0], ["fuse_yx", "ot", 1]]}], "r": [[0.00632215375], 0, 1.249842643737793, 1577696609.4359627], "v": 0.1}
{"i": ["cuda", "schedule_conv3d_nchw_cuda", [[64, 1, 40, 40, 40], [64, 1, 40, 40, 40], [1, 1, 1], [1, 1, 1], [1, 1, 1], 1], {}, ["schedule_conv3d_nchw_cuda", [64, 1, 40, 40, 40], [64, 1, 40, 40, 40], [1, 1, 1], [1, 1, 1], [1, 1, 1], 1], {"i": 2608393123, "t": "", "c": null, "e": [["tile_n", "sp", [-1, 1, 2, 1]], ["tile_f", "sp", [-1, 2, 8, 1]], ["tile_d", "sp", [-1, 1, 3, 1]], ["tile_y", "sp", [-1, 3, 1, 1]], ["tile_x", "sp", [-1, 1, 1, 1]], ["tile_rc", "sp", [-1, 1]], ["tile_rd", "sp", [-1, 1]], ["tile_ry", "sp", [-1, 4]], ["tile_rx", "sp", [-1, 4]], ["auto_unroll_max_step", "ot", 1500], ["unroll_explicit", "ot", 1], ["fuse_yx", "ot", 1]]}], "r": [[0.0089994085], 0, 2.2201831340789795, 1577696610.2507036], "v": 0.1}
{"i": ["cuda", "schedule_conv3d_nchw_cuda", [[64, 1, 40, 40, 40], [64, 1, 40, 40, 40], [1, 1, 1], [1, 1, 1], [1, 1, 1], 1], {}, ["schedule_conv3d_nchw_cuda", [64, 1, 40, 40, 40], [64, 1, 40, 40, 40], [1, 1, 1], [1, 1, 1], [1, 1, 1], 1], {"i": 1192467374, "t": "", "c": null, "e": [["tile_n", "sp", [-1, 2, 4, 1]], ["tile_f", "sp", [-1, 2, 4, 2]], ["tile_d", "sp", [-1, 1, 1, 1]], ["tile_y", "sp", [-1, 1, 3, 1]], ["tile_x", "sp", [-1, 1, 3, 1]], ["tile_rc", "sp", [-1, 1]], ["tile_rd", "sp", [-1, 1]], ["tile_ry", "sp", [-1, 4]], ["tile_rx", "sp", [-1, 2]], ["auto_unroll_max_step", "ot", 1500], ["unroll_explicit", "ot", 1], ["fuse_yx", "ot", 0]]}], "r": [[0.00726026325], 0, 1.7374606132507324, 1577696610.9309583], "v": 0.1}
{"i": ["cuda", "schedule_conv3d_nchw_cuda", [[64, 1, 40, 40, 40], [64, 1, 40, 40, 40], [1, 1, 1], [1, 1, 1], [1, 1, 1], 1], {}, ["schedule_conv3d_nchw_cuda", [64, 1, 40, 40, 40], [64, 1, 40, 40, 40], [1, 1, 1], [1, 1, 1], [1, 1, 1], 1], {"i": 2196689629, "t": "", "c": null, "e": [["tile_n", "sp", [-1, 2, 1, 1]], ["tile_f", "sp", [-1, 2, 8, 1]], ["tile_d", "sp", [-1, 1, 3, 1]], ["tile_y", "sp", [-1, 1, 3, 1]], ["tile_x", "sp", [-1, 3, 1, 1]], ["tile_rc", "sp", [-1, 1]], ["tile_rd", "sp", [-1, 1]], ["tile_ry", "sp", [-1, 1]], ["tile_rx", "sp", [-1, 8]], ["auto_unroll_max_step", "ot", 0], ["unroll_explicit", "ot", 1], ["fuse_yx", "ot", 1]]}], "r": [[0.0132884545], 0, 1.0511384010314941, 1577696613.6486368], "v": 0.1}
{"i": ["cuda", "schedule_conv3d_nchw_cuda", [[64, 1, 40, 40, 40], [64, 1, 40, 40, 40], [1, 1, 1], [1, 1, 1], [1, 1, 1], 1], {}, ["schedule_conv3d_nchw_cuda", [64, 1, 40, 40, 40], [64, 1, 40, 40, 40], [1, 1, 1], [1, 1, 1], [1, 1, 1], 1], {"i": 2348536513, "t": "", "c": null, "e": [["tile_n", "sp", [-1, 2, 1, 1]], ["tile_f", "sp", [-1, 2, 4, 2]], ["tile_d", "sp", [-1, 1, 3, 1]], ["tile_y", "sp", [-1, 1, 3, 1]], ["tile_x", "sp", [-1, 1, 3, 1]], ["tile_rc", "sp", [-1, 1]], ["tile_rd", "sp", [-1, 1]], ["tile_ry", "sp", [-1, 4]], ["tile_rx", "sp", [-1, 2]], ["auto_unroll_max_step", "ot", 512], ["unroll_explicit", "ot", 1], ["fuse_yx", "ot", 1]]}], "r": [[0.007116738], 0, 1.2161030769348145, 1577696614.3670354], "v": 0.1}
